id,firstname,lastname,faction,position,date, url,speech
"1060662","Enrico","Komning","AfD","Member of Parliament","2021-05-06T00:00:00.000Z","https://dip21.bundestag.de/dip21/btp/19/19227.pdf","\n\nFrau Präsidentin! Meine Damen und Herren Kollegen! Sehr geehrte Frau Staatssekretärin! Zu später Stunde hier am Abend: Die Bundesregierung hat die Wirtschaft derzeit in einem Würgegriff, der seinesgleichen sucht. Die langfristigen Auswirkungen der Coronamaßnahmen sind noch in keiner Weise absehbar.\n\n({0})\n\nDie kurzfristigen sehen wir aber schon überall.\n\nDie LEAG – immerhin zweitgrößter deutscher Stromerzeuger – plant für dieses Jahr, Mitarbeiter im Braunkohletagebau zum wiederholten Male in Kurzarbeit zu schicken. Grund sei der niedrige Stromverbrauch wegen des Corona-Lockdowns. Insgesamt 2,5 Millionen Menschen in Deutschland sind momentan in Kurzarbeit – von den 500 000 zusätzlichen Arbeitslosen seit einem Jahr gar nicht zu sprechen.\n\nSie von der Bundesregierung lassen sich von diesen Zahlen schon lange nicht mehr beeindrucken, geschweige denn erweichen. Sie von der Bundesregierung haben die Perspektivlosigkeit dieser Menschen zu verantworten.\n\nUnd nun dieser Gesetzentwurf! Gleich in der Problemstellung machen Sie deutlich: Durch stillstehende Unternehmen – ich zitiere – „drohen erhebliche wirtschaftliche Schäden (auch mit Folgen für die Arbeitnehmer wie z. B. Kurzarbeit) …“ – Tja, wer hätte das gedacht?!\n\nDa müsse man ja nun was tun, und das machen Sie auch. Sie planen den Abbau bürokratischer Hürden und eine Rechtswegverkürzung in Bezug auf die Genehmigung der Wiedernutzbarmachung von Tagebaustätten für Anlagen zur Produktion von Energie aus erneuerbaren Quellen; Frau Staatssekretärin, Sie haben darauf hingewiesen.\n\nEs ist ein Begleitgesetz zu Ihrem Kohleausstiegsvorhaben. Es soll sicherstellen, dass Sie Ihren Kohleausstieg auch tatsächlich bis 2038 hinbekommen. Mit anderen Worten: Wenn es um Ihre Klimaideologie geht, funktionieren auf einmal die erstaunlichsten Dinge: Bürokratieabbau und Rechtswegverkürzung sollen im Hinblick auf den Kohleausstieg stattfinden können. – Dem Mittelstand hingegen wird jeder bürokratische Knüppel zwischen die Beine geworfen, den man nur finden kann.\n\n({1})\n\nDamit wir nicht missverstanden werden: Bürokratieabbau ist ja grundsätzlich gut. Auch die nun bestehende Rechtssicherheit durch die klare Definition von Lithium als bergfreiem Bodenschatz schafft Planungssicherheit für Investoren. Bezogen auf die Rechtswegverkürzung muss man sich allerdings die Frage stellen, ob dies nicht zu einer zu starken Belastung der nun erstinstanzlich zuständigen Oberverwaltungsgerichte führt.\n\nInsgesamt lehnen wir den Ausstieg aus der Kohleverstromung aber ab. Sie gefährden damit nämlich die Energiesicherheit Deutschlands, bürden den Menschen die höchsten Energiekosten der Welt auf, nehmen strukturelle Verelendungen ganzer Regionen in Kauf und haben am Ende, wie schon im Ruhrgebiet, kein Konzept für den dann anstehenden Strukturwandel. Dem Klima wird es am Ende egal sein.\n\n({2})\n\nWir von der Bundesregierung – –\n\n({3})\n\n– Tja, noch nicht! – Wir von der AfD-Bundestagsfraktion würden uns von der Bundesregierung ein ähnlich großes Entbürokratisierungsengagement wünschen, wenn es um die Rettung des deutschen Mittelstandes und der sozialen Marktwirtschaft geht. Darauf werden wir wohl noch lange warten können.\n\nVielen Dank.\n\n({4})"
"1060671","Christian","Wirth","AfD","Member of Parliament","2021-05-06T00:00:00.000Z","https://dip21.bundestag.de/dip21/btp/19/19227.pdf","\n\nFrau Präsidentin! Werte Kollegen! Es gibt ja lustige Sachen. Eine lustige Sache ist heute Abend dieser Gesetzentwurf. Wir wollten eigentlich – bis gestern – über einen Gesetzentwurf zur Einführung eines elektronischen Identitätsnachweises mit mobilen Endgeräten reden. Heute reden wir plötzlich über einen Gesetzentwurf zur Erprobung von Verfahren eines Registerzensus und zur Änderung statistikrechtlicher Vorschriften. Wir wollten also über etwas ganz anderes reden, und plötzlich reden wir über Statistik. Gut, gar kein Problem.\n\nWir haben lange über den Zensus geredet – über die letzten Jahre – und festgestellt, dass die Regierung eigentlich viel verschlafen hat. Plötzlich soll es – im Gegensatz zu gestern – um den Zensus-Gesetzentwurf gehen, weil die EU plötzlich möchte, dass wir sehr schnell und jedes Jahr sehr viele solcher Daten weitergeben. Deshalb reden wir plötzlich heute Abend über einen Gesetzentwurf, der gestern gar nicht vorgesehen war. Da muss ich sagen, –\n\n({0})\n\n– überhaupt kein Problem –, ich wundere mich einfach, wie sich hier das Verfahren ändert.\n\n({1})\n\nGestern noch sollten wir über ein anderes Verfahren reden, heute reden wir über diesen Gesetzentwurf. Ich muss sagen: Nein, wir werden diesem Gesetzentwurf nicht zustimmen, weil es einfach so ist\n\n({2})\n\n– ja, Junge, ist gut! – Wir werden einem Gesetzentwurf nicht zustimmen, wo die EU heute sagt, wir müssen jedes Jahr Daten übertragen. Was soll das? Wir wollten gestern über ein anderes Gesetz reden. Heute reden über wir dieses. Meine lieben Damen und Herren, wir lehnen diesen Gesetzentwurf ab.\n\nVielen Dank.\n\n({3})"
"1060675","Jens","Maier","AfD","Member of Parliament","2021-05-07T00:00:00.000Z","https://dip21.bundestag.de/dip21/btp/19/19228.pdf","\n\nSehr geehrter Herr Präsident! Meine Damen und Herren! Dieser Gesetzentwurf stellt einen weiteren Schritt dar in Richtung Totalüberwachung der Gesellschaft. Was hier als angebliche Reaktion auf die aktuellen Ereignisse im Bereich des Rechtsterrorismus verkauft wird, ist der Vorwand dafür, auf einfachere Weise als bisher Einzelpersonen gezielt in den Blick zu nehmen. Das heißt auf Deutsch: Jedermann kann jetzt jenseits der Strafverfolgung auf einfachere Weise in die Überwachung durch den Verfassungsschutz gelangen.\n\nWenn denn der Verfassungsschutz wenigstens das wäre, was er in seinem Namen vorgibt zu sein: eine Behörde, die die Verfassung, das heißt die freiheitlich-demokratische Grundordnung, schützt. Bis zum würdelosen Abgang von Hans-Georg Maaßen wird man das im Großen und Ganzen sogar noch bejahen können. Mittlerweile ist der Verfassungsschutz aber zu einem reinen Regierungsschutz heruntergekommen. Seine Tätigkeit besteht unter anderem darin, Oppositionspolitiker auszuspähen, Oppositionsparteien zu denunzieren und im Zusammenspiel mit den Medien Diffamierungskampagnen zu unterstützen.\n\n({0})\n\nDabei werden auch Kriterien, die das Gesetz nicht vorsieht, erfunden, wie zum Beispiel die Erklärung einer Partei als Prüffall. Bei seinem ersten Auftritt als neuer Präsident des Bundesamtes hat Herr Haldenwang, der oberste Verfassungsschützer, doch gezeigt, wie er es mit der deutschen Rechtsordnung hält: legal, illegal, völlig egal – Hauptsache, der Dienstherr ist zufrieden, Herr Seehofer. Das Verwaltungsgericht Köln musste damals eingreifen und auf Antrag der AfD Herrn Haldenwang und den Seinen wegen dieser Rechtsverletzungen einen Maulkorb verpassen. Es zeigt sich, dass der Verfassungsschutz eben nicht neutral und unabhängig operiert, sondern in das Ressort des Bundesinnenministeriums eingegliedert ist und offenbar zu liefern bereit ist, was man sich dort wünscht, Herr Seehofer.\n\n({1})\n\nWenn man ein über 1 000 Seiten langes Gutachten anfertigen muss, um eine Partei zu einem Verdachtsfall abstempeln zu können, dann – das muss ich als ehemaliger Richter sagen –\n\n({2})\n\nspricht eine Vermutung dafür, dass an dem Verdacht nicht viel dran ist; sonst bedürfte es dieses Umfangs nicht.\n\nSeitdem Herr Haldenwang das Bundesamt leitet, ist die Maske gefallen. Der Verfassungsschutz hat seine Legitimation, sein Ansehen eingebüßt und das in ihn gesetzte Vertrauen verspielt. Er ist zu einem Unterdrückungsinstrument verkommen.\n\n({3})\n\nAm Umgang mit den Querdenkern kann man das besonders deutlich erkennen.\n\n({4})\n\nDer Verfassungsschutz ist dabei, sich Schritt für Schritt in eine Richtung zu entwickeln, die wir in Deutschland, vor allem aber in der ehemaligen DDR schon mal hatten. Darum sagen wir von der AfD: Es bedarf einer grundlegenden Reform des Verfassungsschutzes und seiner Reduzierung auf eng begrenzte Kernaufgaben. Es muss Schluss damit sein, dass sich der Verfassungsschutz politisch inszeniert. Es muss Schluss damit sein, dass der Verfassungsschutz das in ihn gesetzte Vertrauen missbraucht und aus Gründen politischer Gefälligkeit den Ruf anständiger Leute zerstört oder gefährdet.\n\n({5})\n\nSolange die Dinge so sind, wie sie sind, kann man einem Gesetzentwurf wie diesen, der weitere Befugnisse für den Verfassungsschutz vorsieht, nicht befürworten.\n\n({6})\n\nDas erlaubte Auslesen von Messengerdiensten über die sogenannte Quellen-TKÜ bedeutet für den Bürger, der Whatsapp oder Ähnliches nutzt, dass nun der Verfassungsschutz mitlesen kann und bestenfalls auch darf. Die Telekommunikationsanbieter müssen sogar dafür sorgen, dass die Dienste ihre Überwachungsgeräte direkt neben ihren Servern anschließen können.\n\nDabei ist die Grenze hin zur Onlinedurchsuchung von Smartphones und Computern fließend. Denn in der geplanten Änderung des § 11 des Artikel‑10-Gesetzes ist vorgesehen, dass nicht nur die laufende Kommunikation überwacht und aufgezeichnet wird, sondern auch die Inhalte der Kommunikation, die ab dem Zeitpunkt der Anordnung hätten aufgezeichnet werden können, aber nicht aufgezeichnet worden sind. Das ist nichts anderes als ein Auslesen von Nachrichten, die in der Vergangenheit liegen, aber gespeichert worden sind. Das ist im Ergebnis nicht nur eine Quellen-TKÜ, sondern bereits eine Onlinedurchsuchung. Das halten wir für unverhältnismäßig. Daher lehnen wir es ab. Im Ausschuss wird hier noch einiges zu diskutieren sein.\n\nVielen Dank.\n\n({7})"
"1060694","Wilhelm","Gottberg","AfD","Member of Parliament","2021-05-07T00:00:00.000Z","https://dip21.bundestag.de/dip21/btp/19/19228.pdf","\n\nHerr Präsident! Herr Minister Seehofer! Meine Damen und Herren! Wir wollen hier und heute den vorgelegten Bericht zur Stadtentwicklung erörtern. Der Bericht ist ein Konvolut von 156 Seiten. Er ist eine Fleißarbeit. Aber wie soll ein derartig umfangreicher Bericht in wenigen Minuten Redezeit, die der Opposition zur Verfügung stehen, sachgerecht bewertet werden? Wir praktizieren hier parlamentarisches Alltagsgeschehen in eingefahrenen Gleisen. Eine verantwortungsbewusste Arbeit der Legislative geht anders, meine Damen und Herren.\n\n({0})\n\nDer Bericht enthält wesentliche Fakten und wissenswerte Informationen, aber auch Unwesentliches und Überflüssiges; was dem Bericht einen unnötigen Umfang gibt. Beispiele: Das Abkürzungsverzeichnis umfasst drei Seiten. Der Bericht enthält überdurchschnittlich viele Abbildungs- und Kartenverzeichnisse. Was soll beispielsweise ein Schaubild über die Antragsbestätigung für das Baukindergeld im Bericht?\n\nWichtig und überraschend ist andererseits die Aussage im Bericht, dass die Bundesregierung Projekte der nachhaltigen Stadtentwicklung im sogenannten Globalen Süden mit mehr als 22 Milliarden Euro fördert. Das ist bemerkenswert.\n\nDie künftigen Vorgaben für die Stadtentwicklung in der EU sind in der Neuen Leipzig-Charta formuliert. Diese Charta wurde am 30. November von den zuständigen Ressortchefs der EU fortgeschrieben. Es ist zumindest zu hinterfragen, ob eine Stadtentwicklung in den ländlichen Regionen Nord- und Südeuropas nicht andere Schwerpunkte zu setzen hat, als dies im hochverdichteten Industriestaat Deutschland der Fall ist.\n\nIm Bericht auf Seite 148 heißt es in Bezug auf die Stadtentwicklung, dass sich die Rahmenbedingungen sowie die stadtpolitischen Herausforderungen seit 2007 deutlich gewandelt haben. Stichworte dazu: Klimawandel, Digitalisierung, demografischer Wandel, Globalisierung und verstärkte soziale Disparitäten. – Richtig, aber es ist eine jahrhundertealte menschliche Erfahrung: Alles ist ständig im Fluss. Zukunft ist nach vorne immer offen.\n\nZur Wahrheit gehört auch, dass die Politik der vergangenen Jahre einen Großteil der sogenannten Probleme selbst verschuldet hat.\n\n({1})\n\nEinige dieser Entwicklungen wurden bereits im Stadtentwicklungsbericht 2008 angestoßen, Stichworte: Klimaschutz, Energiesparen und – besonders wichtig – Flächenreduzierung. Der Bericht lässt viele Fragen offen.\n\nPolitik hat den Menschen und dem allgemeinen Wohl zu dienen. Die Bedürfnisse der Menschen sind zeitlos. Sie sind 2021 nicht anders als 2007 oder 1920. Dazu gehören vorrangig eine angemessene Wohnung bzw. angemessene Mieten auf dem Wohnungsmarkt. Ebenso bedeutsam ist der Wunsch, Wohneigentum zu erwerben; die vielen Hunderttausend Häuslebauer belegen dies. Sie haben jahrzehntelang Konsumverzicht geübt, um sich ein eigenes Haus oder eine eigene Wohnung anzuschaffen. Eigentum gewährt ein Stück weit Unabhängigkeit und Freiheit.\n\nStadtentwicklung muss zum Ziel haben, den Menschen ein bezahlbares Angebot zum Erwerb von Wohneigentum zu machen. Neben anderen wichtigen Indikatoren muss Wohnen oberste Priorität bei der Stadtentwicklung haben. Wohnen ist ein Grundrecht. Wohnen ist Zu-Hause-Sein – das reicht vom Eigentum bis zum Mietobjekt. Weite Kreise der Bevölkerung streben auf ihre Weise danach.\n\nSchlussbemerkung. Eine den Menschen dienende Stadtentwicklung muss sich auch von der Warnung des großen Ökonomen Wilhelm Röpke leiten lassen – Zitat –: Der Aufbau des Sozialstaates bewirkt den Verlust des Freiheitsankers Privateigentum.\n\nDanke.\n\n({2})"
"1060712","Martin Erwin","Renner","AfD","Member of Parliament","2021-05-07T00:00:00.000Z","https://dip21.bundestag.de/dip21/btp/19/19228.pdf","\n\nGrüß Gott, Herr Präsident! Nur noch drei verbleibende Plenarwochen – nicht mehr so ganz viel Zeit –, also hat die FDP-Fraktion Themenschnipsel und sonstiges Liegengebliebenes zusammengefegt und mit schön klingenden Titeln in inhaltsleere Anträge gepresst.\n\n({0})\n\nWir folgen hier der Beschlussempfehlung aller befassten Ausschüsse. In erster Linie will ich mich mit dem Antrag der Grünen beschäftigen, nämlich „Non-Profit-Journalismus als gemeinnützig anerkennen“. Hinter diesem sehr schönen und unschuldig daherkommenden Titel lugt schon die Fratze der grünen Ideologie;\n\n({1})\n\nes schlägt einem der Atem des Zerrbildes einer grün geprägten Gesellschaft entgegen: Hass auf Leistung, Hass auf Gewinne durch Leistung, Hass auf die Marktwirtschaft.\n\nIhr Grünen – da Sie es offenbar nicht verstanden haben, helfe ich Ihnen gerne weiter –, wir haben doch schon einen Non-Profit-Journalismus, der heißt nur anders, nämlich öffentlich-rechtlicher Rundfunk, für den man als Bürger jährlich bereits 8 Milliarden Euro abpresst und bezahlen muss, weil er ja angeblich gemeinwohlorientiert sein soll und sein muss.\n\nDoch das reicht den Grünen offensichtlich noch nicht. Die ohnehin schon sehr weitgehende ideologische Gleichschaltung unserer Medien geht Ihnen nicht schnell genug voran. Die mit Steuergeldern des Bundes und der Länder latent geförderte ökosozialistische Dominanz in Kultur und Medien ist Ihnen noch nicht genug. Der von Ihnen betriebene und entfachte Kulturkampf in unserer Gesellschaft lodert Ihnen noch nicht hoch genug. Sie beklagen aufgrund der geltenden Rechtslage ein fehlendes finanzielles Engagement gemeinnütziger Stiftungen für Journalismus. Ich sehe jetzt schon, wie die ehemalige Stasi-IM „Victoria“ als Chefredakteur zukünftig massenhaft neomarxistische Ideologiepamphlete vorbereitet und verbreitet,\n\n({2})\n\nund dies dann als Ersatz für sinkende Auflagen im Pressewesen.\n\nSie beklagen, dass ausgerechnet der Verein Correctiv nur über seine nebenbei betriebene Bildungsarbeit den Gemeinnützigkeitsstatus erhält. Verflixt, man muss also auch noch arbeiten und kann sich nicht ausschließlich seiner eigenen Berufung widmen, so als sozialistische Gesinnungs- und Zensurbehörde mit Anspruch auf Allwissen und einzig erlaubte Sichtweisen.\n\nUnd schaut man dann in die Fußnoten Ihrer Antragsdokumentation, dann sieht man radikal-linke Köpfe dort: zum Beispiel Correctiv-, Attac- und Grüne-Jugend-Mitbegründer mit bestem Draht zum Campact-Verein. Übrigens: Sowohl Campact wie auch Attac wurde die Gemeinnützigkeit erst kürzlich entzogen. Dann folgte lautes, wütendes Kommunistengeheul, und jetzt ist das wieder umstritten.\n\n({3})\n\nEs geht in Ihrem Antrag nicht um Gemeinnützigkeit. Es geht nicht um eine angeblich weitere Stütze in unserer Demokratie. Es geht Ihnen hier ausschließlich um Meinungshoheit und um Deutungsdominanz in Medien, Presse und Internet.\n\n({4})\n\nEs geht Ihnen um die kulturelle Hegemonie, so ganz nach den Anweisungen des Erzkommunisten Antonio Gramsci aus dem letzten Jahrhundert,\n\n({5})\n\nder Ihnen genau vorgibt, wie diese kulturelle Hegemonie zur Durchsetzung der marxistischen Philosophie in das Alltagsbewusstsein der Bürgerlichen hineingekämpft werden kann.\n\nEs geht Ihnen also um die Befeuerung Ihres ökosozialistischen, neomarxistischen Kulturkampfes.\n\n({6})\n\nAber Marxismus und Kommunismus haben auf dieser Welt weiß Gott schon mehr als genug Menschenleben gekostet. Wir sind angetreten und berufen, um Sie daran zu hindern. Und wir werden siegen. Venceremos!\n\n({7})"
"1060732","Albrecht","Glaser","AfD","Member of Parliament","2021-05-07T00:00:00.000Z","https://dip21.bundestag.de/dip21/btp/19/19228.pdf","\n\nDas, meine sehr verehrten Damen und Herren, ist das Gegenteil von dem, was heute eigentlich Gegenstand der Diskussion sein sollte.\n\n({0})"
"1060730","Albrecht","Glaser","AfD","Member of Parliament","2021-05-07T00:00:00.000Z","https://dip21.bundestag.de/dip21/btp/19/19228.pdf","\n\nHerr Präsident! Meine Damen und Herren! Mit ihrem Antrag wollen die Grünen einen sogenannten Non-Profit-Journalismus als gemeinnützig steuerlich subventionieren. Beklagt wird ein „Marktversagen“ hinsichtlich der „medialen Versorgung“ der Bevölkerung. Meine Damen und Herren, das könnte vielleicht auch das Relotius-Syndrom sein.\n\n({0})\n\nDer gemeinnützige, von steuerbegünstigten Spenden durch Karussellfinanzierung unterhaltene Non-Profit-Journalismus hat inzwischen in Deutschland eine große Szene, aus deren Lobbykonzeptpapier der Grünenantrag im Wesentlichen abgeschrieben worden ist.\n\n({1})\n\nDie tonangebende gemeinnützige Aktiengesellschaft PHINEO schleuste im letzten Berichtsjahr 24 Millionen Euro an steuerbegünstigten Spenden in ein breites Umfeld anderer steuerbegünstigter Einrichtungen. Sie tut dies in dem Verständnis – ich zitiere –, dass „der Journalismus … um seine orientierungsgebende Funktion in der Gesellschaft“ ringt, in Wahrheit also wohl eher um eine manipulative Vormundschaftsanmaßung, meine Damen und Herren.\n\n({2})\n\nRingkämpfer auf diesem Feld ist unter anderem das Forum Gemeinnütziger Journalismus, dem die taz Panter Stiftung, die Augstein Stiftung, Belltower.News, Queer.de und Ähnliche angehören. Diesem Forum gehört auch die bekannte gemeinnützige Correctiv gGmbH an – bekannt auch deshalb, weil sie – wie etwa auch die dpa – im Auftrag des großen Mittelständlers Facebook gut bezahlte Netzkontrolle betreibt, um Regierungszensurvorgaben umzusetzen.\n\n({3})\n\nDer Geschäftsführer, der die Geschäftsidee „gemeinnütziger Journalismus“ erfunden hat, hatte 2015 ein gemeinnütziges Jahresgehalt von über 110 000 Euro. Die Zuwendungen an Correctiv kommen überwiegend aus der SPD-nahen Brost-Stiftung, die eng mit der Friedrich-Ebert-Stiftung kooperiert. Unter dem Etikett der Volksbildung wurde die Correctiv gGmbH als gemeinnützig anerkannt – nicht für ihren Journalismus. Ob es eine Betriebsprüfung der Steuerverwaltung je gegeben hat, um zu schauen, was tatsächlich unter dieser gGmbH passiert, ist nicht bekannt.\n\nDie Entscheidung eines Finanzamtes, dem Netzwerk Attac die Gemeinnützigkeit zu entziehen, wurde im Januar 2019 vom Bundesfinanzhof bestätigt. Seither findet ein Hauen und Stechen um den steuerlichen Status der Gemeinnützigkeit statt, der nach Rechtslage nur Körperschaften zugutekommen soll, die ausschließlich und unmittelbar gemeinnützige, mildtätige oder kirchliche Zwecke verfolgen.\n\nLinken politischen Gesinnungsjournalismus unter Gemeinnützigkeit subsummieren zu wollen, meine Damen und Herren, ist unlauterer Wettbewerb im Vergleich zu ehrlichem Journalismus, der um seine entgeltlichen Kunden werben muss.\n\n({4})\n\nDiesem Irrwitz setzt die Krone auf – ich komme zum Ende, Herr Präsident –, dass die Grünen dem linksradikalen Forum Gemeinnützigkeit Journalismus per Spenden-Siegel die Entscheidungsgewalt übertragen wollen, in welchen Fällen die Finanzverwaltung die Gemeinnützigkeit anerkennen soll und in welchen nicht."
"1060750","Udo Theodor","Hemmelgarn","AfD","Member of Parliament","2021-05-07T00:00:00.000Z","https://dip21.bundestag.de/dip21/btp/19/19228.pdf","\n\nSehr geehrter Herr Präsident! Sehr geehrte Kolleginnen und Kollegen! Wenn wir heute über das Baulandmobilisierungsgesetz sprechen, muss man eines vorwegschicken: Es handelt sich wieder einmal um einen Etikettenschwindel dieser Regierung. Dieses Gesetz mobilisiert eines nicht: Bauland! Es verschärft die bestehende Krise des Wohnungsmarktes weiter.\n\nDieser Gesetzentwurf ist handwerklich schlecht gemacht und präsentiert das gesamte Sammelsurium an Maßnahmen, die kaum etwas bringen, den Bürger aber erheblich beeinträchtigen.\n\n({0})\n\nDie Bürger werden auf der Grundlage ausgesprochen schwammiger Formulierungen in ihren Rechten massiv beschränkt. Es wird Rechtsunsicherheit geschaffen, wo klare und sinnvolle Regelungen notwendig wären. Die Sachverständigen haben diesen Befund weitgehend bestätigt. Wie üblich, hört diese Bundesregierung nur auf die Stimmen, die in ihr Weltbild passen.\n\nWelche Ideen finden sich im Einzelnen in diesem Gesetzentwurf? Da ist zunächst einmal der sektorale Bebauungsplan. Hier werden neben den bestehenden Vorgaben für Bebauungspläne zusätzliche Anforderungen formuliert. Anstelle einer Deregulierung, die immer wieder gefordert wird, werden weitere Voraussetzungen geschaffen. Es ist klar, dass schnelleres Bauen so nicht erreicht werden kann.\n\n({1})\n\nUnd es ist illusorisch, anzunehmen, dass man auf diese Art und Weise den Mangel an Wohnraum bekämpfen kann.\n\n({2})\n\nEin weiteres Highlight des Entwurfs ist die Stärkung des gemeindlichen Vorkaufsrechts. Es kann jetzt auch bei wenig oder unbebauten Grundstücken ausgeübt werden, und auch die Frist zur Ausübung verlängert sich von zwei auf drei Monate. Für alle Beteiligten, insbesondere auch für die Mieter, bedeutet das eine längere Phase der Unsicherheit und des Stillstands. Man muss jetzt nicht nur auf das Grundbuchamt warten, sondern auch noch auf die Gemeinde. Von Beschleunigung der Prozesse keine Spur!\n\nWeshalb man es den Gemeinden nicht zumuten kann, das Vorkaufsrecht innerhalb von zwei Monaten auszuüben, und wie dadurch Bauland mobilisiert werden soll, ist das Geheimnis der Verfasser dieses Gesetzentwurfs. Im Ergebnis lädt die Stadt wieder einmal Verantwortung und mögliche Kosten beim Bürger ab.\n\nEin weiteres wesentliches Element des Gesetzes betrifft die Umwandlung von Miet- in Eigentumswohnungen, teilweise auch kurz „Umwandlungsverbot“ genannt. Mit der Neuregelung des § 250 Baugesetzbuch entscheidet sich die Bundesregierung gegen die Bildung und Förderung von Wohneigentum. Nur am Rande möchte ich darauf hinweisen, dass Deutschland schon jetzt die zweitniedrigste Quote an Wohneigentum innerhalb der OECD aufweist und das Medianvermögen der deutschen Haushalte unter dem von Spanien, Italien und sogar unter dem von Griechenland liegt.\n\nWir wissen, dass von Links-Rot-Grün jetzt das Argument kommen wird, dass sich die meisten Mieter einen Kauf ihrer Wohnung überhaupt nicht leisten können. Das ist leider richtig. Sie können das nicht, weil die Mittelschicht und die unteren Einkommensgruppen durch die Politik des links-grünen Mainstreams seit über 20 Jahren an Einkommen und Vermögen verloren haben. Es ist aus unserer Sicht zynisch, wenn die gleichen Akteure jetzt auf diesen Umstand verweisen, um die Eigentumsbildung und damit den Aufbau von Vermögen zu erschweren. Wahrscheinlich will diese Regierung dem Bürger die Lust auf Wohneigentum vor dem „Great Reset“ noch so richtig vermiesen.\n\nZusammenfassend kann man also sagen: Die Bundesregierung will die Probleme mit mehr Bürokratie, mit mehr Staat und weniger Privateigentum lösen. Erwartet da noch irgendjemand etwas Gutes? Nachdem man jetzt mehr als ein Jahr von Lockdown zu Lockdown gestolpert ist und nach einem halben Jahr des fast kompletten Impfversagens sollte jedem klar sein, was das für Folgen haben wird.\n\nSehr geehrte Damen und Herren, das Erschreckende daran ist, dass die Union nicht einmal im Ansatz erkennt, wie weit sie den Weg sozialistischer Irrlehren schon mitgegangen ist. Mit dieser Vorlage zur Baulandmobilisierung versuchen Sie, Probleme zu lösen, die Sie selbst geschaffen haben.\n\n({3})\n\nUnd selbst das können Sie nicht. Sie schaffen das eben nicht.\n\n({4})\n\nDie Änderungsanträge der FDP sind sicherlich gut gemeint. Am wesentlichen Inhalt und am Geist dieses Gesetzes können aber auch diese nichts ändern.\n\nVielen Dank.\n\n({5})"
