id,firstname,lastname,faction,position,date, url,speech
"1074261","Robert","Farle","AfD","Member of Parliament","2022-06-23T00:00:00.000Z","https://dip21.bundestag.de/dip21/btp/20/20044.pdf","\n\nIch bedanke mich für Ihre geschätzte Aufmerksamkeit und sage Ihnen: Beschließen Sie was Sinnvolles, und das ist die Senkung der Lebensmittelpreise.\n\nVielen Dank.\n\n({0})"
"1074285","Stephan","Brandner","AfD","Member of Parliament","2022-06-23T00:00:00.000Z","https://dip21.bundestag.de/dip21/btp/20/20044.pdf","\n\nWir haben mit unserem Wahlvorschlag Malte Kaufmann zur Wahl eines Stellvertreters der Präsidentin aufgestellt. Im Vorfeld hatten wir am 30. Mai entsprechend § 2 Absatz 2 Satz 2 der Geschäftsordnung des Deutschen Bundestages, der da lautet: „Ergibt sich im ersten Wahlgang keine Mehrheit, so können für einen zweiten Wahlgang neue Bewerber vorgeschlagen werden“, versucht, einen anderen Wahlvorschlag einzureichen. Das hat die Verwaltung am 1. Juni zurückgewiesen. Deshalb beantrage ich gemäß der Geschäftsordnung, dass wir weitere Vorschläge machen dürfen und würde dazu gerne das Wort erteilt bekommen."
"1074292","Sebastian","Münzenmaier","AfD","Member of Parliament","2022-06-23T00:00:00.000Z","https://dip21.bundestag.de/dip21/btp/20/20044.pdf","\n\nSehr geehrte Frau Präsidentin! Meine Damen und Herren! „15 Grad im Winter hält man mit Pullover aus. Daran stirbt niemand.“ Sie, meine Damen und Herren von der CDU/CSU, haben diese Aktuelle Stunde aufgesetzt, und Sie, Herr Spahn, haben darüber geredet, dass im Winter niemand frieren müssen soll. Aber dieses Eingangszitat, dieses unsägliche Eingangszitat, ist von Ihrem CDU-Landwirtschaftsminister in Baden-Württemberg, Peter Hauk. Sie sollten sich schämen.\n\n({0})\n\nWer hier große Reden schwingt und dann in Interviews die eigene Arroganz und Überheblichkeit durchscheinen lässt, der zeigt eines: Ihnen geht es eben nicht um die Bürger dieses Landes, Ihnen geht es um reine Symbolpolitik.\n\nDiese Aktuelle Stunde der Unionsfraktion zeigt doch symptomatisch ein Grundproblem der deutschen Politik der vergangenen Jahre, das Sie alle, also von der CDU bis hin zur Ampel, gemeinsam zu verantworten haben. Ideologisch verblendet haben Sie in nahezu allen wichtigen Politikbereichen notwendige Substanz abgebaut, die nicht mehr ersetzt wurde. Und wenn dann Krisenzeiten kommen, wird dieses Problem schonungslos offengelegt.\n\nBeispiel eins. Ein Krieg in Europa bricht aus, und ganz plötzlich fällt Ihnen allen auf, dass die Bundeswehr über Jahre vernachlässigt wurde und nicht mal unser eigenes Land verteidigen könnte.\n\nBeispiel zwei. Als Corona über uns kommt, wird Ihnen vom einen auf den anderen Moment bewusst, dass Sie das ganze Gesundheitssystem kaputtgespart haben.\n\nUnd jetzt Beispiel drei. Nun werden die Energievorräte zum Winter hin knapp, und ganz plötzlich fällt den Altparteien auf, dass Deutschland in ideologischer Verblendung in der Energiepolitik aufs falsche Pferd gesetzt hat und die Versorgungssicherheit unseres Landes gefährdet ist.\n\n({1})\n\nSchon vor dem Angriff Putins auf die Ukraine lag die Preissteigerung bei Erdgas bei 32 Prozent, bei Heizöl waren es sogar 52 Prozent. Schon 2019 mussten laut Zahlen des Statistischen Bundesamtes 2 Millionen Menschen in Deutschland, darunter insbesondere Alleinerziehende mit ihren Kindern, frieren, weil sie sich die Heizkosten nicht mehr leisten konnten. Der drohende Kältewinter und diese enormen Preisexplosionen fallen also nicht vom Himmel, sondern sind die Folge Ihrer verfehlten Energiepolitik, meine Damen und Herren.\n\n({2})\n\nAber ich bin ja froh – ich versuche immer, das Positive zu sehen –, dass die Unionsfraktion und auch Bundesfinanzminister Lindner jetzt in der Krise offensichtlich panisch nach Lösungen suchen und deshalb in unser AfD-Wahlprogramm reingeschaut haben. Denn ganz plötzlich – wir haben es gerade eben hier vom Pult auch von Herrn Spahn gehört – werden die Rufe nach einer Kernforderung unserer Bürgerpartei laut: Wir brauchen eine Rückkehr zur sicheren und sauberen Kernenergie, um Versorgungssicherheit und vor allem bezahlbare Energie zu gewährleisten, meine Damen und Herren.\n\n({3})\n\nWas wir schon jahrelang predigen, fordert nun also auch die Unionsfraktion im Deutschen Bundestag. Wieder mal zeigt sich: Wir als AfD haben die besseren Ideen für Deutschland, und wir wirken, meine Damen und Herren.\n\n({4})\n\nIn puncto Themensetzung haben Sie sich jetzt ja also schon erfolgreich bei uns bedient. Das ist in Ordnung; aber jetzt kommt der entscheidende Punkt: Wort und Tat sollten bei guten Politikern übereinstimmen, meine Damen und Herren. Und wie sieht es bei der CDU aus? Stimmen da Worte mit Taten überein? Lieber Herr Spahn, Sie haben gerade gefordert, wir müssten wieder zurück zur Kernenergie. Leider – erinnere ich mich vielleicht falsch? – war es doch so, dass Sie, von den Grünen getrieben, 2011 dafür gesorgt haben, dass Deutschland völlig überstürzt aus der Kernenergie aussteigt. Und war es nicht so, dass Sie sogar noch im April 2022, also vor wenigen Wochen, hier im Ausschuss für Klimaschutz und Energie zusammen mit den Vertretern der Ampelparteien unseren AfD-Antrag zur Laufzeitverlängerung der Kernkraftwerke einstimmig abgelehnt haben? Entweder leiden Sie also an Demenz, oder Sie versuchen hier böswillig, unsere Bürger da draußen für blöd zu verkaufen.\n\n({5})\n\nWas davon schlimmer ist, kann ich Ihnen nicht sagen, aber eines bleibt klar: Die CDU/CSU ist sicher keine Alternative zur Ampelpolitik, sondern ein konservativ lackierter Wurmfortsatz rot-grüner Politik, meine Damen und Herren. Und ganz im Gegensatz zu Ihnen stehen wir als AfD zu unserem Wort und haben die Kernenergie als Baustein eines breiten Energiemixes schon in unserem Grundsatzprogramm fest verankert, als Sie noch mit Ihren grünen Freunden vom nächsten Windpark geträumt haben.\n\nAber unsere Bürger brauchen jetzt dringend eine sichere und vor allem eine bezahlbare Energieversorgung, damit sie im Winter nicht frieren müssen.\n\n({6})\n\nDeswegen sehen wir mal über die Vergangenheit hinweg. Und wenn Union und FDP hier jetzt unserer Meinung sind, bieten wir gerne unsere Unterstützung an. Eine Mehrheit wäre ja da, meine Damen und Herren.\n\n({7})\n\nAlso hören Sie auf, zu reden, und handeln Sie endlich! Verlängern Sie die Laufzeit der verbliebenen Kernkraftwerke! Investieren Sie endlich in Forschung und Weiterentwicklung, sodass langfristig auch neue Werke gebaut werden können! Und entlasten Sie unsere Bürger durch Steuersenkungen, zum Beispiel im Bereich der CO2-Steuer! Sorgen Sie also dafür, dass das Geld unserer fleißigen Bürger hier in Deutschland bleibt und nicht überall auf der Welt verschleudert wird! Werden Sie endlich Ihrer Verantwortung gerecht! Denn in diesem Winter soll kein Deutscher frieren müssen.\n\nIch danke Ihnen für Ihre Aufmerksamkeit.\n\n({8})"
"1074320","Stefan","Keuter","AfD","Member of Parliament","2022-06-23T00:00:00.000Z","https://dip21.bundestag.de/dip21/btp/20/20044.pdf","\n\nFrau Präsidentin! Meine sehr geehrten Damen und Herren! Liebe Zuschauer! Vor einigen Wochen hat die AfD-Bundestagsfraktion hier einen Antrag auf Einrichtung eines Untersuchungsausschusses eingebracht, der die politischen, militärischen, zivilen Engagements in Afghanistan aufarbeiten sollte, und zwar über den gesamten Zeitraum des Einsatzes. Unser Antrag ist abgelehnt worden. Sie hatten einen eigenen Antrag angekündigt. Der liegt uns jetzt vor. Wie erwartet, befasst dieser sich nur mit der Evakuierung und nicht mit den Entscheidungen, die zur Katastrophe in Afghanistan geführt haben. Die Pseudoopposition Union zeichnet hier mit. Das Afghanistan-Desaster vereint Sie im selben Boot. Man möchte auch sagen: Eine Krähe hackt der anderen kein Auge aus.\n\n({0})\n\nUnd was für ein Desaster das war: 59 deutsche Soldaten haben ihr Leben gelassen, drei Bundespolizisten, 64 000 afghanische Sicherheitskräfte, 43 000 afghanische Zivilisten, 42 000 regierungsfeindliche Kämpfer, Millionen von Afghanen waren zur Flucht gezwungen, und die totale Destabilisierung eines Kulturraums war die Folge. Wenn ich mir Ihren Antrag anschaue, stelle ich fest, dass bereits auf der ersten Seite „deutsche Friedensmission in Afghanistan“ steht. Das, meine Damen und Herren, ist blanker Hohn.\n\n({1})\n\nEine Gesamtaufklärung ist dringend nötig. Jeder Bürger weiß, dass Afghanistan ein Desaster war. Es muss um Aufarbeitung gehen, und nicht nur um den katastrophalen Abzug. Eine oberflächliche Enquete-Kommission reicht hier nicht aus. Ich darf unsere Außenministerin Annalena Baerbock zitieren, die der SPD im August letzten Jahres sagte – Zitat –:\n\nBei dem einen kann man Zeugen … laden und die Bereitstellung von Akten beantragen, bei dem anderen werden Schlussfolgerungen für die Zukunft getroffen. Wie sollen wir denn Schlussfolgerungen für die Zukunft treffen, wenn wir nicht bereit sind, über Fehler der Vergangenheit zu reden?\n\nDamit hat unsere Außenministerin recht. Aber sie macht einen weiteren Fehler; auch sie will den Untersuchungszeitraum nur auf den Abzug beschränken. Der ausschlaggebende Zeitpunkt für dieses Desaster ist nicht im Herbst 2021, sondern 20 Jahre davor, im Jahr 2001 zu suchen, als die rot-grüne Bundesregierung den Amerikanern in den Krieg folgte.\n\n({2})\n\nEine weitere interessante Frage, die zu klären wäre, ist: Warum setzte die GroKo den Einsatz fort, selbst als im Jahr 2010 die Niederländer abzogen, zwei Jahre später unsere französischen Partner. Deutschland hätte sich wie die Niederlande und Frankreich für nationale Interessen einsetzen müssen. Stattdessen erzählte man sich im Berliner Elfenbeinturm zwei Jahrzehnte lang Märchen und behandelte unsere deutschen Soldaten wie Luft – eine selbstreferenzielle Blase, welche die eigenen Werte auf die außenpolitische Lage projiziert. Wenige Wochen vor der desaströsen Evakuierung verkündete der damalige SPD-Außenminister Heiko Maas, eine westlich geprägte afghanische Zivilgesellschaft würde den Taliban standhalten und es gebe kein Zurück in das Jahr 2001. Welch Hybris! Eine reine Realitätsverweigerung!\n\n({3})\n\nWir täten gut daran, mit anderen Nationen in einen respektvollen Dialog zu treten, ohne westliche Chauvinismen zu transportieren. Ihre sogenannte wertebasierte Außenpolitik wurde am 27. August letzten Jahres widerlegt. Afghanistan ist das mahnende Symbol für das Scheitern des Nationbuilding. Und es ist krachend gescheitert. Daran hat sich Deutschland beteiligt, und es ist bitter notwendig, auch aus Respekt vor den gefallenen deutschen Landsleuten, eine komplette Aufarbeitung herbeizuführen. Die Altparteienregierungen sind dafür verantwortlich. Es muss aufgezeigt werden, welche Fehler hier 20 Jahre lang gemacht worden sind; da kann man sich nicht darauf zurückziehen, das seien zu viele Akten. Genau das aber ist mit Ihrem Antrag nicht möglich, und ich sage Ihnen: Es ist von Ihnen auch gar nicht gewollt, weil Sie dafür die Verantwortung tragen.\n\n({4})\n\nDas ist wirklich schandhaft. Schämen Sie sich!\n\n({5})"
"1074343","Enrico","Komning","AfD","Member of Parliament","2022-06-23T00:00:00.000Z","https://dip21.bundestag.de/dip21/btp/20/20044.pdf","\n\nSehr geehrte Frau Präsidentin! Meine Damen und Herren Kollegen! Liebe Bürger auf den Tribünen! Herr Staatsminister, Sie waren als Ostbeauftragter eigentlich die Hoffnung der neuen Bundesregierung. Was Sie hier heute vorgetragen haben, lässt mich doch sehr stark daran zweifeln. Sie haben hier ein großes Lob für die CDU, ein großes Lob für die Vorgängerregierung formuliert. Wahrscheinlich können Sie nicht anders; Sie gehörten ja vormals selbst zur Regierung. Von 20 Jahren Umbruchs- und Forschungsarbeit im Osten kann ich aber wirklich nicht viel erkennen.\n\nHerr Müller, Sie haben den BDI zitiert, Sie sprachen von einem Krisenmodus. Ja, einen Krisenmodus gibt es tatsächlich. BDI-Präsident Russwurm sagte unlängst zum Tag der Industrie hier in Berlin: „Es brennt lichterloh.“ Meine Damen und Herren, das liegt nicht allein am trockenen Sommerwetter oder am Ukrainekrieg, sondern, Herr Staatsminister, an der Politik der Bundesregierung der letzten 17 Jahre.\n\n({0})\n\nZu leiden hat darunter insbesondere die Wirtschaft im Osten unseres Vaterlandes. In meinem Wahlkreis im östlichen und südlichen Mecklenburg-Vorpommern sind in den Jahren der Mitregierung der CDU in Bund und Land unzählige Unternehmen pleitegegangen; Einwohner sind weggezogen, Straßen sind maroder und die Menschen ärmer geworden.\n\nUnd da kommen jetzt Sie, liebe Kollegen von der Union, mit diesem Antrag daher. Dieser Antrag ist wie so viele andere Anträge in den letzten Monaten ein scheinoppositionelles Feigenblatt, das Sie sich vor die Scham Ihres Versagens als Regierungspartei hängen.\n\n({1})\n\nIhr Hoffen auf Tesla in allen Ehren; aber Tesla hat schon Stellenstreichungen angekündigt, bevor es in Grünheide so richtig losging. Ihr Antrag jedenfalls – ich weiß nicht, aus welcher grünen Schublade Sie den geholt haben – wird daran nichts ändern. Im Gegenteil, liebe Union: Mehr Windräder sind eben nicht die Antwort auf die Energie- und Wirtschaftskrise. Der Ausbau der erneuerbaren Energien auf Kosten von Kern- und Kohlekraft hat uns doch erst in die gegebene Gasabhängigkeit getrieben.\n\n({2})\n\nSolar- und Windenergie sind nicht grundlastfähig. Kapieren Sie das endlich, und hören Sie auf, den Menschen etwas vorzumachen!\n\n({3})\n\nWirtschaftliche Stärke geht auch und vor allem in Ostdeutschland nur mit einem starken Mittelstand, und dessen Rahmenbedingungen, meine Damen und Herren, sind miserabel. Allein die Bürokratiebelastungen – im Vergleich zu großen Konzernunternehmen – sind der Wahnsinn. Und in Brüssel macht man munter weiter mit immer neuen Nachhaltigkeitsberichtspflichten. Ostdeutschland wird aber nur mit einem starken Mittelstand innovativ und leistungsstark werden.\n\n({4})\n\nWir brauchen einen Gleichklang aus einer Politik des radikalen Bürokratieabbaus, der Energiesicherheit – mit Kohle- und Kernkraft –, einen Gleichklang aus Ausbildungs- und Forschungsschwerpunkten und eine Infrastrukturoffensive, analog und digital.\n\nUnd wir brauchen einen kräftigen Anschub, um den Exodus der jungen Familien und Menschen aus den ländlichen Regionen aufzuhalten. Warum denken Sie nicht wenigstens mal kurz über Sonderwirtschaftszonen nach? Das habe ich seit Beginn der letzten Legislaturperiode hier immer wieder vorgeschlagen, vor allem nach Ihrer versenkten Regierungskommission „Gleichwertige Lebensverhältnisse“, die Sie vor vier Jahren eingerichtet hatten und die für den Osten gar nichts gebracht hat. Wir brauchen Sonderwirtschaftszonen wie in Italien oder in Polen; die beiden Länder machen es doch vor.\n\nMeine Damen und Herren von der Union, Ihr Antrag ist unehrlich, er ist ein Wendehalsbeweis für Ihre Fraktion und nicht geeignet, im Osten unseres Landes irgendetwas zu verbessern."
"1074345","Enrico","Komning","AfD","Member of Parliament","2022-06-23T00:00:00.000Z","https://dip21.bundestag.de/dip21/btp/20/20044.pdf","\n\nDaher werden wir Ihren Antrag ablehnen, ebenso wie den sozialistischen Unsinn der Linken.\n\nVielen Dank.\n\n({0})"
"1074370","Hannes","Gnauck","AfD","Member of Parliament","2022-06-23T00:00:00.000Z","https://dip21.bundestag.de/dip21/btp/20/20044.pdf","\n\nFrau Präsidentin! Meine Damen und Herren! Der Bundestag entscheidet über die Fortsetzung der Beteiligung bewaffneter deutscher Streitkräfte an der United Nations Interim Force in Lebanon, kurz UNIFIL, und das zu einer Zeit, da über die militärische Kampffähigkeit und Rüstungsausgaben fast täglich medial berichtet wird und die Bundeswehr vermutlich so stark wie nie zuvor im politischen Diskurs stattfindet. Das ist ein Novum und, wie wir alle wissen, eine unmittelbare Folge und Konsequenz des Krieges in der Ukraine. Daran war natürlich 2006, zum Zeitpunkt der Resolution des Sicherheitsrates der Vereinten Nationen, noch gar nicht zu denken. Aber wir leben nun mal in einer anderen Zeit. Dementsprechend sind Auslandseinsätze mit der Bestrebung abzuwägen, unsere Streitkräfte auszurüsten und einen Rückstand von mindestens vier Jahrzehnten aufzuholen.\n\nWie bei vielen Auslandseinsätzen der Bundeswehr bleibt auch bei diesem Mandat der Beleg einer tatsächlichen Wirksamkeit aus. In diesem Fall betrifft dies vor allem die Verhinderung von Waffenschmuggel. Ursprünglich stellte Deutschland sechs Schiffe und um die 700 Soldaten für die Leitung der Maritime Task Force im Rahmen des Mandats. Nun sind bloß noch 68 deutsche Soldaten vor Ort. Meine Damen und Herren, es wäre doch weitaus sinnvoller, die deutsche Beteiligung an UNIFIL zu beenden. Holen wir endlich die noch verbliebenen Kameraden nach Hause!\n\n({0})\n\nDiese Heimkehr wäre doch auch gar kein Ausdruck des Scheiterns; denn die Bedingungen dafür sind doch erfolgreich geschaffen worden. Die libanesische Marine ist in der Lage, selbst auszubilden. Das geht auf die hervorragende Leistung unserer Männer und Frauen in Uniform zurück.\n\nNun ist es aber an der Zeit, die eigene Ausbildung wieder in den Fokus zu nehmen und unsere Marine in Verteidigungsfähigkeit zu versetzen.\n\n({1})\n\nUnd das, meine Damen und Herren, erfolgt in heimischen Gefilden und nicht in fremden Gewässern. Man gewinnt ja bei Ihren Reden in dieser Debatte teils den Eindruck, als seien Auslandseinsätze grundsätzlich ein Geschenk und ein Gefallen für die Soldaten wie eine nette Urlaubsreise und Extrataschengeld. Auch das, meine Damen und Herren, ist ein Produkt Ihrer verzerrten Darstellung unserer Streitkräfte als international ausgerichtetem Arbeitgeber und nicht als das, was unsere Bundeswehr wirklich ist, nämlich eine professionelle nationale Verteidigungsarmee.\n\n({2})\n\nMeine Damen und Herren, Sie würden als politische Verantwortungsträger den Soldaten tatsächlich einen Gefallen tun, wenn diese sich endlich wieder dem Auftrag widmen können, für welchen sie sich mal verpflichtet haben, nämlich der verfassungsgeregelten Kernaufgabe der Bundeswehr, also der nationalen Landesverteidigung hier vor Ort in Deutschland. Für unsere Marine bedeutet dies vor allem, die Ostsee im Blick zu haben und nicht die levantinische Küste im Mittelmeer. Wir haben hier ganz andere Prioritäten zu setzen und Herausforderungen zu bewältigen. An fragwürdige NATO-Mandate ist dabei gar nicht mehr zu denken.\n\nDie Verteidigungsfähigkeit der Bundeswehr wiederherzustellen, ist eine gigantische, wohl generationenübergreifende Aufgabe.\n\n({3})\n\nDie wiederkehrenden Phrasen von der Zeitenwende sind zwar medial präsent, doch die Handlungen seitens der Regierung zeigen, dass der notwendige Wille eben nicht vorhanden ist. Sonst würde man auch unsere Marine ganz anders einsetzen, und man würde hier und heute mit solchen Einsätzen ganz anders umgehen als noch 2006. Andere Bündnispartner sind gut aufgestellt. Somit ist es endlich an der Zeit, dass wir uns ebenfalls wieder gut aufstellen. Das, meine Damen und Herren, muss jetzt absolute Priorität haben.\n\nDie AfD-Fraktion lehnt deshalb eine Fortsetzung der Beteiligung Deutschlands an UNIFIL ab. Wir benötigen jedes Schiff und jeden Soldaten genau hier, in Deutschland.\n\nVielen Dank.\n\n({4})"
"1074391","Götz","Frömming","AfD","Member of Parliament","2022-06-23T00:00:00.000Z","https://dip21.bundestag.de/dip21/btp/20/20044.pdf","\n\nFrau Präsidentin! Sehr geehrte Damen und Herren! Die letzte Rednerin erzählt uns, was Sie noch alles vorhaben.\n\n({0})\n\nIhr Vorredner hat dann natürlich auch zurückschauend sich selbst loben müssen, was nicht alles schon damals getan wurde. Aber, meine Damen und Herren, die Realität ist eine andere, und es ist eine bittere.\n\nIm Jahr 2020 verfügten nach den Daten des neuen Mikrozensus in Deutschland bei den jungen Menschen zwischen 20 und 34 Jahren 15,5 Prozent, hochgerechnet etwa 2,33 Millionen, über keinen Berufsabschluss. Gleichzeitig teilt uns der Zentralverband des Deutschen Handwerks mit: Rund eine Viertelmillion Menschen könnten sofort bei uns anfangen. – Und im ländlichen Raum wird eine Berufsschule nach der anderen geschlossen, mit fatalen Folgen. Meine Damen und Herren, was läuft da eigentlich schief?\n\nWir teilen – vielleicht wird Sie das freuen, Herr Albani – Ihre Analyse in weiten Teilen und können auch etliche Ihrer Empfehlungen mittragen, weil Sie uns in weiten Teilen an das erinnern, was wir schon in der letzten Legislaturperiode zur beruflichen Bildung hier vorgetragen und gefordert haben. Damals haben Sie das natürlich alles noch zusammen mit Ihrem früheren Koalitionspartner abgelehnt.\n\nZum Antrag der Linken nur ganz kurz: Die Analyse ist auch überwiegend richtig. Aber Ihre Lösungsvorschläge gehen für uns zumindest dann zu sehr in eine planwirtschaftliche Richtung, die wir natürlich nicht mittragen können.\n\nAllerdings, meine Damen und Herren, es wirkt schon kurios, wenn die CDU/CSU in ihrem Antrag nun ganz richtig erkennt, dass die Bologna-Reform, die ja dazu geführt hat, dass noch mehr junge Menschen an die Universitäten streben und dort nicht nur den Bachelor, sondern auch den Master anstreben, auch mitursächlich ist für den Niedergang der beruflichen Bildung.\n\n({1})\n\nDas ist richtig, meine Damen und Herren. Aber man fragt sich dann schon: Warum haben Sie denn diese Bologna-Reform die ganze Zeit mitgetragen? Also hier sind doch dringend Reformen notwendig.\n\n({2})\n\nMeine Damen und Herren, der rosa Elefant ist doch ein ganz anderer, und über den müssen wir heute ja auch mal sprechen. Es ist doch so: Weil inzwischen ganz viele Abitur haben – in den Großstädten ist es schon mehr als die Hälfte –, glaubt auch jeder, er müsse studieren und könne alles werden. Das, meine Damen und Herren, ist aber letztlich nichts anderes als eine Lüge und Heuchelei. Es kann eben nicht jeder alles werden.\n\nEs ist ein bisschen so wie im Sport: Wenn man jemandem, der vielleicht kurze Beine hat, sagt: „Du kannst den Marathon gewinnen“, ja, dann wird er das vielleicht eine Weile glauben, aber er wird scheitern. Und das Gleiche machen Sie im Bildungsbereich: Sie versprechen jungen Menschen das Blaue vom Himmel, tun so, als seien alle gleich, und das führt dazu, dass junge Menschen sich mitunter jahrelang quälen, weil es niemanden mehr gibt, um sie frühzeitig richtig zu beraten.\n\n({3})\n\nMeine Damen und Herren, wenn heutzutage ein Lehrer beispielsweise den Kindern sagt: „Für dich ist das Gymnasium nicht der richtige Weg“, was passiert denn dann? Er hat schon am nächsten Tag ein Gespräch beim Direktor, oder die Eltern stehen mit dem Anwalt vor der Tür. Da, meine Damen und Herren, liegt das eigentliche Problem. Hier müssen wir dringend umsteuern. Wir brauchen den Mut zur Wahrheit. Wir müssen unser dreigliedriges Schulsystem wieder stärken. Denn das ist die Kehrseite des Handwerkermangels: dass wir schlichtweg zu viele Akademiker haben, meine Damen und Herren.\n\n({4})\n\nIch komme zum Schluss. Es gibt natürlich noch einen weiteren Grund, den Sie hier auch berücksichtigen müssen. Das ist die Fehlsteuerung in der Zuwanderung. Wir sehen leider, dass der Großteil der jungen Menschen mit Migrationshintergrund es immer noch viel, viel schwerer hat, in einem Beruf zu landen. Auch darüber müssen wir mal sprechen, meine Damen und Herren. Es ist ein weiterer rosa Elefant, der im Raum steht. Haben Sie den Mut, mit uns mal darüber zu reden!\n\nIch danke Ihnen.\n\n({5})"
"1074408","Marc","Jongen","AfD","Member of Parliament","2022-06-23T00:00:00.000Z","https://dip21.bundestag.de/dip21/btp/20/20044.pdf","\n\nFrau Präsidentin! Meine Damen und Herren! Ein „neuer Gedenkort für deutsche Gräueltaten“ soll also errichtet werden – so nannte „Spiegel Online“ in schöner Direktheit das geplante Dokumentationszentrum „Zweiter Weltkrieg und deutsche Besatzungsherrschaft in Europa“.\n\nIch schicke voraus: Auch die AfD-Fraktion weicht nicht von der einzig möglichen Meinung ab, die man als informierter und vernünftiger Mensch von den historischen Vorgängen haben kann. Das nationalsozialistische Regime mit seiner aggressiven Rassenideologie und der von Hitler hemmungslos eingesetzten Kriegsmaschinerie hat unsägliches Leid über Europa gebracht und insbesondere mit der Shoah ein Verbrechen von historischer Monstrosität begangen, auf das die Antwort nur lauten kann: Nie wieder!\n\n({0})\n\nNun haben wir das Denkmal für die ermordeten Juden Europas, wir haben die Topographie des Terrors, wir haben die KZ-Gedenkstätten, das Programm „Jugend erinnert“ und vieles mehr. All das hat aber nicht verhindert, dass auf der Documenta in Kassel – der Kunstausstellung mit weltweiter Ausstrahlung, unter Mitverantwortung von Kulturstaatsministerin Claudia Roth – vor wenigen Tagen ein riesiges Banner einer indonesischen Künstler- oder Aktivistengruppe zu sehen war, das widerwärtige antisemitische Karikaturen nach Art des „Stürmers“ enthielt, wirklich Hass und Hetze schlimmster Art – um die Begriffe zu verwenden, mit denen Sie sonst immer so schnell zur Hand sind."
"1074410","Marc","Jongen","AfD","Member of Parliament","2022-06-23T00:00:00.000Z","https://dip21.bundestag.de/dip21/btp/20/20044.pdf","\n\nNicht."
