id,firstname,lastname,faction,position,date, url,speech
"1061425","Sebastian","Münzenmaier","AfD","Member of Parliament","2021-05-20T00:00:00.000Z","https://dip21.bundestag.de/dip21/btp/19/19230.pdf","\n\nSehr geehrter Herr Präsident! Meine Damen und Herren!\n\nWenn nicht Meinung gegen Meinung offen gesagt wird, lässt sich die bessere nicht herausfinden.\n\nDiese Worte stammen vom griechischen Geschichtsschreiber Herodot und spiegeln perfekt wider, was in der Diskussionskultur in Deutschland leider immer mehr abhandenkommt.\n\nAm vergangenen Wochenende hat die Veröffentlichung eines Papieres namhafter Mediziner und Wissenschaftler um Professor Dr. Schrappe für einen Aufschrei in Zeitungen und sozialen Medien gesorgt. Die Aussagen von Professor Dr. Schrappe und seinen Kollegen wiegen dabei schwer. Die Forscher kommen anhand der Betrachtungen zu dem zentralen Ergebnis, dass die Angst vor knappen Intensivkapazitäten in Deutschland während der Coronakrise übertrieben gewesen sei. Die Bundesregierung um Kanzlerin Angela Merkel rechtfertigte aber massive Grund- und Freiheitseinschränkungen über Monate mit der Gefahr überlasteter Intensivstationen. Eine Bestätigung der Beobachtungen Schrappes würde also den harten Einschränkungen der Grund- und Freiheitsrechte nachträglich die Grundlage entziehen.\n\n({0})\n\nDaher sind es die Ergebnisse der Stellungnahme wert, aufgeklärt und aufgearbeitet zu werden. Ja, natürlich ist richtig, dass das Autorenteam inzwischen eine aktualisierte Fassung vorgelegt und einige Korrekturen vorgenommen hat. Auch wenn einige Zahlen und Schlussfolgerungen immer noch umstritten sind, bleibt die zentrale Grundaussage des Teams die gleiche, meine Damen und Herren.\n\nIch möchte an dieser Stelle ausdrücklich betonen, dass es uns als AfD-Fraktion eben nicht darum geht, die Belastungen der Pfleger und Ärzte in Deutschland zu relativieren, die in der Coronazeit für Gesundheit und Leben ihrer Patienten gekämpft haben.\n\n({1})\n\n– Wenn Sie zuhören würden, würden Sie etwas lernen.\n\n({2})\n\nDas tun wir eben nicht. Aber Sie müssen erst mal zuhören.\n\n({3})\n\nDie Pfleger und Ärzte haben von der Regierung nur warme Worte und ein bisschen Applaus bekommen. Das Aufklären einer undurchsichtigen Faktenlage ist nicht gleichbedeutend mit einer Kritik am medizinischen Personal, auch wenn im öffentlichen Diskurs versucht wird, das so zu verkaufen, und der eine oder andere das immer noch nicht verstanden hat.\n\nAls AfD-Fraktion fordern wir eine transparente Aufarbeitung der Erkenntnisse, die auf schwerwiegende Politikfehler in einer der größten Krisen unserer Bundesrepublik hinweisen. Der Verdacht Professor Schrappes und anderer, dass einige Kliniken aus finanziellen Interessen plötzlich den Aufbau von Intensivbetten meldeten und 50 000 Euro pro neu geschaffenem Bett erhielten, während die Betten höchstwahrscheinlich noch in Folie eingepackt im Keller schlummerten, wird auch von anderen Experten mehrfach erwähnt und beispielsweise durch eine „Spiegel“-Recherche aus dem niedersächsischen Seesen erhärtet.\n\n({4})\n\nInsgesamt flossen im vergangenen Jahr mehr als 9 Milliarden Euro an die Kliniken, größtenteils nach dem Gießkannenprinzip. Diese Zahlungen müssen transparent, sachlich und ohne Schaum vor dem Mund – nicht wahr, Herr Kollege Ulrich – aufgearbeitet werden; denn es kann nicht sein, dass Steuerzahlergeld für freigehaltene Betten ausgegeben wurde, wenn diese Betten nicht existieren oder nicht zum Einsatz kommen konnten.\n\n({5})\n\nUnzweifelhaft korrekt ist auch die Erkenntnis der Wissenschaftler, dass die Bundesregierung nach ungefähr anderthalb Jahren der Coronamaßnahmen immer noch keine Übersicht hat, wie viele Pfleger überhaupt auf den Intensivstationen arbeiten. Hier hätte eine verantwortungsvolle Regierung frühzeitig Zahlen erfasst und dafür gesorgt, dass mögliche Engpässe nicht durch das Ausschütten von Geldern für Fantasiebetten, sondern durch Programme zur Rückgewinnung von Pflegekräften aus dem Ruhestand oder zur Qualifikation von Pflegern aus anderen Bereichen gelöst werden.\n\n({6})\n\nAber statt diese Ergebnisse zu diskutieren und eigene Fehler in Überlegungen einzubeziehen, wurde auch dieses Mal wieder der Wissenschaftler zum „Schwurbler“ und der Mediziner zum „Alu-Hut“. Diese Scheuklappenpolitik muss endlich ein Ende haben. Ergebnisoffener Austausch bedeutet immer auch eine Bereicherung für unsere Demokratie meine Damen und Herren.\n\n({7})\n\nWir als AfD-Fraktion fordern seit einiger Zeit einen Corona-Untersuchungsausschuss, um das Handeln der Bundesregierung während der Coronakrise auszuwerten. Die getroffenen Maßnahmen müssen auf Evidenz und Verhältnismäßigkeit geprüft und die bisher völlig außer Acht gelassenen Kollateralschäden der Lockdown-Politik müssen endlich wahrgenommen werden.\n\n({8})\n\nEin beispielloses Versagen bei der Maskenbeschaffung, eine sich wie Kaugummi ziehende Auszahlung von dringend benötigten Coronahilfen, unverhältnismäßige, teilweise rechtswidrige Maßnahmen wie die 15-Kilometer-Leine oder die Ausgangssperre und ein völliges Desaster bei der Impfstoffbestellung – all das muss endlich aufgeklärt werden!\n\nWir als AfD-Fraktion werden auch in Zukunft als aufmerksame und kritische Stimme hier im Deutschen Bundestag, die ihren Auftrag der Regierungskontrolle ernst nimmt, auffallen. Denn nur wenn Meinung gegen Meinung endlich wieder ergebnisoffen diskutiert wird und nicht abgewertet wird durch Begriffe wie „Schwurbler“ oder „Verschwörungstheoretiker“, kann die beste Lösung für unser Land gefunden werden. Und nur dann wird Deutschland wieder normal.\n\nIch danke Ihnen für ihre Aufmerksamkeit.\n\n({9})"
"1061444","Detlev","Spangenberg","AfD","Member of Parliament","2021-05-20T00:00:00.000Z","https://dip21.bundestag.de/dip21/btp/19/19230.pdf","\n\nHerr Präsident! Sehr geehrte Damen und Herren! Eines der wichtigsten Argumente für die einschneidenden Maßnahmen gegenüber der Bevölkerung in der Coronaproblematik ist und war die Überlastung des Gesundheitssystems, hierbei insbesondere die drohende Knappheit der Intensivbetten. Sie wurde mit panikauslösenden Bildern aus anderen Ländern geschürt und durch die Überlegung des BMI befördert, direkt Schreckensbilder zu produzieren – dies allein, um Akzeptanz und Gefügigkeit bei der Bevölkerung für die einschneidenden Maßnahmen zu erreichen.\n\nDie Kritik an den Schreckensmeldungen der Regierung mit ihren grün-linken Unterstützern begleitet diese Maßnahmen immer noch, meine Damen und Herren. Auf Expertenmeinungen, die den offiziellen Verlautbarungen der Regierung widersprechen, wird und wurde grundsätzlich polemisch reagiert. Da konnten die Experten durchaus anerkannte wissenschaftliche Persönlichkeiten mit akademischen Graden, akademischen Titeln und Funktionen sein; es nützte ihnen gar nichts, meine Damen und Herren. Quasi über Nacht werden sie zu Unpersonen stigmatisiert.\n\n({0})\n\nSo auch die zahlreichen hochkarätigen Autoren der aktuellen dritten Ad-hoc-Stellungnahme „Zur intensivmedizinischen Versorgung in der SARS-2/CoViD-19-Epidemie“, auf die ich mich hier vorwiegend beziehe. Ein großer Faktor bei der Begründung mit fehlenden Intensivbetten war ja der Faktor Angst, mit dem aus unserer Sicht in unverantwortlicher Weise Politik betrieben wird. Eine nahezu gleichbleibende Anzahl von Intensivbetten ist mit 20 000 Betten seit Frühjahr 2020 festzustellen. Seit April 2020 wurde die Gesamtbettenzahl nach einer kurzen Zeit der gleichbleibenden Anzahl immer weiter verringert. Die Anzahl der Coronabettenbelegung schwankte bei gleichbleibender Gesamtintensivbettenbelegung. Das ist einfach die Tatsache.\n\nAlso die Frage: Wie ist es möglich, dass bei unterschiedlichen Wellen, Krankheitsverläufen und Inzidenzwerten keine Schwankung im Intensivpflegebereich zu verzeichnen ist? Die angebliche Gefahr der Überlastung der Intensivstationen war offensichtlich nie gegeben, hat aber zur Verängstigung geführt, die noch heute zu den nicht erfassten Kollateralschäden geführt hat und führen wird, meine Damen und Herren. Dies ist gerade im Bereich von Herz-Kreislauf- und Krebspatienten besonders zu sehen.\n\nDie Kritik an der Erfassung der Coronapatienten ist ebenfalls konkret. Doppelzählungen sind festzustellen, etwa durch die Verlegung und Einweisung von Patienten in den Intensivpflegebereich, die Nichtcoronapatienten sind. Dies führt ebenfalls zu völlig ungenauen Daten. Trotzdem werden die einschneidenden Maßnahmen gegenüber der Bevölkerung durchgeführt und durchgesetzt. Die Frage ist hierbei: Ist das nun Absicht oder Unfähigkeit, meine Damen und Herren?\n\nDas Intensivregister ist keine zuverlässige Quelle, um sichere Schlüsse zu ziehen. Die Zahlen werden eben nicht in einer Weise erhoben, dass sie die tatsächliche Situation widerspiegeln. Die DIVI erklärt sogar selbst, dass Mehrfachzählungen von Patienten durch Verlegungen vorkommen können. Wie stark sich das auswirkt, ist nicht bekannt; man kann nur vage Schätzungen abgeben. Laut AOK-Angaben werden etwa 11 Prozent aller Patienten einmal verlegt, bei beatmeten Patienten sind es sogar über 30 Prozent. Dass die DIVI um konkrete Meldungen bittet, bedeutet, dass die DIVI selbst um die Schwachstellen weiß.\n\nAuch die häufig wiederholte Feststellung, die intensivmedizinisch behandelten Coronapatienten würden immer jünger, hält einer Überprüfung nicht stand. Die Statistiken geben diese Behauptung ebenfalls nicht her.\n\n({1})\n\nSehr bedenklich ist auch die Diskussion um die Möglichkeit der sogenannten Triage-Entscheidung in den Kliniken. Frau Dittmar, Sie haben das nicht ganz richtig ausgeführt. Es ging nicht darum, ob ein Herzpatient zugunsten eines Coronapatienten ausgetauscht wird. Nein, die Diskussion wurde in unverantwortlicher Art und Weise in Bezug darauf, wer leben darf und wer sterben muss, geführt. Das ist das, was ich Ihnen vorwerfe. Da haben Sie eine Sache in die Gesellschaft gebracht, die unverantwortlich ist.\n\n({2})\n\nUnfähigkeit könnte man auch im Bereich der Prämienzahlungen für die Bereitstellung von Intensivbetten in Krankenhäusern sehen – das wurde vorhin schon einmal erwähnt –, wenn eine 75-prozentige Auslastung der Bettenkapazität mit Nichtcoronapatienten die Voraussetzung für den Abruf der Mittel ist. Das heißt, wenn ich nicht auf 75 Prozent Auslastung komme, reduziere ich einfach meine Gesamtbettenzahl und kann sie dann mit 75 Prozent ausweisen. Meine Damen und Herren, eine sehr fragwürdige Maßnahme!\n\nHaben politische Entscheidungen für finanzielle Entschädigungen und Sonderzahlungen zu Fehlanreizen geführt, also zu Missbrauch? Ich glaube, auch das wäre noch einmal zu überprüfen. Es sieht jedenfalls so aus. Dies ehrlich zu analysieren, ist wichtig, um die Entscheidungen von Parlament und Regierung – auch der Länderregierungen – zu überprüfen und gegebenenfalls zu korrigieren sowie für kommende ähnliche Fälle zu lernen und Fehler zu vermeiden.\n\nDie AfD hat mehrfach die Gründung einer ständigen Epidemiekommission angeregt, die auch solche Probleme hätte lösen können sowie mit ihrem Beratungsergebnis dann die Bundesregierung oder auch den Bundestag fachlich hätte beraten können. Das haben Sie abgelehnt, meine Damen und Herren. Wir kritisieren Ihre Politik. Sie haben ohne Not Panik und Angst in der Bevölkerung geschürt.\n\nVielen Dank.\n\n({3})"
"1061451","Wilhelm","Gottberg","AfD","Member of Parliament","2021-05-20T00:00:00.000Z","https://dip21.bundestag.de/dip21/btp/19/19230.pdf","\n\nHerr Präsident! Frau Ministerin Klöckner! Meine Damen und Herren! Wir beraten heute in erster Lesung das Gesetzespaket der Bundesregierung zur Ausgestaltung der Agrarförderung ab 2023. Ministerin Klöckner spricht davon, dass die heimischen Bauernfamilien mit den vorgelegten Gesetzentwürfen ihre Existenz in Zukunft dauerhaft sichern können. Wir, die AfD, sehen das anders.\n\nEs handelt sich doch im Grunde um ein Weiter-so der bisherigen Gemeinsamen Agrarpolitik, jedoch mit einem ganz entscheidenden Unterschied: Die Bundesregierung will die einkommenswirksamen Direktzahlungen für die landwirtschaftlichen Betriebe stark kürzen. Wir alle wissen, dass die bäuerlichen Einkommen ganz wesentlich von diesen Direktzahlungen abhängen. Zusammen mit immer neuen Auflagen werden diese Mittelkürzungen die landwirtschaftlichen Betriebe weiter unter Einkommensdruck setzen. Am Ende steht dann die Hofaufgabe. 80 000 Betriebsaufgaben in den letzten zehn Jahren sind ein Menetekel.\n\nVerehrte Kolleginnen und Kollegen, eines der Hauptprobleme der GAP ist, dass sie nicht gemeinsam ist. Jeder EU-Mitgliedstaat gestaltet seine Agrarpolitik trotz EU-Vorgaben im Prinzip selbst. Es ist für uns nicht vorstellbar, dass unsere EU-Partner die Direktzahlungen aus der ersten Säule so stark kürzen, wie das bei uns ab 2023 der Fall sein wird.\n\nZu den Vorlagen im Einzelnen:\n\nErstens: Viertes Gesetz zur Änderung des Direktzahlungen-Durchführungsgesetzes. Die Bundesregierung plant erneut eine Kürzung der einkommenswirksamen Direktzahlungen um 8 Prozent für das Jahr 2022. Das entspricht 100 Millionen Euro. Jedes Jahr will sie schrittweise weiter kürzen, bis dann in fünf Jahren sogar 15 Prozent, also etwa 188 Millionen Euro pro Jahr, den Direktzahlungen entzogen sind. Nicht mit uns!\n\n({0})\n\nDa wissen wir den Deutschen Bauernverband an unserer Seite.\n\nZweitens: Gesetz zur Einführung eines Integrierten Verwaltungs- und Kontrollsystems im Rahmen der GAP. Künftig soll das gesamte Antragsverfahren inklusive des Systems des Flächenmonitorings elektronisch abgewickelt werden. Zahlreiche landwirtschaftliche Betriebe arbeiten bereits nach diesem System. Das ist tatsächlich ein Beitrag zum Bürokratieabbau und zur Transparenz. Gut so!\n\n({1})\n\nDrittens: Gesetz zur Durchführung der im Rahmen der GAP geltenden Konditionalität. Konditionalität meint Verpflichtungen, die jeder Landwirt erfüllen muss, um die flächenbezogenen Direktzahlungen zu erhalten. Jeder landwirtschaftliche Betrieb muss zukünftig mindestens 3 Prozent seiner Fläche stilllegen, darf sie also nicht zur Nahrungsmittelproduktion nutzen. Damit Sie wissen, worüber wir reden: Diese 3 Prozent Stilllegungsflächen betragen rund eine halbe Million Hektar in Deutschland. Dadurch wird das Einkommen der Landwirte zusätzlich verringert.\n\nViertens: GAP-Direktzahlungen-Gesetz. Positiv bewerten wir bei diesem Entwurf die gekoppelte Einkommensstützung für die Muttertiere von Kälbern und Lämmern.\n\n({2})\n\nDiese Förderung ist überfällig. Trotzdem ist der Zielwert von etwa 60 Euro pro Mutterkuh unangemessen. Basierend auf dem Großvieheinheitenverhältnis müssten das etwa 200 Euro sein. Hier besteht Nachbesserungsbedarf.\n\nAusweislich der Tagesordnung soll bei dieser Debatte auch noch der Antrag der Linken „Runder Tisch zur Sicherung der Zukunft von Freiland- und Weidetierhaltungen“ anberaten werden. Der Antrag geht in die richtige Richtung. Die Einrichtung eines runden Tisches lehnen wir grundsätzlich ab. Das ergäbe eine schöne Kakofonie. Der Antrag ist deshalb abzulehnen.\n\nWir freuen uns auf produktive Ausschussberatungen.\n\nDanke.\n\n({3})"
"1061464","Steffen","Kotré","AfD","Member of Parliament","2021-05-20T00:00:00.000Z","https://dip21.bundestag.de/dip21/btp/19/19230.pdf","\n\nVielen Dank. – Sehr geehrter Herr Präsident! Sehr geehrte Damen und Herren! Das Weltwirtschaftsforum steht in diesem Jahr unter dem Motto „Great Reset“ – Großer Umbruch. Regierungsvertreter und vom Staat alimentierte Nicht-, also doch Regierungsorganisationen planen den Umbau der westlichen Gesellschaft. Digitalisierung, Klima- und Coronahysterie, Energiewende und missbrauchte Jugendliche werden benutzt, um ideologische Konzepte umzusetzen. Wissenschaft, Innovation, Technologie sollen planwirtschaftlich gesteuert werden. Nicht mehr der souveräne Kunde soll entscheiden, was produziert werden muss und soll, sondern Klimaideologen und Funktionäre. Es sollen nur noch Unternehmen unterstützt werden, die sogenannt klima- und umweltfreundlich sind. Unternehmen sollen also nicht mehr in allererster Linie Produkte erstellen, Umsatz und Gewinn machen, um die Gesellschaft zu stützen, sondern im Sinne der Regierung Wohlverhalten zeigen. Das heißt nichts anderes als die Aushöhlung der sozialen Marktwirtschaft hin zu einer ökosozialistischen Planwirtschaft, meine Damen und Herren.\n\n({0})\n\nDie ersten Vordenker wollen denn auch schon Demokratie und Eigentum abschaffen. Sie glauben das nicht? Ich darf das Bundesministerium für Umwelt, Naturschutz, Bau und Reaktorsicherheit aus dem Jahre 2017 und aus der Smart City Charta zitieren: „Vielleicht wird Privateigentum in der Tat ein Luxus“ oder: „Verhaltensbezogene Daten können Demokratie als das gesellschaftliche Feedbacksystem ersetzen“, meine Damen und Herren. Aha! Klaus Schwab, Vorsitzender des Weltwirtschaftsforums: Du wirst nichts mehr besitzen, aber glücklich damit sein. – Oder Wolfgang Schäuble: „Wir können die Wirtschafts- und Finanzunion, die wir politisch bisher nicht zustande gebracht haben, jetzt hinbekommen“.\n\n({1})\n\nEine Finanzunion wäre ebenfalls ganz klar grundgesetzwidrig, meine Damen und Herren!\n\n({2})\n\nWas bedeutet der große Umbau also im Gesamten? Er bedeutet Staatsdirigismus, Gängelung der Unternehmen, Deindustrialisierung, Einschränkung der grundgesetzlichen Freiheiten, weniger Demokratie, Umverteilung von Fleißig zu Reich, von Mittelstand zu Großunternehmen, von Deutschland zur EU.\n\n({3})\n\nEr bedeutet weiterhin den Verlust von Produktivität, Innovationskraft, Arbeitsplätzen und Wohlstand. Er bedeutet Quoten statt Leistung und eine weitere Spaltung der Gesellschaft, meine Damen und Herren. Diese Bundesregierung, die das vorantreiben möchte, ist ein Fall für den wirklichen Verfassungsschutz.\n\n({4})\n\nWir brauchen als Gegenteil zu dieser ökosozialistischen Planwirtschaft Lösungen der tatsächlichen Probleme der Menschen. Wir brauchen eine Entideologisierung und mehr direkte Demokratie.\n\nVielen Dank.\n\n({5})"
"1061475","Hansjörg","Müller","AfD","Member of Parliament","2021-05-20T00:00:00.000Z","https://dip21.bundestag.de/dip21/btp/19/19230.pdf","\n\nHohes Präsidium! Werte Abgeordnete! Zuerst gibt es eine klare Ansage an die fünf Vorredner der fünf Linksfraktionen im Hause:\n\n({0})\n\n– „Hohes Präsidium! Werte Abgeordnete!“ habe ich gesagt. – Sie Vorredner von den fünf Linksfraktionen haben unsere Anträge intellektuell überhaupt nicht verstanden.\n\n({1})\n\nSie hätten besser geschwiegen, anstatt hier billigstes AfD-Bashing zu betreiben.\n\n({2})\n\nDas Konstrukt des Great Reset ist durchsichtig; es hat keine demokratische Legitimierung. Zumindest nach unserem Verständnis als einziger demokratischer Fraktion hier im Hause ist das Volk der Souverän und nicht die Europäische Zentralbank oder das World Economic Forum.\n\n({3})\n\nDenn diese Organisationen zerstören den Kern unserer Wirtschaftsordnung. Sie zerstören die soziale Marktwirtschaft, frei nach dem Motto „Ideologie verdrängt Realität“; das haben Sie hier gerade oft genug gesagt.\n\n({4})\n\nBeim Green Deal ist es das gleiche Vorgehen: Vorgeblicher Klimaschutz ist die ideale Mogelpackung von euch Linken. – Das Klima regelt sich von selbst. Das Klima steht darüber und lässt sich nicht von euch Gottspielern vereinnahmen, ob ihr das jetzt begreift oder nicht.\n\n({5})\n\nWas Sie mit dieser Klimabesteuerung machen, das ist moderner Ablasshandel, der weder dem Bürger noch dem Klima dient.\n\n({6})\n\nDie CO2-Ausstöße der Industrienationen gehen nach oben, und das, was Sie vorhaben, sind lächerliche Bemühungen der EU – ein Pusten gegen den Sturm, etwas anderes ist das nicht. Das ist eine offensichtliche Abzocke. Es ist der uralte Betrug der Regierung am Bürger, die Umverteilung von Arm zu Reich, von den Fleißigen zu den Mächtigen oder aber – wir haben es ja gerade festgestellt – von den wenig Intelligenten hierher zu uns, den Intelligenten.\n\n({7})\n\nDas Ganze läuft jetzt nicht mehr unter der roten Fahne, wie wir das aus der Geschichte kennen, sondern es läuft jetzt in Grün, und die sogenannten Schwarzen und Gelben machen da auch noch mit! Wirklich genial gemacht ist diese Manipulation durch die Besteuerung von Luft. Vielleicht ist noch nicht jedem klar, was CO2 ist: Das ist ein Bestandteil von Luft.\n\n({8})\n\nUnsere beiden Anträge beenden dieses erbärmliche Ideologietheater, und wir als Alternative für Deutschland stellen unsere Wirtschaft wieder vom Kopf auf die Füße.\n\nIch bedanke mich fürs Nichtzuhören."
"1061477","Hansjörg","Müller","AfD","Member of Parliament","2021-05-20T00:00:00.000Z","https://dip21.bundestag.de/dip21/btp/19/19230.pdf","\n\nDanke schön.\n\n({0})"
