id,firstname,lastname,faction,position,date, url,speech
"1059946","Beatrix","Storch","AfD","Member of Parliament","2021-05-05T00:00:00.000Z","https://dip21.bundestag.de/dip21/btp/19/19226.pdf","\n\nVielen Dank für das Wort. – Herr Minister, ich möchte zu der Verordnung für Sonderrechte für Geimpfte und Genesene fragen. Sie werden mir gleich sagen, dass es keine Privilegien sind – gleichwohl. In dieser Verordnung steht drin:\n\nIst aufgrund wissenschaftlicher Erkenntnisse hinreichend belegt, dass geimpfte Personen und genesene … nicht (mehr) ansteckend sind …, müssen … Erleichterungen … vorgesehen werden.\n\nMeine erste Frage lautet: Wie wollen Sie verhindern, dass dadurch die Republik unterteilt wird in Menschen, die geimpft sind, und Menschen, die nicht geimpft sind – die einen mit Grundrechten, die anderen mit weniger oder sehr viel weniger oder gar keinen Grundrechten? Das ist meine erste Frage.\n\nMeine zweite Frage bezieht sich auf den zweiten Absatz dieser Verordnung:\n\nEs handelt sich … nicht um … Privilegien, sondern um die Aufhebung nicht mehr gerechtfertigter Grundrechtseingriffe.\n\nDie Rechtfertigung der Grundrechtseingriffe ist in § 28b geregelt. Da steht drin: Sieben-Tage-Inzidenz, 100er-Schwellenwert bei 100 000 Einwohnern.\n\nMeine Frage ist: Welche wissenschaftliche Grundlage gibt es für diese Rechtsgrundlage? Denn Sie müssen zunächst den Eingriff rechtfertigen. Für die Befreiung, sagen Sie, braucht es eine wissenschaftliche Grundlage. Ich möchte von Ihnen wissen, wie die Einschränkung von Grundrechten wissenschaftlich belegt ist. Welche wissenschaftliche Grundlage gibt es dafür, dass mein Mann und ich nach 22 Uhr nicht gemeinsam auf die Straße gehen dürfen, weil wir keinen Hund haben? Wenn wir einen Hund hätten, dürften wir das. Welche wissenschaftliche Grundlage haben Sie, dass meine Grundrechte so eingeschränkt sind?\n\n({0})"
"1059949","Beatrix","Storch","AfD","Member of Parliament","2021-05-05T00:00:00.000Z","https://dip21.bundestag.de/dip21/btp/19/19226.pdf","\n\nDie Frage war nicht, ob das verhältnismäßig ist, sondern ob die Maßnahme geeignet ist – das prüft der Jurist zunächst –, und für die Geeignetheit tragen Sie die Beweislast. Sie müssen darlegen und beweisen, dass der Eingriff etwas bringt, und das muss wissenschaftlich dargelegt werden. Und Sie sprechen hier auch für das Robert-Koch-Institut. Ich frage Sie: Was haben die für Grundlagen?\n\nVielleicht noch konkreter: Warum dürfen nach dieser Verordnung Bücher verkauft werden, aber Lampen nicht? Warum dürfen Blumen verkauft werden, Schuhe aber nicht? Warum dürfen Fahrräder nicht verkauft werden, aber Rasenmäher schon? Das steht alles in dieser Verordnung drin. Und ich frage Sie noch mal: Welches sind die wissenschaftlichen Grundlagen, auf die Sie als Regierung diese Maßnahmen stützen – über das RKI? Aber was ist die Grundlage?"
"1059952","Rainer","Kraft","AfD","Member of Parliament","2021-05-05T00:00:00.000Z","https://dip21.bundestag.de/dip21/btp/19/19226.pdf","\n\nVielen Dank. – Gut, dass wir bei diesem Thema sind und dass wir einen Mediziner haben. – Herr Minister Braun, wie kann es sein, dass die Regierung diese weitgehenden einschränkenden Maßnahmen an dem Inzidenzwert festmacht, der eine reine statistische Erhebung ist und mit dem tatsächlichen Krankheitsverlauf in der Bevölkerung nichts zu tun hat? Denn der Inzidenzwert ist maßgeblich von der Anzahl der durchgeführten Tests abhängig. Diese sind aufgrund des Kriteriums der Spezifizität, also der falsch positiven Tests, ein Haupttreiber des Inzidenzwertes im Allgemeinen. Das heißt, durch eine Verdopplung der Test kann ich eine Verdopplung der Inzidenzen erreichen, auch wenn sich am tatsächlichen Krankheitsverlauf, am tatsächlichen Krankheitsbild der Bevölkerung, de facto nichts geändert hat. Ich kann sogar in einer Nullcoronasituation allein durch falsch positive Tests eine Inzidenz herbeitesten. Wie kann so was in ein Gesetz gegossen werden durch einen Mediziner im Kanzleramt?"
"1059958","Johannes","Huber","AfD","Member of Parliament","2021-05-05T00:00:00.000Z","https://dip21.bundestag.de/dip21/btp/19/19226.pdf","\n\nVielen Dank, Herr Präsident. – Herr Minister Braun, vielen Dank für die Gelegenheit zur Nachfrage. Sie haben nämlich gerade geleugnet und bestritten, dass die Inzidenzzahl von der Anzahl der Tests abhängig wäre. Es ist nun mal im theoretischen Fall so – ich will es anschaulich machen –: Der Bundestag besteht aus etwa 700 Vertretern. Nehmen wir an, es wären alle infiziert. Dann ist die Inzidenz bei 50 Tests 50, bei 100 Tests wäre die Inzidenz 100, bei 200 Tests wäre die Inzidenz folglich 200.\n\n({0})\n\nVon daher ist die Testhäufigkeit natürlich ausschlaggebend für den Inzidenzwert. Bleiben Sie trotzdem bei der Meinung, dass der Inzidenzwert das geeignete Mittel der Wahl wäre? Warum nehmen Sie nicht die Positivrate als Grundlage für die Einschätzung des Infektionsgeschehens und auch des Pandemiegeschehens?\n\n({1})\n\nDie Positivrate wäre nämlich von der Testhäufigkeit abhängig und würde diesen Fakt wissenschaftlich betrachten."
"1059970","Rainer","Kraft","AfD","Member of Parliament","2021-05-05T00:00:00.000Z","https://dip21.bundestag.de/dip21/btp/19/19226.pdf","\n\nVielen Dank. – Stichworte „Gesundheitsminister Spahn“ und „Pflegekräfte“. Vor zwei Jahren gab es den Plan, Pflegekräfte unter anderem in Mexiko anzuwerben. Nun haben wir die Coronasituation. Inwiefern sind diese Anwerbeversuche davon betroffen? Wie groß ist dann die Minderversorgung und personelle Unterversorgung durch das Fehlen angeworbener Pflegekräfte in Deutschland, in diesem Fall durch Corona verursacht?"
"1060000","Rainer","Kraft","AfD","Member of Parliament","2021-05-05T00:00:00.000Z","https://dip21.bundestag.de/dip21/btp/19/19226.pdf","\n\nEine Ja/Nein-Frage. Das teuerste Arbeitspferd in den Behörden und auch hier im Bundestag ist nach wie vor das Telefax. Also Ja/Nein-Frage: Wird Ihre Digitalisierungsoffensive innerhalb von 24 Monaten dazu führen, dass das Faxzeitalter in den deutschen Behörden beendet ist?"
"1060021","Beatrix","Storch","AfD","Member of Parliament","2021-05-05T00:00:00.000Z","https://dip21.bundestag.de/dip21/btp/19/19226.pdf","\n\nVielen Dank. – Angenommen, wir erreichen Klimaneutralität bis 2045, was auch immer das heißt: Um wie viel Grad reduziert sich die Temperatur, wenn Deutschland dieses Ziel erreicht? Ich weise darauf hin, dass es große Industriestaaten gibt, die bei dieser Geschichte nicht mitmachen. Unter Berücksichtigung des Anteils von Deutschland an den Treibhausgasen: Um wie viel Grad wird die Temperatur gesenkt, wenn wir, Deutschland, unsere ehrgeizigsten Klimaschutzziele erreichen? Welche Gradzahl können Sie nennen? Und können Sie mir sagen, auf welcher wiederum wissenschaftlichen Grundlage Sie das beweisen können? Ich frage das, damit wir sehen, dass sich das lohnt, was wir machen; gerade habe ich gehört: keine Tierzucht mehr, kein Fleisch mehr essen – und was auch sonst noch alles an Restriktionen kommen soll.\n\n({0})"
"1060039","Stephan","Brandner","AfD","Member of Parliament","2021-05-05T00:00:00.000Z","https://dip21.bundestag.de/dip21/btp/19/19226.pdf","\n\nJa, gerne. – Dass die Kanzlerin sich sorgt, das mag so sein; davon kommt draußen nichts an. Und dass sich viele Menschen bei ihr gut aufgehoben fühlen: Ich kenne keinen, der sich da gut aufgehoben fühlt. – Egal.\n\n({0})\n\nAm 25. März hat „Die Zeit“ getitelt „Ab in die Präsidialrepublik“ und deutlich gemacht, dass der Neubau von Teilen des Bundeskanzleramtes den Anschein erwecke, als wenn sich Deutschland in ein neues Regierungssystem, nämlich eine Präsidialrepublik, entwickeln würde. Wörtlich heißt es:\n\nMit seinem ständigen Mitarbeiterwachstum verschiebt das Bundeskanzleramt die fein austarierten Gewichte des parlamentarischen Regierungssystems …\n\nNun wissen wir alle: Das Bundeskanzleramt soll für 600 Millionen Euro umgebaut werden: mehretagige Luxuswintergärten, Promi-Kindergarten, Hubschrauberlandeplatz in luftiger Höhe, Baukosten von 20 000 Euro pro Quadratmeter. Herr Braun, ich frage Sie: Finden Sie das in dieser tiefen Krise, in der sich unser Land befindet, aber auch ansonsten angemessen?"
"1060030","Stephan","Brandner","AfD","Member of Parliament","2021-05-05T00:00:00.000Z","https://dip21.bundestag.de/dip21/btp/19/19226.pdf","\n\nJa, vielen Dank. – Herr Braun, im Rahmen des Formats „Die Bundeskanzlerin im Gespräch“ – das ist noch abrufbar über die Webseite des Bundeskanzleramtes – beantwortete Ihre Chefin am 27. April 2021 eine Frage zum vierten Bevölkerungsschutzgesetz, also zur sogenannten Bundesnotbremse, wie folgt – Zitat – :\n\nDadurch, dass wir jetzt ein Bundesgesetz gemacht haben, kann das nur durch das Bundesverfassungsgericht noch überprüft werden. Das heißt also, man hat nicht die verschiedenen Verwaltungsgerichtsentscheidungen … Und was hat die Sache noch mal erschwert? Dass verschiedene Gerichtsentscheidungen immer nach dem Gleichbehandlungsgrundsatz gehen … und schwups ist man in einer Bahn, wo dann alle Geschäfte auf sind.\n\nZitat Ende. – Frau Merkel brüstete sich also mit Verstößen gegen den Gleichheitsgrundsatz, Artikel 3 Grundgesetz, und mit der von ihrer Koalition verursachten massiven Rechtswegbeschränkung, also einem Verstoß gegen Artikel 19 Absatz 4 Grundgesetz, die Rechtsschutzgarantie. Frau Merkel war froh, dass es keine verwaltungsgerichtlichen Entscheidungen im Rahmen der Coronamaßnahmen mehr gibt.\n\nIch habe seit Jahren den Eindruck, dass Frau Merkel auf Kriegsfuß mit unserer Verfassung steht und teilweise deren Vorgaben missachtet\n\n({0})\n\noder auch verachtet – Stichworte: Asylrecht, Struktur der Europäischen Union, Parallelstrukturen, Ministerpräsidentenkonferenz und so etwas."
"1060032","Stephan","Brandner","AfD","Member of Parliament","2021-05-05T00:00:00.000Z","https://dip21.bundestag.de/dip21/btp/19/19226.pdf","\n\nZudem meine ich auch seit Jahren zu bemerken, dass Frau Merkel einen Hang zur Beratungsresistenz –"
"1060034","Stephan","Brandner","AfD","Member of Parliament","2021-05-05T00:00:00.000Z","https://dip21.bundestag.de/dip21/btp/19/19226.pdf","\n\n– und zu absolutistischen Zügen entwickelt hat.\n\n({0})\n\nJetzt stelle ich meine Ja-oder-Nein-Frage: Teilen Sie die Auffassung, und, wenn nein, warum nicht?"
"1060047","Rainer","Kraft","AfD","Member of Parliament","2021-05-05T00:00:00.000Z","https://dip21.bundestag.de/dip21/btp/19/19226.pdf","\n\nVielen Dank. – Zurück zum Neubau Bundeskanzleramt. Die Investitionskosten sind ja nur die eine Seite der Medaille. In diesen Büroräumen werden ja dann auch Personen angestellt sein und arbeiten. Mit welchem Aufwuchs an Personal im Bundeskanzleramt können wir denn rechnen bzw. wie viele von den dann dort eingesetzten Angestellten werden von außen hereingeholt?"
"1060073","Martin","Sichert","AfD","Member of Parliament","2021-05-05T00:00:00.000Z","https://dip21.bundestag.de/dip21/btp/19/19226.pdf","\n\nHerr Präsident! Meine Damen und Herren! An den Sana-Kliniken sieht man wunderbar, was alles schiefläuft im deutschen Gesundheitssystem, und dass der Staat nicht die Lösung ist, sondern die Ursache des Problems.\n\n({0})\n\nWährend zu normalen Zeiten maximal ein paar Hundert Krankenhausbeschäftigte in Kurzarbeit sind, sind es in diesem Lockdown 10 000; im ersten Lockdown waren es gar 60 000.\n\n({1})\n\nDas liegt schlicht daran, dass die Regierung das ganze Gesundheitssystem hysterisch auf die Bekämpfung einer einzigen Krankheit ausrichtet, obwohl viel mehr Menschen an anderen Krankheiten sterben. Ganze Abteilungen oder gar Kliniken werden geschlossen, Reha- und Vorsorgetermine verschoben und Behandlungen gestrichen oder gekürzt.\n\nService und Patientennähe sind gerade nicht gefragt. Die passen nicht in die Hysterie. Da ist es nur konsequent, dass die Sana-Kliniken über 1 000 Stellen im Servicebereich streichen. Liebe Sana-Mitarbeiter, Sie werden arbeitslos, weil die Bundesregierung Ihre Arbeit nicht wertschätzt.\n\n({2})\n\nDie Fokussierung der Regierung nur auf Corona kostet nicht nur Tausende Arbeitsplätze, sondern sie schädigt auch die Gesundheit von Millionen Menschen.\n\n({3})\n\nUnzählige Menschen erkranken psychisch schwer durch den Lockdown, und die Entwicklungsschäden bei Millionen Kindern durch Panikmache und soziale Isolation sind katastrophal.\n\nExperten sagen uns, dass 20 000 Menschen zusätzlich an Krebs sterben werden, weil durch den Lockdown Vorsorgeuntersuchungen verschoben wurden. 240 000 Menschen, also die Einwohnerzahl eines kompletten Bundestagswahlkreises, sterben jedes Jahr an Krebs. Wo ist das konsequente politische Vorgehen gegen Krebs? Wo sind die Politiker, die eine Kerze für diese vielen Toten anzünden? Es gibt sie nicht, weil Sie nur dann Trauer heucheln, wenn es Ihnen politisch nutzt.\n\n({4})\n\nIhre Politik hat dafür gesorgt, dass in großen Teilen des medizinischen Bereichs nicht die Gesundheit der Patienten im Vordergrund steht. Sie machen Deutschland zur gesundheitspolitischen Servicewüste. Ein Beispiel: Obwohl sich die Zahl der Geburten in Deutschland in den letzten 30 Jahren kaum geändert hat, wurde die Zahl der Geburtskliniken halbiert.\n\nSelbst in der angeblichen Pandemiebekämpfung stellen Sie völlig falsche Weichen. Seit März letzten Jahres wissen wir aus China, dass zu frühe invasive Beatmung für Coronapatienten tödlich ist. Darauf weist auch der oberste deutsche Lungenfacharzt Thomas Voshaar hin. Und die Daten aus Krankenhäusern zeigen uns auch schon lange: Dort, wo frühzeitig invasiv beatmet wird, ist die Todesrate um ein Vielfaches höher als dort, wo nur im äußersten Notfall invasiv beatmet wird. Und was machen Sie? Sie setzen einen fetten fünfstelligen Betrag pro Patient als Anreiz für die Krankenhäuser, frühzeitig invasiv zu beatmen.\n\nIhre Politik tötet Menschen. Ihre Politik macht Menschen arbeitslos, und sie schürt Hysterie. Seit Juli letzten Jahres gibt es keinen Anstieg bei den Intensivpatienten.\n\n({5})\n\nDie Zahl ist über die ganzen Monate hinweg konstant. Das Bundesgesundheitsministerium selbst sagte wortwörtlich: Im Jahresdurchschnitt waren 4 Prozent aller Intensivbetten mit Coronapatientinnen und ‑patienten belegt. – Da die Auslastung der Betten übers Jahr hinweg konstant ist, Sie aber Hysterie schüren wollen, sorgen Sie für eine Abnahme der Zahl der freien Betten. Mit dem § 21 des Krankenhausfinanzierungsgesetzes bekommen Krankenhäuser deutlich mehr Geld, wenn sie zumindest zu 75 Prozent oder 85 Prozent ausgelastet sind. Sie haben einen finanziellen Anreiz dafür geschaffen, dass Krankenhäuser freie Kapazitäten abbauen.\n\nDie Sana Kliniken suchen übrigens trotzdem händeringend Personal, nämlich als Pflegekräfte. Und obwohl der Pflegemangel seit Jahren bekannt ist, versagt die Politik auch hier. Wo bleiben denn die Maßnahmen, um Pfleger und Intensivpfleger zu gewinnen und langfristig zu halten? Wo bleibt die Aufstockung der Kapazitäten? Wo bleibt die Rettung von Menschenleben, indem man Krankenhäusern Anreize schafft, erst dann invasiv zu beatmen, wenn es gar keine andere Möglichkeit mehr gibt?\n\n({6})\n\nAll diese Maßnahmen gibt es nicht, und ich kann Ihnen auch sagen, warum es sie nicht gibt: weil für Sie nicht die Gesundheit der Menschen im Vordergrund steht, sondern nur die eigene Profit- und Machtgier.\n\n({7})\n\nWir müssen diesen gesundheitspolitischen Irrweg beenden. Es muss endlich wieder das Wohl der Patienten im Vordergrund stehen.\n\n({8})\n\nDann ist auch wieder Platz für ausreichend Servicemitarbeiter im Gesundheitswesen.\n\n({9})"
"1060089","Robby","Schlund","AfD","Member of Parliament","2021-05-05T00:00:00.000Z","https://dip21.bundestag.de/dip21/btp/19/19226.pdf","\n\nSehr geehrter Herr Präsident! Werte Kolleginnen und Kollegen! Manches, was sich in unser Gesichtsfeld drängt und gerade sichtbar wird, hat die Wurzeln im Tiefgehenden. – Wenn man die Nachrichten der letzten Monate hört und selbst Aufsichtsrat eines kommunalen Krankenhauses ist, dann wundert man sich, ehrlich gesagt, nicht über die aktuelle Situation in den Sana Kliniken. Denn was dort passiert, meine Damen und Herren, ist kein Zufall, sondern das Ergebnis jahrelanger und monatelanger Fehlpolitik im Gesundheitswesen.\n\n({0})\n\nDie Leidtragenden sind auch nicht die Politiker – also wir, die hier sitzen –, sondern eben die Bürger unseres Landes.\n\nDie wirtschaftliche Situation vieler deutscher Krankenhäuser, insbesondere der kommunalen, ist einfach nur noch katastrophal. Das ist nicht nur meine Meinung, sondern das prognostizierten die Gesundheitsökonomen Augurzky und Schmidt vom Leibniz-Institut für Wirtschaftsforschung in einem veröffentlichten Positionspapier. Bereits im Jahr 2018 lagen 13 Prozent der Krankenhäuser im Bereich erhöhter Insolvenzgefahr, und zu dieser Zeit gab es noch gar keine Coronapandemie.\n\nEin wachsender Ärzte- und Pflegekräftemangel belastet die Situation zusätzlich, und private Krankenhauskonzerne betreiben mit hochspezialisierten medizinischen Filetstückchen eine Gewinnmaximierung unter Dumping des Humankapitals, das heißt der gesamten medizinischen Arbeitskräfte, meine Damen und Herren.\n\n({1})\n\nGenau das sehen wir jetzt bei den Sana Kliniken: Gewinn und Profit stehen vor sozialer Verantwortung. Wo sind wir denn da hingekommen, meine Damen und Herren? Wo sind wir da hingekommen in Deutschland? – Gleichzeitig aber kämpfen die kommunalen Krankenhäuser ums Überleben und schließen beispielsweise Geburtenstationen und andere lokal wichtige Fachabteilungen.\n\nBesonders jetzt in den Pandemiezeiten zeigen sich die gravierenden strukturellen Mängel in einem massiven Investitionsstau, der letztendlich das Desaster des gesamten Pandemiemanagements offenbart. Bei einer Bezahlung der Krankenkassen nur nach Zahl belegter Betten und leistungsbezogenen Fallpauschalen gleicht dies einem Offenbarungseid der deutschen Gesundheitspolitik der letzten 17 Jahre.\n\n({2})\n\nDeshalb fordert die AfD schon seit Langem die Abschaffung des völlig unnützen DRG-Systems und eine komplette Neustrukturierung der Krankenhauslandschaft mit einem vorausbezahlten Pro-Kopf-Vergütungssystem mit Regionalkomponente, die umgehend zum Beispiel auch an sogenannte pandemische Lagen angepasst werden kann. Diese von uns geforderten Vorhaltepauschalen sichern eine Daseinsvorsorge der Krankenhäuser, insbesondere der ländlich und kommunal geprägten.\n\nDeshalb meine dringende Bitte ans Gesundheitsministerium: Nehmen Sie sich bitte dieser Problematik an, und befassen Sie sich mit der flächendeckenden, regionalgesteuerten, patientenorientierten Versorgung! Denn Sie sehen ja selbst, dass Sie anscheinend mit den privaten Konzernen wie zum Beispiel den Sana Kliniken einfach nicht zurechtkommen.\n\nGesundheit ist ein hohes und allgemeines Gut, und hier hat der Staat vor allem dem Bürger gegenüber eine wichtige und soziale Verantwortung, und da ist der Staat natürlich auch in der Pflicht, die fortschreitende Kapitalisierung und Kommerzialisierung im Gesundheitsbereich kleinzuhalten und das Wohl des Bürgers tatsächlich in den Vordergrund zu stellen.\n\nVielen Dank.\n\n({3})"
"1060105","Albrecht","Glaser","AfD","Member of Parliament","2021-05-05T00:00:00.000Z","https://dip21.bundestag.de/dip21/btp/19/19226.pdf","\n\nHerr Präsident! Meine sehr verehrten Damen und Herren! Wir beraten heute das Abzugsteuerentlastungsmodernisierungsgesetz. Mit diesem Artikelgesetz sollen Änderungen an zahlreichen Gesetzen vorgenommen werden, alle mit dem Ziel, die Erstattung von Abzugsteuern zu regeln. Abzugsteuern sind Steuern, die an der Einkunftsquelle einbehalten werden. Das ist beispielsweise der Fall bei Dividenden, bei denen das auszahlende Unternehmen die Kapitalertragsteuer einbehält und direkt an den Fiskus abführt.\n\nDeutschland hat mit zahlreichen Ländern Doppelbesteuerungsabkommen abgeschlossen, die regeln, dass beispielsweise der ausländische Wohnsitzstaat des Dividendenempfängers das Anrecht auf Besteuerung hat und insofern Deutschland kein Besteuerungsrecht mehr hat. In diesem Fall darf der Empfänger einer Dividende abgeführte Kapitalertragsteuer zurückfordern. In der Vergangenheit haben sich Banken und Großanleger durch Ausnutzung von Verfahrensmängeln und Gesetzeslücken die Kapitalertragsteuer zu Unrecht erstatten lassen. Diese Betrügereien sind als Cum/Ex-Geschäfte bekannt geworden und haben den deutschen Staat um zweistellige Milliardenbeträge geschädigt.\n\nErste Warnungen gab es bereits 1992. Wirklich aufgedeckt aber wurde dieser Steuerbetrug erst nach und nach ab dem Jahr 2010. Die politische Befassung mit dem Problem erfolgte erst 2016/2017 im Rahmen eines Untersuchungsausschusses. Die rechtliche Aufarbeitung dauert bis heute an. Der Finanzminister ist vor einigen Tagen selbst als Zeuge in einem Verfahren der Hamburger Variante des Cum/Ex-Geschäftes vernommen worden. Aber nicht nur der gegenwärtige Finanzminister, nein, auch die anderen Finanzminister der Merkel-Regierung, Peer Steinbrück und Wolfgang Schäuble, haben diesen Steuerbetrug nicht wirksam bekämpft.\n\n({0})\n\nDieser Gesetzentwurf soll es nun richten.\n\nTrotz der nun sehr langen Arbeit von vielen Jahren ist der heute vorgelegte Entwurf leider nicht ausgereift; das zeigen schon die 26 Änderungsanträge der Koalition zum eigenen Gesetzentwurf. Die Sachverständigen, die sich im Rahmen der öffentlichen Anhörung äußerten, waren ebenfalls enttäuscht. Von einer „Reform aufs Geratewohl“ war die Rede.\n\nBesonders stechen Haftungsanforderungen ins Auge – es war gerade die Rede davon, wenn auch mit anderer Prononcierung –, bei denen Banken für Angaben von Dritten einstehen sollen, selbst wenn sie kein Verschulden trifft oder sie die Informationen auf legalem Wege gar nicht beschaffen können. Von einigen Sachverständigen wurde diese Regelung als verfassungswidrig angesehen. Es spricht vieles dafür, dass das auch so ist.\n\nAuch die neu eingeführte Verpflichtung von Aktiengesellschaften, vor jeder Hauptversammlung die Identität aller Aktionäre festzustellen – bei einem Unternehmen wie Siemens sind das etwa 850 000 –, ist für die Beteiligten unzumutbar, und – was viel entscheidender ist – es bringt überhaupt keinen Nutzen, um das Problem, um das es geht, zu lösen. Hier gilt leider also erneut, meine sehr verehrten Damen und Herren: schlechtes Handwerk und maximale Schikane für die Steuerpflichtigen.\n\n({1})\n\nBei so viel Schatten gibt es auch Licht: Die Übertragung der Zuständigkeit und damit Zentralisierung des Erstattungsverfahrens an das Bundeszentralamt für Steuern begrüßen wir ebenso wie die Digitalisierung der Antragsbearbeitung, die leider erst ab 2024 zu erwarten ist.\n\nInsgesamt werden wir uns enthalten, obwohl wir einer qualitätsvollen Legislation sehr gerne zugestimmt hätten. Die hastig eingereichten Änderungs- und Entschließungsanträge der Grünen fügen den Mängeln des Gesetzentwurfs noch weitere Mängel hinzu. Die FDP stellt ganz andere Themen ins Schaufenster, die mit dem Gesetzentwurf nichts zu tun haben. Aber auch das ist business as usual.\n\nHerzlichen Dank.\n\n({2})"
