id,firstname,lastname,faction,position,date, url,speech
"1062007","Rainer","Kraft","AfD","Member of Parliament","2021-05-21T00:00:00.000Z","https://dip21.bundestag.de/dip21/btp/19/19231.pdf","\n\nIch danke. – Die Höhe von über 4 Milliarden Euro wird nun von der Fraktion der Grünen infrage gestellt. Wer in den vergangenen Jahren im Berliner Politikbetrieb aufgepasst hat, dem fällt sofort das Gezerre um die Entschädigungen beim Ausstieg aus der Kernkraft ein; das war ja ganz analog. Blicken wir ganz kurz zurück:\n\nIn 2011 beschließt der Bundestag ein Ende der kommerziellen Stromerzeugung aus Kernkraft. Dazu wurde das 13. Gesetz zur Änderung des Atomgesetzes beschlossen. Im Dezember 2016 befindet dann das Bundesverfassungsgericht, dass die dort enthaltenen finanziellen Regelungen nicht ausreichend sind. Daraufhin arbeitet die jetzige Regierung das 16. Gesetz zur Änderung des Atomgesetzes aus. Im Sommer 2018 wird dieses vom Bundestag, also von uns, beschlossen. Im September 2020 befindet das Bundesverfassungsgericht erneut, dass dieses 16. Gesetz zur Änderung des Atomgesetzes die bestehenden Verpflichtungen aus 2016 nicht erfüllt. Eine weitere Änderung muss her, und diese liegt uns derzeit mit dem Entwurf des 18. Gesetzes zur Änderung des Atomgesetzes vor; er liegt gerade im Ausschuss.\n\nDas Bundesverfassungsgericht hat also allen Absichten, die enteigneten Unternehmen mit Brosamen abzuspeisen, eine klare Absage erteilt. Das sollten sich die sozialistischen Fraktionen hier im Hause einmal gut merken: Ihre feuchten Enteignungsträume werden für den Steuerzahler immer sehr, sehr teuer.\n\n({0})\n\nAber das ficht Sie ja nicht. Es ist doch immer das Geld anderer Leute, das Geld des Steuerzahlers, und das ist Ihnen in der Regel ja immer komplett egal.\n\n({1})\n\nDie verschiedenen Regierungen haben es also in über zehn Jahren nicht geschafft, die Entschädigungszahlungen für die Kernkraftwerksbetreiber rechtskonform hinzubekommen, und wollen jetzt schon das nächste Fass aufmachen.\n\nZudem ist der Ausstiegsfahrplan des Kohleausstiegsgesetzes durch die jüngsten Pläne der Regierung zur Verschärfung der Klimaplanziele wieder komplett infrage gestellt. Wir wissen also noch nicht einmal, worüber wir hier konkret reden. Es wird ja auch von Ihnen gefordert, diesen Ausstiegsfahrplan zu überarbeiten.\n\nWir müssen also auch feststellen: Es gibt nicht so wirklich was Aktuelles für diese Aktuelle Stunde am Freitagabend. Sprechen wir also lieber über die Versorgungssicherheit mit Energie und Strom in Deutschland. Wir haben ja heute bereits mehrfach das Märchen von der preiswerten Energie aus Sonne und Wind gehört. Jeder private und unternehmerische Stromkunde weiß bei einem Blick auf seine Rechnung, dass diese Schutzbehauptungen der Koalition reine Lügen sind. Wie könnte es sonst sein, dass das Vorreiterland in Sachen erneuerbare Energie die teuersten Strompreise aller Industrie- und Flächenstaaten hat? Dank Ihres rückschrittlichen Technologieverständnisses setzen Sie bei der dauerhaften Versorgung unseres Landes nämlich auf gänzlich unzuverlässige Energiequellen. Das klingt nicht nur doof, das ist es auch.\n\n({2})\n\nWährend Sie jede Abschaltung eines zuverlässig arbeitenden Kern- oder Kohlekraftwerkes in Deutschland feiern, bauen unsere Nachbarn entlang der Grenze neue Kraftwerke auf, und das nicht nur für den Eigenbedarf, sondern weil sie genau wissen, dass Strom in Deutschland dank Ihrer Politik in Zukunft Mangelware sein wird. Diese Nachbarn reiben sich jetzt schon alle die Hände, weil sie diesen Strom in Zukunft zu Premiumpreisen nach Deutschland exportieren können. In Frankreich arbeiten bereits jetzt rechnerisch zwei komplette Kernkraftwerksblöcke nur für den Export von Strom nach Deutschland. Das ist das Ergebnis Ihrer Energiepolitik.\n\nDie Grünen, die den deutschen Ausstieg aus der Kernkraft so frenetisch beklatscht haben, bemängeln nun die schlechteren Sicherheitsbedingungen in französischen Kernkraftwerken. Frau Kotting-Uhl, wenn ich Sie zitieren darf – das war vorgestern im Ausschuss –: Die Sicherheitsstandards in deutschen Kernkraftwerken waren höher als die in den französischen jetzt. – Wäre es da nicht besser gewesen, statt teures Geld über die Grenze zu werfen und dort zwei Blöcke mit niedrigeren Sicherheitsniveaus, als es in Deutschland der Fall wäre, zu unterhalten, die deutschen einfach zu behalten? Die Franzosen hätten ihre dann abgestellt.\n\nAuch Polen sieht seine energetische Zukunft nur durch Kernenergie gesichert – mit Neubauten entlang der deutschen Grenzen. Die Behauptung, dass Deutschland mit seinen minderwertigen erneuerbaren Energien Vorreiter einer weltweiten Bewegung wäre, ist also wieder mal nur reines Wunschdenken.\n\n({3})\n\nDas Fazit ist klar: Sie vernichten unsere heimische, preiswerte und zuverlässige Stromversorgung. Das wird für den deutschen Stromverbraucher drastische Folgen haben, die Sie als angebotsorientierte Stromversorgung schönfärben wollen.\n\nDoch auf gut Deutsch sind das nichts anderes als Unterversorgung und Mangelwirtschaft, die uns in die teure Abhängigkeit von ausländischen Stromimporten treiben.\n\nIhre Politik macht Menschen arm, meine Damen und Herren, wie immer im Sozialismus. Aber ich hoffe sehr, dass im September der Wähler Sie dafür abstrafen wird.\n\n({4})"
"1062022","Alexander","Gauland","AfD","Member of Parliament","2021-06-09T00:00:00.000Z","https://dip21.bundestag.de/dip21/btp/19/19232.pdf","\n\nHerr Präsident! Meine Damen und Herren! Nichts widersprach so fundamental der preußischen und auch der österreichischen Militärtradition wie der Überfall auf die Sowjetunion vom 22. Juni 1941. Dieser Krieg war von Anfang an ein Vernichtungskrieg und sein Ziel „Lebensraum im Osten“ eine nationalsozialistische Chimäre. Dass die Wehrmacht diesem Irrsinn Folge leistete, hat sie auf alle Zeiten beschmutzt.\n\nDer Krieg im Osten unterschied sich von Anfang an von den übrigen Kämpfen. Hier glaubte Hitler, keine Rücksicht nehmen zu müssen. Der Kommissarbefehl und die Ausmordung der Juden, das massenweise Verhungernlassen von Kriegsgefangenen\n\n({0})\n\nund die flächendeckende Zerstörung sowjetischer Infrastruktur hatten nichts mehr mit einem klassischen Staatenkrieg der Vergangenheit zu tun. Die sowjetischen Völker sollten vom Erdboden getilgt werden oder bestenfalls als Fellachen ein trostlos-grauenvolles Dasein fristen. Eine russische, ukrainische oder weißrussische Kultur sollte es danach nicht mehr geben.\n\nEs bleibt also nichts zu diskutieren, nur immer wieder zu fragen, warum so viele in der preußischen Militärtradition Erzogene diesen Weg mitgegangen sind. Und es ist deshalb nur zu verständlich und immerhin ein kleiner Lichtblick im trüben Bild, dass Stauffenberg Erzählungen seiner Kameraden und eigene Beobachtungen im Osten zum Anlass für seine Tat nahm.\n\nWenn der Überfall und der Krieg auch kaum eine unterschiedliche Bewertung erfahren, so bleibt die Frage: Hätte man es verhindern können? Wir Deutschen können sie wegen eigener tiefer Schuld nicht stellen. Aber im Westen ist sie gestellt worden. Hat die Sowjetunion nicht, so der Vorwurf, durch den Molotow-Ribbentrop-Pakt eine Mitschuld an der Katastrophe, die sie getroffen hat? Wir wissen, dass Stalin zwei Optionen hatte: das Bündnis mit dem Westen oder einen kurzfristigen Aufschub durch den Teufelspakt mit Hitler. Und es gibt nicht wenige Historiker, die diesen Teufelspakt für unverzeihlich und einen schweren Fehler halten.\n\n({1})\n\nRealistisch und gerecht ist diese Kritik nicht; denn die langwierigen Verhandlungen über eine Militärkonvention zwischen der Sowjetunion, dem Empire und Frankreich führten immer wieder zu demselben toten Punkt: Wie soll eine Verteidigung organisiert werden ohne ein Polen, das keine sowjetischen Truppen auf seinem Territorium dulden wollte? Wenn Stalin also auf diese Weise eine kurze Zeit erkaufte, um gegen den deutschen Angriff besser gewappnet zu sein, so war das eine realpolitische und richtige Entscheidung für das eigene Überleben, dessen Konsequenzen allerdings für Polen furchtbar waren.\n\nDoch auch das war die Folge von Hitlers Überfall auf dieses Land: Er hatte die europäische Ordnung zerstört und einen Weltkrieg ausgelöst, auf den mindestens ebenso wie auf den Ersten die Bemerkung des ehemaligen britischen Außenministers Sir Edward Gray zutraf: In Europa gehen die Lichter aus, und wir werden sie in unserer Lebenszeit nicht mehr leuchten sehen. – Denn am Ende gab es keine Sieger, nur Verlierer.\n\nDoch gerade weil wir Deutschen Russland gegenüber in so tiefer Schuld stehen, ist es geboten, mit Nachsicht und Toleranz diesem Land gegenüberzutreten, auch wenn wir manches an seinem Verhalten nicht immer verstehen oder gar billigen können. Moralische Überheblichkeit ist jedenfalls fehl am Platze. Russland ist eine europäische Macht und unser ältester Verbündeter. Hitler wollte dieses Land vom Erdboden tilgen. Dass ihm das nicht gelungen ist, darf uns heute mit Dank und Freude erfüllen.\n\nIch bedanke mich.\n\n({2})"
"1062034","Tino","Chrupalla","AfD","Member of Parliament","2021-06-09T00:00:00.000Z","https://dip21.bundestag.de/dip21/btp/19/19232.pdf","\n\nWerter Herr Präsident! Sehr geehrte Vertreter der Russischen Botschaft! Meine Damen und Herren! Der 22. Juni 1941 stellte einen Tiefpunkt der deutschen und europäischen Geschichte dar. Die deutsch-russischen Beziehungen lagen am Boden. Mit dem Überfall auf die Sowjetunion brachte das nationalsozialistische Deutschland unermessliches Leid über Europa und die Welt. Kaum ein Land hat das mehr spüren müssen als Russland. Allein in der damaligen Sowjetunion starben zwischen 25 Millionen bis 27 Millionen Menschen. Das Ausmaß der Zerstörung ist weder in Worte noch in Zahlen zu fassen.\n\nDennoch hatte ich trotz all des Leids, das der Zweite Weltkrieg auch über das russische Volk gebracht hat, immer den Eindruck, dass es mir als deutschem Staatsbürger fast immer ohne Vorbehalte begegnet ist. Es hat den Blick nicht in die Vergangenheit, auf die Kriege und Divergenzen gerichtet, sondern auf das Hier und Heute, in die Zukunft und auf die positiven Elemente unserer jahrhundertelangen Beziehungen.\n\n({0})\n\nUnd ich weiß, dass ohne das Zutun der späten Sowjetunion diese Plenardebatte heute hier sicherlich nicht im Reichstag zu Berlin stattfinden würde. Das dürfen wir nicht vergessen.\n\nEuropa ist und bleibt ohne Russland nicht denkbar und auch nicht die Bundesrepublik.\n\n({1})\n\nDeutschland wäre heute ohne Russland nicht das, was es ist: ein vereintes, demokratisches Land in der Mitte Europas.\n\nMeine Damen und Herren, wir erinnern heute an einen der schwärzesten Tage der europäischen und deutschen Geschichte. Nach 80 Jahren müssen wir leider feststellen, dass sich die deutsch-russischen Beziehungen verschlechtern. Auch diese Bundesregierung, Herr Maas, muss sich fragen: Warum befindet sich unser Verhältnis zu Russland auf einem neuen Tiefpunkt und ist mittlerweile schlechter als zu Zeiten des Kalten Krieges?\n\n({2})\n\nJetzt, da wir wieder an einem Scheideweg in den Beziehungen angekommen sind, werden wir nur durch kontinuierlichen Dialog, offene und verbindliche Gespräche weiterkommen, nicht aber durch Schuldzuweisungen und erhobene Zeigefinger. Vor allem dürfen wir aber eins nicht: den Graben noch tiefer machen, indem wir noch weiter auf Distanz zueinander gehen und schweigen.\n\nAber auch wenn das deutsch-russische Verhältnis derzeit so belastet ist: Uns eint eine über 1 000 Jahre andauernde gemeinsame Geschichte. Wir waren immer wieder Feinde, aber auch oft Verbündete und Freunde. Immer wieder ist es uns gelungen, nach Kriegen und Auseinandersetzungen neu anzufangen. Hier und heute haben wir die Gelegenheit, im respektvollen Umgang miteinander stark und ohne neue Ideologien pragmatisch an einer gemeinsamen Zukunft zu arbeiten.\n\n({3})\n\nDer Respekt vor nationalen Interessen, Kulturen und Mentalitäten ist dabei der Garant für ein friedliches Europa.\n\nVielen Dank.\n\n({4})"
"1062054","Armin Paulus","Hampel","AfD","Member of Parliament","2021-06-09T00:00:00.000Z","https://dip21.bundestag.de/dip21/btp/19/19232.pdf","\n\nDanke sehr, Herr Präsident. – Herr Bundesaußenminister, Sie sind ja noch verhältnismäßig jung in diesem Amte. Ich habe die letzten 30 Jahre meines Lebens die Außenpolitik verfolgt und will Ihnen eine kleine Übersetzungshilfe geben.\n\nIch habe die Äußerung des US-Außenministers gehört, dass nach Ihren Gesprächen in den USA zu Nord Stream 2 Deutschland nun am Verhandlungstisch angekommen sei: Das ist an sich, auf Deutsch übersetzt, auf diplomatischem Niveau so ungefähr das niedrigste Level an Geringschätzung, das Sie erreichen können. Meine Frage ist: Wie interpretieren Sie denn die Äußerung von Herrn Blinken, Sie seien dank der Würde des amerikanischen Außenministers jetzt bei diesem deutsch-russischen Projekt am Verhandlungstisch angekommen?"
"1062056","Armin Paulus","Hampel","AfD","Member of Parliament","2021-06-09T00:00:00.000Z","https://dip21.bundestag.de/dip21/btp/19/19232.pdf","\n\nSie haben meine Frage nicht beantwortet, wie Sie die Äußerung interpretieren, Sie seien am Verhandlungstisch angekommen.\n\nAber Herr Blinken hat Ihnen ja schon so ein bisschen den Weg gewiesen, wie man das Problem vom Eis kriegen könnte. Wenn ich das richtig interpretiere: Die möglichen Ausfälle für die Ukraine durch weniger Gastransfers durch Ihre Pipeline erzeugt in Kiew ein Milliardendefizit. – Wenn ich Herrn Blinken richtig interpretiere, hat er uns schon dafür ausersehen, dass wir mögliche Ausfälle der Ukraine dann finanziell entschädigen sollen."
"1062071","Armin Paulus","Hampel","AfD","Member of Parliament","2021-06-09T00:00:00.000Z","https://dip21.bundestag.de/dip21/btp/19/19232.pdf","\n\nDanke, Herr Präsident. – Herr Minister, ich war bei der Rede in Sankt Petersburg anwesend. Putin hat dort nicht von einer geopolitischen Dimension gesprochen, er hat sogar konkret auf die wirtschaftliche Perspektive der Nord-Stream-2-Leitung hingewiesen. Er hat gesagt: Es ist für Deutschland wie für Russland ein Projekt, das unter rein wirtschaftlichem Nutzen zu sehen ist. Erstens: Das Gas ist billiger. Zweitens – für die Klimafreunde –: Es wird auch noch in einer Art und Weise gefördert, die im Gegensatz zum Fracking in den USA sehr viel umweltweltschonender ist.\n\n({0})\n\nSie haben jetzt noch mal die Ukraine bewertet. Der Präsident hat ja auch ausgeführt: Wenn die Ukraine ihre Verträge einhält – 40 Milliarden Kubikmeter Gas sollen transportiert werden –, geht es weiter. Noch mal konkret: Wenn dies aus irgendwelchen Gründen, die vielleicht die Ukraine zu verantworten hat, nicht der Fall ist, wird sich die Bundesregierung dagegen wehren, dass sie eventuelle Ausfallkosten der Ukraine begleicht?"
"1062105","Stephan","Brandner","AfD","Member of Parliament","2021-06-09T00:00:00.000Z","https://dip21.bundestag.de/dip21/btp/19/19232.pdf","\n\nNur um das für mich und die Zuschauer etwas zu erhellen: Ich habe jetzt gerade gehört: Die Verhandlungen wären abgeschlossen. – Ihre einleitenden Worte habe ich auch so verstanden. Dann haben Sie gesagt: Es könnte auch noch etwas mehr sein, nicht ganz so viel, wie gefordert wird. – Das sind diese knapp 500 Milliarden Euro. Deshalb meine Frage: Sind die Verhandlungen abgeschlossen, ja oder nein? Und wenn nicht: Wer verhandelt auf welcher Grundlage nach, und welchen Spielraum sehen Sie da noch?\n\nUnd in dem Zusammenhang noch mal die Bemerkung, dass wir als Deutschland ja sehr häufig Reparations- oder anderen Forderungen ausgesetzt sind, sei es aufgrund des Zweiten Weltkriegs, sei es aufgrund des Ersten Weltkriegs, sei es jetzt aufgrund der Kolonialvergangenheit.\n\n({0})\n\nKönnen Sie uns kurz mal schildern, welche anderen Länder oder Gruppen noch Reparationsforderungen auf welcher Grundlage an Deutschland stellen?"
"1062108","Siegbert","Droese","AfD","Member of Parliament","2021-06-09T00:00:00.000Z","https://dip21.bundestag.de/dip21/btp/19/19232.pdf","\n\nDanke, Herr Präsident. – Sehr geehrter Herr Außenminister, ich möchte auf die Östliche Partnerschaft zu sprechen kommen. Wir sind der Meinung, dass dort eine Neubewertung vorzunehmen wäre, idealerweise unter dem Leitgedanken „Kooperation statt Konfrontation“. Sie selber waren vor gar nicht so langer Zeit noch mit Äußerungen bezüglich Russlands zu vernehmen – man hat das von Ihnen gehört –, dass auch die Beziehungen zu Russland einer Überprüfung unterzogen werden sollten und gegebenenfalls eine Neuausrichtung vorgenommen werden sollte. Ich möchte anmerken, dass die Östliche Partnerschaft natürlich ohne die Berücksichtigung vitaler Interessen Russlands sicherlich nicht neu zu gestalten ist. Konkrete Frage: Wie ist der aktuelle Standpunkt Ihres Hauses in der Frage der Östlichen Partnerschaft?"
"1062159","Stefan","Keuter","AfD","Member of Parliament","2021-06-09T00:00:00.000Z","https://dip21.bundestag.de/dip21/btp/19/19232.pdf","\n\nFrau Präsidentin! Meine sehr geehrten Damen und Herren! Die letzten Jahre haben wir von den Linken hier nicht viel Vernünftiges gehört.\n\n({0})\n\nAn dieser Stelle möchte ich mich bei Ihnen – Frau Sommer, hören Sie mal zu! – ausdrücklich bedanken,\n\n({1})\n\ndass Sie dieses Thema auf die Tagesordnung gebracht haben; denn es ist extrem wichtig.\n\nDas Maskenthema beschäftigt uns schon länger. Wir haben eine ganze Menge Anfragen diesbezüglich an die Regierung gestellt. Aus dem Hause Spahn kam da nicht viel – nur sehr viel heiße Luft: Die parlamentarischen Anfragen wurden meistens durch die Staatssekretärin Weiss abgetan. Wir haben hier keine Antworten der Bundesregierung erhalten.\n\nWenn man etwas mehr über diesen ganzen Maskenskandal erfahren möchte, muss man recherchieren,\n\n({2})\n\nund meine Fraktion hat recherchiert: Wir haben Lieferanten kontaktiert, wir haben Zuträger gehabt, wir haben Zuträger – passen Sie auf! – aus der Bundesregierung gehabt, von ihrem Rechtsberater, Ernst & Young, und hier sind Unterlagen ans Tageslicht gekommen, die schwer belastend und schwer beschämend für diese Bundesregierung sind.\n\nSchauen wir uns an, wie die Masken beschafft worden sind: Vor einem Jahr, März/April letzten Jahres sind Verträge geschlossen worden mit Unternehmen wie Lufthansa, BASF, Otto etc. Die Verträge liegen hier vor. Das sind 16-seitige Verträge, die relativ ordentlich geschlossen sind.\n\nBei dieser Recherche sind aber auch andere Verträge aufgetaucht, unter anderem Verträge mit einer FIEGE Logistik Stiftung & Co. KG, die dann übertragen worden sind auf eine FIEGE International Beteiligungs-GmbH, eine klitschige GmbH, FIB abgekürzt, die vor Vertragsschluss 40 Millionen Euro aufs Konto überwiesen bekommen hat. Das ist ein Skandal sondergleichen, Herr Spahn.\n\n({3})\n\nDiese Verträge sind geschlossen worden. Hier stehen zwei Blätter Papier für über eine halbe Milliarde Euro Beschaffungsvolumen. Hier sind in Wildwestmanier Verträge geschlossen worden, wo noch nicht einmal ein Stempel vorhanden war; da ist handschriftlich „FIB GmbH“ ergänzt worden. Das ist unwürdig, hier sind Betrug Tür und Tor geöffnet.\n\n({4})\n\nIch frage mich: Warum ist die FIB GmbH oder FIEGE überhaupt ausgewählt worden? Herr Spahn, hängt das damit zusammen, dass hier persönliche Bekanntschaften bestehen, dass das Ihr Nachbarwahlkreis ist? Die FIEGE Logistik hat überhaupt gar keine Expertise in der Logistik, die hier gefordert wird – wo es darum ging, Schutzausrüstung einzufliegen –, hat keine eigenen Flugzeuge. Ein Rahmenvertrag, der am 31. März 2020 geschlossen wurde, ist übertragen worden auf die FIB. Es ist dann drei Tage später, am 02. April 2020, noch einmal ein Preisnachschlag von 10 Cent vereinbart worden.\n\nBei Gesprächen mit Lieferanten ist mir versichert worden, dass es üblich ist, wenn noch ein Zwischenhändler mitverdienen will, dass das immer in 10-Cent-Schritten passiert. Da frage ich mich: Wer hat hieran noch mitverdient? Das Volumen alleine dieses FIEGE-Vertrages, dieses Rahmenvertrages, liegt bei 545 Millionen Euro. Die Konditionen sind ein Traum: Erfüllungsort: Shanghai; keine Frachtkosten; man musste keine Verzollung machen; man musste sich nicht um Zertifikate kümmern, darum, wie die Ware ins Land kommt. Vereinbart waren FFP2-Masken. Soweit ich weiß, war nur ein ganz geringer Bruchteil dessen, was durch die Bundesregierung eingeflogen wurde, tatsächlich FFP2-Masken. Man ist dem Problem entgangen, indem man selber als Inverkehrbringer aufgetreten ist.\n\nLieferanten bestätigten mir, dass der Markt im März/April letzten Jahres maximal 2 Euro für FFP2-Masken – verzollt, inklusive Fracht – und Einfuhrumsatzsteuer hergab. Diese Masken, die die Bundesregierung beschafft und in Verkehr gebracht hat, waren mangelhaft, grob mangelhaft. Insbesondere bemängelt wurde bei den Schnelltests ein Partikeldurchlass. Zulässig waren 6 Prozent, die Masken wiesen in der Regel um die 15 Prozent auf.\n\nAußerdem taucht immer wieder ein Name auf, eine kleine Bude aus der Schweiz, Emix, mit der die Bundesregierung Milliardenverträge geschlossen hat. Hier möchte ich auch gerne einmal hinter die Kulissen schauen und gucken, was da tatsächlich passiert ist.\n\nIm Gegenzug hat die Bundesregierung ein Open-House-Verfahren ausgeschrieben. 100 Lieferanten sind heute immer noch nicht bezahlt. 1 Milliarde Euro ist hier noch strittig. Man hat sich wieder mal seines Partners EY Law bedient, um diese Forderung abzuwehren. Hier stehen Existenzen von Kleinlieferanten auf dem Spiel, die alles verpfändet haben, um der Bundesregierung aus einer Krise zu helfen und Schutzausrüstung zu beschaffen. Mit juristischen Winkelzüge ziehen Sie sich jetzt auf ein Fixgeschäft zurück. Ich sage Ihnen: Mit den Unterlagen, die aus Ihrem Hause gekommen sind, lässt sich dieses Fixgeschäft kippen.\n\n({5})\n\nAußerdem: Wie laufen diese Beschaffungsketten? Es tauchen immer wieder Namen auf: Monika Hohlmeier, die Strauß-Tochter. Ich erinnere nur an die Amigo-Affäre: Man kennt sich, man hilft sich. Das ist offensichtlich hängen geblieben. Mir sind dazu Protokolle vorgelegt worden. Frau Hohlmeier empfiehlt an Emmi Zeulner, die wiederum gute Kontakte zum Bundesministerium hat. So kürzt man Beschaffungsprozesse ab.\n\nIch sage Ihnen: Der Fisch ist zum Teil ausgenommen worden. Die CDU hat sich bereits von einigen ihrer Abgeordneten getrennt, die sich persönlich bereichert haben oder bei denen der Verdacht im Raume steht.\n\n({6})\n\nDer Fisch stinkt aber immer vom Kopf, und hier in diesem Hause ist noch viel zu viel Verwesungsgeruch.\n\n({7})\n\nWir haben hier in ein Wespennest gestochen."
"1062111","Siegbert","Droese","AfD","Member of Parliament","2021-06-09T00:00:00.000Z","https://dip21.bundestag.de/dip21/btp/19/19232.pdf","\n\nSehr gerne eine Nachfrage, Herr Präsident. – Herr Außenminister, der Westen, zu dem ja Deutschland zweifelsohne zählt, hat den sogenannten Arabischen Frühling unterstützt. Das Ergebnis: Krieg, Chaos, Millionen von Flüchtlingen. Der Westen hat ebenfalls die Orangene Revolution in Kiew in der Ukraine unterstützt. Die Ergebnisse sind: an sich genauso viel Korruption und Misswirtschaft wie vorher. Viele Politiker aus der politischen Welt sagen, dass auch Herr Selenskyj mit Sicherheit nicht viel demokratischer ist als seine Vorgänger. Die Frage ist konkret: Ist die Strategie der Einmischung, vielleicht auch mit dem Ziel, einen Regimewechsel, einen Regime Change, herbeizuführen, nicht völlig kontraproduktiv und eigentlich als gescheitert anzusehen? – Danke."
"1062161","Stefan","Keuter","AfD","Member of Parliament","2021-06-09T00:00:00.000Z","https://dip21.bundestag.de/dip21/btp/19/19232.pdf","\n\nIch komme zum Ende, Frau Präsidentin. – Ich sage Ihnen: Wir werden diese Sache noch aufarbeiten müssen. Das schreit nach einem Untersuchungsausschuss – leider erst nach der Bundestagswahl. Ich bin sicher: Das ist nicht nur ein Fall für den Untersuchungsausschuss, sondern auch noch für den Staatsanwalt.\n\nUnser Vorsitzender sagte: Wir werden sie jagen."
"1062163","Stefan","Keuter","AfD","Member of Parliament","2021-06-09T00:00:00.000Z","https://dip21.bundestag.de/dip21/btp/19/19232.pdf","\n\nJa. – Herr Bundesminister, Sie wissen jetzt, was jagen bedeutet.\n\nVielen Dank.\n\n({0})"
