id,firstname,lastname,faction,position,date, url,speech
"1074954","Norbert","Kleinwächter","AfD","Member of Parliament","2022-07-06T00:00:00.000Z","https://dip21.bundestag.de/dip21/btp/20/20046.pdf","\n\nWerter Herr Präsident! Eure Exzellenz! Werte Kolleginnen und Kollegen! Kroatien will den Euro einführen. Ich bitte die Bundesregierung darum, das im Rat abzulehnen; denn Kroatien ist nicht reif für den Euro, und die Eurozone ist nicht reif für Kroatien.\n\n({0})\n\nIch weiß nicht, ob Sie es mitbekommen haben, aber selbst die „Tagesschau“ berichtet, dass wir wieder mitten in einer Eurokrise sind. Finanzexperten sehen das Ende des Euros kommen.\n\n({1})\n\nVersprochen hatte uns Helmut Kohl ja einen Euro mit unbedingter Haushaltsdisziplin, mit strikter Preisstabilität, wie es der D‑Mark würdig sein sollte. Bekommen haben wir eine Schrottwährung. Die EZB macht permanente Rettungspolitik, druckt hemmungslos Geld, um Italien, Frankreich, Spanien zu retten, die sich verschulden ohne Ende. Und, wen wundert’s: Italien ist schon wieder pleite und weiß nicht, wie es sich finanzieren soll.\n\nDafür hat Deutschland Target2-Salden in Höhe von 1,16 Billionen Euro.\n\n({2})\n\nEin kleiner Hinweis: Das entspricht einem Fünftel des Gesamtwerts aller Wohnimmobilien in Deutschland. Da brauchen Sie nicht zu lachen in der Union. Meine Damen und Herren, das bedeutet nämlich: Wir haben faktisch jedes fünfte Haus an irgendeinen Schuldenstaat verliehen; zumindest vom Wert her.\n\n({3})\n\nKein Wunder, dass der Euro an den Börsen auf Talfahrt geht. Bezahlen müssen all das die Bürger mit einer mörderischen Inflation und völlig unerschwinglichen Wohneigentumspreisen. Der Euro bedeutet Armut für alle.\n\n({4})\n\nMit dem Euro, verehrte Kolleginnen und Kollegen, haben Sie sich am Wohlstand der Deutschen versündigt.\n\n({5})\n\nUnd Sie sündigen weiter, wenn Kroatien nun in den Euroraum aufgenommen wird; denn Kroatien ist das neue Griechenland,\n\n({6})\n\nund zwar nicht deshalb, Eure Exzellenz, weil es die Statistiken selbst schönt, sondern weil die EU-Kommission es sich selbst schönrechnet. Die Kommission, Herr Krichbaum, schummelt im Konvergenzbericht.\n\n({7})\n\nEines der wesentlichen Kriterien ist doch die langfristige Preisstabilität, und die richtet sich laut der Verträge an den besten drei Euroländern aus. 4,7 Prozent hat man für Kroatien an Inflation berechnet über die Zwölfmonatssichtweise. Tja, dumm nur, dass Malta und Portugal um die 2 Prozent haben, Kroatien damit die Konvergenzkriterien nicht erfüllt hätte. Deswegen hat die Kommission da mal eben beschlossen: Malta und Portugal sind Outliers, sind Ausreißer; die sind zu gut. Kein Wunder: Kroatien hätte sonst nicht bestanden.\n\n({8})\n\nWie auch? Wie auch mit einer tatsächlichen Inflation, wie wir sie im Mai 2022 gesehen haben, mit einer Preissteigerung um 10,7 Prozent im Vergleich zum Vorjahresmonat? Da ist nichts mit langfristiger Preisstabilität. Da ist nichts mit der Erfüllung der Konvergenzkriterien, meine Damen und Herren.\n\n({9})\n\nDas ist übrigens genauso wie bei den Staatsschulden. Die sollen ja laut Vertrag langfristig tragfähig sein, maximal 60 Prozent des BIPs. Sie kennen die Grenze aus dem Vertrag von Maastricht. Die hat Kroatien seit 2011 nie wieder erreicht und wird sie auch nie wieder erreichen; es steht bei 79,8 Prozent des BIP. Die EU sieht die Schuldenregel interessanterweise trotzdem als erfüllt an, und zwar wegen der sogenannten Zwanzigstelregel. Das heißt, dass ein Zwanzigstel der über der Marke von 60 Prozent vom BIP liegenden Schulden jährlich abgetragen werden muss. Und Kroatien hat das tatsächlich einmal gemacht, nämlich 2021. Da waren ungefähr 590 Millionen Euro zurückzuzahlen. Das ging ja auch mit einer schönen Finanzspritze aus Brüssel. 2021 hat Kroatien nämlich 818 Millionen Euro aus „Next Generation EU“ erhalten. Was nicht passt, wird passend gemacht. Das ist die Position der EU.\n\n({10})\n\nVon Artikel 126 AEUV, wonach die Schulden erheblich und laufend zurückgehen müssten, ist natürlich keine Rede. Verheerend sind auch die anderen Werte: BIP pro Kopf weniger als die Hälfte der EU, ungefähr ein Drittel Deutschlands; Handelsbilanz negativ, Leistungsbilanz negativ, Korruption grassiert, Rechtsstaatlichkeit schlecht, Gesetzgebung schlecht. Das sagt sogar die EU in ihrem Konvergenzbericht.\n\nMeine Damen und Herren, ich hoffe, ich habe Ihnen hinreichend dargetan: Kroatien gehört nicht in einen Währungsverbund und erst recht nicht in einen Haftungsverbund mit Deutschland. Der Beitritt Kroatiens wird die Probleme des Euro noch weiter verstärken. Dann ist eine Rettung Kroatiens vorprogrammiert.\n\n({11})"
"1074959","Norbert","Kleinwächter","AfD","Member of Parliament","2022-07-06T00:00:00.000Z","https://dip21.bundestag.de/dip21/btp/20/20046.pdf","\n\nHerr Dr. Lieb, was Sie gerade gesagt haben, passt nicht zu dem ersten Teil Ihrer Rede, wo Sie im Endeffekt ein bisschen auf mich losgegangen sind.\n\nSie haben gerade die Verträge erwähnt. Ich finde die Verträge außerordentlich wichtig; denn gerade Artikel 126 und Artikel 140 AEUV regeln ja sehr klar, was von den Beitrittskandidaten in Bezug auf die Konvergenzkriterien entsprechend verlangt wird. Wenn zum Beispiel ganz klar drinsteht, dass sich die Staatsschulden erheblich und langfristig mindern müssen, und zwar auf ein Niveau, das dem Referenzwert entspricht – das sind 60 Prozent des BIP –, dann müssen Sie doch eigentlich zugeben, dass Kroatien, das im Moment 79,8 Prozent des BIP Staatsverschuldung hat, das bei deutlich über 80 Prozent Staatsverschuldung war, von der die EU-Kommission schon in ihren relativ positiven Berechnungen sagt, dass sie eigentlich nicht wesentlich unter 72 Prozent kommen wird –\n\n({0})"
"1074961","Norbert","Kleinwächter","AfD","Member of Parliament","2022-07-06T00:00:00.000Z","https://dip21.bundestag.de/dip21/btp/20/20046.pdf","\n\n– ich stelle eine Frage –, und die weiter steigen wird, diese Kriterien nicht erfüllt. Wie kommen Sie dann auf die Idee, hier die Erfüllung der Konvergenzkriterien zu postulieren, wo Sie von Anfang an eben nicht erfüllt sind?"
"1074972","Martin","Sichert","AfD","Member of Parliament","2022-07-06T00:00:00.000Z","https://dip21.bundestag.de/dip21/btp/20/20046.pdf","\n\nHerr Präsident! Meine Damen und Herren! 2,5 Millionen Patienten hatten 2021 so schwere Impfnebenwirkungen, dass sie ärztliche Hilfe gesucht haben. Das sind mehr als 30‑mal so viele wie in den Vorjahren, in denen es maximal 77 000 gab. Von 77 000 auf 2,5 Millionen, das heißt: Es waren in den Vorjahren immer weniger, als Lüdenscheid Einwohner hat; letztes Jahr hingegen waren es mehr Fälle, als Hamburg und Bremen zusammen an Einwohner haben – 2,5 Millionen!\n\nUnd das ist nur die Spitze des Eisbergs; das sind nur die erfassten Fälle von Kassenpatienten bei Kassenärzten. Die Nebenwirkungen von Privatpatienten oder die Nebenwirkungen, die in Krankenhäusern erfasst wurden, kommen obendrauf. Auch die vielen Fälle, in denen Patienten mit Impfnebenwirkungen nicht ernst genommen wurden und in denen die Ärzte den Patienten gesagt haben, die Nebenwirkung habe nichts mit der Impfung zu tun, fehlen. Bei 2,5 Millionen dokumentierten Fällen ist also noch von einer hohen Dunkelziffer weiterer Fälle auszugehen.\n\n({0})\n\nJa, ich weiß – und ich höre es hier jetzt auch wieder –: Sie versuchen, es kleinzureden.\n\n({1})\n\nDas Standardargument wird sein, dass es mehr Impfungen gab. Das ist ein ganz schwaches Argument; denn es waren nur viermal so viele Impfungen wie im Vorjahr, aber es gab mehr als 30‑mal so viele Nebenwirkungen. Das heißt, die Zahl der Nebenwirkungen, die so schwer waren, dass jemand deswegen beim Arzt war, ist um 800 Prozent gestiegen. Und noch einmal: Wir reden hier von Millionen Betroffenen.\n\n({2})\n\nDas nächste Argument wird sein, dass die Impfung weniger erprobt ist. Ja, aber genau das ist doch das beste Argument dafür, endlich alle Daten zu den Nebenwirkungen zu erheben und auszuwerten. Genau weil diese Impfstoffe ein medizinisches Experiment sind, ist es unverantwortlich, weiter im Blindflug unterwegs zu sein.\n\n({3})\n\nUnd dann wird kommen: Ja, die Nebenwirkungen sind wahrscheinlich alle harmlos.\n\n({4})\n\nWir alle wissen nicht, was es für Nebenwirkungen sind. Es könnten 2,5 Millionen Fälle von Hautausschlag oder von Juckreiz sein, es könnten aber auch 2,5 Millionen Fälle von Krebs- und von Herzerkrankungen sein. Niemand weiß es, und das ist der eigentliche Skandal.\n\n({5})\n\nWir haben Millionen Fälle von Impfnebenwirkungen, und die Daten dazu werden nicht ausgewertet. Letzten Freitag erst teilte mir die Bundesregierung mit – ich zitiere –:\n\nEine … Auswertung … zur Angabe der Art der … Nebenwirkung … liegt nicht vor.\n\nDabei hat die Regierung gemäß Infektionsschutzgesetz sogar die Pflicht, die Daten der Kassenärztlichen Vereinigungen auszuwerten. Diese Regierung tritt nicht nur den Rechtsstaat, sondern auch die Gesundheit von Millionen Bürgern mit Füßen. Damit muss endlich Schluss sein.\n\n({6})\n\nEs muss analysiert werden, welche Symptome und Krankheitsbilder die Menschen haben, die unter Impfnebenwirkungen leiden. Die Ergebnisse dieser Analyse müssen dann veröffentlicht und insbesondere den Ärzten mitgeteilt werden, damit die Impfgeschädigten endlich ernst genommen werden. Es muss eine Infrastruktur aufgebaut werden, um Impfgeschädigten schnell zu helfen.\n\n({7})\n\nUnd es ist unverantwortlich, dass Impfgeschädigte monatelang auf Termine bei Fachärzten warten müssen.\n\nDie Regierung hat hier eine besondere Verantwortung; denn sie hat den Menschen versprochen, dass die Impfung sicher ist. 2,5 Millionen Impfgeschädigte sind ein deutlicher Beweis dafür, dass die Impfung eben nicht sicher ist.\n\n({8})\n\nIch möchte mit zwei emotionalen Einzelfällen enden. Ich war neulich bei einer jungen Frau, die eine Organspende benötigt und deren Lebenstraum ein eigenes Kind ist. Die hat das Krankenhaus knallhart erpresst. Man hat ihr gesagt, wenn sie sich nicht impfen lässt, nehme man sie nicht auf und mache nicht die Untersuchungen, die sie benötigt, um auf die Warteliste für eine Organspende zu kommen. Seit der Impfung spielt ihr Zyklus verrückt, und sie weiß nicht, ob sie überhaupt noch ein Kind bekommen kann. Der Lebenstraum dieser Frau wurde zerstört.\n\nIch habe mehrere Stunden bei einer Mutter gesessen, die nach der Coronaimpfung ihre lebensfrohe, gesunde Tochter verloren hat. Das Mädchen ist beim Abendessen einfach so, aus dem Nichts tot umgefallen. „Postvakzinale Myokarditis“ sagte dazu der Arztbrief.\n\nIch verspreche Ihnen eines: Es ist egal, wie oft Sie sagen: „Der sollte das nicht sagen“ und: „Die AfD sollte aufhören, darüber zu reden“. Ich und meine Fraktion, wir fühlen eine besondere Verantwortung. Die gesamte AfD, wir werden nicht ruhen, bis man aufhört, gesunde Menschen gegen ihren Willen zu nötigen, an einem medizinischen Experiment teilzunehmen.\n\n({9})\n\n– Setzen Sie sich endlich mal mit den Fakten auseinander.\n\n({10})"
"1075145","Leif Erik","Holm","AfD","Member of Parliament","2022-07-07T00:00:00.000Z","https://dip21.bundestag.de/dip21/btp/20/20047.pdf","\n\n– es ist dringend , bevor wir in eine große Krise hineinrutschen!\n\n({0})"
"1074999","Kay Uwe","Ziegler","AfD","Member of Parliament","2022-07-06T00:00:00.000Z","https://dip21.bundestag.de/dip21/btp/20/20046.pdf","\n\nVielen Dank, dass Sie die Zwischenintervention zulassen. – Ich habe an Sie nur eine Frage. Sie sagten eben in der Einleitung zu Ihrer Rede, dass Sie die Impfung für sehr wirksam halten. Ich habe für Sie folgende Frage: Die Sieben-Tage-Inzidenz heute beträgt 678 laut RKI, vor einem Jahr lag sie am selben Tag bei 4,9, und im Jahr davor lag sie bei 2,9. Können Sie mir bitte aus medizinischer Sicht erklären, wie man nach anderthalb Jahren Impfkampagne zu so einer Inzidenz kommt und was das mit einer sicheren und zuverlässigen Impfung zu tun hat?\n\nVielen Dank.\n\n({0})"
"1075012","Marc","Bernhard","AfD","Member of Parliament","2022-07-07T00:00:00.000Z","https://dip21.bundestag.de/dip21/btp/20/20047.pdf","\n\nFrau Präsidentin! Meine Damen und Herren! Sie von der Ampel wollen heute beschließen, dass zukünftig 2 Prozent der Fläche Deutschlands ausschließlich für Windindustrieanlagen bereitgestellt werden.\n\n({0})\n\nStand heute haben wir 31 000 dieser Anlagen und benötigen dafür 0,5 Prozent der Landesfläche. Jetzt vervierfachen Sie diese Fläche, sodass zukünftig bis zu 120 000 dieser Anlagen auch in unmittelbarer Nähe von Wohngebieten gebaut werden können.\n\n({1})\n\nEs handelt sich hierbei eben nicht um romantische Windrädchen, sondern um Monsteranlagen mit einer Gesamthöhe von über 240 Metern.\n\n({2})\n\nDas ist ungefähr so, als wenn man auf dem Kölner Dom einen Propeller mit 160 Metern Durchmesser anbringen würde. Und sollten die Länder es nicht schaffen, die von Ihnen vorgegebenen Flächenquoten zu erfüllen, fallen die Mindestabstände zu Wohnhäusern. Damit können solche Giganten zukünftig auch auf der Wiese 500 Meter vor jedem Wohnhaus stehen. Dafür sorgt Ihr Gesetz.\n\n({3})\n\nWo sollen denn sonst die 90 000 weiteren Windindustrieanlagen hingestellt werden?\n\n({4})\n\nWenn man sich den Windatlas meiner Heimat Baden-Württemberg anschaut, sieht man: Da kommen eigentlich nur der Schwarzwald und die Schwäbische Alb infrage.\n\n({5})\n\nDie Pläne der Ampel werden also unweigerlich dazu führen, dass große Teile des Schwarzwalds abgeholzt werden.\n\n({6})\n\nDenn für jede Windindustrieanlage müssen 1,5 Hektar Wald gerodet werden.\n\n({7})\n\nWenn Sie also in Zukunft von Karlsruhe 200 Kilometer durch die Ferienregion zur Schweizer Grenze fahren, sehen Sie Kilometer für Kilometer nur noch Windrad an Windrad.\n\nWährend die Grünen gegen die Rodung von läppischen 100 Hektar im Hambacher Forst protestiert haben, fordern sie jetzt bei der Windkraft das Abholzen von Zehntausenden Hektar Wald und schaffen zudem die Mindestabstände zu Wohnhäusern praktisch ab.\n\n({8})\n\nDabei ist ihnen ganz offensichtlich völlig egal, dass Menschen, die im Umfeld von Windindustrieanlagen wohnen, unter Infraschall und zermürbenden Lichtreflexen leiden,\n\n({9})\n\nganz zu schweigen von den zahllosen Tieren, die in diesen Industrieanlagen Tag für Tag geschreddert werden. Jedes Jahr sind es 250 000 Fledermäuse, 600 000 Vögel wie Störche, Rotmilane und Bussarde sowie 6 Milliarden Bienen, Käfer und andere Insekten.\n\n({10})\n\nUnd wofür opfern Sie das? Für eine rein ideologiebasierte Energiewende, die unsere Energiesicherheit massiv gefährdet und dazu führt, dass wir die höchsten Strompreise der Welt haben.\n\n({11})\n\nDabei wäre es doch so einfach, wenn wir das machen würden, was der Rest der Welt macht, nämlich die drei aktiven Kernkraftwerke weiterlaufen lassen,\n\n({12})\n\ndie drei kürzlich abgeschalteten wieder in Betrieb nehmen, unsere Kohlekraftwerke weiterlaufen lassen und in moderne Kraftwerkstechnologien und synthetische Kraftstoffe investieren.\n\n({13})\n\nErst vorgestern hat das EU-Parlament bestätigt, dass es sich bei der Kernenergie um eine grüne und nachhaltige Technologie handelt.\n\n({14})\n\nDeshalb hat Belgien die Laufzeiten seiner Kernkraftwerke um zehn Jahre verlängert. Frankreich plant 14 neue,\n\n({15})\n\nGroßbritannien 6, und in Finnland haben die Grünen den Bau von Kernkraftwerken in ihr Parteiprogramm aufgenommen.\n\n({16})\n\nDeutschland ist also mal wieder der Geisterfahrer in Europa, meine sehr geehrten Damen und Herren.\n\n({17})\n\nAnstatt Umwelt, Arbeitsplätze und Energiesicherheit zu zerstören, müssen wir jetzt endlich diese Geisterfahrt stoppen.\n\nHerzlichen Dank.\n\n({18})"
"1075032","Andreas","Bleck","AfD","Member of Parliament","2022-07-07T00:00:00.000Z","https://dip21.bundestag.de/dip21/btp/20/20047.pdf","\n\nWerte Frau Präsidentin! Werte Kolleginnen und Kollegen! Eins vorweg: Das Osterpaket der Bundesregierung ist einer der größten politischen Anschläge auf den Artenschutz\n\n({0})\n\nseit Gründung des Bundesumweltministeriums,\n\n({1})\n\nund das nicht trotz, sondern wegen der grünen Bundesminister. Es ist doch entlarvend, dass kein einziger Redner den Artenschutz hier einmal länger thematisiert hat als in einem einzigen Satz.\n\n({2})\n\nFrüher ging es noch darum, den Artenschutz zu stärken. Jetzt geht es nur noch darum, den Artenschutz für die Energiewende zu schwächen.\n\n({3})\n\nDie Abhängigkeit von russischem Öl und Gas durch die Abhängigkeit von Wind und Sonne zu ersetzen, darauf kann man nur als Grüner kommen.\n\n({4})\n\nAber es ist erstaunlich: Offensichtlich kann man auch ohne die Kernenergie verstrahlt sein.\n\n({5})\n\nDie Art und Weise, wie die Regierung das Gesetzgebungsverfahren durchgeführt hat, stellt eine grobe Missachtung der Rechte der Opposition dar. Bei der Sondersitzung des Umweltausschusses wurden Änderungsanträge erst kurz vorher oder lange nach Beginn an die Ausschussmitglieder verschickt. Kein Ausschussmitglied der Oppositionsfraktionen hatte überhaupt die Chance, diese Änderungsanträge, die bis zu 328 Seiten umfassten, zu lesen – geschweige denn zu verstehen.\n\n({6})\n\nTrotzdem wurde darüber abgestimmt. Das, werte Kolleginnen und Kollegen, ist eine Farce und ein Armutszeugnis für den Parlamentarismus.\n\n({7})\n\nDoch auch artenschutzfachliche Gründe sprechen gegen das Osterpaket. Egal welchen der Gesetzentwürfe man sich anschaut: Bei jedem wird deutlich, dass die Bundesregierung dem Klimaschutz höhere Priorität einräumt als dem Artenschutz. So wird ausschließlich der Bau von sogenannten erneuerbaren Energien als öffentliches Interesse und als Fall für die öffentliche Sicherheit eingestuft,\n\n({8})\n\nnicht jedoch der Erhalt der biologischen Vielfalt. Abstände von kollisionsgefährdeten Brutvogelarten zu Windkraftanlagen werden drastisch reduziert. Das ist gar nicht artenschutzfachlich hergeleitet, sondern das ist politische Willkür zulasten unserer Natur.\n\n({9})\n\nDas ornithologische Fachwissen der staatlichen Vogelschutzwarten wird ignoriert. Der Fledermausschutz hat im Gesetzentwurf keine Bedeutung.\n\nDarüber hinaus führt die Bundesregierung nur 15 Arten in der Liste kollisionsgefährdeter Brutvogelarten auf. Das verstößt eindeutig gegen das europäische Recht, das in der Vogelschutzrichtlinie den Schutz aller geschützten Vogelarten vorsieht.\n\n({10})\n\nDamit setzen wir uns einem Vertragsverletzungsverfahren aus.\n\nDie Ausweisung von 2 Prozent der Fläche Deutschlands für den Bau von Windindustrieanlagen wird nicht nur Freiflächen, sondern zunehmend auch Wälder und Schutzgebiete unter Druck setzen. Deswegen gilt auch hier: Lieber einen grünen Wald als einen Grünen im Wald.\n\n({11})\n\nSumma summarum: Die Bundesregierung hat ihren Worten keine Taten folgen lassen. Sie hat viel angekündigt und ist an ihren eigenen Ansprüchen gescheitert. Mit ihrem Osterpaket legt die Bundesregierung uns also vier faule Eier ins Nest. Auf dieses unerwünschte und verspätete Geschenk können wir verzichten, und deshalb werden wir die Gesetzentwürfe ablehnen.\n\nVielen Dank.\n\n({12})"
"1075051","Dirk","Brandes","AfD","Member of Parliament","2022-07-07T00:00:00.000Z","https://dip21.bundestag.de/dip21/btp/20/20047.pdf","\n\nSehr geehrte Frau Präsidentin! Meine sehr verehrten Kolleginnen und Kollegen! Es ist schon erstaunlich, wie Sie es schaffen, wirklich jedes Thema dafür zu nutzen, um Ihre Migrationssucht zu befriedigen.\n\nDer Personalnotstand und die damit verbundenen Einschränkungen für den Luftverkehr fassen die Gesamtsituation unseres Landes perfekt zusammen: Arbeiten scheint sich für viele nicht mehr zu lohnen. Was früher in Deutschland selbstverständlich war und funktioniert hatte, funktioniert heute nicht mehr. Dass die Menschen aus ihren Jobs an den Flughäfen flüchten, ist allein auf das Regierungsversagen der jetzigen und der Vorgängerregierung zurückzuführen, meine Damen und Herren.\n\n({0})\n\nCoronahysterie, luftverkehrsfeindliche Politik, Verbot von Inlandsflügen – das sind grüne Zutaten für das Flughafenchaos, das jetzt besteht. Statt der Luftfahrt eine sichere Planungsperspektive zu bieten, bereiten unsere unter Carbonphobie leidenden Politiker die Wirtschaft und die Bürger schon auf die neuen Einschränkungen im Herbst vor. Wohlgemerkt: als einzige westliche Industrienation. Wie wollen Sie da erwarten, dass Tausende ehemalige Mitarbeiter, die inzwischen einen anderen Job in vermeintlich sichereren Branchen gefunden haben, unter diesen Umständen wieder zurück an die Flughäfen kommen? Das ist eine Illusion. Aber wie ich sehe, haben Sie das ja auch gar nicht so geplant.\n\nDas Chaos an den Flughäfen haben definitiv Sie zu verantworten. Für die Sicherheitskontrollen von Passagieren und Handgepäck sind nicht die Airlines und Flughäfen verantwortlich, sondern die Bundespolizei. Vor Monaten wies ich Frau Faeser und ihr Innenministerium in einem an sie gerichteten Schreiben auf die nun real gewordenen Zustände hin. Es passierte damals nichts – nichts außer Beschwichtigung. Trotz aller Warnungen durch die Bundespolizeigewerkschaft wurden Sicherheitskontrollen – übrigens ein Teilbereich der Terrorbekämpfung – an private Sicherheitsfirmen ausgelagert. Wird die Terrorabwehr an Flughäfen bald durch Mindestlöhner und durch türkische Gastarbeiter durchgeführt? Das sind absurde Ideen aus der Denkfabrik von Frau Faeser.\n\n({1})\n\nDas ist sinnbildlich für eine Innenministerin, für die der Kampf gegen rechts und die Bespitzelung von Regierungskritikern höhere Priorität hat als die Bekämpfung des islamistischen Extremismus.\n\n({2})\n\nSehr geehrte Bundesregierung, warum nehmen Sie diese Herausforderung nicht einfach als Anlass, unter den 917 000 Langzeitarbeitslosen vielleicht 1 000 für die Gepäckabfertigung zu finden? Stattdessen befriedigen Sie mal wieder genüsslich Ihre Migrationssucht und heizen das internationale Lohndumping weiter an.\n\n({3})\n\nStocken Sie endlich die Bundespolizei auf, damit sie ihren Hoheitsaufgaben nachkommen kann! Wir haben es bereits in den Haushaltsberatungen gefordert. Geben wir Bodendienstleistern und Flugpersonal eine langfristige Perspektive! Studien beweisen doch, dass Flugreisen nie ein Pandemieherd waren. Hören Sie auf, hier die nächsten Coronahorrormärchen zu verbreiten! Erhalten Sie die Luftfahrt, und unterlassen Sie es zukünftig, den geschundenen Bürgern nicht nur Haare, sondern Rapunzels komplette Perücke\n\n({4})\n\nin die Urlaubssuppe zu schmeißen!\n\n({5})\n\nDer Bürger hat auch mal Urlaub verdient, und zwar nicht nur Flugurlaub, sondern vor allem Urlaub von Ihnen und Ihren zukunftsfeindlichen und freiheitsfeindlichen Politikansätzen.\n\nVielen Dank, meine Damen und Herren.\n\n({6})"
