id,firstname,lastname,faction,position,date, url,speech
"1073221","Michael","Espendiller","AfD","Member of Parliament","2022-06-01T00:00:00.000Z","https://dip21.bundestag.de/dip21/btp/20/20040.pdf","\n\nSehr geehrte Frau Präsidentin! Sehr geehrte Kollegen! Liebe Zuschauer im Saal und bei Youtube!\n\n({0})\n\nMein Fraktionskollege Fabian Jacobi hat vorgestern gesagt, dass er auch deshalb in die Politik gegangen ist, weil die anderen Parteien die Bürger regelmäßig für dumm verkaufen und sie auch für dumm halten würden. Und er hat auch gesagt, dass die Bürger eben genau das nicht sind. Als ich das hörte, musste ich unweigerlich an den Verlauf der Beratungen über diesen Verteidigungsetat und an die Debatte zum Sondervermögen denken. Denn alle anderen Parteien, die hier im Hause sitzen, tun auf die eine oder andere Weise genau das: Sie verkaufen die Menschen für dumm.\n\nDa haben wir zum einen eine Regierung aus SPD, Grünen und FDP, eine linke Regierung, die selbst kräftig dabei mitgeholfen hat, die Bundeswehr so rettungslos kaputtzusparen, dass sie jetzt in einem so schlechten Zustand ist, dass man um die Verteidigungsfähigkeit dieses Landes ernsthaft besorgt sein muss.\n\n({1})\n\nGenau diese linke Regierung wäscht ihre Hände jetzt in Unschuld und schwingt sich nun zum Retter der Bundeswehr auf; wir haben es gerade von der Verteidigungsministerin gehört.\n\n({2})\n\nAber eigentlich hat sie noch nicht einmal den blassesten Schimmer, wie sie mit diesem Scherbenhaufen umgehen soll. Die FDP müsste aus haushalterischen Gründen hier eigentlich schon im Dreieck springen. Aber was interessiert die Minister das Liberalala-Geschwätz von gestern?\n\nDie Union wird nicht müde, zu betonen, dass sie ja schon immer für die Bundeswehr war und dass nur die SPD schuld daran ist, dass unsere Truppe nicht besser ausgestattet wurde. Dazu muss man einfach mal festhalten, dass die deutsche Regierungschefin 16 Jahre lang Angela Merkel hieß und dass auch das Verteidigungsministerium 16 Jahre lang in den Händen der Union war – 16 Jahre, in denen Sie die Missstände in der Bundeswehr bestenfalls verwaltet und nichts gegen den fortschreitenden Verfall unserer Streitkräfte unternommen haben.\n\n({3})\n\nJa, es gab seit 2014 Etaterhöhungen. Aber was ist eigentlich mit dem Geld passiert? Da fallen einem dann leider nur diverse Beschaffungsskandale und Berateraffären ein. Und für diesen Mist haben Sie Frau von der Leyen dann auch noch zur Präsidentin der Europäischen Kommission befördert.\n\nDann haben wir natürlich noch die alles entschuldigende Ausrede – für alles und jeden –: Der Russe ist schuld.\n\n({4})\n\nFrüher war alles Friede, Freude, Eierkuchen, es brauchte doch gar keine Armee mehr, und überhaupt konnte man doch die Wahrnehmung der eigenen Sicherheitsinteressen gepflegt den Amerikanern aufbürden. Das 2‑Prozent-Ziel hat hier niemanden interessiert.\n\n({5})\n\nIm Gegenteil: Man war noch empört, als der damalige Präsident Trump forderte, Deutschland möge doch endlich mal seine Bündnisverpflichtungen erfüllen.\n\nUnd das führt uns direkt zu dem Elefanten im Raum, den keiner hier benennen will: Sie alle hier haben dabei mitgemacht, dass die Bundeswehr so heruntergewirtschaftet wurde, dass man den entstandenen Schaden nur noch mit der Aufnahme massiver Schulden oder durch harte Einschnitte im Gesamthaushalt beheben kann. Wenn man das Prinzip eines ausgeglichenen Haushalts nicht aufgeben und dabei die Sicherheitsinteressen Deutschlands nicht preisgeben will, dann geht das nur über radikale Kürzungen in sämtlichen anderen Etats.\n\n({6})\n\nDas ist die fürchterliche Wahrheit, vor der wir hier alle stehen. Das ist die riesige Hypothek, die Sie allen Bürgern dieses Landes durch Ihre Verantwortungslosigkeit und Ihre laxe Haushaltspolitik in der Vergangenheit aufgebürdet haben.\n\n({7})\n\nIch habe Frau Ministerin Lambrecht in den Beratungen gefragt, was wir denn machen, wenn das 100-Milliarden-Euro-Sondervermögen aufgebraucht ist. Sie hat geantwortet, dass es natürlich eine Möglichkeit wäre, ein neues Sondervermögen aufzulegen, dass sie das aber selbstverständlich nicht möchte. Schon klar! Ich glaube Ihnen kein Wort.\n\n({8})\n\nEin souveränes Land muss sich verteidigen können. Daran führt kein Weg vorbei, und das haben wir hier auch immer wieder gesagt. Aber mit Ihrer Haushaltspolitik laufen wir auf eine dauerhafte Finanzierung unserer Parlamentsarmee durch Schulden zu – allen gegenteiligen Bekundungen zum Trotz. Natürlich könnte man das noch verhindern. Aber alle anderen Fraktionen haben in den Haushaltsberatungen deutlich gemacht, dass sie zu dem dafür erforderlichen Sparkurs nicht bereit sind. Wenn Sie diesen Weg also gehen, dann sollten Sie wenigstens so ehrlich sein und den Bürgern darüber die Wahrheit sagen. Denn das haben die Bürger nicht nur verdient, darauf haben sie auch ein Recht.\n\nVielen Dank für die Aufmerksamkeit.\n\n({9})"
"1073108","Alice","Weidel","AfD","Member of Parliament","2022-06-01T00:00:00.000Z","https://dip21.bundestag.de/dip21/btp/20/20040.pdf","\n\nSehr geehrte Frau Präsidentin! Sehr geehrter Herr Bundeskanzler! Sehr geehrte Damen und Herren! Es ist ja schön, dass Sie sich zwischen Opposition und Regierung so gut verstehen, dass Sie zu einem Kompromiss gefunden haben. Aber uns liegen alle diese Anträge gar nicht vor. Haben wir hier geschlafen, oder haben Sie geschlafen?\n\n({0})\n\nWas ist hier eigentlich los? Legen Sie doch die Anträge vor, damit wir darüber hier auch vernünftig abstimmen können!\n\n({1})\n\nAber zurück zum Haushalt – es ist ja eine Haushaltsdebatte –: Wenig hat Herr Merz über den Haushalt geredet. Aber dieser Haushalt ist ein Dokument der Abgehobenheit, der Realitätsverweigerung und der Ignoranz gegenüber dem Zustand des Landes und seiner Menschen.\n\n({2})\n\nDie Regierungskoalition maßt sich an, die Welt zu retten, die Energieversorgung für ein Industrieland im Alleingang neu zu regeln und das Klima in 50 oder 100 Jahren zu regeln; aber das eigene Land und seine Menschen werden ruiniert.\n\nSie reden von „Zeitenwende“, aber Sie handeln nicht danach. Sie kapseln sich in Ihre ideologischen Fantastereien von Klimaschutz, Energiewende, Multikulturalismus, Diversität ein und verweigern den Blick auf die Realität.\n\n({3})\n\nDeutschland steckt in einer fundamentalen Wirtschafts-, Finanz- und Staatskrise, die alles bisher Dagewesene übertrifft.\n\n({4})\n\nUnd dennoch geben Sie das Geld mit vollen Händen aus. Sie verteilen es in alle Welt: Klimamilliarden für Indien hier, Waffenmilliarden für die Ukraine da. Sie blähen den Staatsapparat noch weiter auf; Sie schaffen neue Regierungsposten und genehmigen sich großzügig noch mehr Stellen in den Ministerien und Verwaltungen. Für die eigenen Bürger und Steuerzahler bleiben dagegen nur Trostpflaster und Alibipolitik. Die Deutschen zahlen mit die höchsten Steuern und Abgaben der westlichen Welt. Sie bekommen dafür miserable Renten und einen zunehmend funktionsunfähigen Staat,\n\n({5})\n\neinen Staat, der immer weniger in der Lage ist, seine Kernaufgaben – die Aufrechterhaltung von Rechtsstaatlichkeit und öffentlicher Ordnung, die Gewährleistung von innerer und äußerer Sicherheit – wahrzunehmen, der sich aber immer dreister und übergriffiger in das Privatleben der Bürger einmischt, sie bevormundet und ihnen dafür immer tiefer in die Tasche greift.\n\nDie Krise, in der unser Land steckt, ist nicht vom Himmel gefallen; sie ist politisch gemacht. Inflation, Energieknappheit, explodierende Energiepreise, gestörte Lieferketten, Fachkräftemangel und überlastete Sozialkassen sind die Folge politischer Fehlentscheidungen.\n\n({6})\n\nUnd nein, Sie können die Verantwortung dafür nicht allein auf Putins Angriffskrieg schieben.\n\n({7})\n\nDie Ursachen liegen tiefer. Die fatalen Fehlentscheidungen wurden früher getroffen,\n\n({8})\n\nund sie sind vor allem in Berlin und Brüssel gefallen.\n\n({9})\n\nDie galoppierende Inflation ist die Quittung für exzessives Schuldenmachen und für die Geldschwemme und Nullzinspolitik der Europäischen Zentralbank zur Subventionierung der Eurohochschuldenstaaten. 8 Prozent Inflation heißt: Sparguthaben, Rücklagen und Rentenansprüche sind nach sechs Jahren nur noch die Hälfte wert. Die Reallöhne sinken als Folge der Inflation. Fast 40 Prozent der Deutschen wissen gar nicht mehr, wie sie ihren Lebensunterhalt bestreiten sollen. Was haben Sie dazu eigentlich gesagt? Was haben Sie an Lösungen angeboten?\n\n({10})\n\nNichts! Noch mehr bürokratische Umverteilung ist alles, was diese Ampel anzubieten hat. Tankrabatt, 9‑Euro-Ticket, Einmalzuschüsse oder Klimageld sind teure bürokratische Strohfeuer, die nichts bringen und – ich muss es einfach so sagen – die nur Ihre eigene Unfähigkeit kaschieren sollen.\n\n({11})\n\nSteigende Energiepreise heizen die Inflation weiter an und treiben Mittelstand und Mittelschicht in die Verarmung. Die deutsche Energiekrise hat einen Namen: die Energiewende. Kohle- und Atomausstieg zeitgleich, Flatterstrom aus Wind und Sonne als Ersatz für eine grundlastfähige, günstige Energieversorgung, wie wir sie einmal hatten in diesem Land, und dazu als neueste Idee aus dem Hause Habeck die Beseitigung der Erdgasinfrastruktur für die Wohnungsbeheizung. Das konnte und das kann nicht gut gehen.\n\nSie aber missbrauchen den Krieg in der Ukraine, um diesen Irrweg noch zu beschleunigen, noch mehr Geld dafür zu verbrennen und noch mehr Naturzerstörung durch monströse Windräder voranzutreiben. Die deutschen Energiekosten sind jetzt schon die höchsten aller Industrieländer,\n\n({12})\n\nob mit oder ohne Ukrainekrieg. Die Energiewende ist gescheitert und muss schleunigst korrigiert werden.\n\n({13})\n\nUnd dazu muss die Erkenntnis kommen, dass Energiesanktionen gegen Russland kontraproduktiv sind und unserem Land mehr Schaden zufügen als Russland, sehr geehrte Damen und Herren.\n\n({14})\n\nDurch den freiwilligen Verzicht auf Erdöllieferungen auf dem Landweg – das muss man sich mal vorstellen – gefährden Sie die Treibstoffversorgung im Osten Deutschlands und bürden den Bürgern noch höhere Energiepreise auf.\n\nAuf den drohenden Zusammenbruch der sozialen Sicherungssysteme, vor dem der Bundesrechnungshof gerade in einem Alarmbericht gewarnt hat, haben Sie ebenfalls keine Antwort. Unkontrollierte Migration löst weder Fachkräftemangel noch Demografieprobleme, und schon gar nicht, wenn man wahllos Migration von Bildungsfernen und Nichtintegrierbaren aus fremden Kulturkreisen zulässt\n\n({15})\n\nund sogar noch fördert.\n\n({16})\n\nDagegen sind im vergangenen Jahr 1 Million Menschen aus Deutschland ausgewandert. Nicht wenige sind Hochqualifizierte, die für immer verloren sind. Diesen Braindrain nehmen Sie achselzuckend hin\n\n({17})\n\nund fahren fort mit der negativen Anreizsetzung für qualifizierte Arbeitnehmer.\n\n({18})\n\nSo sieht die Politik aus. Von den Asylzuwanderern seit 2016 – Stichwort „Wir schaffen das“ – sind rund 1 Million – 1 Million! – immer noch zusätzliche Kostgänger in unserem Sozialsystem. Was tun Sie? Sie funktionieren die Hartz-IV-Leistungen durch Streichung der Sanktionsmöglichkeiten zum De-facto-Grundeinkommen um,\n\n({19})\n\nund Sie wollen den Zugang zu diesen Leistungen im nächsten Schritt nicht nur für ukrainische Kriegsflüchtlinge, sondern auch für alle Asyleinwanderer öffnen. Das heißt: Sie beschleunigen diesen Trend unqualifizierter Einwanderung noch. Wer dagegen 45 Jahre bei einem Durchschnittsbruttolohn von 24 000 Euro im Jahr gearbeitet hat, landet gerade auf einem Hartz‑IV-Niveau, und Sie tun nichts, um diese offensichtliche Schieflage zu beseitigen und das Rentensystem auf eine tragfähige Grundlage zu stellen. Und das ist der Offenbarungseid für die sozialdemokratisch geführte Ampelregierung.\n\n({20})\n\nWir brauchen tatsächlich eine echte Zeitenwende in der deutschen Politik, und das bedeutet Abschied von ideologischen Illusionen und Konzentration der Staatsaufgaben und ‑ausgaben auf das Wesentliche. Es ist richtig und überfällig, den Aufrüstungs- und Investitionsstau der Bundeswehr mit zusätzlichen Ausgaben anzugehen. Jahrzehntelang wurde die Armee vernachlässigt und heruntergewirtschaftet. Dafür tragen Sie alle, vor allem aber Ihre Partei, Herr Merz, die Verantwortung. 16 Jahre lang hat die Union Kanzlerin und Verteidigungsminister gestellt. Da ist es schon mehr als scheinheilig, sich hier als Retter und Beschützer der Bundeswehr aufzuspielen.\n\n({21})\n\nUnd den Soli, wie Herr Merz es hier eben dargelegt hat, umzufunktionieren als Sondersteuer zur Reparatur der eigens heruntergewirtschafteten Bundeswehr, das ist ein Schlag ins Gesicht für alle Steuerzahler.\n\n({22})\n\nDie Bezeichnung „Sondervermögen“ für zusätzliche Schulden ist ebenfalls irreführend. Warum nennen Sie das „Sondervermögen“? Es sind Sonderschulden. Das wäre ehrlicher. Dass diese Ausgabe im Grundgesetz verankert werden soll, um sie aus der allgemeinen Staatsverschuldung hinauszurechnen,\n\n({23})\n\nist ein unnötiger und unlauterer Bilanztrick, und das wissen Sie ganz genau.\n\n({24})\n\nBesser wäre es – dafür steht die AfD –, überflüssige Posten aus dem Haushalt zu streichen. Wir sprechen hier von einem Rekordvolumen des Haushaltes. Streichen Sie überflüssige Posten, und konzentrieren Sie die Staatsausgaben auf das Wesentliche! Niemand kann behaupten, dass dafür keine Spielräume vorhanden wären. Der Staat hat in Deutschland nicht zu wenig Geld, sondern zu viel – das Konzept verstehen Sie vielleicht –, und er setzt bei diesen Ausgaben die falschen Prioritäten. Darum geht es doch.\n\nDer auf das Vierfache des Vor-Corona-Haushalts aufgeblasene Etat des Gesundheitsministeriums ist durch nichts zu rechtfertigen. Der überforderte Gesundheitsminister darf also weiter Milliarden nicht benötigter Impfdosen bestellen und anlasslose Massentestungen veranlassen. Unser Land hat gerade wahrhaftig andere Sorgen als die Neuauflage faktenfreier Grundrechtseinschränkungen und rechtswidriger Impfkampagnen.\n\n({25})\n\nViel Geld wird ausgegeben für Zensurmaßnahmen, Meinungskontrolle – da sind Sie ja Spitzenreiter – und den sogenannten Kampf gegen rechts. Drängende echte Sicherheitsprobleme werden dagegen heruntergespielt, vor allem, wenn es sich um die importierte Kriminalität handelt.\n\nDeutschland braucht weder neue Steuern noch neue Schulden, um wieder auf die Beine zu kommen. Wir brauchen die Rückkehr zu soliden Staatsfinanzen, und das erfordert mehr als folgenlose Tweets dieses Bundesfinanzministers.\n\n({26})\n\nStampfen wir lieber einige Lieblingsprojekte grüner und linker Ideologie und Klientelpolitik ein, dann haben wir auch Geld zur Entlastung der Menschen. Lassen wir den Bürgern ihr sauer verdientes Geld in ihrem eigenen Portemonnaie. Dort ist es am besten aufgehoben.\n\n({27})\n\nGeben wir der bürgerlichen und der unternehmerischen Freiheit wieder Vorrang statt Bevormundung und Kontrollwahn, liebe Ampelkoalition, kehren wir zurück zur Realpolitik und setzen die Interessen des eigenen Landes genau dahin, wo sie hingehören, und zwar an die erste Stelle.\n\nIch bedanke mich.\n\n({28})"
"1073130","Tino","Chrupalla","AfD","Member of Parliament","2022-06-01T00:00:00.000Z","https://dip21.bundestag.de/dip21/btp/20/20040.pdf","\n\nSehr geehrte Frau Präsidentin! Sehr geehrte Damen und Herren! Liebe Landsleute! Der Deutsche Bundestag ist aufgefordert, den Bundeshaushalt 2022 zu verabschieden. Wir beraten in dieser Woche über eine Neuverschuldung in schwindelerregender Höhe von circa 139 Milliarden Euro. Damit wachsen die geplanten Ausgaben auf nahezu 500 Milliarden Euro an.\n\nWerter Herr Bundeskanzler, wann konnten Sie als Regierungschef dieser Ampelkoalition eigentlich einen Arbeitstag mit dem Gewissen beenden, unser Land vorangebracht zu haben? Denn eines muss ich sagen: Die Verantwortung für die desolate Lage unseres Landes lastet zu Recht schwer auf Ihren Schultern. Als ehemaliger Bundesfinanzminister und Sozialdemokrat haben Sie Ihrer Vorgängerin im Amt über Jahrzehnte den Boden für eine realitätsferne Wirtschafts- und Finanzpolitik geebnet.\n\n({0})\n\nWir erleben hier und heute den wirtschaftlichen und sozialen Abstieg Deutschlands und seiner Bürger. Und wie ist Ihre Reaktion darauf? Entweder hört und sieht man den Bundeskanzler nicht, oder man hört von einem ehemaligen Bundespräsidenten, dass man auch mal für den Frieden frieren könne. Genau das ist unwürdig, meine Damen und Herren,\n\n({1})\n\nunwürdig dem Land gegenüber, für das Sie als Bundesregierung Verantwortung übernommen haben, und vor allem unwürdig den Menschen gegenüber, die tagtäglich zur Wertschöpfung in Deutschland und damit zum Wohl unserer Gesellschaft beitragen.\n\nDie CDU steht Ihnen im Übrigen in nichts nach. Herr Merz, Sie haben ja selbst in der ARD vom Ende unseres Wohlstandes für eine gewisse Zeit gesprochen. Für mich hört sich das so an, als hätte die CDU Deutschland bereits aufgegeben und den Glauben an sich selbst verloren; denn Lösungen haben die Christdemokraten und heute auch Sie, Herr Merz, nicht hervorgebracht. Sie haben kein Wort zu den deutschen Bürgern gesagt, kein Wort zu den Steuerzahlern in diesem Land.\n\nMeine Damen und Herren, diese beiden Politiker bringen heute ihre eigene Ernte ein. Schauen Sie sich in unserem Land um! Sie werden die Ergebnisse fehlgeleiteter Politik der letzten Jahrzehnte überall erkennen, wenn Sie durch unser Land fahren. Diese treten immer stärker in den Vordergrund und lassen sich auch nicht mehr vertuschen. Beispielsweise wurde der Spalt zwischen den strukturstarken und den strukturschwachen Regionen sogar noch vertieft. Wir alle wissen: Für kaum ein Unternehmen des Mittelstands ist es wirtschaftlich überhaupt noch attraktiv, sich in einer strukturschwachen Region dauerhaft niederzulassen. Hier hat der deutsche Staat seit Jahren seine Grundaufgabe nicht erfüllt, die heißt: Aufbau und Erhalt von Infrastruktur. Verkehrsnetze von Straße und Schiene, Breitbandausbau, Gesundheitsversorgung und Bildung sind nur einige Eckpfeiler, die einfach vorhanden sein müssen. Es ist die Aufgabe der Regierungen in den Ländern und im Bund, die grundlegenden Voraussetzungen zu schaffen, damit gerade auch kleine und mittelständische Unternehmen und insbesondere das Handwerk existieren können.\n\n({2})\n\nWas ist eigentlich Ihre Idee für Deutschland und den Kontinent Europa in den nächsten 20 Jahren, werte Bundesregierung? Wie werden wir nach der sogenannten Energiewende leben und arbeiten? Wie geht es weiter? Dazu schweigen Sie sich komplett aus. Damit endet die einseitige Utopie der Ampelkoalition, meine Damen und Herren. Welche Industrien beispielsweise werden noch in Deutschland existieren, und welche werden wir entwickeln müssen? Womit werden die Menschen in diesem Land ihr Geld verdienen? Wer wird in diesem Land überhaupt noch wertschöpfend arbeiten? Zu diesen Fragen hören wir schon lange keine Antworten mehr von Ihnen. Sie fahren mit Ihrer Politik nur noch auf Sicht. Und weiter: Was sollen wir den nachfolgenden Generationen raten? Was würden Sie Ihren Kindern raten, welchen Beruf sie erlernen sollten, welches Studium sie ergreifen sollten? Wie sehen die Berufsbilder der Zukunft eigentlich aus?\n\nInvestieren Sie überhaupt noch einen Gedanken in diese wichtigen Fragestellungen? Wir und viele deutsche Bürger jedenfalls können das aktuell nicht erkennen. Ihre Politik, werte Bundesregierung, schafft Deutschland und Europa als eigenständigen und zukunftssicheren Wirtschafts- und Bildungsraum vollkommen ab.\n\n({3})\n\nDamit nicht genug, diese Bundesregierungen versuchen seit Jahren, die strukturellen Probleme mit neuen Staatsschulden zu lösen, natürlich auch in diesem Haushalt. Als Alternative für Deutschland haben wir stets und ständig darauf hingewiesen, dass Sie unser Land damit in eine Inflation hineinsteuern. Und auch hier sollten wir recht behalten, meine Damen und Herren. Die steigenden Preise für die Waren des täglichen Bedarfs und Kraftstoffe haben die Bürger Ihnen zu verdanken. Sie sollten sich wirklich schämen, die Ergebnisse Ihrer mangelhaften Politik mit dem Deckmantel des Ukrainekriegs verhüllen zu wollen.\n\n({4})\n\nSie alle hier wissen, dass die Notenpresse der EZB seit Jahren auf Hochtouren läuft, um die Missstände zu verschleiern. Genau das ist der Hauptgrund: die Geldmenge in Europa.\n\n({5})\n\nDazu kommt jetzt noch das beschlossene Ölembargo. Auch das wird uns hier in Europa schwächen. In den Erdölraffinerien von Schwedt und Leuna werden Arbeitsplätze und in den Regionen dadurch die Wirtschaftskraft verloren gehen. Ideologisch verblendet beharrt diese Bundesregierung seit Monaten auf ihren Standpunkten. Ebenso lange machen wir Sie auf wirkliche Einsparpotenziale aufmerksam. Sie jedoch sind an einem ehrlichen Kassensturz überhaupt nicht interessiert. Einnahmen und Ausgaben gegenüberzustellen, ist nicht gewollt.\n\nDabei wäre es möglich, dass Sie über 100 Milliarden Euro bei dem Energie- und Klimafonds, durch Auflösung der Asylrücklage oder eine ordentliche Außen- und Entwicklungspolitik im deutschen Interesse einsparen. Auch das Bürokratiemonster EU darf nicht weiter unbedacht gefüttert werden. Würde man nur einen Teil dieser Vorschläge in Erwägung ziehen, könnten wir den Staatshaushalt entlasten. Vielmehr wäre dieses Geldvolumen frei, ja, auch für die Finanzierung der Bundeswehr – ohne neue Schulden aufzunehmen und ohne das Grundgesetz zu ändern – oder um in die chronisch unterfinanzierten sozialen Sicherungssysteme zu investieren. Das sind Sie nämlich den Bürgern schuldig, die einen Großteil ihrer Einkommen jeden Monat dafür aufwenden und damit den Sozialstaat auch aufrechterhalten.\n\n({6})\n\nAber diese Bundesregierung reagiert wie gewohnt nachdenklich und kündigt zunächst einmal ein Entlastungspaket an. Das hört sich natürlich immer toll und schön an. Nicht nur, dass es lange auf sich warten lässt, man hat sich zuallererst auch noch im ideologischen Klimabaukasten bedient und versucht, mit einem 9‑Euro-Ticket die Bürger über die Sommermonate weg von ihren Autos hin zum ÖPNV zu bringen. Natürlich können wieder nur diejenigen davon profitieren, bei denen noch Busse und Bahnen fahren. Wieder werden die infrastrukturschwachen Regionen abgekoppelt. Frau Haßelmann, kommen Sie gerne in meinem Wahlkreis, nach Görlitz.\n\n({7})\n\nDa fährt pro Woche ein Bus. Da können Sie dann einmal für 9 Euro fahren. Das ist der Grund: Die Menschen dort haben rein gar nichts von dieser kurzfristigen Symbolpolitik. Sie sind zur eigenen Versorgung nämlich auf ihr Auto angewiesen.\n\n({8})\n\nHiervon besonders betroffen sind ausgerechnet die Älteren und Ältesten in unserem Land, ausgerechnet diejenigen, denen wir unseren Wohlstand zu verdanken haben. Diejenigen, die unser Land aufgebaut haben, werden zum Dank von den Regierungen gedemütigt und vergessen. Aber gerade diese Menschen brauchen unsere Unterstützung, verdienen unsere Wertschätzung, und auch Entlastung haben diese Menschen verdient.\n\nJa, die Preisspirale dreht sich immer weiter. Hohe Kraftstoffpreise werden höhere Lebensmittelpreise zur Folge haben. Die Erzeugerpreise liegen schon über den Handelspreisen. Ergreifen Sie endlich pragmatische Lösungen, die bei den Bürgern und Unternehmen ankommen! Setzen Sie die Mehrwertsteuer auf Grundnahrungsmittel aus! Schaffen Sie Entlastung bei der Lohn- und Einkommensteuer durch Anhebung der Grundfreibeträge! Und noch einmal: Die CO2-Abgabe gehört abgeschafft.\n\n({9})\n\nWir selbst hier im Deutschen Bundestag müssen endlich die Wahlrechtsreform vorantreiben. Hätte dieses Parlament die angemessene Zahl von 598 Abgeordneten anstelle von 736, würden wir pro Jahr 100 Millionen Euro einsparen. Das würde zum Vertrauen der Bürger in unsere parlamentarische Arbeit und in die Politik beitragen und könnte sich vielleicht sogar positiv auf die Wahlbeteiligung auswirken. Wahrscheinlich wollen Sie das aber gar nicht."
"1073132","Tino","Chrupalla","AfD","Member of Parliament","2022-06-01T00:00:00.000Z","https://dip21.bundestag.de/dip21/btp/20/20040.pdf","\n\nLetzter Satz, Frau Präsidentin. – Werte Kollegen, ein Weiter-so kann und darf es nicht geben. Wir brauchen eine Politik, in der unsere Bürger ebenso zuerst bedacht werden wie Deutschland.\n\nVielen Dank.\n\n({0})"
