id,firstname,lastname,faction,position,date, url,speech
"1073811","Gerrit","Huy","AfD","Member of Parliament","2022-06-03T00:00:00.000Z","https://dip21.bundestag.de/dip21/btp/20/20042.pdf","\n\nSehr geehrte Frau Präsidentin! Sehr geehrte Damen und Herren! Heute soll das Rentenanpassungsgesetz verabschiedet werden, mit dem eine formale Rentenerhöhung von rund 5 bzw. 6 Prozent erfolgt. Leider liegt die Inflationsrate schon heute höher, sodass die Kaufkraft der Rentner trotz dieser durchaus erheblichen Erhöhung weiter sinkt.\n\nWir unterstützen die geplante Rentenerhöhung zwar vollumfänglich – sowohl die lange überfällige Erhöhung der Erwerbsminderungsrenten im Bestand als auch die Erhöhung der Altersrenten –, hätten uns aber angesichts des drastischen Preisanstiegs, gerade auch im Warenkorb der Rentner, mehr gewünscht.\n\n({0})\n\nDer erste Mangel. Sie kündigen jetzt eine Rentenerhöhung für die lange vergessenen Erwerbsminderungsrentner im Bestand an. Aber in Kraft treten soll diese Erhöhung erst in 2024. Während alle anderen Rentner schon ab Juli mehr Rente zur Verfügung haben, müssen ausgerechnet die älteren Jahrgänge der Erwerbsminderungsrentner noch ganze zwei Jahre auf die angekündigten Verbesserungen warten. Bis dahin sind diese durch die Inflation längst verpufft.\n\nBegründet wird das mit technischen Umsetzungsproblemen, für deren Lösung erst in 2024 genügend Kapazitäten bei der Rentenversicherung zur Verfügung stehen sollen. Den Prozentsatz für bestimmte Erwerbsminderungsrentnerjahrgänge heraufzusetzen, geht also erst in zwei Jahren? Da reibt man sich doch erstaunt die Augen.\n\n({1})\n\nMeine Damen und Herren, Sie sparen hier an der falschen Stelle. Das Mindeste ist doch, dass Sie die entgangene Erhöhung dann in 2024 nachzahlen; aber auch das ist bisher nicht geplant.\n\nZum zweiten Mangel. Bei den Inflationsentlastungspaketen hat die Ampelregierung die Rentner nahezu komplett vergessen. Rentner ohne Grundsicherung oder Wohngeld fallen einfach unter den Tisch. Dazu gehören übrigens auch die gut 1 Million Rentner, die zwar Anspruch auf Grundsicherung hätten, also nach allen Kriterien wirklich arm sind, diese Grundsicherung aber nicht beantragt haben. Gerade diese Rentner hätten das Entlastungspaket am allernötigsten.\n\n({2})\n\nMit unserem Antrag wollen wir die Entlastung für die vergessenen Rentner nachholen. Sie alle haben es als Abgeordnete der deutschen Bürger in der Hand, diesem Antrag zuzustimmen und damit allen Rentnern ein Entlastungspaket in Höhe von 300 Euro steuerfrei zukommen zu lassen. Hand heben an der richtigen Stelle ist genug.\n\nUm Ihnen die Entscheidung zu erleichtern, möchte ich hier noch ein paar Fakten zum armen Teil unserer Rentner anführen. Wie viele sind denn eigentlich arm? Die europäische Statistik sagt: sehr viele. An die 30 Prozent unserer Alten sind arm, und die meisten von ihnen sind Rentner. Dem letzten Alterssicherungsbericht der Bundesregierung können Sie zudem entnehmen, dass rund 30 Prozent unserer alleinstehenden Rentner weniger als 1 250 Euro im Monat zur Verfügung haben. Sie sollten auch wissen, dass in etwa der Hälfte aller Altenhaushalte die Rente das einzige Einkommen ist.\n\nNun zu den Allerärmsten unter den Rentnern. Ich zitiere wörtlich aus dem Alterssicherungsbericht:\n\nDie 20 Prozent der Haushalte mit dem niedrigsten Einkommen lassen sich durch eine Kombination niedriger Alterssicherungsleistungen mit geringen zusätzlichen Einkünften charakterisieren.\n\nDas ist eine hübsche Umschreibung dafür, dass die untersten 20 Prozent der armen Rentnerhaushalte so gut wie gar nichts haben außer ihrer niedrigen Rente. Davon können sie sich heute kaum noch vernünftig ernähren, geschweige denn am sozialen Leben teilhaben oder in Würde altern."
"1073599","Götz","Frömming","AfD","Member of Parliament","2022-06-02T00:00:00.000Z","https://dip21.bundestag.de/dip21/btp/20/20041.pdf","\n\nSehr geehrte Frau Präsidentin! Sehr geehrte Damen und Herren! In einer Rede am 29. November 2018 habe ich hier an dieser Stelle prophezeit, dass der DigitalPakt scheitern wird. Damals haben Sie gelacht und sind über unsere wohlbegründeten Bedenken hinweggegangen.\n\nNun erhalten wir die erste Evaluation in Form eines Berichtes des Bundesrechnungshofs von diesem Jahr. Meine Damen und Herren, dieses Zwischenzeugnis, das Sie hier alle miteinander erhalten, fällt für Sie verheerend aus. Der Bundesrechnungshof stellt fest, es fehle dem Bund nicht nur an der Zuständigkeit, sondern vielmehr führten seine Initiativen zu „Angeboten, die redundant zu denen der Länder“ seien. Sie seien damit „unwirtschaftlich“. Es drohten weiterhin – so wörtlich – „Förderruinen, für deren Weiterbetrieb es keine Perspektiven“ gebe. Das ist das Ergebnis Ihrer verfehlten Haushaltspolitik.\n\n({0})\n\nDas, was wir hier über den DigitalPakt gesagt haben, könnte als drohendes Motto über Ihrem gesamten Haushalt stehen: Deutschland als Förderruine, für deren Weiterbetrieb es keine Perspektive mehr gibt. – Man muss aufgrund früherer Äußerungen, insbesondere aus den Reihen der Grünen, fast annehmen, dass einige von Ihnen diesen Untergang heimlich herbeisingen.\n\nMeine Damen und Herren, dass wir uns nicht missverstehen: Eine vernünftige Internetanbindung in den Schulen oder ein warmes Mittagessen, das sind wichtige Dinge, das befürworten auch wir. Aber das sind Selbstverständlichkeiten. Sicherlich könnten die Länder und Kommunen besser dafür sorgen, als wenn wir das hier von Berlin aus tun.\n\n({1})\n\nDa, wo Sie wirklich als Bundesgesetzgeber gefragt sind, scheitern Sie. Für die berufliche Bildung tun Sie nach wie vor viel zu wenig bzw. das Falsche. Auch hier beklagt der Bundesrechnungshof zu Recht eine fehlende gesetzliche Grundlage und einen unkoordinierten Förderdschungel, in dem sich keiner mehr auskenne. Das Gleiche erleben wir übrigens beim BAföG. Dazu haben Sie ja einen neuen Entwurf vorgelegt; über den werden wir noch reden müssen – auch hier ein vernichtendes Zeugnis vom Bundesrechnungshof auf 40 Seiten.\n\nMan muss auch fragen, warum der Bund meint, ständig Projekte zu finanzieren wie zum Beispiel „Demokratie leben!“, „Kultur macht stark“ „Bildung für nachhaltige Entwicklung“. Das sind alles so tolle, wohlklingende Namen. Aber warum tun Sie das als Bund? Sind dafür nicht eigentlich die Länder zuständig, und trauen Sie an der Stelle nicht den Lehrern vor Ort zu, das Richtige zu tun?\n\nWir stellen fest, dass es um unsere Bildungseinrichtungen herum, Herr Gehring, inzwischen einen regelrechten Sumpf von externen Bildungsanbietern gibt.\n\n({2})\n\nEbenso wenig, wie Lehrer und Schüler auf diesen Bildungssumpf an externen Bildungsanbietern gewartet haben, haben sie übrigens auf das gewartet, was uns tagtäglich im früher sogenannten Bildungsfernsehen erwartet. Lesen Sie mal die Berichte vom heutigen Tage! Das ist eher eine perverse Genderideologie, die statt wissenschaftlicher Erkenntnisse verbreitet wird.\n\n({3})\n\nMeine Damen und Herren, wir kritisieren die seit Jahren zu beobachtende schleichende Umwandlung des einstigen Atom- und Forschungsministeriums zu einem Ministerium, das man „Ministerium für Bildung und Umerziehung“ nennen könnte. Schuld daran ist maßgeblich der Einfluss der Grünen und ihrer außerparlamentarischen Vorfeldorganisationen. Frau Ministerin, Sie sind von der FDP. Sie stehen hier in der Verantwortung: Trocknen Sie diesen grünen Sumpf aus, befreien Sie Ihr Ministerium aus der Geiselhaft der Grünen!\n\n({4})\n\nDeutschland droht parallel dazu den Anschluss an die internationale Spitzenforschung zu verlieren. Das sehen wir im Bereich der künstlichen Intelligenz: China und die USA haben uns längst abgehängt. Wir sehen es aber auch in anderen Bereichen; die Kernenergie ist schon genannt worden. Hier haben Sie sich von einem kompletten Forschungszweig verabschiedet – übrigens auch ein deutscher Sonderweg; das ist nie eine gute Idee.\n\nMeine Damen und Herren, vielleicht erleben wir aber von den Grünen einen weiteren Purzelbaum; denn sie haben sich ja entschieden, Waffen in Kriegsgebiete zu liefern, und nehmen in Kauf, eine Atommacht zu provozieren."
"1073601","Götz","Frömming","AfD","Member of Parliament","2022-06-02T00:00:00.000Z","https://dip21.bundestag.de/dip21/btp/20/20041.pdf","\n\nVielleicht trauen sie sich dann ja auch, in die Kernenergieforschung wiedereinzusteigen.\n\nVielen Dank.\n\n({0})"
"1073615","Marc","Jongen","AfD","Member of Parliament","2022-06-02T00:00:00.000Z","https://dip21.bundestag.de/dip21/btp/20/20041.pdf","\n\nFrau Präsidentin! Frau Ministerin! Meine Damen und Herren! Wissenschaft lebt von ergebnisoffener Forschung und angstfreier – mit Jürgen Habermas gesprochen: „herrschaftsfreier“ – Diskussion. Der renommierte Mathematiker Professor Stephan Luckhaus ist aus der Nationalen Akademie der Wissenschaften Leopoldina ausgetreten, weil diese die Verbreitung seiner Forschungsergebnisse zu Corona „massiv behindert“ hat, wie er berichtete. Die Modellrechnungen von Professor Luckhaus hatten die weitgehende Nutzlosigkeit der Lockdown-Politik ergeben. Das war offenbar nicht genehm, weil extrem peinlich für die Regierung.\n\nIch will gar nicht unterstellen, dass jemand aus dem Bildungs- oder Gesundheitsministerium bei der Leopoldina angerufen und für Repression gesorgt habe. Wissenschaftliche Karrieren werden heute durchaus subtiler beendet. Sandra Kostner, die Vorsitzende des Netzwerks Wissenschaftsfreiheit spricht von einem wachsenden „Klima der intellektuellen Unfreiheit“ an deutschen Universitäten, das „ab einem gewissen Punkt in einen intellektuellen Lockdown mündet“.\n\nMeine Damen und Herren, das ist ein unerträglicher Zustand. Und es müsste gerade Sie von der FDP, Frau Bildungsministerin, massiv alarmieren. Da müssten Sie doch gegensteuern.\n\n({0})\n\nStattdessen lassen Sie die Förderung der ideologischen sogenannten Agendawissenschaften einfach weiterlaufen wie Gender Studies, Postcolonial Studies usw., die Wissenschaft als Wiedergutmachungsprojekt für angeblich benachteiligte Gruppen betreiben, die jeden als „Angreifer“ bekämpfen und als „rechts“ diffamieren, der zu anderen Ergebnissen kommt, und die auch vor der Leugnung naturwissenschaftlicher Fakten wie der Zweigeschlechtlichkeit des Menschen nicht zurückschrecken.\n\n({1})\n\nSolange ein solches Klima herrscht und immer stärker wird, können wir Ihrer im Prinzip sinnvollen Förderung der Wissenschaftskommunikation nicht zustimmen. Die Gefahr ist derzeit einfach zu groß, dass die Wissenschaft hier für gesellschaftspolitische Ziele missbraucht wird, man könnte auch sagen: dass Propaganda unter wissenschaftlichem Deckmantel betrieben wird.\n\n({2})\n\nWenn Sie die Durchsetzung sogenannter Chancengerechtigkeit von Frauen und Männern mit 33 Millionen Euro weiter fördern wollen, so ist das ein Etikettenschwindel, da es nicht auf Chancengleichheit, sondern auf starre Frauenquoten hinausläuft, die zahllose hochqualifizierte Männer in der Wissenschaft bereits in die Resignation getrieben haben.\n\n({3})\n\n– Das ist so; lesen Sie das bitte mal nach. Informieren Sie sich mal woanders als nur bei Ihren Ideologen.\n\n({4})\n\nAuch das ist das Gegenteil von liberal, Frau Stark-Watzinger. Wir haben die Streichung dieser Mittel beantragt.\n\nWas wir stattdessen wollen: deutlich mehr Geld für Fachhochschulen und angewandte Wissenschaften. In Deutschland sind zurzeit 150 000 Stellen für Ingenieure vakant – so viele wie nie zuvor. Jedes Jahr fehlen 26 000 Absolventen in den MINT-Fächern, wie uns das Institut der deutschen Wirtschaft vor zwei Tagen wieder mitgeteilt hat.\n\nEs muss hier dringend eine Schwerpunktverlagerung in der Forschungsförderung stattfinden: weniger Ideologie, mehr MINT, mehr Pragmatismus – da sind auch gute Ansätze vorhanden; das wollen wir anerkennen –, damit wir die wichtigste Ressource, die wir in diesem Land haben, die Bildung,\n\n({5})\n\ndas Wissen und das Können der Menschen, wieder optimal einsetzen.\n\nVielen Dank.\n\n({6})"
"1073631","Marcus","Bühl","AfD","Member of Parliament","2022-06-02T00:00:00.000Z","https://dip21.bundestag.de/dip21/btp/20/20041.pdf","\n\nFrau Präsidentin! Sehr geehrte Damen und Herren! Die Mittel für 2022 im Bereich des Bildungs- und Forschungsministeriums liegen bei knapp über 20 Milliarden Euro. Für die Stärkung der beruflichen Bildung und für die überbetrieblichen Bildungsstätten wird dabei viel zu wenig getan. Unsere Handwerker und Industriearbeiter, auf die wir stolz sein können, gehören gefördert und unterstützt. Denn sie sind es, die deutsche Qualität weltweit bekannt gemacht haben. Wir setzen uns für Chancengleichheit ein, egal ob mit Studienabschluss oder beruflicher Ausbildung.\n\n({0})\n\nSchwerpunkt Forschung. Wir unterstützen den Abbau von Selbstbewirtschaftungsmitteln bei den außeruniversitären Forschungseinrichtungen sowie die Ausfinanzierung der Modernisierung der deutschen Forschungsschiffsflotte, Stichwort „Polarstern II“. Bezüglich der Errichtung des internationalen Teilchenbeschleunigerprojektes in Darmstadt – auch „FAIR-Projekt“ genannt – wollen wir, dass das angestrebte Zwischenziel trotz Mehrkostenrisiken erreicht wird. Dieses Vorzeigeprojekt physikalischer Grundlagenforschung ist zwar kostenintensiv, aber die Investitionen haben großes Potenzial, langfristig viele neue Erkenntnisse und Innovationen hervorzubringen.\n\n({1})\n\nKritisch sehen wir, dass mit der DATI eine weitere Agentur eingerichtet werden soll, um anwendungsorientierte Forschung an Fachhochschulen zu unterstützen. Frau Ministerin, wir haben bereits eine Bund-Länder-Vereinbarung zur Unterstützung der Forschung an Fachhochschulen. Diese gilt es nach ihrem Auslaufen im nächsten Jahr weiter zu stärken und auszubauen. Das wäre der richtige Weg. Wir brauchen keinen Aufbau einer Doppelstruktur auf Kosten des deutschen Steuerzahlers.\n\nDie Umsetzung des DigitalPakt Schule läuft mehr als schleppend. Beim Basispakt in Höhe von 5 Milliarden Euro sind zum Jahresende 2021 gerade einmal 19 Prozent der Fördermittel abgeflossen.\n\nNeben digitaler Technik gibt es aber eine noch viel größere Baustelle, nämlich die marode Substanz vieler Schulgebäude. Die aktuellen Zahlen sind dramatisch und ein Armutszeugnis für die Bildungsrepublik Deutschland. Der immens hohe Investitionsrückstand an Schulen von über 46 Milliarden Euro belegt die anhaltende Vernachlässigung von Schulgebäuden durch die Bundesländer. Um diesen Negativtrend zu kippen, haben wir in den Beratungen über den Bundeshaushalt 2022 einen Antrag eingebracht mit der Forderung, den DigitalPakt Schule in einen Zukunftspakt Schule umzuwandeln und mit erweiterten Förderinstrumenten endlich auch Instandsetzungsinvestitionen an Schulgebäuden zu ermöglichen.\n\n({2})\n\nIch danke für die Aufmerksamkeit.\n\n({3})"
"1073668","René","Springer","AfD","Member of Parliament","2022-06-03T00:00:00.000Z","https://dip21.bundestag.de/dip21/btp/20/20042.pdf","\n\nFrau Präsidentin! Meine sehr verehrten Damen und Herren! Liebe Gäste! Man kann über den Sozialhaushalt nicht debattieren, ohne über zwei zentrale Problemfelder zu sprechen, die Sie hier regelmäßig ignorieren und auch heute wieder geschickt umtänzeln. Das ist auf der einen Seite die Inländerfeindlichkeit der Bundesregierung, und das ist auf der anderen Seite die Auswirkung der Migration bezogen auf den explodierenden Sozialhaushalt hier.\n\n({0})\n\nMerkels illegale Grenzöffnung ist nun sieben Jahre her. Schauen wir auf die Zahlen, sehen wir, dass heute 900 000 Menschen aus den Top‑8-Asylherkunftsländern Hartz IV beziehen; das ist die Hälfte aller Migranten aus den Top-8-Asylherkunftsländern. Ja, 400 000 sind in Beschäftigung, 200 000 davon in unterqualifizierten Jobs. Wenn man das umrechnet, stellt man fest, dass auf eine Fachkraft aus diesen Ländern vier Sozialhilfeempfänger kommen. Sie ändern an dieser Politik überhaupt nichts. Sie machen einfach weiter so. Meine Damen und Herren, das ist nichts anderes als staatlich organisierte Veruntreuung von Steuergeld.\n\n({1})\n\nDie Rechnung dafür bezahlen die Arbeitnehmer in diesem Land, die Arbeitnehmer, die nach OECD-Angaben die zweithöchste Belastung durch Steuern und Abgaben weltweit tragen. Anstatt nun die zu entlasten, die es verdient haben, bauen Sie gerade unseren Sozialstaat radikal um und führen ein Grundeinkommen für Asylbewerber ein.\n\nAsylbewerber sollen nach Vorstellung der Bundesregierung zukünftig direkt in Hartz IV durchmarschieren können. Das bedeutet eine Rundum-sorglos-Versorgung, inklusive Klassenfahrt für die Kinder, inklusive Rundumversicherung in der gesetzlichen Krankenversicherung.\n\n({2})\n\nDann gibt es obendrauf über das Entlastungspaket der Bundesregierung eine Einmalzahlung von 200 Euro.\n\nMeine Damen und Herren, obendrauf kommt dann auch noch, dass die Sanktionen für Hartz‑IV-Empfänger abgeschafft werden. Das heißt, wenn jemand die Teilnahme an einem Deutschkurs, eine berufliche Qualifikation oder eine zumutbare Arbeit ablehnt, dann bleibt das zukünftig ohne Konsequenzen. Es gibt also einen Freifahrtschein für Hartz‑IV-Empfänger. Das, meine Damen und Herren, ist ein Nackenschlag für all die Mindestlohnempfänger in diesem Land, die am Ende des Monats trotz eines Vollzeitjobs oftmals weniger in der Tasche haben als ein Hartz-IV-Empfänger.\n\n({3})\n\nUnd obendrauf auf diese ganze Last, auf die Koffer, die getragen werden, kommt jetzt noch die Inflation. Arbeitnehmer werden momentan erdrückt von der höchsten Inflation seit den 70er-Jahren, seit der Ölkrise. Jeder Siebte muss sich höher verschulden, jeder Zweite sorgt sich inzwischen um seinen Lebensunterhalt. Die einzige Antwort, die die Bundesregierung hier zu bieten hat, sind einmalig 300 Euro als Entlastung; und diese 300 Euro müssen auch noch versteuert werden. Das ist ein Witz, meine Damen und Herren. Diejenigen, die den Laden hier am Laufen halten, die Ihnen die 10 000-Euro-Diäten im Monat finanzieren und Ihnen, Herr Minister, die 30 000 Euro, die Sie im Monat bekommen, lassen Sie jetzt bei der Inflation ins offene Messer laufen.\n\n({4})\n\nDie Rentner haben sie gleich völlig vergessen.\n\n({5})\n\nMütter mit drei Kindern bekommen in Deutschland durchschnittlich eine Rente von 751 Euro. Denken Sie darüber nach: 751 Euro durchschnittlich! Ein illegaler Migrant, der in Deutschland lebt, hat zwischen 800 und 1 000 Euro Hartz‑IV-Anspruch.\n\n({6})\n\nDer Migrant bekommt 200 Euro einmalig aus dem Entlastungspaket, und die Mütter in Rente bekommen nichts, gar nichts.\n\n({7})\n\nSie sollten sich schämen hier im Haus, dass Sie das mittragen.\n\n({8})\n\nDas ist nichts anderes als inländerfeindliche Politik, nichts anderes.\n\nDas Haus brennt durch die Inflation, und Sie kippen obendrauf auch noch einen Brandbeschleuniger; denn die Bundesregierung hat kraft eigener Wassersuppe entschieden, aus dem Öl auszusteigen.\n\n({9})\n\nDas heißt also: kein Öl mehr aus Russland, kein Öl mehr nach Leuna, kein Öl mehr nach Schwedt. Russland verkauft derweil sein Öl nach Asien und macht sogar noch mehr Profite, weil der Ölpreis steigt. Meine Damen und Herren, die Folge wird sein, dass Benzin und Diesel in Ostdeutschland und in Deutschland insgesamt teurer werden, dass die Versorgungssicherheit gefährdet wird und dass vor allem Zehntausende Jobs gefährdet sind. Herr Minister Heil, ich erwarte eigentlich von Ihnen, dass Sie nach Schwedt und nach Leuna fahren und den Beschäftigten dort erklären, warum sie zu Kanonenfutter in einem Krieg werden, den Russland wahrscheinlich gewinnen wird.\n\n({10})\n\nGanz einfach: Fahren Sie hin, und erklären Sie das den Leuten! Diese Leute verlieren ihren Arbeitsplatz umsonst.\n\n({11})\n\nMeine Damen und Herren, die inländerfeindliche Politik der Bundesregierung ist nicht alternativlos. Wir haben als Alternative für Deutschland schon im Oktober letzten Jahres mehrere Vorschläge unterbreitet, was man besser machen kann. Entlasten Sie die Arbeitnehmer! Erhöhen Sie die Pendlerpauschale! Senken Sie die Mehrwertsteuer auf Sprit, Gas und Heizöl, damit das Tanken und damit das Fahren wieder bezahlbar ist! Reduzieren Sie die Mehrwertsteuer bei Lebensmitteln auf null, damit man das Essen wieder bezahlen kann! Und vor allem: Stoppen Sie die Gelddruckerei und Niedrigzinspolitik der Europäischen Zentralbank!\n\n({12})\n\nGanz zum Schluss: Stoppen Sie die Wirtschaftssanktionen gegen Russland! Wir schießen Russland vielleicht in ein Knie, wir schießen uns aber in beide Knie. Das kann nicht das Ziel einer interessengeleiteten deutschen Politik sein.\n\nDanke schön.\n\n({13})"
