id,firstname,lastname,faction,position,date, url,speech
"1021007","Uwe","Schulz","AfD","Member of Parliament","2019-03-14T00:00:00.000Z","https://dip21.bundestag.de/dip21/btp/19/19086.pdf","\n\nFrau Präsidentin! Meine Damen und Herren! Der vorliegende Antrag der FDP bezieht sich auf die marktbeherrschende Stellung internationaler Digitalkonzerne. Dieses Thema ist nicht ganz neu. Mittlerweile empfehlen sogar die Langzeitstudien des Kartellamts, der Marktbeherrschung durch Digitalgiganten entgegenzutreten. Das ist prima.\n\nDie Antragsteller fordern, die kartell- und wettbewerbsrechtlichen Rahmenbedingungen endlich der Realität anzupassen und die Unternehmensgründungen zu erleichtern. Das passt. Die AfD ist voll bei Ihnen. Wer in Deutschland ein Unternehmen aufbaut, ob Techbude oder Handwerksbetrieb, soll nicht von Bürokratiemonstern gegängelt werden.\n\nAuch die Regierung Merkel hat das erkannt. Im Koalitionsvertrag von 2013 findet sich folgender Satz:\n\nWir wollen das Gründen von Unternehmen leichter machen: Durch eine Vereinfachung der Prozesse (One-Stop-Agency) soll eine schnellere Unternehmensgründung möglich sein.\n\nUmsetzung in der vergangenen Legislaturperiode? Fehlanzeige, meine Damen und Herren!\n\n({0})\n\nDafür geht es im aktuellen Koalitionsvertrag weiter mit der Forderung nach einer Entbürokratisierung mittels „One-Stop-Shop“-Lösungen. Ähnlicher Name, gleiches Ziel, offenbar gleiches Beratungsunternehmen. Umsetzung bisher? Fehlanzeige!\n\nAber auch Sie von der FDP teilten ja vor einiger Zeit mit Frau Merkel Tisch und Bett. Blickt man in Ihren gemeinsamen Koalitionsvertrag von 2009, findet man dort ganz ähnliche Absichtsbekundungen, wie zum Beispiel das Errichten von Modellregionen für Bürokratieabbau oder das Erleichtern von Gründungen. Das hat leider auch zwischen 2009 und 2013 nicht geklappt. Schade! Aber Ihr mutiger Vorstoß heute, aus der Opposition heraus, ehrt Sie.\n\nEine ähnliche Situation sehen wir beim längst überfälligen Wagniskapitalgesetz. Was geschieht, wenn der deutsche Staat als Investor tätig wird, sehen wir derzeit beim A‑380-Desaster. Für die AfD jedenfalls ist klar: Der Staat soll nicht Business Angel spielen. Er hat aber die Rahmenbedingungen für Investoren so zu setzen, dass Unternehmensbeteiligungen attraktiv werden.\n\n({1})\n\nWie beim Bürokratieabbau haben sich die Merkel-Regierungen auch zu Wagniskapitalregeln schon mehrfach geäußert. Ich zitiere aus dem Koalitionsvertrag 2013:\n\nWir wollen die rechtlichen und steuerlichen Rahmenbedingungen für Wagniskapital international wettbewerbsfähig gestalten …\n\nIm Koalitionsvertrag 2018 steht: „Wir fördern die Gründungskultur“ und geben steuerliche Anreize für die Mobilisierung von Wagniskapital. Und schaut man in den schwarz-gelben Koalitionsvertrag von 2009, so ist dort zu lesen:\n\nWir werden … bessere Rahmenbedingungen für Chancen- und Beteiligungskapital schaffen und für ein Leitbild der unternehmerischen Selbständigkeit werben.\n\nErgebnis auch hier: Es wurde nichts verwirklicht.\n\nMeine Damen und Herren, seit mindestens zehn Jahren versprechen die von Frau Merkel geführten Koalitionen weniger Bürokratie und bessere Rahmenbedingungen für Investoren. Hätte man einfach mal durchgezogen, statt immer nur vollmundig anzukündigen, könnten deutsche Unternehmen heute vielleicht längst den großen US-Digitalkonzernen die Stirn bieten. Und wo wir schon bei den USA sind: Man muss kein Freund von Donald Trump sein; aber eines kann man neidvoll anerkennen. Im Gegensatz zu allen Merkel-Regierungen arbeitet er entschieden daran, seine Wahlversprechen umzusetzen.\n\n({2})\n\nAber, meine Damen und Herren, was nützt der Blick über den Ozean? Kehren wir zurück zum real-existierenden Deutschland. Der vorliegende FDP-Antrag enthält einige gute Ansätze und Ideen. Sie sind zwar nicht neu, aber müssen nun dringend umgesetzt werden.\n\nVielen Dank.\n\n({3})"
"1021016","Martin","Reichardt","AfD","Member of Parliament","2019-03-14T00:00:00.000Z","https://dip21.bundestag.de/dip21/btp/19/19086.pdf","\n\nFrau Präsidentin! Sehr geehrte Damen und Herren! Wir reden heute über den Gesetzentwurf zur Teilzeitmöglichkeit von unter 27‑Jährigen im Bundesfreiwilligendienst und über den Antrag der FDP mit der Zielgruppe Senioren. In der Debatte um die Wiedereinführung der allgemeinen Dienstpflicht warf Herr Lindner der CDU seinerzeit fehlendes Verständnis für die jüngere Generation vor. Der jetzt vorliegende Antrag dokumentiert das fehlende Verständnis der FDP für die ältere Generation. Eine Forderung aus dem Antrag lautet – ich zitiere –, „das Informationsangebot über ein freiwilliges Engagement für Seniorinnen und Senioren transparenter, einfacher zugänglich und verständlicher zu gestalten“. Ihr Fraktionskollege Wolfgang Kubicki, den ich, durchaus mit Respekt und ohne despektierlich zu sein, als Senior bezeichnen würde, würde Ihnen vermutlich klare Worte sagen, wenn Sie ihm Leichte Sprache würden verordnen wollen. Vielleicht ist das ein Grund dafür, dass er diesen altersdiskriminierenden Antrag nicht mit unterzeichnet hat.\n\nZudem zeichnen Sie ein falsches Bild unserer Senioren. Lediglich 463 sind deutschlandweit im Bundesfreiwilligendienst tätig, dafür aber engagieren sich 23 Prozent der über 70‑Jährigen im Ehrenamt. Sie liegen damit an der Spitze beim bürgerschaftlichen Engagement. Dafür gebühren diesen Senioren der Dank dieses Hauses und der Dank unseres Landes und keine altersdiskriminierenden Anträge einer Hipster-Partei, liebe Freunde.\n\n({0})\n\nNun zum Gesetzentwurf der Regierung. Die Einführung einer Teilzeitmöglichkeit im Bundesfreiwilligendienst ist eine technische Regelung, gegen die man kaum etwas einwenden kann und die wir befürworten. Einwände haben wir allerdings dagegen, dass Frau Ministerin Giffey wieder ihre linke Krake „Demokratie leben!“ den Freiwilligendienst pädagogisch begleiten lässt.\n\n({1})\n\nGanze 25 Tage müssen die Teilnehmer in einem Bildungszentrum des Bundes verbringen. Diese Bildungszentren haben eine eindeutige Ausrichtung. So liest man auf der Homepage des Bundesfreiwilligendienstes:\n\nUnsere Bildungsarbeit wird durch die Kooperation mit Projektpartnern des Bundesprogramms Demokratie leben! bereichert.\n\n({2})\n\nDanach folgt die übliche Auflistung aller möglichen Programme gegen rechts.\n\n({3})\n\nDaran erkennt man die fehlende Neutralität. Frau Ministerin Giffey hat betont, „Demokratie leben!“ sei eine neutrale Stütze unserer Zivilgesellschaft. Genau das ist nachweislich nicht der Fall.\n\n({4})\n\nAußerdem vermittelt Frau Giffey den Eindruck, dass es ohne die fleißigen Mitarbeiter von „Demokratie leben!“ den Menschen in Deutschland gar nicht mehr möglich wäre, Demokratie richtig zu praktizieren.\n\n({5})\n\nDie extrem linkslastige pädagogische Zwangsbegleitung der Freiwilligendienste ist eine Misstrauenserklärung gegenüber Vereinen, Institutionen und Elternhäusern, und wir lehnen sie ab.\n\n({6})\n\nIn Vereinen wird Demokratie gelebt, ganz ohne Programme von links.\n\nDie AfD steht übrigens für die Wiedereinführung der Wehrpflicht und für die Einführung einer allgemeinen Dienstpflicht für alle, die nicht Mütter sind.\n\n({7})\n\nDie allgemeine Dienstpflicht ist ein Dienst an der Gesellschaft und an Deutschland.\n\n({8})\n\nDie allgemeine Dienstpflicht steht für Miteinander und gelebte Demokratie. Da stehen alle Bürger in der Verantwortung, kein abstrakter Staat und schon gar keine weltfremde Bundesregierung.\n\n({9})\n\nDie „Fridays for Future“-Demonstrationen haben gezeigt, dass die Jugend in Deutschland bereit ist, Verantwortung zu tragen und sich zu engagieren. Aufgabe einer verantwortungsvollen Politik ist es aber, dafür Sorge zu tragen, dass das Engagement der Jugend nicht in die Fänge der grünen Klimasekte gerät,\n\n({10})\n\neiner Sekte, in der gewissenlose Gurus wie Herr Habeck, Frau Baerbock oder auch Frau Roth unsere Jugend mit irrationalen Klimaängsten für linksextreme Gesellschaftsmodelle gefügig machen wollen.\n\n({11})"
"1021018","Martin","Reichardt","AfD","Member of Parliament","2019-03-14T00:00:00.000Z","https://dip21.bundestag.de/dip21/btp/19/19086.pdf","\n\nFreiwilligendienst ist Dienst an der Heimat und am Gemeinwesen und kein staatlich gefördertes, linksradikales Indoktrinationsseminar. Ich danke allen Menschen, die in Deutschland Freiwilligendienst leisten, auf das Herzlichste und wünsche ihnen weiterhin viel Erfolg.\n\nVielen Dank.\n\n({0})"
"1021030","Nicole","Höchst","AfD","Member of Parliament","2019-03-14T00:00:00.000Z","https://dip21.bundestag.de/dip21/btp/19/19086.pdf","\n\nFrau Präsidentin! Werte Kollegen! Frau Ministerin! Sehr verehrte freiwillige und ehrenamtlich tätige Männer, Frauen, Junge und Alte, Ihnen gebührt unser größter Dank und Respekt. Ihr Engagement ist zugleich Dienst an der Gesellschaft und betrifft viele Bereiche, wie zum Beispiel Naturschutz, Pflege, Internationales, Kultur. Menschen, die sich freiwillig durch Dienste an der Gesellschaft einbringen oder ehrenamtlich tätig sind, sind helle, wärmende Lichter der Gegenwart. Dies gilt besonders in einem Zeitalter, in welchem Digitalisierung Menschen vereinsamen lässt, zu Konsumüberfluss und Oberflächlichkeit verführt und ideologische Fehlwege unsere Gesellschaft täglich rücksichtsloser, undemokratischer, globaler und ungerechter machen.\n\nDie AfD möchte die Werte des Christentums, der Antike, des Humanismus und der Aufklärung erhalten. Dazu gehören auch Bräuche und Traditionen, Dienst an der Gesellschaft, persönliches Engagement im Ehrenamt und den Freiwilligendiensten. Unser erklärter Wille ist es, Freiwilligendienste zu stärken, zu entbürokratisieren, die persönlich bereichernde Lebenserfahrung des Dienstes an der Gesellschaft möglichst vielen zugänglich zu machen. Denn seien wir ehrlich: So, wie das im Moment ausgestaltet ist und in der Natur der Sache liegt, sind Freiwilligendienste eine ziemlich exklusive Veranstaltung.\n\nDer vorliegende Gesetzentwurf der Bundesregierung leistet einen begrüßenswerten, wenn auch sehr geringen Beitrag dazu. Die Frage ist doch: Wie viele Menschen, in absoluten Zahlen oder im Proporz, sind überhaupt vom Teilzeitwunsch betroffen? Der Verdacht liegt nahe, dass sich die Regierung hier genauso wie bei unzähligen anderen Gesetzesvorhaben im Klein-Klein verliert, um auch hier signalisieren zu können: Seht her, wir tun etwas, wir stärken Freiwilligendienste. Und in Wahrheit betrifft es wie viele Personen?\n\nDen Beweis, dass wir wirklich deutlich mehr Menschen zu Freiwilligendiensten bewegen können, tritt die Regierung in diesem Gesetzentwurf nicht an; denn die Begründung ist frei von Zahlen, die die Notwendigkeit eindeutig belegen. Die Regierung möchte auch gar nicht wissen, ob dieses Gesetz wirksam und gut für Deutschland ist; denn eine Evaluierung ist erst gar nicht geplant. Ein regelmäßiger Erfahrungsaustausch soll es dann richten.\n\nDas sehen wir von der AfD anders, wir möchten wenigstens jährlich einen Bericht über die Wirksamkeit und die Entwicklung in diesem Bereich bekommen.\n\n({0})\n\nDarüber hinaus muss man einfach einmal zur Kenntnis nehmen, dass dieser Gesetzentwurf der verzweifelte Versuch ist, zusätzliche Potenziale für den Freiwilligendienst an der Gesellschaft zu heben. Denn dieser Dienst an der Gesellschaft fehlt spürbar und in allen Bereichen. Geben Sie doch bitte endlich zu, dass die Abschaffung des Wehr- und Ersatzdienstes ein Riesenfehler war!\n\n({1})\n\nGerade junge Menschen in diesem Land sind bereit, sich für die Gesellschaft und ihre Zukunft zu engagieren – wie ja auch die Freitagsdemos zeigen – und die Solidarität, die sie einfordern, auch zu leben. Sie engagieren sich für ein Miteinander, für gelebte Demokratie in Vereinen, Institutionen, Elternhäusern, Schulen, Universitäten, in Freiwilligendiensten und Ehrenamt. Die Bereitschaft zum Einsatz für Heimat, Natur, Kultur und Gesellschaft war nie größer als heute. Ermöglichen wir zukünftig großflächig und ganz unbürokratisch allen Menschen diesen Einsatz, nicht nur denjenigen, die sich Engagement im Rahmen von Freiwilligendiensten und Ehrenamt leisten können!\n\nVielen Dank.\n\n({2})"
"1021049","Karsten","Hilse","AfD","Member of Parliament","2019-03-14T00:00:00.000Z","https://dip21.bundestag.de/dip21/btp/19/19086.pdf","\n\nHerr Präsident! Meine Damen und Herren! Die grünen Gläubigen, die sich in allen Altparteien eingenistet haben, glauben bedingungslos dem IPCC, dem sogenannten UN-Weltklimarat. Jede Behauptung – und wäre sie noch so abstrus, egal ob sie bewiesen werden kann oder nicht – wird als absolute Wahrheit förmlich aufgesaugt. Aber kennen Sie auch den UN-Weltstrahlenschutzrat, den Wissenschaftlichen Ausschuss der Vereinten Nationen zur Untersuchung der Auswirkungen der atomaren Strahlung, United Nations Scientific Committee on the Effects of Atomic Radiation, kurz UNSCEAR? Dieser arbeitet bei seinen Berichten eng zusammen mit der Weltgesundheitsorganisation WHO. Die zitieren Sie ja gerne, wenn es mal wieder um absurde Grenzwerte für Stickoxide geht.\n\nZum Reaktorunfall in Fukushima wurden von ­UNSCEAR fast 100 wissenschaftliche Publikationen durchforstet. Ergebnis: kein einziges Strahlungsopfer.\n\n({0})\n\nEs waren nicht, wie ich heute früh in einem Nachrichtenmagazin lesen musste, 18 000, sondern kein einziges Strahlungsopfer. Lesen Sie den Bericht! Dabei handelt es sich auch noch um einen Reaktor aus der Anfangszeit der Kerntechnik in Japan aus den 50er-Jahren.\n\n({1})\n\n– Ja, ist klar – Selbst dieser Reaktor mit dem schweren Designfehler, der in Deutschland nie genehmigt worden wäre, ausgesetzt einem historischen Erdbeben der Stärke 9,1 auf der Richterskala und einer gewaltigen Tsunamiwelle, konnte die Lust der Grünen und Linken auf ein Horrorszenario nicht befriedigen. Kein einziges Strahlungsopfer!\n\n({2})\n\nUnd was tut Deutschland ohne starke Erdbeben und ohne Tsunamis? Hier werden in einer Aktion kopfloser Panik und rein wahltaktisch Reaktoren abgeschaltet und Reaktorbetreiber enteignet.\n\n({3})\n\nDie Geschichte der Kernenergie in Deutschland ist eines der Lügenmärchen. So wird immer wieder behauptet, unsere Reaktoren seien nicht nur unsicher, sondern würden auch Unmengen an Abfall produzieren, der ewig lange und stark vor sich hin strahlt.\n\n({4})\n\nFragen Sie mal einen Physiker – jetzt nicht unbedingt unsere Kanzlerin, aber jeden anderen –: Radioaktive Reststoffe können entweder stark strahlen oder lange strahlen, aber nicht beides zusammen.\n\n({5})\n\nAuch bei der Menge wird in unseren Qualitätsmedien konsequent übertrieben. Doch selbst diese geringe Menge an Abfällen könnte man noch entschärfen. Auf ein geologisches Endlager könnte man heute vollständig verzichten. Man müsste dazu allerdings technologieoffen sein – ein Fremdwort nicht nur für die Grünen, sondern auch für unsere grüne Bundesregierung.\n\n({6})\n\nFür die Zuschauer: Schauen Sie mal nach „Partitionierung und Transmutation“.\n\n({7})\n\nEs sei denn, es geht um Technologie, die schon die Babylonier genutzt haben, wie Windmühlen. Da ist plötzlich alles innovativ, auch wenn es unsere Flora und Fauna zerstört und Menschen krank macht.\n\n({8})\n\nFür Kernenergie hingegen gibt es wirklich neue Konzepte, die noch weniger Abfall produzieren, die sogar die bisherigen Reststoffe zur Stromproduktion nutzen könnten und bei denen das Risiko eines GAUs gegen null geht: sogenannte Flüssigsalzreaktoren.\n\n({9})\n\n– Ich weiß, dass es für Sie ein Fremdwort ist. – Aber auch diese Technologien überlassen wir lieber Ländern wie Kanada.\n\nIch weiß, dass gerade beim Thema Kerntechnik viele CDU-Kollegen mit geballter Faust in der Tasche hier sitzen, aber Mutti hat eben gesagt: Mit diesen Förmchen spielen wir nicht mehr.\n\n({10})\n\nVielleicht setzen sich nach dem hoffentlich baldigen Abgang von Frau Merkel die Vernünftigen wieder durch.\n\n({11})\n\nMit denen arbeiten wir dann auch gerne zusammen.\n\nVielen Dank für Ihre Aufmerksamkeit.\n\n({12})"
"1021055","Karsten","Hilse","AfD","Member of Parliament","2019-03-14T00:00:00.000Z","https://dip21.bundestag.de/dip21/btp/19/19086.pdf","\n\nVielen Dank. Es geht auch ganz schnell. – Liebe Frau Schwarzelühr-Sutter, ich habe nicht gesagt, dass radioaktive Reststoffe nicht strahlen. Ich habe nur gesagt, dass immer wieder behauptet wird, dass atomare Reststoffe sehr lange und sehr stark strahlen. Ich habe darauf abgehoben – fragen Sie einen Physiker, der wird Ihnen das bestätigen –, dass atomare Reststoffe entweder lange strahlen oder stark strahlen. Beides zugleich nicht.\n\n({0})\n\n– Okay. – Darauf wollte ich bloß eingehen.\n\nDanke schön.\n\n({1})"
"1021067","Rainer","Kraft","AfD","Member of Parliament","2019-03-14T00:00:00.000Z","https://dip21.bundestag.de/dip21/btp/19/19086.pdf","\n\nSehr geehrter Herr Präsident! Geehrte Abgeordnete! Werte Gäste! Eine kurze Vorbemerkung: Frau Kotting-Uhl, Sie hatten sinngemäß in Ihrer Rede als größte Bedrohung für das Leben, das Wohlbefinden, das Glück der Leute die Kernenergie ausgemacht.\n\n({0})\n\nMit dem Zusammenbruch der Sowjetunion ist die durchschnittliche Lebenserwartung in der Ukraine um acht Jahre gesunken. Das heißt, das Atomunglück von Tschernobyl hat auf die durchschnittliche Lebenserwartung der Bewohner der Ukraine einen vernachlässigbaren Einfluss gehabt. Der Verlust des Wohlstandes, der Arbeitsplätze, der inneren Sicherheit im Zuge des Zusammenbruchs der Sowjetunion hingegen hat zu einer Reduktion von acht Jahren geführt.\n\n({1})\n\nDas heißt, wir sehen, die größte Bedrohung für das Leben, das Wohlbefinden und das Glück der Leute geht von einer Deindustrialisierung aus, wie Sie sie zum Beispiel mit der Verkehrs- und der Energiewende in diesem Land vorantreiben wollen.\n\n({2})\n\nDer vorliegende neue Antrag der Grünen dürfte tatsächlich eines der verlogensten und heuchlerischsten Dokumente sein, die dieses Parlament je ertragen musste.\n\n({3})\n\nDer Titel des Antrags entlarvt Sie dabei, dass Sie die katastrophalen Ereignisse im März 2011 auf die nuklearen Störfälle in den Blöcken Fukushima Daiichi 1 bis 3 reduzieren und dabei kein Gedenken an die Toten des Tohoku-Erdbebens zulassen. Sie haben das mit Ihrer Rede mehr oder weniger bestätigt. Sie instrumentalisieren also die Toten der Naturkatastrophe, um Ihre ideologische Abneigung bezüglich der Kernenergie auszuleben. Das, meine Damen und Herren, ist ekelhaft.\n\n({4})\n\nAus den Kraftwerksblöcken selbst, vor denen Sie uns so nachdrücklich warnen, gibt es übrigens keine Toten zu vermelden, die in irgendeiner Form mit der freigesetzten Strahlung in Verbindung gebracht werden können, so der Bericht der Vereinten Nationen. Um es direkt noch einmal klarzustellen: Es hat in Fukushima keine Todesfälle oder Fälle von beobachteter Strahlenkrankheit bei irgendeinem der über 20 000 Arbeiter gegeben, die im Kernkraftwerk mit den Aufräumarbeiten betraut waren.\n\nDer Bericht der Vereinten Nationen stellt klar, dass die gesamte erwartete Lebenszeitdosis für Bewohner der Präfektur Fukushima, die aus dem Reaktorunglück resultiert, unter 10 Millisievert liegen wird. In Relation: Diese Lebenszeitbelastung entspricht etwa dem, was in Deutschland zum Beispiel in Weinkellern von den Behörden als Exposition pro Jahr als zulässig angesehen wird; pro Jahr, liebe Kollegen von den Grünen.\n\nDer Bericht stellt klar, dass zweieinhalb Jahre nach dem Unglück die Cäsium‑137-Werte jenseits der direkten Kraftwerksumgebung auf Werte aus der Zeit vor dem Unglück gesunken sind. Die in den Sedimenten gemessenen Werte bewegen sich im Bereich dessen, was in Deutschland zum Beispiel bei der Strahlenbelastung von Wild noch als unbedenklich zum Verzehr angesehen wird. Hätte Japan seine Kernkraftwerke nach deutschen Maßstäben nachgerüstet, wären diese Freisetzung von Radioaktivität und auch die begleitenden Knallgasexplosionen verhindert worden. Manche Politiker, allen voran der deutsche EU-Kommissar Oettinger, bezeichnen das vorschnell als Apokalypse und offenbaren damit die gesamte Lächerlichkeit ihrer ideologisierten Hysterie.\n\n({5})\n\nDie jährlichen Strahlenschutzberichte beweisen es. Seit 2011 kann man dort jährlich lesen – ich zitiere –: Im laufenden Jahr xy sind\n\nwie schon in der zweiten Jahreshälfte 2011 keine erhöhten Radionuklidaktivitäten aus dem Fukushima-Ereignis mehr nachweisbar.\n\nWir erinnern uns: In Deutschland hat damals die schwarz-gelbe Regierung die Ausstiegspirouette hingelegt und einen nur wenige Monate alten Entschluss zur Laufzeitverlängerung der deutschen Kernkraftwerke wieder kassiert. Geholfen hat das freilich nichts; denn bei den folgenden Landtagswahlen in Baden-Württemberg ist die CDU krachend gescheitert. Das Ländle ging für die Union verloren und ist es bis heute.\n\n({6})\n\nUnd in Japan selbst? In Japan sind heute wieder neun Kernreaktoren in Betrieb, zwei sind im Bau und 16 weitere befinden sich in den verschiedenen Stadien der erneuten Erteilung von Betriebsgenehmigungen. Japan bekennt sich also zur nuklearen Zukunft. Im Übrigen hat sich auch Taiwan im letzten Herbst in einer Volksabstimmung dazu bekannt, den Ausstieg nicht weiter fortzusetzen, sondern die Kernkraftwerke wieder zu betreiben.\n\n({7})\n\nAuch rund um Deutschland befinden sich zahlreiche Kernkraftwerke im Bau, zum Beispiel in Großbritannien, der Slowakei, Finnland, Weißrussland oder der Türkei.\n\n({8})\n\nDies bringt uns zu einem besonders perfiden Detail des neuen Antrags der Grünenfraktion: Sie fordern die Nichterteilung von Hermes-Exportkreditbürgschaften für sämtliche Lieferungen aus Deutschland an bestehende oder im Bau oder Planung befindliche Kernkraftwerke. Die schließt Lieferungen von Sicherheitstechnik mit ein. Deutsche Unternehmen liefern weltweit führende Technologie, mit der Kernkraftwerke mit höchster Sicherheit ausgestattet werden. Diese Technologie rettet Leben, und diese wollen Sie unseren europäischen Partnern verwehren. Sie wollen, dass aktuelle Projekte mit Sicherheitstechnik zweiter Wahl ausgestattet werden. Sie wollen, dass diese Projekte unsicher sind.\n\n({9})\n\nSie wollen hier neue nukleare Zwischenfälle produzieren, um Ihre These der unsicheren Kernkraft zu untermauern. Sie spielen mit dem Schicksal und der Gesundheit unzähliger Menschen.\n\n({10})\n\nEs ist besonders heuchlerisch, Frau Kotting-Uhl, wenn Sie in Ihrer Rede den Schutz der einheimischen Bevölkerung thematisieren, während Sie Lieferungen aus Deutschland von bester Sicherheitstechnik für die Kernkraftwerke in Europa verweigern wollen. Sie vernichten mit Ihrem ökopopulistischen Wahnsinn Arbeitsplätze,\n\n({11})\n\nWohlstand und technologische Errungenschaften, und Sie gefährden Menschenleben, nur um Bestätigung für Ihre grotesken Horrorszenarien zu produzieren.\n\n({12})\n\nIm Mittelpunkt Ihrer Politik steht weder Umwelt noch die Gesundheit der Menschen, sondern eine kalte, menschenverachtende Ideologie.\n\nVielen Dank.\n\n({13})"
