id,firstname,lastname,faction,position,date, url,speech
"1039305","Martin","Sichert","AfD","Member of Parliament","2020-04-23T00:00:00.000Z","https://dip21.bundestag.de/dip21/btp/19/19156.pdf","\n\nJa."
"1039307","Martin","Sichert","AfD","Member of Parliament","2020-04-23T00:00:00.000Z","https://dip21.bundestag.de/dip21/btp/19/19156.pdf","\n\nWie können Sie hier Äpfel mit Birnen vergleichen? Im Gesetz steht – ich zitiere extra noch einmal für Sie –:\n\n... junge Menschen [sind] förderungsberechtigt, die ... ihren Wohnsitz und ihren gewöhnlichen Aufenthalt außerhalb\n\n– außerhalb! -\n\nvon Deutschland haben …\n\n({0})\n\nEs geht hier nicht um die Migranten, die seit 30 Jahren hier leben, die gut integriert sind, die Teil dieser Leistungsgesellschaft sind, sondern es geht darum, dass wir als Staat und dass die Regierung hier ständig Geld ausgibt für Leute aus dem Ausland, und das mit dem hart verdienten Geld der deutschen Steuerzahler,\n\n({1})\n\ndie überhaupt nicht wissen, woher sie noch irgendwelche Rücklagen bilden sollen. Das ist der Skandal an dieser Stelle, und das ist das, was auch in diesem Gesetz wieder eine völlig falsche Lenkungswirkung hat.\n\n({2})\n\n– Ich habe Sie auch lieb; aber wenn Sie etwas sagen wollen, machen Sie doch eine Zwischenfrage.\n\nIn diesem Sinne fasse ich alles noch einmal kurz zusammen:\n\n({3})\n\nSchaffen Sie bitte einen schlanken, digitalisierten Staat; aber hören Sie auf,\n\n({4})\n\nständig mit unnötigen Förderungsmaßnahmen neue Belastungen für die Steuerzahler einzuführen.\n\nVielen Dank.\n\n({5})"
"1039325","Leif Erik","Holm","AfD","Member of Parliament","2020-04-23T00:00:00.000Z","https://dip21.bundestag.de/dip21/btp/19/19156.pdf","\n\nSehr geehrte Bürger! Frau Präsidentin! Meine Damen und Herren! Ich bin wirklich gespannt, wie und wann dieses Gesetzes jemals in Kraft treten wird. Wir merken es hier ja schon: Die Positionen sind extrem weit aufgespannt. Die Grünen haben angekündigt, das so nicht mitmachen zu wollen, und auch wir werden diesem Entwurf nicht zustimmen, obwohl wir grundsätzlich ein modernes Geologiedatengesetz befürworten. Aber wir glauben, dass die Korrekturen, die jetzt ins Gesetzgebungsverfahren eingebracht wurden, immer noch massiv in die Eigentumsrechte der betroffenen Unternehmen eingreifen. Das wollen wir nicht, und wir glauben auch nicht, dass das Bestand haben wird.\n\n({0})\n\nGenau diese Eingriffe haben ja auch die Experten in der Anhörung kritisiert. Es gab große Zweifel daran, dass das Gesetz verfassungskonform sein würde. Wir sehen diese Probleme nach wie vor nicht behoben. Das Gesetz darf nicht dazu führen, dass viele Unternehmen ihren teuer erworbenen Wissensschatz verlieren und damit faktisch teilenteignet werden.\n\nMan muss sich das wirklich einmal vorstellen: Eine Firma investiert aufwendig, betreibt Bohrungen, um exklusive Erkenntnisse über den Boden zu gewinnen und damit natürlich auch Geld zu verdienen, und dann kommt der Staat und sagt: Du hast da interessante Informationen. Gib mal her! Die Öffentlichkeit interessiert das auch. – Das ist wirklich schwierig. So, meine Damen und Herren, kann es nicht gehen.\n\n({1})\n\nEs handelt sich um wertvolle private Daten; die sind das Kapital dieser Firmen. Wenn Sie diesen Unternehmen ihren selbst erarbeiteten Vorsprung nehmen, dann werden die ihr Geschäftsmodell überdenken müssen; dann werden in Zukunft eben keine Erkundungen mehr in Angriff genommen, wird nicht mehr investiert. Das schädigt das Vertrauen und wäre mit Sicherheit nicht der Weg zu Wachstum und mehr Beschäftigung.\n\nHinzu kommt, dass der Bund wieder einmal eine Menge Bürokratiekosten schafft. Der Erfüllungsaufwand liegt geschätzt bei einer guten Million Euro. „Entbürokratisierung“ ist hier also auch wieder nur eine Worthülse der Regierung. Tatsächlich passiert das Gegenteil, und das ausgerechnet in einer schwierigen Zeit, in der die Wirtschaft jede Entlastung mehr als dringend bräuchte. Das halten wir für den falschen Weg.\n\nNoch einmal zum Thema Endlager. Ja, es ist tatsächlich eine schwierige Abwägung zwischen dem öffentlichem Interesse und dem Geheimhaltungsbedürfnis der Unternehmen. Nur schaffen, wie gesagt, Ihre bisherigen Änderungen am Entwurf unserer Meinung nach da keinen ausgewogenen Ausgleich. Ein Expertengremium, das die Notwendigkeit der Veröffentlichung von privaten Daten beurteilen soll, wird nicht ausreichen, damit das Gesetz verfassungskonform wird.\n\n({2})\n\nEs gab einen Vorschlag, für den wir durchaus Sympathie hatten: von Professor Rossi. In der Anhörung hat er genau das angesprochen: ein abgestuftes Verfahren, mit dem wir vorgehen könnten, also erst sozusagen per Ausschlussverfahren horizontal und vertikal Standorte auszuschließen, die nicht infrage kommen, und dann die wenigen übriggebliebenen Standorte tatsächlich näher zu untersuchen und da gegebenenfalls verhältnismäßig – die Verhältnismäßigkeit ist das Entscheidende – einzugreifen, wenn es denn wirklich notwendig sein sollte.\n\nVielleicht auch dies noch: Wenn wir schon über ein Endlager diskutieren, müssen wir heute immer die Alternativen mit auf dem Schirm haben; denn diese Alternativen kommen langsam. Ich habe das in der ersten Lesung schon angesprochen: Es ist durchaus anzunehmen, dass wir ein solches Endlager in einigen Jahren vielleicht gar nicht mehr brauchen; denn die Stimmen mehren sich, dass moderne Verfahren – Stichwort: Transmutation – oder moderne Reaktortypen es möglich machen, auch die Reststoffe noch zu verwerten.\n\n({3})\n\nMeine Damen und Herren, eines zum Schluss: Sie wollen möglichst viel Transparenz bei der Endlagersuche herstellen, und das ist ja auch eine gute Idee. Nur, aus unserer Sicht ist die naiv. Wir erleben das ja auch jetzt in der Diskussion: Die Grünen wettern jetzt schon gegen den Entwurf. Es ist doch klar – für mich jedenfalls ist es klar –: Die Antikernkraftlobby in diesem Land wird sich dadurch sicherlich nicht besänftigen und schon gar nicht überzeugen lassen. Das wird sicherlich ein Wunschtraum bleiben.\n\nDanke schön.\n\n({4})"
"1039351","Kay","Gottschalk","AfD","Member of Parliament","2020-04-23T00:00:00.000Z","https://dip21.bundestag.de/dip21/btp/19/19156.pdf","\n\nSehr geehrter Herr Präsident! Verehrte Kollegen! Liebe Zuschauerinnen und Zuhörer! Herr Haase, gut gebrüllt! Aber an der Stelle muss auch ich Sie korrigieren. Sie wissen – darauf komme ich in meiner Rede gleich zu sprechen –: Es gibt Verteilungsschlüssel. Wenn den Kommunen in Teilen die Einnahmen wegbrechen, werden sie auch den Ländern wegbrechen.\n\n({0})\n\nInsoweit ist das ein schönes Verteilspiel an dieser Stelle.\n\nHeute reden wir also über den Antrag der Linken „Schutzschirm für Kommunen in der Coronakrise“. Diese Debatte verfolgt uns schon seit Längerem. Herr Scholz stand ja auch schon hier am Rednerpult und hat hierzu Vorschläge gemacht. Insoweit ist es leider alter Wein, aber in neuen Schläuchen, die notwendiger denn je sind. Bereits die Kommission „Gleichwertige Lebensverhältnisse“ kam zu der Empfehlung, dass überschuldeten Kommunen – und die haben wir nun mal, und da nützt es auch nichts, wenn Sie die Leistungsfähigkeit und die Grenzfähigkeit dieser Kommunen hier preisen – vom Bund geholfen werden soll.\n\nHierzu legte das Bundeskabinett am 10. Juli 2019 – immerhin, meine Damen und Herren, Juli 2019! – Maßnahmen der Bundesregierung zur Umsetzung der Altschuldenpolitik vor. Seitdem ist auch viel passiert. Umgesetzt wurde aber leider nichts – vielleicht ein Mantra dieser Regierung Merkel. Erst am 11. März 2020 konnte man in der Zeitschrift „Der Neue Kämmerer“, die viele hier, die in der Kommunalpolitik tätig sind, kennen – das ist die Hauspostille aller kommunalen Finanzer –, lesen: „Altschulden-Einigung liegt erst mal auf Eis“.\n\nIm Weiteren möchte ich deshalb auch nicht auf das Für und Wider der Maßnahmen zur Eindämmung von Corona eingehen. Ob sie nun wirksam sind oder nicht, das werden andere dann klären. Das überlasse ich den Gesundheitsexperten. Als Finanzer bin ich aber schon der Meinung, dass unsere Aufgabe darin besteht, verehrte Kollegen, über die Folgen dieser Maßnahmen zu sprechen. Als Bundestagsabgeordnete haben wir nämlich die verdammte Pflicht, über die anstehenden Auswirkungen uns jetzt, hier und heute, zu unterhalten und für geeignete Maßnahmen zu sorgen. Ja, Frau Merkel – sie ist jetzt nicht hier –, diese Diskussionsorgie müssen wir in der Tat führen.\n\nAls Mann der Zahlen möchte ich die heute schon bestehende Problematik – darauf sind Sie leider nicht eingegangen, Herr Haase – einfach mal anhand von Zahlen verdeutlichen; denn Zahlen lügen nicht. Aus dem Bericht der Kommission „Gleichwertige Lebensverhältnisse“ lässt sich nämlich auch herauslesen, dass die Verschuldung der kommunalen Kernhaushalte beim öffentlichen und nichtöffentlichen Bereich in den vergangenen 20 Jahren um rund 35 Prozent gestiegen ist – 35 Prozent! Während der Bund seine Neuverschuldung tatsächlich unter die magische 60-Prozent-Grenze drücken konnte, ist in vielen Kommunen die Verschuldung der Kernhaushalte gestiegen. Ich rechne da nicht, wie hier in Berlin üblich, die Schattenhaushalte und die kommunalen Unternehmen mit hinein, in denen auch gerne mal die eine oder andere Geschichte versteckt wird.\n\nMeine Damen und Herren, das liegt daran, dass die Kassenkreditbestände gestiegen sind. Diese haben sich von 1997 bis 2014 verzehnfacht. Wir sprechen hier von 49,7 Milliarden Euro. Diese Kassenkredite dienen eben nicht investiven Aufgaben, sondern sie wurden rein zur Deckung der laufenden Verpflichtungen aufgenommen. Jeder bei uns in NRW kann das bewundern, wenn er über kaputte Brücken – von Brücken, die nicht gebaut werden können, ganz zu schweigen – oder über Schlaglöcher zur Arbeit fährt.\n\nMeine Damen und Herren, was denken Sie denn, was passiert, wenn jetzt noch die Coronamaßnahmen das Land treffen? Was wird dann bei den Kommunen geschehen? Schauen Sie dazu in den aktuellen Bericht des Bundesfinanzministeriums. Aus dem geht hervor, dass bereits im März die Gewerbesteuerumlage um 54,5 Prozent eingebrochen ist. Sie ist ein guter Indikator dafür, dass man wohl davon sprechen kann, dass die Gewerbesteuereinnahmen der Gemeinden im wahrsten Sinne des Wortes wegbrechen werden. Ich zitiere auch hier aus der Ausgabe des „Neuen Kämmerers“ von gestern:\n\nZu Monatsbeginn machte bereits der Deutsche Städtetag auf die drohende finanzielle Notlage vieler Kommunen aufmerksam. Damals sagte Burkhard Jung, Präsident des Städtetags und Leipziger Oberbürgermeister, dass der Verband für das Jahr 2020 ein Defizit der deutschen Kommunen in zweistelliger Milliardenhöhe befürchte."
"1039353","Kay","Gottschalk","AfD","Member of Parliament","2020-04-23T00:00:00.000Z","https://dip21.bundestag.de/dip21/btp/19/19156.pdf","\n\nIch komme zum Ende, ja. – Bevor Sie also großzügig über 500 Milliarden Euro, wie es heute in der Presse stand, oder viele Dinge für Europa nachdenken – das mag schön und gut sein –, denken Sie zunächst mal darüber nach, –"
"1039355","Kay","Gottschalk","AfD","Member of Parliament","2020-04-23T00:00:00.000Z","https://dip21.bundestag.de/dip21/btp/19/19156.pdf","\n\n– wie Sie in der Heimat und den vielgepriesenen Kommunen und damit den Einrichtungen wie Bibliotheken vor Ort helfen können. Wir jedenfalls stimmen der – –\n\n({0})"
"1039438","Albrecht","Glaser","AfD","Member of Parliament","2020-04-23T00:00:00.000Z","https://dip21.bundestag.de/dip21/btp/19/19156.pdf","\n\nHerr Präsident! Meine sehr verehrten Damen und Herren! Zur Abmilderung der Folgen der Coronakrise haben die Bundesregierung und die Landesregierungen Konzepte vorgelegt, die auf Existenzsicherung von Unternehmen und Unternehmern zielen und mit denen die Arbeitnehmer, soweit eine Weiterbeschäftigung unmöglich wird, durch Lohnersatzleistungen von bis zu 87 Prozent der bisherigen Nettoverdienste unterstützt werden.\n\nVon den 2 Billionen Euro öffentlicher Schulden, die wir seit der Finanzkrise 2008/2009 angehäuft haben, ist seither nichts getilgt worden. Die stets wiederholte Behauptung der Regierung, man habe in den vergangenen Jahren gut gewirtschaftet, ist daher – vorsichtig ausgedrückt – kühn. Ohne eine solche Vorbelastung hätten wir jetzt andere Handlungsmöglichkeiten.\n\nKleinbetrieben und Selbstständigen soll durch nichtrückzahlbare Zuschüsse die Last fixer und remanenter Kosten erleichtert werden. Dafür werden 50 Milliarden Euro bereitgestellt. Mittel- und Großunternehmen werden staatsverbürgte Kredite im Volumen von 600 Milliarden Euro angeboten, um Insolvenzen zu vermeiden.\n\nVerbunden mit dieser Liquiditätshilfe, meine Damen und Herren, ist jedoch automatisch der Anstieg der Fremdkapitalisierung aller Programmteilnehmer, weil Erlösausfälle kompensiert und nicht etwa Investitionen mit den neu aufgenommenen Schulden finanziert werden. Die im internationalen Vergleich unterfinanzierte deutsche Wirtschaft wird durch die zusätzlich steigende Fremdfinanzierung Ertragskraft verlieren. Die Sicherung der Fremdmittelversorgung muss daher flankiert werden durch ein Bündel fiskalischer Maßnahmen – diese Diskussion fängt an, sich durchzusetzen; vor ein paar Tagen war davon überhaupt noch nicht die Rede –, welche die Ertragskraft der Unternehmen stärken. Denn nur das wird weiterhelfen. Solche Maßnahmen werden auch bewirken, dass weniger Darlehen in Anspruch genommen werden.\n\nWir fordern daher eine erleichterte Umstellung von der Soll- auf die Istbesteuerung nach § 20 Umsatzsteuergesetz und eine Erhöhung der Umsatzgrenze für die Istbesteuerung; eine Anhebung der Kleinunternehmergrenze nach § 19 Umsatzsteuergesetz – ganz nebenbei wäre das eine hochwirksame Hilfe für alle Kleinunternehmer, Selbstständigen und Kulturschaffenden, und zwar viel wirkungsvoller als das, was die Grünen beantragt haben –; obligatorische Erstattung der Sondervorauszahlung der Umsatzsteuer und das Verrechnungsmodell für die Einfuhrumsatzsteuer. Meine Damen und Herren, die Fachleute wissen, worum es dabei geht: Diese beiden Maßnahmen haben sofort eine Liquiditätswirkung für die Unternehmen, und sie sind mit wenig Verwaltungsaufwand und ohne fiskalische Belastung zu machen. Es wäre unintelligent, es nicht zu tun.\n\nWir fordern des Weiteren: die Verbesserung des Spendenabzugs nach § 10b Einkommensteuergesetz für Coronahilfen; die Zulassung des Rücktrags von Verlusten – auch da beginnt die Diskussion, gottlob – für das Wirtschaftsjahr 2020, und zwar bei allen drei Ertragsteuerarten, Einkommensteuer, Körperschaftsteuer und Gewerbesteuer; die Öffnung der vollen Verlustverrechnung aus dem Wirtschaftsjahr 2020 für die Folgejahre – es ist makaber, jetzt in die Verluste zu fahren und nächstes Jahr nicht die volle Verlustverrechnung zuzulassen, wie es derzeit geltende Rechtslage ist –; Aussetzung der Zinsschranke nach § 4h Einkommensteuergesetz bzw. nach § 8 Absatz 1 des Körperschaftsteuergesetzes – auch das eine Behinderung in der Verlustverrechnung, tatsächlich sich selbst helfen zu können –; Beseitigung der zweiten Hälfte der Solibelastung; Indexierung des Formeltarifs der Einkommensteuer gemäß Kaufkraftverlust, um endlich die heimlichen Steuererhöhungen zu verhindern; und schließlich für die Nachfrageseite und zur Kompensation des Kaufkraftverlustes breiter Schichten der Bevölkerung durch Corona Ermäßigung der Umsatzsteuer in toto um 4 Prozent beim normalen und um 2 Prozent beim ermäßigten Steuersatz.\n\nEine vorübergehende Entlastung für die Gastronomie, soweit sie überlebt, wird kaum Wirkung entfalten. Das kann man machen, oder man kann es lassen; es hat keine Auswirkungen.\n\nWir fordern ferner eine sofortige gesetzgeberische Absenkung der Nachzahlungszinsen von 6 Prozent auf normales Marktzinsniveau; das ist wahrscheinlich verfassungsrechtlich ohnehin geboten."
"1039371","Petr","Bystron","AfD","Member of Parliament","2020-04-23T00:00:00.000Z","https://dip21.bundestag.de/dip21/btp/19/19156.pdf","\n\nSehr geehrter Herr Präsident! Liebe Kolleginnen! Liebe Kollegen! Lieber Heiko Maas, was für eine Mogelpackung servieren Sie uns hier? Für wie dumm halten Sie uns eigentlich? Für wie dumm wollen Sie die Menschen in diesem Land verkaufen? Wir alle wissen, dass Irini der Ersatz für die gescheiterte Mission Sophia ist. Und Sie erzählen uns hier heute – genauso wie zuvor fünf Jahre lang bei Sophia –, dass es darum ginge, Waffenschmuggel zu unterbinden, den Ölschmuggel aus Libyen zu unterbinden und Menschenschlepperei im Mittelmeer zu bekämpfen. Dabei ist schon Sophia von der damaligen italienischen Regierung mithilfe unseres Freundes Matteo Salvini versenkt worden, da nachgewiesen wurde, dass mit den Schiffen nur Migranten aus Afrika nach Europa geschmuggelt wurden.\n\n({0})\n\nWenn Sie hier über Erfolge sprechen, haben wir uns gedacht: Okay, wenn Sie diese Geschichte nach fünf Jahren noch einmal auftischen, dann fragen wir doch das Verteidigungsministerium: Was wurde denn erreicht? Zeigen Sie uns mal die beschlagnahmten Waffen! – Und wissen Sie, was das Verteidigungsministerium uns geantwortet hat? Nichts! Sie haben in fünf Jahren 85 Millionen Euro verballert und können uns nicht mal präsentieren, was Sie beschlagnahmt haben. Es wurde kein einziger Waffenschmuggler gefangen. Das ist ja auch kein Wunder: Denn die Schiffe haben munter Migranten aus Afrika nach Europa geschmuggelt. Hierzu gibt es allerdings eine Zahl: 49 000 Migranten haben sie nach Europa geschafft.\n\n({1})\n\nIch fasse mal zusammen: Sie erzählen uns, bei dieser Mission gehe es darum, Öl- und Waffenschmuggel zu unterbinden. Das Ergebnis aber ist: 49 000 Migranten wurden nach Europa gebracht. Noch einmal: Was für eine Mogelpackung! Und ich wiederhole: Für wie dumm halten Sie uns eigentlich?\n\n({2})\n\nWir von der AfD haben das illegale Shutteln von Migranten aus Afrika nach Europa von Anfang an bekämpft. Wir von der AfD haben Strafanzeigen gegen alle deutschen NGOs gestellt, die diesen Menschenschmuggel betreiben. Und wir haben zusammen mit unseren italienischen Freunden dafür gekämpft, dass die Boote von Menschenschmugglern beschlagnahmt wurden und dass Leute wie Carola Rackete und Claus-Peter Reisch ins Gefängnis gewandert sind.\n\n({3})\n\nWir haben all das sicher nicht deswegen gemacht, damit wir Ihnen hier und heute einen Persilschein dafür ausstellen, dass Sie mit den Schiffen der deutschen Marine weiterhin Menschenschmuggel betreiben.\n\n({4})\n\nWir lehnen die Mission logischerweise ab. Wir werden gegen diese Politik auch weiter ankämpfen. Wir werden auch weiter Ihre Lügen aufdecken. Wir werden auch weiterhin mit unseren Freunden aus Österreich, Ungarn, Italien und Polen Widerstand gegen Ihre Open-Border-Policy aufrechterhalten. Spätestens dann, wenn unser Freund Matteo Salvini in Italien wieder an der Regierung ist, werden wir die Mission wieder versenken.\n\nDanke schön.\n\n({5})"
"1039376","Armin Paulus","Hampel","AfD","Member of Parliament","2020-04-23T00:00:00.000Z","https://dip21.bundestag.de/dip21/btp/19/19156.pdf","\n\nVielen Dank, Herr Kollege, dass ich die Möglichkeit habe, eine Frage zu stellen. Ich hatte die Frage schon im Ausschuss gestellt, aber sie ist mir leider nicht beantwortet worden.\n\nWie stellen Sie sich das eigentlich persönlich vor, wenn man im Zuge der Irini-Mission, sagen wir mal, einen russischen Frachter vor sich hat? Der Kommandant funkt ihn also an: Lieber Herr Kapitän des russischen Frachters, haben Sie Waffen an Bord? Dann wird der wahrscheinlich sagen: Nein. Und was machen wir dann? Eine ganz praktische Frage. Wie stellen Sie sich das vor? Ich stelle es mir so vor, dass der russische Kapitän Nein sagt, der Kommandant sich herzlich für die Auskunft bedankt, das in sein Logbuch einträgt und der russische Kapitän weiterfährt. Aber wie stellen Sie es sich vor, Herr Hardt?"
"1039402","Peter","Boehringer","AfD","Member of Parliament","2020-04-23T00:00:00.000Z","https://dip21.bundestag.de/dip21/btp/19/19156.pdf","\n\nHerr Präsident! Verehrte Kolleginnen und Kollegen! Wir können heute feststellen, dass die apokalyptischen Coronaprognosen der Regierung, mit denen hier Ende März die gewaltigen Einschränkungen der Bürgerrechte und der superteure Shutdown begründet wurden, unzutreffend waren, zum Glück natürlich, aber nicht bedingt durch den verfügten Stillstand."
"1039404","Peter","Boehringer","AfD","Member of Parliament","2020-04-23T00:00:00.000Z","https://dip21.bundestag.de/dip21/btp/19/19156.pdf","\n\nEs ist schade, dass es keine Zwischenfrage gab; denn ich hätte zu diesem Thema gern mehr Redezeit gehabt.\n\nJedenfalls wurde der Shutdown erst verfügt, als die Seuche bereits beherrscht wurde bzw. fast beherrscht war. Die AfD hat darum zu Recht am 25. März hier beantragt, die Maßnahmen zeitlich streng auf maximal vier Wochen zu befristen, sie dann zu evaluieren und gegebenenfalls zügig aufzuheben – sehr zu Recht, wie wir heute wissen.\n\nVor diesem Hintergrund plant nun auch noch die EU eigene billionenschwere Coronakrisenprogramme. Das ist grotesk. Corona ist ein symmetrischer Schock, für alle Länder der EU gleich. Das Virus darf darum keine asymmetrischen Geldtransfers zulasten Deutschlands begründen.\n\n({0})\n\nDie EU will wieder einmal mit deutschem Geld ihre Existenzberechtigung zurückkaufen, die sie längst verloren hat.\n\nDie EU hat bereits Maßnahmen für gewaltige 500 Milliarden Euro beschlossen: erstens ein 200-Milliarden-Euro-Programm der Europäischen Investitionsbank – dieses steht in direkter Haushaltskonkurrenz zu nationalen Maßnahmen der KfW für Mittelständler –; zweitens 200 Milliarden Euro an ESM-Krediten, ein Transfermechanismus wie immer von deutschem Geld für die Euro-Südländer; drittens ein EU-Kurzarbeiterprogramm SURE. Das ist schlicht illegal. Die geplanten Garantien der Mitgliedstaaten begründen eine nach Artikel 125 AEUV verbotene Gemeinschaftshaftung. Daran ändert auch der vielzitierte Artikel 122 nichts. Weiterhin ist die Arbeitsmarktpolitik gemäß EU-Verträgen überhaupt nicht vergemeinschaftet. Es fehlt somit eine Rechtsgrundlage für die EU, hier überhaupt tätig zu werden. Zudem ist nach Artikeln 124 und 311 AEUV auch noch die Kreditaufnahme verboten. Das ist also schon als Kreditfinanzierung verboten, also multipel illegal.\n\n({1})\n\nAuch SURE steht in direkter Konkurrenz zu nationalen Regelungen. In Deutschland reden wir bei derzeit über 15 Millionen Kurzarbeitern von einem Geldbedarf, der die in langen guten Jahren angesparte Milliardenrücklage der Bundesagentur schon im Frühjahr aufbrauchen wird. Der Bund wird hier also einspringen müssen. Unser Beitrag zu SURE für südeuropäische Kurzarbeiter fehlt dann im deutschen Haushalt. Die AfD spricht sich in diesem Konflikt um Mittel ganz klar für die Rettung der deutschen Arbeitnehmer und Unternehmen aus.\n\n({2})\n\nViertens nenne ich noch den gerade jetzt in dieser Stunde verhandelten Recovery Fund, finanziert über deutsche Haushaltsmittel und deutsche Bonität. Auch ohne explizite Coronabonds wäre der Fonds ein Dammbruch. Ein billionenschwerer Anschlag kommt jetzt auf den deutschen Letzthafter zu. Noch nie in der Finanzgeschichte hat es funktioniert, wenn die einen haften und dann andere über die generierten Finanzmittel verfügen. Es behaupte bitte niemand, dieser kommende Fonds habe nichts mit Euro-Bonds zu tun. Sogar die Fraktion der Sozialdemokraten im EU-Parlament hat diesen Fonds genau als das bezeichnet, was er ist, als einen riesigen Euro-Bond. Das ist natürlich illegal; das übrigens auch in Richtung des Kollegen Rehberg, der erst heute Vormittag an dieser Stelle staatstragend die Verfassungsmäßigkeit aller Maßnahmen beschworen hat. Darüber sprechen wir bitte noch einmal im Ausschuss. Natürlich ist bei diesem Fonds Deutschland Haupthafter ebenso wie bei Krediten des ESM, der EIB, der EZB oder der EU-Kommission. Es ist immer dasselbe.\n\nAuch Macron sagt jetzt ganz offen: „Ohne Finanztransfers“ – deutsche natürlich – „scheitert die EU.“ Macron-Zitat! Dummerweise sind diese aber illegal. Geschäftsgrundlage für EU und Euro seit 1991 war immer offiziell: Niemals eine Haftungsgemeinschaft! Die Euro-Rettung führt uns also immer weiter in den Unrechtsstaat.\n\n({3})\n\nSogar ohne EU-Programme ist ein weiterer deutscher Nachtragshaushalt auf Pump bereits absehbar. Keinesfalls hat also der deutsche Steuerzahler noch mehr Geldmittel für EU-Programme. Das Geld würde gemäß mir vorliegenden Papieren übrigens verwendet für noch mehr Bürokratie, für mehr CO2-Religion, für die berüchtigte Agenda 2030, für den Green Deal, für noch mehr Immigration, noch mehr Milliarden für die sogenannten Partnerländer Äthiopien, Senegal, Türkei, Albanien, Kosovo, sogar für Venezuela und die karibischen Länder, all das gemäß offizieller EU-Papiere. Für all diese Länder will man – ich zitiere – „kohärente Finanzpakete schnüren“.\n\nDoch will das der deutsche Bürger? Nein, natürlich nicht! Die Menschen verstehen sich nicht als EU-europäische oder gar als globale Schicksalsgemeinschaft, wie es heute Morgen wieder einmal von der Kanzlerin behauptet wurde. Nur eine massenmedial unterstützte weltferne supranationalistische Elite kann glauben, dass Schuldenmacherei und Planwirtschaft die EU oder gar die Welt aus der Krise führen werden."
"1039442","Albrecht","Glaser","AfD","Member of Parliament","2020-04-23T00:00:00.000Z","https://dip21.bundestag.de/dip21/btp/19/19156.pdf","\n\n– die weniger Gewinn machen, durch Krisenhilfen geholfen werden muss.\n\n({0})\n\n– Das steht so drin."
