id,firstname,lastname,faction,position,date, url,speech
"1021738","Peter","Boehringer","AfD","Member of Parliament","2019-03-20T00:00:00.000Z","https://dip21.bundestag.de/dip21/btp/19/19088.pdf","\n\nFrau Präsidentin! Werte Kolleginnen und Kollegen! Einiges wurde schon gesagt, und einiges ist auch richtig. Ja, hier droht wieder einmal eine Verletzung der seit 2010 doch angeblich eisern einzuhaltenden ordnungspolitischen Grundsätze „Nie wieder Rettungen von Banken mit Steuergeld!“ und „Nie wieder Banken, die „too big to fail“ sind!“.\n\nJa, es geht um bis zu 30 000 Arbeitsplätze. Und doch mauert die Bundesregierung und eben auch der Fraktionsvertreter der Union mit Informationen, obwohl an den Börsen und überall in den Medien völlig klar ist, dass das Finanzministerium aktiver Treiber der Fusionsgespräche ist.\n\nIm Haushaltsausschuss hat Minister Scholz heute ernsthaft behauptet, man sehe die Commerzbank nur als Finanzanlage – das ist lächerlich – und man verfolge diesen Prozess in den Medien, und dies, obwohl die Spatzen das Gegenteil von den Dächern pfeifen. Nur zwei Medienzitate: Scholz macht Druck. Staatssekretär Kukies treibt Fusion voran. – Sogar offiziell bestätigt hat es 23 Treffen der betroffenen Banken mit dem BMF gegeben. Das Thema schreit nach Behandlung im Bundestag. Immerhin ist die Commerzbank bereits teilverstaatlicht mit dem Ankeraktionär Bund.\n\nIch konzentriere mich nun aber auf die in den Medien noch zu wenig angesprochenen, meiner Meinung aber entscheidenden Punkte.\n\nErstens. Die wahre Ursache für diese Gespräche und der rosarote Elefant im Raum, den keiner sehen will, ist der von der EZB manipulativ bis nahe null gedrückte EU-ropäische Leitzins.\n\n({0})\n\nDieser Nullzins verursacht erst das Ertragsproblem bei den Banken. Gerade wurde bekannt gegeben, dass die Banken für 2019 ein Ertragsminus bei den Zinserlösen von 13 Prozent gegenüber 2018 erwarten. Diese Erlöse tragen über 70 Prozent zum Gewinn der Banken bei. Eine Bank kann in diesem Umfeld nichts mehr verdienen. Eine Fusion kann an diesen EU-gemachten Problemen überhaupt nichts ändern.\n\nZweitens. Hier droht eine Teilverstaatlichung der Deutschen Bank durch die Hintertür, sogar durch eine doppelte Hintertür: Zum einen wird hier indirekt und unauffällig durch die Fusion mit der bereits staatlichen Commerzbank eine Liquiditäts- und letztlich auch Haftungs- und Rettungsleine zur Deutschen Bank geworfen. Zum anderen soll der Bundesanteil an den Banken künftig über die KfW gehalten werden – und so zunächst am deutschen Staatshaushalt und an der parlamentarischen Kontrolle vorbei. Das ist eine Parallele zur Euro-Dauerrettung, wo genau das gleiche Prinzip immer wieder greift: Über Sondervehikel wird Geld ausgereicht, immer wieder faktisch mit deutscher Bonität garantiert. Und weil die KfW eine der ganz wenigen Banken in Deutschland ist, die wirklich noch viel Geld und durch die Haftung des deutschen Steuerbürgers ein AAA-Rating hat, soll sie nun einspringen. Damit sind künftige Kapitalerhöhungen der neuen Großbank schon gesichert. Die kommen so sicher wie das nächste Euro-Rettungspaket der EZB, und das wird ebenso milliardenschwer sein.\n\n({1})\n\nIch kann das heute noch nicht beweisen, aber wir werden uns hier wieder sprechen.\n\nBei den folgenden sehr berechtigten Fragen darf das BMF nicht länger mauern – sie berühren nicht die Verhandlungspositionen der betroffenen Banken, und sie lösen auch keine Ad-hoc-Mitteilungspflichten aus, um das Argument, das vermutlich kommt, Frau Staatssekretärin, gleich vorwegzunehmen –:\n\nErstens: Soll staatliches Geld neu in die Hand genommen werden? Wir müssen diese Frage stellen dürfen, und wir vermuten sehr stark, ja. Der Bund muss voraussichtlich alle Risiken dieser Fusion mit Milliarden an Steuergeld absichern. Was bei der Euro-Dauerrettung seit Jahren mit deutscher Bonität funktioniert, soll auch hier der Königsweg werden. Anders geht es gar nicht. Die Kapitalmärkte erkennen diese implizite Staatsgarantie. Sie wissen das; jeder an der Börse weiß es. Doch der deutsche Steuerzahler wird nicht informiert, und hier wurde das Offensichtliche eben wieder geleugnet.\n\nZweitens: Warum soll ein teilverstaatlichter Champion besser wirtschaften? Das ging bislang immer schief. Ich verweise auf die französischen Erfahrungen der 1980er-Jahre und natürlich auf die unsäglich vielen Desaster bei den Landesbanken. Gerade das BMF mit Minister Scholz an der Spitze sollte eigentlich wissen – HSH Nordbank mit einem Steuerdesaster von 14 Milliarden Euro –, wie Staatsinterventionismus im Bankensektor funktioniert, nämlich gar nicht. Das geht immer schief. Herr Müller – Sie waren mein Vorredner eben –, es ist nicht vorbei, es fängt gerade erst an. Das ist Staats­interventionismus pur. Wir werden ihn erleben.\n\n({2})\n\nDiese Fusion wird zu komplex, zu intransparent und zu teuer. Das sehen sogar die Kollegen in Ihren eigenen Reihen so: Herr Michelbach, Herr Rehberg und Herr Jäger von der Union sind skeptisch, und auch der Obmann der SPD im Finanzausschuss, Kollege Binding, hat sich skeptisch geäußert.\n\n({3})\n\n– Ich habe nur „skeptisch“ gesagt. Was Sie wirklich sagen, Herr Michelbach, weiß ich natürlich nicht. Aber skeptisch haben Sie sich geäußert, und das haben auch einige andere Kollegen getan.\n\nZuletzt noch das „ceterum censeo“ – nicht ganz neu, aber es passt in diesem Kontext wieder gut –: Besetzen Sie endlich das schreiend unvollständig besetzte Banken-Finanzierungsgremium auch mit AfD-Vertretern!\n\n({4})\n\nDort werden die relevanten Infos zu solchen Fusionen diskutiert und diesem Haus bekannt gegeben und zugänglich gemacht. Es ist ein demokratischer Skandal, dass die Kollegen Münz und Glaser noch immer nicht in dieses Gremium gewählt sind.\n\n({5})\n\nWir geben Ihnen morgen noch eine Chance dazu.\n\n({6})\n\nHerzlichen Dank.\n\n({7})"
"1021748","Kay","Gottschalk","AfD","Member of Parliament","2019-03-20T00:00:00.000Z","https://dip21.bundestag.de/dip21/btp/19/19088.pdf","\n\nSehr geehrte Frau Präsidentin! Verehrte Kollegen! Liebe Negativzinssparer! Frau Lambrecht, vielleicht sollte ich angesichts der Märchenstunde, die Sie hier gehalten haben, lieber „Frau Grimm“ zu Ihnen sagen.\n\n({0})\n\nAls ich zum ersten Mal von den Fusionsplänen und dem Begleitschutz des Finanzministeriums im Zusammenhang mit diesen Fusionsplänen hörte, dachte ich sofort: Na, klasse! Diese linken Träumer von der SPD! In deren Logik spannt man also neben einen lahmen Gaul einen weiteren lahmen Gaul vor die Postkutsche und denkt, man hätte einen Rennwagen. Ähnliches dachte man vielleicht auch bei Nahles und Scholz. Die Ergebnisse der Umfragen kennen Sie.\n\nNun aber versucht dieser Herr Scholz, eine deutsche Megabank entstehen zu lassen. Was sie tun soll, welches Ziel sie hätte – dazu bekam ich keine Antwort im Finanzausschuss, als ich fragte: Soll sie vielleicht die deutsche Finanzsouveränität und den deutschen Finanzplatz sichern? Soll sie eine feste Hand für deutsche Unternehmen sein, weil die chinesischen Unternehmen hier auf Einkauftour gehen, oder Expansion begleiten? – Keine Antwort von Ihnen darauf! Meine Damen und Herren, das ist nichts anderes als sozialistische Planwirtschaft à la SPD, die wir hier wieder beobachten dürfen.\n\n({1})\n\nWenn SPD-Politiker in die Marktwirtschaft eingreifen, wird es für den Steuerzahler teuer. Philipp Holzmann und der Genosse der Bosse lassen schön grüßen. Im Übrigen möchte ich alle Altparteien daran erinnern: Sie alle haben den Satz „too big to fail“ – er sollte nie wieder im Plenum fallen – erwähnt. Meine Damen und Herren, hierzu warnt auch der Vorsitzende der Monopolkommission, Achim Wambach, in der „Rheinischen Post“. Ich zitiere mit der Erlaubnis der Präsidentin:\n\nDurch den Zusammenschluss entsteht möglicherweise eine neue Bedrohung für die Finanzwelt, nämlich durch einen Anstieg des Systemrisikos.\n\nKeine Rede davon bei Ihnen hier.\n\nDie Finanzkrise habe deutlich gemacht, dass große Banken nicht ohne Weiteres abgewickelt werden könnten und gegebenenfalls vom Staat gerettet werden müssten.\n\nFrau Lambrecht, zu Ihrer Märchenstunde, der deutsche Steuerzahler werde nie mehr haften. Sie haben 2009 für 5,1 Milliarden Euro 15 Prozent der Commerzbankanteile erworben. Diese sind heute gerade einmal 1,4 Milliarden Euro wert. Sie haben an dieser Stelle fast 4 Milliarden Euro Steuergeld verplempert und verprasst; das sollten Sie alle mitnehmen und auch bei der nächsten Europawahl daran denken.\n\n({2})\n\nOffenbar, meine Damen und Herren, leiden nicht nur einige Abgeordnete, sondern vor allen Dingen auch die Bundesregierung an politischer Demenz. Haben Sie denn schon vergessen, warum Sie die Commerzbank eigentlich retten mussten? Es klang nämlich an: wegen der ziemlich vergurkten Fusion – so muss man das wohl sagen – mit der Dresdner Bank. Aber auch dort war es ja nicht Ihr Geld. Es war immer das Geld der deutschen Steuerzahler. Gerade die Kollegen der Sozialdemokraten wollten das ja eigentlich nie mehr haben. Rote Versprechen, sie sind so viel wert wie der Lottoschein von letzter Woche, bei dem ich immer um eine Zeile danebenlag, nämlich nichts am Ende.\n\n({3})\n\nAber welcher Film, meine Herren und Damen, läuft hier wirklich ab? Der Druck aus dem Finanzministerium ist schon angeklungen. Sie wollen jetzt nicht ernsthaft sagen, dass alle seriösen Zeitungen Fake News verbreiten, von der „Wirtschaftswoche“ über das „Handelsblatt“, die „Frankfurter Allgemeine Zeitung“ bis zur „Süddeutschen Zeitung“?\n\n({4})\n\nMeine Damen und Herren, Sie haben Druck ausgeübt, und die Fusion – das wissen wir auch – bringt nur etwas, wenn tatsächlich Synergieeffekte genutzt werden. Auch das wollen Sie ja schon verhindern, indem Sie sagen: Die 30 000 Arbeitsplätze sollen nicht abgebaut werden.\n\nMeine Damen und Herren, die Zahlen der Commerzbank und der Deutschen Bank sprechen auch hier für sich. In der Größe liegt nie der Gewinn einer Bank, und in der Größe liegt auch nicht ihre Stärke. Die kleine Commerzbank mit einer Bilanzsumme von 462 Milliarden Euro hat einen Gewinn von 865 Millionen Euro erzielt, und die große Deutsche Bank mit knapp 1,4 Billionen Euro Bilanzsumme hat nur 341 Millionen Euro Gewinn erzielt.\n\n({5})\n\nSie sehen also: Es kommt auf gute Ideen, auf ein Geschäftskonzept an und nicht darauf, einen Riesenchampion zu schaffen. Meine Damen und Herren, auch das werden Sie mit Ihrer Planwirtschaft nicht schaffen.\n\n({6})\n\nSchauen Sie im Übrigen in die volkswirtschaftliche und betriebswirtschaftliche Literatur. Zwei Drittel aller Fusionen scheitern oder erreichen ihre Ziele nicht: Daimler/Chrysler, Commerzbank/Dresdner Bank, Karstadt/Kaufhof, Bayer/Monsanto – heute ist der Kurs um über 10 Prozent eingebrochen –, Allianz/Dresdner Bank, BMW/Rover. Ich könnte die Liste beliebig fortsetzen. Meine Damen und Herren, darum prüfe, wer sich ewig bindet. Die Logik der Marktwirtschaft, liebe Genossen, wird auch durch Ihre feuchtroten Träume nicht ausgehebelt. Größe ist kein reiner Selbstzweck, und ohne Idee bringt diese Größe auch nichts.\n\nAber nun kommen wir zum eigentlichen Kern der Frage, warum meine Fraktion in diesem Zusammenhang einen Untersuchungsausschuss beantragen wird. Wer macht in diesem Land eigentlich Politik? Warum tut sich Herr Scholz dies an? Denken wir mal an die Fusionsgespräche. Die werden von Goldman Sachs begleitet. Und um Ihre Erinnerungslücken zu schließen, meine Damen und Herren: Bevor es zur Übernahme durch den Staat kam, hat auch Goldman Sachs die Commerzbank beraten. Nun kommt Herr Kukies ins Spiel. Wenn ich mir seine Vita anschaue – er war von 2001 bis 2018 hochrangiger Manager bei Goldman Sachs, sogar deutscher Vizepräsident –, dann gestatten Sie mir die Frage: Wer macht im Finanzministerium eigentlich Politik? Wer führt es: Goldman Sachs oder Herr Kukies oder vielleicht doch noch Herr Scholz?\n\n({7})\n\nMeine Damen und Herren, lassen Sie Ihre sozialistische Planwirtschaft da, wo sie hingehört, nämlich in der Mottenkiste, und lassen Sie uns hier aufdecken, welche Ideen und welche Punkte wirklich dahinterliegen. Wir wollen einen Untersuchungsausschuss, damit Licht in diese Umstände gebracht wird.\n\nDanke schön.\n\n({8})"
"1021758","Alexander","Gauland","AfD","Member of Parliament","2019-03-21T00:00:00.000Z","https://dip21.bundestag.de/dip21/btp/19/19089.pdf","\n\nHerr Präsident! Meine Damen und Herren! Man muss nicht jede Wendung im Brexit-Drama für einen Ausweis jahrhundertealter Staatsklugheit in London halten, um dennoch hohen Respekt vor dem Ringen einer Nation um eine Grundfrage zu empfinden. England war immer zugleich drinnen und draußen, halb Europa, halb Indien, zugleich europäische Macht und Weltmacht. Wie hat es Churchill einmal so unnachahmlich literarisch gegenüber de Gaulle ausgedrückt? Wenn ich mich zwischen Ihnen und Amerika, zwischen Ihnen und dem offenen Meer entscheiden muss, entscheide ich immer für das offene Meer. – Und es wäre wirklich eine ironische Volte, sollte eine Parlamentsregel, die auf das Jahr 1604 zurückgeht, eine dritte, diesmal vielleicht erfolgreiche Abstimmung über den Deal verhindern.\n\nDarf ich dieses Haus daran erinnern, dass die Entscheidung zum Brexit auf demokratischem Wege gefallen ist?\n\n({0})\n\nDie Mehrheit der Briten hat beschlossen, die EU zu verlassen. Ja, das war eine knappe Mehrheit; doch diese Konstellation ist heute normal und historisch. Bedeutende Entscheidungen sind oft durch knappe Mehrheiten herbeigeführt worden. Es war eine demokratische Entscheidung, also etwas, was in der EU eher selten vorkommt.\n\n({1})\n\nWas wir derzeit erleben, ist der Versuch, das unerwünschte Ergebnis einer demokratischen Entscheidung vielleicht doch noch rückgängig zu machen.\n\nMeine Damen und Herren, Spott ist kaum angebracht, wenn einer unserer ältesten und wertvollsten Verbündeten sich in politischen Krämpfen windet. Es sind eben nicht die Fehlinformationen der Brexit-Befürworter, die zu dieser Situation geführt haben; es sind die zwei Seelen in der Brust jedes Engländers, die dieses Dilemma herbeigeführt haben. Deshalb wäre es auch die Aufgabe der Bundesregierung, nicht beiseitezustehen und dem shakespearehaften Drama seinen Lauf zu lassen, sondern beherzt einzugreifen, Frau Bundeskanzlerin,\n\n({2})\n\ndas Paket wieder aufzuschnüren oder zumindest mit zusätzlichen Erklärungen zu versehen.\n\n({3})\n\nEs kann doch nicht so schwer sein, den Briten den einseitigen Ausstieg aus dem Backstop zu ermöglichen, und es fällt den 27 bei Gott kein Zacken aus der Krone, für eine kurze Übergangszeit die Niederlassungsfreiheit auszusetzen.\n\n({4})\n\n„Rosinenpickerei“ ist dafür das falsche Wort – angesichts eines Dramas, das die Zukunft unseres Kontinents bestimmt und darüber entscheiden wird, ob Großbritannien, das uns jahrelang in Berlin verteidigt hat, uns auch künftig freundschaftlich verbunden bleibt. Denn Verletzungen, meine Damen und Herren, an den Seelen der Völker sind schwerer zu heilen als materielle Schäden. Gerade wir Deutschen können davon ein Lied singen.\n\n({5})\n\nRegelbasierte Multilateralität – das kam bei Ihnen auch wieder vor, Frau Bundeskanzlerin – ist ein wohlklingendes Abstraktum,\n\n({6})\n\ndas niemanden zu seelischen Anstrengungen verführt und, von Herrn Barnier repräsentiert, eher abschreckt und spaltet als zusammenführt.\n\n({7})\n\nEin Appell der Bundeskanzlerin an die Verhandelnden, einen kleinen Schritt aufeinander zuzugehen, könnte da vielleicht Wunder wirken.\n\n({8})\n\nAllerdings müsste man dafür von dem Gedanken Abstand nehmen, der in Brüssel immer mitgedacht wird: die Briten dafür zu bestrafen, dass sie einen Weg gehen wollen, der in manchen Hauptstädten des Kontinents für politisch inkorrekt gehalten wird\n\n({9})\n\nund der niemals auf eine Weise ins Freie führen darf, die Nachahmer anspornen könnte.\n\n({10})\n\nDoch gerade darin müsste sich die Stärke der Europäischen Union erweisen: dass sie niemanden gegen seinen Willen festhält. Es ist unsouverän und ein Zeichen von fehlendem Vertrauen in die eigene Attraktivität, wenn man sich bei einer Trennung so aufführt wie die EU momentan gegenüber den Briten.\n\n({11})\n\nDie Europäische Union, so ihre eifrigen Befürworter, sei kein Zwangsverband, sondern eine freiwillige Übereinkunft, die jedes Volk, jeder Staat jederzeit auflösen können, wenn sie es für nötig halten.\n\n({12})\n\nEs ist an der Zeit, dass die europäischen Regierungen das beweisen und Großbritannien eine ebenso faire wie kluge Chance geben, Frau Merkel. Ich appelliere an Sie: Machen Sie damit den Anfang!\n\n({13})\n\nMan wird nämlich den Eindruck nicht los, dass es der EU um anderes als um den Frieden in Irland geht, nämlich darum, zu verhindern, dass Großbritannien zu einem deregulierten, von niedrigen Löhnen und niedrigen Steuern geprägten Wettbewerber der EU wird. Ihr Quidproquo: Wenn Großbritannien weiter den vollen Zugang zum EU-Markt will, muss es sich weiter an die EU-Standards zu Besteuerung, Beschäftigung, zu Wettbewerb und Umwelt halten – also praktisch ein Mitglied ohne Mitspracherecht. Zartere Gemüter würden das Erpressung nennen.\n\n({14})\n\nWenn wir die Zeitungen aufschlagen, lesen wir immer von dem wirtschaftlichen Schaden, der den Briten durch den Brexit entstehen wird. Wir lesen aber nichts über den Schaden für die EU. Denn auch wir verlieren, meine Damen und Herren: Deutschland zuvörderst.\n\n({15})\n\nGeben wir den Briten etwas mehr Zeit, aber nicht das Gefühl, aus einem Gefängnis ausbrechen zu müssen. Dazu müsste man freilich von all den Affekten, die zu einer schmutzigen Scheidung führen, zur Vernunft zurückkehren. Ich kann nur noch mal wiederholen, Frau Merkel: Machen Sie damit den Anfang! Denn das ist Politik im deutschen Interesse.\n\nIch bedanke mich.\n\n({16})"
"1021772","Alice","Weidel","AfD","Member of Parliament","2019-03-21T00:00:00.000Z","https://dip21.bundestag.de/dip21/btp/19/19089.pdf","\n\nSehr geehrter Herr Präsident! Sehr geehrte Damen und Herren! Werte Kollegen! Frau Bundeskanzlerin, Sie haben über die Unsicherheit gesprochen, die der Brexit bringen wird. Nicht, dass wir dabei viel Neues erfahren hätten: Es war nämlich Ihre erprobte Mischung aus Phrasen und Baldrian. Eines ist klar: Dieser Brexit wird teuer – teuer für die EU und deshalb per Definition teuer für die deutschen Steuerzahler: teuer wie die Bankenrettung, die Griechenland-Rettung, die Energiewende, die Grenzöffnung, die Zerstörung der deutschen Automobilindustrie, der Schlüsselindustrien und die gigantische Inflationierung unserer Gemeinschaftswährung. Zukunftsweisende Politik sieht anders aus, sehr geehrte Damen und Herren.\n\n({0})\n\nNun also der Brexit und Ihr Anteil daran; denn den hatten Sie, im besten Fall aus Fahrlässigkeit. Aber es war eher unterlassene Hilfeleistung. Die historisch guten Beziehungen zum Vereinigten Königreich werden auf diese Weise gefährdet. Was hatte David Cameron denn so Fürchterliches verlangt? Keine Sozialhilfe sofort und für alle, stärkere nationale Parlamente, weniger EU-Bürokratie. Doch in Brüssel hat er damit auf Granit gebissen. Dabei wäre eine schlankere Gemeinschaft, die sich auf ihre Kernaufgabe besinnt, einen gemeinsamen Markt zu schaffen und zu erhalten, eine große Chance gewesen. Aber nein, das ging auf keinen Fall. Da setzten Sie lieber den Zusammenhalt der EU-Mitgliedstaaten aufs Spiel.\n\nJetzt kriegen wir die Rechnung: 15 Milliarden Euro an britischen Beiträgen werden künftig im Budget fehlen. Zwar weiß jede Familie, dass man den Gürtel enger schnallt, wenn die Einnahmen schrumpfen, aber nicht die EU. Muss sie auch nicht, solange der deutsche Steuerzahler der Zahlmeister ist. Größer als das Loch im EU-Etat sind die Kosten für die deutsche Wirtschaft. Das Vereinigte Königreich ist die zweitgrößte Volkswirtschaft der EU, so groß wie die 19 kleinsten zusammen. Ökonomisch gesehen schrumpft die EU also nicht auf 27, sondern auf 9 Staaten zusammen. Die Sorglosigkeit, ja Gleichgültigkeit, die Brüssel und Berlin angesichts dieser Größenordnung an den Tag legen, grenzt an pathologische Realitätsverweigerung, sehr geehrte Damen und Herren.\n\n({1})\n\nFür Deutschland ist das Vereinigte Königreich der größte Handelspartner in der EU. Die wirtschaftlichen Verflechtungen sind so eng wie mit keinem zweiten Land. Es liegt eindeutig im deutschen Interesse, Handel und Investitionen weiter ungehindert zu tätigen. Hier stehen deutscher Wohlstand, deutsche Arbeitsplätze auf dem Spiel. Sie aber stellen sich in Nibelungentreue hinter Frankreich, das den Briten sogar den Zugang zum gemeinsamen Binnenmarkt verweigern will. Sie erwägen ja sogar die Möglichkeit, den Briten keinen Zugang zum europäischen Wirtschaftsraum einzuräumen, weil Paris das ablehnt. Das wäre ja auch alles viel zu viel: viel zu viel Freihandel, zu viel frische Luft auf den Märkten, zu viel Wettbewerb und zu viel Konkurrenz um die besten Wirtschaftsstandorte. Von Eigenständigkeit ist nichts zu sehen in dem von Ihnen unterzeichneten Aachener Vertrag, der als Krönung des Élysée-Vertrages gepriesen wird. Welch ein Dünkel! Der Aachener Vertrag trägt eine französische Handschrift, von vorne bis hinten. Dieses Europa, für das das zentralistisch organisierte Frankreich mit einer gescheiterten Industrie- und Wirtschaftspolitik als Blaupause dient, kommt schneller, als man denkt.\n\n({2})\n\nSpätestens dann, wenn im Europäischen Rat das nächste Mal abgestimmt wird, sehen wir nämlich ganz genau: Die teuerste Konsequenz des Brexits ist, dass Deutschland keine Sperrminorität mehr im Rat zustande bringt. In der aktuellen EU der 28 vertritt Deutschland 16 Prozent der Bevölkerung, Großbritannien 13 Prozent. Macht zusammen fast 30 Prozent. Mit einigen kleineren Ländern – Dänemark, Niederlande, Österreich – war die Sperrminorität von 35 Prozent immer gesichert. Damit konnte man sich gegen den Griff in die Gemeinschaftskasse krisengeschüttelter „Club Med“-Staaten sowie Frankreichs wehren. Das ist durch den Austritt Großbritanniens nun bald Geschichte. Und es wird deutlich: Ohne Reformen kann es in der Europäischen Union doch gar nicht weitergehen. Wo ist Ihre Strategie? Sie haben überhaupt gar keine.\n\nFangen wir bei Artikel 50, der den Austritt regelt, an. Er ist vollkommen schwammig formuliert. Konkret ist nur der Hinweis darauf, wie mit Abtrünnigen, mit Verrätern umzugehen sei: nach Artikel 218, also wie bei jedem x-beliebigen Drittstaat. Kann man eigentlich für einen Partner, mit dem man 40 Jahre in guten wie in schlechten Zeiten zusammengelebt hat, nicht einen anderen Modus finden als für Paraguay oder Papua-Neuguinea, sehr geehrte Damen und Herren?\n\n({3})\n\nDas ist ja wohl der blanke Hohn. Verwundert es da noch, wenn die Briten hinter jedem Manöver aus Brüssel bösen Willen vermuten? Brexit-Unterhändler Barnier soll seinerzeit Freunden anvertraut haben – ich zitiere –:\n\nMeine Mission wird ein Erfolg sein, wenn … die Bedingungen … für die Briten so brutal sind, dass sie es vorziehen …, in der Europäischen Union zu verbleiben.\n\n({4})\n\nWer solche Freunde hat, braucht keine Feinde mehr, sehr geehrte Damen und Herren.\n\n({5})\n\nVon Selbstkritik ist auf dem Kontinent nichts zu hören, nicht in Brüssel, nicht in Berlin, schon gar nicht in Paris. Der Brexit hat die Brüsseler Abgehobenheit deutlich gemacht. Er zeigt auch, wo Europas wahre Gegner sitzen: unter anderem hier auf der Regierungsbank, sehr geehrte Damen und Herren. Europa ist zu wichtig, um es ihnen zu überlassen. Wegsehen gilt nicht, weglaufen auch nicht. Die EU muss von innen reformiert werden. Dazu gehört ein Vetorecht der Nationalstaaten gegen Brüsseler Vorgaben genauso wie eine Reform des Austritts-Artikels 50 zur Erhaltung des Binnenmarktes, auch für austretende Länder, und die Sicherung der EU-Außengrenzen, die wir seit Jahren fordern. Und zu Europa gehören unsere britischen Freunde, sehr geehrte Damen und Herren.\n\nVielen Dank.\n\n({6})"
