id,firstname,lastname,faction,position,date, url,speech
"1020160","Joana","Cotar","AfD","Member of Parliament","2019-02-21T00:00:00.000Z","https://dip21.bundestag.de/dip21/btp/19/19083.pdf","\n\nSehr geehrter Herr Präsident! Werte Kollegen! Digitalisierung gestalten, Arbeit 4.0, Gigabit-Gesellschaft, Big Data, Disruption – Buzzwörter, die mittlerweile in keiner einzigen Bundestagsrede mehr fehlen dürfen. Sie sollen zeigen: Wir haben verstanden! Die Regierung kümmert sich.\n\nDie Reden klingen gut, die Versprechen sind groß. Doch die Realität sieht – leider – anders aus. Das wichtige Querschnittsthema Digitalisierung wird in dieser Bundesregierung eben nicht wirklich ernst genommen. Das wird auch in diesem Umsetzungspapier sehr deutlich: Es ist reines Stückwerk und keine koordinierte Strategie – symptomatisch für die Digitalpolitik der Bundesregierung.\n\n({0})\n\nEs gibt in Deutschland kein Digitalministerium, in dem alle Fäden zusammenlaufen; jeder kocht sein eigenes Süppchen. Es gibt eine Digitalstaatsministerin ohne eigenes Budget, eine Abteilung für Digitalpolitik im Kanzleramt, ein Digitalkabinett und einen Digitalrat. In allen Ministerien gibt es unzählige Referate, Abteilungen, Projekte, Kommissionen und Agenturen, die sich um die Digitalisierung kümmern. Alle wollen sie mitreden, und niemand hat den Überblick. Und genau das ist einer der Hauptgründe, warum all die schönen Versprechen in Sachen Digitalisierung, die wir seit Jahren hören, nicht umgesetzt werden. Etwas zur Chefsache zu erklären, meine Damen und Herren von der Regierungsbank, sieht wirklich anders aus.\n\n({1})\n\nEin Beispiel. Jahr für Jahr verspricht uns die Regierung schnelles Netz für alle. Schon 2009 versprach Angela Merkel „flächendeckendes Breitband für alle bis 2010“; 2010 wurde das Versprechen wieder einkassiert. Dafür versprach die Kanzlerin dann, dass bis 2014  75 Prozent der Haushalte über „mindestens 50 Megabit“ verfügen sollten. Bald gab sie zu: Auch das wird nichts. – Dann ein neues Versprechen: Spätestens 2025 werde Deutschland mit Gigabitnetzen die beste digitale Infrastruktur der Welt haben. Und schon jetzt wissen wir: Auch dieses Ziel wird nicht erreicht werden. Eine Bankrotterklärung, liebe Bundesregierung!\n\n({2})\n\nBei Internetgeschwindigkeiten liegt Deutschland im internationalen Vergleich auf Platz 25 hinter Ländern wie Rumänien oder Lettland. Beim Mobilfunk sieht es nicht viel besser aus; das weiß jeder Bürger, der verzweifelt versucht, auf Bahnfahrten längere Telefonate zu führen.\n\nEines der wichtigsten Themen der heutigen Zeit: Cybersecurity. Ohne Sicherheit ist diese schöne neue Welt nichts wert. Auch die Regierung möchte die Cybersicherheit stärken und gründet dafür – mal wieder – eine Agentur; wir haben davon ja so wenig. Gleichzeitig möchte die Regierung aber nur ihr bekannte Sicherheitslücken in IT-Produkten nicht schließen, sondern nutzen, wohl wissend, was für Schäden solche Exploits anrichten können. Und Backdoors in Soft- und Hardware werden auch nicht abgelehnt; die Überwachung muss schließlich umfassend sein. Mit Verlaub, so steigern Sie die Sicherheit nicht, so fahren Sie auch das Thema Cybersecurity vor die Wand, meine Damen und Herren.\n\n({3})\n\nWenn ich dann lese, dass man sich in dem Papier auch über das Internet auslässt und die Medienkompetenz der Menschen stärken will, dann schlage ich vor, dass wir gleich hier im Bundestag und auch auf EU-Ebene beginnen. Wer allen Ernstes die Freiheit des Internets mit der Einführung von Upload-Filtern zerstören möchte, wer Zensur im großen Stil einführen möchte, weil er nicht verstanden hat, dass Algorithmen völlig ungeeignet sind, um Urheberrechtsverletzungen zu erkennen, der sollte bei digitalen Themen schlichtweg den Mund halten, liebe Kollegen von der Union und der SPD.\n\n({4})\n\nIm Koalitionsvertrag haben Sie Upload-Filter als unverhältnismäßig abgelehnt, nur um dann auf EU-Ebene umzufallen und die Anwendung genau dieser Filter zu beschließen. Eine Petition mit fast 5 Millionen Unterschriften interessiert Sie nicht. Beschwerdemails von jungen Menschen werden ignoriert, ja, mehr noch, diese Menschen werden von Ihnen wahlweise als Bots oder als Mob beschimpft. Schämen Sie sich, meine Damen und Herren! Schämen Sie sich in Grund und Boden!\n\n({5})\n\nIhr Koalitionsvertrag ist das Papier nicht wert, auf dem er steht, und das ist mit dieser visionslosen Umsetzungs-„Strategie“ für die Digitalisierung leider nicht anders: Viele Worte, verstreute Einzelmaßnahmen, wenig dahinter. So bringen Sie Deutschland nicht nach vorne, und das Nachsehen hat wieder einmal der Bürger.\n\n({6})"
"1020166","Martin","Hebner","AfD","Member of Parliament","2019-02-21T00:00:00.000Z","https://dip21.bundestag.de/dip21/btp/19/19083.pdf","\n\nHerzlichen Dank für die Genehmigung der Zwischenfrage. – Ich habe eine konkrete Frage an Sie. Sie sagen: Es muss überall was getan werden, gerade in Unternehmen usw. usf. – Was machen Sie denn konkret? Sie haben über Infrastruktur und ihre Bedeutung gesprochen. Bitte vergegenwärtigen Sie sich mal die Zahlen. Es gibt in Asien Länder – nehmen wir mal Japan und Südkorea als Beispiele –, die 50 bis über 70 Prozent Glasfaseranschlüsse haben. In Deutschland sind wir – ich gehe davon aus, dass Sie es wissen – bei circa 2 Prozent. Was macht der Staat, um hier eine entsprechende Infrastruktur bereitzustellen? Gerade die mittelständische Wirtschaft braucht das, vor allem – das ist ja auch ein Thema Ihrer Partei; auch ich halte das für sinnvoll – bei Themen wie Homeoffice. Was machen Sie in dem Fall, um die Anbindung der Mitarbeiter zu gewährleisten? Was tun Sie? Welche Ziele haben Sie?\n\nOder mal ganz konkret: Bis wann wird die Zahl dieser Anschlüsse erhöht? Bis zu welchem Jahr haben wir mindestens 30 Prozent Glasfaseranschlüsse? Bis zu welchem Jahr 50 Prozent? Werden Sie doch bitte einmal konkret, statt immer nur abstrakt weiterzureden. Ich bitte um konkrete Aussagen."
"1020179","Uwe","Schulz","AfD","Member of Parliament","2019-02-21T00:00:00.000Z","https://dip21.bundestag.de/dip21/btp/19/19083.pdf","\n\nHerr Präsident! Meine Damen und Herren! Die vorgelegte Umsetzungsstrategie der Bundesregierung ist für jemanden wie mich, der aus der realen Unternehmenswelt kommt, spannend, und zwar allein aus handwerklichen Gesichtspunkten; denn hier wird gezeigt, wie es nicht geht. Es werden Einzelthemen und Bruchstücke aneinandergereiht, es werden Vorstudien mit Erkenntnissen verknüpft. Die logische Abfolge von Vision, Ziel, Strategie und Umsetzung fehlt völlig. Ich kann Ihnen sagen: Mein im Bundestag in nur 17 Monaten erworbenes Bild wird bestätigt: Kaum jemand in diesen weichen Sesseln hat die Funktionsweise komplexer Organisationen jemals erlebt.\n\n({0})\n\nDie in munteren Worten formulierte Umsetzungsstrategie nährt sich einerseits aus der leider gefloppten Digitalen Agenda und andererseits aus den Ergebnissen der Enquete-Kommission 2013. Meine Damen und Herren, wir schreiben das Jahr 2019. Beleuchtet werden also mehr als sechs Jahre Erkenntnisse, angereichert mit Schwerpunktthemen aus den Ministerien. In der realen Welt, meine Damen und Herren, würde jeder Vorstandschef die Flucht ergreifen müssen, allein wenn die Hauptaktionäre nur das Vorwort seiner Umsetzungsstrategie lesen würden.\n\n({1})\n\nMachen wir uns bewusst: Unsere Welt befindet sich in einem Zustand der maximalen Veränderung. Daher haben Wirtschaft und Bevölkerung einen Anspruch darauf, zu wissen, in welchem Rahmen und unter welchen Bedingungen sie sich zukünftig bewegen müssen. Aktives Veränderungsmanagement zu betreiben, wäre eigentlich das Gebot der Stunde. Aber wirklich verändern kann nur, wer weiß, was er will, und wer seine Ideen und Zusammenhänge auch beschreiben kann. Ich sehe aber eher Ahnungslosigkeit. Ich sehe Ahnungslosigkeit im Megaprojekt der Gegenwart, das ausnahmslos alle gesellschaftlichen und politischen Themenfelder umfasst und betreffen wird.\n\nUnsere Unternehmen erwarten von der Regierung zu Recht verlässliche ordnungspolitische Rahmenbedingungen. Die Bürger hingegen müssen wissen, dass lebenslange Anstellungsverhältnisse ausgedient haben und neue Modelle für soziale Absicherungen zu schaffen sind. Und Eltern müssen in der Welt der Digitalisierung auf neue Ausbildungswege für ihre Kinder vertrauen können. Aber hier? Keine Klammer über den vielen Herausforderungen, keine Verzahnung einzelner strategischer Ansätze! Alles in allem, meine Damen und Herren, handelt es sich um eine handwerkliche Schlechtleistung.\n\n({2})\n\nDas sieht man auch beim Blick in die Einzelziele: Schwammige Formulierungen, politische Umschreibungen, aus denen man sich jederzeit herauswinden kann, prägen das Bild. Was ich vor allem vermisse, sind Zahlen und Beträge,\n\n({3})\n\ndie einen Überblick über die Kosten der Umsetzung und den beabsichtigten Nutzen geben. Somit vermeiden die Autoren des Kataloges eine klare Messbarmachung. „Nur nicht festlegen“ ist das Prinzip.\n\n({4})\n\nNoch etwas fällt dem geübten Blick auf, meine Damen und Herren: Der Umsetzungskatalog ist in Beraterdeutsch verfasst. Aufmachung und Aussagen entsprechen dem Werkzeugkoffer von McKinsey, Roland Berger und Co.\n\n({5})\n\nDieses Werk ist gezimmert von genau diesen Leuten, denen seit 2014 mehr als 700 Millionen Steuereuro in die Hälse geworfen wurden. Nun aber läuft uns die Zeit davon, und solides Vorgehen ist gefragt. Mir jedenfalls wäre ein ehrliches, ein nüchternes Amtsdeutsch in einem solchen Dokument lieber als diese inhaltslose Marketingsprache.\n\n({6})\n\nMeine Damen und Herren, ich komme zum Schluss. Die Regierung muss nun endlich den Mut aufbringen, mit dem Bürger in den Diskurs zu gehen, und sie darf auch mal zugeben, dass sie noch nicht weiß, was auf uns alle zukommt. Was Deutschland braucht, ist ein umfassender digitaler Masterplan, aber kein Stückwerk, wie es die Bundesregierung vorlegt.\n\nVielen Dank.\n\n({7})"
"1020195","Fabian","Jacobi","AfD","Member of Parliament","2019-02-21T00:00:00.000Z","https://dip21.bundestag.de/dip21/btp/19/19083.pdf","\n\nHerr Präsident! Meine Damen und Herren! Die Geschichte der Demokratie in Deutschland beginnt nicht im Jahr 1949. Die Jahrhunderte, die unserer heutigen Ordnung vorausgingen, waren angefüllt von vielfältigen Herrschaftsformen. Es gab Fortschritte und Rückschläge beim Ringen, zuerst um die Mitbestimmung des Volkes im monarchischen Staat, späterhin um die Selbstbestimmung des Volkes in der Republik.\n\nIn all dieser Zeit galt in Deutschland das, was in der Menschheitsgeschichte weithin üblich war und vielfach noch ist: eine Unterteilung des Volkes in Stände, Klassen und Schichten, nach Religionen und Geschlechtern. Dabei definierte die Zugehörigkeit des Einzelnen zu einer solchen Gruppe auch seine Rechtsstellung im Gemeinwesen. Selten war es möglich, dass Einzelne von einer Gruppe in eine andere überwechselten, etwa durch Erhebung in den Adelsstand, durch Freilassung eines Leibeigenen oder auch durch Religionswechsel. Für die meisten jedoch war mit der durch Herkunft und Geburt bestimmten Gruppenzugehörigkeit auch ihre Rechtsstellung in der Gesellschaft lebenslanges Schicksal. Die Geschichte der Demokratie in Deutschland ist die Geschichte des Kampfes um die Aufhebung dieser Spaltungen des Volkes, dieser Unfreiheit des Einzelnen.\n\n({0})\n\nMit dem Grundgesetz ist dieser Kampf um Freiheit und Gleichheit an sein logisches Ende gekommen. Es kennt im Hinblick auf die Teilnahme des Einzelnen an der Demokratie keine Unterteilung des Volkes mehr.\n\n({1})\n\nDamit verwirklicht das Grundgesetz zugleich die Befreiung des Einzelnen aus dem Zwang der Gruppenzugehörigkeit. Die Republik kennt nur einen relevanten Status: den des Staatsbürgers. Der demokratische Souverän ist das Staatsvolk in seiner Einheit. Es äußert seinen Willen in demokratischen Wahlen. Demokratisch sind Wahlen dann, wenn sie neben anderen zwei ganz elementare Grundbedingungen erfüllen: Sie müssen frei und gleich sein.\n\n({2})\n\nFrei ist die Wahl, wenn die Willensbildung von unten nach oben, vom Bürger zum Staat verläuft und der Staatsbürger in der Wahl seine eigene, souveräne Entscheidung trifft. Eine Wahl, bei der vorgegeben wird, dass das Wahlergebnis bestimmten Kriterien entsprechen muss, ist keine freie Wahl.\n\n({3})\n\nGleich ist die Wahl, wenn das Recht, zu wählen und sich zur Wahl zu stellen, den Staatsbürgern in gleicher Weise zukommt. Eine Wahl, bei der das Gesetz die Staatsbürger in verschiedene Klassen einteilt, ist keine gleiche Wahl.\n\n({4})\n\nZwischen dem einzelnen Staatsbürger und dem Staat stehen die Parteien. Weil faktisch der Weg in ein Parlament fast ausschließlich über das organisierte Zusammenwirken in den Parteien führt, kommt den Parteien eine besondere Rolle zu. Parteien sind gerade nicht beliebige private Vereine. Deshalb hat das Grundgesetz auch für die Parteien eine klare Regelung getroffen. Ihre innere Ordnung muss demokratischen Grundsätzen entsprechen. Das heißt, auch Wahlen in Parteien müssen frei und gleich sein.\n\n({5})\n\nErst recht und umso mehr gilt das dort, wo die Parteien Kandidaten für Parlamente aufstellen. Damit sind wir bei dem Grund angekommen, der unseren Gesetzentwurf notwendig macht: Parteien in Deutschland versuchen, die Entwicklung unserer Demokratie umzukehren und zurückzudrehen.\n\n({6})\n\nSie wollen das Volk wiederum spalten und den Einzelnen bei der Ausübung seiner demokratischen Rechte wiederum an seine Gruppenzugehörigkeit binden. Sie halten Wahlen ab, bei denen mittels sogenannter Quoten den Wählern vorgeschrieben wird, nach welchen Kriterien gewählt werden muss, und den Bewerbern, ob sie kandidieren dürfen oder nicht. Diese Wahlen sind keine demokratischen Wahlen.\n\n({7})\n\nDie innere Ordnung dieser Parteien entspricht nicht, wie es das Grundgesetz verlangt, demokratischen Grundsätzen. Als wäre das nicht schlimm genug, praktizieren sie dieselben undemokratischen Verfahren auch bei der Aufstellung von Parlamentskandidaten. Sie korrumpieren damit die demokratische Natur unserer Parlamentswahlen. Wahlen nach Quoten sind ein Angriff auf die demokratische Grundordnung Deutschlands.\n\n({8})\n\nEs ist unsere Verantwortung als Volksvertreter, diesen Angriff abzuwehren. Unser Gesetzentwurf sieht vor, dass in den Gesetzen, in den Wahlgesetzen und im Parteiengesetz, klargestellt wird, was sich eigentlich von selbst versteht, was aber von einigen Parteien bewusst missachtet wird: dass die Parteien niemandes demokratische Rechte beschneiden dürfen aufgrund der Eigenschaften, die das Grundgesetz in seinem Artikel 3 Absatz 3 aufzählt. Also: keine Einschränkung demokratischer Rechte wegen des Geschlechtes, der Abstammung, der Rasse, der Sprache, der Heimat und Herkunft, des Glaubens oder der Behinderung. Wie gesagt: Eine völlig banale Selbstverständlichkeit!\n\n({9})\n\nNun versuche ich, einiges vorwegzunehmen, was in nachfolgenden Redebeiträgen vorhersehbarerweise vorgetragen werden wird, zum Beispiel dies: Es gibt Juristen, die meinen, die Vorgabe des Grundgesetzes, dass auch in den Parteien demokratische Regeln gelten müssen, dürfe man nicht so eng sehen. Parteien müssten sich entsprechend ihrer jeweiligen Ideologie verhalten können, und wenn die Ideologie der Partei es mit der Demokratie nicht so genau nehme, dann müsse die Partei das eben auch ausleben dürfen.\n\n({10})\n\nJa, diese Meinung gibt es. Sie ist aber falsch.\n\n({11})\n\nWenn eine Partei eine Ideologie vertritt, nach der die Regeln der Demokratie missachtet oder abgeschafft werden sollen, dann darf man dieser Partei nicht die Möglichkeit geben, das auszuleben, sondern dann muss sich um diese Partei der Verfassungsschutz kümmern. Im Extremfall muss diese Partei verboten werden.\n\n({12})\n\nDann wird vermutlich gleich vorgetragen werden, speziell für die von den Parteien praktizierte Diskriminierung wegen des Geschlechtes gebe es eine Rechtfertigung, nämlich den sogenannten Gleichstellungsauftrag, der angeblich im Grundgesetz enthalten sei. Auch diese Meinung gibt es. Auch diese Meinung ist falsch.\n\n({13})\n\n– Lesen Sie einfach das Grundgesetz. Es kennt dieses Wort nicht.\n\n({14})\n\nEs gab vor langer Zeit einmal den Versuch, das Wort „Gleichstellung“ in das Grundgesetz hineinzuschreiben. Dieser Versuch ist zum Glück gescheitert.\n\n({15})\n\nSeitdem versuchen diejenigen, die damals diesen Versuch unternommen haben, das durch die Hintertüre doch noch durchzusetzen, indem sie so tun, als seien Gleichberechtigung und Gleichstellung dasselbe. Das ist reine Propaganda.\n\n({16})\n\nSolange Menschen Individuen mit freiem Willen sind und keine normierten Klone à la „Schöne neue Welt“, so lange lässt sich statistische Gleichverteilung nur durch Zwang erreichen, also gerade durch die Abschaffung gleicher Rechte. Gleichstellung und Gleichberechtigung schließen sich deshalb gegenseitig aus.\n\n({17})\n\nDer erfundene Gleichstellungsauftrag rechtfertigt keinesfalls den Bruch elementarer demokratischer Regeln.\n\n({18})\n\nIch möchte zum Abschluss den Blick weg von der Ebene der abstrakten juristischen Begriffe auf die Ebene der Menschen richten. Um die geht es.\n\n({19})\n\nWir leben ja in Zeiten, in denen Regierungsparteien – Sie grinsen, Frau Nahles; aber ich schaue Sie an – es unternehmen, das Volk wieder zu spalten und gegeneinander zu treiben. Sie teilen die Staatsbürger ein, erst in Männer und Frauen, demnächst noch in andere Kategorien. Sie nehmen uns die Freiheit, die das Grundgesetz doch garantiert, die Freiheit, uns von Ihnen nicht solchermaßen einteilen zu lassen.\n\n({20})\n\nSie wollen zur Sicherung Ihrer Herrschaft einen Geschlechterkonflikt anzetteln, und Sie wollen in diesem, von Ihnen selbst geschürten Konflikt keine Neutralität akzeptieren und keine Verweigerung. Die Verfassung schützt aber die Freiheit und die Würde des Einzelnen, die Würde derjenigen, die sich dem verweigern, die sich nicht nötigen lassen wollen zum Zwangsdienst in Ihrem absurden Geschlechterkrieg.\n\n({21})\n\nEs ist unsere Verantwortung als Gesetzgeber, dafür zu sorgen, dass dieser Schutz durch die einfachen Gesetze effektiv gewährleistet wird. Dafür sorgt unser Antrag.\n\n({22})\n\nDas Quotendenken ist ein Gift, eine Säure, die unsere freiheitliche Gesellschaft zerfrisst.\n\n({23})\n\nDieses Gift hat unsere Rechtsordnung, unsere bürgerliche Freiheit bereits an vielen Stellen angegriffen.\n\n({24})\n\nHier und heute geht es um den Kern der politischen Freiheit, um die Freiheit der Wahl, und es geht um die Würde des Einzelnen als Staatsbürger. Bekennen Sie sich zur Freiheit, zur Demokratie, zur Würde des Einzelnen! Unterstützen Sie unseren Antrag!\n\nVielen Dank.\n\n({25})"
"1020211","Beatrix","Storch","AfD","Member of Parliament","2019-02-21T00:00:00.000Z","https://dip21.bundestag.de/dip21/btp/19/19083.pdf","\n\nIch höre, Sie freuen sich schon auf meine Intervention; ich auch.\n\nHerr Kollege, Sie sprachen von politischer Präzision, die wir an den Tag legen sollten, und das möchte ich gerne tun. Ich möchte in politischer Präzision Ihre Einlassungen in den Kontext Ihrer sonstigen Gesetzesinitiativen stellen.\n\nSie reden einer Quote für Frauen das Wort. Die kann nur 50 Prozent betragen. Das stelle ich in den Kontext Ihrer anderen Initiativen, die jetzt offiziell ein drittes Geschlecht eintragen lassen wollen, das „divers“ heißt. Ich frage mich, wie das bei den Quoten berücksichtigt werden soll. Sie können schlechterdings nicht eine 50‑Prozent-Quote für Männer und für Frauen ansetzen und gleichzeitig sagen, es gibt noch ein drittes Geschlecht, das Sie gerne „divers“ nennen wollen. Das heißt, Sie müssen schon erklären, wie hoch die Quoten für die Diversen sein sollen.\n\nDann muss das Ganze im Kontext der Definition der Diversen gesehen werden; denn Sie legen ja Wert darauf, dass „divers“ derjenige ist, der sich selbst als „divers“ definiert. Das heißt, unabhängig von der Biologie kann man sich dem Geschlecht „männlich“, „weiblich“ oder „divers“ zuordnen, was wiederum bedeutet: Für wen gilt eigentlich die Frauenquote, wenn sie am Ende vielleicht 33 Prozent beträgt und 33 Prozent auf „divers“ entfällt? Wer ist im Sinne Ihres Quotensprechs eigentlich eine Frau und ein Mann? Kann nicht auch ein biologischer Mann die Frauenquote für sich in Anspruch nehmen, wenn er sich selbst, zumindest am Wahltag oder beim Aufstellungsparteitag, als Frau definiert?\n\nSie werden das gleich als lächerlich abtun. Aber diese Fragen stellen sich, und das Lächerliche an dieser Geschichte, das ist Ihre Gesetzesinitiative, das sind Ihre Definitionen, und die werden anhand der konkreten Beispiele klar. Also bitte: Wie hoch sind die Quoten für die Diversen, und wer ist ein Diverser? Wer ist Mann und wer ist Frau im Rahmen Ihrer 50‑Prozent-Quotenregelung?\n\n({0})"
"1020244","Johannes","Huber","AfD","Member of Parliament","2019-02-21T00:00:00.000Z","https://dip21.bundestag.de/dip21/btp/19/19083.pdf","\n\nSehr geehrte Frau Präsidentin! Sehr geehrte Damen und Herren! Die heutige Debatte ist eine Folge der eigentlich abgewählten Großen Koalition der vergangenen Wahlperiode. War sie damals noch voll des Lobes für das entworfene Kinder- und Jugendstärkungsgesetz, so bezeichnet die heutige Große Koalition es nur noch als Vorarbeit. Wir sagen Danke, dass Sie auf die Entschlusskraft der AfD gewartet haben.\n\n({0})\n\nAls Bürgerpartei vertreten wir die Anliegen der öffentlichen Petitionen an den Bundestag.\n\n({1})\n\nSo können wir uns durchaus mit Ombudsstellen für Betroffene in der Kinder- und Jugendhilfe anfreunden, soweit damit die soziale Teilhabe von Eltern und Kindern gewährleistet wird. Wir wollen aber nicht, dass Eltern und ihre Kinder in der Debatte um die Kinderrechte gegeneinander ausgespielt werden. Es ist ein Skandal, dass Bundesfamilienministerin Giffey eine Broschüre gefördert hat,\n\n({2})\n\nin der es darum geht, in Kitas an einer Gesinnungskontrolle von Eltern zu arbeiten, wie es eine Vertreterin der Amadeu-Antonio-Stiftung hier im Bundestag ausgedrückt hat.\n\n({3})\n\nGenauso lehnen wir den Vorschlag Ihrer Fraktion, also der Grünen, ab, Kinder zu eigenständigen Leistungsberechtigten mit Antragsrecht zu machen. Denn damit würden familiäre Bindungen aufgelöst und ganze Familien gespalten werden.\n\n({4})\n\nDie Zugriffsmöglichkeiten der Grünen beim Thema Kinder sollte man sowieso beschränken.\n\n({5})\n\nVor allem in Deutschland, wo die Erfolgschancen für Kinder mit am stärksten vom Status der Eltern abhängen, sollte klar sein: Wer Kinder und Jugendliche wirklich stärken will, der muss zuerst die Eltern von der Steuerlast und der Zeitknappheit entlasten.\n\n({6})\n\nAuch als Mitglied der Kinderkommission kann man sehr schnell erkennen, wie mit allen vorliegenden Anträgen auf dem Rücken der Schwächsten ideologische Politik betrieben wird. Mit Ihren Inklusionsträumereien sind Ihnen sogar behinderte Kinder offenbar nicht zu schade, um sie für Ihre Ideologie einer sozialistischen Gleichmacherei einzusetzen.\n\n({7})\n\nUnterstützungsangebote individuell und bedarfsgerecht auszugestalten, bedeutet für uns ganz klar, Förderschulen und ein gestuftes Schulsystem auszubauen, damit Kinder durch entsprechend ausgebildetes Personal passgenau die Förderung bekommen, die sie benötigen.\n\n({8})\n\nDie AfD erteilt aber auch anderen sozialen Experimenten von freien Trägern der Jugendhilfe eine Absage, wenn sie sich zu linksradikalen Keimzellen entwickeln.\n\n({9})\n\n– Hören Sie zu.\n\n({10})\n\nZum Beispiel erhält das Alternative Jugendzentrum in Chemnitz im Rahmen der Kinder- und Jugendhilfe jährlich 500 000 Euro. Das sind 500 000 Euro für ein Zentrum, welches die einschlägig bekannte Band „Feine Sahne Fischfilet“ beherbergt und in dem die Rotfaschisten der sogenannten Antifa Kongresse abhalten können, zum Beispiel zur Vorbereitung der Demonstrationen beim G-20-Gipfel in Hamburg, oder Seminare, die Titel tragen wie „Militanz, Gewalt und die Frage: Politische Gegner ignorieren, blockieren oder verhauen?“\n\n({11})\n\nWenn es die Kinder- und Jugendhilfe der Großen Koalition sein soll, eine Rotfront zu züchten, dann ist sie jedenfalls erfolgreich. Mit dem Grundgesetz hat das aber nichts mehr zu tun.\n\n({12})\n\nImmerhin haben Sie alle im Einklang erkannt, dass asylsuchende Kinder, Jugendliche und Frauen in Aufnahmeeinrichtungen in Deutschland wieder Gewalt erfahren müssen. Suchen wir die Ursache, so landen wir bei den so liebevoll angekündigten Fachkräften, leider Gottes bei sehr vielen Leuten, die eher qualifiziert mit Messern umgehen können. Allein diese Tatsache ist die selbst ausgestellte Bankrotterklärung dieser Bundesregierung."
"1020246","Johannes","Huber","AfD","Member of Parliament","2019-02-21T00:00:00.000Z","https://dip21.bundestag.de/dip21/btp/19/19083.pdf","\n\nHier hilft es auch wenig, an den Symptomen herum­zudoktern und Träger von Asylunterkünften jetzt Schutzkonzepte entwickeln zu lassen. Wer während des Asylverfahrens in und außerhalb von Aufnahmeeinrichtungen Gewalt gegen Kinder und Jugendliche verübt, der muss unverzüglich abgeschoben werden. Erst wenn Sie das verstanden haben, hat Kinder- und Jugendhilfe in Deutschland eine Zukunft.\n\nVielen Dank.\n\n({0})"
