id,firstname,lastname,faction,position,date, url,speech
"1037872","Mariana Iris","Harder-Kühnel","AfD","Member of Parliament","2020-03-06T00:00:00.000Z","https://dip21.bundestag.de/dip21/btp/19/19150.pdf","\n\nSehr geehrter Präsident! Sehr geehrte Damen und Herren! Der Weltfrauentag bietet in jedem Jahr die Gelegenheit, Bilanz zu ziehen. Was hat sich für Frauen und Mädchen in Deutschland verändert? Was zum Guten, was zum Schlechten? Gut und richtig ist, den Kampf der Frauen für Gleichberechtigung und die mit diesem Kampf erzielten Erfolge in Erinnerung zu rufen: das Frauenwahlrecht, die Freiheit und die Emanzipation der Frau, die im Grundgesetz verankerte Gleichberechtigung. Aber damit meine ich echte Gleichberechtigung im Sinne von Chancengleichheit zwischen Männern und Frauen, keine Gleichstellung.\n\n({0})\n\nChancengleichheit muss selbstverständlich gegeben sein; da sind wir uns alle einig. Chancengleichheit bedeutet aber nicht, dass der Staat in typischen Männerberufen, in sämtlichen Gremien und Parlamenten und in sozialistischer Manier eine Frauenquote von 50 Prozent erzwingen muss.\n\n({1})\n\nChancengleichheit bedeutet vielmehr, dass es Frauen und Männern in ihrer freien Entscheidung möglich sein muss, all diese Tätigkeiten ausüben zu können, wenn sie das möchten.\n\n({2})\n\nSie hingegen machen Frauen da zu Opfern, wo sie gar keine sind, schweigen aber dröhnend laut dort, wo Frauen zunehmend zu Opfern werden.\n\n({3})\n\nSie führen einmal mehr Phantomdebatten. Ihnen geht es um die gendergerechte Verhunzung der deutschen Sprache. Ihnen geht es um Unisextoiletten. Ihnen geht es um Frauenquoten sogar bei Straßennamen.\n\n({4})\n\nFrüher hat uns die ganze Welt um unsere Dichter und Denker und um unsere Ingenieurskunst beneidet. Und heute?\n\n({5})\n\nHeute lacht man uns aus, weil wir Millionen an Genderinstitute verpulvern, die an der Entwicklung eines 71. Geschlechtes basteln.\n\n({6})\n\nIhr Kampf für Gleichberechtigung ist längst zu einem Kampf um Privilegien verkommen. Sie fordern Frauenquoten, aber bitte nur in Wohlfühlberufen: Quoten für Lehrstühle an der Uni, Quoten in Aufsichtsräten großer Unternehmen, Quoten in hohen Managementpositionen. Warum fordern Sie eigentlich keine Frauenquoten bei Militäreinsätzen im Ausland, nicht beim Bau oder bei der Müllabfuhr?\n\n({7})\n\nIhre Quotenforderung ist nichts anderes als die für Sie typische konformistische Rebellion,\n\n({8})\n\neine Rebellion, die in Wahrheit gar keine ist. Es ist kostenfreier Gratismut. Sie ecken nirgendwo an, wo es wehtun könnte. Sie spielen Rebell in sicherem Wissen, die Medien und den politischen Mainstream auf Ihrer Seite zu haben. Und Sie schmücken sich dann mit so edlen Begriffen wie „Haltung“, „Mut“ und „Zivilcourage“.\n\nMeine Damen und Herren, Zivilcourage bedeutet aber nicht, mit dem Mainstream einfach mitzuschwimmen, sondern sich, wenn nötig, diesem Mainstream entgegenzustellen,\n\n({9})\n\nund das tut in diesem Land nur eine Partei, und das ist die AfD.\n\n({10})\n\nWo ist denn Ihre Zivilcourage, wenn in deutschen Städten wie auf der Kölner Domplatte zahllose Frauen Opfer von Sexualdelikten werden?\n\n({11})\n\nWo ist Ihr Mut, wenn es darum geht, klipp und klar die wahren Ursachen für zunehmende häusliche Gewalt, Zwangsheiraten, Genitalverstümmelungen, Kinderehen und Ehrenmorde zu benennen? Wo ist Ihre Haltung, wenn es darum geht, Frauen vor einer Unterdrückung durch Menschen aus patriarchalischen Gesellschaften zu schützen? Da hört man aus Ihrer Ecke zumeist erstaunlich wenig.\n\n({12})\n\nNein, Sie haben eben keine Zivilcourage.\n\nJa, Sie haben eine Haltung, aber leider die falsche. Und nein, Sie sind nicht mutig, weil Sie den Mund immer dann halten, wenn Sie ihn eigentlich zwingend aufmachen müssten.\n\n({13})\n\nUnd ja, wir brauchen eine neue, ehrliche Debatte über Frauenrechte. Frauenrechte zu stärken, ist aktuell wichtiger denn je. Dabei geht es aber nicht um Genderwahn oder darum, wie man Eltern politisch korrekt nennt. Nein, vielmehr geht es darum, dass wir Frauen in Deutschland des 21. Jahrhunderts uns das Recht zurückerkämpfen müssen, angstfrei und ohne männliche Begleitung auf die Straße gehen zu können.\n\n({14})\n\nEs geht darum, echte Wahlfreiheit zu haben als Frau und als Mutter und sich auch für drei Kinder und mehr entscheiden zu können, ohne sich einem Armutsrisiko auszusetzen. Es geht darum, dass Frauen und Mädchen sich so kleiden dürfen, wie sie möchten, dass sie nicht schon als kleine Kinder Kopftücher tragen müssen, die ein freies Rennen, Spielen, Schwimmen geradezu unmöglich machen und die die Unterdrückung der Frau von Kindesbeinen an zur zweiten Haut werden lassen. Es geht darum, dass Frauen und Mädchen alle Bildungsangebote wahrnehmen dürfen.\n\n({15})\n\nChancengleichheit – Sie erinnern sich – insbesondere auch für Frauen und Mädchen mit Migrationshintergrund. Es geht darum, importierte patriarchalische Strukturen wieder aufzubrechen. Es geht um Nulltoleranz bei der zunehmenden Gewalt gegen Frauen,\n\n({16})\n\nNulltoleranz, egal ob bei häuslicher Gewalt, Kinderehen, Zwangsheiraten oder Genitalverstümmelungen. Wo bleibt bei diesen Themen Ihr lauter Aufschrei? Wo?\n\nDurch Ihr politisch korrektes, kultursensibles Schweigen machen Sie sich mitschuldig,\n\n({17})\n\nmitschuldig daran, dass die über Jahrhunderte hart erkämpften Freiheiten der Frauen in Deutschland schleichend immer weiter eingeschränkt und gefährdet werden. Viele Frauen und Mädchen trauen sich abends nicht mehr allein zum Joggen oder auf die Straße, meiden bestimmte Stadtteile. Schwimmbadbesuche werden zum Spießrutenlauf. Das ist leider die bittere Realität für Frauen in Ihrem besten Deutschland, das es je gab.\n\n({18})\n\nAber Sie stören sich lieber daran, dass es immer noch Gentlemen gibt,\n\n({19})\n\nMänner, die Frauen aus dem Mantel helfen, die Frauen die Tür öffnen, die Frauen im Bus ihren Platz anbieten. Viele von Ihnen halten solche selbstverständlichen Freundlichkeiten für eine patriarchale Anmaßung, für das Ergebnis eines patriarchalen Frauenhasses, wo es doch nichts anderes ist als eine tradierte Ehrbekundung des Mannes an die Frau.\n\n({20})\n\nMeine Damen, nicht der alte weiße Mann ist der Feind der Frauen im 21. Jahrhundert. Es ist Ihre utopiebesoffene Multikultipolitik,\n\n({21})\n\nderen Folgen für viele Frauen zum realen Albtraum werden.\n\n({22})\n\nUnd wenn man die neuesten Bilder von den Gewalttätigkeiten an der griechisch-türkischen Grenze sieht, ahnt man noch Übleres auf uns zukommen. Es wiederholt sich gerade das, wovor wir als Einzige immer gewarnt haben. Und es sind erneut die Frauen hierzulande, die das ausbaden müssen.\n\nMein Appell an Sie: Beenden Sie endlich Ihren konstruierten Kampf der Geschlechter! Männer sind nicht unsere Gegner, sie sind unsere Partner. Lassen Sie Leistung und Qualifikation entscheiden, keine Quoten! Denn keine Frau möchte als Quotenfrau abqualifiziert werden.\n\n({23})\n\nHören Sie auf mit Ihrem Kampf gegen die Natur! Lassen Sie Frauen als Frauen und Männer als Männer glücklich sein! Öffnen Sie endlich die Augen für die Probleme der Frauen in Deutschland! Ansonsten machen Sie sich weiterhin mitschuldig. Und ich bezweifle sehr, dass kommende Generationen Ihre Politik noch bejubeln werden. Kehren Sie stattdessen zu den Kernzielen echter Frauenrechtlerinnen zurück: Freiheit, Sicherheit, Schutz vor Gewalt, Gleichberechtigung.\n\n({24})\n\nDamit haben Sie im Deutschland des 21. Jahrhunderts leider genug zu tun; denn all diese mühsam erkämpften Rechte der Frauen sind aufgrund Ihrer Politik in höchster Gefahr.\n\n({25})"
"1037880","Beatrix","Storch","AfD","Member of Parliament","2020-03-06T00:00:00.000Z","https://dip21.bundestag.de/dip21/btp/19/19150.pdf","\n\nVielen Dank. – Ich habe eigentlich nur eine Frage stellen wollen. Dass Frauen und Männer die gleichen Chancen haben sollen, ist klar; das ist Gleichberechtigung. Nun haben Sie gesagt: Sie müssen die Chancen gleich verwerten. – Sagen Sie mir, welches Recht Frauen in Deutschland nicht haben, das Männer haben. Was können Frauen rechtlich nicht tun, was Männer tun können? Haben wir da Nachholbedarf? Gibt es da irgendetwas? Sagen Sie mir ein Gesetz, einen Bereich, in dem Frauen nicht das machen können – rechtlich –, was Männer machen können. Dass das Ergebnis nicht das gleiche ist, das ist immer schwierig.\n\nUnd wenn wir von einer 50-Prozent-Quote reden, möchte ich auch gerne wissen: Wie verträgt sich das mit der Tatsache, dass wir drei Geschlechter haben?\n\n({0})"
"1037910","Udo Theodor","Hemmelgarn","AfD","Member of Parliament","2020-03-06T00:00:00.000Z","https://dip21.bundestag.de/dip21/btp/19/19150.pdf","\n\nSehr geehrter Herr Präsident! Sehr geehrte Kolleginnen und Kollegen! Sehr geehrtes Publikum auf den Tribünen! Wir haben an dieser Stelle bereits mehrfach über den Wohnungsmangel – insbesondere in den Metropolen unseres Landes – gesprochen. Parteiübergreifend sollte Einigkeit darin bestehen, dass mehr und vor allem schneller gebaut werden muss, um die Situation zu entspannen. Unsere beiden Anträge dienen genau diesem Ziel.\n\nMit dem ersten Antrag fordern wir die Aussetzung der Energieeinsparverordnung – zumindest so lange, bis der Wohnraum wieder für alle Menschen bezahlbar geworden ist. Man hat in Zeiten von Greta Thunberg keinen leichten Stand, wenn man einen solchen Antrag vorlegt, aber wir müssen den Blick auf die Realitäten in unserem Land richten. Generell kann der Politik in unserem Land ein wenig mehr Realitätssinn nicht schaden.\n\nDie energetischen Vorgaben der EnEV haben in den Jahren 2000 bis 2017 zu Kostensteigerungen von bis zu 19 Prozent und damit zu einer erheblichen Verteuerung des Bauens geführt. Diese Verteuerung hat neben anderen Faktoren für einen deutlichen Anstieg der Mieten gesorgt.\n\nDie Dämmvorschriften der EnEV sind dabei ein schönes Beispiel für die Überschreitung jeglichen Grenznutzens und das, was wir als „Dämmwahn“ bezeichnen. Während die ersten Zentimeter der Außendämmung im Hinblick auf den Wohnkomfort und unter energetischen Gesichtspunkten noch Sinn machen, fällt der Nutzen danach immer weiter ab. Es macht dann praktisch keinen Unterschied mehr, ob man 16 oder 30 Zentimeter Dämmung aufbringt. Trotzdem schreibt die EnEV am Ende natürlich die 30-Zentimeter-Dämmung vor.\n\nAuch wenn derzeit noch der Grundsatz der anlassbezogenen Sanierung gilt: Die EnEV gibt den Eigentümern das Maß der Sanierung vor. Wenn der Eigentümer die Fassade sanieren möchte, wird er zur Einhaltung des EnEV-Standards verpflichtet, obwohl sich das für ihn weder finanziell noch in sonstiger Hinsicht lohnt. In der Folge entscheiden sich viele Eigentümer dann oftmals gegen die Sanierung und beschränken sich auf Reparaturen. Wir wissen, dass einige Vertreter des linken politischen Lagers schon jetzt von Zwangssanierungen träumen, deren Kosten dann bei den vermeintlich reichen Hausbesitzern hängen bleiben. Derartigen Ideen erteilen wir schon heute eine Absage.\n\n({0})\n\nUm an dieser Stelle nicht missverstanden zu werden: Auch im politischen Programm der AfD haben Ressourcenschonung und Umweltschutz einen wichtigen Platz. Auch wir sind grundsätzlich dafür, dass Gebäude energetisch saniert werden, wenn das sinnvoll ist.\n\n({1})\n\nDas Was und das Wie der Maßnahmen muss aber den Eigentümern überlassen bleiben. Die meisten Eigentümer werden zur energetischen Sanierung bereit sein, wenn es für sie Sinn macht.\n\nRichtig wäre es daher, wenn man den Fokus auf die Gebäude legen würde, die die größten energetischen Defizite haben. Das sind die Nachkriegsbauten, die bis Ende der 70er-Jahre errichtet und bislang noch nicht energetisch saniert wurden. Hier kann man mit relativ wenig Aufwand sehr viel erreichen. Die EnEV fördert demgegenüber das am meisten, was am teuersten ist. Das ist der Grund, weshalb energetische Sanierungen in den meisten Fällen für Eigentümer und Mieter unwirtschaftlich sind.\n\nDie Bundesregierung hat nun den Entwurf des Gebäudeenergiegesetzes vorgelegt, das die EnEV und andere Vorschriften in einem Gesetz zusammenführt. Auch wenn damit derzeit keine Verschärfung der energetischen Standards verbunden ist, werden die teuren und überzogenen Anforderungen weiter zementiert, und die nächste Stufe der Verschärfung wird vorbereitet.\n\nDaneben wird das Gebäudeenergiegesetz zu einem Anwachsen der Vorschriften von 80 auf 200 Seiten führen. In der Expertenanhörung wurde zwar gesagt, dass es für die Immobilienwirtschaft als einheitliches Regelwerk trotzdem leichter zu handhaben wäre. Wir glauben allerdings, dass dieser Zustand nur von kurzer Dauer ist und die Widersprüche schon mit der nächsten Änderung wieder aufbrechen werden. Die Fehler der EnEV werden bis auf Weiteres im Gebäudeenergiegesetz fortgeschrieben.\n\nMeine Damen und Herren, über den Klimawandel und die Energieeinsparung mag man denken, was man will – wichtiger ist aus unserer Sicht in jedem Fall, dass jeder Mensch in unserem Land zu bezahlbaren Kosten ein angemessenes Dach über dem Kopf hat.\n\n({2})\n\nDie Politik muss hier eine Entscheidung treffen. Sie muss entscheiden, ob sie den ideologisch motivierten Klimaschutz weiterhin auf Kosten der Menschen betreibt oder ob sie der berechtigten Forderung nach bezahlbarem Wohnraum nachkommt. Wir sind auf Ihre Entscheidung gespannt.\n\nMan muss in diesem Zusammenhang darauf hinweisen, dass die energetischen Regelungen nur einen Teil der Vorschriften des Baurechts bilden. Der Deutsche Städte- und Gemeindebund beklagte jüngst in einem Positionspapier, dass sich die Anzahl der Vorschriften seit 1990 von 5 000 auf 20 000 vervierfacht hätte. Diese dramatische Steigerung betrifft alle Bereiche des Bau- und Baunebenrechts. Auch dieser Wildwuchs von Vorschriften trägt zur Steigerung der Kosten des Bauens und Wohnens bei.\n\nInsbesondere für kleine und mittlere Betriebe wird es immer schwerer und aufwendiger, die für sie maßgeblichen Normen auszumachen und anzuwenden. Die zusätzlichen Vorschriften haben das Bauen weder besser noch sicherer gemacht, sondern nur komplizierter und teurer.\n\n({3})\n\nMeine Damen und Herren, das nächste Drama ist mit der europäischen Bauprodukte-Verordnung bereits vorgezeichnet. Der unselige Drang, auf jede Herausforderung mit noch mehr Regulierung zu antworten, lähmt dieses Land im Wohnungsbau und an anderer Stelle. Es ist unsere Aufgabe, hier korrigierend einzugreifen.\n\nDem dient unser zweiter Antrag. Dabei geht es nicht nur darum, das weitere Anwachsen der Zahl der Vorschriften zu verhindern; es geht auch darum, die bestehenden Normen auf ihre Erforderlichkeit und ihren Nutzen zu prüfen. Erschwert wird diese Aufgabe dadurch, dass das Bauordnungsrecht Ländersache ist. Der Bund kann hier nicht direkt eingreifen; aber er kann und muss seine Möglichkeiten wahrnehmen, gemeinsam mit den Ländern auf eine weitere Vereinheitlichung des Baurechts hinzuwirken. Die derzeitige Musterbauordnung kann diesem Anspruch nur teilweise gerecht werden, da sie in der gegenwärtigen Struktur den Besonderheiten des städtischen und des ländlichen Raums nicht gleichzeitig gerecht werden kann.\n\n({4})\n\n– Ja, lassen Sie es sich erklären. – Hier ist ein neuer, modularer Ansatz zu wählen, der diesen Gegebenheiten Rechnung trägt.\n\nMeine Damen und Herren, wie eingangs bereits erwähnt, wird immer wieder bemängelt, dass in unserem Land zu langsam und zu kompliziert gebaut wird. Die Überwindung der Probleme auf den Wohnungsmärkten wird nur gelingen, wenn wir das Angebot an Wohnraum zügig vergrößern. Wir zeigen Ihnen mit unseren Anträgen Schritte auf, die Probleme zu lösen. Und an das Bauministerium gerichtet: Mit der Zustimmung zu unseren Anträgen würde Ihr Ziel von 375 000 neuen Wohnungen pro Jahr deutlich schneller erreicht.\n\n({5})\n\nDanke schön.\n\n({6})"
"1037946","Steffen","Kotré","AfD","Member of Parliament","2020-03-06T00:00:00.000Z","https://dip21.bundestag.de/dip21/btp/19/19150.pdf","\n\nSehr geehrte Frau Präsidentin! Sehr geehrte Damen und Herren! Die staatliche Plankommission zur Lenkung der Wirtschaft, genannt Kommission für „Wachstum, Strukturwandel und Beschäftigung“, hat getagt und uns ihren Fünfjahresplan vorgelegt. Die Genossen vom Zentralkomitee, genannt Bundesregierung,\n\n({0})\n\nsind dabei, die staatliche Lenkung der Energiepolitik zu perfektionieren. Während ihre Vorbilder in der sozialistischen DDR wenigstens noch die Produktivitätssteigerung im Sinn hatten, hat sich diese Bundesregierung die Planaufgabe der Zerstörung unserer gesicherten Energieversorgung gestellt. Wir hatten eine gesicherte Energieversorgung, hohe Qualität und einen passablen Strompreis. Wir bekommen jetzt eine geringere und abnehmende Energieversorgung, Stromversorgung, abnehmende Qualität und weiter steigende Strompreise. Wir bekommen also mit dieser Planwirtschaft eben die Mangelwirtschaft, meine Damen und Herren.\n\n({1})\n\nDie Bundesregierung ist in diesem Sinne eher ein Fall für den Psychiater, gehört auf die Couch, aber nicht in Regierungsverantwortung.\n\n({2})\n\nDie schizophrene Begründung des Kohleausstiegs ist immer die CO2-Einsparung. Aber das kann ja die wirkliche Begründung nicht sein, weil wir kein CO2 einsparen werden. Überall auf der Welt werden neue Kohlekraftwerke gebaut. In den nächsten 20, 30 Jahren wird die Kohleverstromung noch um ein Drittel steigen. Und was wir hier mit dem Kohleausstieg machen, ist einfach nur die Verschiebung der Kohleverstromung, zum Beispiel nach Polen. Wenn wir dann eben unsere Stromlücke schließen wollen,\n\n({3})\n\ndann importieren wir wieder den Kohlestrom aus Polen. Das ist natürlich widersinnig. Aber wir exportieren natürlich damit auch unsere Arbeitsplätze. Also, es hat sich weiter nichts geändert. Keine CO2-Einsparung, aber eben Arbeitsplatzexport nach Polen. Das macht kein Land auf dieser Welt. Das macht man nur – irrsinnigerweise – hier in Deutschland.\n\n({4})\n\nNun soll es der Wasserstoff richten, meine Damen und Herren, eine Technologie von vor 180 Jahren. Wasserstofftechnologie kann sinnvoll sein – in Nischen und in Spezialgebieten –, aber nicht als flächendeckende Stromversorgung herhalten. Wer hier Luftschlösser baut und behauptet, dass wir in Afrika das heilige Land der Wasserstoffproduktion hätten, der schaue mal bitte auf die Landkarte. Wir haben in Afrika keine stabilen Länder oder keine solchen, denen wir die Achillesferse unserer Energieversorgung und Industrie anvertrauen dürfen. Das Erpressungspotenzial wäre einfach zu groß.\n\n({5})\n\nAber in diesem Land, das sich auch Erdogan an den Hals wirft, obwohl es die Grenzen selber schützen könnte, ist man vor einem solchen Irrsinn leider nicht gefeit.\n\n({6})\n\nDer Kohleausstieg trägt mit dem dann erhöhten Anteil der erneuerbaren Energien zur Erhöhung der Stromausfallgefahr bei. Instabiler erneuerbarer Strom hat bei uns zu Frequenzschwankungen, Spannungsabfällen und insgesamt zu Instabilität beigetragen. Die Fakten sprechen dann auch für sich. Wacker Chemie überlegt, den Standort Deutschland aufgrund der höheren Strompreise und der nicht mehr gesicherten Stromversorgung zu verlassen, nämlich in Richtung USA. Seit dem Jahr 2000 übersteigen die Abschreibungen die Investitionen in den energieintensiven Branchen. Das, meine Damen und Herren, ist der beste Indikator dafür, dass wir hier in Deutschland schon aufgrund der Energiewende eine Deindustrialisierung haben, leider.\n\n({7})\n\nDie Zahl der kritischen Tage, an denen die Übertragungsnetzbetreiber in Alarmbereitschaft stehen, ist gestiegen, ebenfalls die der Stromabschaltungen von Industriebetrieben. Dass diese Stromabschaltungen von Industriebetrieben geplant sind, spricht Bände und ist einer Industrienation nicht würdig.\n\nDer Kohleausstieg ist unsozial. In der Lausitz wird, wirtschaftlich gesehen, das Licht ausgehen, und da helfen auch keine Verlegungen von Ministerien oder sonstigen Behörden oder andere Tropfen auf den heißen Stein. Die Wertschöpfung von 1,4 Milliarden Euro jährlich lässt sich auch langfristig nicht durch die 18 Milliarden Euro Subventionen für diese Region auffangen, die eben auf 20 Jahre verteilt werden. Die sozial schwachen Einkommensbezieher werden also diesen Kohleausstieg entsprechend spüren als das, was es ist: Wegfall von Einkünften und Abbau der sozialen Marktwirtschaft, meine Damen und Herren.\n\nDieser Kohleausstieg reiht sich ein in eine lange Kette wirtschaftlicher Verheerungen: schleichende Schrumpfung des Mittelstandes und der Mittelschicht, Enteignung der Sparer durch die Nullzinspolitik – 400 Milliarden Euro mindestens –, schleichende Zerstörung der Automobilindustrie, die Landwirtschaft im Würgegriff der Umwelthysteriker und Fälscher von Messergebnissen.\n\n({8})\n\nDie Folge, meine Damen und Herren, für uns als viertgrößte Wirtschaftsnation ist, dass unser Pro-Kopf-Nettogeldvermögen unterdurchschnittlich auf Platz 18 rangiert. Viertgrößte Wirtschaftsnation, Platz 18 beim Pro-Kopf-Nettogeldvermögen! Vor uns liegen Länder wie Italien, Neuseeland, Belgien oder sogar Taiwan. Die haben alle mehr. Und nun wird eben unsere Energiewirtschaft zerlegt.\n\nÜbrigens: 3 Milliarden Menschen auf dieser Erde haben gerade mal so viel Strom wie wir für unseren Kühlschrank. Wenn wir also unsere Stromversorgung schreddern, dann haben wir nicht die Möglichkeit, hier zu unterstützen.\n\nAn all diesem erkennt man ein Muster: Das Zentralkomitee – so können wir die Bundesregierung durchaus folgerichtig nennen – vernichtet mutwillig Volksvermögen. Das erinnert im Kleinen so ein bisschen an die große Transformation des Genossen Mao Tse-tung, der sein chinesisches Volk auch ins Unheil gestürzt hat, oder an die Verstaatlichungen im Sozialismus. Das macht kein Land dieser Erde. Aber nur in Deutschland ist man so irrsinnig.\n\n({9})\n\nDie Bundesregierung reiht sich hier mit der Energiewende und dem Kohleausstieg ein in die Regierungen, diktatorischen Regierungen dieser Erde, die Volksvermögen vernichten und denen die Menschen völlig egal sind.\n\n({10})\n\nUnd nun: An dieser Stelle wird die AfD nicht deshalb kriminalisiert und mit Hass und Hetze überzogen, weil mal ein falsches Wort gesagt wird. Nein, man hat erkannt, dass die AfD die einzige parlamentarische Kraft ist, die diesem Irrsinn ein Ende bereiten kann. Ich versichere Ihnen: Sie wird es auch."
"1037948","Steffen","Kotré","AfD","Member of Parliament","2020-03-06T00:00:00.000Z","https://dip21.bundestag.de/dip21/btp/19/19150.pdf","\n\nVielen Dank.\n\n({0})"
