id,firstname,lastname,faction,position,date, url,speech
"1040249","Lothar","Maier","AfD","Member of Parliament","2020-05-13T00:00:00.000Z","https://dip21.bundestag.de/dip21/btp/19/19159.pdf","\n\nFrau Präsidentin! Der Einsatz der deutschen Streitkräfte in Mali ist nun im siebten Jahr, und die Nachrichten, die wir bekommen, sind alles andere als erhebend. Sind wir dem Ziel dieser Mission näher gekommen? Offensichtlich nicht. Die Kämpfe sind nicht abgeflaut, sondern sie nehmen fast mit jedem Tag zu. Wir hören Nachrichten von Kämpfen mit zum Teil mehreren Hundert Toten, nicht nur an den Grenzen des malischen Staates, sondern auch auf dem malischen Territorium im Inneren. Dem sollte die Mission EUTM – wie auch die MINUSMA-Mission – entgegenwirken. Aber hat sie das wirklich gekonnt? Wenn wir uns die Zahlen für die Ausbildung anschauen, dann sehen wir, dass EUTM seit Beginn dieser Mission ungefähr ebenso viele malische Soldaten ausgebildet hat, wie die malische Armee insgesamt an Soldaten hat. Also jeder hat eine hochwertige Ausbildung bekommen; aber das hat offensichtlich zu nichts geführt.\n\nWoran liegt das? Waren die Ausbildungsinhalte nicht in Ordnung? Dafür gibt es Beispiele aus anderen Missionen: In Afghanistan etwa sind Leute an einer Technik ausgebildet worden, mit der sie nicht umgehen konnten oder die sie hinterher verkauft haben. In Mali kommt dazu, dass sich sehr viele dieser Soldaten mit ihrer von der Regierung geforderten Mission gar nicht richtig identifizieren können. Wir müssen auch erkennen: Mali ist vielleicht ein Staat – der Herr Außenminister sagte: Es ist kein Failed State; das bezweifle ich –, aber es ist keine Nation. Mali besteht aus einer Reihe von Nationen, die sehr unterschiedlich strukturiert sind, die unterschiedlichen Sprachfamilien angehören, unterschiedlichen Stammeskulturen, die in sehr unterschiedlichen, weit voneinander entfernten Regionen leben. Wenn Sie einmal einen Staatsbürger von Mali fragen würden, welcher Nation er angehört, dann wird er kaum sagen: „Ich bin Malier“, sondern er wird sagen: Ich bin Bambara, Dogon, Tuareg, Fulani, Kunta und wie sie alle heißen. Es ist eine Stammesgesellschaft. Wir versuchen hier, einen Konflikt mit militärischen Mitteln zu lösen; aber er ist ein politischer Konflikt. Diesen Staat auf der jetzigen Basis zu regieren, dürfte kaum möglich sein.\n\n({0})\n\nFür solche Staaten ist zunächst einmal die sinnvolle Lösung, sie zu regionalisieren, zu föderalisieren. Die malische Regierung – das ist zum Beispiel allgemein bekannt – hat sich um den Norden des Landes überhaupt nicht geschert.\n\n({1})\n\nSie hat keine Entwicklungsanstrengungen unternommen; sie überlässt das den ausländischen Interventionen. So geht das nicht! Hier muss man eben versuchen, die politische Lösung voranzubringen, statt auf der militärischen Lösung, so wie sie jetzt ist, zu beharren. Es ist auch eine Frage etwa der Stärke der hier eingesetzten europäischen und auch der deutschen Kräfte. EUTM, MINUSMA und die französische Operation Barkhane haben zusammen, wenn ich richtig informiert bin, 1 400 Dienstposten. Diese sollen auf einem Territorium von 1,2 Millionen Quadratkilometern Sicherheit herstellen. Allein die Außengrenzen von Mali umfassen mehrere Tausend Kilometer. Sie sind faktisch nicht zu sichern, und Interventionen erfolgen von allen Seiten, von allen benachbarten Staaten aus. So wie diese Mission jetzt angelegt ist und ohne die notwendige politische Beteiligung ist der weitere Einsatz nicht zu verantworten. Er sollte beendet werden.\n\nDanke Ihnen.\n\n({2})"
"1040259","Armin Paulus","Hampel","AfD","Member of Parliament","2020-05-13T00:00:00.000Z","https://dip21.bundestag.de/dip21/btp/19/19159.pdf","\n\nVielen Dank, Frau Präsidentin. – Herr Kollege, nach Ihren Ausführungen sind Einsätze in Mali und der Sahelzone an sich überhaupt nicht mehr mit irgendwelchen spezifischen messbaren Fragen zu verbinden. Ich habe von Ihnen jetzt kein einziges Mal gehört, was wir in welchem Zeitraum mit welchen Mitteln mit welchem finanziellen Aufwand wo und wie erreichen wollen. Sie wollen in Zukunft den Einsatz über Mali hinaus auf die Sahelzone ausdehnen; damit haben Sie völlig recht. Da sind wir ja schon; der Minister sagte es gerade. In welche Regionen wollen wir denn noch vordringen? Noch einmal: das alles immer, ohne eine Spezifizierung, ohne Kriterien aufzustellen. Was wollen wir in welchem Zeitraum wo durchsetzen?"
"1040285","Udo Theodor","Hemmelgarn","AfD","Member of Parliament","2020-05-13T00:00:00.000Z","https://dip21.bundestag.de/dip21/btp/19/19159.pdf","\n\nSehr geehrte Frau Präsidentin! Sehr geehrte Kolleginnen und Kollegen! Seltsame Zeiten führen zu seltsamen Ideen, und seltsame Ideen führen zu seltsamen Anträgen. Der Antrag der Grünen fordert überraschend eine Lösung, die auch den privaten Kleinvermietern nutzen würde. So viel ökonomischen Sachverstand hätte man von den Grünen nicht erwartet. Wahrscheinlich hat die Parteibasis hier Druck gemacht.\n\n({0})\n\nLieber Herr Kühn, über einige dieser Punkte würden wir sogar mit Ihnen reden.\n\nDie Linken hingegen wollen allen Ernstes die Nettokaltmiete um 30 Prozent absenken, wenn der Mieter coronabedingt von erheblichen Einkommensverlusten betroffen ist. Zum Ausgleich soll es auch zugunsten von Privatvermietern ein Moratorium für Kreditverpflichtungen geben. Die eingetretenen Schäden würden damit von den Vermietern in den Bankensektor verlagert. Offensichtlich hassen die Linken die Banken noch mehr als den privaten Vermieter.\n\n({1})\n\nWir haben schon häufig darauf hingewiesen: Ein Großteil der privaten Vermieter – das sind mehr als 60 Prozent der Vermieter – macht mit seinen Wohnungen keinen oder nur einen geringen Gewinn. Die geforderte Absenkung der Nettokaltmiete würde für viele den sicheren Ruin bedeuten. Aber die Linken haben auch dafür eine Lösung: Es soll ein Härtefallfonds eingerichtet werden, der auch Privatvermietern Hilfe gewährt, wenn sie aufgrund der Coronakrise in Not geraten.\n\n({2})\n\nMan will den Vermieter erst ruinieren, um ihm dann die huldvolle Hilfe des Staates angedeihen zu lassen.\n\nDas Ganze wird abgerundet durch bekannte Maßnahmen linker Ideologen wie einem Moratorium für Mieterhöhungen, dem Verbot von Zwangsräumungen und schließlich dem Verbot jeder Kündigung von Mietern. Fairerweise muss man sagen, dass die Linken das meiste davon auf die Dauer der Coronapandemie beschränken wollen. Aber keine Angst, liebe Linke! Das reicht locker aus, um die meisten Kleinvermieter nachhaltig zu schädigen.\n\nMan kann den Linken an dieser Stelle kaum einen Vorwurf machen. Ihr Antrag ist nur ein wenig chaotischer als das Krisenmanagement der Bundesregierung. Am Ende fragt man sich: Wozu das Ganze überhaupt? Um eine ökonomische Krise zu bekämpfen, die in erster Linie durch den Shutdown dieser Bundesregierung hervorgerufen wurde?\n\n({3})\n\nWie gesagt: Wir leben in seltsamen Zeiten. Kritiker der Bundesregierung in dieser Krise werden wahlweise als Spinner, Verschwörungstheoretiker oder Coronaleugner diffamiert, ungeachtet der Tatsache, dass Schweden einen anderen, besseren Weg gegangen ist.\n\n({4})\n\nAber um es klar zu sagen: Niemand leugnet die Existenz des Coronavirus.\n\n({5})\n\nDer Vorwurf, den wir der Bundesregierung machen, ist, dass sie mit völlig überzogenen Maßnahmen diese Pandemie zu eigenen Zwecken ausnutzt, um ihre katastrophale Politik der letzten Jahre zu verdecken.\n\n({6})\n\nEuro-Krise, Migrationskrise, der Wahnsinn der Energiewende: alles schön überdeckt von Corona. Nebenbei nutzt man das Ganze, um die Bevölkerung auf Linie zu bringen und die Autorität des Staates oder, besser gesagt, die eigene Autorität zu stärken.\n\nHier noch eine weitere Kuriosität in dieser Krise: Während der Großteil der Bundesbürger auch jetzt noch nicht an Nord- und Ostsee reisen darf, können Asylbewerber und Flüchtlinge aller Art\n\n({7})\n\nimmer noch ohne Quarantäne in das Bundesgebiet einreisen. Minister Seehofer sieht hier keinen Handlungsbedarf. Hier stellt sich wirklich die Frage: Innerdeutsche Grenzen können wir sichern, unsere Außengrenzen nicht?\n\n({8})\n\nGleichzeitig wird ein Beamter des Innenministeriums von seinen Pflichten entbunden, weil er den hektisch herbeigeführten Shutdown als Fehlalarm bezeichnete.\n\n({9})\n\nZu Recht wies er darauf hin, dass adäquate Instrumente zur Gefahrenanalyse und ‑bewertung fehlten und auch heute noch fehlen und damit kaum Chancen bestehen, sachlich richtige Entscheidungen zu treffen. Sie müssen mal zuhören, Herr Möring.\n\n({10})\n\nDa kann ich insgesamt nur sagen: ein Innenminister in Topform.\n\nMeine Damen und Herren, es ist richtig, Lösungen zu finden, um die Folgen der Coronamaßnahmen abzumildern. Sehr viel wichtiger ist es allerdings, die immer noch bestehenden, unnötigen Beschränkungen sofort aufzugeben.\n\n({11})\n\nDen übrigen Oppositionsparteien in diesem Parlament empfehle ich, sich sehr genau zu überlegen, ob sie weiter die Statisten in dieser Regierungsinszenierung sein wollen.\n\nVielen Dank.\n\n({12})"
"1040309","Armin Paulus","Hampel","AfD","Member of Parliament","2020-05-13T00:00:00.000Z","https://dip21.bundestag.de/dip21/btp/19/19159.pdf","\n\nDanke schön. – Frau Präsidentin! Meine sehr verehrten Damen und Herren! Zuschauer haben wir ja keine mehr. Sehr verehrter Herr Wehrbeauftragter Bartels! Ich mache die Heuchelei von Ihnen, Frau Ministerin, nicht mit. Sie hätten ja dagegenstimmen können, als es um den Wehrbeauftragten ging. Ich spreche Ihnen aber auch meinen Respekt und meine Anerkennung für Ihre hervorragende Arbeit aus, Herr Wehrbeauftragter.\n\n({0})\n\nMali ist ein Kunstprodukt der Franzosen, entstanden in der Kolonialzeit. Die Bevölkerung lebt in ganz unterschiedlichen Identitäten, die nicht von der Staatsgrenze abhängen; mein Kollege Lothar Maier hat das vorhin bei EUTM Mali schon ausgeführt.\n\n({1})\n\nDort geht es nicht um Nationalitäten, sondern um tribale Identitäten, und dort findet nicht ein Kampf zwischen islamistischen Terroristen und friedliebenden Menschen, sondern zwischen Viehzüchtern und Ackerbauern statt. Der Konflikt ist jahrhundertealt. Früher konnte das durch Kompromisse gelöst werden, heute leider nicht mehr.\n\nDas exzessive Bevölkerungswachstum von 4 Millionen auf absehbar 36 Millionen überfordert die natürlichen Ressourcen. Es handelt sich nicht um ein demografisches Problem in der Region, sondern um eine demografische Katastrophe.\n\nDas ist die Ausgangslage, die wir vorgefunden haben. Mittlerweile verfolgen wir dort seit sieben Jahren eine Operation, die nicht irgendeinen Erfolg für uns erkennbar oder absehbar gemacht hat.\n\nHerr Staatsminister, ich habe im Ausschuss nachgefragt, was denn die wenigen Grundparameter sind, die man abfragen kann, um einen Erfolg zu messen. Ich habe Sie gefragt: Ist denn das Bruttoinlandsprodukt in Mali gestiegen, oder ist es gefallen? Um wie viel ist es gestiegen? Ich brauchte nicht die genaue Prozentzahl; aber ich wollte es gerne ansatzweise wissen. Um ein Viertel? Um die Hälfte? – Sie konnten darauf keine Antwort geben. Auch Ihr Fachmann, der Abteilungsleiter, ist uns die Antwort schuldig geblieben.\n\nIch habe dann nachgefragt: Wie viel des Staatsgebietes kontrollieren die Regierungstruppen denn jetzt, nach sieben Jahren Einsatz? Sind das 10 Prozent oder 50 Prozent oder 80 Prozent? Ungefähr! Ich will keine konkrete Zahl haben. – Selbst darauf fanden Sie keine Antwort. Sie konnten nur sagen: Da gibt es einige Wüstenregionen, wo gar nichts unter Kontrolle ist.\n\n({2})\n\nWas für eine Aussage zu einem Konflikt, den wir seit sieben Jahren begleiten! Nicht mal die Frage nach einer verbesserten Infrastruktur oder der Produktivität in dem Lande konnten Sie mit einer ungefähren Zahl oder Prozentangabe beantworten.\n\nWer uns noch nicht einmal die Grundparameter eines solchen Einsatzes vorlegen kann, kann doch von uns nicht erwarten, dass wir weiterhin einen Einsatz gutheißen, bei dem wir es derzeit mit einer Regierung zu tun haben, die gerade mal mit 36 Prozent – wenn ich es richtig in Erinnerung habe – gewählt worden ist. Der Oppositionsführer wurde weggeschnappt, befindet sich irgendwo eingekastelt und wird nicht herausgegeben. Der islamistische Terror ist zudem nicht auf dem Rückzug, sondern auf dem Vormarsch. Ja wo ist denn da ein Erfolg dieser Operation zu verzeichnen, Herr Staatsminister?\n\n({3})\n\nKommen wir zu den europäischen Nationen, die sich hier engagieren. In diesem Zusammenhang kann man einen Aspekt hinzufügen. Man könnte sagen: Ja, das machen wir, um unsere französischen Freunde zu unterstützen. Schließlich wissen wir alle, dass da vornehmlich französische Interessen wichtig sind, nicht unsere, keine deutschen. Dann könnten wir das zu einem politischen Instrument machen. – Wir könnten ja sagen: Wir geben den Franzosen was; wir stellen uns an ihre Seite. Aber dafür wollen wir vielleicht etwas von unseren französischen Freunden in anderen Bereichen haben. – Selbst diese Idee zu formulieren, kommt Ihnen nicht in den Sinn.\n\nIch ahne nur eins: dass das in Afrika nur funktioniert, wenn wir Afrika den Afrikanern zurückgeben, auch die Lösung ihrer Probleme. Wir alle haben so etwas nämlich erlebt – das war vorbildlich – beim Konflikt zwischen Äthiopien und Eritrea. Ich habe das immer wieder erwähnt, weil es in der Tat interessant ist, nachzuvollziehen, wie sich da zwei Staaten ohne jegliche westliche Einmischung auf ein aufgezeichnetes Friedensabkommen haben einigen können. Das ist der Weg. Meine Damen und Herren, überlassen wir Afrika den Afrikanern. Sie werden für ihre Zukunft kämpfen. Ja, sie müssen sie auskämpfen. Aber eine europäische Intervention wird auch weiterhin scheitern. Schicken Sie Soldaten nicht in die Wüste, schicken Sie sie nach Hause, Frau Minister!\n\n({4})"
"1040343","Martin","Sichert","AfD","Member of Parliament","2020-05-13T00:00:00.000Z","https://dip21.bundestag.de/dip21/btp/19/19159.pdf","\n\nHerr Präsident! Meine Damen und Herren! Die Grünen fordern eine Coronaprämie aus Steuermitteln für Beschäftigte im Gesundheitswesen, und sie begründen das mit geringen Einkommen und den besonderen Risiken einer Infektion. Als gerechtigkeitsliebendem Menschen erschließt sich mir das nicht. Auch Verkäufer im Lebensmitteleinzelhandel oder Mitarbeiter von Sicherheitsdiensten waren wochenlang ohne ausreichende Schutzmaßnahmen einem besonderen Risiko ausgesetzt und haben sehr geringe Einkommen. Warum soll nun aus deren Steuern eine Sonderprämie im Gesundheitswesen bezahlt werden?\n\nNatürlich kann sich jetzt jede Partei gegenseitig mit Sonderzahlungen für bestimmte Gruppen überbieten und versuchen, sich in dieser Coronakrise zu profilieren und neue Wähler zu sichern. Das aber ist, wenn man das weiterdenkt, eine Form der Scheckbuchdemokratie, die höchst unseriös ist und die in eklatantem Widerspruch zum Auftrag der Abgeordneten als Vertreter aller Bürger steht.\n\n({0})\n\nReden wir doch mal über die Erkenntnisse, die wir in den letzten Wochen gewonnen haben.\n\n({1})\n\nWir alle haben gelernt, dass das Outsourcen betreuungsbedürftiger Familienangehöriger von den Familien an den Staat höchst problematisch ist. Die Eltern jammern, weil Kitas geschlossen sind und sich die Eltern nun, wie es früher selbstverständlich war, ganztägig um die Kinder kümmern müssen. In der Betreuung der Alten und Kranken sehen wir, dass der Trend, pflegebedürftige Familienmitglieder ins Heim abzugeben, in Krisenzeiten zur Katastrophe werden kann; denn durch Besuchsverbote vereinsamen die Pflegebedürftigen, und das Ansteckungsrisiko in den Heimen ist hoch und führt zu vielen Toten.\n\nWenn uns die letzten Wochen eines gezeigt haben, dann, dass Deutschland eine Politik der Stärkung der Familie als Keimzelle der Gesellschaft braucht. Je mehr Kinder von Familienangehörigen betreut werden und je mehr Pflegebedürftige im Kreis ihrer Lieben umsorgt werden, umso besser kommt eine Gesellschaft durch eine Pandemie.\n\n({2})\n\nDeswegen verfolgen wir als AfD einen anderen Ansatz. Wir wollen keine einmaligen Sonderprämien auf Kosten der Steuerzahler, deren Wirkung schnell verpufft; denn wegen einer einmaligen Zahlung wird der Beruf nicht attraktiver. Wir wollen Gelder lieber nachhaltig einsetzen, um häusliche Pflege stärker zu honorieren. Es ist niemandem erklärbar, warum die Pflege durch Familienangehörige weit geringer honoriert wird als die Pflege durch Fremde.\n\n({3})\n\nAktuell wird häusliche Pflege mit weniger als der Hälfte des Betrags der ambulanten Pflege vergütet, und das, obwohl pflegende Angehörige oft zusätzlich die extrem wichtige liebende Fürsorge leisten, die vielen professionellen Pflegekräften wegen Zeitmangels\n\n({4})\n\nund oft auch fehlender Deutschkenntnisse gar nicht möglich ist.\n\n({5})\n\nWenn ein pflegender Angehöriger mal krankheitsbedingt für einen Monat ausfällt, wird in diesem Monat für ambulante Pflege mehr als das Doppelte gezahlt. Jeder Angehörige, der diese Geringschätzung erlebt, fühlt sich zu Recht ungerecht behandelt. Die Lenkungswirkung der bisherigen Politik hat weg von häuslicher, hin zu ambulanter und stationärer Pflege geführt und damit den aktuellen Pflegenotstand verursacht.\n\nLassen Sie uns also die Ursachen bekämpfen und die häusliche Pflege stärken! So können wir professionelle Pflegekräfte am besten entlasten. Denn je mehr Menschen zu Hause von Angehörigen oder Bekannten gepflegt werden, umso weniger müssen ambulant oder stationär von professionellen Kräften gepflegt werden und umso weniger Arbeit fällt für diese professionellen Kräfte an. Auch für kommende Generationen ist es ein wichtiger Aspekt für die Ausbildung emotionaler Intelligenz, wenn wir zeigen, dass wir alles in unserer Macht Stehende tun, damit Pflegebedürftige so lange wie irgend möglich im Kreis ihrer Angehörigen umsorgt werden. Daher haben wir als AfD beantragt, häusliche Pflege künftig genauso hoch zu vergüten wie ambulante Pflege.\n\nInvestieren wir das Geld lieber in die Honorierung der außergewöhnlichen Leistung all der pflegenden Angehörigen und in die Stärkung der Familie als Keimzelle der Gesellschaft,\n\n({6})\n\nanstatt – wie in diesem Antrag der Grünen – mit Einmalzahlungen zu versuchen, irgendwelche Berufsgruppen als Wähler zu kaufen.\n\n({7})\n\nVielen Dank.\n\n({8})"
"1040356","Anton","Friesen","AfD","Member of Parliament","2020-05-13T00:00:00.000Z","https://dip21.bundestag.de/dip21/btp/19/19159.pdf","\n\nSehr geehrter Herr Präsident! Sehr geehrte Damen und Herren Abgeordnete! Liebe Bürger! Es begann mit einer Lüge: Die Rechtfertigung für den Kosovokrieg und damit auch für den längsten Bundeswehreinsatz, über den wir hier beraten, war nämlich Fake News des damaligen Bundesverteidigungsministers Scharping. Insofern tritt Innenminister Seehofer eine würdige Nachfolge an, was den Titel „Größter Fake-News-Produzent“ angeht.\n\n({0})\n\nDen serbischen Hufeisenplan, eine genozidale Wahnvorstellung mit serbischen KZs und ausgemergelten Kosovo-Albanern, hat es nämlich nie gegeben. Der Kosovokrieg war daher genauso wenig notwendig, wie es heute die grundrechtseinschränkenden und ebenfalls Menschenleben gefährdenden Coronazwangsmaßnahmen sind.\n\n({1})\n\nWährend beides auf Fake News beruht, dauern die Fake News im Fall des Kosovo schon 21 Jahre an.\n\n({2})\n\nDas Märchen vom friedlichen multikulturellen, demokratischen Kosovo glauben wohl nicht einmal diejenigen, die das hier verbreiten.\n\n({3})\n\nDas Kosovo ist heute ein faktisch monoethnischer Staat, regiert von Kriegsverbrechern, geprägt von organisierter Kriminalität, von Menschen-, Organ- und Drogenhandel. Die Bürger Kosovos sind die zweitärmsten Europas. Die offizielle Arbeitslosigkeitsrate lag im letzten Jahr bei fast 26 Prozent, die Jugendarbeitslosigkeit gar bei 50 Prozent. Derzeit macht dieses NATO-EU-Protektorat vor allem durch eine Regierungskrise von sich reden. Multiethnisch und multikulturell, so sollte dieser neugeborene Pseudostaat sein. Das ist wohl der Traum der Brüsseler und Berliner Machteliten. Die Realität sieht so aus, dass seit 1999 rund 150 Kirchen, Klöster, andere Heiligtümer zerstört wurden. Mehr als 10 000 Ikonen wurden geschändet und gestohlen, und die serbisch-orthodoxe Kirche muss in ihrer historischen Heimat um ihre Existenz kämpfen.\n\n({4})\n\n21 Jahre nach dem Beginn des Kosovo-Einsatzes hat der deutsche Steuerzahler mehr als 464 Millionen Euro für einen gescheiterten Mafiastaat ausgegeben, und das ohne die Kosten des Verteidigungsministeriums, die geheim gehalten werden. Anstatt diesen Lebenslügen nachzuhängen, sollte Berlin darauf hinwirken, dass ein Gebietsaustausch zwischen Kosovo und Serbien stattfindet, sodass die Serben im heutigen Nordkosovo innerhalb des serbischen Staates geschützt werden und einige instabile albanisch geprägte Gebiete in Südserbien durch ihre Eingliederung in das Kosovo stabilisiert werden.\n\n({5})\n\nFake News und Märchen helfen hier nicht weiter. Die Wahrheit ist unseren Bürgern zuzumuten. Deshalb wollen wir diesen Einsatz sofort beenden.\n\nVielen Dank.\n\n({6})"
"1040386","Robby","Schlund","AfD","Member of Parliament","2020-05-14T00:00:00.000Z","https://dip21.bundestag.de/dip21/btp/19/19160.pdf","\n\nSehr geehrter Herr Präsident! Werte Kollegen! Sie kennen seit einigen Tagen sicherlich den Coronahotspot Greiz. Das ist mein Wahlkreis. Dort sind regionalbedingt aufgrund des Uranbergbaus Lungenerkrankungen ab dem 50. Lebensjahr sehr verbreitet. Mit den neuen Richtlinien des RKI vom 6. Mai treiben Sie die regionale Reproduktionszahl in die Höhe und erzeugen bei den Menschen vor Ort Panik, Verzweiflung und Perspektivlosigkeit.\n\n({0})\n\nGlauben Sie mir: Ein erneuter Lockdown wird in meiner Heimat mehr Opfer fordern als Ihre vermeintliche Coronakrise, befeuert durch Massenarbeitslosigkeit und Landflucht.\n\n({1})\n\nGenau zu diesem Zeitpunkt bringen Sie den Entwurf eines zweiten Gesetzes zum Schutz der Bevölkerung ein. Aber schützen Sie die Bevölkerung durch solch ein Gesetz wirklich? Wir meinen, nein. Das Gesetz billigt dem Gesundheitsminister unter dem Deckmantel einer epidemischen Lage von nationaler Tragweite eine Reihe von gravierenden Befugnissen zu. Der Katalog dieser Befugnisse wird immer länger und länger. Wer weiß, was bei einem dritten Gesetz zum Schutz der Bevölkerung noch folgen wird? Es suggeriert uns eine permanente Krise, die es gar nicht gibt, und lässt uns im Krisenmodus verharren.\n\n({2})\n\nWissen Sie, was Sie damit den Bürgern dieses Landes antun? Sie erzeugen Angst, Hysterie und Depression, die in einer eskalierenden Lebensmüdigkeit enden werden.\n\n({3})\n\nViel zu wenig wird sowieso von den psychologischen Folgen Ihrer verfehlten Krisenpolitik gesprochen. Bereits am 12. Februar habe ich an genau dieser Stelle sechs Basismaßnahmen gefordert, unter anderem mithilfe von Wärmebildkameras Infektionsfälle zu identifizieren und die Abhängigkeit von Medizinprodukten und Arzneimitteln aus Fernost zu verringern. Hätten Sie alle dies damals nicht abgelehnt, hätten Sie sich den Kollaps eines Shutdowns ersparen können.\n\n({4})\n\nMit den neuen AfD-Anträgen setzen wir auf die Basis genau dieses Rastermanagements und – unter Schutz der Bürgerrechte – auf drei Säulen auf:\n\nErstens: Umsetzung der digitalen Innovationspotenziale im Gesundheitswesen.\n\nZweitens: schnelle Einführung technischer Verfahren und Monitoringsysteme.\n\nDrittens: regelmäßige wissenschaftliche Analyse und Bewertung von epidemiologischen Daten.\n\n({5})\n\nWas Sie in unseren Anträgen nicht finden können, ist der Versuch, unser Grundgesetz teilweise auszuhebeln.\n\n({6})\n\nSie demontieren mit Ihrem Entwurf nämlich die Parlaments- und Bürgerrechte wie Demokratieprinzip und Rechtsstaatprinzip. Sie können uns nicht einmal darlegen, was die Voraussetzungen für eine epidemische Lage von nationaler Tragweite überhaupt sind.\n\n({7})\n\nWir appellieren an Sie, dieses und das erste Gesetz durch eine angemessene Lösung zu ersetzen, auch im Namen unzähliger besorgter Bürger und Verbände.\n\n({8})\n\nVerlassen Sie sich lieber auf den gesunden Menschenverstand und auf ein professionelles Management bei der Normalisierung des öffentlichen und gesellschaftlichen Lebens.\n\n({9})\n\nDas ist, wie wir in der Anhörung gehört haben, keine Frage von rechts oder links, sondern einfach nur eine Frage der Selbstachtung und Selbstverantwortung.\n\nDie AfD lehnt diesen Gesetzentwurf ab.\n\nVielen Dank.\n\n({10})"
