id,firstname,lastname,faction,position,date, url,speech
"1022295","Uwe","Witt","AfD","Member of Parliament","2019-03-22T00:00:00.000Z","https://dip21.bundestag.de/dip21/btp/19/19090.pdf","\n\nHerr Präsident! Verehrte Kolleginnen und Kollegen! Liebe Gäste des Hohen Hauses! In Deutschland leben 7,8 Millionen Schwerbehinderte; das sind 9,4 Prozent der Gesamtbevölkerung. Mehr als 40 Prozent der schwerbehinderten Menschen in Deutschland sind im erwerbsfähigen Alter.\n\nUm schwerbehinderten Menschen den Zugang zum Arbeitsmarkt zu erleichtern, wurde den Arbeitgebern mit den Regelungen des zweiten Kapitels des SGB IX die Pflicht zur Schaffung von Arbeitsplätzen für schwerbehinderte Arbeitnehmer auferlegt. Dennoch haben schwerbehinderte Erwerbsfähige nach wie vor eine deutlich niedrigere Erwerbsbeteiligung als nicht schwerbehinderte Erwerbsfähige. Die Arbeitslosenquote Schwerbehinderter liegt bei 11,7 Prozent; sie liegt damit deutlich über der Arbeitslosenquote Nichtschwerbehinderter. Daher ist klar erkennbar, dass die Maßnahmen zur Beschäftigungsförderung bei schwerbehinderten Arbeitslosen nicht ausreichend greifen.\n\nDamit kann man nicht zufrieden sein, und es ist auch nicht zu verstehen, warum die Hemmschwelle, schwerbehinderte Arbeitnehmer einzustellen, bei manchen Arbeitgebern offenbar immer noch so hoch liegt. Schwerbehinderte arbeitslose Menschen sind häufig besonders gut qualifiziert. Anteilig finden sich unter den schwerbehinderten Arbeitslosen sogar mehr Fachkräfte als unter den nicht schwerbehinderten Arbeitslosen. Trotzdem gelingt es ihnen seltener als nicht schwerbehinderten, eine Beschäftigung aufzunehmen, und sie müssen auch deutlich mehr Wartezeit in Kauf nehmen, damit es überhaupt gelingt. Im Durchschnitt sucht ein schwerbehinderter Arbeitsloser 366 Tage nach einem Job; das sind 104 Tage mehr als bei Menschen ohne Handicap. Auch der Anteil der Langzeitarbeitslosen ist mit 44,4 Prozent bei Schwerbehinderten deutlich höher als bei Menschen ohne Behinderung; dort liegt er bei 35,6 Prozent.\n\nDeutschland hat sich bereits 2009 verpflichtet, die UN-Behindertenrechtskonvention umzusetzen, die Behinderten das Recht auf eine frei gewählte Arbeit garantiert. Doch obwohl die Ziele der Konvention nicht annähernd erreicht wurden, fehlt es bisher an funktionierenden Maßnahmen, um die Quote arbeitsloser Schwerbehinderter endlich signifikant und nachhaltig zu senken. Die AfD hat sich dazu Gedanken gemacht; denn die derzeitigen Regelungen im zweiten Kapitel SGB IX sind offenbar nicht ausreichend.\n\nDie Einstellungspflicht für schwerbehinderte Arbeitnehmer entsteht bereits ab einer Zahl von 20 Beschäftigten. Dennoch wählen viele Firmen statt der Einstellung eines neuen Mitarbeiters mit Behinderung häufig die Möglichkeit, eine jährliche Ausgleichsabgabe an das Integrationsamt zu zahlen. Darunter sind insbesondere Firmen, die in der Vergangenheit gar keine Erfahrungen mit der Beschäftigung Schwerbehinderter hatten. Hier ist natürlich Aufklärungsarbeit notwendig. Viele Arbeitgeber wissen vielleicht auch nicht, welche zahlreichen Förderungen bei der Beschäftigung von Schwerbehinderten möglich sind.\n\nWir meinen, dass die durch die Regelungen des SGB IX geschaffene Einstellungsverpflichtung mit Sanktionsdrohung, also einer Bestrafung, unzureichend ist, um Arbeitgeber von den Vorteilen der Einstellung behinderter Menschen zu überzeugen. Wir glauben auch, dass die derzeitigen Regelungen die Schaffung behindertengerechter Arbeitsplätze einseitig fördern, nämlich vornehmlich in Unternehmen einer bestimmten Größe und in bestimmten Regionen, in denen diese Unternehmen und öffentliche Arbeitgeber besonders häufig zu finden sind.\n\nWir wollen die freiwillige Schaffung zusätzlicher Arbeits- und Ausbildungsplätze für Schwerbehinderte fördern, auch in kleineren Betrieben, indem wir auf ein zusätzliches Bonussystem setzen. Darum fordern wir die Bundesregierung auf, einen Gesetzentwurf zur Änderung des zweiten Kapitels SGB IX vorzulegen, der die Unternehmen für die Schaffung von Arbeitsplätzen für Schwerbehinderte dann belohnt, wenn sie mehr Schwerbehinderte einstellen, als sie per Gesetz verpflichtet sind. Das Gleiche gilt natürlich auch für Ausbildungsplätze. Das soll ausdrücklich – ausdrücklich – auch für privatrechtliche Betriebe und für Arbeitgeber gelten, die gar nicht zur Schaffung von Arbeitsplätzen für Behinderte verpflichtet werden. Wir schlagen hier einen steuerfreien Bonus für jede Vollzeitstelle und jeden Ausbildungsplatz in Höhe von monatlich 250 Euro vor. Das kann zunächst aus einem Topf finanziert werden, in den die Ausgleichs­abgaben derjenigen Arbeitgeber fließen, die trotz Verpflichtung keine Arbeitsplätze für Schwerbehinderte schaffen. Bei Mehrbedarf muss der Topf natürlich aus Steuermitteln aufgestockt werden.\n\nLiebe Kolleginnen und Kollegen, helfen Sie uns dabei, die UN-Behindertenrechtskonvention umzusetzen! Springen Sie über Ihren Schatten, und unterstützen im Sinne der schwerbehinderten Erwerbsfähigen in Deutschland diesen Antrag, auch wenn er bei Ihnen auf der schwarzen Liste steht, weil er von der AfD kommt!\n\nVielen Dank.\n\n({0})"
"1022325","Thomas","Ehrhorn","AfD","Member of Parliament","2019-03-22T00:00:00.000Z","https://dip21.bundestag.de/dip21/btp/19/19090.pdf","\n\nHerr Präsident! Meine Damen und Herren! Seit Jahrzehnten ertragen wir die verschiedenen Auswüchse linker Ideologieprojekte, deren Hauptmerkmal es ist,\n\n({0})\n\nkeinen Fehler auf dem Weg zum totalen Irrtum zu machen. Ob Gender-Gaga\n\n({1})\n\noder Klima-Religion,\n\n({2})\n\nam Ende findet sich für jede Sekte der geeignete Anhänger.\n\n({3})\n\nAnhänger hat auch das Märchen der angeblich unterdrückten und diskriminierten Frau, die in einer von Männern dominierten Welt ungerecht behandelt wird.\n\n({4})\n\nDie Geschichte wird immer gleich erzählt. Sie lautet etwa so: Die Chefs in den Unternehmen sind meistens Männer. Die wissen die Arbeit von Frauen aus Gründen, die mir noch niemand erklären konnte, einfach nicht zu schätzen, und deshalb bekämen die Frauen weniger Gehalt.\n\n({5})\n\nNun lösen wir uns mal ganz kurz von der Welt der Märchen und kommen zu den Fakten. Vergleicht man die Gehälter aller berufstätigen Frauen in der Bundesrepublik mit denen aller berufstätigen Männer, stellt man fest: Ja, dann verdienen Frauen in der Tat – rein statistisch – erst einmal 21 Prozent weniger.\n\n({6})\n\nJa, aber eben nicht für die gleiche Arbeit, nicht in den gleichen Berufen, nicht in vergleichbaren Firmen und nicht mit der gleichen Berufserfahrung!\n\n({7})\n\nWoran liegt das? Es liegt daran, dass Frauen in eher niedrig entlohnten Bereichen wie Erziehung, Unterricht, Gesundheit und Sozialwesen überrepräsentiert sind. Unterrepräsentiert sind sie dagegen in wissenschaftlich oder naturwissenschaftlich orientierten Berufen, den sogenannten MINT-Berufen.\n\n({8})\n\nWarum das so ist? Ja, das müssen Sie die Frauen vielleicht einmal selbst fragen.\n\n({9})\n\nKönnte es vielleicht daran liegen, dass Frauen und Männer so gleich, wie immer behauptet wird, doch nicht sind?\n\n({10})\n\nSei’s drum! Es ist jedenfalls nicht die Aufgabe des Staates, den Frauen in ihre freie Berufswahl hineinzureden.\n\n({11})\n\nBereinigt man die Statistik nun aber um diesen Faktor, stellt man fest, dass von der Lohnlücke gerade noch 6 Prozent übrig bleiben.\n\n({12})\n\nAber damit ist die Geschichte ja nicht zu Ende. Laut Umfragen sind noch immer viele Paare – also Männer und Frauen – der Meinung, dass Mütter von Schulkindern nicht Vollzeit arbeiten sollten. Und oft sind es in der Tat die Frauen, die bereit sind, etwas Karriere für ein klein wenig mehr Zeit mit dem eigenen Kind einzutauschen – eine Einstellung, die bei den Damen und Herren von Linken und Grünen natürlich zur Schnappatmung führt, die aber in einer freien Gesellschaft einfach legitim ist. Das müssen Sie mal zur Kenntnis nehmen.\n\n({13})\n\nWährend sich also in dieser Lebensphase viele Frauen selbst aus dem Rennen nehmen, indem sie sich für eine Teilzeitstelle entscheiden, machen Männer nicht selten Überstunden und sammeln Berufserfahrung.\n\n({14})\n\nUnd höhere Berufserfahrung – wer hätte das gedacht? – führt zu höherem Lohn. So einfach ist das.\n\n({15})\n\nUnd wird die Statistik auch diesbezüglich bereinigt, so rechnet uns das Institut der deutschen Wirtschaft vor, bleibt vom Gender Pay Gap so gut wie nichts mehr übrig.\n\n({16})\n\nDass es in das linke Weltbild nicht so gut passen mag, dass Frauen noch immer die Zeit mit dem eigenen Kind höher bewerten als berufliches Fortkommen, wissen wir natürlich. Im Sozialismus gehören Frauen in die Produktion und die Kinder in die Kita; auch das wissen wir.\n\n({17})\n\nInzwischen gibt es ja sogar Frauen, die deshalb arbeiten, um die Kosten für den Kitaplatz zu erwirtschaften. Das heißt, sie verdienen Geld, um tatsächlich fremde Menschen dafür zu bezahlen, dass sie das eigene Kind erziehen.\n\n({18})\n\nIch frage Sie: Merkt denn hier eigentlich\n\n(Steffi Lemke [BÜNDNIS 90/DIE GRÜNEN]: Sie merken auch nichts in dieser Debatte!\n\nirgendwann irgendwer in diesem Hohen Haus, wie krank das eigentlich ist?\n\n({19})\n\nWenn wir nun aber unbedingt über Diskriminierung und finanzielle Ungleichheiten reden wollen, dann reden wir doch mal über den Gender Lifetime Gap, wie ich es nenne. Reden wir mal darüber, dass Frauen durchschnittlich fünf Jahre länger leben, was ja nach Genderideologie gar nicht passieren dürfte, weil Frauen und Männer ja gleich sind.\n\n({20})\n\nDennoch passiert es. Das heißt, Frauen profitieren im Durchschnitt fünf Jahre länger von einer Rente, die im Übrigen auch durch männliche Beitragszahler gezahlt wird. Schon mal darüber nachgedacht?\n\n({21})\n\nRechnen wir doch mal aus, was da finanziell so alles zusammenkommt.\n\n({22})\n\nVielleicht kommen wir dann auch zu ganz anderen Bewertungen bezüglich der angeblichen immer wieder benannten strukturellen Benachteiligungen,\n\n({23})\n\ndie wir natürlich immer nur bei Frauen ausmachen.\n\n({24})\n\nDeshalb sage ich Ihnen: Hören Sie endlich auf, die Menschen mit Ihren ideologischen Märchen zu langweilen. Frauen sind in dieser Gesellschaft keine Opfer!\n\n({25})\n\nDeswegen brauchen wir weniger Frauenquoten. Wir brauchen keine Prüfung der Entgeltgleichheit, und am allerwenigsten brauchen wir ein Verbandsklagerecht."
"1022327","Thomas","Ehrhorn","AfD","Member of Parliament","2019-03-22T00:00:00.000Z","https://dip21.bundestag.de/dip21/btp/19/19090.pdf","\n\nIhre Anträge haben den Nährwert einer Gurke.\n\n({0})\n\nWir werden sie selbstverständlich ablehnen.\n\nDanke schön.\n\n({1})"
"1022346","Thomas","Ehrhorn","AfD","Member of Parliament","2019-03-22T00:00:00.000Z","https://dip21.bundestag.de/dip21/btp/19/19090.pdf","\n\nVielen Dank, Frau Kollegin, dass Sie die Zwischenfrage zulassen. – Ich wollte nur höflich darauf aufmerksam machen, dass mit dem Begriff „Gender-Gaga“ auch noch ganz andere Dinge gemeint waren,\n\n({0})\n\nzum Beispiel der Wahnsinn, der bezüglich der Verunstaltung unserer deutschen Sprache betrieben wird, und Ähnliches. Gender-Gaga bezog sich also nicht unbedingt auf das, was Sie fälschlicherweise, wie ich glaube, darunter verstanden haben.\n\n({1})\n\nWir sollten uns insofern einig sein, dass einiges von dem, was Sie gerade gesagt haben, durchaus mit dem übereinstimmt, was ich vorher auch benannt habe. Manchmal sind wir so weit gar nicht auseinander.\n\n({2})"
"1022353","Axel","Gehrke","AfD","Member of Parliament","2019-04-03T00:00:00.000Z","https://dip21.bundestag.de/dip21/btp/19/19091.pdf","\n\nVielen Dank. – Herr Minister, meine Frage bezieht sich auf den Berufsstand der Heilpraktiker. Im Koalitionsvertrag wurde ja festgehalten, dass die Regierung im Sinne einer verstärkten Patientensicherheit das Spektrum der heilpraktischen Behandlungen überprüfen will. Nun stehen ja schon Neuregelungen im Arzneimittelgesetz zur Diskussion. Planen Sie weitere Einschränkungen, und halten Sie den in Europa einmaligen Dualismus von Ärzten und Heilpraktikern in der Gesundheitsversorgung langfristig für sachgerecht?"
"1022401","Detlev","Spangenberg","AfD","Member of Parliament","2019-04-03T00:00:00.000Z","https://dip21.bundestag.de/dip21/btp/19/19091.pdf","\n\nRecht vielen Dank. – Herr Minister, die neue 5G-Technologie erfordert den Aufbau vieler neuer Mobilfunkantennen, und die damit einhergehende gesundheitliche Gefährdung wurde schon 2017 in verschiedenen Studien festgestellt. Die Frage ist: Inwieweit plant Ihr Ministerium eine Überprüfung dieser Studien? Plant das Ministerium, dazu selbst eine Studie in Auftrag zu geben, und zwar auch unter dem Aspekt, dass die Präsidentin des Bundesamtes für Strahlenschutz, Frau Paulini, selbst eine solche Überprüfung in ihrem Zuständigkeitsbereich für notwendig hält?"
"1022404","Detlev","Spangenberg","AfD","Member of Parliament","2019-04-03T00:00:00.000Z","https://dip21.bundestag.de/dip21/btp/19/19091.pdf","\n\nIch habe die Bundesregierung nicht kritisiert. Ich habe gefragt, ob Sie eine Studie in Auftrag geben wollen, um zu untersuchen, was behauptet wird."
"1022440","Beatrix","Storch","AfD","Member of Parliament","2019-04-03T00:00:00.000Z","https://dip21.bundestag.de/dip21/btp/19/19091.pdf","\n\nHerr Minister! Herr Präsident! Der Völkermord an den Armeniern und an anderen christlichen Minderheiten 1915/16 hat etwa 1,5 Millionen Menschen das Leben gekostet. Er wird heute von der türkischen Regierung weiter geleugnet. Und mehr noch: Der Versuch der Aufarbeitung dieses Völkermordes wird in der Türkei strafrechtlich verfolgt.\n\nFrankreichs Präsident Emmanuel Macron hat ein deutliches Zeichen angekündigt. Er hat angekündigt, den 24. April als Gedenktag für den Völkermord an den Armeniern zu einem nationalen Gedenktag in Frankreich zu machen. Ich frage die Bundesregierung: Wie begegnet die Bundesregierung dem Eindruck, dass sie aus Angst vor den Reaktionen der türkischen Regierung oder auch der türkischen Nationalisten den Völkermord an den Armeniern nicht ausdrücklich als Völkermord bezeichnet? Wie begegnet die Bundesregierung dem Eindruck, dass sie den Begriff „Völkermord“ vermeidet?"
"1022443","Beatrix","Storch","AfD","Member of Parliament","2019-04-03T00:00:00.000Z","https://dip21.bundestag.de/dip21/btp/19/19091.pdf","\n\nJa, ich habe eine weitere Nachfrage."
"1022445","Beatrix","Storch","AfD","Member of Parliament","2019-04-03T00:00:00.000Z","https://dip21.bundestag.de/dip21/btp/19/19091.pdf","\n\nSie werden in bilateralen Gesprächen mit der Türkei das Thema ansprechen. – Ich frage Sie ausdrücklich: Ist die Bundesregierung bereit, den Begriff „Völkermord“ für den Völkermord an den Armeniern öffentlich zu verwenden?"
"1022478","Gottfried","Curio","AfD","Member of Parliament","2019-04-03T00:00:00.000Z","https://dip21.bundestag.de/dip21/btp/19/19091.pdf","\n\nSehr geehrter Herr Präsident! Meine Damen und Herren! Die Kriminalitätsstatistik wird vorgestellt, und Minister Seehofer ist ein zufriedener Mann. Warum eigentlich? Die Zahl der Rauschgiftdelikte etwa ist um 6 Prozent auf 350 000 gestiegen. Die Grenzen zu Belgien und Holland müssten dafür überwacht werden. GdP-Vorstand Krummen sagt: Der Grenzschutz findet zum jetzigen Zeitpunkt so gut wie gar nicht statt. Wir sind offen wie ein Scheunentor. – Das ist unzumutbar. Staatsversagen!\n\n({0})\n\nEs gibt einen Anstieg um 40 Prozent bei Gewalt gegen Polizei, etwa bei Abschiebungen; viele müssen abgebrochen werden. Obwohl die Zahl nichtdeutscher Tatverdächtiger schon über 30 Prozent liegt, lässt Seehofer die Grenzen weiter sperrangelweit offen.\n\n({1})\n\nDabei kommen immer mehr Mehrfachtäter aus dem Maghreb, aus Libyen oder Zentralafrika. Die Abschiebepraxis scheitert. Sie muss effektiver werden. Wir brauchen Abschiebehaft, finanzielle Sanktionen – Durchsetzung.\n\n({2})\n\nGefängnisse – überfüllt, Polizei – Personalmangel, Gerichte – überlastet, arabische Clans breiten sich aus. Aber Minister Seehofer ist ein zufriedener Mann. Die Zahl der Angriffe auf Polizei, Sanitäter, Feuerwehrleute steigt. Das Dunkelfeld der nicht angezeigten Delikte wird ausgeblendet. Gefährderüberwachung wäre rund um die Uhr zu leisten, die Zahlen steigen. Aber Minister Seehofer ist ein zufriedener Mann. Aber nicht der Innenminister soll sich sicher fühlen, sondern der Bürger, und der weiß genau, was in seiner Stadt los ist.\n\n({3})\n\nWeniger Wohnungseinbrüche – eine Leistung der Regierung? Von wegen! Erfolg nur durch kostenaufwendige Prävention seitens der Bürger. Gegen die Schengen-verursachte grenzüberschreitende Kriminalität tut die Regierung wenig. Weil die Grenzen nicht gesichert werden, müssen die Leute jetzt ihre Haustür sichern.\n\nWenn Ärzte zunehmende Aggressivität beklagen, werden Deeskalationskurse und Sicherheitstrainings angeboten, natürlich für die Ärzte, Migranten dürfen ausrasten.\n\n({4})\n\nWenn immer mehr Bürger Pfefferspray mit sich führen, ist Deutschland dann sicherer geworden? Wenn immer mehr Menschen nicht wagen, in No-go-Areas zu gehen, und das dann zum Rückgang der Kriminalität führt, dann ist das vorauseilende Risikovermeidung wegen bereits herrschender Kriminalität und geht auf Kosten des Lebensraums der Bürger. Das ist staatliches Totalversagen.\n\n({5})\n\nDer Anteil von Migranten unter Tatverdächtigen liegt bei 14 Prozent, bei schwereren Straftaten noch höher; der Bevölkerungsanteil liegt bei 2 Prozent. Bei Ausländern liegt die Kriminalitätsrate insgesamt bei über 30 Prozent, beim Bevölkerungsanteil bei 13 Prozent. Jeder dritte Gefängnisinsasse ist Ausländer. Was tut die Regierung gegen den überhohen Anteil der Ausländerkriminalität?\n\n({6})\n\nSie verschenkt quasi deutsche Pässe. Wer so eine Regierung hat, muss sich um Rechtsbrechernachschub nicht mehr sorgen.\n\n({7})\n\nOhne Frau Merkels Willkommenskultur hätte es letztes Jahr über 500 Tötungsdelikte, 1 300 Vergewaltigungen und 22 000 Fälle gefährlicher Körperverletzung nicht gegeben. Die Täter waren jeweils Flüchtlinge. Aber Frau Merkels freundliches Gesicht war ja wichtiger. Kein Wunder, wenn das Unsicherheitsgefühl der Bevölkerung zunimmt. Wer eine Hochrisikogruppe junger Männer aus Kulturen erlernter Gewaltbereitschaft und Frauenverachtung ohne jede Not – Stichwort „Selbsteintritt“ – in Millionenstärke ins Land bringt, der, meine Damen und Herren, handelt verantwortungslos.\n\n({8})\n\nPersonalnotstand bei der Polizei. Rückläufige Zahlen in der Statistik gibt es auch, weil immer weniger Polizisten da sind, um Anzeigen aufzunehmen und Kontrollen durchzuführen.\n\n({9})\n\nStaatsversagen!\n\nPersonalnotstand bei den Gerichten. 2018 kamen 65 dringend Tatverdächtige aus U-Haft frei, weil die Verfahren nicht rechtzeitig bearbeitet wurden. Die laufen jetzt wieder frei rum. Staatsversagen!\n\nClankriminalität. Der Essener Polizeipräsident sagt: Da ist die Integration voll gegen die Wand gefahren, weil sich viele dieser Leute gar nicht eingliedern wollen. Diese Menschen sehen den Staat nur als Beute an. In Essen wird ein Clanchef nicht angeklagt; das Sicherheitsrisiko sei zu hoch. Staatsversagen! Irrenhaus Deutschland 2019.\n\n({10})\n\nDer Täter von Chemnitz hätte längst abgeschoben sein müssen: Intensivtäter, Messerangriff, 14 Aliasnamen, Diebstahl, Schlägerei, Drogenhandel. Die Duldung war abgelaufen, er durfte bleiben und tötete.\n\nDie Bürger dürfen Frau Merkels freundliches Gesicht ausbaden, eine tödliche Fahrlässigkeit an unterlassener Gefahrenprävention. Und wo der verzweifelte Bürger gegen dieses Unrecht demonstrierend aufbegehrt, tritt das Kanzleramt eine Desinformationskampagne ohnegleichen los, und ein Topsicherheitschef, der das enttarnt, wird als politisch unbequem entlassen.\n\n({11})\n\nIm Sicherheitsranking des Weltwirtschaftsforums liegt Deutschland 2017 auf Platz 51, zwei Jahre zuvor lag es noch auf Platz 20. Wenn Herr Seehofer sagt, Deutschland ist eines der sichersten Länder der Welt: Ja, meine Damen und Herren, für Kriminelle.\n\nIch danke Ihnen.\n\n({12})"
"1022490","Martin","Hess","AfD","Member of Parliament","2019-04-03T00:00:00.000Z","https://dip21.bundestag.de/dip21/btp/19/19091.pdf","\n\nSehr geehrter Herr Präsident! Sehr geehrte Damen und Herren! Sehr geehrter Herr Minister, alle Jahre wieder – könnte man sagen – das gleiche Schauspiel: Sie stellen die Zahlen der Polizeilichen Kriminalstatistik vor und überschlagen sich dabei mit Superlativen. 2018 hatten wir, so behaupten Sie, sogar das sicherste Deutschland seit Jahrzehnten. Ihre Absicht ist dabei klar: Sie sprechen den Bürgern das eigene Urteilsvermögen ab und diffamieren all jene als Angsthasen oder Panikmacher, die aufgrund persönlicher Erfahrungswerte wissen, dass Sie, Herr Minister, unrecht haben.\n\nDie Wahrheit ist: Deutschland wird immer unsicherer, und das subjektive Unsicherheitsgefühl unserer Bürger\n\n({0})\n\nstimmt sehr wohl mit der objektiven Faktenlage der Statistik überein. – Ich werde das so lange wiederholen, bis Sie, Herr Minister, endlich zur Kenntnis nehmen, dass die PKS nicht die tatsächliche Sicherheitslage in unserem Land abbildet. Früher hatten wir keine Betonpoller und keine schwerbewaffneten Polizisten in unseren Innenstädten, und Frauenschutzzonen bei öffentlichen Veranstaltungen gab es auch nicht. Allein das zeigt doch jedem jeden Tag ganz offensichtlich, dass wir unsicherer leben als früher. Nehmen Sie das endlich zur Kenntnis, und beleidigen Sie nicht fortwährend die Intelligenz unserer Bürger!\n\n({1})\n\nHerr Minister, Sie sagten bei der Vorstellung der PKS, Sie wollten nicht über Gewalt durch Zuwanderer, also Flüchtlinge und Asylbewerber, sprechen, sonst würde man Ihnen eine politische Instrumentalisierung der Zahlen vorwerfen. Und ich sage Ihnen ganz klar: Wir werden nicht zulassen, dass Sie Ihr eigenes Politikversagen mit solchen Tabuisierungen kaschieren. Wer Probleme lösen will, der muss Fakten klar benennen, und Fakt ist: Deutschland ist unsicherer geworden, und die Grenzöffnung von 2015 ist die Hauptursache dafür.\n\n({2})\n\nÜber 1 Million Straftaten durch Zuwanderer, darunter 250 000 Rohheitsdelikte, 16 000 Sexualdelikte und 1 500 Tötungsdelikte wären niemals begangen worden, wenn Sie unsere Grenzen effektiv geschützt hätten.\n\n({3})\n\nWenn wir das Verhältnis von Opfern und Tätern vergleichen, müssen wir feststellen: Letztes Jahr fielen 102 Deutsche einem vollendeten Tötungsdelikt durch Zuwanderer zum Opfer; aber nur ein einziger Zuwanderer wurde durch einen Deutschen getötet. Insgesamt wurden 2018 über 46 000 Deutsche zum Opfer einer Straftat durch Zuwanderer; das bedeutet einen Anstieg um 19 Prozent. Fakt ist: Deutsche werden immer häufiger Opfer schwerer Straftaten von Zuwanderern. Diese Entwicklung muss gestoppt werden und ist inakzeptabel.\n\n({4})\n\nSchauen wir nach Bayern, Herr Minister, wo Ihre CSU regiert: Letztes Jahr waren 20,8 Prozent der Tatverdächtigen im Bereich der Gewaltkriminalität Zuwanderer. Vor zehn Jahren waren es noch weniger als 2 Prozent. Das zeigt eindeutig: Sie versagen im Bereich der Asyl- und Migrationspolitik nicht erst seit 2015. Das können Sie nicht wegdiskutieren; das ist eine Tatsache.\n\n({5})\n\nStichwort „Messerangriffe“. Selbst Täteranwälte geben zu: In den Herkunftsländern vieler Zuwanderer werden Konflikte mit dem Messer ausgetragen. – Und genau dieser kulturelle Hintergrund wird durch die Kriminalstatistik bestätigt. In Baden-Württemberg stellen Zuwanderer 2018 über 30 Prozent der Tatverdächtigen im Bereich der Gewaltkriminalität mit dem Tatmittel Messer.\n\n({6})\n\nSehen Sie, Herr Minister, endlich ein: Wer Messerkriminalität stoppen will, muss die Massenmigration stoppen.\n\n({7})\n\nNeuerdings bilden Zuwanderer in Berlin sogar Straßenbanden. Dabei hat unser Rechtsstaat nicht einmal wirksame Konzepte gegen die eingesessenen kriminellen Familienclans, die unsere Bürger tyrannisieren und das staatliche Gewaltmonopol ablehnen. Durch Zuwanderung wird dieses Problem massiv verschärft. Das BKA warnt vor einer Zunahme der Clanstrukturen und der BND gar vor der nigerianischen Mafia. Herr Minister, wer kriminelle Familienclanstrukturen bekämpfen will, der darf ihnen nicht massenhaft Nachschub ins Land holen.\n\n({8})\n\nImmer mehr Bürger melden sich bei mir, weil sie sich um die Sicherheit ihrer Familien sorgen. Insbesondere Frauen kommen auf mich zu, weil sie Angst vor sexuellen Übergriffen haben; Sie teilen mir mit, dass sie zum Beispiel abends nicht mehr joggen gehen. Und diese Ängste bestätigt ja auch ihr neuer Viktimisierungssurvey: Mehr als die Hälfte der Frauen vermeiden bestimmte Orte, um nicht Opfer einer Straftat zu werden. – Ich erinnere an die Kölner Silvesternacht 2015: 661 Opfer von Sexualstraftaten, 43 Verfahren und 3 Verurteilungen. Nur 3 Verurteilungen! Diese Bilanz, Herr Minister, ist eines Rechtsstaates unwürdig.\n\n({9})\n\nUnd was machen Sie? Sie fragen sich: Wie kann ich den Bürgern ihre Ängste ausreden? – Und ich sage Ihnen: Sorgen Sie endlich für mehr Sicherheit! Dann verschwinden diese Ängste von ganz alleine.\n\n({10})\n\nUnser Rechtsstaat – auch das ist Fakt – erodiert immer mehr; aber die AfD wird sich dem entschlossen entgegenstellen und Sie immer wieder mit dieser Realität konfrontieren. Deutschland kann erst wieder sicher werden, wenn die illegale Massenmigration gestoppt wird. Und die AfD ist dazu jederzeit bereit.\n\n({11})"
