id,firstname,lastname,faction,position,date, url,speech
"1041531","Kay","Gottschalk","AfD","Member of Parliament","2020-05-28T00:00:00.000Z","https://dip21.bundestag.de/dip21/btp/19/19163.pdf","\n\nSehr geehrter Herr Präsident! Verehrte Kollegen! Liebe Steuerzahler und vor allen Dingen liebe zukünftige Generationen da draußen! Wir sprechen heute über einen Wiederaufbaufonds, den Recovery Fund, der nach den Vorstellungen von Frau von der Leyen insgesamt 750 Milliarden Euro umfassen soll, 500 Milliarden Euro davon als nicht zurückzuzahlende Zuwendung, 250 Milliarden Euro – immerhin – als Kredit, meine Damen und Herren. Schachmatt in drei Zügen, Herr De Masi! Sie sprechen hier immer von Solidarität. Ich zeige Ihnen mal auf, was Sie hier im Hohen Haus unter Solidarität verstehen. Italien sollen wir mit 1 350 Euro pro Kopf helfen. Für Spanien sind es 1 638 Euro pro Kopf. Das macht in Summe für Italien 81 Milliarden Euro, für Spanien 77 Milliarden Euro; diese sollen nicht zurückgezahlt werden. Meine Damen und Herren, der Rest in Krediten! Ich glaube, diese sehen wir auch nicht wieder.\n\nKleine Belehrung, Mezzogiorno, die Kasse des Südens: Wir versenken seit den 60er-Jahren in Italien Geld, ohne dass es zu Strukturreformen kommt und ohne dass dieses Land auf die Beine kommt. Wann lernen wir eigentlich mal dazu?\n\n({0})\n\nMeine Damen und Herren, was Sie hier starten, ist nichts anderes als der rechtswidrige Versuch der Vergemeinschaftung von Staatsschulden – nur in einem anderen Gewand. Aber das lassen wir Ihnen nicht durchgehen, und der Frau Merkel auch nicht. Ich kann Ihnen aber eines an dieser Stelle versprechen: Wir werden alle parlamentarischen und juristischen Mittel nutzen und ausschöpfen, um diese Falltür für Deutschland in die Transferunion – nichts anderes ist es – geschlossen zu halten. Sie wollen hier den Höllenschlund der Vergemeinschaftung öffnen. Das lassen wir nicht zu, meine Damen und Herren.\n\n({1})\n\nSie verkaufen hier schlichtweg 60 Prozent Staatsverschuldung im Verhältnis zum BIP – ein Maastricht-Kriterium, das auch Sie von der CDU/CSU schon längst über Bord geschmissen haben –, um die Party- und Dolce-Vita-Staaten des Südens zu beglücken, die trotz zehnjähriger Niedrigzinspolitik es nicht auf die Kette gekriegt haben, was übrigens auch zulasten der deutschen Steuerzahler, der deutschen Sparer, der deutschen Versicherungen, der deutschen Pensionskassen ging. Trotz dieser Chancen haben es Italien, Spanien und die anderen Länder nicht auf die Kette bekommen, ihre strukturellen Probleme zu lösen. Und jetzt soll mehr Geld mehr helfen? Sie werfen gutes Geld dem schlechten hinterher. Lassen Sie es doch einfach, meine Damen und Herren!\n\n({2})\n\nUnd Solidarität? Solidarität ist bei Ihnen – ich will es mal vergleichen –: Sie geben Italien weiter Zuschüsse, einem Land, in dem die Bürger mit 62 Jahren in Rente gehen. Bei uns dürfen sich die Deutschen als Belohnung bis 67 abrackern, und Herr Spahn hat ja jüngst sogar ins Spiel gebracht, meine Damen und Herren, die Deutschen dürften bis 70 arbeiten. Schauen Sie sich die Statistik an: Niemand geht so spät in Rente wie die Deutschen. Sie wollen uns den Mindestlohn abspenstig machen; auch das klang bei Ihnen an. Wie wollen Sie den Bürgern hier eigentlich verkaufen, dass Sie Unsummen in den Süden geben und hier über Lohnkürzung sprechen? Und dann reden Sie von Solidarität. Ist das Ihre gelebte Solidarität?\n\n({3})\n\nSchauen wir uns doch die OECD-Studien an. Fakten, Fakten! Machen Sie den Faktencheck! Deutschland ist mit 49,4 Prozent Spitzenreiter bei Abgaben und Steuern. Italien, Spanien, Frankreich – weit hinter uns, meine Damen und Herren. Herr Binding – er ist, glaube ich, leider nicht da –, Sie redeten gestern vom Durchschnitt. Schauen wir uns das Median-pro-Kopf-Vermögen der Staaten, denen wir helfen wollen, an, meine Damen und Herren; das ist noch viel gerechter als der Durchschnitt. Man hat in Spanien ein Pro-Kopf-Vermögen von 95 000 Euro, in Frankreich eines von 101 942 Euro, und die arme deutsche Wurst, die solidarisch sein soll, Herr De Masi – ein Lippenbekenntnis –, 35 313 Euro. Also: Die Deutschen sollen dem Spanier helfen, haben aber nicht mal ein Drittel von dem, was er als Median-Vermögen hat. Gelebte Solidarität dieser EU, meine Damen und Herren!\n\n({4})\n\nIch glaube, das widerlegt die Mär vom reichen Deutschland und führt Ihre großzügige Europarettungspolitik ad absurdum. Meine Damen und Herren, diese EU – das stelle ich für heute fest – ist ein Waterloo und Versailles für Deutschland in einem.\n\n({5})\n\nIch frage mich auch, wie Sie eigentlich bei diesen erschreckenden Zahlen deutschen Arbeitnehmern noch dazu verhelfen wollen, zu Vermögen zu kommen. Wie sagte ich einst? Erst Flüchtlinge, dann Facharbeiter; erst Südländer, dann Deutschland. Germany First? Fehlanzeige, meine Damen und Herren! In Wirklichkeit – das schreibe ich Ihnen hier ins Stammbuch, und das wird die Geschichte zeigen – wollen Sie doch nur eines: Sie wollen eine längst bankrotte Währung, nämlich den Euro, durch die Hintertüre mit Blut, Schweiß und Tränen der Deutschen retten, meine Damen und Herren, und das wird nicht mit uns geschehen; denn diese Union kennt nur Solidarität, wenn es darum geht, dem deutschen Steuerzahler das Geld aus der Tasche zu ziehen.\n\n({6})\n\nMeine Damen und Herren, wir werden mit allem, was uns zur Verfügung steht, uns dagegen wehren, aus Verantwortung für zukünftige Generationen und vor allen Dingen für die Zukunftsfähigkeit hier in Deutschland.\n\nKümmern Sie sich um unsere Infrastruktur, kümmern Sie sich um die Digitalisierung, kümmern Sie sich um die Renten! Das war eben ärmlich, was Sie hier gerade zuvor zur Grundrente diskutiert haben, meine Damen und Herren. Aber wir werden dieser irrsinnigen Europa- und Euro-Rettungspolitik weiterhin den Spiegel der Wahrheit vorhalten. Diese Politik geschieht nicht mit uns.\n\nDanke schön.\n\n({7})"
"1041535","Kay","Gottschalk","AfD","Member of Parliament","2020-05-28T00:00:00.000Z","https://dip21.bundestag.de/dip21/btp/19/19163.pdf","\n\nVielen Dank, Herr Präsident. – Es ist ungeheuerlich und zeigt eigentlich den wirklich geistig-moralischen Verfall\n\n({0})\n\nIhrer Partei, wenn Sie auf Fakten so reagieren, und Sie werden nicht ein Faktum, das ich hier eben in meiner Rede genannt habe, widerlegen können. Ich könnte noch die Eigentumsquote und Wohneigentum anfügen. Ich habe hier die OECD-Studie zitiert.\n\nSie haben, glaube ich, eben hier über die Grundrente debattiert. Da ging es um Kleckerbeträge, und jetzt kübeln Sie, und zwar wesentlich für andere. Wenn Sie also Fakten, die ich eben genannt habe, tatsächlich mit Faschismus gleichsetzen, meine Damen und Herren, dann möchte ich Ihnen den Spiegel vorhalten.\n\n({1})\n\nUnd ich bin wirklich entsetzt. Ich verwahre mich aufs Ärgste gegen solche ungeheuerlichen Behauptungen. Die sind hier auch nicht durch die Redefreiheit abgedeckt.\n\nAber es ist offensichtlich – so erlebe ich das auch tatsächlich im Diskurs und im Wahlkampf –, dass Sie Fakten versuchen mit Faschismus gleichzusetzen und damit versuchen, irgendwo die Lufthoheit zu erobern und zu erhalten. Das wird Ihnen aber nicht gelingen. Denn die Wahrheit dieser Zahlen wird Ihnen auf die Füße fallen. Nochmals: Ich finde es schäbig. Ich glaube, ein Helmut Schmidt würde sich im Grabe umdrehen, wenn er Sie hier hätte heute reden hören.\n\n({2})"
"1041547","Tobias Matthias","Peterka","AfD","Member of Parliament","2020-05-28T00:00:00.000Z","https://dip21.bundestag.de/dip21/btp/19/19163.pdf","\n\nFrau Präsidentin! Sehr geehrte Kollegen! Die Europäische Union hat also festgestellt, dass sie ein Problem mit Korruption hat – siehe auch die Aktuelle Stunde gerade eben –, dass die Gelder, die sie wie selbstverständlich bei ihren leistungsfähigen Mitgliedern einsammelt, eben durchaus, Herr Fechner, in dunklen Kanälen verschwinden, und zwar oft innerhalb der Projekte bei weniger gut dastehenden Ländern. Radwege in Italien werden auf dem Papier einfach dreifach gebaut. Aufträge zum Brückenbau in Spanien werden einfach an die bekannte Verwandtschaft vergeben. Die EU wird spätrömisch gemolken und damit natürlich auch deren letzte schlagende Herzkammer: Deutschland.\n\n({0})\n\nAlso, was tun? Auf Gipfelebene war nichts zu machen. Da gibt es zwar Gespräche, aber die Mehrheiten liegen eben einfach beim „Club Med“. Standardlösungen bürokratischer Apparate erweitern einfach die zur Verfügung stehende Apparatur: eine von den Nationalstaaten unabhängige EU-Staatsanwaltschaft. Das passte dann auch gleich so toll in das Staatlichkeitsnarrativ der Union, dass politisch kein Kraut mehr dagegen gewachsen war. Gut, Rumänien versuchte dann doch noch irgendwie zu verhindern, dass ausgerechnet jemand, der sich besonders im rumänischen Filz auskennt, Chefin der Behörde wird; aber gut, das sind Brüsseler Details.\n\nNun haben wir sie also da, die EU-Staatsanwälte. Zuständigkeit: Vergehen gegen europäisches Recht zum finanziellen Nachteil der Union; ermittlungsorganisatorischer Unterbau: keiner; denn so weit ging die Selbstaufgabe der einzelnen Staaten dann zum Glück doch nicht. Für die eigentlichen Maßnahmen vor Ort wird also weiterhin auf die nationalen Behörden zurückgegriffen werden müssen. Ob das allgemein so klappt, zum Beispiel in Rumänien, könnte an sich schon ein Treppenwitz werden.\n\nHier zeigt sich aber vor allem erneut exemplarisch die Hybris der EU. Es wurde gerade eben wieder gesagt: Man will sich auf Teufel komm raus gerieren wie ein Staat, Stück für Stück.\n\n({1})\n\nMal minimal und unauffällig, zunehmend aber dreist und völlig offen. So eben nicht nur bei den Rachefantasien im Hinblick auf das unbotmäßige deutsche Urteil zur EZB, sondern auch bei der EUStA: höchstbezahlte, de facto durchaus von Brüssel gesteuerte Staatsanwälte – ein Angriff auf das Primat der allein demokratisch aufgestellten Mitgliedstaaten. Richtig, dass sich hier zum Teil rausgehalten wird; unter anderem machen Polen und Schweden nicht mit.\n\nJeder weiß doch ganz genau, wer den Takt in dieser EUStA tatsächlich angeben wird. Politischer Durchgriff zwar nicht offen formal, wie leider noch in Deutschland, aber dafür oligarchisch verdeckt, wie bisher schon – jeder weiß es – beim EuGH.\n\n({2})\n\nFrau Kövesi mag sich ja gut im rumänischen Sozisumpf auskennen – bravo dafür! –; aber sie hat auch gleich ganz gut erkannt, wie die EU-Bürokratur läuft: Verlange stante pede erstens mehr Geld, zweitens mehr Zuständigkeit!\n\nOffen fantasiert wird auch in mehreren Mitgliedstaaten – wir haben es hier gehört – von der Terrorbekämpfung als neuem Zuständigkeitsfeld oder gleich einer Komplettzuständigkeit im Strafrecht. So will der Bund Deutscher Kriminalbeamter ganz offen ein EU-Strafrecht mit EU-Prozessordnung und dazu noch ein EU-FBI, was zwingend das Herabsinken der Mitgliedstaaten auf bloße Bundesstaaten bereits im Namen trägt.\n\n({3})\n\nDie bestehende Eurojust-Agentur zur freiwilligen Zusammenarbeit, die es schon gibt, wird damit definitiv untergraben. Dabei war das einmal etwas, was halbwegs funktioniert hat, zusammen mit EJN und OLAF. Aber nein, Zentralismus ist erneut das Mittel der Wahl; wir haben es hier gesehen. Deutschland wird sich dem willfährig öffnen, während andere Länder die EUStA ins Leere laufen lassen werden. Wieder einmal, auf Neudeutsch, Lose-lose für den Musterknaben – ein klares und entschiedenes Nein von uns zu diesem Vorgehen.\n\nVielen Dank.\n\n({4})"
"1041594","Frank","Pasemann","AfD","Member of Parliament","2020-05-28T00:00:00.000Z","https://dip21.bundestag.de/dip21/btp/19/19163.pdf","\n\nSehr geehrte Frau Präsidentin! Meine Damen und Herren! Nachdem bei meiner letzten Rede einige Kollegen hier so nett darauf reagiert haben, sage ich auch heute wieder: Werte Zuschauer an den Fernsehgeräten und vor allen Dingen – für die AfD viel wichtiger – auf YouTube, Facebook und sonstigen sozialen Kanälen.\n\n({0})\n\nIn meinem Redebeitrag zur ersten Lesung dieses Gesetzentwurfes ging ich unter anderem darauf ein, dass es sich bei dem vorliegenden Entwurf um nur minimale Verbesserungen des aktuellen Status quo handele. Der Entwurf werde nicht mal dem eigenen Anspruch aus dem Koalitionsvertrag gerecht und bleibe somit sogar hinter dem Kompromiss der Koalitionspartner zurück.\n\nVon einem modernen Adoptionsrecht ist hier die Rede und davon, die Abläufe zu vereinfachen. Das Gegenteil ist leider bei diesem Entwurf der Fall. Der bürokratische Aufwand wird noch weiter verstärkt, und selbst bei der Stiefkindadoption wird eine Begleitung durch Caritas und andere Verbände verpflichtend. Bei der Stiefkindadoption handelt es sich jedoch nur um die rechtliche Würdigung einer bereits real bestehenden Situation. In einer Familie lebende Partner übernehmen Verantwortung für die Kinder des jeweils anderen Partners durch Adoption. Wieso mischt sich der Staat hier also unter dem Vorwand des Kindeswohls in höchst familiäre Prozesse ein?\n\n({1})\n\nDer staatlich forcierte Eingriff durch die Familienpolitik der Bundesregierung in familiäre Abläufe zeigt sich noch an anderer Stelle überdeutlich: bei der gewünschten und hier diskutierten Aufnahme besonderer Kinderrechte ins Grundgesetz. Ich zitiere mit Genehmigung der Präsidentin: „Wir wollen die Lufthoheit über die Kinderbetten erobern“, nannte dies der sozialdemokratische Kulturrevolutionär Olaf Scholz.\n\nStatt die Adoption als eine echte Alternative zur Abtreibung in Betracht zu ziehen, wird in Coronazeiten darüber schwadroniert, die sogenannte Schwangerenkonfliktberatung zu digitalisieren. Damit würde die Abtreibung und – das kann nicht oft genug gesagt werden –\n\n({2})\n\ndie Tötung von ungeborenen menschlichen Leben noch einfacher gemacht.\n\n({3})\n\nZu befürchten steht, dass womöglich Regelungen geschaffen werden, die weit über die derzeitige Coronakrise hinaus gelten werden.\n\n({4})\n\nUm aus der Adoption ein wirksames Instrument der Willkommenskultur für Kinder zu machen, wie es die AfD fordert, bedürfte es einer rechtlichen Vereinfachung und vor allem einer Entbürokratisierung.\n\n({5})\n\nAuch das Gesetz zum Ausbau der Hilfen für Schwangere und zur Regelung der vertraulichen Geburt hätte hier mit bedacht werden müssen. Nichts davon findet sich im vorliegenden Gesetzentwurf wieder. Allein die im Entwurf vorgesehene Regelung zum Auskunftsrecht des Adoptivkindes über seine Herkunftseltern möchten wir als positiv hervorheben, da hier echte Hilfe möglich und nötig erscheint.\n\nDie AfD-Fraktion wird sich zu diesem Entwurf enthalten und fordert eine tatsächliche – und dem Wort gerecht werdende – Verbesserung im Adoptionswesen. Das sind wir einerseits den Kindern und Jugendlichen schuldig, die nach wie vor in Pflegeheimen oft überbeanspruchten und unterbezahlten Betreuern gegenüberstehen, anstatt in eine Pflegefamilie vermittelt zu werden, weil die gesetzlichen Anforderungen hierfür zu hoch sind. Wir sind es aber andererseits auch den nie ins Leben kommenden Kindern schuldig, die die derzeit politischen Verantwortlichen lieber abgetrieben sehen, weil sie „ungewollt“ entstanden sind.\n\n({6})\n\nFür uns als AfD-Fraktion ist und bleibt die Familie jedenfalls die beste Pflegeeinrichtung, ob es nun die eigene ist oder eine fremde, deren Kinderwunsch unerfüllt blieb.\n\nVielen Dank.\n\n({7})"
"1041574","Roman Johannes","Reusch","AfD","Member of Parliament","2020-05-28T00:00:00.000Z","https://dip21.bundestag.de/dip21/btp/19/19163.pdf","\n\nFrau Präsidentin! Meine Damen und Herren! Wie immer, wenn der Kollege Frei vor mir dran ist, kann ich mich kürzer fassen. – Ich danke.\n\n({0})\n\nDieses bekannte Urteil des Verfassungsgerichts stellt uns vor ziemliche Probleme. Teilweise droht sogar Ungemach, nämlich dann, wenn es uns nicht gelingt, den Nachrichtenaustausch zwischen dem BND und den Partnerdiensten im jetzigen Zustand und Umfang zu erhalten; Kollege Frei hat die Bedeutung hervorgehoben. Denn das Verfassungsgericht sagt ja zum einen, der BND muss Bedingungen setzen, wenn er Nachrichten weitergibt, und zum anderen muss die Third-Party-Rule durchbrechbar sein. Da liegt der Hase im Pfeffer. Es ist wirklich zu befürchten, dass der BND aus dem Kreis der Mitspieler auf Augenhöhe ausscheidet und nur noch geringer qualifizierte Meldungen von anderen Diensten bekommt, wenn es nicht gelingt, hier zufriedenstellende Lösungen zu finden.\n\n({1})\n\nWas deutlich leichter lösbar erscheint, sind die Kontrollauflagen, die wir bekommen haben. Es ist klar: Nunmehr muss auch die Tätigkeit des BND, wie es das Bundesverfassungsgericht so schön ausgedrückt hat, rechtsstaatlich eingehegt werden. – Nun gut, das kann man machen, wie die FDP es vorschlägt, indem man die G 10-Kommission ein bisschen aufbläst. Man kann das Unabhängige Gremium – das besteht ja immerhin aus Bundesrichtern – mit dieser Aufgabe betrauen. Man könnte gar, wie andere Nationen das machen, ein unter Geheimbedingungen tagendes Gericht damit beauftragen.\n\nDas ist alles möglich. Man kann über alles reden. Möglich ist vieles, lösbar ist es auf jeden Fall. Dieser nationale Bevollmächtigte für Nachrichtendienste – ich kann mir den Namen nicht merken, den die FDP sich da ausgedacht hat –\n\n({2})\n\nsoll – das finde ich toll – sogar das Kanzleramt und das Innenministerium beaufsichtigen, wenn es um Nachrichtenfragen geht. Da habe ich dann doch ein Schmunzeln nicht unterdrücken können.\n\n({3})\n\nNach meiner Kenntnis übt das Parlament die Kontrolle über die Regierung aus und kein administrativer Mensch, mag er auch noch so toll gewählt sein. Aber okay.\n\nWir werden in den kommenden Monaten sicherlich intensive Beratungen vor uns haben. Die AfD steht selbstverständlich zu konstruktiven Vorschlägen und zur Mitarbeit bereit. Schauen wir mal, was dabei herauskommt.\n\n({4})"
"1041620","Karsten","Hilse","AfD","Member of Parliament","2020-05-28T00:00:00.000Z","https://dip21.bundestag.de/dip21/btp/19/19163.pdf","\n\nHerr Präsident! Meine Damen und Herren! Liebe Landsleute! Vor allem: Liebe Landwirte! Die heute zur Debatte stehende Neufassung des Wasserhaushaltsgesetzes soll den Nitrateintrag in Gewässer durch die Landwirtschaft weiter reduzieren. Landwirte sollen verpflichtet werden, entlang von Gewässern einen 5 Meter breiten Grünstreifen anzulegen und zu unterhalten. Ob das funktioniert und damit der Natur hilft, ist nicht erwiesen.\n\n({0})\n\nAuf jeden Fall werden die Landwirte de facto enteignet, da ihr Grund und Boden natürlich weniger Ertrag abwirft. Besonders hart trifft es hier kleine Winzerbetriebe in unseren Flusstälern. Der Begriff „Gewässer“ bleibt im vorliegenden Entwurf zudem unbestimmt, was Willkür Tür und Tor öffnet.\n\n({1})\n\nSeit den frühen 80er-Jahren ist Nitrat im Grundwasser ein Thema, durchaus zu Recht – Sie hatten es erwähnt –: Stark überhöhte Nitratwerte im Trinkwasser, das hierzulande sehr häufig aus Grundwasser gewonnen wird, stellen für Säuglinge eine Gefahr dar. Zu viel Nitrat in Gewässern begünstigt Algenbildung. – Ein Grund für Nitrateintrag ins Grundwasser war und ist die Landwirtschaft, wohlgemerkt: ein Grund, nicht der alleinige Grund.\n\n({2})\n\nNitrat ist für Pflanzen lebensnotwendig. Aber auch hier gilt nach Paracelsus: Allein die Dosis macht’s, dass ein Ding kein Gift sei.\n\nSeit den 80er-Jahren hat sich in der Landwirtschaft viel getan. Natürlich sind wir nicht im Nitratparadies; aber unter Mithilfe der Landwirte wurde viel erreicht. Doch dann kam man im Jahr 1991 in der damaligen EWG überein, dass man ein Problem, das sich perfekt regional lösen lässt, auch zentralistisch angehen könnte. Gedacht, getan: die Geburtsstunde der europäischen Nitratrichtlinie, übrigens mit freundlicher Genehmigung der damaligen Regierung unter Helmut Kohl, dem Ziehvater unserer allseits geliebten Kanzlerin.\n\nDie Verurteilung Deutschlands durch den EuGH, mit dem dieses Gesetz begründet wird, haben wir dennoch nicht der EU, sondern einzig und allein der Bundesregierung zu verdanken. Die Nitratrichtlinie fordert, dass von der Landwirtschaft beeinflusste und repräsentative Messstellen auszuwählen sind, was auch vernünftig ist. Die Bundesregierung stattdessen meldet seit Jahren ausschließlich Messstellen, die besonders belastet sind, darunter auch solche, die in Wohn- und Industriegebieten liegen und mit der Landwirtschaft nichts – aber auch gar nichts – zu tun haben.\n\n({3})\n\nDie EU-Kommission hat dieses Vorgehen mehrfach gerügt und Änderungen angemahnt.\n\nBei den Messstellen für Stickoxide sind Ihre Lügen, dass es einen monokausalen Zusammenhang zwischen erhöhten Stickstoffwerten und dem Fahrzeugverkehr gebe, aufgeflogen. Bei den Nitratmessungen wird der gleiche Betrug vorgenommen: nicht repräsentative Messstellen und die Herstellung eines monokausalen Zusammenhangs mit einer Zielgruppe. Bei Stickoxiden sind es die bösen Dieselfahrer, und beim Nitrat sind es die Landwirte, die hier zu Buhmännern gemacht werden.\n\nLandwirte schützen die Umwelt von Natur aus, seit es die Landwirtschaft gibt und seit Jahrtausenden, lange bevor sich Ideologen auf die Fahne geschrieben haben, dass Landwirte quasi Umweltzerstörer seien. Und natürlich kommen die schrillsten Vorwürfe genau aus den Reihen der Neostalinisten, die bei der Zerstörung der Umwelt durch ihre geliebten sogenannten erneuerbaren Energien eher abwinken.\n\nDer Urteilsspruch des EuGH und damit auch das neue Wasserhaushaltsgesetz wie auch die neue Düngeverordnung, gegen die wir übrigens eine Klage anstreben, sind das direkte Ergebnis der falschen Messstellenauswahl der Bundesregierung und haben nichts mit Aussagen zur tatsächlichen und repräsentativen Nitratbelastung zu tun. Weit über 90 Prozent des deutschen Grundwassers sind völlig in Ordnung.\n\n({4})\n\nDas EuGH-Urteil fordert auch nicht die hier zur Debatte stehenden Begrünungsmaßnahmen entlang von Gewässern. Die EU dient der Bundesregierung wieder einmal als Legitimierung für absurde Regelungsorgien.\n\n({5})\n\nFür ein Gesetz, das bestenfalls eine Scheinlösung darstellt, die Landwirte de facto enteignet und die Fehler der Bundesregierungen vertuschen soll, steht meine Fraktion nicht zur Verfügung.\n\n({6})\n\nDie AfD wird die vorliegende Abänderung zum Wasserhaushaltsgesetz ablehnen.\n\nVielen Dank – auch für Ihre Aufmerksamkeit.\n\n({7})"
