id,firstname,lastname,faction,position,date, url,speech
"1042258","Fabian","Jacobi","AfD","Member of Parliament","2020-06-17T00:00:00.000Z","https://dip21.bundestag.de/dip21/btp/19/19165.pdf","\n\nFrau Präsidentin! Meine Damen und Herren! Das Gesetzes zur Fortentwicklung des Rechts des Pfändungsschutzkontos, das uns die Bundesregierung hier vorlegt, hat erhebliche praktische Auswirkungen für die mit der Zwangsvollstreckung befassten oder von ihr betroffenen Personenkreise, also für Vollstreckungsschuldner, Gläubiger, Gerichte, Banken, Schuldnerberatungen und auch Insolvenzverwalter.\n\nEinigkeit dürfte darüber bestehen, dass die bisherigen Regelungen zum Pfändungsschutzkonto teilweise lückenhaft, teilweise unklar sind und dadurch etliche Anwendungsprobleme auslösen, sodass eine gründliche Überarbeitung angezeigt ist. Insofern ist die Vorlage dieses Gesetzentwurfs durch die Bundesregierung im Grundsatz zu begrüßen.\n\nÜber die Qualität des Entwurfs wird es dann schon eher unterschiedliche Auffassungen geben. Er hat einen Vorlauf durch mehrere Inkarnationen hinter sich. Nach dem Diskussionsentwurf von 2018 und dem Referentenentwurf vom vergangenen Jahr hat er nunmehr die vorliegende Form dieses Regierungsentwurfs angenommen.\n\nDie betroffenen Verkehrskreise haben die Gelegenheit zur Stellungnahme zu den früheren Entwurfsfassungen wahrgenommen und Hinweise auf Mängel gegeben. Einige dieser Hinweise sind in der nun vorliegenden Fassung auch berücksichtigt, etwa durch die ersatzlose Streichung des noch im Referentenentwurf enthaltenen, eher irrwitzigen § 850m ZPO-E zur Übertragung bestehender Pfändungen auf ein neues Konto des Schuldners. Gleichwohl darf bezweifelt werden, dass die jetzige Entwurfsfassung bereits der Weisheit letzter Schluss ist. Die zahlreichen Detailprobleme der neuen Regelungen können an dieser Stelle nicht erschöpfend dargestellt werden. Deshalb muss es hier und heute bei Beispielen bleiben.\n\nSo ist vorgesehen, im Kontext des Pfändungsschutzkontos eine eigene Regelung zur Pfändung eines Gemeinschaftskontos zu schaffen. Die fehlt bisher. Die Schließung dieser Lücke ist zu begrüßen. Der Entwurf sieht vor, dass das Guthaben auf dem gepfändeten Gemeinschaftskonto den mehreren Kontoinhabern zu gleichen Teilen zugeordnet wird. Der Referentenentwurf enthielt noch die Möglichkeit, dass das Vollstreckungsgericht auf Antrag auch eine andere Aufteilung vornimmt. Dazu hatte der Bund Deutscher Rechtspfleger angemerkt, die vorgesehene Zuständigkeit des Vollstreckungsgerichts sei abzulehnen, weil die Beurteilung der materiellen Berechtigung an dem Kontoguthaben vor das Prozessgericht gehöre. Das ist richtig.\n\nAnstatt aber die vom Rechtspflegerbund vorgeschlagene Alternativlösung aufzugreifen, ist die Möglichkeit einer abweichenden gerichtlichen Regelung im Regierungsentwurf einfach ersatzlos gestrichen worden. Die dadurch generell anzuwendende Aufteilung nach Kopfteilen kann aber – je nach den zugrundeliegenden Verhältnissen – tatsächlich zu grob unbilligen Ergebnissen führen, weil nicht berücksichtigt wird, wem das Guthaben im Verhältnis der Kontoinhaber untereinander zusteht. Das eröffnet durchaus auch Möglichkeiten des kreativen Missbrauchs. – Über die Fassung der Vorschrift zum Gemeinschaftskonto ist also auf jeden Fall noch einmal nachzudenken.\n\nEin weiteres Beispiel betrifft das in der Praxis der Insolvenzverwaltung immer wieder relevante Problem der fortbestehenden Verstrickung eines Kontos aufgrund einer bei Insolvenzeröffnung bereits bestehenden Pfändung – ein eher technisches Problem, bei dem verschiedene Lösungen denkbar sind. In den einschlägigen Stellungnahmen wurde auch angemahnt, hierzu dann mal eine Regelung zu schaffen. Unverständlicherweise ist das in dem vorliegenden Gesetzentwurf wieder nicht geschehen, sodass auch an dieser Stelle noch Nachbesserungsbedarf besteht.\n\n({0})\n\nDas waren, wie gesagt, nur zwei Beispiele aus den vielen Details dieses Gesetzentwurfs. Man wird sehen, inwieweit die Mehrheitsfraktionen zu Nachbesserungen noch bereit sein werden.\n\nWollte man den Blick von den technischen Aspekten des Vollstreckungsrechts ins Grundsätzliche lenken, könnte man die Frage aufwerfen, ob die Schaffung einer Rechtsordnung, die das Machen von und das Leben mit Schulden immer leichter und angenehmer gestaltet, auf die Dauer wirklich erstrebenswert ist. Moral Hazard gibt es auf vielen Ebenen, nicht nur in den Vorstandsetagen. Auch der Massenkonsum auf Pump stellt keine erstrebenswerte Kultur dar. Aber mit solchen Erwägungen wird hier wohl kaum jemand die Behandlung eines solchen Gesetzentwurfs belasten wollen.\n\n({1})\n\nVielen Dank.\n\n({2})"
"1042282","Alice","Weidel","AfD","Member of Parliament","2020-06-18T00:00:00.000Z","https://dip21.bundestag.de/dip21/btp/19/19166.pdf","\n\nSehr geehrter Herr Präsident! Sehr geehrte Damen und Herren! Schade, Frau Merkel, wieder eine Gelegenheit verpasst, um den Bürgern reinen Wein einzuschenken, reinen Wein über die enorme Steigerung der finanziellen Lasten, die auf unser Land zukommen.\n\nDa ist zum einen – passend zum Beginn der deutschen Ratspräsidentschaft – die dreiste Forderung der EU-Kommission, die deutschen EU-Beiträge um mehr als 40 Prozent ansteigen zu lassen. Das allein bedeutet rund 13 Milliarden Euro mehr pro Jahr. Statt den EU-Haushalt nach dem Ausscheiden Großbritanniens entsprechend zu kürzen, soll der deutsche Steuerzahler einspringen, ja sogar überkompensieren.\n\nZum Zweiten: das Pandemieanleiheaufkaufprogramm der EZB, das erst vor zwei Wochen auf die astronomische Summe von 1 350 Milliarden Euro aufgestockt wurde. Die Coronakrise muss auch hier als Vorwand für die quasi unbegrenzte rechtswidrige Staatsfinanzierung über die Notenpresse herhalten. Bürge der letzten Instanz ist der deutsche Steuerzahler, der obendrein noch durch die Nullzinspolitik enteignet wird. Auch dazu kein Wort von Ihnen. Ich frage mich: Haben Sie eigentlich den Warnschuss aus Karlsruhe nicht gehört? Wir haben das. Darum wird die AfD-Fraktion auch dagegen klagen.\n\n({0})\n\nDrittens: der sogenannten Green Deal; Sie haben es eben erwähnt. Kommissionspräsidentin von der Leyen jongliert mit mindestens 1 Billion Euro, die sie für grüne CO2-neutrale Luftschlösser verpulvern will. Wer soll das eigentlich noch bezahlen?\n\nViertens: der sogenannte Wiederaufbaufonds in Höhe von 750 Milliarden Euro. Deutschland bürgt allein für 135 Milliarden Euro, mindestens. Wieder dient die Coronakrise als Vorwand, um das Tabu der rechtswidrigen Vergemeinschaftung der Staatsschulden zu brechen. In Paris, Madrid und Rom plant man schon eifrig neue Ausgabenprogramme. Die deutschen Bürger, die jetzt schon länger arbeiten, höhere Steuern zahlen und geringere Renten und Privatvermögen haben als die Bürger der Empfängerländer dieser Transfers, müssen sich dagegen auf noch höhere Belastungen einstellen.\n\nAll diesen Haftungsrisiken und Milliardentransfers haben Sie zugestimmt, Frau Bundeskanzlerin, obwohl wir in diesem Land genug eigene Probleme zu lösen haben, für die wir unser Geld dringend brauchen.\n\n({1})\n\nWir sind kein reiches Land mehr. Die Infrastruktur bröckelt. Das Bildungssystem stürzt ab. In Sachen Digitalisierung sind wir weit abgeschlagen. Die sozialen Sicherungssysteme stecken in der demografischen Doppelfalle aus alternder Bevölkerung und unqualifizierter Einwanderung in unseren Sozialstaat.\n\n({2})\n\nDazu kommt der volkswirtschaftliche Schaden durch die Coronakrise, der von Tag zu Tag größer wird. Wir haben heute bereits über 7 Millionen Kurzarbeiter. Das sind zehnmal mehr als auf dem Gipfel der Finanzkrise im Februar 2009.\n\n({3})\n\nUnserem Land droht eine nie dagewesene Welle von Arbeitslosigkeit und Unternehmenspleiten. Der Mittelstand verarmt. Mit schuldenfinanzierten Ausgabenprogrammen kommen wir aus dieser Krise überhaupt nicht heraus. Nein, ganz im Gegenteil: Sie verschärfen die Krise dadurch noch mehr.\n\n({4})\n\nIn dieser Situation haben wir auch keine Milliarden zu verschenken; denn wir müssen uns selbst helfen, den Lockdown und die Coronaeinschränkungen unter den Schutzbestimmungen vollständig beenden, damit der Mittelstand wieder auf die Beine kommt.\n\nZweitens: Steuern und Abgaben deutlich und dauerhaft senken, damit Arbeitnehmer und Selbstständige wieder Luft zum Atmen haben.\n\n({5})\n\nUnd drittens und vor allem: Nein zu neuen Milliardentransfers und Haftungsrisiken, mit denen deutsches Volksvermögen für Euro-Rettung und Transferunion verpfändet wird. Handeln Sie bitte im Interesse dieses Landes und seiner Bürger, Frau Bundeskanzlerin,\n\n({6})\n\nund verstecken Sie sich nicht länger hinter ideologisch aufgeladener Phrasendrescherei, wie Sie es leider in Ihrer Rede heute getan haben. Sehr schade für diese verpasste Chance.\n\n({7})"
"1042295","Harald","Weyel","AfD","Member of Parliament","2020-06-18T00:00:00.000Z","https://dip21.bundestag.de/dip21/btp/19/19166.pdf","\n\nGeehrter Präsident! Kollegen und Zuschauer! Die Kanzlerin optimiert hier mit quasi veruntreutem Steuergeld die Steigerung der EU-Fiskalausbeutung inländischer Sparer und Steuerzahler.\n\n({0})\n\nAm Ende stehen Reformverweigerung, erlernte Hilflosigkeit und immer dreisteres Forderungsgebaren der Wohltatsadressaten. Mit der Fremdfinanzierung nationaler Sozialpolitik in dem unsäglichen SURE-Vorhaben, dem ominösen Recovery Fund oder von der Leyens 750-Milliarden-Pseudoprogramm runden Sie die ganze schlechteuropäische Antisubsidiaritätsorgie ab.\n\n({1})\n\nMit herbeigeredeter Not wird sich nach rein französischem Oktroi und seinen Nutznießern gerichtet. Mit systemwidrigen Nichtleistungsanreizen für anderer Leute Regierung, Staatshaushalt und Wirtschaft wird hierbei selbst der Keynesianismus ad absurdum geführt. Großteils verschenktes Geld für andere Staaten als Kaufprämie für renditelose Konsuminvestitionen – wofür? Und das, während hierzulande nicht nur die Infrastruktur verrottet. Ich gratuliere!\n\nMit Panik und Hysteriestrategie haben Sie das Land nacheinander getrieben vom Euro-Politikwahn, der die Finanzen ruiniert, in den Klimapolitikwahn, der die Umwelt schädigt, in den Coronapolitikwahn, der auf die Wirtschaft wirkt wie eine Neutronenbombe.\n\n({2})\n\nKein neuer Spuk hat je den alten aufgelöst, wie manche hoffen. Nein, drei apokalyptische Reiter sitzen uns zugleich im Nacken, und der vierte ist auch schon eingetroffen: eine völlig überkandidelte Antidiskriminierungspolitik, die die Bevölkerungsmehrheit diskriminiert und Polizei und Justiz genauso durchdysfunktionalisiert, wie es beim Militär schon gelungen ist.\n\n({3})\n\nDabei geht Nachbarschaftshilfe auch international über Sachleistungen und dergleichen. Corona ist genau nicht das Erdbeben von Haiti, als das es verkauft wird. Das letzte sinnvolle Krisenmanagement Brüssels liegt 50 Jahre zurück: die strategische Ölreserve, die ganz unspektakulär für genau 90 Tage den Öl- und Treibstoffbedarf abdeckt – Punkt. Genau das – und nur das sollte man machen – kann man auch ganz unspektakulär für Medizingeräte, Arzneibedarf etc. vorsehen. Aber beispielsweise der herbeigeredete Bedarf an Atemgeräten hat sich inzwischen offenbar in Luft aufgelöst und oft genug auch noch als tödliche Fehlbehandlung herausgestellt. Die mit heißer Nadel gestrickten monetären Hilfs-, Not- und Krisenprogramme dürften sich als betrügerische Haustürgeschäfte erweisen.\n\n({4})\n\nFällig wäre vielmehr eine nachhaltige, ganzheitliche, allumfassende deutsche Nichtzuständigkeitserklärung für derlei fremdbestimmte Anliegen. Just say no.\n\nEin letztes Wort. Herr Brinkhaus, Sie hatten so schön die Friedensdividende usw. erwähnt. Ich darf darauf aufmerksam machen: Der wunderbare Finanzhistoriker – Oxford usw. – Niall Ferguson hat 2011 festgestellt, dass die damaligen Finanzrettungsübungen der EU den Kosten eines Weltkriegs entsprachen. Das war 2011.\n\n({5})\n\nDeswegen hat die EU in 2012 völlig zu Recht den Friedensnobelpreis bekommen. Denn sie hat bewiesen, dass man im tiefsten Frieden einen Schaden auf Weltkriegsniveau anrichten kann.\n\nIch danke.\n\n({6})"
"1042318","Robby","Schlund","AfD","Member of Parliament","2020-06-18T00:00:00.000Z","https://dip21.bundestag.de/dip21/btp/19/19166.pdf","\n\nSehr geehrter Herr Präsident! Guten Morgen, liebe Kollegen! Am 6. Mai forderte unsere Fraktion hier an dieser Stelle, hier im Plenum, „die epidemische Lage von nationaler Tragweite aufzuheben“. Heute, sage und schreibe 43 Tage später, fordert die FDP: „Epidemische Lage von nationaler Tragweite beenden“.\n\n({0})\n\nWir freuen uns darüber außerordentlich, keine Angst. Wir finden es auch nicht weiter schlimm, dass „aufzuheben“ jetzt „beenden“ heißt – damals noch von Ihnen moniert. Manche haben sogar im Plenum hier über Menschenfeindlichkeit oder Ähnliches philosophiert und gebrüllt. Dennoch möchten wir uns bei der FDP für diesen Antrag bedanken.\n\nWoher dieser Sinneswandel jetzt kommt, können wir uns leider nicht erklären, da Sie ja damals unseren Antrag kategorisch abgelehnt hatten.\n\n({1})\n\n– Entschuldigung. Lassen Sie mich mal bitte ausreden. – In Anbetracht der Erfurter Situation mit Herrn Kemmerich, die jedem hier ja hinlänglich bekannt sein dürfte, hoffen wir, dass Sie jetzt nicht Ihren eigenen Antrag ablehnen müssen, meine Damen und Herren. Das wäre in der Tat außerordentlich schade und sicherlich nicht im Interesse der Menschen dieses Landes.\n\n({2})\n\nJa, es ist längst überfällig, festzustellen, dass eine epidemische Lage von nationaler Tragweite nicht mehr vorliegt. Und, liebe Kollegen, wie schon so oft: Die AfD wirkt, meine Damen und Herren.\n\n({3})\n\nAber Sie fragen sich jetzt sicherlich: Wie ist die AfD bereits vor Wochen zu dieser Erkenntnis gelangt,\n\n({4})\n\nwährend sich viele Politiker hier aus dem Haus noch im Homeoffice befanden und sich ängstlich hinter dem Regierungs-Shutdown verbarrikadiert hatten?\n\n({5})\n\nMit ein wenig mathematischem Geschick und den umfangreichen Daten der Hopkins-Universität haben wir einige Länder hinsichtlich der Einwohnerdichte und der Infektionsausbreitung verglichen und festgestellt, dass Länder ohne Lockdown eine niedrigere Infektionsausbreitung je Quadratkilometer hatten und haben als jene mit einem oder einem verzögerten Shutdown wie bei uns.\n\n({6})\n\nBesser wäre es tatsächlich gewesen, auf den Shutdown komplett zu verzichten\n\n({7})\n\nund stattdessen ein gestuftes pandemisches Rastermanagement zu verwenden, wie es die AfD bereits im Februar, genau am 12. Februar, hier in diesem Plenum gefordert hatte.\n\n({8})\n\nEhrlich gesagt, meine Damen und Herren, hätten wir uns dann diese Diskussion hier und heute und eine Stunde sparen können. Die Zahlen zeigten, dass ein Shutdown in Deutschland nicht nur völlig unnötig war, sondern geradezu die Pandemie in die Länge gezogen hat.\n\n({9})\n\nDabei sind die einzelnen Verläufe der Pandemie dynamisch gut zu beurteilen, da sie nach den klassischen Fließgleichgewichtsprinzipien in komplexen adaptiven Biosystemen reagieren. Dazu wäre allerdings am Anfang eine öffentliche Expertenanhörung von Fachwissenschaftlern wie Systemtheoretikern, Medizinern und Katastrophenforschern erforderlich gewesen.\n\n({10})\n\nDoch leider Fehlanzeige. Nun müssen Sie es sich in aller Öffentlichkeit gefallen lassen, werte Bundesregierung, dass wir wegen Ihres Missmanagements auch in dieser Frage einen Corona-Untersuchungsausschuss fordern.\n\n({11})\n\nUnd noch etwas: Hier und da hört man schon wieder vom Damoklesschwert einer zweiten Welle. Hören Sie bitte mit diesem Unfug auf! Den Menschen muss klar sein, dass Seuchen schon immer zur Menschheitsgeschichte gehört haben und auch gehören werden. Deshalb ist es absolut unsinnig, die Menschen mit monatelangen Verunsicherungen durch ständig wechselnde Ausnahmen und Regelungen zu zermürben. Statt sie gegen Viren und Bakterien aller Art widerstandsfähig zu machen, haben Sie mit Ihren Maßnahmen genau das Gegenteil erreicht.\n\n({12})\n\nWissen Sie, was Sie gemacht haben?\n\n({13})\n\nSie haben nämlich den negativen Stress massiv erhöht und damit das Immunsystem vieler Menschen geschwächt.\n\n({14})\n\nWir fordern Sie deshalb auf: Klären Sie die Menschen über das Virus auf, und hören Sie auf, Ängste zu schüren und persönliche Freiheiten einzuschränken.\n\n({15})\n\nInsbesondere die Sorge um unsere Kinder muss eine höhere Wichtigkeit bekommen und im höchsten Maße an Normalität orientiert sein. Meine Damen und Herren, wir brauchen keine Angsthasen, sondern gut ausgebildete, vorwärtsstrebende und lösungsorientierte junge Menschen.\n\n({16})\n\nLiebe Kollegen, es ist eine sehr traurige Wahrheit, die aber hundertprozentig uns alle hier treffen wird – und das ist so sicher wie das Amen in der Kirche –: Wir alle hier werden einmal sterben. – Daher ist es wichtig, unser Leben mit Freude und Lebensenergie auszufüllen, egal in welchem Stadium wir uns auch immer befinden – ob als Kind, als Erwachsener oder als Angehöriger der sogenannten Risikogruppe. Diese Möglichkeit wurde uns in den letzten Wochen durch die Entscheidungsträger komplett genommen.\n\n({17})\n\nSie haben uns in den Altenheimen alleingelassen, sie haben uns zu Lehrern im Homeoffice gemacht, und sie haben uns unserer Freizeitmöglichkeiten beraubt. Das darf sich nie wiederholen.\n\n({18})\n\nWir müssen auf die nächste Epidemie einfach besser vorbereitet sein. Einen planlosen Lockdown, wie wir ihn in den letzten Wochen erlebt haben, darf es niemals wieder geben. Denn es ist ebenso eine traurige Wahrheit, die zu 100 Prozent stimmt: Die nächste Epidemie kommt ganz bestimmt. – Nur eins: Wir sollten besser darauf vorbereitet sein.\n\n({19})\n\nNoch etwas ganz Persönliches als Mediziner zum Schluss: Nehmen Sie bitte den Menschen da draußen diesen unnützen Maulkorb ab! Bereits nach drei Stunden und bei Temperaturen von 28 Grad haben Sie die perfekte mobile Petrischale für Millionen Arten von Keimen.\n\nVielen Dank, meine Damen und Herren.\n\n({20})"
"1042388","Hansjörg","Müller","AfD","Member of Parliament","2020-06-18T00:00:00.000Z","https://dip21.bundestag.de/dip21/btp/19/19166.pdf","\n\nHerr Präsident! Verehrte Kollegen! Lieber Herr Bundesminister, Sie haben heute Geburtstag, also alles Gute, und selbstverständlich werde ich Sie deswegen etwas weicher anfassen als sonst.\n\n({0})"
"1042390","Hansjörg","Müller","AfD","Member of Parliament","2020-06-18T00:00:00.000Z","https://dip21.bundestag.de/dip21/btp/19/19166.pdf","\n\nDas meine ich natürlich im übertragenen Sinne.\n\nIch möchte den Minister erst einmal loben. Die deutschen Schlüsselindustrien sind vor ausländischem Zugriff zu schützen, wenn die Investoren neben wirtschaftlichen Zielen auch Machtziele verfolgen.\n\n({0})\n\nMit Investitionen Gewinne zu erzielen, ist legitim und für eine funktionierende Marktwirtschaft notwendig. Gefährlich wird es, wenn aus weiteren Gründen investiert wird, die mit Gier zu tun haben – und ich weiß nicht, ob Gier unbedingt legitim ist –, und zwar Kontrollgier nach Marktmacht, um den Wettbewerb auszuschalten, Gier nach Shareholder-Value, wenn Heuschrecken Firmen aufkaufen, die Substanz über Beraterhonorare aussaugen und Mitarbeiter auf die Straße setzen, und Neugier über das Absaugen deutscher Technologie durch ausländische Global Player und Investmentbanken. – Jetzt können Sie klatschen; denn etwas Ähnliches hat der Minister auch gerade gesagt. Da haben Sie auch geklatscht.\n\n({1})\n\nDas war es auch schon mit unserem Lob für den grundsätzlich richtigen Ansatz der Bundesregierung. Ihr Ansatz verursacht bei differenzierter Betrachtung folgende Probleme. – Es wäre nett, wenn in der ersten Reihe vielleicht auch zugehört würde, wenn ich hier meine Rede halte. Ich bedanke mich bei den grünen Kolleginnen und Kollegen.\n\n({2})\n\nDie Kriterien für eine Prüfung ausländischer Direktinvestitionen in Deutschland sind zu schwammig formuliert. Es werden keineswegs nur die sogenannten systemrelevanten Unternehmen geschützt. Die vagen Formulierungen – das ist eine Hauptkritik von uns – ermöglichen eine willkürliche Auslegung durch die Ministerien. Dann steht immer die Frage im Raum: Was ist systemrelevant und was nicht? Bei Bedarf kann man wohl auch eine Masken- oder Maulkorbproduktion für systemrelevant erklären, da die Kriterien nicht eindeutig sind.\n\nZur Nacharbeitung ihrer Änderungen zum Außenwirtschaftsgesetz hat sich die Regierung drei Wochen zusätzlich genehmigt – wenn Sie diese Zeit bloß sinnvoll genutzt hätten –, und zwar im Hinblick auf die sehr heftigen Nachwirkungen des Corona-Lockdowns. Man hätte den Gesetzentwurf an die Gefahren eines Ausverkaufs der deutschen Wirtschaft anpassen müssen. Diese sind nämlich durch die aktuellen Verwerfungen an den Kapitalmärkten gestiegen. Aber nichts wurde gemacht. Es ist ja auch klar: Es ist für die Regierung einfacher, sich als Retter mit fremdem Geld auf Kreditbasis feiern zu lassen – so richtig schön populistisch –, anstatt Sacharbeit zu leisten.\n\n({3})\n\nAber sei’s drum: Der wesentliche Schwachpunkt des Koalitionsvorschlags ist und bleibt die Ausgestaltung. Die alleinige Lösung über reine Kontrollmechanismen ist nicht effizient. Es fehlen zusätzliche Anreizmechanismen, insbesondere fiskalischer Natur. Darüber hinaus sind die Kontrollmechanismen – so steht es im Gesetzentwurf – auch noch mit folgenden praktischen Problemen verbunden:\n\nErstens. Es entsteht ein bürokratisches Prüfchaos. Bis zu fünf Ministerien sollen gemeinsam entscheiden, manchmal zusätzlich auch noch die Bundesregierung; gegebenenfalls ist auch noch die Zustimmung anderer europäischer Staaten einzuholen. Die Koalition ist sich dieses Tohuwabohus, denke ich, schon bewusst. Sie beschreibt selbst das Minimalziel ihres Änderungsantrags im Ausschuss: Zumindest die Fristen sollen für Unternehmen halbwegs durchschaubar gemacht werden. – Aber ob das einem ausländischen Unternehmer ausreicht, um planungssicher in ein deutsches Unternehmen zu investieren?\n\nZweitens sehen wir die Gefahr der außenpolitischen Einflussnahme. Siehe Nord Stream 2 – da haben wir es doch –: Einflussnahme außenpolitischer Natur auf das Außenwirtschaftsgesetz. Es ist realistisch, anzunehmen, dass deutsche Ministerien unter erheblichen Druck aus den USA geraten könnten. Dann hätten wir kein neutrales Außenwirtschaftsgesetz zum Schutze systemrelevanter deutscher Unternehmen mehr, sondern ein Sondergesetz gegen Investoren aus Russland und China.\n\n({4})\n\nAls AfD-Bundestagsfraktion sehen wir es kritisch, dass viele Ministerien immer nur kontrollieren, anstatt Anreize zu setzen, obwohl Anreize doch Steuerungsinstrumente sind, mit denen man viel mehr Wirkung erzielen kann.\n\nAus diesem Grund beantragen wir als AfD-Fraktion in unserem Entschließungsantrag, Änderungen fiskalischer Natur ins Außenwirtschaftsgesetz einzubauen. Die deutschen Finanzämter verfügen über die notwendige Durchsetzungsfähigkeit, vor der auch ausländische Investoren Ehrfurcht haben. Damit bieten unsere Finanzämter einen viel wirksameren Schutz für systemrelevante deutsche Unternehmen als dieses Kompetenzwirrwarrprüf- und ‑entscheidungsgremium aus folgenden Ministerien, die bei uns mitquatschen: Wirtschaft, Verteidigung, Inneres, Finanzen, Auswärtiges; gegebenenfalls quatscht auch noch das Kanzleramt mit. Was für ein Chaos!\n\n({5})\n\nDas angestrebte Ziel können die Finanzämter viel wirksamer und einfacher erreichen, zum Beispiel durch die gezielte Verteuerung von Käufen systemrelevanter Unternehmen, wenn diese Unternehmen auf Kosten des deutschen Steuerzahlers hochgepäppelt und erst dadurch wertvoll geworden sind. Ordnungspolitisch ist es sogar erforderlich, der Privatisierung von Gewinnen und der Sozialisierung von Verlusten einen Riegel vorzuschieben, damit die Marktwirtschaft, von der unser Minister immer so gerne spricht, funktionieren kann.\n\n({6})\n\nAusländische Investoren können, wenn sie wollen, sehr gerne systemrelevante deutsche Unternehmen kaufen, wenn sie bereit sind, dem deutschen Steuerzahler diejenigen Beträge zurückzuerstatten, die er vorher in diese Unternehmen in Form staatlicher Förderung investiert hat.\n\n({7})\n\nIn diesem Sinne sind die Vorschläge in unserem Entschließungsantrag aufgebaut: Anreize setzen, dafür Prüf- und Bürokratieaufwand reduzieren. Damit, liebe Bundesregierung, lässt sich Ihr Ziel, systemrelevante deutsche Unternehmen vor ausländischer Übernahme zu schützen, viel effizienter erreichen als mit Ihrem Kompetenzwirrwarrprüf- und ‑entscheidungsgremium.\n\nIch danke fürs Zuhören.\n\n({8})"
