id,firstname,lastname,faction,position,date, url,speech
"1042949","Beatrix","Storch","AfD","Member of Parliament","2020-06-19T00:00:00.000Z","https://dip21.bundestag.de/dip21/btp/19/19167.pdf","\n\nSehr geehrte Frau Präsidentin! Meine Damen und Herren! Der Gesetzentwurf der Grünen ist Ausdruck fortgeschrittener spätrömischer Dekadenz.\n\n({0})\n\nZum ersten Mal in der Menschheitsgeschichte gibt es eine relevante politische Gruppe, die der Meinung ist, jeder kann sich sein Geschlecht aussuchen und dass es staatliche Beratungsstellen braucht, um den Menschen bei der Entscheidung zu helfen, welches Geschlecht sie gerne hätten.\n\n({1})\n\nIm Gesetzentwurf der Grünen heißt es – ich darf zitieren –:\n\nJede Person kann gegenüber dem Standesamt erklären, dass die Angaben zu ihrem Geschlecht in einem deutschen Personenstandseintrag durch eine andere … Bezeichnung ersetzt oder gestrichen werden soll.\n\n({2})\n\nAnton Hofreiter geht als Anton Hofreiter in das Standesamt hinein und kommt als Antonia Hofreiter heraus.\n\n({3})\n\nDas neue Wunschgeschlecht soll auch für die Vergangenheit gelten. Die Kinder, die sich noch ganz genau an ihren Vater erinnern konnten, sollen plötzlich immer nur zwei Mütter gehabt haben. Das ist Orwell 2.0.\n\n({4})\n\nDer Gesetzentwurf gilt ausdrücklich auch für Asylbewerber,\n\n({5})\n\ndie dann zu Asylbewerberinnen werden, sodass die jungen Syrer, Eritreer, Somalier dann ganz diskriminierungsfrei auch beim Frauenschwimmen teilnehmen dürfen. Was für ein Wunder der Integration!\n\n({6})\n\nDie grüne Geschlechtervielfalt in der Praxis sieht so aus: Männer, die Kinder gebären, Goldmedaillen im Frauensport gewinnen, in die Frauensauna gehen und sich natürlich auf die Frauenquote berufen können. Und auch das das erste Mal in der Menschheitsgeschichte: Frauen, die zur Prostatavorsorge müssen.\n\n({7})\n\nUnd die Krönung: für jeden verurteilten brutalen Vergewaltiger Absitzen der Gefängnisstrafe im Frauengefängnis. So geschehen im Vereinigten Königreich. Der 52-jährige Sexualverbrecher Stephen Wood vergewaltigte Frauen und Kinder. Er konnte gefasst und verurteilt werden. Stephen Wood nannte sich dann um in „Karen White“ und erklärte sich zur Frau und den Wunsch, in das Frauengefängnis verlegt zu werden, was passierte, wo er weitere Frauen sexuell missbrauchte.\n\n({8})\n\nDas sind die Folgen des politischen Kampfes der Genderideologen gegen die Biologie, gegen die Realität und gegen den ganz normalen gesunden Menschenverstand – der schiere pure Irrsinn.\n\n({9})\n\nIn ihrem Antrag berufen sich die Grünen auf den aktuellen Stand der Wissenschaft; damit meinen sie den ideologischen Quark, der an den 250 Genderlehrstühlen auf Staatskosten verzapft wird. Wer will, dass man sich sein Geschlecht frei aussuchen kann, der kann sich auch gleich mit der 1956 gegründeten Flat Earth Society zusammentun, die behauptet: Die Erde ist eine Scheibe.\n\n({10})\n\nDiese Debatte heute ist denkwürdig. Die Staatsverschuldung ist explodiert. 7 Millionen Arbeitnehmer sind auf Kurzarbeit, Hunderttausende von Menschen bangen um ihre Existenz, und die Grünen fordern von der Flensburger Förde bis in den letzten Winkel der Chiemgauer Alpen flächendeckende steuerfinanzierte Genderidentitätsberatungsstellen. Das sind Luxusprobleme linksliberaler Wohlstandsneurotiker,\n\n({11})\n\ndie in ihren hochsubventionierten Energiesparhäusern jeden Bezug zur Realität verloren haben.\n\nVon uns aus kann Anton Hofreiter Königin in Gender-Gaga-Land werden, oder auch Antonia Hofreiter. Aber Deutschland hat echte Probleme. Um die werden wir uns kümmern.\n\nVielen Dank.\n\n({12})"
"1042966","Enrico","Komning","AfD","Member of Parliament","2020-06-19T00:00:00.000Z","https://dip21.bundestag.de/dip21/btp/19/19167.pdf","\n\nSehr geehrte Frau Präsidentin! Meine Damen und Herren Kollegen! Es ist wahrscheinlich eine der ältesten Geschichten der Menschheit: die unselige Verquickung von Macht und Geld. Deshalb ist es gut, dass wir immer mal darüber reden – heute natürlich aus gegebenem Anlass.\n\nIn einer Demokratie wird Macht auf Zeit gewährt. Es ist daher nicht nur verständlich, sondern geradezu wünschenswert, dass die persönliche Existenzgrundlage nicht auf einem politischen Mandat oder Amt, sondern auf einem tatsächlichen und bestenfalls auch ausgeübten Beruf basiert. Oftmals sind es gerade Leistungsträger, die sich politisch auch hier im Bundestag engagieren: Bauern, Handwerker, Menschen, die sich ein kleines Unternehmen aufgebaut haben, die hart und ehrlich arbeiten und die vor allem auch große soziale Verantwortung für ihre Arbeitnehmer und deren Familien übernehmen. Die Abgabe oder gar Schließung des eigenen Betriebes um des Mandats willen wären aus wirtschafts-, sozial- und gesellschaftspolitischer Sicht deshalb falsch. Aber es gibt natürlich auch die anderen, diejenigen, die ihr Mandat nutzen, um sich persönlich zu bereichern. Gestaltungsmacht in einer Demokratie, meine Damen und Herren, dient dem gesamtgesellschaftlichen Wohl und nicht dem eigenen Geldbeutel.\n\n({0})\n\nGerade aus der selbsternannten politischen Mitte dieses Hauses wird von Abgeordneten, die das C in ihrem Fraktionsnamen führen, besonders oft und gern die moralische Keule geschwungen. Und besonders oft und gern sind es Vertreter aus Ihren Reihen, die es eben mit dieser Moral nicht immer so ganz genau nehmen. Eine Aufzählung erspare ich mir jetzt; Dietmar Bartsch hat ja hier schon einen Aufschlag gemacht.\n\nSie, meine Damen und Herren von der Union, sollten das mit dem erhobenen Zeigefinger sein lassen. Abgesehen von der Frage der Legalität: Ein kleines Start-up, von dem übrigens keiner so genau weiß, was es tut, im Wirtschaftsministerium zu pushen und dafür Anteilsoptionen zu bekommen, das, meine Damen und Herren, ist nicht aufrecht, das ist nicht bürgerlich, und das ist schon gar nicht konservativ.\n\n({1})\n\nMeine Damen und Herren, das gilt im Übrigen auch für die Minister, die darauf eingehen. Auch das gilt es zu untersuchen.\n\nMeine Damen und Herren, Kommunikation zwischen Interessenvertretern, Fachleuten und Politik führt zum Austausch von Argumenten und damit in der Regel zu besseren politischen Entscheidungen. Es muss aber unbedingt Transparenz herrschen. Transparenz ist vor allem bei den politischen Mandatsträgern wichtig, und das wird durch die Pflicht zur Anzeige von Nebeneinkünften ja auch schon realisiert. Das Problem ist: Eine Anteilsoption ist eben kein Einkommen. Es ist ein Versprechen, wenn nicht gar eine Wette auf einen zukünftigen Gewinn und deshalb bisher nicht anzeigepflichtig. Ratio der Offenlegungspflicht bei Nebeneinkünften ist ja aber gerade die Möglichkeit, Verknüpfungen zwischen Geld und politischen Entscheidungen zu erkennen. Da besteht vor allem auch bei der Gewährung von Optionen ein hohes Interesse an Transparenz. Optionen sind ein übliches Vergütungsmittel, vor allem bei Start-ups, die zumeist kaum ausreichend Kapital haben. Und der gut vernetzte Mandatsträger wird dadurch ganz besonders motiviert, zum Unternehmenserfolg und damit zu seinem eigenen finanziellen Erfolg beizutragen. Das macht die Option besonders verlockend für politische Korruption. Deshalb ist es absolut notwendig, die Gewährung von Anteilsoptionen für Abgeordnete anzeigepflichtig zu machen.\n\n({2})\n\nAbschließend, meine Damen und Herren: Wir sollten uns jeden Tag und alle vor Augen halten: Wir handeln hier für die Allgemeinheit und nicht für das eigene Interesse. Schauen wir alle jeden Morgen in den Spiegel und fragen wir uns, ob wir dem auch wirklich gerecht werden!\n\nVielen Dank und ein schönes Wochenende.\n\n({3})"
"1042978","Thomas","Seitz","AfD","Member of Parliament","2020-06-19T00:00:00.000Z","https://dip21.bundestag.de/dip21/btp/19/19167.pdf","\n\nSehr geehrte Frau Präsidentin! Sehr geehrte Damen und Herren! Ich möchte bekennen: Ich bin Lobbyist, ein Lobbyist für Recht und Freiheit und für nichts anderes.\n\n({0})\n\nWenn alle Abgeordneten so dächten, dann hätten wir nicht nur ein besseres Parlament, sondern auch ein besseres Deutschland.\n\n({1})\n\nDer Kollege Amthor liefert den Anlass für die heutige Diskussion. Das Problem ist aber strukturell. Und nur ganz kurz zum Kollegen: Er hat äußerst unklug gehandelt, auch wenn wohl kein Verstoß gegen die Verhaltensregeln vorliegt. Man muss dem Kollegen aber zugutehalten, dass er mit seinem auf Universität und Junge Union beschränkten Erfahrungsschatz einfach nicht bodenständig verwurzelt war und es auch nicht sein konnte.\n\n({2})\n\nÜber die für die Unabhängigkeit eines Abgeordneten notwendige Lebens- und Berufserfahrung konnte er altersmäßig gar nicht verfügen. Ich glaube, das zeigt, wie falsch manche Kollegen hier im Haus unterwegs sind, und zwar nicht, weil bei allen das Talent fehlt, sondern weil sie einfach fünf oder zehn Jahre zu früh hier dran sind.\n\n({3})\n\nIch schätze den Kollegen Amthor aber als intelligent genug ein, um aus seinen Fehlern zu lernen und vor allem sein Zweites Staatsexamen nachzuholen, um sich unabhängig vom Politikbetrieb zu machen. Gerade weil er so jung ist, gebe ich ihm eine echte Chance, die Traditionslinie fragwürdiger Integrität in der Union zu durchbrechen, eine unrühmliche Traditionslinie von Helmut Kohl über Wolfgang Schäuble bis unlängst Stephan Harbarth. Denn wenn wir über Lobbyismus reden, reden wir vor allem über Integrität, über die Integrität des Parlaments, der Regierung und allgemein des politischen Betriebs. Da die Hoffnung auf Integrität nicht ausreicht, brauchen wir Regeln für den Lobbyismus, um jedenfalls die schlimmsten Auswüchse zu verhindern. Und was an zulässigem Lobbyismus übrig bleibt, das muss dann möglichst transparent sein, damit der Bürger weiß, welchen Konzern oder welche Ideologie er zwangsläufig mit einer Partei oder einem Kandidaten mitwählt.\n\n({4})\n\nWas das Thema „Integrität und Transparenz“ angeht, ist dieses Parlament ein Parlament der Schande.\n\n({5})\n\nGerade wir als Alternative für Deutschland sind deshalb gegen den Berufspolitiker „Typ Altpartei“.\n\n({6})\n\nUnsere Satzung gibt das Bild eines Abgeordneten vor, der über eine mehrjährige Erwerbsbiografie verfügt, die es ermöglicht, dass er nach längstens drei oder vier Legislaturperioden in seinen alten Beruf zurückkehrt.\n\n({7})\n\nUnd wenn er seinen Beruf auch während des Mandats ausübt, dann nur in einem Umfang, der für die spätere Rückkehr notwendig ist. Er übernimmt aber keine neuen Tätigkeiten, schon gar nicht als Lobbyist, und am Ende des Mandats gilt freiwillig eine Karenzzeit von drei Jahren. – Das ist es, wofür die Alternative für Deutschland steht.\n\n({8})\n\nIn der Realität der Altparteien gab es dagegen jahrzehntelang überhaupt keine Regelungen, die wenigstens verhinderten, dass Regierungsmitglieder und Parlamentarische Staatssekretäre ihr amtlich erworbenes Wissen, vor allem aber ihre amtlich geknüpften Kontakte mehr oder weniger nahtlos nach dem Ausscheiden aus dem Amt gewinnbringend an den Meistbietenden verhökerten. Seit 2015 gibt es für Minister und Staatssekretäre nun zumindest halbherzige Regelungen mit einer allerdings viel zu kurzen Karenzzeit und vor allem ohne spürbare Sanktionen.\n\n({9})\n\n– Stellen Sie doch eine Zwischenfrage, Frau Kollegin; auch Ex-Minister dürfen das tun.\n\n({10})\n\nDer Kollege Oliver Wittke, CDU, bis letzten November noch Staatssekretär, wartet auf die Berufung als Hauptgeschäftsführer des Spitzenverbandes der Immobilienwirtschaft. Ex-Minister Gabriel, SPD, wartet auf die Berufung in den Aufsichtsrat der Deutschen Bank. Ex-Ministerin Frau Zypries, SPD, sitzt im Aufsichtsrat bei Bombardier. Und Frau Andreae von den Grünen ist jetzt Lobbyistin beim Bundesverband der Energie- und Wasserwirtschaft. Das in seiner Dimension wohl dramatischste Beispiel: der Präsident des Bundesverfassungsgerichts, Stephan Harbarth. Ein exzellenter Jurist, keine Frage, aber wer als Vorstand selbst einer Wirtschaftskanzlei sogenannte Nebeneinkünfte in einer Höhe bezogen hat, dass er dafür selbst bei einem Stundensatz von 500 Euro neben dem Mandat noch weitere rund 2 500 Stunden im Jahr hätte arbeiten müssen, der provoziert eben die Vermutung, dass hier Geld ohne Gegenleistung geflossen ist. Ein mutmaßlicher Lobbyist für Volkswagen war tätig in Ausschüssen und hat im Dieselskandal an Entscheidungen mitgewirkt – mit großer Bedeutung für Volkswagen. So etwas darf es nicht mehr geben. Eine Möglichkeit wäre, dass Einkünfte aus Nebentätigkeiten, nicht aus Vermögensverwaltungen, die die Abgeordnetenentschädigung übersteigen, künftig an die Staatskasse abzuführen sind.\n\n({11})\n\nDiese Beispiele machen es für mich unumgänglich: Es muss nicht nur das Bundesministergesetz und das Abgeordnetengesetz angepasst werden – Herr Schnieder, Änderungen bei den Verhaltensregeln reichen eben nicht aus –, sondern es bedarf auch der Einführung eines Lobbyregisters. Wir werden dazu demnächst einen eigenen Entwurf vorlegen.\n\nAber es geht eben nicht nur um die Verflechtungen und die Einflussnahme seitens der Wirtschaft, sondern auch um Einflüsterungen seitens Ideologen und NGOs. Gerade Letztere müssen hier erfasst werden, da sie oft das Vehikel zur Umsetzung von Interessen von milliardenschweren Hintermännern sind, deren direkte Einflussnahme bei Bekanntwerden öffentliche Empörung auslösen würde.\n\n({12})"
"1042980","Thomas","Seitz","AfD","Member of Parliament","2020-06-19T00:00:00.000Z","https://dip21.bundestag.de/dip21/btp/19/19167.pdf","\n\nIch komme zum Schluss.\n\n({0})\n\nEin Register, das für echte Lobbytransparenz sorgt, muss deshalb abbilden, mit wem ein Abkassierverein wie die bereits erwähnte DUH zusammenarbeitet, und genauso –"
"1042982","Thomas","Seitz","AfD","Member of Parliament","2020-06-19T00:00:00.000Z","https://dip21.bundestag.de/dip21/btp/19/19167.pdf","\n\n– die Verflechtungen von Frau Scheer von der SPD und ihren missionarischen Eifer bei der Verbreitung der Solarideologie.\n\nVielen Dank.\n\n({0})"
"1042998","Albrecht","Glaser","AfD","Member of Parliament","2020-06-29T00:00:00.000Z","https://dip21.bundestag.de/dip21/btp/19/19168.pdf","\n\nHerr Präsident! Meine sehr verehrten Damen und Herren! Das Konjunktur- und Krisenbewältigungspaket und das Zukunftspaket der Bundesregierung haben zusammen ein Volumen von 172 Milliarden Euro. Der Anteil steuerlicher Erleichterungen darin beträgt 50 Milliarden Euro, aber nur dann, wenn man die 11 Milliarden Euro Energiesubventionen für Wind und Sonne einbezieht, die in Zukunft direkt aus Steuermitteln und nicht mehr von den Stromabnehmern bezahlt werden sollen. Dies belastet dauerhaft den Bundeshaushalt und führt keineswegs zur Senkung der Strompreise. Für Unternehmen und Bürger ist dies daher völlig bedeutungslos.\n\nWenn man diesen Betrag und alle anderen steuerlichen Maßnahmen, die nur Stundungscharakter haben – und das ist die Mehrzahl –, von den 50 Milliarden Euro abzieht, dann bleiben nur noch 20 Milliarden Euro übrig, die sich bei der Mehrwertsteuersenkung als Einnahmeminderung des Staates darstellen und die Endverbraucher um diesen Betrag entlasten, sofern diese Steuersenkung bei ihnen überhaupt ankommt. Ist dies der Fall, fressen die zweimaligen Umstellungskosten für die Umsatzsteuer – in einem halben Jahr zweimal –, die in Milliardenhöhe geschätzt werden, diesen Vorteil nahezu auf.\n\n({0})\n\nKeine Soliabschaffung, keine dauerhafte Ertragssteuersenkung, keine Steuervereinfachung, keine Bürokratieerleichterung – es gibt einfach nichts, was einer zwangskollabierten Volkswirtschaft wieder auf die Beine helfen könnte.\n\nÄhnlich wirkungslos wird der Kinderbonus sein, der gerade einmal 4,3 Milliarden Euro Staatsausgaben verursacht. Er spart dabei aber die Kinder der Eltern aus, deren Kinderfreibetrag auf dem bisherigen Niveau eingefroren bleibt. So viel zur Gleichheit der Behandlung von Kindern.\n\n({1})\n\nDie Sparquote, meine sehr verehrten Damen und Herren, ist in den letzten Wochen rapide angestiegen. Ein Nachfrageproblem gibt es in diesem Lande nicht, es gibt ein Angebotsproblem. Und es gibt ein Unsicherheitsgefühl der Menschen über die eigene wirtschaftliche Zukunft, weil die EU-Staaten im Schuldensumpf versinken.\n\nSoweit das Konjunkturpaket Umverteilungen im öffentlichen Sektor vornimmt wie bei der Kompensation des Gewerbesteuerausfalls der Kommunen, der Umsatzsteuerausfälle der Länder, der Unterkunftskosten der Kommunen und der Stärkung des öffentlichen Gesundheitswesens, handelt es sich um ein Paket von 31 Milliarden Euro. Dieser Betrag erhöht die Schulden des Bundes, verändert jedoch nicht die Schuldenlast des Gesamtstaates und hat überhaupt keine wirtschaftliche Impulsfunktion.\n\n({2})\n\nBleiben noch die Investitionen des Zukunftpakets, seien es staatliche oder private. Nationale Wasserstoffstrategie, 5G-Netzausbau, Quantentechnologie, künstliche Intelligenz, Ladeinfrastruktur und E-Autoprämie, das meiste dieser 25 Milliarden Euro ist Zukunftsmusik. Eine zeitnahe Wirtschaftsbelebung wird davon nicht ausgehen.\n\n({3})\n\nAlles zusammengenommen wird es in 2020 eine Nettoneuverschuldung des Bundes von 218 Milliarden Euro geben und Haftungsrisiken für Garantieerklärungen von vielen Hundert Milliarden Euro.\n\nUnd dann kommt die EU auf die Idee, sie müsse mit einem kreditfinanzierten Wiederaufbaufonds, dem „Next Generation EU“, auf alle staatlichen Hilfspakete den nationalstaatlichen Schuldenorgien noch die Krone aufsetzen. Allein Italien nimmt national mehr als 30 Prozent des BIP an Schulden für Coronahilfe in die Hand. Sie können sich vorstellen, was das für die italienische Schuldenquote bedeutet! Die bei der Kommission angedachten 750 Milliarden Euro sollen zudem in Höhe von 500 Milliarden Euro als zins- und tilgungsfreie Zuwendungen gewährt werden, also als Geschenk. Finanziert werden diese über EU-Emissionen, die durch erhöhte Umlagen der Mitgliedstaaten getilgt werden sollen – vor allem von Deutschland. Die vergleichsweise armen Deutschen – weit hinter Franzosen, Italienern, Spaniern und Griechen – mit der vergleichsweise höchsten Abgabelast, die vergleichsweise spät in eine vergleichsweise niedrige Rente gehen, sollen die vergleichsweise höchste Abfinanzierungsrate tragen, meine Damen und Herren.\n\n({4})\n\nDabei weiß bis heute niemand, wieso es sich gerade um 750 Milliarden Euro handelt und wofür dieses Geld überhaupt verwendet werden soll. Der Verteilungsmaßstab des Bedürftigkeitsschlüssels soll nichts mit der Zahl der Coronakranken zu tun haben, nichts mit der wirtschaftlichen Belastung des Gesundheitswesens zu tun haben und auch nichts mit dem Lockdown zu tun haben, sondern er stützt sich auf die Wirtschaftskraft 2019 – da gab es noch keine Krise – und die Arbeitslosenraten zwischen 2015 und 2019.\n\n({5})\n\nDie Jahrhundertlast soll weder gegen Artikel 311 noch gegen Artikel 122 des AEUV verstoßen; in dem einen Artikel geht es um ein Darlehensaufnahmeverbot der EU, in dem anderen Artikel um EU-Hilfe bei einer asymmetrischen Belastung von Staaten. Beides funktioniert also nicht.\n\n({6})\n\nDie kühne Behauptung aller Euromanen wird die AfD durch das Bundesverfassungsgericht prüfen lassen müssen.\n\nAn Italien sollen 173 Milliarden Euro, an Spanien 140 Milliarden Euro zins- und tilgungsfreie Zuwendungen fließen.\n\n({7})\n\nDas sind die Länder, die jeweils rund 400 Milliarden Euro zinslose Target-Überziehungskredite in Anspruch nehmen, die Deutschland zur Verfügung stellt. Damit finanzieren diese Länder ihre Einkäufe in Deutschland. Wir verhalten uns also so wie der Wirt, der seine Stammgäste ewig anschreiben lässt, bis sie alle Alkoholiker sind und die aufgelaufenen Rechnungen auch deshalb nicht mehr bezahlen können.\n\n({8})\n\nWer Staatsschulden macht, muss auf Teufel komm raus Wirtschaftswachstum generieren, meine Damen und Herren. Das eine zieht das andere als notwendige Bedingung nach sich. Wer das nicht kann oder nicht will, etwa aus ökologischen Gründen – viele wollen aus berechtigten ökologischen Gründen vielleicht sogar gar kein Wirtschaftswachstum –,\n\n({9})\n\nder geht mit seinen Schulden unter. Die EU kann es einfach nicht. Und die nächste Generation kann es schon gar nicht, weil sie kleiner und weil sie technologisch defizitär sein wird. Mit Antifa und Billigabitur ist kein Staat zu machen.\n\n({10})\n\nWas Sie hier also anrichten mit der Abschaffung der Selbstverantwortung der Nationalstaaten für ihr eigenes ökonomisches und finanzielles Wohlergehen, mit dem Euro und der Schuldenkollektivierung, muss zum europäischen Kollaps führen.\n\n({11})\n\nSie führen ihn herbei.\n\n({12})\n\nUnd Sie werden dafür die Rechnung zu bezahlen haben.\n\n({13})"
"1043004","Martin","Sichert","AfD","Member of Parliament","2020-06-29T00:00:00.000Z","https://dip21.bundestag.de/dip21/btp/19/19168.pdf","\n\nHerr Dobrindt, Sie haben gerade ganz viel geredet. Wir sehen jetzt an vielen Stellen im Gesetz, wo Geld ausgegeben wird. Sie haben unter anderem gesagt: Deutschland wird moderner.\n\nSie geben relativ sinnlos ganz viel Geld aus, beispielsweise für Elektromobilität. Sie wird jetzt explizit noch mehr gefördert. Das Institut für Weltwirtschaft hat letzte Woche erklärt, dass die Elektroautos 73 Prozent mehr Emissionen in die Luft schleudern als moderne Dieselfahrzeuge.\n\n({0})\n\nWir sehen: Sie wollen eine Vergemeinschaftung der Schulden in der EU. Sie wollen immer mehr Geld für Europa ausgeben, und Sie geben auch immer mehr Geld der Steuerzahler aus. Auf der anderen Seite sehen wir: Sie lassen die Schwächsten im Land hinten runterfallen. Da möchte ich von Ihnen gerne wissen: Wie passt das zusammen?\n\n({1})\n\nEs steht in dieser Woche auch das Intensivpflege- und Rehabilitationsstärkungsgesetz auf dem Programm. Da droht die Regierung Zehntausenden schwerbehinderten Menschen in diesem Land damit, dass diese Menschen künftig Tausende Euro Zuzahlungen extra leisten müssen, wenn sie weiter zu Hause gepflegt werden wollen. Das Seelenheil vieler dieser Menschen hängt daran, dass sie zu Hause, bei ihren Verwandten, bei ihrer Familie sein können. Sie wollen diese Menschen jetzt künftig ins Heim abschieben, um ein paar Euro einzusparen. Auf der anderen Seite geben Sie Hunderte Milliarden Euro aus. Wie passt das zusammen? Ist in diesem modernen Deutschland, von dem Sie reden, kein Platz mehr für die Schwächsten der Gesellschaft?\n\n({2})"
"1043049","Gottfried","Curio","AfD","Member of Parliament","2020-07-01T00:00:00.000Z","https://dip21.bundestag.de/dip21/btp/19/19169.pdf","\n\nFrau Kanzlerin, die „taz“ druckte wenige Tage vor den Gewaltexzessen in Stuttgart, Polizisten gehörten auf den Abfall, da seien sie unter ihresgleichen. Diese Volksverhetzung, diese Verletzung der Menschenwürde und diesen Angriff auf die Ordnungsmacht des Staates wollten Sie nicht vom Innenminister rechtlich überprüft sehen. Der verantwortliche Dienstherr selbst sollte sich nicht vor seine Leute stellen. Sie wollten eher die Verunglimpfungsfreiheit der Linkspresse geschützt sehen, meinten gar, Derartiges sei wohl legitime Meinungsäußerung.\n\nIst Ihnen klar, dass Sie den Minister an genau dem hindern, wofür Sie ein Netzwerkdurchsetzungsgesetz gemacht haben, das jetzt de facto zur Zensur normaler freier Meinungsäußerung gebraucht wird, während bei der „taz“ wirklich Hassrede zu unterbinden gewesen wäre? Sie verhindern hier ein politisches Zeichen gegen die, die unseren Sicherheitskräften hinterrücks in den Rücken treten.\n\nIch frage Sie: Wie kommen Sie dazu, den Innenminister davon abzuhalten, diese Hetze gegen die Leute, die für unseren Staat den Kopf hinhalten, durch Rechtsprechung unterbinden zu lassen? Reichen Ihnen 19 verletzte Polizisten in Stuttgart nicht?\n\n({0})"
"1043052","Gottfried","Curio","AfD","Member of Parliament","2020-07-01T00:00:00.000Z","https://dip21.bundestag.de/dip21/btp/19/19169.pdf","\n\nFrau Kanzlerin, Sie bringen den Innenminister von seiner Klageabsicht de facto ab: Er kommt mit seiner Meinung zu Ihrem Gespräch und kommt mit Ihrer Meinung wieder heraus. Ist es, weil Sie nach dem Prinzip regieren: „Hauptsache, die Linkspresse steht zu uns“, weil Sie das seit Jahren brauchen für Ihre Linksverschiebung der Union? Früher wäre doch so eine Ferne zu den eigenen Sicherheitskräften gar nicht möglich gewesen. Sehen Sie eigentlich überhaupt, dass Sie mit alldem wie auch mit der Verhinderung einer gebotenen Strafanzeige die Union bis zur Unkenntlichkeit nach links verschoben haben und die Interessen unseres Landes verraten?\n\n({0})\n\n– Linksextremistisch, ja. Danke."
