id,firstname,lastname,faction,position,date, url,speech
"1040802","Jürgen","Braun","AfD","Member of Parliament","2020-05-15T00:00:00.000Z","https://dip21.bundestag.de/dip21/btp/19/19161.pdf","\n\nHerr Präsident! Liebe Kollegen! Meine sehr verehrten Damen und Herren! Herr Bundesaußenminister, das waren mal wieder schöne Worte; diese hören wir sehr häufig von Ihnen. Sie haben angeprangert, dass in anderen Ländern angebliche Fehlinformationen unter Strafe gestellt werden. Könnte es nicht sein, dass wir uns auch mal in unserem Land damit beschäftigen sollten,\n\n({0})\n\nmit dem NetzDG?\n\n({1})\n\nSie sind verantwortlich gewesen für das Netzwerkdurchsetzungsgesetz, ein Internetzensurgesetz in schlimmster Weise, wo es um die Löschung von anderen Meinungen oder angeblichen Fehlinformationen geht. Aber dazu kommen wir noch.\n\nMichael Ignatieff, Rektor der Soros-Universität, der wichtigste Vordenker von George Soros, sagte in der Schweizer „Weltwoche“:\n\nDer Nationalstaat bleibt die einzig legitime Quelle politischer Autorität in der Welt. Die Pandemie verstärkt die Macht des Nationalstaats, weil er die einzige glaubwürdige Antwort gibt auf die Frage: „Wer wird mich jetzt beschützen?“.\n\nDas könnte von der AfD sein, ist es aber nicht. Merken Sie eigentlich, dass ausgerechnet der linksliberale Michael Ignatieff, der wichtigste Soros-Vordenker, inhaltlich längst weiter ist als Sie alle von den Altparteien hier?\n\n({2})\n\nHierzulande dreht sich alles um Corona. Wir stoppen das Land um jeden Preis. Auch die humanitäre Hilfe leidet. Interessiert Corona die Menschen in Afrika? Eher nicht so sehr. In Ostafrika sind es die Heuschrecken. Dort fressen derzeit gigantische Schwärme alles kahl. Chemische Mittel, die helfen können, sind von den Grünen jahrzehntelang bekämpft worden. Grünes Jammern über Schäden durch Heuschreckenplagen in Afrika ist deshalb pure Heuchelei.\n\n({3})\n\nCorona verdeckt die große Seuchenproblematik weltweit. Ein Beispiel: Malaria. Malaria ist gefährlicher als das Coronavirus. Wer nicht stirbt, wird – in vielen Ländern Afrikas oder auch in Indien – dauerhaft zum Pflegefall. Gegen die Mücken, die die Krankheit übertragen, müsste stärker mit DDT gearbeitet werden.\n\n({4})\n\nAuch wenn das für grünliche Europäer ein Tabuthema ist: DDT verfügt über die beste Wirkung. Jahrzehntelange grüne Kampagnen gegen DDT haben in Afrika und in Indien verheerende Folgen gehabt, haben viele Menschenleben gekostet.\n\nIn einigen Staaten der Welt werden abweichende Meinungen zum Umgang mit dem Coronavirus bekämpft und ausgeschaltet. Dann kommt die Internetpolizei in der Manier eines George Orwell – Twitter, Facebook, YouTube usw.\n\n({5})\n\nSusan Wojcicki, der Chefin von YouTube in Europa, rutschte in einem Interview mit CNN eine entlarvende Formulierung heraus. Sie sagte sinngemäß, dass sie auch wissenschaftliche Meinungen löschen lasse, wenn diese im Gegensatz zur Meinung der WHO stünden. Diese WHO ist keine rein medizinische Einrichtung. Sie ist eine politische Organisation. An ihrer Spitze steht ein äthiopischer Kommunist, und der macht nur zu gerne seinen Kotau in Peking.\n\n({6})\n\nWohlgemerkt, die YouTube-Chefin lässt abweichende Meinungen löschen. Andere Meinungen und Tatsachen löschen lassen – das hätte sich George Orwell nicht besser ausdenken können. Das Orwell’sche Wahrheitsministerium finden wir auch hierzulande. Seine fragwürdigen Helfer sehen sich als Faktenchecker oder Faktenfinder, sie nennen sich „Correctiv“ und tauchen bei der Tagesschau und im ZDF auf. Doch sie vernebeln die Fakten. Sie sind Verschwörungspraktiker.\n\n({7})\n\nMedien, die nicht ausgewogen informieren, Medien, die Selbstzensur üben, Medien, die wie der Spiegel-Verlag und „Die Zeit“ Spenden der Bill-und-Melinda-Gates-Stiftung erhalten haben, und zwar in Millionenhöhe, solche Medien sind Verschwörungspraktiker.\n\n({8})\n\nWas würden die Grünlinken sagen, wenn in Ungarn oder Polen das Staatsfernsehen die Vertreter der größten Oppositionspartei über Monate hinweg nicht ins Studio einlädt?\n\n({9})\n\nSchnell hieße es, das Staatsfernsehen sei gleichgeschaltet und diene nur der Regierung. Die EU würde Verfahren gegen diese Staaten eröffnen, wie so häufig. In Deutschland sind Regierung und Medien aber auch noch stolz darauf, nicht ausgewogen zu berichten.\n\n({10})\n\nPanik herrscht seit zwei Monaten bei vielen Menschen in Deutschland. Die Bundesregierung hat sie verbreitet. Das Innenministerium hat die Zahl von über 1 Million Coronatoten allein in Deutschland in diesem Jahr in die Welt gesetzt. Christliche Gottesdienste zu Ostern: verboten.\n\n({11})\n\n– Selbstverständlich, in einzelnen Bundesländern sehr wohl. – Treffen von Verwandten: verboten; Treffen in der Familie: häufig verboten; die erkrankte Mutter berühren: verboten; die Hand eines Sterbenden halten: verboten; Besuch von Beerdigungen: verboten;\n\n({12})\n\nReisen innerhalb Deutschlands: verboten; Eis essen: verboten; sitzen auf einer Parkbank: verboten.\n\n({13})\n\nStaatsrechtler hierzulande warnen einhellig vor der Verfassungswidrigkeit beschlossener Coronamaßnahmen in diversen Bundesländern: Professor Klaus Gärditz, Professor Florian Meinel, Professor Thorsten Kingreen, Professor Pierre Thielbörger, Professor Christoph Möllers, Professor Dietrich Murswiek – um nur wenige Namen zu nennen – sowie die ehemaligen Verfassungsrichter Professor Udo Di Fabio und Professor Hans-Jürgen Papier. Sie alle beklagen die Verletzung von Grund- und Menschenrechten nicht in irgendwelchen autokratischen Staaten, sondern hier in Deutschland.\n\n({14})\n\nIn anderen Ländern begleitet eine kritische Öffentlichkeit das Handeln der Regierung. Bei uns begleiten unkritische Medien eine grüne Kanzlerin, die pro forma eine CDU-Regierung anführt.\n\n({15})\n\nARD, ZDF und die anderen grün-linken Mainstream-Medien hofieren diese Bundesregierung, es sei denn, die Grünen fangen an zu meckern. Die kleinste Oppositionsfraktion bestimmt über die Medien das Meinungsklima in diesem Land.\n\n({16})\n\nIch zitiere das vielbeachtete interne Papier des Bundesinnenministeriums:\n\nDie beobachtbaren Wirkungen und Auswirkungen von COVID-19 lassen keine ausreichende Evidenz dafür erkennen, dass es sich ... um mehr als um einen Fehlalarm handelt. Durch den neuen Virus bestand vermutlich zu keinem Zeitpunkt eine über das Normalmaß hinausgehende Gefahr für die Bevölkerung ...\n\n({17})\n\nOberregierungsrat Stephan Kohn hat mit diesem Papier für die Wahrheit seine Karriere geopfert. Der Europarat hat beschlossen, mutige Menschen wie ihn zu schützen: Resolution 2300 letztes Jahr, auch mit den Stimmen von CDU und SPD beschlossen. Stephan Kohn ist ein Held für Menschenrechte in Deutschland.\n\n({18})"
"1040817","Jürgen","Braun","AfD","Member of Parliament","2020-05-15T00:00:00.000Z","https://dip21.bundestag.de/dip21/btp/19/19161.pdf","\n\nVielen Dank, Herr Präsident. – Herr Kollege Patzelt, ich schätze Sie menschlich sehr. Ich bitte Sie, doch zur Kenntnis zu nehmen, dass ich vielerlei Kritik an der Bundeskanzlerin Angela Merkel und auch vielerlei Kritik an der Bundesregierung habe, dass ich aber nicht von einer „Scheinregierung“ gesprochen habe. Das müssen Sie falsch gehört haben."
"1040831","Thomas","Ehrhorn","AfD","Member of Parliament","2020-05-15T00:00:00.000Z","https://dip21.bundestag.de/dip21/btp/19/19161.pdf","\n\nVielen Dank, Herr Kollege, für die Möglichkeit, hier diese Frage zu stellen. – Herr Kollege, in den letzten Tagen habe ich viele Reden im Zusammenhang mit der Coronakrise gehört, und in vielen lief es eigentlich immer auf denselben Tenor hinaus, nämlich darauf, dass wir in dieser Situation verpflichtet sind, solidarisch zu handeln, das heißt im Klartext, auch einen Teil der Schulden, die in Europa entstanden sind, mit zu bezahlen. Das, was ich jetzt hier in dieser Debatte höre, geht noch einen Schritt weiter: dass wir auch bezüglich der ganzen restlichen Welt solidarisch sein müssen. Das ist natürlich auch immer mit Geldzahlungen verbunden.\n\nIch möchte Ihnen eine Frage stellen. Sie wissen ja, dass dem deutschen Steuerzahler von einem verdienten Euro nicht mal 48 Cent bleiben, weil wir nämlich Steuerzahlerweltmeister sind. Deswegen frage ich Sie, wo für Sie ganz persönlich vielleicht die Obergrenze der steuerlichen Belastung liegen würde, wo auch Sie sagen würden: Tut uns leid. Wir können unsere eigenen Leute nicht immer weiter belasten, auch wenn wir glauben, aus humanitären Gründen die Welt retten zu müssen.\n\n({0})\n\nDas ist eigentlich das Einzige, was ich von Ihnen gern wissen würde.\n\nDanke sehr."
"1040833","Wolfgang","Wiehle","AfD","Member of Parliament","2020-05-15T00:00:00.000Z","https://dip21.bundestag.de/dip21/btp/19/19161.pdf","\n\nSehr geehrter Herr Präsident! Kolleginnen und Kollegen! 2 Millionen Führerscheine kassiert, 200 000 Existenzen zerstört – nein, ich spreche nicht von den Folgen des Shutdown.\n\n({0})\n\nDiese Zahlen gehören zu einer Petition, die in gut zwei Wochen fast 140 000 Menschen unterschrieben haben. Es geht um den neuen Bußgeldkatalog für den Straßenverkehr.\n\n({1})\n\nDen müssen wir hier im Bundestag endlich besprechen. Wie man in den Nachrichten hört, hat ja schon die Ankündigung dieser Debatte Wirkung erzielt.\n\n({2})\n\nIm Schatten von Corona, unter dem Druck aus dem Bundesrat und vielleicht auch im Überschwang der Regierungsmacht hat das Verkehrsministerium viele Bußen drastisch verschärft.\n\n({3})\n\nEin Fahrverbot ist die angemessene Konsequenz für das Verhalten rücksichtsloser Raser. Seit Ende April gibt es das innerorts aber schon bei 21 km/h zu viel; vorher lag die Grenze bei 31 km/h.\n\n({4})\n\nImmer mehr Städte und Gemeinden ordnen auf breiten Hauptstraßen Tempo 30 an, je nach Wochentag und Uhrzeit. In so einer Tempofalle ist eine Überschreitung um 20 km/h schnell passiert. Ein Fehler beim Blick auf die Uhr, und der Schein ist weg.\n\n({5})\n\nFür den Handwerker mit seinem Transporter, für den Taxifahrer, für den Mitarbeiter im Außendienst heißt das schnell: Der Job ist weg. Alleinerziehende Mütter, die jeden Tag vor der Arbeit die Kinder zu Kita und Schule bringen, stehen ohne Auto schnell vor der Verzweiflung.\n\n({6})\n\nDiese Beispiele zeigen: Der neue Bußgeldkatalog ist lebensfremd und ganz bestimmt nicht verhältnismäßig.\n\n({7})\n\nViele Betroffene werden vor Gericht Einspruch erheben. Mit etwas Glück entkommen sie dem Fahrverbot – um den Preis des doppelten oder dreifachen Bußgelds. Der Preis für die Amtsgerichte wird eine gewaltige Überlastung sein. Rechtsanwälte und Rechtsschutzversicherungen freuen sich über neue Geschäfte.\n\nDen Führerschein verlieren müsste aber, wer vorsätzlich mit seinem Auto eine Straße blockiert, etwa für eine Hochzeitsfeier. Warum wird das nicht geregelt?\n\n({8})\n\nNein, es ist nicht alles falsch am neuen Bußgeldkatalog. Wer Rettungsgassen auf der Autobahn nicht bildet oder sie missbraucht, gehört hart bestraft. Wer beim Rechtsabbiegen mit dem Lkw zu schnell fährt und Radler und Fußgänger gefährdet, gehört bestraft. Die AfD-Fraktion beantragt: Der Rest des Katalogs muss aber revidiert werden. Dazu, meine Damen und Herren, soll dieses Hohe Haus die Regierung ausdrücklich auffordern und so auch ein klares Signal an den Bundesrat senden.\n\n({9})"
"1040843","Karsten","Hilse","AfD","Member of Parliament","2020-05-15T00:00:00.000Z","https://dip21.bundestag.de/dip21/btp/19/19161.pdf","\n\nVielen Dank, Herr Präsident, dass sie die Kurzintervention zulassen. – Also, Sie können in Zukunft durchaus eine Zwischenfrage zulassen: Wir beißen nicht.\n\n({0})\n\nIch war über 30 Jahre Polizist; ich habe Tausende Unfälle aufgenommen. Ich wollte Sie eigentlich nur darauf hinweisen: Für gewöhnlich wird der § 3 Absatz 1, also unangemessene Geschwindigkeit, so gut wie immer als Unfallursache angegeben. Unterhalten Sie sich bitte mit Polizisten, die Verkehrsunfälle für gewöhnlich aufnehmen.\n\n({1})\n\nDas wird so gut wie immer quasi mit reingeschrieben. Also diese Zahl, die Sie hier angeben, ist in diesem Zusammenhang nicht relevant.\n\n({2})"
"1040853","Thomas","Ehrhorn","AfD","Member of Parliament","2020-05-15T00:00:00.000Z","https://dip21.bundestag.de/dip21/btp/19/19161.pdf","\n\nHerr Präsident! Meine Damen und Herren! Und vor allen Dingen: Liebe Autofahrer! Im Schatten von Corona hat offenkundig noch ein anderes Virus den Weg in unsere Gesellschaft geschafft, nämlich die härteste Verschärfung des Bußgeldkatalogs, mit dem man jemals den deutschen Autofahrer versucht hat zu drangsalieren, und das in einer Zeit, in der seit Jahren die Verkehrsopferzahlen immer weiter zurückgehen. Im Jahr 2019 waren diese Zahlen so niedrig wie niemals zuvor seit Beginn der Aufzeichnungen.\n\n({0})\n\nAber wenn es darum geht, dass grüne Ideologie die deutsche Politik dominiert, dann geht es auch um etwas ganz anderes. Es geht nicht um mehr Sicherheit, sondern es geht um den immerwährenden, nie enden wollenden Kampf gegen das Automobil.\n\n({1})\n\nEs geht darum, dass der deutsche Autofahrer, wenn er die Frechheit besitzt, sich trotzdem ans Steuer seines Fahrzeugs zu setzen,\n\n({2})\n\nimmer die kleine Stimme im Hintergrund hören soll. Letzten Endes ist es die Stimme der kleinen verrückten Greta, die ihm ins Ohr säuselt: How dare you? Wie kannst du es wagen?\n\n({3})\n\nOffenkundig ist nicht nur deine Oma, offenkundig bist auch du eine Umweltsau,\n\n({4})\n\nund das werden wir dir niemals durchgehen lassen! Warte es ab: Wir kriegen dich!\n\nWir kriegen dich vielleicht schon heute Abend auf dem Weg nach Hause auf der Landstraße, auf der gefühlte 20-mal hintereinander die Geschwindigkeit zwischen 70 und 100 km/h wechselt.\n\n({5})\n\nEin Moment der Unaufmerksamkeit, und du siehst diesen kleinen roten Blitz. Dann weißt du, dass du für den nächsten Monat nicht mehr weißt, wie du zur Arbeit kommen sollst.\n\n({6})\n\nUnd wenn wir dich da nicht kriegen, dann kriegen wir dich an der nächsten Ortseinfahrt, wenn du vielleicht gerade dem neusten Hit im Autoradio zuhörst, ein bisschen unaufmerksam\n\n({7})\n\nnicht gleich rechtzeitig abbremst, dann siehst du den kleinen roten Blitz und dann weißt du, dass sich in diesem Moment gerade der gesamte Nettoverdienst dieses Tages in deiner Tasche in Luft aufgelöst hat.\n\n({8})\n\nUnd wenn auch das nicht reicht, dann haben wir noch ganz andere Möglichkeiten: Wir machen aus jeder verdammten grünen Welle in deiner Stadt eine rote Welle. Wir sorgen dafür, dass du innerhalb von 3 Kilometern 15-mal anhalten musst.\n\n({9})\n\nWir haben noch einen ganz neuen Trick in der Westentasche: Wir sorgen nämlich dafür, dass die Tempo-30-Zonen gerade wie Pilze aus dem Boden sprießen. Und wenn das nicht reicht, dann wenden wir uns an die Deutsche Umwelthilfe, die sorgt dann nämlich dafür, dass euer fast neuwertiger Diesel innerhalb einer Nacht nur noch die Hälfte wert ist. Jawohl, so läuft das Spiel!\n\n({10})\n\nWir werden sogar mittelfristig dafür sorgen, dass in Zukunft in Deutschland, in unserer Autofahrernation überhaupt kein vernünftiges Auto mit Verbrennungsmotor mehr gebaut werden kann. Und wenn dann die gesamte Autoindustrie den Bach runtergeht und die Zulieferindustrie gleich mit\n\n({11})\n\nund wenn das eure Arbeitsplätze und euren Wohlstand kostet: So what? Wen interessiert’s?\n\n({12})\n\nNein, meine Damen und Herren, dann könnt ihr auch alle gerne auf die Straße rennen und irgendwas Sinnloses rufen wie: Wir sind das Volk! Wir sind das Volk! – Aber wir sind der Staat, und wir haben die Macht. Und wenn ihr nicht freiwillig ablasst vom Autofahren, dann werden wir euch zeigen, wo der grüne Hammer hängt!\n\n({13})\n\nDenn wir können mit euch alles machen:\n\n({14})\n\nWir können euch drangsalieren, wir können euch schikanieren, wir können eure Führerscheine einbehalten, und wir können euch abkassieren.\n\n({15})\n\nWir können aus freien Bürgern grüne Untertanen machen.\n\n({16})\n\nLiebe Autofahrer, freut euch schon mal auf die nächste grüne Regierungsbeteiligung!\n\nVielen Dank.\n\n({17})"
"1040875","Ulrike","Schielke-Ziesing","AfD","Member of Parliament","2020-05-15T00:00:00.000Z","https://dip21.bundestag.de/dip21/btp/19/19161.pdf","\n\nSehr geehrte Damen und Herren! Sehr geehrte Frau Präsidentin! Verehrte Bürger! Lange haben wir Abgeordnete auf diesen Moment gewartet. Wir debattieren doch heute tatsächlich den Gesetzentwurf zur Grundrente. 14 Monate wurde sehr viel Energie in die Bewerbung der Grundrente investiert, mindestens ebenso viel Energie, um den Koalitionspartner endlich zu überzeugen. In der Vorlage heißt es, dass die Grundrente die Lebensleistung honorieren und vor Altersarmut schützen soll.\n\nAn dieser Stelle ist es angebracht, zu fragen, warum Versicherte, die mindestens 33 Jahre lang gearbeitet und in die Rentenversicherung eingezahlt haben, letztendlich eine so niedrige Rente erhalten, die nun bezuschusst werden muss. Wie kommt so etwas zustande?\n\nEntscheidend für die erschreckend niedrigen Renten sind doch die Reformen der letzten Jahre, beispielsweise 1998 die Einführung des demografischen Faktors und allen voran 2001 die Schröder-Riester-Reform. Erinnert sei auch daran, dass sich erst mit einer SPD-geführten Regierung der Niedriglohnsektor in Deutschland so ausweiten konnte. Die Koalitionsparteien haben die geringen Renten zu verantworten und feiern sich jetzt dafür, dass sie durch die Grundrente ein wenig an den Zahlbeträgen schrauben. Großartig!\n\nSeit Monaten weisen Experten von der Bertelsmann-Stiftung bis hin zu den Arbeitgeberverbänden, von der Deutschen Rentenversicherung bis hin zur OECD auf gravierende Fehlstellen hin. Die Grundrente ist nicht zielgenau. Sie ist sozial ungerecht, viel zu teuer und dabei weitgehend wirkungslos.\n\n({0})\n\nJeder weiß, dass diejenigen, die besonders auf Hilfe angewiesen sind, selten die vorgeschriebenen Versicherungsjahre erreichen. Die Grundrente ist verfassungsrechtlich bedenklich wegen der Missachtung des allgemeinen Gleichheitsgrundsatzes. Außerdem wird das Äquivalenzprinzip nicht eingehalten.\n\n({1})\n\nWie erklären Sie, Herr Heil, dass Versicherte die gleiche Beitragssumme einzahlen, aber nicht die gleiche Leistung von der Rentenversicherung erhalten? Herr Heil, damit schaffen Sie doch neue Ungerechtigkeiten innerhalb der Versichertengemeinschaft.\n\n({2})\n\nOrganisatorisch ist die Grundrente für die Rentenversicherung in dem Zeitrahmen nicht umsetzbar. Hierbei fehlt das nötige IT-System zur Einkommensabfrage bei den Finanzämtern. Es fehlt vor allem an Personal. Millionen von Akten müssen händisch geprüft werden. Die Rentenversicherung benötigt rund 3 400 zusätzliche Angestellte, um die Prüfung der Bestandsrenten zu bewältigen. Für den laufenden Betrieb, insbesondere wegen der regelmäßigen Einkommensprüfung, müssen über 1 600 Angestellte für die Grundrente abgestellt werden. Wo wollen Sie diese neuen Angestellten hernehmen? Die Rentenversicherung hat bereits signalisiert, dass ein Beginn der Grundrente zum 1. Januar 2021 technisch nicht umsetzbar sein wird – und das war noch vor Corona.\n\nUm zielgenau den wirklich armen Rentnern zu helfen, ist eine Freibetragslösung für die Rente bei der Anrechnung auf die Grundsicherung im Alter der bessere Ansatz.\n\n({3})\n\nSeit Februar 2019 liegt Ihnen dafür unser Antrag zur Umsetzung vor, den wir gestern hier abschließend im Plenum behandelt haben. Der Umsetzungsaufwand wäre weitaus geringer und der Nutzen gleich oder sogar noch größer als bei der Grundrente.\n\n({4})\n\nFerner wäre diese Option verfassungskonform und wahrt noch das Äquivalenzprinzip in der gesetzlichen Rentenversicherung.\n\n({5})\n\nHerr Minister Heil, es ist äußerst lobenswert, dass Sie unseren Vorschlag teilweise mit in Ihren Gesetzentwurf aufgenommen haben.\n\n({6})\n\nNur leider schränken Sie hier den Kreis der Berechtigten ein, indem Sie als Zugangsvoraussetzung 35 Versicherungsjahre definieren.\n\n({7})\n\nAlle anderen Rentner, auch die Erwerbsunfähigkeitsrentner, fallen wieder durch den Rost, und das ist nicht gerecht.\n\n({8})\n\nKommen wir zu den Kosten der Grundrente. Wie man aktuell liest, wurde Herr Heil seitens der CDU daran erinnert, dass es keine zweite und dritte Lesung zur Grundrente geben wird, wenn die Finanzierung nicht geregelt ist, und das ist auch gut so. Der Finanzierungsbedarf wird im Jahr 2021 mit rund 1,3 Milliarden Euro angegeben. Positiv ist, dass klar geregelt wird, dass diese Kosten nicht von der Versichertengemeinschaft getragen werden, sondern aus Steuermitteln gezahlt werden sollen. Aber woher sollen diese Steuermittel kommen? Schon vor Corona stand die Finanzierung auf sehr wackeligen Füßen. Minister Scholz wollte eine Finanztransaktionsteuer, die anderen EU-Länder nicht.\n\nWie sieht es jetzt in der Coronakrise aus? Um die wirtschaftlichen und sozialen Auswirkungen der Krise abzufedern, haben wir als Parlament gerade einen Nachtragshaushalt in Höhe von rund 156 Milliarden Euro beschlossen. Die Bundesanstalt für Arbeit wird mit ihren Rücklagen nicht auskommen. Es ist sicher, dass ein weiterer Nachtragshaushalt kommen wird. Die Einnahmen des Staates werden in den nächsten Jahren weitaus geringer ausfallen als geplant. Allein dem Bund werden in diesem Jahr Steuereinnahmen in Höhe von rund 40 Milliarden Euro fehlen.\n\nAuch in der Renten-, Kranken- und Pflegeversicherung werden Einnahmen wegbrechen, die dann vom Bund bezuschusst werden müssen.\n\n({9})\n\nWie soll denn bitte die Grundrente finanziert werden? Trotzdem setzen Sie, Herr Heil, alles daran, diese Grundrente durchzusetzen. Hier fragt man sich dann schon, warum Sie Ihre Prioritäten gerade so setzen.\n\n({10})\n\nKann es etwa damit zu tun haben, dass im nächsten Jahr die Bundestagswahlen stattfinden und die Gruppe der Rentner eine nicht zu unterschätzende Wählergruppe ist?\n\n({11})\n\nKurz vor Wahlen Wahlgeschenke zu verteilen, das machen alle Arbeitsminister gerne. In diesem Falle wird es für die Wähler jedoch eine Riesenenttäuschung werden, wenn sich die Grundrente im Portemonnaie nicht wirklich bemerkbar macht.\n\n({12})\n\nGestern verkündete Minister Scholz das größte Steuerloch aller Zeiten. Bis 2024 soll sich die Summe der Steuerausfälle auf unfassbare 315,9 Milliarden Euro summieren, davon rund 171 Milliarden Euro beim Bund. Trotzdem soll laut Scholz kein einziges Projekt gekippt werden. Wo der Steuerzahlerbund mahnte, alle Staatsausgaben zu überprüfen, sagt Minister Scholz wörtlich: „Wir können uns das, was wir uns vorgenommen haben, weiter leisten.“ – Natürlich bezog er sich dabei auch auf die Grundrente. Es ist eigentlich nur noch unfassbar, wie hier Haushaltspolitik gemacht wird\n\n({13})\n\nund wie weit Anspruch und Wirklichkeit auseinandergehen.\n\nBei der SPD sind Hopfen und Malz verloren. Ich möchte hier aber an die Vernunft der Abgeordneten der CDU/CSU-Fraktion appellieren. Stoppen Sie diese irrsinnige Grundrente! Lassen Sie hier keine weitere, zweite Lesung im Bundestag zu.\n\nVielen Dank.\n\n({14})"
