id,firstname,lastname,faction,position,date, url,speech
"1053650","Armin Paulus","Hampel","AfD","Member of Parliament","2021-01-27T00:00:00.000Z","https://dip21.bundestag.de/dip21/btp/19/19205.pdf","\n\nIch wollte noch warten, Frau Präsidentin, bis die Frau Bundeskanzlerin gegangen ist; sie geht ja sonst immer, wenn wir reden. Aber ich freue mich, wenn Sie heute dableiben, Frau Bundeskanzlerin.\n\nFrau Präsidentin! Meine sehr verehrten Damen und Herren! Eine Dame besucht nach dem ersten Lockdown in Niedersachsen ihre Mutter in einem Pflegeheim. Die Mutter begrüßt sie mit den Worten: Du kommst allein. Sind alle anderen tot? – Was für eine Angst muss diese alte Dame gehabt haben, was für eine Vorstellung von Corona – als ob die Menschen zu Tausenden in den Straßen hier in Deutschland sterben würden! Und diese Angstpolitik – Frau Bundeskanzlerin, Ihre Regierung ist dafür verantwortlich – setzen Sie konsequent seit Februar/März vergangenen Jahres durch. Anfangs war es noch eine Krankheit – laut Herrn Spahn –, die uns nicht betrifft, und dann wurde aufgedreht, mit einer Angstpolitik ohnegleichen.\n\nEine vernünftige Bundesregierung hat nicht Angst zu schüren, sondern sie hat den Menschen Hoffnung zu machen,\n\n({0})\n\nund sie hat ihnen zu sagen: Ja, wir haben eine Krankheit, die ist neu in unserem Lande, aber die gute Nachricht ist: 85 Prozent der Infizierten sind von dieser Krankheit gar nicht oder nur leicht bedroht. 15 Prozent der Infizierten sind gefährdet, ein geringer Teil von ihnen an Leib und Leben. – Diese Nachricht hätte als Allererstes transportiert werden müssen.\n\n({1})\n\nStattdessen ignorieren Sie genau diese 15 Prozent, bei denen von Anfang an – und kein Experte hat das bisher bestritten – klar war: Es sind Menschen, wie wir jetzt wissen, über 80 – damals sagte man „60 plus“. Die „Bild“-Zeitung mag ja nicht immer die Wahrheit schreiben, aber in Zahlen sind sie ganz gut. 88 Prozent aller Verstorbenen des vergangenen Jahres waren 80 Jahre und älter, 25 Prozent über 90 Jahre. Das sind die Menschen, die bei uns in den Alten- und Pflegeheimen sitzen. Das ist die Generation, wie es der Kollege in der „Bild“-Zeitung richtig beschrieben hat, zu der die Trümmerfrauen und Heimkehrer der Nachkriegszeit gehören, die dieses Land aufgebaut haben\n\n({2})\n\nund die Sie, Frau Merkel, seit zehn Monaten ununterbrochen im Stich lassen und alleinelassen. Das sind die, von denen die jungen Grünen und die Jungsozialisten sagen: Das ist ja die Nazigeneration, da ist es nicht so schlimm.\n\n({3})\n\n– Gucken Sie mal in Ihren eigenen Reihen nach! Da finden Sie diese Stimmen, jawohl!\n\n({4})\n\nDiese alten Menschen haben Sie im Stich gelassen. Und der Punkt ist: Seit zehn Monaten kriegen wir es nicht in den Griff, in diesen Alten- und Pflegeheimen eine professionelle Schutzmaßnahme durchzuführen. Dabei ist es ganz einfach: indem Sie das Personal und auch die alten Menschen rundum schützen und vor einer Erkrankung bewahren. Das lässt sich organisieren.\n\nNeuerdings will das die Bundesverteidigungsministerin übernehmen, mit bisher 5 000 Soldaten – angedacht sind 20 000 –, beruft sich aber heute im ZDF-Frühstücksfernsehen darauf: Da müssten erst die Verfassungsbedenken ausgeräumt werden, die Bundeswehr könne nur angefordert werden.\n\n({5})\n\nMeine Damen und Herren Sozialdemokraten, da kann ich Ihnen sagen: Bei der Hochwasserkatastrophe in Hamburg, da war ein Innensenator Helmut Schmidt, der hat die Bundeswehr nicht angefordert, der hat sie eingesetzt.\n\n({6})\n\nUnd nebenbei: Er hat auch noch alliierte Besatzungssoldaten kommandiert.\n\n({7})\n\nDanach hat er sich das Plazet geholt, das die verfassungsmäßige Ordnung herstellte. So reagiert man im Krisen- und Katastrophenfall,\n\n({8})\n\nund nicht so kleckerweise, wie die Bundesregierung es tut.\n\nEs kommt noch was hinzu: Seit dem März des vergangenen Jahres werden ernstzunehmende Wissenschaftler, die fortlaufend und immer wieder Kritik an den zweifelhaften Praktiken des RKI und anderer geäußert haben, bewusst ausgegrenzt – nicht nur das: Sie werden ignoriert, sie werden lächerlich gemacht, teilweise sogar in ihren Berufen bedrängt –, weil sie darauf hinweisen, was jetzt, letzte Woche, die WHO gesagt hat – das RKI hat übrigens noch gar nicht reagiert –: dass der PCR-Test eben keine fundierte Grundlage für die Feststellung einer Erkrankung bildet, also die Zahlen, die wir schon rückwirkend korrigieren müssen, nicht stimmen können. Sie seien zu hoch, weil dieser Test nur mit einem weiteren Test und einer ärztlichen Diagnose funktionieren könne. Wir brauchen zehn, elf Monate dafür, um das in unseren wissenschaftlichen Kreisen überhaupt erst mal zu erwähnen. Diskutiert wird es selten, und akzeptiert wird es gar nicht.\n\n({9})\n\n– Reden Sie mit der WHO, Herr Kollege! Ich habe das nicht gesagt; das hat die WHO letzte Woche gesagt. Das können Sie in ihren Verlautbarungen nachlesen.\n\n({10})\n\nWas wir gemacht haben, ist: Wir haben einen Impferreger geschaffen. Und was machen wir jetzt? Die Tabletten, die Donald Trump in Amerika geheilt haben, muss jetzt die Bundesregierung bestellen.\n\nDiese Bundesregierung, meine Damen und Herren, hat auf der ganzen Ebene, in vielen Kritikpunkten, die ich hier noch anführen könnte, versagt.\n\n({11})\n\nFrau Merkel, alle Mitglieder Ihrer Bundesregierung müssen die Konsequenzen aus diesem völligen Versagen der deutschen Politik ziehen und zurücktreten.\n\n({12})\n\nIch danke Ihnen.\n\n({13})"
"1053676","Tobias Matthias","Peterka","AfD","Member of Parliament","2021-01-27T00:00:00.000Z","https://dip21.bundestag.de/dip21/btp/19/19205.pdf","\n\nFrau Präsidentin! Sehr geehrte Kollegen! Das geistige Eigentum ist in der Tat eine der wichtigsten Stützen der deutschen Wirtschaft. Rechtsdogmatisch haben wir damals noch einmal die Kurve gekriegt und die komplizierte Konstruktion aus gewerblichem Rechtsschutz und Urheberrecht in sinnvolle Gesetze überführt; in anderen Rechtskreisen lief das etwas pragmatischer. Aber trotz dieser spitzfindigen Startschwierigkeiten hat sich Deutschland in den letzten 150 Jahren zu einer der führenden Nationen bei den Patentanmeldungen entwickelt, gestützt von solider und unabhängiger Gerichtsbarkeit, welche übrigens von Beginn an ein Markenzeichen des 1871 gegründeten modernen deutschen Nationalstaats war. Leider ein – zumindest bisher – verpasstes Jubiläum in 2021.\n\n({0})\n\n– Dass Sie da lachen, ist mir klar.Zum Gesetzentwurf: Erfreulich ist, dass die ganze Richtung zumindest auf den ersten Blick auf die Glättung von Unstimmigkeiten im Rechtsstreit abzielt – dies bei einem meiner Meinung nach fast gelungenen Interessenausgleich zwischen Rechteinhaber und potenziellem Verletzer.\n\nDas Grundproblem bei Patentsachen ist schon immer gewesen, dass es sehr empfehlenswert ist, dass das entscheidende Gericht zumindest einige Kenntnisse über die technischen Grundlagen besitzt. Für das Verletzungsverfahren wurde anscheinend a priori entschieden, dass die reguläre Zivilgerichtsbarkeit dies durch motivierte Richter oder eingearbeitete Spruchkammern im Ganzen zu erreichen hat.\n\nFür die Nichtigkeitsklage wurde aber folgerichtig recht bald das Bundespatentgericht eingeführt – auch wenn der generelle Weg über Spezialgerichte meiner Meinung nach von Beginn an besser gewesen wäre, allemal bei dem technischen Stand heutzutage und übrigens auch in höheren Instanzen.\n\nDie Straffung der Nichtigkeitsklage, die hier versucht wird, ist aber zumindest ein erster guter Schritt. Denn was macht der Beklagte im Verletzungsverfahren – es wurde schon angesprochen – und vor allem oft nur zur Verzögerung? Er reicht Nichtigkeitsklage beim Bundespatentgericht ein. Wo kein Patent, da keine Verletzung. Jahrelange Hängepartien können die Folge sein. Der baldigste Hinweisbeschluss des Bundespatentgerichts an das ordentliche Gericht, ob denn an diesem Manöver überhaupt etwas dran ist, ob das Patent nichtig sein könnte, ist damit durchaus sinnvoll und zu begrüßen.\n\nDie Verhältnismäßigkeit des Unterlassungsanspruchs anzugehen – ja, das ist durchaus auch fällig gewesen. Patentrecht ist nun mal ein Mittel des wirtschaftlichen Konkurrenzkampfs. Wenn ich meinen Konkurrenten drankriegen kann, dann mache ich eben alles, was geht. Das heißt je nachdem Rückruf und Verschrottung von komplexen Maschinen ohne Rücksicht darauf, dass vielleicht nur ein kleines Teil fehlerhaft ist und ausgebaut gehört.\n\nHier gehört die Verhältnismäßigkeit durchaus ins Gesetz – als Wink mit dem Zaunpfahl auf dem Beipackzettel meinetwegen; denn Entschädigungen können im genannten Beispiel die wirtschaftliche Vernichtung des Kontrahenten verhindern, was hier vertretbar wäre. Ausgedehnt werden darf dieser Ansatz aber nicht auf den Schutz von Kundeninteressen am Produkt; das würde definitiv zu weit gehen.\n\nWeiter soll das Geschäftsgeheimnisgesetz direkt mit dem Patentprozess verzahnt werden, und die obengenannte Konkurrenzsituation lässt das auf den ersten Blick auch noch sinnvoll erscheinen; denn eine De-facto-Ausforschung meines Kontrahenten in der Wirtschaft ist schnell mal ein größerer Gewinn für mich, als den eigentlichen Verletzungsprozess zu gewinnen. Dies muss, so gesehen, unterbunden werden, kann aber jetzt schon – durch Richterrecht entwickelt – so erreicht werden.\n\nZu weitgehende Geheimhaltung gerade im Verhältnis Anwalt/Prozesspartei schießt über das Ziel hinaus. Das beschneidet die Prozesshoheit der Streitparteien zu sehr, weil sie gar keine Entscheidungsgrundlage mehr haben, wenn der Anwalt ihnen Informationen nicht in ausreichendem Maße weiterleiten darf. Der Inhalt von Auskunftsansprüchen muss hier anders ausgeformt werden, um dieses Ziel zu erreichen; da geht die Sache viel zu weit.\n\nVielen Dank.\n\n({1})"
"1053715","Wilhelm","Gottberg","AfD","Member of Parliament","2021-01-27T00:00:00.000Z","https://dip21.bundestag.de/dip21/btp/19/19205.pdf","\n\nHerr Präsident! Frau Ministerin Klöckner! Meine Damen und Herren! Der hier debattierte Gesetzentwurf betrifft das Agrarmarktstrukturgesetz von 1969. Ursprünglich enthielt dieses Gesetz 14 Vorschriften. Derzeit sind es noch 11 überschaubare Vorschriften, vom Umfang her durchaus unternehmer- und bürgerfreundlich.\n\nAufgrund der EU-Vorgaben muss Deutschland nun bis zum 1. Mai die UTP-Richtlinie bezüglich unlauterer Handelspraktiken in nationales Recht umsetzen. Das soll durch eine Einfügung in das Agrarmarktstrukturgesetz erfolgen. Ziel der Richtlinie ist es, den finanziellen Druck auf die Landwirte und andere Lebensmittelerzeuger durch stärkere Regulierung der unlauteren Handelspraktiken zu senken. Die Mitgliedstaaten können nationale Vorschriften zu unlauteren Handelspraktiken, die über diese Richtlinie hinausgehen, ersatzlos streichen oder beibehalten.\n\nDas Verbot der unlauteren Handelspraktiken – in der sogenannten schwarzen Liste der UTP-Richtlinie aufgelistet – ändert nichts an dem strukturellen Verhandlungsungleichgewicht und der schwachen Verhandlungsposition der Landwirtschaft gegenüber der Ernährungsindustrie und dem Handel.\n\n({0})\n\nGanz im Gegenteil: Der Preisdruck auf die deutschen Bauern wird sich wahrscheinlich noch erhöhen. Denn der Handel wird die Kosten, die ihm durch das höhere Risiko entstehen, durch noch härtere Preisforderungen kompensieren. Die Unternehmen der Ernährungsindustrie werden sich darauf einlassen müssen und den Preisdruck an das Ende der Kette durchreichen, nämlich zu den Bauern.\n\nWenn man die Marktstellung der landwirtschaftlichen Betriebe stärken will, muss man auf der Angebotsseite das Angebot stärker bündeln. Das heißt, landwirtschaftliche Betriebe müssen sich verstärkt zu Erzeugerorganisationen zusammenschließen. Denn nur so sind sie von § 1 des Kartellgesetzes freigestellt und dürfen Preisabsprachen und Preisbindungen treffen.\n\n({1})\n\nNur so haben die landwirtschaftlichen Betriebe eine echte Chance, auf Augenhöhe zu verhandeln.\n\nDas allein wird aber nicht ausreichen. Die deutsche Landwirtschaft kämpft seit Jahren mit ständig steigenden Produktionskosten. Schuld daran sind vor allem immer neue behördliche Auflagen. Es ist schlicht und ergreifend unfair, dass deutsche Bauern die höchsten Standards erfüllen müssen, gleichzeitig aber massenhaft Billiglebensmittel aus dem Ausland importiert werden können, die diese Standards nicht zu erfüllen brauchen.\n\n({2})\n\nDie UTP-Richtlinie sieht vor, dass in jedem Mitgliedstaat eine Durchsetzungsbehörde mit Ermittlungs- und Sanktionskompetenzen einschließlich Bußgeldern eingerichtet wird. Dafür schlagen wir das Bundeskartellamt vor. Es ist zu hoffen, dass dieser Punkt von der Bundesanstalt für Landwirtschaft und Ernährung realisiert wird und die UTP-Richtlinie vom Obst- und Gemüsesektor auch auf den Milch-, Fleisch- und Pflanzenproduktionssektor übertragen wird; denn nur so ist eine nachhaltige Gleichstellung von Landwirten mit dem Lebensmitteleinzelhandel möglich.\n\nWir begrüßen, dass es zu dem Gesetzentwurf am 22. Februar eine Anhörung geben wird. Das wird die Erörterung des Entwurfs im Agrarausschuss erleichtern und insgesamt für mehr Klarheit sorgen.\n\nDanke.\n\n({3})"
"1053735","Marc","Bernhard","AfD","Member of Parliament","2021-01-27T00:00:00.000Z","https://dip21.bundestag.de/dip21/btp/19/19205.pdf","\n\nHerr Präsident! Meine Damen und Herren! 84 Prozent der Deutschen träumen von den eigenen vier Wänden, und Sie von den Grünen erklären das Traumhäuschen im Grünen nun zu einem Flächenvernichter, einem Baulandfresser und einem Ressourcenverschwender.\n\nNachdem Sie begonnen haben, mit Ihrer grünen Politik den Menschen das Auto wegzunehmen, vergreifen Sie sich jetzt auch noch am Wohneigentum.\n\n({0})\n\nDenn die von Ihnen angestrebte Bauwende offenbart die Scheinheiligkeit und völlige Substanzlosigkeit Ihrer Politik.\n\n({1})\n\nSie stören sich mal wieder an der Art, wie gebaut und geheizt wird: zu viel Zement, zu viele Steine, zu viel Stahl.\n\n({2})\n\nStattdessen wollen Sie jetzt Baustoffe aus Hanf und Pilzen verwenden. So soll also aus Sicht der Grünen Deutschlands technologischer Fortschritt 2021 aussehen. Sie von den Grünen sollten wirklich aufhören, dieses Zeug zu rauchen, dann würden Sie vielleicht auch sinnvolle Anträge stellen.\n\n({3})\n\nSeit 20 Jahren kann Ihnen die Fassadendämmung gar nicht dick genug sein. Genau Sie haben uns dazu verdonnert, zu dämmen, bis der Arzt kommt. Fast 500 Milliarden Euro sind in Form von Styropor an die Häuser geklebt worden. Und mit welchem Effekt? Mit welchem Effekt denn? Mit dem einzigen Effekt, dass noch mehr CO2 in noch kürzerer Zeit in die Luft geblasen wurde, als wenn wir gar nichts gemacht hätten. Denn Ihnen selbst fällt ja jetzt auch plötzlich auf, dass die Herstellung der Dämmmaterialien nämlich mit einem massiven CO2-Ausstoß verbunden ist, und trotzdem wollen Sie in Ihrem Antrag das Niveau eines Effizienzhauses 40 als Standard festschreiben, um noch mehr Dämmmaterialien an die Hauswände kleben zu können.\n\nDie Idiotie der von Ihnen seit Jahren geforderten angeblich so klimafreundlichen Maßnahmen lässt sich durch ganz einfache Mathematik auch beweisen.\n\n({4})\n\nDenn selbst wenn man durch die Dämmung den Wärmeverlust unrealistischerweise auf null reduzieren könnte, würde die CO2-Bilanz für ein Einfamilienhaus immer noch so aussehen: 50 Tonnen CO2 entstehen allein bei der Herstellung des Dämmmaterials, und diesen 50 Tonnen steht eine lächerliche CO2-Einsparung von gerade mal einer einzigen Tonne CO2 pro Jahr gegenüber. Also haben wir bis heute 500 Milliarden Euro in Ihren Dämmwahn investiert und damit kein einziges – kein einziges! – Gramm CO2 eingespart.\n\nWährend Sie hier ernsthaft darüber diskutieren, anstelle von Beton und Stahl mit Stroh und Pilzen zu bauen, setzen andere Nationen wie beispielsweise Indien alles daran, ihre Strohhäuser endlich durch Häuser aus Beton und Stahl zu ersetzen. Mit anderen Worten: Es interessiert den Rest der Welt nicht die Bohne, ob wir hier mit Pilz-, Stroh- oder Hanfbauweise arbeiten. Das Einzige, das jedoch mit Sicherheit erreicht wird, ist, dass die Bürger nur noch mehr fürs Bauen und Wohnen bezahlen müssen, genau das.\n\n({5})\n\nUnd im Ergebnis, Herr Kühn, werden Sie von den Grünen sowieso zu dem Schluss kommen, dass das Wohnen in Höhlen am ökologischsten ist.\n\n({6})\n\nIhre Bauwende ist nicht grün und auch nicht nachhaltig. Ihre Bauwende ist genauso wie die Energiewende und die Verkehrswende: teuer, nutzlos und umweltschädlich.\n\n({7})"
"1053757","Peter","Felser","AfD","Member of Parliament","2021-01-27T00:00:00.000Z","https://dip21.bundestag.de/dip21/btp/19/19205.pdf","\n\nVielen Dank. – Herr Präsident! Meine Damen und Herren! Was wäre der deutsche Wald ohne das in ihm heimische Wild, Hirsch, Sau, Fuchs und Reh? Beides gehört doch untrennbar zusammen: Wald und Wild.\n\n({0})\n\nMit Verlaub und mit allem Respekt, Frau Ministerin: In Ihrem Entwurf steht das Gegenteil von dem, was Sie gesagt haben. „Wald gegen Wild“ ist dort leider Ihr Leitmotiv.\n\n({1})\n\n– Doch. – Dieser Gesetzentwurf ist getrieben von Angst: Angst vor dem Klimawandel, Angst vor Wildschäden und vor allem Angst vor wirtschaftlichen Einbußen in der Forstwirtschaft. Schwarz-Rot fordert hier: Feuer frei auf Leittiere, also auch auf Muttertiere;\n\n({2})\n\nFeuer frei auf Tiere mit ungeborenem Nachwuchs; Feuer frei zu allen Tageszeiten,\n\n({3})\n\nzur Not sogar mit Nachtzielgeräten – Sie haben es gerade angesprochen –,\n\n({4})\n\nwie sie sonst nur von Soldaten im Krieg benutzt werden.\n\n({5})\n\nDas lehnen unsere Jäger ab, und das lehnen auch wir mit Nachdruck ab.\n\n({6})\n\nLassen Sie uns sachlich darüber reden.\n\n({7})\n\nWir von der AfD sind bekannt dafür, dass wir den Waldumbau mit sachlichen Argumenten voranbringen wollen. Sie haben es ja im Ausschuss auch mitbekommen: Wir gehen die Sache ganzheitlich an. Zum Beispiel fordern wir seit Langem eine Fokussierung auf die Verbesserung von forstlichem Saatgut. Wir müssen jetzt die Baumarten züchten und weiterzüchten, die unseren Wald auch noch in 30, 50 oder 80 Jahren stärken. Wir fordern immer wieder im Ausschuss oder in unseren Anträgen, endlich das Personal in den Forstämtern wieder aufzustocken. So gelingt Waldumbau!\n\n({8})\n\nBei Ihnen hat man das Gefühl, dass hier einseitig die Forstpartie gegen die Jäger ausgespielt wird. Die Forstwirtschaft wird gegen die heimischen Wildtiere und gegen den Tierschutz ausgespielt. Zeile für Zeile sprechen aus Ihrem Entwurf das Weltbild der Lobbyverbände mit ihren Forderungen, die Profitgier und die rein wirtschaftlichen Aspekte heraus. Genau das ist der Inhalt Ihrer Gesetzesvorlage. Das ist ein Lobbygesetz und nichts anderes, liebe Kollegen.\n\n({9})\n\nAus zwanzigjähriger Erfahrung als Jäger weiß ich, dass zum Schutz des Waldes und der Wildbestände Eingriffe nötig sind – das ist klar –, aber ich wehre mich mit Nachdruck dagegen, alle bisherigen Regeln ohne Not über den Haufen zu werfen. Das, was Sie vorschlagen, ist in der Praxis auch gar nicht möglich. Sie hätten einmal die Jäger und die Jagdverbände fragen sollen; aber die wurden erst gar nicht richtig eingebunden.\n\n({10})\n\nAn dieser Stelle möchte ich mich für das Engagement unserer Jäger bedanken. Frau Ministerin, auf diese engagierten Frauen und Männer werden Sie bei der Bekämpfung der Afrikanischen Schweinepest noch dringend angewiesen sein. Mein aufrichtiger Dank geht an dieser Stelle an die deutschen Jäger.\n\n({11})\n\nDer Wald kann nicht von allein und ohne Schutzmaßnahmen wachsen. Jetzt haben Sie in der Vorlage auch noch den Begriff „Naturverjüngung“ gestrichen; der Wald soll sich nun nur noch selbst verjüngen. Wenn wir für den Waldumbau Douglasien, Eiben, Elsbeere und auch Ahorn pflanzen, dann geht das nicht ohne Schutzmaßnahmen. Das weiß jeder, der auch nur ein wenig im Wald oder mit dem Wald zu tun hat. Gerade bei den fremdländischen Baumarten brauchen wir weiterhin einen Verbissschutz. Sie können unser Schalenwild bekämpfen, wie Sie wollen: Das allerletzte Reh, das dann irgendwo noch übrig bleibt, wird Ihnen diese Bäume dann doch wieder verbeißen oder schälen.\n\n({12})\n\nHören Sie endlich auf, das Reh als Schädling zu diffamieren! Hören Sie auf, unserem heimischen Wild die Schuld am Klimawandel zu geben!\n\n({13})\n\nDie Jagd, das Schießen ist doch nicht der einzige Aspekt, wenn wir über den Waldumbau sprechen. Diesen Irrsinn machen wir nicht mit. Liebe Kollegen, kehren Sie zurück zu einem Wald-Wild-Management, das nachhaltig ist, nachhaltig im wahrsten Sinne des Wortes. Kehren Sie zurück zu den ethischen Grundsätzen, die wir dem heimischen Wild schuldig sind. Wald mit Wild, das sind wir im 21. Jahrhundert der Natur, unserer Umwelt, unserer Heimat schuldig. Liebe Kollegen, kehren wir zurück zu dem Grundsatz „Den Schöpfer im Geschöpfe ehren“, wie es Hunderttausende Jäger in diesem Land gelernt und verinnerlicht haben.\n\nIch danke Ihnen.\n\n({14})"
"1053775","Leif Erik","Holm","AfD","Member of Parliament","2021-01-28T00:00:00.000Z","https://dip21.bundestag.de/dip21/btp/19/19206.pdf","\n\nSehr geehrte Bürger! Herr Präsident! Meine Damen und Herren! Herr Minister, Sie sprechen von einer Wirtschaft in robustem Zustand. Das ist ja wohl wirklich ein Witz. Ich schätze, Tausende haben da draußen jetzt mit dem Kopf geschüttelt, die um ihre Jobs, um ihre Unternehmen bangen. Das ist weiß Gott nicht robust.\n\n({0})\n\nRobust ist offensichtlich allein der Wille der Bundeskanzlerin, diesen Lockdown ewig weiterzutreiben. Frau Bundeskanzlerin, Sie haben wohl gesagt, wir müssen noch strenger werden. Das macht den Menschen da draußen Angst, die um ihre Jobs fürchten. Und wir sagen dazu: Nein, wir halten das wirtschaftlich auf Dauer nicht durch. Deutschland braucht endlich eine neue Strategie.\n\n({1})\n\nWir müssen unsere Senioren, insbesondere die in den Heimen, endlich konsequent schützen, aber unsere Unternehmen müssen wieder arbeiten dürfen!\n\n({2})\n\nWer soll denn bitte schön den Staat finanzieren, wenn keiner mehr etwas erwirtschaftet? Ich erlebe es in meinem Wahlkreis an der Ostsee. Viele Touristiker fragen: Wann können wir denn endlich wieder Urlauber empfangen? Die Einzelhändler fragen: Wann können wir endlich unsere Läden aufmachen? – Es macht mürbe auf die Dauer. Die Wirtschaft braucht endlich eine verlässliche und schnelle Öffnungsperspektive.\n\n({3})\n\nHerr Altmaier, Sie haben gesagt: Wir werden alles tun, damit kein Arbeitsplatz verloren geht und kein gesundes Unternehmen wegen Corona schließen muss. Das war natürlich ein hehres Ziel, aber Sie sind krachend gescheitert. Die Zahlen sind deutlich: Im letzten Jahr haben wir im Schnitt eine halbe Million mehr Arbeitslose gehabt. Das Ifo-Institut schätzt, dass sich bis zu 750 000 Unternehmen in existenzieller Not befinden.\n\nEs knirscht also immer lauter im Gebälk, und das können wir nicht auf Dauer mit immer neuen Überbrückungshilfen übertünchen. Dagegen hilft schon gar nicht, einfach nach Vogel-Strauß-Methode die Insolvenzantragspflicht immer weiter auszusetzen. Ich kann es ja verstehen, dass Sie sich über die nächste Wahl retten wollen, aber Sie schaden damit unserer Volkswirtschaft. Sie schaden damit unseren noch einigermaßen gesunden Unternehmen.\n\n({4})\n\nEs war diese Bundesregierung, Herr Altmaier, die es nicht geschafft hat, gerade den kleinen Unternehmen mit den November- und Dezemberhilfen wirklich schnell unter die Arme zu greifen. Das liegt im Wesentlichen wohl nicht in Ihrem Ressort, das kann man sagen, aber es ist Ihre Bundesregierung, die das getan hat. Am Anfang der Pandemie kann man sich Softwareprobleme noch vorstellen, aber wenn da nach einem Dreivierteljahr immer noch nichts klappt, dann grenzt das an Totalversagen.\n\n({5})\n\nUnd wo sind die begleitenden strukturellen Verbesserungen, die Sie hätten treffen können, die jetzt wirklich sinnvoll wären? Wir haben das gefordert. Warum lassen wir die gesenkte Mehrwertsteuer nicht da, wo sie im letzten halben Jahr war? Das war ja ein richtiger Schritt. Warum konnten wir das nicht weiterlaufen lassen? Warum haben wir die Stromsteuer nicht längst aufs Minimum gesenkt? Warum haben wir die steuerlichen Verlustrückträge nicht deutlich ausgeweitet? Das alles hätte kommen müssen, und Ihre Bundesregierung hat es nicht geschafft.\n\n({6})\n\nStattdessen streiten Sie über Steuererhöhungen. Aber so groß scheint der Streit gar nicht zu sein: Zum 1. Januar dieses Jahres haben Sie die Spritsteuern erhöht und die Mehrwertsteuer wieder angehoben. Also, da scheint der Streit wirklich nicht groß zu sein.\n\n({7})\n\nAllein der Gedanke an Steuererhöhungen in dieser Zeit ist ein Affront gegenüber den ohnehin schon gebeutelten Bürgern.\n\n({8})\n\nMeine Damen und Herren, der ewige Lockdown ruiniert unser Land. Soloselbstständige, Einzelhändler, Gastronomen, Hoteliers – sie alle wollen endlich wieder ranklotzen dürfen. Wir müssen jetzt dazu kommen, dass dieser Lockdown endlich ein Ende hat! Schützen wir unsere Senioren in den Heimen, aber lassen wir die Wirtschaft und unsere Menschen im Land endlich wieder arbeiten.\n\nDanke schön.\n\n({9})"
