id,firstname,lastname,faction,position,date, url,speech
"1052855","Detlev","Spangenberg","AfD","Member of Parliament","2021-01-13T00:00:00.000Z","https://dip21.bundestag.de/dip21/btp/19/19203.pdf","\n\nHerr Präsident! Sehr geehrte Damen und Herren! Impfen ist – meine Damen und Herren, ich glaube, da sind wir uns alle einig – eine ganz bedeutende medizinische Errungenschaft. Mir fallen da immer gleich zwei Namen ein: Louis Pasteur und Robert Koch. Keiner wird bezweifeln, dass das wirklich für uns von großer Bedeutung ist.\n\nAls am 31. Dezember 2019 die erste Infektion in Wuhan bekannt wurde, haben nicht Sie reagiert; die AfD hat reagiert – allein! -\n\n({0})\n\nmit dem Sechs-Punkte-Plan vom 13. Februar 2020. Mächtig peinlich für Sie, aber es ist einfach so.\n\n({1})\n\nDarin sind zwei wesentliche Forderungen enthalten, an denen Sie sich jetzt alle hochziehen – Sie kamen aber von uns –: Erstens Impfforschung, Impfentwicklung – damals für Sie kein Thema;\n\n({2})\n\nSie haben ja eben ausgeführt: erst seit August –\n\n({3})\n\nund zweitens Schutz von Risikogruppen. Für Sie auch kein Thema.\n\n({4})\n\nDas ging sogar noch weiter. Unsere Meinung wurde von Ihnen kriminalisiert. Frau Kappert-Gonther sprach von menschenfeindlichen Anträgen. Aber was soll ich von so einer Fraktion auch anderes erwarten, meine Damen und Herren.\n\n({5})\n\nHass und Hetze gegen Andersdenkende auch beim Thema Gesundheit, anstatt an die Bevölkerung zu denken, das ist Ihre Politik. Sie haben überhaupt kein Interesse an einer demokratischen Entwicklung, sondern für Sie zählt nur irgendeine Ideologie.\n\nAm 11. Januar 2021 hat das Bundesministerium für Gesundheit einen Bericht vorgelegt. Da frage ich noch mal: Warum wurde die Eigeninitiative Impfstoffbeschaffung mit drei anderen europäischen Staaten, nämlich Frankreich, Italien, Niederlande – wir haben dazu auch eine Anfrage gestellt –, nicht weiter verfolgt? Es wurde ausgeführt: Die europäischen Interessen wurden vor die deutschen Interessen gestellt. – Ich muss aber feststellen: Die Bundesregierung ist von der deutschen Bevölkerung gewählt worden, und in erster Linie ist erst mal die Versorgung der deutschen Bevölkerung mit Impfstoffen sicherzustellen und nicht die der europäischen. Das ist unsere Meinung, meine Damen und Herren.\n\n({6})\n\nWenn Impfen als einzige und absolute Möglichkeit erkannt ist, dann muss diese Möglichkeit auch umsetzbar sein. Die Prognose „zweites Halbjahr 2021“ bedeutet, wenn ich es richtig sehe: tägliche Einkommensverluste, tägliches Sterben von Unternehmen und tägliches Einschränken der persönlichen Freiheit; denn Sie kommen ja vor dem zweiten Halbjahr nicht aus dem Knick.\n\nSie haben gemeinsam einen Plan für eine Nationale Impfstrategie erarbeitet; den habe ich mir angeschaut. Meine Damen und Herren, aber auch da hatte die AfD am 16. September bereits vorgeschlagen, dies in eine ständige Pandemiekommission miteinzubringen. Da hätten Sie auch schon reagieren können. Sie hinken immer hinterher. Die AfD ist immer einen Sprung schneller. Das haben Sie bis heute noch nicht verstanden, meine Damen und Herren.\n\n({7})\n\nWeiter haben wir am 3. November 2020 einen Antrag zu Eigenverantwortung statt Vorschriften, Restriktionen usw. gestellt. Ja, meine Damen und Herren, die Eigenverantwortung ist von vielen auch ernst genommen worden. Sie haben Gesundheitsauflagen erfüllt, und trotzdem wurde ihnen die Bude dichtgemacht. Es schafft natürlich Verdruss, wenn Berufsverbote kommen, obwohl sie genau das machen, was Sie ihnen gesagt haben: Eigeninitiative. Heute Morgen hat der Bundesgesundheitsminister im Deutschlandfunk noch einmal angedeutet, dass er diese Eigeninitiative auch für richtig hält – zumindest habe ich das Interview so verstanden –, und ich denke, dann sollte man diese auch belohnen und nicht bestrafen.\n\n({8})\n\nLänderbezogene Maßnahmen wie Ausgangssperren, Kontaktverbote willkürlich, ohne wissenschaftliche Begründung einzuleiten, schafft natürlich Verdruss und Ablehnung, das ist ganz klar. Nach wie vor gibt es keine wissenschaftlich begründeten Maßnahmen; der Lockdown wirkt nicht. Professor Schade sagte heute Morgen: Na ja, wenn wir nichts gemacht hätten, wäre es vielleicht noch schlimmer geworden. – Das ist auch nur eine Hypothese. Das weiß ja keiner. Also jedenfalls könnte man die Maßnahmen einmal überdenken und vielleicht andere machen. Aber Fehlanzeige! Sie machen weiter wie bisher.\n\nPrioritäten für die Impfung: Ja, da hat die FDP natürlich den schlauen Vorschlag, das hier zu diskutieren. Meine Damen und Herren, das ist so eine Art Klientelpolitik: Wen nehme ich denn zuerst dran? Wo habe ich die meisten Wählerstimmen? – Ich gebe Ihnen einmal ein Beispiel. Wir haben ja gesagt: die Risikogruppen zuerst. Wie sieht es denn eigentlich im Flugverkehr aus? Das kennt doch jeder: Wenn Druckabfall in der Kabine vorkommt, dann fallen die Masken runter. Wie ist da die Anordnung? Wer soll zuerst die Maske aufsetzen? Das Elternteil oder das Kind? Und da lautet die Anweisung ganz klipp und klar: das Elternteil, damit es dem Kind helfen kann, und nicht andersherum, sonst sind beide verloren. Also könnte man auch in dieser Situation eine andere Prioritätensetzung vornehmen. Aber wollen wir das hier diskutieren? Das wird doch nichts. Das sollten wir der Expertenkommission vorlegen, und das, denke ich, ist besser, als wenn Sie versuchen, über die Schiene Ihre 5-Prozent-Hürde zu erreichen, meine Damen und Herren.\n\n({9})\n\nDann geht es weiter: Misstrauen und Ablehnung. Das müssen Sie einfach einmal zur Kenntnis nehmen. Sie sind es gar nicht mehr gewöhnt, dass die Menschen auch mal eine andere Meinung haben, meine Damen und Herren, das gehört einfach dazu. Es ist egal, ob es das Impfen, die Erprobungsphase, die Art des Impfstoffes betrifft: Sie müssen zur Kenntnis nehmen, dass die Bevölkerung Fragen hat, einiges nicht glaubt oder auch nicht glauben will. Das ist einfach so.\n\n({10})\n\nDas gehört zur Demokratie. Daran müssen Sie sich messen lassen.\n\nMeine Damen und Herren, wer geimpft werden möchte, der soll geimpft werden, und wer nicht geimpft werden möchte, der lässt es eben sein. Das ist eine ganz klare Ansage von der AfD.\n\n({11})\n\nGefährliche Diskussionen über die Ausgrenzung Nichtgeimpfter ohne wissenschaftliche Grundlage offenbaren undemokratisches Verhalten. Wenn es sich wie in Sachsen-Anhalt durch entsprechende Regelungen für Reiserückkehrer logischerweise ergibt, dass Geimpfte mehr Vorteile haben, ist das undemokratisch, meine Damen und Herren. Was ist in dem Land los? Das wird ja immer schlimmer. Wir haben mittlerweile schon Zeichen der Blockwartmentalität in Deutschland. Wir haben bei der Maskenpflicht schon gemerkt, dass diese miesen Charaktere ganz offen in der Öffentlichkeit rumturnen, so wie wir das aus den Berichten aus vergangenen schlimmen Zeiten schon gehört haben.\n\nOffen sind die Fragen, ob Geimpfte möglicherweise weiterhin das Virus verbreiten, wie lange die Immunität anhält, ob es Impfschäden gibt. Das sind alles normale Fragen, denen sich die Politik stellen muss. Und geradezu ein Paradebeispiel fehlenden Demokratieverständnisses sind die Einlassungen von Ministerpräsident Söder vom 10. Januar 2021, wenn er von „Corona-Mob“, „Corona-RAF“ spricht. Meine Damen und Herren, wer diese linken Kriminellen mit einer demokratischen Opposition, gleich welche Art, ob hier oder draußen, in Verbindung bringt, hat kein Recht, sich als Demokrat zu bezeichnen.\n\nRecht vielen Dank.\n\n({12})"
"1052876","Wilhelm","Gottberg","AfD","Member of Parliament","2021-01-13T00:00:00.000Z","https://dip21.bundestag.de/dip21/btp/19/19203.pdf","\n\nFrau Präsidentin, danke fürs Wort. – Frau Ministerin, wir konnten der Presse entnehmen, dass Sie am 6. Januar dieses Jahres in einem Schreiben den Kolleginnen und Kollegen der Bundesländer die Frage vorgelegt haben, wie sie sich zu den inhaltlichen Schwerpunkten des Nationalen Strategieplanes für die Förderperiode ab 2023 stellen.\n\nDiese Nationalen Strategiepläne müssen bis zum Jahresende der Kommission zur Genehmigung vorgelegt werden. Dass Sie diese Fragen stellen, liegt am neuen Umsetzungsmodell für die zukünftige EU-Agrarpolitik. Im Vorfeld der kommenden Agrarministerkonferenz des Bundes und der Länder am 5. Februar dieses Jahres fragen wir die Meinungsbildnerin, Frau Ministerin Klöckner: Wie stehen Sie zu den vorgeschlagenen Parametern Kappung und Degression, Junglandwirteprämie und eine mögliche Gemeinwohlprämie?"
"1052880","Wilhelm","Gottberg","AfD","Member of Parliament","2021-01-13T00:00:00.000Z","https://dip21.bundestag.de/dip21/btp/19/19203.pdf","\n\nFrau Ministerin, wir wissen, dass die Abwanderung der Menschen aus den ländlichen Räumen auch deshalb geschieht, weil im Abwanderungsgebiet keine oder nur eine unzureichende Zahl an Arbeitsplätzen vorhanden ist. Sehr viele landwirtschaftliche Betriebe, gerade im Osten, beschäftigen zahlreiche Mitarbeiter. Wird bei der Umgestaltung der ersten Säule der GAP das Kriterium „Anzahl der beschäftigten ganzjährigen Mitarbeiter“ neben der Flächenprämie ein weiteres Förderkriterium sein? Diese Maßnahme würde nach unserer Auffassung zu einer Entspannung auf dem landwirtschaftlichen Bodenmarkt führen."
"1052943","Peter","Felser","AfD","Member of Parliament","2021-01-13T00:00:00.000Z","https://dip21.bundestag.de/dip21/btp/19/19203.pdf","\n\nVielen Dank, Frau Präsidentin. – Sehr geehrte Frau Ministerin, die Afrikanische Schweinepest ist seit ein paar Monaten in Deutschland angekommen. Wir haben sie halbwegs im Griff. Ich glaube, das ist auch der deutschen Jägerschaft geschuldet, die beim Schwarzwild eine Rekordstrecke nach der anderen liefert.\n\nWir sehen aber auch massive Einschränkungen bei den Bauern in den Hotspots, in den Sperrzonen. Wir haben es dort mit Ernteverboten zu tun, wir haben es mit Beschränkungen im Anbau zu tun. Meine Frage wäre: Gibt es eine bundeseinheitliche Perspektive fürs Frühjahr? März und April stehen vor der Tür; die Bauern wollen jetzt drillen, sie wollen die Aussaat nach draußen bringen. Was können die Bauern jetzt von Ihnen als Signal erwarten? Was können sie auf ihrem Grund und Boden im März, im Frühjahr ausbringen?"
"1052947","Peter","Felser","AfD","Member of Parliament","2021-01-13T00:00:00.000Z","https://dip21.bundestag.de/dip21/btp/19/19203.pdf","\n\nGerne. – Auch vielen Dank an Sie als neue sitzungsleitende Präsidentin."
"1052949","Peter","Felser","AfD","Member of Parliament","2021-01-13T00:00:00.000Z","https://dip21.bundestag.de/dip21/btp/19/19203.pdf","\n\nWir hatten ja vorher die Debatte über den Impfstoff für Menschen, was Covid-19 und Corona betrifft. Da ging es ja ganz, ganz schnell bei den Impfstoffherstellern, hier was zu liefern. Vielleicht war das zu schnell; das werden wir in fünf oder zehn Jahren erst wissen. Wie sieht denn die Perspektive aus bei der Entwicklung eines Impfstoffes gegen ASP, gegen das Virus bei den Wildschweinen? Bei der Tollwut in den 70er-Jahren hat das auch gut geklappt. Was ist da die Perspektive aus Ihrer Sicht?"
"1053207","Paul Viktor","Podolay","AfD","Member of Parliament","2021-01-14T00:00:00.000Z","https://dip21.bundestag.de/dip21/btp/19/19204.pdf","\n\nFrau Präsidentin! Meine Damen und Herren! Innovation – ein Begriff, der häufig verwendet wird, ohne seine Bedeutung zu verstehen: von Funktionären, die nie etwas Neues kreieren oder erfinden mussten, von Politikern, die keine Ahnung davon haben, irgendwelche Lösungen zu finden. Eben diese Unwissenheit und Unerfahrenheit mit Dingen des realen Lebens findet man in diesem Antrag der Linken, in dem gefordert wird, die Impfstoffpatente an jedermann freizugeben; denn mit Enteignungen kennen Sie sich ja bestens aus.\n\nWas man in diesem Antrag liest, ist haarsträubend und zeugt von großer Unwissenheit. Das Freigeben von Patenten ist nämlich nicht gleichzusetzen mit der Erhöhung der Produktionskapazitäten; denn Produktionsmöglichkeiten müssen aufgebaut werden, was wegen der hohen Qualitätsanforderungen an die Herstellung von Impfdosen bekanntlich auch in Deutschland eine Herausforderung darstellt.\n\nWas Sie verlangen, ist ein weiterer Meilenstein in der Zerstörung der deutschen Innovationskraft und der internationalen Wettbewerbsfähigkeit. Dies passt zwar zu Ihrer sozialistischen Agenda, trifft den deutschen Bürger jedoch ins Mark! Eigeninitiative, geistiges Eigentum und Wille zur Innovation müssen weiterhin geschützt werden; denn Hersteller brauchen Anreize für die Entwicklung von Impfstoffen. Was soll ein Unternehmen motivieren, so viel Zeit und Geld zu investieren, um ein Patent zu finden, das dann gratis an alle verteilt wird? Altruismus? Sind die schon so weit abgedriftet? Das ist Sozialismus pur!\n\n({0})\n\nDeutschland kommt seinen internationalen und humanitären Verpflichtungen bereits großzügig nach: Um die weltweiten Produktionskapazitäten auszugleichen, unterstützt Deutschland die Covax-Impforganisation, die der WHO untersteht, bereits mit mehreren hundert Millionen Euro. Die Initiative soll reichen und armen Ländern gleichermaßen einen fairen Zugang zu wirksamen Impfstoffen gewährleisten. Es gibt also keinen Anlass für Ihren Alarmismus! Außer natürlich die bevorstehende Bundestagswahl.\n\nUm in die Zukunft zu schauen und unser Land wieder aus der Misere herauszuführen, ist es an der Zeit, logisch und rational zu denken. Wir brauchen jetzt mehr denn je verlässliche gesundheitspolitische Rahmenbedingungen, um den Entwicklungs- und Produktionsstandort Deutschland zu stärken. Viele Menschen werden aufgrund des unwissenschaftlichen Handelns der Regierung mit dem Endlos-Lockdown ihre Arbeitsplätze verlieren. Das ist eine unbequeme Tatsache, die von der Regierung gerne unter den Teppich gekehrt wird. Fakt ist: Wir wurden von unseren Bürgern gewählt, und für die Lebensumstände ebendieser Bürger sind wir verantwortlich!\n\n({1})\n\nDass Ihnen die zermürbten Menschen da draußen egal sind, haben Sie schon vielfach bewiesen. Wir müssen jeden Arbeitsplatz und jede Investition schützen; denn wer sich selbst nicht hilft, kann auch anderen nicht helfen.\n\nDa Ihnen als Kommunisten grundlegende ökonomische Kenntnisse fehlen, erkläre ich Ihnen nun, was Deutschland braucht und wofür die AfD steht: –"
"1052991","Christian","Wirth","AfD","Member of Parliament","2021-01-13T00:00:00.000Z","https://dip21.bundestag.de/dip21/btp/19/19203.pdf","\n\nFrau Präsidentin! Werte Kollegen! Sehr geehrte Regierungsfraktionen, wir trauen Ihnen nicht. Wir trauen Ihnen nicht, weil Sie schon wieder einen Gesetzentwurf geschrieben und mit Ihren Mehrheiten durchgedrückt haben, der Ihnen von den Gerichten um die Ohren gehauen wurde – schon wieder. Dass Ihre eigenen Leute zu inkompetent sind, um einen verfassungskonformen Gesetzentwurf vorzulegen, das verwundert nicht. Aber dass all die teuren Berater, die wohlinvestierten Spenden der Wirtschaft anscheinend nicht ausreichend, um auch nur oberflächlich Korrektur zu lesen, ist schon überraschend. Nicht mal vom Wissenschaftlichen Dienst des Bundestages haben Sie sich beeindrucken lassen.\n\nWir vertrauen Ihnen nicht; denn es ist ja kein Einzelfall. Der wilde und andauernde Rundumschlag der Bundesregierung in Sachen Corona und die Umsetzung in den Ländern sind von den Juristen und den Gerichten auf allen Ebenen so oft kassiert und kritisiert worden, dass man es kaum noch zählen kann.\n\n({0})\n\nSelbst in einer Zeit, wo Sie sich einer parlamentarischen Mehrheit sicher sein können, haben Sie darauf verzichtet, auch nur die grundlegendste parlamentarische Beteiligung an den Coronamaßnahmen zu ermöglichen. Herr Maas erdreistet sich nunmehr noch, anderen Regierungen einen „Marshallplan für die Demokratie“ anzubieten. Das ist wirklich zum Fremdschämen.\n\nWir trauen Ihnen nicht, weil Sie von Tag eins an jede Ihnen zur Verfügung stehende Waffe auf allen Ebenen angewendet haben, um der einzigen Oppositionspartei im Bundestag zu schaden. Keine Ausrede war Ihnen zu peinlich, kein Paragraf zu obskur, und wo gewissenstreue Beamte Ihnen im Weg standen, wurden sie nach Sonnenkönigsart vom Hof gejagt.\n\nWir trauen Ihnen nicht, weil Sie trotz aller hier angebrachten Korrekturen weiter nur das korrigieren, was absolut mindestens nötig ist, um die Vorgaben des Bundesverfassungsgerichts zu erfüllen. Sie ignorieren weiterhin die einstimmige Kritik aller betroffenen Bürger, Verbände und Unternehmen außerhalb ihrer eigenen Parteien.\n\nWir trauen Ihnen nicht, weil Sie statt einem konkreten, per Gericht benannten und geforderten Einblick in die Daten von Verbrechern und Terroristen die Passwörter als Generalschlüssel für eine beliebige Anzahl von Plattformen wollen, weil Sie weiter ignorieren, dass es nur eine technische Möglichkeit gibt, um ihre geforderte Passwortweitergabe überhaupt zu ermöglichen, nämlich das Speichern von Passwörtern als unverschlüsselter Klartext durch die Anbieter. Ein Geschenk für Hacker und ausländische Dienste.\n\nWir trauen Ihnen nicht, weil Sie von durch Steuergelder alimentierten NGOs das Gottesgeschenk „Hass und Hetze\" erhalten haben, um legitime Regierungskritik in einen Topf mit widerlicher Menschenverachtung zu werfen. Mit dem Gesetz zur Hasskriminalität haben Sie Strafrecht und somit Hoheitsrecht in die Hände amerikanischer Konzerne gegeben und somit ein neues Besatzungsrecht geschaffen.\n\n({1})\n\nGetreu nach Erich Mielke, „Genossen, wir müssen alles wissen!“, ist auch ihre erste Reaktion auf Regierungskritik, erst einmal herauszufinden, wer sich da einer eigenen Meinung erdreistet. Die Weitergabe von IP-Adressen und Portnummern ist Schritt eins zur Repression.\n\nWir trauen Ihnen nicht, weil Sie besonders in dieser Legislaturperiode bewiesen haben, dass Sie ein anderes Deutschland wollen, mit voller Kontrolle über die politische Meinung und ohne störende Parlamente oder Verfassungsgerichte. Wir trauen Ihnen aber auch deshalb nicht, weil keine Regierung eine solche Machtfülle haben sollte, selbst nicht, wenn sie von der AfD geführt wäre. Allein, dass Sie diese Vollmachten haben wollen, ist Grund genug, dass Sie diese nicht haben dürfen.\n\n({2})\n\nWir werden Ihnen nicht dabei helfen, Ihren Angriff auf das freie Internet mit dem hier vorgelegten Feigenblatt zu legitimieren.\n\nVielen Dank.\n\n({3})"
"1052977","Berengar","Elsner von Gronow","AfD","Member of Parliament","2021-01-13T00:00:00.000Z","https://dip21.bundestag.de/dip21/btp/19/19203.pdf","\n\nFrau Präsidentin! Werte Frau Ministerin, mich interessiert der Einsatz der Bundeswehr zur Unterstützung im deutschen Forst. Welche Bilanz ziehen Sie, welche Bilanz zieht die Bundeswehr, was sagen die Forstbetriebe hierzu? Wie zielorientiert wurden denn die zur Verfügung gestellten Soldaten eingesetzt? Welche Aufgaben haben sie übernommen, gerade vor dem Hintergrund, dass ja die meisten Soldaten keine Qualifikation oder Kompetenz besitzen, um forstwirtschaftliches Gerät, Fahrzeuge und Ähnliches zu bedienen?"
"1052980","Berengar","Elsner von Gronow","AfD","Member of Parliament","2021-01-13T00:00:00.000Z","https://dip21.bundestag.de/dip21/btp/19/19203.pdf","\n\nGerne. – Nach dem Aufräumen kommt ja bekanntlich der Aufbau. Der Waldumbau ist auf Bundes- und Länderebene natürlich ein sehr wichtiges Thema. Von Land- und Forstwirten höre ich aber doch immer wieder die Kritik, dass die Bedingungen für Hilfsmittel zu pauschal seien, örtliche, regionale Bedingungen nicht ausreichend berücksichtigt würden, die förderfähigen Maßnahmen dort unter Umständen nicht sinnvoll wären, somit dann viele Forstwirte die Hilfen nicht in Anspruch nehmen könnten. Kennen Sie diese Kritik, und, wenn ja, wie werden Sie im Rahmen Ihrer Möglichkeiten auf Bundesebene darauf reagieren?"
"1053014","Stefan","Keuter","AfD","Member of Parliament","2021-01-13T00:00:00.000Z","https://dip21.bundestag.de/dip21/btp/19/19203.pdf","\n\nFrau Präsidentin! Meine sehr geehrten Damen und Herren! Liebe Zuschauer! Dieser Antrag der Genossinnen und Genossen zielt darauf ab, den Dispositionszinssatz auf maximal 5 Prozent über dem sogenannten Leitzins der EZB zu deckeln.\n\nJa, wir haben es hier mit einem altbekannten Antrag zu tun, wie Herr Hauer gerade schon sagte. Wir haben diesen Antrag fast in identischer Form bereits am 1. Februar 2019, also vor gut zwei Jahren, hier im Plenum diskutiert. Diesmal ist noch der Zusatz „… infolge der Corona-Pandemie …“ beigefügt worden. Man hat also aufseiten der Linken versucht, einen Bezug zur Pandemie herzustellen.\n\nNun wollen wir den Linken nicht unterstellen, dass sie per se keine guten Anträge stellen können; aber uns wundert es schon, dass diese Oppositionskraft hier im Deutschen Bundestag, wenn sie schon das Thema Corona aufgreift, keine knackigen Themen bringt: dass sie beispielsweise das Staatsversagen beim Managen dieser Pandemie aufzeigt, dass sie vor der größten wirtschaftlichen Krise seit Bestehen der Bundesrepublik Deutschland warnt, vor der Verschuldung der kommenden Generationen, vor der Corona-Angstmache des öffentlich-rechtlichen Rundfunks oder vor der Impfpropaganda.\n\nEs wundert uns, dass sie die Angst vor der Mutation nicht aufklärt oder hinterfragt.\n\n({0})\n\nHandelt es sich nur um eine Mutation – was Viren seit Millionen von Jahren machen – oder um einen neuen Stamm, der gegebenenfalls tatsächlich gefährlich sein könnte?\n\nSie könnte als Oppositionskraft hier auch eine Aufklärung zu den Risiken dieses neuen sogenannten mRNA-Impfstoffes fordern. Sie kann fragen, was dieser Impfstoff überhaupt kann.\n\n({1})\n\nRichtig aufgeklärt wird darüber nämlich nicht. Sie kann den Kampf über die Diskussion der Impfpflicht aufnehmen.\n\nAlles das tut sie nicht. Eine Übersterblichkeit haben wir nicht. Es wäre an Ihnen als Linke, den Menschen Hoffnung zu geben, wenn Sie einen Antrag einbringen.\n\n({2})\n\nStattdessen kommt ein alter Antrag: ein Angriff auf das darbende Bankgewerbe.\n\n({3})\n\nWir wollen ganz kurz uns mit Ihrem Antrag beschäftigen. Wir schauen uns die Banken und die Verbraucher an, und dann rechnen wir ein bisschen.\n\nWas ist dieser Dispozinssatz? Es ist letztendlich ein Aufschlag, der eine Kreditmarge, das Ausfallrisiko der Banken, widerspiegelt und dann noch einen Gewinnaufschlag draufpackt, nämlich die Verzinsung des Eigenkapitals der Banken. Die Banken sollten schon eine Produktgestaltungsfreiheit haben. Sie müssen sich letztendlich mit ihren Produkten im Markt behaupten. Da brauchen wir von gesetzgeberischer Seite überhaupt nicht einzugreifen.\n\nSchauen wir uns die Seite der Verbraucher an. Wozu ist ein Dispositionszinssatz da? Er ist dafür da, um kurzfristige ungeplante Ausgaben zusätzlich überbrücken zu können. Er dient nicht dem vorgezogenen Konsum, und es ist die Freiheit eines jeden Einzelnen, den Dispositionskredit in Anspruch zu nehmen oder halt nicht.\n\nSie als Linke wissen ganz genau, dass es die Pflichten der Banken gibt, darüber aufzuklären, wenn ein Kunde diesen Dispositionskredit über längere Zeit in Anspruch nimmt. Er kann dann günstig umschulden auf Ratenkredite, die im Moment bei circa 3 Prozent liegen. Wenn ein Konto nicht im Rahmen geführt wird und zudem, wie Sie vorhin sagten, Überziehungen in Anspruch genommen werden, dann stellt dieser Kunde eine schlechtere Bonität mit einem größeren Ausfallrisiko dar. Das muss natürlich irgendwo vergütet werden.\n\nWir rechnen einmal. Das „Handelsblatt“ hat eine Umfrage gemacht: Nur 11,8 Prozent der Dispokredite liegen über 1 500 Euro, 88 Prozent unter 1 500 Euro. Bei einem Durchschnittszinssatz von 9,72 Prozent pro Jahr beträgt die Zinslast 138 Euro pro Jahr.\n\n({4})\n\nIhre Deckelung würde eine Ersparnis von lediglich 63 Euro bringen; eine Zinslast von 75 Euro würde bleiben. Damit wollen Sie Ihre Verbraucher entschulden. Das ist lächerlich, meine Damen und Herren! In Wirklichkeit ist dies ein Angriff auf die freiheitlich-demokratische Grundordnung und auf die private Bankwirtschaft, die Ihnen ein Dorn im Auge ist.\n\nSie fordern in Ihrem Antrag außerdem stärkere Kontrollen und Regulierungen. Wir als AfD, als freiheitliche Partei, lehnen dies entschieden ab.\n\nVielen Dank für Ihre Aufmerksamkeit.\n\n({5})"
