id,firstname,lastname,faction,position,date, url,speech
"1051357","Peter","Boehringer","AfD","Member of Parliament","2020-12-08T00:00:00.000Z","https://dip21.bundestag.de/dip21/btp/19/19197.pdf","\n\nHerr Präsident! Verehrte Kolleginnen und Kollegen! Die Bundeshaushalte 2020 und 2021 umfassen zusammen 1 000 Milliarden Euro bei bislang unvorstellbaren 400 Milliarden Euro Neuverschuldung. Die beiden größten Haushalte der deutschen Geschichte. Angeblich alles coronabedingt. Eine Virusinfektion soll die Grenzüberschreitungen rechtfertigen – wir werden es ja gleich überall wieder hören. Ganz so, als ob Deutschland noch nie eine Krise durchlebt hätte. Ganz so, als könne es nie wieder ähnlich schlimme Krisen geben.\n\nDeutschland hat seit 1945 viele Krisen gesehen: den Hungerwinter 1946, den Kalten Krieg seit den 50ern mit dramatischen Zuspitzungen 1953 und in der Kuba-Krise 1962, die Ölpreisschocks der 70er, die Massenarbeitslosigkeit der 80er, die Börsencrashs 1980 und 1987, den Crash 2000, dann 9/11 und seit 2010 eigentlich permanent die Finanzkrise. Und natürlich auch viele schwere Grippen, einige davon mit Zehntausenden Opfern.\n\nNun kommt ein weiteres gefährliches Virus, und alle etablierten Maßstäbe der Haushaltsführung werden gesprengt: fast 40 Prozent Kreditfinanzierungsquote dieses Haushalts bzw. etwa 6 Prozent Neuverschuldung bezogen auf die Wirtschaftsleistung des gesamten Landes. Die Maastricht-Obergrenze ist bekanntlich 3 Prozent. 100 Prozent Zielverfehlung – das sind historische Dimensionen. Absolut liegt die Corona-Neuverschuldung sogar beim Vierfachen des bisherigen Negativrekords von 2010. Niemals zuvor wurde auf eine Krise mit einem verordneten Stillstand des ganzen Landes reagiert, wenn man von vier autofreien Sonntagen im Zuge des Ölpreisschocks 1973 einmal absieht.\n\nDass das nicht verhältnismäßig ist, sieht man auch daran, dass nur wenige Bürger persönlich einen kausal sicher an Corona Verstorbenen kennen. Aber fast jeder kennt inzwischen betroffene Gastronomen, Hoteliers, Einzelhändler und Selbstständige fast aller Branchen. Immer mehr kennen Kurzarbeiter in der Auto- und Maschinenbauindustrie. Jeden Tag hören wir neue Horrormeldungen. Im laufenden Jahr ist die Zahl der Arbeitslosen um 500 000 Menschen angestiegen. Zusammen mit den zugehörigen Familienangehörigen sind das millionenfache Schicksale.\n\n({0})\n\nWir haben noch gar nichts gesehen. 2021 wird das Jahr der massiven Auswirkungen des Lockdowns. Zehntausende Insolvenzen werden kommen; die massenhafte Kurzarbeit wird in millionenfacher Arbeitslosigkeit münden. Bei Familienbetrieben und Mittelständlern wird derzeit vielfach die Lebensleistung von Generationen vernichtet – wegen der völlig unverhältnismäßigen Reaktion der Regierung auf eine Infektionskrankheit, die der PCR-Test übrigens nach wie vor nicht nachweisen kann.\n\n({1})\n\nAll das wegen einer Viruskrankheit mit nur minimal messbarer Übersterblichkeit.\n\nDie Schicksalsfrage von Millionen Betroffenen lautet daher: Wie lange noch? Wir haben diese Frage bei den Haushaltsberatungen eigentlich fast allen Ministern gestellt\n\n({2})\n\nund Antworten bekommen von „Januar“, „Vielleicht Februar“, „Juni“ bis „Könnte aber auch 2022 werden“. Das Land kann aber erst dann wieder zur Normalität zurückkehren, wenn endlich der Lockdown beendet wird, wenn endlich wieder Planbarkeit herrscht.\n\n({3})\n\nDie Menschen sind ebenso wie die Unternehmen völlig verunsichert und oftmals geradezu depressiv. Von gesundheitlichen und gesellschaftlichen Kollateralschäden ganz abgesehen, die die Regierung nebenbei auch noch produziert. Sogar die „Bild“-Zeitung schreibt inzwischen, dass mehr Menschen wegen der unwissenschaftlich ohne objektive Kriterien und ohne echten Wirkungsnachweis verfügten Maßnahmen sterben als am Virus selbst. Bei Hunderttausenden verschobenen Operationen und unterlassenen Krebs- und Herz-Vorsorgeuntersuchungen ist das ja auch völlig klar. An dieser Stelle hier sagte ich bereits im März:\n\nPsychischer Stress durch Freiheitsbeschränkungen, Existenzängste sowie Arbeitslosigkeit aufgrund von Firmeninsolvenzen, die staatliche Stützungszahlungen bei einem längeren Shutdown letztlich nicht verhindern können, werden nach einiger Zeit zu einer verringerten Lebensdauer der Menschen führen.\n\nWas also tun? Die Regierung kommt ohne Gesichtsverlust nicht mehr raus aus der selbstgestellten Falle ihrer Lockdown-Politik. Man setzt nun auf ein schnelles Ende der Krise durch die Impfung. Das aber ist unverantwortlich: Eine kaum getestete, völlig neue Impfung auf Basis des trotz 30-jähriger Forschung noch nie eingesetzten mRNA-Impfprinzips – ein Prinzip! – kann weder 2021 noch 2022 eine ernsthafte Option sein!\n\n({4})\n\nDer vorliegende Haushaltsentwurf gibt die Coronaausgleichszahlungen in derzeitiger Höhe nur etwa bis Sommer 2021 her. Mit Glück kann der Finanzminister die Lockdown-Folgen sogar noch bis zur Bundestagswahl mit Schuldengeld abfedern – Stillhalteprämien sozusagen. Es ist jedoch eine Illusion, dass staatliche Mittel auch nur annähernd ausreichen könnten, die derzeit regulativ gestörte Wertschöpfung des Privatsektors zu ersetzen. Man kann Wertschöpfung nicht durch Geldschöpfung ersetzen! Und dennoch versucht die Regierung nun genau das!\n\n({5})\n\n„Nach uns die Sintflut“ ist ganz klar das Motto in diesem letzten Haushalt der Kabinettsausscheider Merkel und Scholz.\n\n({6})\n\nDanach wird im Bundesbudget ein riesiges Loch klaffen; denn 2021 werden die Steuereinnahmen niemals wie geplant um 4 Prozent wachsen, weil die Umsätze der Realwirtschaft unter Lockdown-Bedingungen sogar fallen werden! Durch die anhaltende CO2– und Coronahysterie werden zentrale Wirtschaftsstrukturen irreversibel zerschlagen. Die Fertigung von Verbrennermotoren bei Daimler und BMW etwa wurde nach einem Jahrhundert der Fertigung in Deutschland mit Millionen Arbeitsplätzen, die davon abhängen, aufgegeben bzw. ins Ausland notverkauft – natürlich auch wegen der CO2-Religion.\n\nDie AfD erkennt den Schuldenbedarf 2021 zu einem kleinen Teil an: verfassungskonform, das heißt ohne illegitime Verlängerung der haushalterischen Notsituation. Die wirklich sinnvollen Ausgaben im Gesundheitswesen und beim Kurzarbeitergeld anerkennt auch die AfD, vor allem solche für Personal in Intensivstationen, also für Ärzte und Pfleger. Hier liegt derzeit der einzig relevante Engpass. Zahlen Sie also hohe Boni an diese Menschen, Herr Scholz!\n\n({7})\n\nBei gleichzeitigem Ende des Lockdowns amortisiert sich dieses Invest tausendfach. Wir haben alle diese Ausgaben – ebenso die zum Schutz der Risikogruppen – seit März immer mitgetragen. Niemand steht hier im Weg. Tun Sie mehr bei diesem einzigen Engpass „Intensivstationen“, der saisonal ab Dezember gar nicht selten ist und wie bei vielen Grippewellen noch bis März weiterbestehen wird.\n\nDie Rettung der deutschen Wirtschaft und Gesellschaft kann nur über das schnelle Ende des Lockdowns kommen, nicht über verfassungswidrige massenhafte Bürgerrechtseinschränkungen, nicht über unbezahlbare Dauersubventionen, nicht über Coronasteuererhöhungen, nicht über Massenquarantänen und keinesfalls über unzureichend getestete Impfungen oder gar über eine faktische Impfpflicht, die wir kategorisch ablehnen.\n\nHerzlichen Dank.\n\n({8})"
"1051371","Bruno","Hollnagel","AfD","Member of Parliament","2020-12-08T00:00:00.000Z","https://dip21.bundestag.de/dip21/btp/19/19197.pdf","\n\nSehr geehrter Herr Präsident! Meine sehr verehrten Damen und Herren! Der Haushalt spiegelt eine neue Normalität wider, eine Normalität, die erschreckend ist. Euro-Krisen, Staatsschuldenkrisen, Haushaltskrisen, Bankenkrisen, Wirtschaftskrisen und Lockdown-Krise – alles steuert auf einen Kollaps hin. Die Lösung der Regierung: Planwirtschaft, gigantische Neuverschuldung, Enteignung der Steuerzahler, Haftungsgemeinschaften, die die Probleme verschleiern statt lösen, meine Damen und Herren.\n\n({0})\n\nDeutschland hat den Point of no Return längst überschritten. Deutschlands Nachhaltigkeitslücke beträgt 13,8 Billionen Euro. Das sind circa 400 Prozent des Bruttoinlandsproduktes, das sind ungedeckte Verpflichtungen im Umfang von circa 38 Bundeshaushalten. Das ist unbezahlbar, das ist unverantwortlich, das ist das Ergebnis einer verfehlten Politik, meine Damen und Herren.\n\n({1})\n\nWir haben mittlerweile anarchistische Zustände. Verträge werden nicht eingehalten: nicht der Maastricht-Vertrag, nicht der EU-Vertrag, nicht der Stabilitäts- und Wachstumspakt, der unter anderem eine maximale Verschuldung von 60 Prozent des Bruttoinlandsprodukts vorschreibt. Auch Italien bricht den Stabilitäts- und Wachstumspakt, lebt über seine Verhältnisse, verschuldet sich maßlos und fordert wegen der hohen Verschuldung Coronahilfen und wird auch noch mit Geldgeschenken belohnt. Meine Damen und Herren, die EU beschenkt Vertragsbrecher, und Deutschland haftet dafür. Das ist unerträglich.\n\n({2})\n\nFür den Wiederaufbaufonds will die EU 750 Milliarden Euro Schulden aufnehmen. Das widerspricht dem Verschuldungsverbot gemäß Artikel 311 AEU-Vertrag. Außerdem: Hilfen innerhalb der EU sind nur bei Naturkatastrophen in einzelnen Staaten zulässig. Ein solcher Sachverhalt liegt aber nicht vor. Folglich verstößt Next Generation EU auch gegen die No-bailout-Klausel in Artikel 122 AEUV. Von den 750 Milliarden Euro sollen 390 Milliarden Euro verschenkt werden. Der italienische Außenminister würde Mittel aus dem Fonds nutzen, um die italienischen Steuern zu senken. Da Deutschland für die Schulden des Fonds mithaftet, würde das bedeuten: Auf dem Rücken der deutschen Steuerzahler erhalten die Italiener eine Steuerreduzierung.\n\n({3})\n\nDie Regierung Merkel fordert einerseits Nachtragshaushalte und neue Steuern, andererseits macht sie Geldgeschenke und verdoppelt die EU-Beiträge. Sie macht die EU zu einem Selbstbedienungsladen ohne Kassen, und Deutschland soll der Hauptlieferant sein. Das ist unerträglich. Damit muss Schluss sein.\n\n({4})\n\nVor Kurzem war zu lesen, dass Staats- und Bankbilanzen nur noch durch Zentralbankinterventionen stabil gehalten werden können und dass das europäische Bankensystem auf faulen Krediten in Höhe von 1,4 Billionen Euro sitzt. Der ESM reicht zur Absicherung nicht annährend aus. Meine Damen und Herren, fällt ein Dominostein, werden die Ketten der Gemeinschaftshaftung uns alle mit in den Abgrund reißen. Jeder Haushaltsplan ist dann absolute Makulatur.\n\nDie Haftungsunion wird teuer für uns, wenn wir die Schulden anderer Staaten mittragen müssen. Und da wollen Sie, Herr Minister Scholz, Deutschland eine Vermögensabgabe aufdrücken? Warum fordern Sie das nicht von den reicheren Franzosen und Italienern? Das Medianvermögen der Italiener und Franzosen ist circa dreimal so groß wie das der Deutschen. Warum sollen wir eigentlich immer bezahlen?\n\n({5})\n\nHören Sie auf, über den „Corona-Nothaushalt“ eine Transferunion einzuführen. Die Zukunft unseres Landes haben Sie längst verspielt. Es ist Zeit für Alternativen, und meine Idee ist: die Alternative für Deutschland.\n\nSchönen Dank.\n\n({6})"
"1051394","Volker","Münz","AfD","Member of Parliament","2020-12-08T00:00:00.000Z","https://dip21.bundestag.de/dip21/btp/19/19197.pdf","\n\nHerr Präsident! Sehr geehrter Minister Altmaier! Liebe Kolleginnen und Kollegen! Unser Land befindet sich in der schwersten Wirtschaftskrise der Nachkriegszeit. Die von der Bundesregierung mutwillig mitverursachte Strukturkrise wichtiger Industriebereiche wie der Energieversorgung und der Automobilbranche hat schon vor Corona begonnen. Jetzt zwingt die Bundesregierung mit ihren Lockdown-Maßnahmen, die das private und gesellschaftliche Leben sowie die Wirtschaft erheblich einschränken, die ganze Volkswirtschaft zusätzlich in die Knie. Die Zwangsmaßnahmen sind unverhältnismäßig, meine Damen und Herren.\n\n({0})\n\nMeine Fraktion stimmt gegen die Feststellung einer Notsituation nach Artikel 115 Grundgesetz aufgrund einer vermeintlich epidemischen Lage und damit gegen die Aussetzung der Schuldenbremse. Damit werden nämlich bei Ausgaben und Verschuldung alle Schleusen geöffnet, als ob es kein Morgen gäbe.\n\n({1})\n\nDer Bundesrechnungshof hat recht mit seiner Kritik, dass die „unzureichende Tragfähigkeit der Bundesfinanzen schonungslos“ zutage tritt. Die immense Neuverschuldung des Bundes von insgesamt 400 Milliarden Euro im laufenden und im nächsten Jahr bürdet den Bürgern große Lasten auf, die unsere Kinder noch werden abtragen müssen.\n\n({2})\n\nSteuererhöhungen werden die zwangsläufige Folge davon sein. Staatlich geförderte Insolvenzverschleppung und die auf Pump finanzierten Konjunkturprogramme und die Übernahmen von Unternehmen durch den Bund können langfristig keine Lösung sein, meine Damen und Herren.\n\n({3})\n\nZu den teuren Beschlüssen vor Corona, insbesondere dem Kohleausstieg, kommen jetzt die teuren Hilfsmaßnahmen wegen des Lockdowns hinzu. Die horrende Neuverschuldung des Staates wird durch die Negativzinspolitik und den Ankauf von Staatsanleihen durch die Zentralbank ermöglicht. Geldschöpfung ersetzt aber keine Wertschöpfung, meine Damen und Herren. Gerade jetzt in der Krise wäre es wichtig, die Wirtschaft nicht noch zusätzlich unter Druck zu setzen. Doch das Gegenteil passiert. Die Bundesregierung hält an der groß angelegten Transformation der Wirtschaft fest.\n\n({4})\n\nDeutschland hat aufgrund der Energiewende schon jetzt die höchsten Strompreise in Europa. Daran werden auch die 10 Milliarden Euro des Bundes zur Verhinderung des Anstiegs der EEG-Umlage und eine weitere Milliarde Euro für die stromintensive Industrie nichts ändern.\n\nDas Abschalten der Kern- und Kohlekraftwerke vernichtet Volksvermögen in gigantischem Ausmaß. Für Entschädigungen an die Kraftwerksbetreiber kommt selbstverständlich der Steuerzahler auf. Die Abschaltung des erst vor fünf Jahren in Betrieb genommenen modernen Kohlekraftwerks in Hamburg-Moorburg zum Ende dieses Jahres ist doch ein Irrsinn, meine Damen und Herren.\n\n({5})\n\nJetzt wäre es richtig, die Laufzeiten der noch laufenden Kernkraftwerke über das Jahr 2022 hinaus zu verlängern\n\n({6})\n\nund den Kohleausstieg zu stoppen oder zumindest ein Moratorium einzuführen. Die Versorgungssicherheit ist gefährdet. Wie die Bundesregierung den Ausstieg aus der Kernenergie, den Ausstieg aus der Kohleverstromung und gleichzeitig die Umstellung des gesamten Verkehrs auf strombetriebene Fahrzeuge bewerkstelligen will, ist bis heute nicht einmal annähernd überzeugend geklärt.\n\n({7})\n\nNachdem in der Stromversorgung schon Planwirtschaft herrscht, wird auch in der Automobilindustrie die Markwirtschaft abgeschafft.\n\n({8})\n\nStatt horrender Subventionen von bis zu 6 000 Euro staatlicher Prämie pro Elektroauto, statt technisch nicht erfüllbarer Grenzwerte und anderer Reglementierung sollte eine Technologieoffenheit herrschen und der Markt wieder wirken können.\n\n({9})\n\nPlanwirtschaft ging noch nie gut, meine Damen und Herren.\n\n({10})\n\nHerr Bundesminister, stoppen Sie außerdem die EU-Kommissionpräsidentin Ursula von der Leyen, damit sie nicht nach der Bundeswehr auch noch die deutsche Automobilindustrie zerstört.\n\n({11})\n\nDie von ihr forcierte Abgasnorm Euro 7 würde das Aus für den Verbrennungsmotor ab 2025 bedeuten; dies würde 100 000 Arbeitsplätze vernichten. Ich appelliere an die Bundesregierung: Hören Sie auf, Experimente zu wagen!\n\n({12})\n\nKehren Sie zurück zu Vernunft und Augenmaß in der Industrie- und Energiepolitik sowie bei den Coronamaßnahmen!\n\nIch bedanke mich für Ihre Aufmerksamkeit.\n\n({13})"
"1051413","Steffen","Kotré","AfD","Member of Parliament","2020-12-08T00:00:00.000Z","https://dip21.bundestag.de/dip21/btp/19/19197.pdf","\n\nSehr geehrter Herr Präsident! Sehr geehrte Damen und Herren! Herr Bundesminister Altmaier, darf ich Sie beim Wort nehmen? Keine Steuererhöhungen mit Ihnen? Habe ich das so richtig verstanden? – Ja. Sehr schön, sehr gut. Das ist, glaube ich, auch der richtige Weg.\n\nNoch mal zu der Bemerkung, dass sinkende Strompreise ein Problem wären. Das sind sie nicht. Es ist kein Problem, wenn die Börsenpreise sinken. Das ist nur dann ein Problem, wenn wir uns in einer Planwirtschaft befinden. Leider befinden wir uns in einer Planwirtschaft,\n\n({0})\n\nund da mag das durchaus ein Problem sein, weil ja alles miteinander verknüpft ist. Dann muss man hier und dort daran drehen, statt den Markt einzusetzen und die Marktmechanismen wirken zu lassen. Wenn sich Preise für die Konsumenten verringern, dann ist das nur gut, meine Damen und Herren.\n\n({1})\n\nDas Unternehmen Tesla baut gerade in Brandenburg ein Werk, und es baut auf dem Werksgelände gleich auch noch die Stromversorgung mit auf. Es wird ein Erdgaskraftwerk dort miterrichtet. Warum? Weil sich dieses Unternehmen nicht mehr auf die deutsche Stromversorgung verlassen kann. Leider ist das so. Die Energiewende zerstört hier gerade unsere gesicherte Stromversorgung, und das ist ein Armutszeugnis, meine Damen und Herren.\n\n({2})\n\nDer Chef des Unternehmens Tesla, Herr Elon Musk, ist darüber hinaus ein Realist.\n\n({3})\n\n– Musk, jawohl; entschuldigen Sie bitte. – Er hat sich für die zukunftsweisende Kernenergie ausgesprochen. Er macht in E-Mobilität, weiß aber ganz genau, dass Erneuerbare allein nicht reichen. Deshalb spricht er richtigerweise davon, dass wir Kernenergie brauchen. Damit hat er natürlich recht, meine Damen und Herren. Energie trägt zu unserem Fortschritt bei.\n\nDer Fortschritt in der Energiegewinnung liegt darin, den Flächenverbrauch bei der Energiegewinnung pro Energieeinheit zu verringern und den Erntefaktor ständig zu erhöhen. Das wird also die Intensität erhöhen. Das kriegen wir nur mit moderner Energiegewinnung hin, also nur mit Kernkraft, meine Damen und Herren. Die Folge dessen, dass wir immer bessere Energieerzeugungssysteme haben, ist unter anderem auch, neben anderen Aspekten, dass die Energie auch in Ländern der Dritten Welt preiswert ist.\n\nWir schlagen leider gerade den anderen Weg ein: Unsere Energie wird immer teurer. Aber in Afrika zum Beispiel ist das ein Faktor für die Menschen. Nicht allein deshalb nimmt dort die Anzahl der Leute, die in extremer Armut leben, ab. Eben auch wegen preiswerter Energie, die diejenigen, die die Energiewende hier voranbringen wollen, ihnen vorenthalten wollen.\n\n({4})\n\nLiebe Freunde,\n\n({5})\n\nim Haushalt lesen wir ständig von der Subvention von E-Mobilität. Aber was bedeutet „die Subvention von E-Mobilität“? Das bedeutet: die Subvention von Konsum. Wenn jemand ein E-Auto fahren möchte, dann sei ihm das vergönnt. Aber wenn wir sein Kaufinteresse jetzt auch noch damit stützen, dass wir ihm Geld geben, dann widerspricht das der Marktwirtschaft, meine Damen und Herren.\n\nNein, wir sollten stattdessen Förderung fordern. Wir sollten stattdessen Subventionen in zukunftsfähige Energiekonzepte fordern und unser Geld dort gut anlegen. Das kann nur die Kernenergie sein.\n\n({6})\n\nDie Russen haben Schiffe mit Kernkraftwerken, die sie überallhin bringen können.\n\n({7})\n\nDie Chinesen haben die Kernfusion für zehn Sekunden hinbekommen. Wir werden technologisch leider abgehängt, und das spiegelt sich leider in diesem Haushalt wider: dass er nicht zukunftsweisend ist. Insofern müssen wir ihn leider ablehnen."
"1051415","Steffen","Kotré","AfD","Member of Parliament","2020-12-08T00:00:00.000Z","https://dip21.bundestag.de/dip21/btp/19/19197.pdf","\n\nUnser Vorschlag ist, Deutschland zukunftsfest zu machen, technologiefest zu machen und auch wieder in die Kernenergie, in die Forschung zu investieren.\n\nDanke schön.\n\n({0})"
"1051435","Leif Erik","Holm","AfD","Member of Parliament","2020-12-08T00:00:00.000Z","https://dip21.bundestag.de/dip21/btp/19/19197.pdf","\n\nSehr geehrte Bürger! Herr Präsident! Meine Damen und Herren! Lieber Kollege Linnemann, das waren hervorragende Punkte, die Sie hier angebracht haben. Aber ich möchte an eines erinnern: Sie stellen als tragende Fraktion diese Regierung. Setzen Sie es endlich um! Genau das, was Sie gesagt haben, brauchen wir; aber diese Bundesregierung liefert nicht.\n\n({0})\n\nUnsere Wirtschaft ächzt unter dem neuen Lockdown, der sich „Lockdown light“ nennt. Es gibt ja mittlerweile sogar schon Stimmen, die sich dafür aussprechen, das Ganze zu verschärfen – sie kommen vorwiegend von südlich des Weißwurstäquators –, und das halten wir für unverantwortlich. Schon jetzt ist eine große Pleitewelle absehbar. Wir werden Hunderttausende, wenn nicht Millionen neue Arbeitslose bekommen. Die Verschuldung nimmt ungeahnte Ausmaße an. Das können wir nicht auf Dauer fortsetzen.\n\n({1})\n\nWir können nicht Milliarden-Hilfspakete noch und nöcher auflegen. Sie funktionieren ja nicht mal; auch das ist angesprochen worden. Wir haben die Novemberhilfen, und die Bescheidung dauert bis ins nächste Jahr hinein. Die Software kommt im nächsten Jahr. Und da können Sie, Herr Minister, doch nicht behaupten, dass es gut liefe.\n\n({2})\n\nEs läuft nicht gut in dieser Corona-Lockdown-Krise.\n\n({3})\n\nDann koppeln Sie die Hilfen auch noch an den Umsatz: 75 Prozent des Vorjahresumsatzes sollen die Firmen bekommen. Darüber lacht mittlerweile ganz Deutschland. Da muss man – ganz ehrlich – mitlachen. Bei einer 75-prozentigen Umsatzerstattung hat zumindest jemand mit relativ geringen Fixkosten am Ende mehr übrig als vorher. Herr Minister Altmaier, Sie und Ihr Kollege Scholz haben hier eine echte Peinlichkeit geliefert.\n\n({4})\n\nHaben Sie denn in Ihren Ministerien niemanden mehr, der mal in der freien Wirtschaft war? Hilfen müssen natürlich an Fixkosten gebunden sein.\n\nUnd wir brauchen zielführendere Instrumente; auch das hat Herr Linnemann schon angesprochen. Ja, wann kommen sie denn endlich, die Verlustrückträge auch in die Vorjahre vor 2019? Das wäre ein zielführendes Instrument. Wenn Sie, Herr Minister Altmaier, das mittlerweile auch so sehen, dann setzen Sie es in dieser Bundesregierung doch bitte endlich durch. Stattdessen reden Sie weiter übers Klima,\n\n({5})\n\nüber den Green Deal und über Taxonomie, also grüne Wirtschaftslenkung in sowjetischem Maßstab.\n\n({6})\n\nSie wollen mehrere Milliarden in E-Autos stecken, die ohne Prämie kein Mensch kaufen will, weil sie völlig unpraktikabel sind. Sie erhöhen im Namen des Klimas die Spritpreise und im Januar die Heizkosten; die Mehrwertsteuer steigt wieder auf 19 Prozent. Halten Sie das wirklich für eine sinnvolle Politik in einer Zeit, in der Millionen Unternehmer und ihre Mitarbeiter ums Überleben kämpfen? – Wir jedenfalls nicht.\n\n({7})\n\nBesser noch: Jetzt denkt die SPD – die gerade besonders laut ruft, Herr Gremmels; ich bin ja schon dankbar, wenn Sie hier im Plenum sitzen; dann können Sie wenigstens nicht weiter daran arbeiten – sogar über einen Coronasoli nach.\n\n({8})\n\nDas wäre der völlig falsche Weg. Niemals einen Coronasoli! Denn der hilft uns, bei Gott, in dieser Phase überhaupt nicht.\n\n({9})\n\nWas wir brauchen, sind zielgerichtete, funktionierende Hilfen, verbesserte Rahmenbedingungen. Ein Ende des Lockdowns ist auch sehr wichtig. Das Strangulieren der Wirtschaft muss endlich aufhören. Wir müssen unsere Risikogruppen schützen – ja, das ist richtig –, wir müssen das Virus in Schach halten – ohne Frage –,\n\n({10})\n\nwir müssen unsere Senioren und auch diejenigen mit Vorerkrankungen schützen, aber lassen wir unsere Wirtschaft endlich wieder arbeiten. Wir brauchen diese Wirtschaft für unseren Wohlstand. Damit wir unsere Risikogruppen schützen können, brauchen wir eine funktionierende Wirtschaft; denn – das steht doch völlig außer Frage – ohne die Wirtschaft haben wir die Mittel dafür nicht.\n\nVielen Dank.\n\n({11})"
"1051449","Martin","Hohmann","AfD","Member of Parliament","2020-12-08T00:00:00.000Z","https://dip21.bundestag.de/dip21/btp/19/19197.pdf","\n\nSehr geehrter Herr Präsident! Frau Ministerin! Liebe Kolleginnen und Kollegen! Die AfD sieht sich in vielen Politikfeldern in die Rolle der Fundamentalopposition gedrängt. Tatsächlich sind wir aber eine Rationalopposition.\n\n({0})\n\nDas beinhaltet den Vorwurf, die Regierung sei weit von Rationalität, von Vernunft und von Berechenbarkeit abgewichen.\n\n({1})\n\nJa, das ist so. So ist es im Umwelthaushalt, und so ist es auch bei den dramatischen Wendeentscheidungen der Kanzlerin Angela Merkel.\n\nAber nicht nur die Wendeentscheidungen der Kanzlerin sind von großer Bedeutung und haben äußerst schwerwiegende Konsequenzen. Nein, es gibt kleine, symbolische Gesten. Sie sagen mehr als viele, geschwurbelte Worte. Eine solche Geste war etwa die Fahnenentsorgung durch Kanzlerin Merkel am Tag des Wahlsieges. Mehrere hochrangige Persönlichkeiten stehen auf der Bühne, ein nichtsahnender Generalsekretär will seine rührend reine Freude über den Wahlsieg mit dem Schwenken einer kleinen Deutschlandflagge zum Ausdruck bringen.\n\n({2})\n\n– Entsorgung einer Deutschlandflagge, Herr Kollege! – Mit zielgerichteter Schnelligkeit entreißt die Kanzlerin dem verdatterten Generalsekretär die kleine Fahne und entsorgt sie. In keinem anderen Land der Welt ist solch ein Vorgang vorstellbar, meine Damen und Herren, –\n\n({3})"
