id,firstname,lastname,faction,position,date, url,speech
"1052021","Wolfgang","Wiehle","AfD","Member of Parliament","2020-12-10T00:00:00.000Z","https://dip21.bundestag.de/dip21/btp/19/19199.pdf","\n\nSehr geehrte Frau Präsidentin! Kolleginnen und Kollegen! Früher gab es im Sozialismus bekanntlich Fünfjahrespläne. Heutzutage genügt das nicht mehr. Jetzt müssen es Zehnjahrespläne sein, die der Ökosozialismus des Green Deal der EU hervorbringt. Die Planziele sind ehrgeizig. In zehn Jahren sollen die CO2-Emissionen des Verkehrs drastisch sinken. Erst war von 40 Prozent die Rede, dann von 50 Prozent und jetzt von 55 Prozent. Den Bürgern wird das sehr harte Einschnitte abverlangen: als Steuerzahler, als Verkehrsteilnehmer und auch als Arbeitnehmer in der Automobilindustrie.\n\n({0})\n\nZur gleichen Zeit entsteht in China jedes Jahr eine zweistellige Zahl neuer Kohlekraftwerke. Der europäische Ehrgeiz in der Klimaplanwirtschaft wird dadurch völlig ad absurdum geführt, aber die angeblich reichen Deutschen können es ja zahlen.\n\nDie etablierte Politik will nicht nur Millionen von E-Autos in den Markt pressen, sondern auch die Fahrgastzahlen der Bahn verdoppeln. Dazu sind gewaltige Ausbaumaßnahmen notwendig, für die im Bundeshaushalt 2021 viele verschiedene Titel zu finden sind. Wenn man die Bahn dort ausbaut, wo sie wirklich gut ist, dann hat das ja auch Sinn, nämlich überall dort, wo sie große Verkehrsströme bündeln kann.\n\n({1})\n\nMehr schnelle Bahnstrecken, die Städte verbinden und Inlandsflüge ersetzen: gut. Mehr Züge im kombinierten Verkehr, rollende Landstraßen statt Lkw-Staus auf den Autobahnen: gut. Elektronische Signalsysteme und Digitale Automatische Kupplungen für die Güterwagen: Ja, bitte, die Bahn braucht moderne Technologien.\n\nIm System Eisenbahn gibt es in Deutschland aber auch eine Menge alter Zöpfe, die endlich abgeschnitten werden müssen.\n\n({2})\n\nDazu gehören die Hunderte von Beteiligungsunternehmen des Bahnkonzerns in aller Herren Länder, die der Kollege Bühl schon erwähnt hat. Dazu gehört auch die Vorstellung, dass die Bahn ein Börsenunternehmen sein könnte, einschließlich vieler dafür geschaffener Strukturen.\n\nDer Staat ist für die Infrastruktur verantwortlich. So ist das bei den Autobahnen und bei den Wasserstraßen, und so ist das auch bei der Eisenbahn. Der Zugbetrieb muss aber nach den Regeln des Wettbewerbs ablaufen, sei es in direkter Konkurrenz verschiedener Anbieter wie beim Schienengüterverkehr oder in Form von Ausschreibungen wie beim Regionalverkehr. Dass der Fernverkehr auch im Wettbewerb stattfinden soll, wird in der Praxis immer mehr zur Fiktion. Da ist von Eigenwirtschaftlichkeit die Rede, also davon, dass die Bahn diejenigen Züge betreibt, die ihr auch Gewinn bringen. In Coronazeiten läuft das aber anders. Ich will den Sinn der zusätzlichen Züge für mehr Abstand in den Waggons gar nicht bestreiten. Nur ist die Rede von der Eigenwirtschaftlichkeit eben eine fromme Lüge, wenn man die Verluste über Kapitalerhöhungen wieder ausgleichen will und dafür Diskussionen mit der EU-Kommission bekommt.\n\n({3})\n\nIn Österreich gibt es jetzt Coronanotvergaben für bestimmte Fernverbindungen. Das darf nicht die Regel werden. Aber für erwünschte, jedoch nicht wirtschaftliche Angebote sollten wir Ausschreibungen nicht länger ausschließen.\n\nMit diesen Lebenslügen und alten Zöpfen aufzuräumen und einen realistischen marktwirtschaftlichen Rahmen zu definieren, das muss Ziel einer Bahnreform 2.0 sein. Von der ist im Moment aber weit und breit nichts zu sehen.\n\n({4})\n\nMut zum Blick auf die Wirklichkeit, Mut zur Wahrheit – das wird die AfD-Fraktion immer einfordern. Dem Weg in den Ökosozialismus stellen wir uns konsequent entgegen.\n\n({5})"
"1052033","Ulrike","Schielke-Ziesing","AfD","Member of Parliament","2020-12-11T00:00:00.000Z","https://dip21.bundestag.de/dip21/btp/19/19200.pdf","\n\nSehr geehrter Herr Präsident! Sehr geehrte Damen und Herren! Verehrte Bürger! In diesen Coronazeiten – wir haben es in dieser Woche schon öfter gehört – ist wenig normal. Die Bewältigung der Coronakrise hat erhebliche Auswirkungen auf den Bundeshaushalt.\n\nBesonders davon betroffen ist – kein Wunder – der Bereich des Einzelplans 11, Arbeit und Soziales. Der Haushaltsentwurf 2021 für das Bundesministerium für Arbeit und Soziales hat einen Umfang von insgesamt rund 165 Milliarden Euro und ist damit wieder der größte Einzelplan im Bundeshaushalt. Vom Entwurf bis zur Bereinigungssitzung wuchs dieser Haushaltsplan auf knapp 1 Milliarde Euro auf.\n\nEin Teil dieses Aufwuchses ist nachvollziehbar, da sich einige Zuschüsse und Leistungen an die Herbstprojektion und die Steuerschätzung anlehnen und dadurch zur Bereinigungssitzung angepasst werden. Was mich aber ärgert, sind neue Maßnahmen, die erst zur Bereinigungssitzung auftauchen und für die dann neue Mittel beantragt werden. Im letzten Jahr waren es die Hilfen für Zeitungszusteller, in diesem Jahr sind es knapp 5 Millionen Euro für die Förderung der Sicherung von Arbeitsplätzen an deutschen Häfen. Das mag ja alles gut sein – oder gut gemeint. Aber fallen solche Ideen immer kurz vor der Bereinigungssitzung vom Himmel und werden dann noch schnell eingebracht? Sollten nicht die Abgeordneten aller Parteien vorher die Chance haben, sich in den Einzelplanberatungen über diese Maßnahmen zu informieren? Wir sollen hier einen Blankoscheck über 5 Millionen Euro ausstellen für einen Antrag, dessen Begründung nur einen Satz umfasst. Das ist nicht sauber.\n\n({0})\n\nSauber ausgestaltet ist leider auch nicht die Finanzierung der Grundrente. Dabei haben Sie das, Herr Minister Heil, in den Beratungen zur Grundrente immer wieder versprochen. Nun versteckt sich die Finanzierung des Ganzen in ungenau abgerechneten Bundeszuschüssen und einer globalen Minderausgabe in Höhe von 400 Millionen Euro. Es wird also mit Einsparungen im eigenen Haushalt geplant, um die Grundrente finanzieren zu können. Und was ist, wenn die geplanten Mittel nicht ausreichen? Werden dann wieder neue versicherungsfremde Leistungen generiert? Wir müssen hier vor allem eines sehen: Die Ausgaben für die Grundrente sind keine einmaligen Ausgaben, die man notgedrungen dieses eine Mal im Haushalt zusammenkratzt und wo man froh ist, das irgendwie finanziert zu haben. Die Grundrente wird ab dem nächsten Jahr ein stetiger Ausgabeposten im Haushalt sein. Soll dann die Finanzierung immer so laufen, über globale Minderausgaben?\n\nWie wir die Grundrente solide und sauber und vor allem nachvollziehbar finanzieren können, haben wir als AfD-Fraktion in den Haushaltsberatungen aufgezeigt. Es wäre schön gewesen, hätten Sie, Herr Minister Heil, diese Idee zur Bereinigungssitzung aufgegriffen. Aber gut, mit diesem von Ihnen geschaffenen Durcheinander wird sich dann der nächste Arbeitsminister herumschlagen müssen.\n\nIn den Haushaltsberatungen haben wir als AfD-Fraktion aufgezeigt, wie sich Geld sparen ließe, wenn sich die Bundesregierung und die Länder an bestehende Gesetze halten würden. Es geht hier um die anfallenden Kosten für abgelehnte Asylbewerber, die nicht abgeschoben werden. Das sind immerhin 4,4 Milliarden Euro allein im Einzelplan 11. Ein weiteres Einsparpotenzial ist die Bundesbeteiligung an den Kosten der Unterkunft. Die Bundesbeteiligung wurde prozentual erhöht, die Prüfbefugnisse des Bundesrechnungshofes verringert. Dabei gibt es gerade in diesem Bereich sehr viele Missbrauchsfälle. Der Bundesrechnungshof hat in seiner Stellungnahme zu den KdU-Leistungen bemängelt, dass die Kosten der Unterbringung von Flüchtlingen oft mehr als doppelt so hoch liegen wie die ortsübliche Vergleichsmiete. Hier jetzt mehr Geld zu verteilen und weniger zu prüfen, wird die Länder und Kommunen nun gerade nicht dazu anhalten, sparsam mit diesen Mitteln umzugehen.\n\n({1})\n\nWir haben außerdem einen Haushaltsvermerk eingebracht, der die Höhe der Zuschüsse an die Deutsche Rentenversicherung kritisiert und einen konsequenten Ausgleich der versicherungsfremden Leistungen fordert.\n\nIm Ergebnis sind wir mit diesem Haushaltsplan nicht einverstanden und werden ihn ablehnen.\n\nDer Gesamthaushalt, wie wir ihn in dieser Woche debattieren, umfasst ein Ausgabevolumen von knapp 500 Milliarden Euro, dem nur geschätzte 293 Milliarden Euro an Steuereinnahmen gegenüberstehen. Es müssen Schulden in Höhe von rund 180 Milliarden Euro aufgenommen werden. Wir bezahlen damit also auch unsere Sozialleistungen über Kredite. Es ist richtig und notwendig, Betrieben und Arbeitnehmern zu helfen, wenn Umsätze einbrechen, Einkommen plötzlich wegfallen und sich viele Menschen unverschuldet in existenzieller Krise befinden. Vor allem, da es in erster Linie die fragwürdigen Lockdown-Maßnahmen einer nicht demokratisch legitimierten Kungelrunde der Kanzlerin mit den Ministerpräsidenten waren und sind, wegen derer heute ganze Branchen in ihrer Existenz gefährdet sind.\n\n({2})\n\nWenn aber Unternehmen und Beschäftigte mit immer neuen Hilfsmaßnahmen gerettet werden müssen, ist die Frage – auch die wurde in dieser Woche öfter gestellt –: Wer soll das bezahlen, wie lange und vor allem wovon? Was Sie tun, ist Folgendes: Sie stopfen Löcher mit Geld, das Sie nicht haben, und schieben die Belastung in die Zukunft.\n\n({3})\n\nZur Wahrheit gehört aber auch: Das ist nicht neu und hat mit Corona nicht viel zu tun. Die Ausgaben für Sozialleistungen – darum handelt es sich ja im Wesentlichen im Einzelplan 11 – steigen seit Jahren. Das ist kein Grund zur Freude und kein Grund, sich auf die Schulter zu klopfen; denn unser Etat zeigt wie durch ein Brennglas die Schieflage einer einfallslosen und kurzsichtigen Wirtschafts- und Sozialpolitik. Die Schulden von heute sind die Steuern von morgen. Das ist eine Binse. Ich ergänze: Die Kurzarbeiter von heute sind die Arbeitslosen von morgen und die armen Rentner von übermorgen.\n\n({4})\n\nIndem wir den Menschen über Sozialleistungen das zurückgeben müssen, was wir ihnen vorher an Steuern und Abgaben abgenommen haben, schaffen wir keine Beitragszahler, sondern zukünftige Leistungsempfänger in einem Transferleistungsstaat, den wir uns dann nur nicht mehr leisten können. Das, liebe Kolleginnen und Kollegen, ist das Hauptproblem Ihrer Sozialpolitik.\n\nVielen Dank.\n\n({5})"
"1052051","René","Springer","AfD","Member of Parliament","2020-12-11T00:00:00.000Z","https://dip21.bundestag.de/dip21/btp/19/19200.pdf","\n\nHerr Präsident! Meine sehr verehrten Damen und Herren! Nun hat sich die Große Koalition 50 Minuten lang selbst gelobt und dabei völlig vergessen, über den rosa Elefanten zu sprechen, der hier mitten im Raum steht,\n\n({0})\n\naber das kennen wir schon. Deshalb: Lassen Sie uns mehr Realität wagen! Gerade noch 15 Millionen Nettosteuerzahler finanzieren heute ein Heer von über 5,5 Millionen Hartz-IV-Empfängern. Das ist fast die gesamte Bevölkerung Dänemarks; nur damit man es mal gehört hat.\n\nZu diesen Hartz-IV-Empfängern gehören auch über 2 Millionen ausländische Staatsbürger. Vor fünf Jahren waren es fast 600 000 weniger.\n\n({1})\n\n– Ich will mal auf 10 Sekunden kommen; ich arbeite daran. – Diese 2 Millionen nichtdeutschen Leistungsbezieher kosten uns etwa 13 Milliarden Euro im Jahr, und da sind die Ausgaben für Asylbewerber und ausländische Sozialhilfeempfänger noch nicht einmal mit eingerechnet.\n\n({2})\n\nDas alles erwähnen Sie hier mit keinem einzigen Wort. Dafür haben Sie schon Schwielen an den Händen vom gegenseitigen Schulterklopfen für Ihre Grundrente, die Sie dreisterweise „Respektrente“ nennen, für die Sie aber gerade einmal 1,3 Milliarden Euro aufbringen, also nur ein Zehntel dessen, was Sie für ausländische Hartz-IV-Empfänger zahlen.\n\n({3})\n\nSie speisen unsere Eltern und Großeltern mit Armutsrenten ab, während Sie die Früchte ihrer Lebensleistung völlig verantwortungslos an alle Welt verschleudern.\n\n({4})\n\nVon 2012 bis 2019, also in nur sieben Jahren, sind rund 4 Millionen Menschen aus aller Welt nach Deutschland gekommen. Das ist etwa die Einwohnerzahl von Brandenburg und Mecklenburg-Vorpommern zusammengenommen. Im Gegenzug haben 3,4 Millionen Deutsche, etwa die Einwohnerzahl Berlins, das Land verlassen: meist hochqualifizierte Fachkräfte, die woanders bessere Perspektiven vorfinden als im ausgemerkelten Land mit der höchsten Steuer- und Abgabenlast der Welt.\n\n({5})\n\nDie Leistungsträger von heute fliehen, und die, die unseren Wohlstand aufgebaut haben, verarmen. Seit Amtsantritt der Bundeskanzlerin hat sich die Zahl der Rentner, die auf Sozialhilfe angewiesen sind, fast verdoppelt. 1,3 Millionen Altersrentner müssen zusätzlich arbeiten gehen. Da sind die Flaschensammler, die man leider immer häufiger in unseren Stadtbildern sieht, nicht mit dabei.\n\nUnd dennoch wollen Sie im vorliegenden Haushalt, dass der Bund jetzt auch noch zu 100 Prozent die Kosten der Unterkunft für jene neuen Asylforderer übernimmt, die einzelne Kommunen noch zusätzlich aufnehmen wollen, darunter die etwa 220 Kommunen der Initiative Seebrücke, die auch von der Antifa und anderen gewaltbereiten Linken unterstützt wird,\n\n({6})\n\nim Übrigen auch vom Potsdamer Oberbürgermeister, Ihrem SPD-Kollegen, Herr Minister.\n\n({7})\n\nDas heißt, zumeist links-grün regierte Kommunen locken nun als sogenannte sichere Häfen eigenmächtig Asylsucher ins Land, während wir angesichts drohender Massenarbeitslosigkeit und einer Viertelmillion Ausreisepflichtiger in Deutschland vielmehr eine Abschiebeoffensive bräuchten.\n\n({8})\n\nDer deutsche Arbeitnehmer darf diese Menschen dann über den Bundeshaushalt mittels Hartz IV und Wohnkosten voll finanzieren, während er selbst die höchste Lebensarbeitszeit aller Euro-Länder ableisten muss, die niedrigsten Renten bekommt und am wenigsten Vermögen in der Tasche hat.\n\nNun wollen Sie im kommenden Jahr mehr als 164 Milliarden Euro für Sozialpolitik ausgeben. Das sind über 26 Milliarden Euro mehr als im letzten Jahr. Allein diese Steigerung von 26 Milliarden Euro ist mehr, als Sie insgesamt in Bildung und Forschung stecken, und doppelt so hoch wie das, was Sie für Familien ausgeben wollen. Das zeigt, wo Ihre Prioritäten liegen. Ihre Prioritäten liegen nicht da, wo wir sie als AfD sehen. Sie haben unsere Kinder zum Armutsrisiko gemacht und unsere Rentner zu Bedürftigen.\n\n({9})\n\nMit diesem Haushalt haben Sie schwarz auf weiß den Nachweis erbracht, dass Ihre Politik gegen die eigenen Bürger gerichtet ist. Und das ist exakt das Gegenteil der Politik, die wir als AfD vertreten.\n\n({10})\n\nDie AfD-Fraktion lehnt diesen Haushalt ab.\n\n({11})"
"1052071","Peter","Boehringer","AfD","Member of Parliament","2020-12-11T00:00:00.000Z","https://dip21.bundestag.de/dip21/btp/19/19200.pdf","\n\nHerr Präsident! Verehrte Kolleginnen und Kollegen! Ein Haushaltsgesetz mit über 3 200 Seiten, fast 60 Stunden Ausschussberatungen mit 1 900 Änderungsanträgen, davon über 700 in der Bereinigungssitzung – dafür Dank an die Kollegen aller Fraktionen und an die Vertreter der Regierung und auch an das Ausschusssekretariat; das Team ist ja heute im Plenum anwesend. Ohne Ihre eingespielte Arbeit bis in die Nachtstunden hätten wir es nicht schaffen können. Herzlichen Dank für Ihre erneut sehr zuverlässige und wertvolle Arbeitsleistung!\n\n({0})\n\nWas hat sich in diesem letzten Haushalt der aktuellen Koalition nicht geändert? Weiterhin sind alle ideologiegetriebenen Ausgaben der vergangenen Jahre ohne jede Einsparung darin enthalten: EU-Transferkosten, Immigrationskosten, Kosten der CO2-Klimareligion wie etwa Subventionen für E-Autos, arbeitsplatzvernichtend in der deutschen Industrie – und nun zusätzlich noch hohe Lockdown-Ausgaben. Zudem hat Olaf Scholz auch noch sehr viel Geld auf Vorrat gebunkert.\n\nWie gelingen diese Wunder? Eben hat uns der Unionskollege Weiß ja weismachen wollen, dass es durch hohe Rücklagen gelingen könne. Das ist natürlich nicht so. Es gelang, Herr Weiß – der Kollege ist, glaube ich, nicht mehr da –, nur über gewaltige Schuldenaufnahme: 180 Milliarden Euro. Schon die Neuschulden 2020 von über 220 Milliarden Euro waren im laufenden Jahr nicht vollständig auszugeben, weil sie zu hoch kalkuliert waren.\n\nHunderte Milliarden Euro auf Pump werden 2021 nun aber tatsächlich aufgebraucht, allerdings beileibe nicht nur zur Epidemiebekämpfung. Mindestens 100 Milliarden Euro können im Wahljahr auch zu ganz anderen Zwecken ausgegeben werden. Der Finanzminister hat derart hohe Kredite aufgenommen, dass es tatsächlich bis zur Bundestagswahl reichen könnte. Auf Steuerbürgerkosten droht die teuerste Wahlkampffinanzierung aller Zeiten.\n\n({1})\n\nSofort nach der Bundestagswahl werden dann aber wieder die sehr großen Risiken dominieren. Der Solidaritätszuschlag etwa hat seit 2020 keine Rechtsgrundlage mehr. Hier besteht ein Haushaltsrisiko von bis zu 30 Milliarden Euro. Viele Kredite für Rettungen von Großunternehmen werden abgeschrieben werden müssen. Konzerne wie die Lufthansa, BER oder die Deutsche Bahn machen derzeit Milliardenverluste.\n\nDer mehrheitlich im Besitz ausländischer Investoren befindliche Reisekonzern TUI alleine macht 700 Millionen Euro Verluste – pro Monat. Die Regierung hat hier bereits 4,3 Milliarden Euro an Steuergeldern eingesetzt, um TUI zu retten. Auf jeden TUI-Angestellten entfällt eine Rettungssumme von 430 000 Euro. Tausende kleiner Unternehmen werden gegenüber Konzernen diskriminiert, welche beileibe nicht alle systemrelevant sind.\n\n({2})\n\nErneut liegt auch ein rechtlich bedenklicher Haushalt vor, der gegen Haushaltsprinzipien verstößt. Coronakreditgelder werden überjährig für krisenfremde Daueraufgaben genutzt; zudem werden Rücklagen in Schattenhaushalten und die Asylrücklage wieder mal nicht angetastet. Wir hatten dem Bundestag dazu bereits zum 2020er-Haushalt eine Verfassungsklage vorgelegt, und den Missbrauch der haushalterischen Notsituation sehen wir nun auch erneut wieder im Haushalt 2021. Aus alldem ergibt sich ein Steuererhöhungsrisiko oder gar die Wahrscheinlichkeit einer Steuerneueinführung: der Coronasoli. Aber das wird uns erst nach der Bundestagswahl erzählt werden.\n\nWir sehen zudem hohe Fehlbeträge im Finanzplan. „Finanzpolitischer Handlungsbedarf“ ist der Euphemismus der Regierung für: Wir haben keine Ahnung, wie wir das Loch von mindestens 42 Milliarden Euro bis 2024 stopfen sollen. – Der Finanzminister wird nach seinem letzten Amtsjahr völlig leere Kassen hinterlassen. Die Gelegenheit, im Zuge der EU-Ratspräsidentschaft bei den Verhandlungen zum neuen Finanzrahmen eine Reduktion des EU-Haushaltsbudgets zu erreichen, wurde von der Bundesregierung schlicht verpasst.\n\nVon der AfD würde die EU aus dem Bundeshaushalt kein Geld mehr enthalten für Mondmomente oder für die große planwirtschaftliche Transformation.\n\n({3})\n\nGeldgeschenke für den Mittelmeerraum im Zuge von „Next Generation EU“ würden von uns niemals mit deutschem Steuergeld finanziert. Und die EU-Schuldenaufnahme über 750 Milliarden Euro ist ein Dammbruch, der den Nichtstaat EU zu einem Gebilde mit einem ausgewachsenen faktischen Staatsbudget macht.\n\n({4})\n\nUnd zu einer illegalen Staatlichkeit passen auch gut illegale Programme. Klammheimlich wurde die bislang bilaterale Hilfe aus dem deutschen Haushalt „Ertüchtigung von Partnerstaaten“ erweitert zu einer multilateralen sogenannten European Peace Facility – eine Friedensfazilität, die aber mit Friedensförderung nichts zu tun hat. Bei diesem Fonds handelt es sich um eine Kriegskasse, um künftig die Aufrüstung von Staaten oder Rebellengruppen mit Waffen im Ausland finanzieren zu können.\n\n({5})\n\nDas wäre laut EU-Vertrag glatt illegal, wenn es nicht außerhalb des EU-Haushalts angelegt wäre. Über den deutschen Haushalt, also worüber wir hier entscheiden, ist es aber anscheinend nicht illegal.\n\nEine weitere Absurdität: Die FDP will ernsthaft Steuerreduktion bei gleichzeitiger Zustimmung zu fast 100 Milliarden Euro Neuverschuldung. Schulden statt Steuern: Ist das die neue FDP-Finanzstrategie?\n\n({6})\n\nDie AfD dagegen konnte für Unternehmen und Bürger trotz Corona ohne exzessive Verschuldung Steuern und Abgaben um 26 Milliarden Euro senken.\n\n({7})\n\nWir fordern die Bundesregierung auf, den Lockdown zu beenden und nur die kleine Risikogruppe zu schützen. Das ist zwingend und auch verantwortbar.\n\n({8})\n\nDie Fallzahlen werden zwar auf hohem Niveau bleiben – saisonal bis März, wie immer –; wichtig ist aber nur die Beherrschung der Lage in den Intensivstationen, wofür auch die AfD alles tun wird – alles! Intensivstationen aufrüsten! Die AfD trägt diese Ausgaben seit März immer mit. Die GroKo dagegen hat die Krankenhäuser seit Jahren kaputtgespart. Die Intensivstationen fahren im Winter seit Jahren am Anschlag; das ist an der Stelle nichts Neues.\n\nAuch die Kollateralschäden des Lockdowns müssen unbedingt im Blick bleiben – und ich spreche jetzt von den gesundheitlichen, menschlichen Kollateralschäden –: Massenhaft vermeidbare Todesfälle wird es Lockdown-bedingt geben wegen unterlassener Vorsorgeuntersuchungen im Bereich der Herz- oder Krebserkrankungen. Existenzängste von Arbeitslosen – und man darf das nicht kleinreden – werden zu Suiziden führen. Und ein demnächst marodes Gesundheitssystem in einem verarmenden Deutschland wird zu vielen unnötigen Toten führen. Die Zahl der weltweiten Hungertoten – der weltweiten! – durch Lockdowns liegt weit über der der offiziellen Coronatoten; es zählt sie aber niemand. Millionen Menschen werden nicht an einer Coronainfektion, sondern aufgrund der Auswirkungen des Lockdowns auf die Welternährungslage sterben.\n\n({9})\n\nWeitere Lockdown-Schäden betreffen die Bürgerrechte bis hin zum Recht auf körperliche Unversehrtheit, verletzt durch die bereits geforderte – bereits geforderte! – indirekte Impfpflicht. Die Hoffnung auf schnelle Rettung durch einen Impfstoff aber ist unrealistisch. Die Testphasen sind viel zu kurz bei einem neuen Impfprinzip, das noch nie erfolgreich bei Menschen eingesetzt wurde. Der anhaltende Lockdown – ist ja sicher – wird damit auch weiterhin zu Haushaltsbelastungen von 20 Milliarden Euro pro Monat führen. Es ist einfach nicht finanzierbar. Steuern Sie bitte um!\n\nVielen Dank.\n\n({10})"
