id,firstname,lastname,faction,position,date, url,speech
"1063729","Annalena","Baerbock","Grüne","Member of Parliament","2021-08-25T00:00:00.000Z","https://dip21.bundestag.de/dip21/btp/19/19238.pdf","\n\nHerr Präsident! Sehr geehrte Kolleginnen und Kollegen! Die Bilder aus Afghanistan der letzten Wochen waren und sind kaum auszuhalten. Viele von Ihnen, viele von uns, haben Anrufe von Menschen bekommen, die für ein deutsches Unternehmen dort arbeiten und sagen: „Ich bin hier mit meinen kleinen Kindern und ich komme einfach nicht mehr raus“, von Menschen, die jahrelang für deutsche Hilfsorganisationen gearbeitet haben und fragen: Was sollen wir denn jetzt noch machen? Verzweifelte Menschen am Flughafen, und zwischendurch hört man Schüsse und sieht rennende kleine Kinder. Nach der gestrigen Entscheidung der G 7 und Ihrer Ansage, Herr Außenminister – wir kriegen nicht mehr alle Menschen raus –, müssen wir uns vergegenwärtigen, dass diese Bilder furchtbare Realität werden. Und ehrlich gesagt, verstehe ich da einige dieser Debattenbeiträge der Großen Koalition an dieser Stelle gar nicht – getragen von der Haltung: Irgendwie ist es ja doch nicht so schlimm gelaufen.\n\nWas können Sie diesen Menschen sagen? Das sind deutsche Staatsangehörige, die mit der Ansage des deutschen Außenministers – wir kriegen nicht mehr alle raus –, jetzt in Afghanistan bleiben, mit kleinen Kindern. Das sind Frauenrechtlerinnen und Frauenrechtler, über die noch vor einer Woche gesagt wurde: Die holen wir da jetzt raus. – Die werden jetzt dort bleiben, weil Sie gesagt haben: In zwei Tagen ist dieser Evakuierungseinsatz zu Ende.\n\n({0})\n\nWenn wir unserer Verantwortung hier als Deutscher Bundestag – wir diskutieren hier ja als Parlament – nur mit einem kleinsten Ansatz gerecht werden wollen, dann müssen wir dieses Desaster jetzt aufklären und dürfen es nicht schönreden.\n\n({1})\n\nDas sind wir nicht nur den afghanischen Ortskräften, das sind wir nicht nur den über 100 deutschen Staatsangehörigen, die nach wie vor dort sind, das sind wir nicht nur den Frauenrechtlerinnen und Frauenrechtlern schuldig, die sich auf das Versprechen der Bundesregierung verlassen haben: „Wir holen euch raus“, sondern auch den Soldatinnen und Soldaten, den Bundespolizisten, den Diplomaten und Hilfsorganisationen, die unter widrigsten Umständen in den letzten 20 Jahren und zum Teil unter Lebensgefahr alles dafür getan haben, um Menschen zu schützen, um das Land aufzubauen, um Infrastruktur aufzubauen, Bildung, Wasserversorgung, eine Zivilgesellschaft. All denjenigen sind wir jetzt schuldig, zu sagen, wo die Fehler gelegen haben.\n\n({2})\n\nStellvertretend für alle hier will ich auch Herrn Hauptmann Marcus Grotian nennen. Er und viele andere haben in den letzten Wochen in Eigenregie versucht, weil Sie Ihrer Verantwortung nicht gerecht geworden sind, Ortskräfte außer Landes zu holen.\n\nNatürlich stimmen wir als Grüne diesem Mandat jetzt zu. Aber das bedeutet doch nicht, dass wir damit alles getan haben. Wenn wir diesem Mandat zustimmen, wenn wir sagen, Soldatinnen und Soldaten haben bis zuletzt alles getan, dann sollten wir den Soldatinnen und Soldaten der Bundeswehr auch ganz genau zuhören. Denn Herr Grotian hat auch noch gesagt – und damit trifft er den Kern des Problems –:\n\nWir sind von der eigenen Regierung moralisch verletzt, und das ist beschämend.\n\nEs unterstreicht, in welch außenpolitisches Desaster Sie als Bundesregierung in den letzten Wochen nicht nur die deutsche Bundeswehr, sondern die Menschen in Afghanistan, die sich auf unsere Hilfe verlassen haben, geführt haben.\n\n({3})\n\nNatürlich ist Außenpolitik, Frau Bundeskanzlerin – Sie haben Joschka Fischer zitiert –, nie einfach. Das ist ganz oft ein Dilemma. Es ist oftmals die Wahl zwischen Pest und Cholera. Und trotzdem bedeutet das dann: Man muss in Krisensituationen eine Entscheidung treffen. Und das bedeutet dann auch, dass wir, wenn eine Verteidigungsministerin hier sagt: „Ich habe Fehler gemacht“, dann doch auch sagen müssen: Was ist der Kern dieser Fehler gewesen?\n\nUnd der Kern dieser Fehler ist nicht gewesen, dass man sich in einem Dilemma entscheiden muss, sondern dass Sie als deutsche Bundesregierung –\n\n({4})\n\nund das bezieht den Außenminister, die Verteidigungsministerin, den Innenminister, aber eben auch das Kanzleramt und den Vizekanzler mit ein – politisch in den letzten Wochen, als man handeln musste, entschieden haben, dass innenpolitische Motive höher gewertet werden als unsere deutsche außenpolitische Verantwortung.\n\n({5})\n\nWarum sonst haben Sie Alarmsignale und Warnungen von deutschen Diplomaten vor Ort einfach weggewischt?\n\nNoch am 23. Juni haben wir hier in diesem Haus mit unserem Antrag zum Gruppenverfahren für Ortskräfte darum geworben, dass diese Ortskräfte herausgeholt werden, weil ihr Leben bedroht ist. Und im April, als US-Präsident Biden den Abzug angekündigt hat, haben wir auch hier an dieser Stelle darüber gesprochen, dass natürlich der Lagebericht zu Afghanistan durch das SPD-geführte Außenministerium angepasst werden muss. – Herr Mützenich, das wissen Sie ganz genau.\n\n({6})\n\nWarum haben Sie das nicht getan? Man kann ja jede Entscheidung begründen. Aber dann muss man auch dazu stehen. Warum haben Sie das nicht getan? Weil Sie weiter nach Afghanistan abschieben wollten. Das gehört zur Ehrlichkeit der Debatte mit dazu.\n\n({7})\n\nNoch wenige Tage vor dem Fall Kabuls erklärte Horst Seehofer als Innenminister gegenüber der EU in einem Brief – das können Sie nachlesen –, dass man bitte weiter nach Afghanistan abschieben soll. Ebenso erklärte der Vizekanzler Olaf Scholz in einem Interview zu diesem Zeitpunkt, dass man an den Abschiebungen weiter festhalten wolle.\n\n({8})\n\nNoch letzte Woche haben Sie im Innenausschuss – letzte Woche im Innenausschuss! – erklärt, mit den Visa habe es eigentlich nicht so viele Probleme gegeben; man hätte die ja über IOM in anderen Ländern beantragen können. Entweder wussten Sie nicht, wie die Lage in Afghanistan war, oder Sie verschließen ganz bewusst Ihre Augen.\n\n({9})\n\nSie haben die politische Entscheidung dafür getroffen, dass Visaverfahren kaum mehr möglich waren. Sprechen Sie doch mal mit den Ortskräften, die diese Visa beantragt haben! Sie hätten nach Pakistan ausreisen müssen, wohin man gar nicht mehr ausreisen konnte. Da kann man doch nicht sagen: Es war theoretisch möglich. – Nein, die Menschen waren in einer Falle.\n\n({10})\n\nWenn wir jetzt daraus politisch Konsequenzen ziehen wollen – und das haben Sie ja alle gesagt: wir müssen das aufklären –, dann bedeutet das doch auch, dass man bereit ist, sich an einen Tisch zu setzen und sich ehrlich zu fragen: Was ist wo schiefgelaufen? Wer wusste was? Warum wurden die Informationen der Dienste nicht ausgewertet?\n\n({11})\n\nDeswegen braucht es einen Untersuchungsausschuss.\n\n({12})\n\nLiebe SPD, lieber Herr Mützenich, Sie sind ja lange genug im Parlament. Nach außen klingt das irgendwie gleich: Untersuchungsausschuss oder Enquete-Kommission. Aber jeder, der in diesem Parlament hier sitzt, weiß ganz genau, was der Unterschied ist: Bei dem einen kann man Zeugen einladen und die Bereitstellung von Akten beantragen, bei dem anderen werden Schlussfolgerungen für die Zukunft getroffen. Wie sollen wir denn Schlussfolgerungen für die Zukunft treffen, wenn wir nicht bereit sind, über Fehler der Vergangenheit zu reden? Wenn Sie aufklären wollen, dann stimmen Sie der Einrichtung eines Untersuchungsausschusses jetzt noch zu!\n\n({13})\n\nDa Sie jetzt schon im Außenministerium, Verteidigungsministerium und Kanzlerinamt damit anfangen, mit dem Finger aufeinander zu zeigen und darüber zu diskutieren, wer wie wo schuld ist, haben wir im Auswärtigen Ausschuss ein Löschmoratorium beantragt, damit Akten jetzt nicht gelöscht werden.\n\n({14})\n\nWir haben ja schon mal erlebt, dass plötzlich die Akten verschwunden sind. Dass Sie von SPD und CDU/CSU dem nicht zugestimmt haben, sondern das abgelehnt haben, zeigt, dass Sie an Aufklärung nicht interessiert sind.\n\n({15})\n\nNatürlich rufen Sie jetzt rein: Ja, das ist jetzt Opposition!\n\n({16})\n\n– Nein! Wissen Sie was?\n\n({17})\n\nWenn wir über Mädchen- und Frauenrechte reden, dann reicht es doch nicht, zu sagen: Die müssen wir irgendwie stärken.\n\n({18})\n\nWenn wir die Berichte hören, dass Taliban jetzt wieder durch das Land ziehen, wenn wir hören, dass sie erst von den Familien in den Dörfern bekocht werden und dann 10- bis 70-Jährige vergewaltigen, dann können wir doch nicht sagen: Wir warten auf die nächste Bundesregierung, das nächste Parlament, und gucken dann mal, wie wir aufklären. – Nein, unsere Verantwortung ist, das hier gemeinsam in diesem Moment zu beschließen.\n\n({19})\n\nDas bedeutet auch, hier in diesem Moment alles zu tun, was wir tun können. Das bedeutet, jetzt einen Afghanistan-Gipfel einzuberufen, an dem alle NATO-Staaten und die Anrainerstaaten beteiligt sind,\n\n({20})\n\ndamit wir über die Unterstützung im Land reden können, damit wir über die Unterstützungsmission der Vereinten Nationen vor Ort reden können. Es bedeutet auch, in Zukunft eine aktive Außenpolitik zu betreiben und sich nicht immer wegzuducken.\n\nIch wundere mich wirklich sehr – bei allem Respekt –, Frau Bundeskanzlerin, dass Sie hier nach 16 Jahren Amtszeit – 16 Jahre von 20 Jahren! – am Ende sagen: Ich habe ganz viele Fragen. – Auch diese Fragen wurden in diesem Deutschen Bundestag 16 Jahre lang immer wieder diskutiert:\n\n({21})\n\nWarum gibt es keinen politischen Prozess? Was passiert, wenn immer nur Aufstandsbekämpfung betrieben wird? Was passiert, wenn eine US-Regierung sich vor allen Dingen auf Terrorismusbekämpfung konzentriert und die Zivilgesellschaft nicht unterstützt wird? Was passiert, wenn die Korruption nicht bekämpft wird? – Wir haben immer wieder gefordert: Wir müssen das evaluieren.\n\n({22})\n\nDas haben Sie von der Unionsfraktion immer wieder abgelehnt. Das ist eines der Probleme, weswegen wir heute so dastehen.\n\n({23})"
"1063731","Annalena","Baerbock","Grüne","Member of Parliament","2021-08-25T00:00:00.000Z","https://dip21.bundestag.de/dip21/btp/19/19238.pdf","\n\nAußenpolitik ist immer eine Abwägung zwischen Dilemmas; aber Außenpolitik bedeutet auch, in schwierigen Momenten zu handeln und nicht den Kopf in den Sand zu stecken. Das sind wir nicht nur den Menschenrechten, sondern auch der Sicherheit in unserem Land schuldig.\n\nHerzlichen Dank.\n\n({0})"
"1063741","Agnes","Malczak","Grüne","Member of Parliament","2021-08-25T00:00:00.000Z","https://dip21.bundestag.de/dip21/btp/19/19238.pdf","\n\nDanke schön, dass Sie die Zwischenfrage zulassen. – Herr Kollege Hardt, wenn Sie der Rede meiner Kollegin Baerbock zugehört hätten, dann wüssten Sie, dass sie nicht gefordert hat, dass Sie jetzt der Einsetzung eines Untersuchungsausschusses zustimmen sollen, sondern sehr konkret – –\n\n({0})\n\n– Nein. Der Antrag liegt, wie Sie sagen, nicht vor, weil wir hier über die nächste Legislaturperiode sprechen.\n\nAber sehr konkret lag im Auswärtigen Ausschuss, dem Sie ja auch angehören, heute ein Antrag für ein Löschmoratorium vor. Wir wissen aus vergangenen Untersuchungsausschüssen, dass Dinge schnell vergessen werden oder verschwinden oder gelöscht werden. Und diesen Antrag hat Ihre Fraktion abgelehnt. Warum?\n\n({1})"
"1063745","Britta","Haßelmann","Grüne","Member of Parliament","2021-08-25T00:00:00.000Z","https://dip21.bundestag.de/dip21/btp/19/19238.pdf","\n\nHerr Hardt, Sie wollten ja nicht, dass ich einen Zwischenruf mache; deshalb vielen Dank, dass Sie meine Zwischenfrage akzeptieren.\n\nEs ist ja nicht das erste Mal, dass eine Fraktion ein Löschmoratorium beantragt. Deshalb hat es uns heute so sehr verwundert, dass weder die SPD noch die CDU/CSU bereit war, einem solchen Löschmoratorium zuzustimmen. Wir haben das alle gemeinsam schon einmal, in einer anderen schwierigen Lage, im Deutschen Bundestag beschlossen. Also tun Sie doch jetzt bitte nicht so, als sei das etwas ganz Besonderes, etwas Extremes, etwas vom Himmel Gefallenes!\n\n({0})\n\nViele der Kolleginnen und Kollegen erinnern sich daran, dass wir das zur Beweissicherung und zur Untermauerung des Aufklärungswillens schon einmal im Parlament gemacht haben, und zwar gemeinsam. Deshalb müssen Sie sich, wenn Sie überall sagen: „Wir werden das aufklären“, natürlich daran messen lassen, dass Sie heute dem Löschmoratorium nicht zugestimmt haben. Damit könnten wir Akten und Vorgänge sichern.\n\n({1})\n\nDas haben Sie heute abgelehnt. Warum?\n\n({2})"
"1063767","Omid","Nouripour","Grüne","Member of Parliament","2021-08-25T00:00:00.000Z","https://dip21.bundestag.de/dip21/btp/19/19238.pdf","\n\nHerzlichen Dank, Frau Präsidentin. Herzlichen Dank, Kollege Röttgen. – Ich bin in den letzten Jahren einer derjenigen gewesen, die diesem Einsatz immer zugestimmt haben. Ich war sehr oft in Afghanistan, kenne dort sehr viele Leute, und ich kann die Landessprache. Wir haben über jede einzelne Verlängerung immer eine lange Diskussion miteinander geführt. Es gab eine Mehrheit in meiner Fraktion, die dem Einsatz nicht zugestimmt hat. Sie hat sehr klar und deutlich gesagt, dass sie zwar weiß, dass wir an die afghanische Bevölkerung, an unsere Freunde und vor allem an unsere Freundinnen in Afghanistan, ein Signal setzen müssen, dass wir auf ihrer Seite stehen, dass sie aber kein Vertrauen in diese Bundesregierung und ihre Art und Weise hat, durch diesen Einsatz zu führen.\n\nGanz ehrlich: Wenn ich mir die letzten zwei Wochen, die Untätigkeit dieser Bundesregierung der letzten Wochen und Monate und den Sonderweg anschaue – Frau Merkel hat gerade ja behauptet, dass es ihn nicht gebe –, auf dem Deutschland so viel an den Zahlen herumgewerkelt hat, bis es jetzt nur noch 2 500 Ortskräfte sein sollen – Herr Grotian sagt, allein bei der Bundeswehr seien es 8 000 –, dann muss ich sagen: Es gab in meiner parlamentarischen Karriere noch nie einen Moment, in dem ich dieses Misstrauen meiner Fraktion so gut verstanden habe. Es gab noch nie so viele Belege dafür, dass es richtig war, dass meine Fraktion dieser Regierung mehrheitlich nicht vertraut hat.\n\n({0})"
"1063803","Anton","Hofreiter","Grüne","Member of Parliament","2021-08-25T00:00:00.000Z","https://dip21.bundestag.de/dip21/btp/19/19238.pdf","\n\nSehr geehrte Frau Präsidentin! Liebe Kolleginnen und Kollegen! Die Flutkatastrophe in Nordrhein-Westfalen und in Rheinland-Pfalz war die schlimmste Naturkatastrophe seit der Hamburger Sturmflut von 1962. Sie hat unvorstellbares Leid mit sich gebracht. Mindestens 183 Menschen sind gestorben, Zehntausende haben ihr Zuhause verloren, die Schäden an der Infrastruktur, an der Wirtschaft sind gigantisch. Ich möchte mich insbesondere bei den Helferinnen und Helfern, bei den Rettungsorganisationen, bei all den Menschen, die unterstützt haben, für ihre wertvolle Arbeit bedanken.\n\n({0})\n\nUmso wichtiger ist es, dass wir heute gemeinsam umfassende Hilfe für den Wiederaufbau auf den Weg bringen. Ich hoffe, dass es den betroffenen Regionen und den Menschen dort wenigstens ein bisschen Trost und Hoffnung spendet, dass unser ganzes Land, Bund und Länder, die Bundesregierung, die demokratischen Parteien hier im Bundestag hinter ihnen stehen. Unser Versprechen aus dem Bundestag an diese Menschen muss sein: Wir werden Sie in den mühevollen Jahren des Wiederaufbaus nicht alleine lassen.\n\n({1})\n\nLiebe Kolleginnen und Kollegen, die Flutkatastrophe in unserem Land war dieses Jahr kein isoliertes Naturereignis. Wir erleben in diesem Jahr eindrücklich, in welche Lage wir uns als Menschen bereits gebracht haben: Hitzewellen in Kanada und den USA, Brände in der Türkei, in Italien, in Griechenland, in Kanada, in Sibirien. Erstmals seit der Geschichte der Wetteraufzeichnung hat es auf dem höchsten Punkt des Grönländischen Eisschildes geregnet. Ja, Extremwetterereignisse gab es immer. Aber die Heftigkeit, die Häufung, die Zahl dieser Extremwetterereignisse weisen darauf hin: Die Klimakrise ist bereits da und schlägt mit voller Heftigkeit zu. Daran kann es keinen ernsthaften naturwissenschaftlichen Zweifel mehr geben.\n\n({2})\n\nDas ist die bittere Hypothek, die wir bereits jetzt unseren Kindern und nachfolgenden Generationen hinterlassen. Und leider muss man sagen: Das ist erst der Anfang. Wenn man naturwissenschaftlich ehrlich ist, lautet die Frage nicht mehr: „Wie wird es in den nächsten Jahrzehnten besser?“, sondern: „Wie verhindern wir, dass es Jahr für Jahr, Jahrzehnt für Jahrzehnt schlimmer wird?“ Es geht darum, die Klimakrise so zu begrenzen, dass die Anpassung an die neuen Bedingungen, unter denen wir leben müssen, überhaupt noch eine Chance hat, zu gelingen. Das sind wir unseren Kindern und Enkelkindern schuldig.\n\n({3})\n\nDafür müssen wir jetzt handeln, entschlossen und eigentlich gemeinsam. Das ist die existenzielle Dringlichkeit, die uns in diesen Tagen doch vor Augen geführt wird. Nur wer das Klima schützt, schützt das Überleben und die Freiheit in der Zukunft.\n\nDoch leider, sehr geehrte Damen und Herren von Union und SPD, sind Sie beim Klimaschutz weit weniger entschlossen, als Sie es hier bei den Aufbauhilfen waren. Nach aktuellen Prognosen werden wir dieses Jahr die Klimaziele klar verfehlen. Das Umweltbundesamt rechnet deutlich vor: Auch die Klimaziele für 2030 werden wir verfehlen, und bereits die Klimaziele für 2040 sind gefährdet. Diese Zahlen zeigen das Versagen der jetzt regierenden Bundesregierung, dieser Koalition aus SPD und Union.\n\n({4})\n\nUnd das Allerschlimmste ist: Sie sagen, dass Sie diese Politik, dieses Politikversagen sogar fortsetzen wollen. Herr Laschet und Herr Scholz verteidigen einen Kohleausstieg, von dem völlig klar ist, dass mit ihm die Klimaziele, die hier, im Deutschen Bundestag, im Juni beschlossen worden sind, nicht erreichbar sind. Wissen Sie, Herr Scholz, es macht es auch keine Spur besser, dass in dem Moment, da Sie die Lausitz verlassen haben, Sie plötzlich etwas anderes erzählt haben. Das zeigt überdeutlich Ihre Unernsthaftigkeit bei diesem existenziellen Thema.\n\n({5})\n\nDas zeigt Ihr taktisches Verhältnis zu diesem wichtigen Menschheitsthema.\n\n({6})\n\nAuch beim Ausbau der erneuerbaren Energien schaut es nicht besser aus. Sie haben ihn mit den Beschlüssen im Deutschen Bundestag über die letzten Jahre aktiv abgewürgt.\n\nHerr Laschet, ich höre ja gerne, dass die Dinge schneller gehen sollen. Aber vor Kurzem habe ich mit Projektierungsingenieuren gesprochen. Die haben mir erzählt, dass sie, als Rot-Grün regiert hat, für eine Windkraftanlage sechs bis neun Monate gebraucht haben, aber jetzt, nach 16 Jahren CDU-Regierung, brauchen sie sechs bis neun Jahre. Und Sie sprechen hier von Beschleunigung! Warum haben Sie denn die letzten 16 Jahre nichts gemacht?\n\n({7})\n\nEs ist eigentlich noch schlimmer: Sie haben ja etwas gemacht. Sie haben die Planungszeiten von sechs bis neun Monaten auf sechs bis neun Jahre erhöht.\n\n({8})\n\nUnd dann reden Sie hier von Beschleunigung.\n\nEs ist längst an der Zeit, wirklich zu handeln und unser Land in den nächsten zwei Jahrzehnten klimaneutral zu machen. Das ist wahrscheinlich die größte Gestaltungsaufgabe, vor der wir je standen. Klar haben da Menschen Sorgen, weil sich Dinge grundlegend ändern müssen. Wir können niemandem versprechen, dass sich nichts ändert. Aber wir können versprechen, dass niemand überlastet wird. Und wir sehen die Chancen. Allein durch neue Technologien, durch gut gemachten Klimaschutz, durch Innovationen können 5 Millionen neue Arbeitsplätze in Europa entstehen. Deshalb: Retten wir unsere Lebensgrundlagen, sehen wir die Chancen, setzen wir auf Klimaschutz, setzen wir auf erneuerbare Energien, setzen wir auf modernste Technologie! Dann haben wir die Chance, das in den Griff zu bekommen. Aber dafür brauchen wir eine andere Bundesregierung; dafür brauchen wir eine andere politische Führung.\n\nVielen Dank.\n\n({9})"
"1063813","Oliver","Krischer","Grüne","Member of Parliament","2021-08-25T00:00:00.000Z","https://dip21.bundestag.de/dip21/btp/19/19238.pdf","\n\nHerr Präsident! Liebe Kolleginnen und Kollegen! Ich bin Ihnen, Frau Ministerpräsidentin Dreyer, ausdrücklich dafür dankbar, dass Sie hier das menschliche Leid geschildert haben. Denn das, was man in den Flutregionen erleben musste, was man an Bildern sehen musste, was die Menschen erlebt haben, wird uns in den Regionen noch lange beschäftigen. Was wir hier tun können – ich bin froh, dass die Bundesregierung diesen Schritt geht; wir gehen ihn mit –, ist, dass wir das deutliche Signal setzen: Wir wollen wenigstens die finanziellen Folgen abmildern und Wiederaufbau leisten. Das ist ein gutes Signal in die Regionen.\n\n({0})\n\nMan muss aber auch sagen: Die eigentliche Herausforderung ist, zu verhindern, dass wir nächstes oder übernächstes Jahr hier wieder stehen und über die gleichen Fragen diskutieren müssen. Neben der akuten Aufbauhilfe, die wichtig und entscheidend ist, ist es ganz wichtig, auch die nötigen Konsequenzen zu ziehen.\n\n({1})\n\nViele hier haben das Thema Warnung angesprochen. Ich glaube nicht, dass es mit Cell Broadcasting und Sirenen getan ist. Wir brauchen eine andere Aufstellung des Katastrophenschutzes. Wir müssen dafür sorgen, dass die Botschaften und Warnungen bei den Menschen ankommen. Denn ich habe in den Flutgebieten überall gehört: Wenn wir gewusst hätten, wie schlimm es wird, dann hätten wir noch viel mehr tun können, noch viel mehr retten können. – Das muss anders werden.\n\n({2})\n\nMeine Damen und Herren, wir brauchen Hochwasservorsorge. Da geht es vor allen Dingen darum, dass wir jeden Kubikmeter Wasser nicht nur an den großen Flüssen, sondern auch in den Mittelgebirgen, in der Landschaft, im Gelände halten. Das bedeutet vor allen Dingen mehr Natur. Das bedeutet weniger Zersiedlung, Bebauung und Betonierung. Das bedeutet Wiedervernässung. Das bedeutet an dieser Stelle gesunde und erhaltenswerte Wälder. Herr Laschet – er ist jetzt nicht mehr hier –\n\n({3})\n\nhat sich in Nordrhein-Westfalen in der Vergangenheit leider nicht mit Ruhm bekleckert; auch das muss man sagen. Hier ist Hochwasservorsorge sträflich vernachlässigt worden. Das muss sich ändern, auf allen politischen Ebenen.\n\n({4})\n\nMeine Damen und Herren, worum es natürlich ganz zentral geht, ist, dass wir alles dafür tun, dass die Wahrscheinlichkeit und die Zahl der Extremwetter und ihr Ausmaß reduziert werden. Dafür brauchen wir endlich engagierten Klimaschutz.\n\n({5})\n\nWir haben im Moment diese Katastrophe bei gut 1 Grad Temperaturerwärmung auf der Welt. Was wird sein, wenn, wie uns die Wissenschaft sagt, wir am Ende des Jahrhunderts – das werden unsere Kinder erleben – 3 bis 4 Grad haben werden, wenn wir so weitermachen? Das darf nicht sein!\n\nHerr Scholz und Herr Laschet – wenn er da wäre –, wer soll Ihnen eigentlich die Ankündigungen, die wir jetzt wieder zum Klimaschutz gehört haben, glauben? Die Union regiert hier seit 16 Jahren, die SPD noch länger. Es hat hundert Weckrufe und Anlässe gegeben, mehr für den Klimaschutz zu machen. Sie haben es nicht getan.\n\nMeine Damen und Herren, ich habe es aufgegeben, zu hoffen, dass Sie dies zum Anlass nehmen werden, ernsthaft etwas für den Klimaschutz zu machen. Deshalb braucht es hier in der Bundesrepublik Deutschland eine andere Verantwortung.\n\nDanke schön.\n\n({6})"
