id,firstname,lastname,faction,position,date, url,speech
"1024099","Kerstin","Andreae","Grüne","Member of Parliament","2019-05-08T00:00:00.000Z","https://dip21.bundestag.de/dip21/btp/19/19097.pdf","\n\nHerr Präsident! Liebe Kolleginnen und Kollegen! Nun wissen wir ja fast alle, dass Kollektivierung und Verstaatlichung keine Antwort auf die Herausforderungen sind, vor denen wir stehen.\n\n({0})\n\nTrotzdem bringen die Äußerungen eines Juso-Vorsitzenden die ganze Republik über Tage hinweg in Wallungen und führen zu einer Aktuellen Stunde hier im Deutschen Bundestag.\n\nMan muss sich doch mal der Frage stellen: Warum passiert das eigentlich? Ich sage Ihnen: Das passiert, weil Kevin Kühnert etwas adressiert hat, das viele spüren. Ein Unbehagen ist da: das Gefühl, dass hier irgendetwas nicht mehr stimmt, das Gefühl, dass Menschen nicht mehr wissen, ob sie in ihrer Wohnung bleiben können, das Gefühl, dass Menschen nicht mehr wissen, ob sie von ihrer Arbeit noch leben können,\n\n({1})\n\ndas Gefühl, dass Menschen nicht mehr die Gewissheit haben, dass die Zukunft für ihre Kinder noch lebenswert ist. Dieses Gefühl ist mit Händen zu greifen, und das hat er mitadressiert.\n\n({2})\n\nEs gibt Fehlentwicklungen; die dürfen wir nicht ignorieren. Ich meine das Unbehagen, dass hier jeder machen kann, was er will: Internetgiganten mit Datensammelwut, manipulierende Automobilkonzerne, spekulierende Banken, überzogene Rendite bei Immobilien, exorbitante Managergehälter. Das ist doch zu greifen, dass hier Fehlentwicklungen sind, gegen die wir etwas tun müssen.\n\n({3})\n\nUnd jetzt will die FDP über die soziale Marktwirtschaft sprechen. Ist es das, was Sie unter sozialer Marktwirtschaft verstehen?\n\n({4})\n\nEhrlich gesagt, andere stoßen wenigstens mal Debatten an; Sie kommen mit Themen von vorgestern und führen hier Reden aus den 80er-Jahren,\n\n({5})\n\nwie im Übrigen ziemlich viele, unter anderem der Wirtschaftsminister, der nicht mehr zum Wettbewerbsrecht steht.\n\n({6})\n\nFakt ist, dass die soziale Marktwirtschaft das Wohlstandsversprechen für alle eben nicht mehr einhalten kann. Das ist doch Fakt.\n\n({7})\n\nNiemand glaubt, dass diese Regierung noch in der Lage ist, die Probleme anzupacken. Das sorgt eben für Unbehagen bei den Menschen. Die Sorge um ihre Zukunft treibt die Kinder auf die Straße.\n\n({8})\n\nDie Union wird zur Dagegen-Partei. Ihr seid inzwischen gegen alles. Jeder Vorschlag wird abgelehnt. CO 2 -Preis, Tempolimit, Vorschläge, die in anderen europäischen Ländern schon längst Alltag sind: Ihr sagt immer nur Nein. AKK sagt Nein. Laschet sagt aber: „Vielleicht“, und Schulze sagt Ja. Bei dieser Kakofonie, die die Bundesregierung beim Thema Klimaschutz an den Tag legt, muss doch ein Unbehagen da sein.\n\n({9})\n\nDie soziale Marktwirtschaft ist das beste System, das wir kennen: Marktwirtschaft mit Freiheitsversprechen und Wohlstandsversprechen für alle. Aber dazu muss ein Staat aktiv und regulierend eingreifen.\n\nUnd ja, Privateigentum wird zu Recht geschützt. Aber im Grundgesetz steht auch: „Eigentum verpflichtet“, und diese Verpflichtung muss ausbuchstabiert werden, mit Leitplanken.\n\n({10})\n\nWir müssen den Begriff erweitern. Worum es geht, ist eine ökologisch-soziale Marktwirtschaft. Das Wohlstandsversprechen in einer ökologischen und sozialen Marktwirtschaft bedeutet nämlich, dass alle Menschen – alle, auch zukünftige Generationen, auch Menschen auf anderen Kontinenten – faire Chancen für ein gutes Leben haben. Eine sozial-ökologische Marktwirtschaft kann ein solches Wohlstandsversprechen geben, meine Damen und Herren.\n\n({11})\n\nDie Lösungen von Kevin Kühnert sind falsch. Andere Eigentumsverhältnisse bringen nicht mehr Klimaschutz, kein einziges Elektroauto mehr.\n\n({12})\n\nIn Frankreich betreiben Staatskonzerne AKWs. VW hat mit 20 Prozent Staatsbeteiligung das Dieselgate angeführt.\n\n({13})\n\nWir müssen Kindern, die freitags auf die Straße gehen, Antworten geben, Menschen, die Angst haben, Zuversicht geben, in dieser angespannten Zeit Orientierung geben. Unser Wirtschaftssystem ist doch viel zu ressourcenhungrig. Wenn alle so leben wollten wie wir, bräuchten wir zweieinhalb Planeten. Die haben wir nicht. Da müssen wir Antworten geben.\n\n({14})\n\nIhr von der FDP habt vor zwei Wochen getwittert:\n\nAlle reden über #FridaysForFuture. Brauchen wir nicht vielmehr #MondaysForEconomy?!\n\n({15})\n\nDas war euer Tweet.\n\n({16})\n\nJetzt antworte ich mal frei nach Lindner: Was wir brauchen, ist eine Economy for Future, und dafür brauchen wir Profis.\n\nVielen Dank.\n\n({17})"
"1024155","Katrin Dagmar","Göring-Eckardt","Grüne","Member of Parliament","2019-05-09T00:00:00.000Z","https://dip21.bundestag.de/dip21/btp/19/19098.pdf","\n\nHerr Präsident! Liebe Kolleginnen und Kollegen! Herr Seehofer! Herr Heil! Herr Seehofer, Sie hatten sich ja eigentlich vorgenommen, über Migration lieber gar nicht zu reden. Einwanderung – das ist Migration – ist ja in Ihrem Duktus „die Mutter aller Probleme“. In Wahrheit ist Einwanderung die Mutter vieler Lösungen, insbesondere beim Fachkräftemangel. Ich finde, das müssen Sie endlich akzeptieren, statt weiter rumzuschwurbeln, einzuschränken und zurückzugehen.\n\n({0})\n\nSie haben auch heute wieder mehr über Ordnung und Begrenzung geredet als darüber, dass wir tatsächlich Einwanderung brauchen in diesem Land, und zwar von Fachkräften.\n\n({1})\n\nSie haben sich ja nicht mal getraut, das Gesetz so zu nennen. Sie nennen es Fachkräfte– – und dann weiß man schon nicht mehr genau, wie man sagen soll. Es ist ein Einwanderungsgesetz. Wir sind ein Einwanderungsland.\n\n({2})\n\nUnd dieses Einwanderungsland braucht ein modernes Einwanderungsgesetz.\n\n({3})\n\nDie Bundesregierung ist gerade sehr kreativ bei der Namensgebung von Gesetzen. Für das, was Sie uns hier heute vorlegen, habe ich einen Vorschlag. Ich sage: Das ist eher ein Fachkräfteeinwanderungsverhinderungsgesetz. Es reicht nicht mehr, es zu unterlassen, Einwanderung aktiv zu verhindern. Wir müssen sie jetzt fördern. Wir müssen jetzt dafür sorgen, dass klar ist: Wir sind ein guter Standort. Wir schaffen gute Bedingungen, übrigens auch für die Familien; denn Menschen, die als Fachkräfte hierherkommen, haben Familie, sie müssen abgesichert werden, und sie müssen auch eine Chance haben. Deswegen: Geben Sie sich endlich einen Ruck bei der Beratung des Gesetzes, und sorgen Sie endlich dafür, dass es Einwanderung gibt, dass wir die besten Kräfte bekommen für die vielen Bereiche, in denen wir sie tatsächlich brauchen.\n\n({4})\n\nWir als Grüne haben etwas vorgelegt, die FDP hat etwas vorgelegt, die SPD hat etwas vorgelegt. Was wir jetzt haben, ist wieder mal nichts anderes als ein kleinster gemeinsamer Nenner. Und die Unternehmen sind ja nicht mehr leise, sondern laut und sagen: Wir sind auf Einwanderung angewiesen. Es geht um die Besetzung von Ausbildungsstellen, es geht um qualifizierte Fachkräfte, es geht um aktuell 1 Million unbesetzte Stellen.\n\nLiebe Frau Ferschl, ich glaube, dass wir uns sicher einig sind, wenn es darum geht, dass man Arbeitsbedingungen verbessern muss. Aber zu der Behauptung, das würde dann schon reichen, wir brauchten keine Einwanderung,\n\n({5})\n\nsage ich Nein. Das wird nicht reichen, weder angesichts des Fachkräftemangels noch angesichts der demografischen Entwicklung. Beides gehört für mich zusammen: gute Arbeitsbedingungen und Einwanderung.\n\n({6})\n\nIch nenne ein paar Beispiele: energetische Sanierung von Häusern. Darüber reden alle, das wollen alle. Es fehlen jedoch aktuell 100 000 Handwerker. In diesem Bereich gibt es besonders viele offene Stellen. 20 Prozent der offenen Stellen entfallen auf den Industriesektor, 17 Prozent auf den Handel, 10 Prozent auf das Gesundheitswesen und hier vor allem auf die Pflege. Es bringt auch nichts, dass wir hier immer wieder beschwören: Wir brauchen mehr Pflegekräfte. Es bringt nichts, dass wir immer wieder beschwören, wo wir überall Veränderungen, Innovationen und Investitionen brauchen, wenn am Schluss die Leute fehlen, die es umsetzen können.\n\n({7})\n\nHerr Seehofer, Sie haben das in einem Nebensatz gesagt, aber eigentlich müsste darauf eine große Offensive folgen: Der Fachkräftemangel gefährdet den Wohlstand in Deutschland, unsere gute Entwicklung. – Wenn man das erkannt hat, dann muss man doch aktiv werden und handeln. Es muss doch allen klar sein: Dieses Deutschland wirbt in der ganzen Welt um die besten Kräfte. Dieses Deutschland sorgt dafür, dass die Fachkräfte hierherkommen wollen, und es macht nichts Verschwurbeltes, das am Ende immer noch so wirkt, als wollten wir es eigentlich nicht, sondern seien nur getrieben. Das ist der falsche Weg, meine Damen und Herren.\n\n({8})\n\nDie Beispiele sind vielfältig, wir kennen sie alle. Unternehmensnachfolge: Googeln Sie mal „Kasseler Traditionsbäckerei kämpft ums Überleben“, „Berliner Bäckerin, 82, findet keinen Nachfolger“. In so einer Situation muss die Botschaft doch klar sein: Wir strengen uns wirklich an.\n\nWir Grünen haben einen Vorschlag gemacht: eine Talentkarte, mit der man sich in Deutschland ein Jahr lang nach Arbeit umsehen kann. Den Lebensunterhalt dürfte man in dieser Zeit übrigens auch mit geringqualifizierter Tätigkeit bestreiten. Wie sieht Ihre Regelung aus? Man darf für ein halbes Jahr kommen, aber man hat Arbeitsverbot in diesem halben Jahr. Wer bitte schön soll das denn machen? Wer bitte schön soll so viel Geld mitbringen können, dass er oder sie sich dann hier einen Fachkräftejob suchen kann? Wer bitte schön soll denn, wenn er beispielsweise im Thüringer Wald in einem Krankenhaus arbeiten will, schon von zu Hause das Geld mitbringen können, um hier ein halbes Jahr zu überleben? Das ist impraktikabel. Das geht nicht; das ist das Gegenteil dessen, was wir brauchen, meine Damen und Herren.\n\n({9})\n\nAuch bei der Berufsausbildung ist es so: Sie öffnen die Tür einen ganz kleinen Spalt. Man kommt da aber am Ende einfach nicht durch, weil die Voraussetzungen immer mehr statt weniger werden."
"1024157","Katrin Dagmar","Göring-Eckardt","Grüne","Member of Parliament","2019-05-09T00:00:00.000Z","https://dip21.bundestag.de/dip21/btp/19/19098.pdf","\n\nNein, ich glaube, das macht wenig Sinn für uns alle."
"1024159","Katrin Dagmar","Göring-Eckardt","Grüne","Member of Parliament","2019-05-09T00:00:00.000Z","https://dip21.bundestag.de/dip21/btp/19/19098.pdf","\n\nEs ist ein klares Nein.\n\n({0})\n\nAußerdem lassen Sie eine ganze Reihe von Schwierigkeiten unangetastet, und das heißt: Es bleibt unattraktiv. Zum Thema Qualifikation: Wir wissen, wie das bei Fachkräften innerhalb der Europäischen Union ist. Wir wissen, welche Schwierigkeiten wir da haben. Auch da werden mehr Hürden aufgebaut und belassen, als dass sie abgebaut werden. Hier ist auch über den Spurwechsel gesprochen worden. Frau Teuteberg und Herr Heil haben darauf hingewiesen.\n\nSie sagen: „Wir haben eine Arbeitsduldung“. Wenn aber jemand, der hier gut integriert ist, der Deutsch sprechen kann, der in ein Team eingearbeitet ist und für den sich Unternehmen angestrengt haben – über hundert Unternehmen, darunter Vaude, Trigema und Edeka, haben sich der Unternehmerinitiative „Bleiberecht durch Arbeit“ angeschlossen –, nur für zwölf Monate bleiben kann, dann hat er eben keine Planungssicherheit. Diese aber wird endlich benötigt.\n\n({1})\n\nDeswegen: Spurwechsel muss Spurwechsel heißen. Wir brauchen nicht schon wieder eine Zwischenlösung.\n\nNoch einmal, meine Damen und Herren: Deutschland ist ein Einwanderungsland. Deutschland braucht ein modernes Einwanderungsgesetz, das so heißt. Diese Gesetze sind es nicht.\n\nVielen Dank.\n\n({2})"
"1024228","Julia","Verlinden","Grüne","Member of Parliament","2019-05-09T00:00:00.000Z","https://dip21.bundestag.de/dip21/btp/19/19098.pdf","\n\nFrau Präsidentin! Meine Damen und Herren! Sie wollen hier die Energiepolitik europäisch denken. Das klingt gut. Dann muss dafür aber auch mal jemand etwas tun. Das fordern die Schülerinnen und Schüler von Fridays for Future, die jetzt in diesem Moment in Rumänien vor dem EU-Gipfel für eine gute Zukunft demonstrieren – und zwar zu Recht.\n\n({0})\n\nDas Ziel muss klar sein: 100 Prozent erneuerbare Energie beim Strom, bei der Wärme, beim Verkehr so schnell es geht. Acht EU-Mitgliedstaaten fordern ein ambitionierteres Vorgehen beim Klimaschutz. Es ist ein Skandal, dass unsere Bundesregierung da nicht mitmachen will!\n\n({1})\n\nStattdessen plant sie lieber die Strafzahlungen an die EU für ihre verpassten Klimahausaufgaben heute schon mal ein.\n\nAber schauen wir uns mal den Status quo an: Wo steht denn Deutschland im Vergleich zu anderen Ländern in der EU? Wie hoch ist denn der Anteil der Erneuerbaren? Von 28 EU-Staaten liegt Deutschland nur auf Platz 17.\n\n({2})\n\nDeutschland ist schlechter als der EU-weite Durchschnitt! Und was machen Sie auf dieser Seite des Parlaments? Sowohl Sie von der FDP als auch von der CDU verweigern Ihre Hausaufgaben hier in Deutschland.\n\nUnd Ihre Ausreden sind echt abenteuerlich: Die FDP ist wie der Schüler, der für die Gruppenarbeit stimmt und dann die anderen die Arbeit machen lässt.\n\n({3})\n\nDas ist nämlich Ihr absurdes Verständnis davon, alles europäisch zu denken: Sie wollen sich auf den Erfolgen anderer Länder ausruhen, statt selbst irgendetwas zu leisten.\n\n({4})\n\nDie CDU hat in den letzten 13 Schuljahren im Fach Klimaschutz nicht aufgepasst und auch das Lösungsheft kein einziges Mal in die Hand genommen.\n\n({5})\n\nUnd jetzt schimpft die CDU, dass das Thema im Abitur überhaupt abgefragt wird – und fällt krachend durch die Prüfung, weil sie ein leeres Blatt abgibt. Die Union hat absolut keine Ahnung, keine Ideen. Was für ein kollektives Versagen dieser heruntergewirtschafteten Partei!\n\n({6})\n\nNur eins haben Sie noch nicht mitgekriegt, liebe CDU: Beim Klimaschutz ist Abschreiben explizit erlaubt.\n\n({7})\n\nNehmen Sie sich ein Beispiel an den erfolgreichen europäischen Nachbarn! Kommen Sie endlich in die Puschen! Wenn es Ihnen mit Ihrem Koalitionsvertrag ernst ist, dann kümmern Sie sich dringend um eine Reform von Euratom. Nicht die Förderung von immer mehr Atomkraft, sondern Sicherheit muss oberste Priorität in der europäischen Zusammenarbeit sein."
"1024205","Ingrid","Nestle","Grüne","Member of Parliament","2019-05-09T00:00:00.000Z","https://dip21.bundestag.de/dip21/btp/19/19098.pdf","\n\nHerr Präsident! Liebe Kolleginnen und Kollegen! Der Antrag der FDP spricht über die wichtige Rolle Europas in der Energiepolitik. Das ist ein ehrenwertes Anliegen. Auch wir Grüne zeigen in unserem Antrag, dass Brüssel viel weiter ist als die Bundesregierung. Die EU will es allen Menschen ermöglichen, in ihren eigenen vier Wänden eine Energiewende zu machen, an den wichtigen Märkten teilzuhaben, ihre Kreativität zu entfalten. Herr Altmaier, setzen Sie das endlich um!\n\n({0})\n\nAber dann wird es leider schwieriger mit dem Antrag der FDP. Sie sagen: Nur Emissionshandel darf Klimaschutz machen. – Emissionshandel ist genauso marktwirtschaftlich wie eine CO 2 -Bepreisung, und andersherum. Der Unterschied ist: Der CO 2 -Preis gibt Investitionssicherheit und Preissicherheit für Bürger und Unternehmen. Und in der Vergangenheit haben Sie sich oft für schwache Ziele im Emissionshandel eingesetzt. Man fragt sich also: Warum lehnen Sie das eine marktwirtschaftliche Instrument, die CO 2 -Bepreisung, vehement ab, während Sie das andere, den Emissionshandel, als angeblichen Heilsbringer darstellen?\n\n({1})\n\n– Sie können gerne eine Zwischenfrage stellen. – Die Erklärung ist: Sie fordern deshalb die Aufnahme des Verkehrs in den Emissionshandel, weil Sie genau wissen, dass das nicht kommen wird. Immerhin geben Sie in Ihrem Antrag offen zu, dass Sie auf Europa warten wollen – Herr Koeppen hat erklärt, wie lange das dauert –, und schieben Ihre Verantwortung an Europa und damit in die Zukunft ab. Diese Zeit haben wir nicht.\n\n({2})\n\nGanz abgesehen davon genügt ein Blick in die Analyse des Bundesverbandes der Deutschen Industrie zur Verkehrskommission, um zu verstehen, warum der Emissionshandel so schlecht zum Verkehr passt. Wollte man die Klimaziele des Verkehrssektors allein über den Emissionshandel erreichen, würde ein CO 2 -Preis von über 200 Euro pro Tonne entstehen. Sie fordern also implizit einen höheren CO 2 -Preis als Fridays for Future und scheinen das noch nicht einmal zu merken.\n\n({3})\n\nFaktisch würden die Autofahrerinnen und Autofahrer erst mal ziemlich viel blechen, ohne etwas zu ändern. Weil Sie von der FDP flankierende Maßnahmen ablehnen, würde sich auch sonst nichts ändern. Irgendwann müsste der Verkehr natürlich trotzdem reduzieren, aber nach Ihrem Vorschlag dann ganz plötzlich und ohne Zeit, E‑Mobilität zu etablieren.\n\nWir Grüne wollen, dass die Autoindustrie ab sofort ihren Teil der Verantwortung übernimmt und sparsamere Autos baut, anstatt das China zu überlassen. Wir wollen mit einem CO 2 -Preis diejenigen belohnen, die sich klimafreundlich verhalten. Wir wollen das den Menschen erleichtern, indem wir die Bahn gut und günstig machen, indem wir sichere Radwege schaffen, indem E-Mobilität einfach wird und indem wir die Einnahmen an die Bürgerinnen und Bürger so zurückgeben, dass diejenigen mit wenig Geld in der Tasche unterm Strich profitieren.\n\n({4})\n\nWir wollen die Verantwortung nicht abschieben, nicht in die Zukunft und nicht auf die EU. Wir wollen, dass wir hier und jetzt unseren Teil beitragen. Dann werden die anderen es auch tun.\n\nZum Abschluss eine Bitte an die Union. Sie haben gesagt, dass wir jetzt das EEG abschaffen müssen, weil die Erneuerbaren so teuer sind. Unter Ihrer Regierung haben wir viele Erneuerbare zugebaut, als sie noch teuer waren. Heute sind neue Erneuerbare günstiger als neue Fossile. Und jetzt wollen Sie das EEG abschaffen? Das ist völlig unlogisch.\n\n({5})\n\nVon Ihnen hört man vielfach das Wort „nachdenken“. Sie regieren seit 14 Jahren. Die Zeit zum Nachdenken ist vorbei. Irgendwann muss eine Regierung auch handeln. Irgendwann muss eine Regierung handeln und auf die Klimakrise reagieren. Die Frage ist: Finden Sie immer nur Gründe, warum Sachen nicht gehen, oder packen wir es an? Wir wollen es anpacken.\n\nHerzlichen Dank.\n\n({6})"
"1024210","Ingrid","Nestle","Grüne","Member of Parliament","2019-05-09T00:00:00.000Z","https://dip21.bundestag.de/dip21/btp/19/19098.pdf","\n\nDanke, dass ich fragen darf. – Ich wollte mich einmal erkundigen, was für Sie „übereilt“ bedeutet. Ich habe 1998 angefangen, Klima- und Energiepolitik zu studieren. Seitdem und auch schon vorher wurde in Deutschland über die richtige Energie- und Klimapolitik nachgedacht. Wir haben alle Technologien und wissen, wie es bezahlbar geht. Wir haben alle politischen Instrumente. Wir haben sie in zig Studien aufeinander abgestimmt, verbessert, optimiert und bewertet. Seit 14 Jahren ist die Union mit in der Regierung. Was ist also für Sie „übereilt“, wenn wir von Ihnen einfordern, dass Sie heute mal eine Maßnahme nennen, zu der Sie sich wirklich bekennen?\n\n({0})"
"1024230","Julia","Verlinden","Grüne","Member of Parliament","2019-05-09T00:00:00.000Z","https://dip21.bundestag.de/dip21/btp/19/19098.pdf","\n\nKlimaschutz und ein atomkraftfreies Europa, das geht Hand in Hand. Es wird Zeit, dass Sie Verantwortung übernehmen!\n\n({0})"
"1024238","Ingrid","Nestle","Grüne","Member of Parliament","2019-05-09T00:00:00.000Z","https://dip21.bundestag.de/dip21/btp/19/19098.pdf","\n\nIch danke auch. – Sie sagen, wir würden uns hier explizit gegen marktwirtschaftliche Regeln wenden. Zum einen haben Sie gemerkt, dass wir versuchen, ganz viel mehr Markt hinzubekommen, indem wir diesen ganzen aktiven Kunden Marktzugang verschaffen wollen. Das ist ja der wesentliche Bestandteil des Antrages. Ich vermute, dass Sie mit Ihrem Fokus auf den kleinen Punkt abzielen, dass wir sagen: Ja, wir wollen Bürgerenergie-, Windenergieprojekte wieder vereinfachen und halten es für möglich, dass Bürger selbst teilhaben können an den Märkten, ohne die volle Komplexität zu verstehen.\n\nStändig sagen Sie, wie schwierig es ist, dass wir keine Windparks mehr hinbekommen. Das war das Erfolgsrezept in Schleswig-Holstein, wo alle Dörfer gerufen haben: Wir wollen einen Windpark. – Das ist kaputt. Das ist das Einzige, was wir wieder machen wollen. Ansonsten würde ich das scharf zurückweisen und sagen: Wir wollen mit diesem Antrag mehr Markt schaffen und nicht weniger.\n\n({0})"
