id,firstname,lastname,faction,position,date, url,speech
"1067220","Anton","Hofreiter","Grüne","Member of Parliament","2022-02-18T00:00:00.000Z","https://dip21.bundestag.de/dip21/btp/20/20018.pdf","\n\nSehr geehrte Frau Präsidentin! Liebe Kolleginnen und Kollegen! Anna Lührmann hat bereits darauf hingewiesen, welch große Bedeutung die Rechtsstaatlichkeit und das Urteil von Mittwoch für die Europäische Union und die Demokratie haben. Aber ich glaube, man muss sich sehr bewusst sein, dass dieses Urteil auch eine große Bedeutung für die Möglichkeit der Europäischen Union hat, nach außen geeint und stark aufzutreten. Nur wenn wir nach innen unsere Rechtsstaatlichkeit glaubwürdig verteidigen, erhalten und dort wieder ausbauen, wo sie bereits in großen Schwierigkeiten ist, sind wir in der Lage, nach außen stark aufzutreten.\n\n({0})\n\nWenn man sich die Lage in der Welt anschaut – da geht es nicht nur um die derzeit vom Aggressor Russland verursachte Krise in Osteuropa, sondern auch um Herausforderungen durch die Klimakrise, um Herausforderungen durch ökonomisch sehr erfolgreiche, aber autoritär und immer diktatorischer auftretende Regime wie China –, dann brauchen wir ein starkes, geeintes, souveränes und handlungsfähiges Europa. Um ein starkes, geeintes, handlungsfähiges Europa zu bekommen, brauchen wir die Einigkeit, die Handlungsfähigkeit und den proeuropäischen Kurs der großen Mitgliedstaaten.\n\nEs gibt ein bekanntes Bonmot in Europa: Es gibt nur zwei Sorten von Ländern innerhalb der Europäischen Union: kleine Länder und Länder, die noch nicht begriffen haben, dass sie kleine Länder sind angesichts der Herausforderungen durch China und durch Russland. – Deshalb ist es entscheidend, dass wir uns als neue Regierung mit aller Kraft für ein geeintes Europa einbringen.\n\n({1})\n\nEs ist auch wichtig, dass man gegenüber China nicht mehr naiv auftritt. Deshalb ist es entscheidend, dass das Außenministerium und die neue Bundesregierung eine kohärente neue China-Strategie voranbringen. Man denke daran, welch schwere Fehler da in der Vergangenheit gemacht worden sind. Man hat damals in der Banken- und Finanzkrise Griechenland, das sicher in großen Schwierigkeiten war und selber schwere Fehler gemacht hat, auch vonseiten der deutschen Bundesregierung unter Druck gesetzt, einen der wichtigsten Mittelmeerhäfen, Piräus, an China zu verkaufen. Welch schwerer geostrategischer Fehler!\n\n({2})\n\nJahrelang stand man mit einer Mischung aus Verblüffung und Desinteresse vor der Strategie der neuen Seidenstraße der chinesischen Regierung.\n\n({3})\n\nDiese ist bereits weit vorgedrungen. Deshalb kommt es ganz entscheidend darauf an, dass wir als neue Regierung die Strategie „Global Gateway“ der Europäischen Union massiv unterstützen.\n\n({4})\n\nChina ist natürlich, wenn es um den Kampf gegen die Klimakrise geht, ein wichtiger Partner für uns.\n\n({5})\n\nChina ist aber auch ein unglaublich herausfordernder Wettbewerber und, wenn es um Fragen von Demokratie und Rechtsstaatlichkeit geht, ein Systemrivale. Darauf müssen wir mit einer Mischung aus Klugheit und Selbstbewusstsein antworten.\n\nDeshalb ist es auch entscheidend, dass in Zusammenarbeit mit den afrikanischen Ländern von den vielen Versprechungen, die in der Vergangenheit gemacht worden sind, zukünftig deutlich mehr umgesetzt werden.\n\n({6})\n\nAuch da habe ich große Hoffnung, dass mit dem neuen Bundeskanzler und der neuen Außenministerin einiges in die Realität umgesetzt wird.\n\nDie Herausforderungen sind groß. Aber mit einem geeinten, souveränen und handlungsfähigen Europa sind wir in der Lage, sie erfolgreich umzusetzen. Gehen wir sie an!\n\nVielen Dank.\n\n({7})"
"1067094","Maria","Klein-Schmeink","Grüne","Member of Parliament","2022-02-17T00:00:00.000Z","https://dip21.bundestag.de/dip21/btp/20/20017.pdf","\n\nFrau Zeulner, ich habe Ihre Worte gehört. Sie sagen, ja, Sie stünden zur einrichtungsbezogenen Impfpflicht; ihr müsse aber eine allgemeine Impfpflicht folgen.\n\nKann ich aus dieser durchaus nachvollziehbaren Kette schließen, dass Sie erstens als Fraktion der Union dann einem Antrag oder den Gruppenanträgen zur allgemeinen Impfpflicht zustimmen werden?\n\n({0})\n\nZweitens haben Sie gerade auch zu Recht betont, dass mit Ihren Stimmen sowohl im Bundesrat als auch hier im Bundestag die einrichtungsbezogene Impfpflicht ja für alle Fachkräfte, alle Beschäftigten in diesen Einrichtungen beschlossen worden ist. Und schon damals war klar, dass es natürlich Auswirkungen hat, beispielsweise auf ein Arbeitsverhältnis, wenn man das Arbeitsverhältnis gar nicht mehr einlösen kann, wenn man nicht die Sicherheit gewährleisten kann, als Beschäftigter auch tatsächlich eingesetzt zu werden.\n\nAlso, diese Fragen waren ja bekannt, von Anfang an. Haben Sie diese Implikationen nicht gesehen, als Sie zugestimmt haben? Haben Sie das alles nicht gewusst, als Sie als CSU sogar sehr, sehr prominent die einrichtungsbezogene Impfpflicht gefordert haben?\n\n({1})"
"1067112","Canan","Bayram","Grüne","Member of Parliament","2022-02-17T00:00:00.000Z","https://dip21.bundestag.de/dip21/btp/20/20017.pdf","\n\nVielen Dank, Frau Präsidentin. – Liebe Kolleginnen und Kollegen! Der CDU/CSU muss man es immer wieder erklären: Im Grundgesetz steht nicht „Eigentum ist heilig“, sondern da steht „Eigentum verpflichtet“, und das sollten Sie sich vielleicht mal näher anschauen, liebe Kolleginnen und Kollegen.\n\n({0})\n\nDenn die eigentliche Frage, die in dem Gesetzentwurf zum Vorkaufsrecht, der hier eingebracht wurde, aufgeworfen wird, ist doch: Wie gelingt es uns, die Kommunen, die öffentliche Hand in die Lage zu versetzen, Häuser so aufzukaufen, dass die Mischung der Bevölkerung, das sogenannte Milieu, erhalten wird? Und da kann ich Ihnen sagen, meine Damen und Herren: Für uns als Grüne ist das eine unserer Kernforderungen, und an der halten wir auch fest.\n\n({1})\n\nUnd wenn Sie hier den Eindruck erwecken wollen, dass das Bundesverwaltungsgericht eine Entscheidung getroffen hätte, die wir als Gesetzgeber nicht verändern könnten, liebe Kollegen von der CDU/CSU, muss ich Sie auch korrigieren: Wir sind der Gesetzgeber, und wir können sehr wohl dafür sorgen, dass es endlich wieder ein Vorkaufsrecht gibt. Und wir müssen dafür sorgen, weil die Menschen das brauchen.\n\nTagtäglich sind Menschen von Verdrängung bedroht, weil Spekulanten, insbesondere in meinem Wahlkreis, in Friedrichshain-Kreuzberg, unterwegs sind. Und die kaufen Wohnungen, die wir ihnen nicht überlassen sollten.\n\n({2})\n\nWir sollten entweder das Vorkaufsrecht in Anspruch nehmen oder mit einer Abwendungsvereinbarung verhindern, dass das Milieu sich verändert, dass Eigenbedarfskündigungen geltend gemacht werden. Dagegen richtet sich das Vorkaufsrecht. Das ist ein scharfes Schwert, und das wollen wir stärken, meine Damen und Herren.\n\n({3})\n\nUnd den Entwurf der Linken kann man nur begrüßen. Gerade ich als Berlinerin sage: Es ist gut, dass dieser Entwurf im Bundesrat liegt. Dort wird er beraten. Und auch vom Bundesrat aus könnte er uns als Initiative hier vorgeschlagen werden. Es ist eine solide Grundlage, die wir beraten sollten. Das enthebt aber Frau Kiziltepe und Frau Geywitz nicht davon, dem Parlament einen gerichtsfesten Vorschlag als Formulierungshilfe vorzulegen. Darauf haben wir uns verständigt. Ich kann da nur sagen: Wir brauchen das schnell – auch ich verspüre den Druck –, damit wir die Menschen vor Verdrängung schützen, und das nicht nur in meinem Wahlkreis, sondern im ganzen Gebiet der Bundesrepublik Deutschland. Das ist unsere Verantwortung als gewählte Abgeordnete, und dafür setzen wir uns ein.\n\nVielen Dank.\n\n({4})"
"1067131","Hanna","Steinmüller","Grüne","Member of Parliament","2022-02-17T00:00:00.000Z","https://dip21.bundestag.de/dip21/btp/20/20017.pdf","\n\nSehr geehrte Frau Präsidentin! Liebe Kolleginnen und Kollegen! Ich dachte eigentlich, nachdem wir das Thema vor drei Wochen schon mal hatten, dass mittlerweile ein bisschen mehr Sachkenntnis im Raum wäre. Ich habe den Eindruck, das ist nicht so. Von daher noch mal ganz klar zur Differenzierung: Wir brauchen Mieterinnen- und Mieterschutz, Sanierungsgebiete, und wir brauchen Neubau. Das alles ständig durcheinanderzumischen, führt nicht dazu, dass wir am Ende eine sachlichere Diskussion haben.\n\n({0})\n\nDie Argumente, was man alles im Bereich Neubau machen könnte, schließen sich nicht gegenseitig aus.\n\nNichtsdestotrotz brauchen wir das Vorkaufsrecht. Herr Luczak, Sie haben gesagt, wie viel Geld das kostet. Wir beide wissen, dass meistens gar nicht die Immobilie zugunsten eines Dritten oder von der Kommune gekauft wird, sondern dass diese Abwendungsvereinbarungen geschlossen werden. Von daher geht es da gar nicht um Geld; das kostet nichts. Wir beide wissen auch, dass in Ihrem Wahlbezirk Tempelhof-Schöneberg – ich hatte letzte Woche ein Gespräch mit dem damals zuständigen Stadtrat Jörn Oltmann – energetische Modernisierungen genehmigt wurden. Das ist der Fall. Sie haben aber das Gegenteil behauptet. Fragen Sie im Bezirksamt Ihres Wahlkreises nach. Was Sie gesagt haben, ist nicht der Fall.\n\n({1})\n\nJetzt aber zurück zum Vorkaufsrecht, worum es ja eigentlich gehen sollte. Ich glaube, im Ziel sind wir uns einig: Wir wollen wie Die Linke das Vorkaufsrecht wiederherstellen. Wir haben aber einige Fragen, die wir einfach noch klären müssen. Die erste ist: Reicht eine Änderung des § 26 Nummer 4 des Baugesetzbuches, um das Vorkaufsrecht nachhaltig wiederherzustellen, oder müssen wir vielleicht mehr machen?\n\n({2})\n\nMüssen wir vielleicht klarer definieren, wann ein Vorkaufsrecht nach § 24 Absatz 3 BauGB zum Wohl der Allgemeinheit in Erhaltungsgebieten gezogen werden kann? Müssen wir vielleicht in Fällen möglicher Spekulation, wo es das Vorkaufsrecht für die Gemeinden eben nicht gibt, nachschärfen, indem wir es zum Beispiel im Wohneigentumsrecht und beim Erbbaurecht neu einführen? Das sind Fragen, die wir klären müssen.\n\nAls Letztes, weil das Vorkaufsrecht so wichtig ist: Wir brauchen mehr Personal und mehr finanzielle Mittel für die Kommunen, damit das Vorkaufsrecht auch wirklich gezogen wird. Darüber müssen wir in den nächsten Wochen diskutieren. Deswegen braucht es, glaube ich, noch mehr Debatten. Dies wird nicht das letzte Mal sein, dass wir hier darüber sprechen. Aber im Sinne der Mieterinnen und Mieter sollten wir das tun.\n\nVielen Dank.\n\n({3})"
"1067147","Linda","Heitmann","Grüne","Member of Parliament","2022-02-17T00:00:00.000Z","https://dip21.bundestag.de/dip21/btp/20/20017.pdf","\n\nVielen Dank. – Sehr geehrte Frau Präsidentin! Liebe Kolleginnen und Kollegen! Liebe Abgeordnete der Union, wir diskutieren hier heute in 40 Minuten zwei Anträge von Ihnen, die aber eigentlich drei Themen umfassen.\n\n({0})\n\nEs geht um die Verkürzung des Genesenenstatus, es geht um die Umsetzung der institutionsbezogenen Impfpflicht, und es geht Ihnen auch um die Quarantäneregeln für Reisende mit Kindern.\n\nIch glaube, wir sind uns einig: Es wird diesen Themen nicht gerecht, sie alle in 40 Minuten zu diskutieren. Man könnte es auch zusammenfassen unter: Wir diskutieren heute mal alles, was der Union an der Pandemie gerade nicht passt.\n\n({1})\n\nSie beklagen in Bezug auf die Verkürzung des Genesenenstatus, dass dieser innerhalb weniger Tage von sechs auf drei Monate herabgesetzt wurde. Ja, ich gebe zu: Die Kommunikation dazu war mehr als unglücklich. Aber, ich glaube, wir müssen einfach mal anerkennen, dass die Wissenschaft in dieser Pandemie in einem unglaublichen Tempo immer wieder zu neuen Erkenntnissen kommt. Daher ist es auch unsere Aufgabe als Politik, das mit einzubeziehen, das in unser politisches Handeln und in unsere politischen Entscheidungen mit aufzunehmen, wenn wir die Wissenschaft wirklich ernst nehmen, die seriös daran arbeitet, auch zu ergründen, wie lange eigentlich die Immunisierung durch eine Genesung vorhält.\n\n({2})\n\nSie fordern in Bezug auf die institutionsbezogene Impfpflicht, die Bundesregierung möge dem Bundesland Bayern, das diese institutionsbezogene Impfpflicht selbst im Bundesrat mit angenommen hat, doch bitte einmal erklären, wie es die jetzt umzusetzen hat.\n\nMeine Damen und Herren, ich finde, es entbehrt nicht einer gewissen Ironie, dass genau jenes Bundesland, das sonst stets auf seine Souveränität pocht, jetzt plötzlich, wenn es die Möglichkeit hat, das Gesetz selbst vor Ort auszugestalten, von der Bundesregierung einfordert, alles haarklein vorgegeben zu bekommen.\n\n({3})\n\nIch finde, das ist wirklich mehr als skurril.\n\nIch möchte jetzt gern in dieser Debatte zu allem, was uns rund um Corona stört, zu der Fragestellung kommen, die mich seit Monaten umtreibt. Das ist die Fragestellung: Wie bekommen wir es hin, dass wir in diesem Land endlich wieder in eine Situation kommen, in der die Gesundheitsversorgung für alle wirklich wieder gut gewährleistet werden kann?\n\n({4})\n\nBis Oktober letzten Jahres war ich in der Suchtkrankenhilfe tätig. Ich hatte mit verschiedensten Einrichtungen der Suchtkrankenhilfe tagtäglich zu tun und habe gesehen, was die Pandemie und was dieser andauernde Ausnahmezustand dort eigentlich angerichtet hat. Gucken wir uns das einmal an: Menschen, die ein Suchtproblem haben, gehen in der Regel als Erstes zu einer Beratungsstelle. Dort können sie sich normalerweise überall in Deutschland ganz unkompliziert und kostenlos beraten lassen. Seitdem die Pandemie angefangen hat, ist dies vielfach nur noch per Video möglich. Es gibt viel weniger Termine, und ich glaube, sehr viele Menschen sind uns in dieser Pandemie an dieser Stelle wirklich verloren gegangen, weil sie mit der Technik nicht zurechtkommen, weil sie diese Anlaufstelle dann nicht mehr haben.\n\nEs geht in der Suchtkrankenhilfe weiter mit einem qualifizierten Entzug. Viele Stationen für einen qualifizierten Entzug wurden zu Beginn der Pandemie geschlossen, oder sie haben die Anzahl der Betten stark zurückgefahren und auch die Leistungen stark reduziert. Ein qualifizierter Entzug in der Suchtkrankenhilfe ist seit der Pandemie nur noch sehr bedingt möglich. Wenn wir uns auch die Reha danach angucken, dann sehen wir: Hier wurden viele Plätze reduziert, weil die Menschen alle in Einzelzimmern untergebracht werden müssen. Es gibt viele Sonderregelungen, und auch hier können eine normale Behandlung und Reha nicht mehr stattfinden.\n\nZuletzt möchte ich den Blick auch noch auf die Suchtselbsthilfe lenken, auf genau das, was viele Menschen in der Sucht immer wieder am Leben hält und ihnen einen normalen Alltag ermöglicht. Hier sind viele persönliche Begegnungen in den letzten zwei Jahren weggefallen. Wir haben davon gehört, dass zahlreiche Menschen, die seit Jahren trocken waren, aufgrund dieses Wegfalls von persönlichen Begegnungen rückfällig geworden sind.\n\nWas möchte ich mit diesem Schlaglicht auf die Suchthilfe verdeutlichen? Ich möchte Ihnen verdeutlichen, dass wir hier wirklich mal den Fokus darauf legen sollten, dass die Behandlung auf allen Ebenen in unserem Gesundheitssystem seit fast zwei Jahren massiv eingeschränkt ist. Ich möchte wirklich dafür plädieren, dass wir hier als Parlament gemeinsam und konstruktiv darüber diskutieren, wie wir aus diesem Dauerausnahmezustand rauskommen.\n\nIch lade Sie dazu ein, beispielsweise in der nächsten Sitzungswoche hier mit uns zu debattieren: Kann die Impfpflicht ein Weg zurück zur Normalität sein? Wenn ja: Wie muss sie ausgestaltet sein? Ich würde mich freuen, wenn Sie sich da konstruktiv einbringen, statt sich im Klein-Klein solcher Anträge zu verlieren, wie Sie sie hier heute vorgelegt haben.\n\nVielen Dank.\n\n({5})"
"1067185","Irene","Mihalic","Grüne","Member of Parliament","2022-02-17T00:00:00.000Z","https://dip21.bundestag.de/dip21/btp/20/20017.pdf","\n\nSehr geehrte Frau Präsidentin! Meine Damen und Herren! Liebe Kolleginnen und Kollegen von der Union! Die ersten vier Worte Ihres Titels für diese Aktuelle Stunde „Rechtsstaatlichkeit wahren, Demokratie schützen“, das sind ganz zentrale Forderungen. Die unterschreiben wir hier heute sofort mit allem Nachdruck. Vielen Dank, dass Sie diese Eule nach Athen getragen haben!\n\n({0})\n\nUnterhalb dieser Selbstverständlichkeit kommt dann das, worum es Ihnen hier heute in Wirklichkeit geht, und das ist bestenfalls irdisch: Sie möchten hier noch einmal Ihre Zitate, die Sie letzte Woche der Presse gegeben haben, laut machen, falsche Vorwürfe wiederholen und Regierungsmitglieder in ein falsches Licht stellen. Dem treten wir hier deutlich entgegen, und diese plumpen Versuche, Mitglieder der Bundesregierung zu diskreditieren, weisen wir aufs Schärfste zurück, meine Damen und Herren.\n\n({1})\n\nIch sage es hier auch in der Sache noch einmal klipp und klar: Unangemeldete Blockaden auf Autobahnen stellen selbstverständlich eine massive Gefährdung für Verkehrsteilnehmerinnen und Verkehrsteilnehmer und Einsatzkräfte dar; das kann ich auch aus meiner früheren beruflichen Erfahrung sagen. Angesichts solcher Gefahren ist auch das Versammlungsrecht unmissverständlich. Jede Form des Protestes hat die Verantwortung dafür auszuschließen, dass Menschen gefährdet werden oder dass gar jemand zu Schaden kommt.\n\nNichts anderes hat im Übrigen auch die Bundesumweltministerin im Kern ausgeführt, und zwar völlig unmissverständlich.\n\n({2})\n\nDas konnte jeder, Herr Amthor, der sich die Frage und die Antwort zusammen angehört hat und ein ernsthaftes Interesse daran hatte, auch erkennen. Und wer Zitate in sinnentstellender Weise aus dem Zusammenhang reißt\n\n({3})\n\noder nach der Überschrift aufhört, zu lesen, und damit versucht, Zweifel am Rechtsstaatsverständnis einer Bundesministerin zu streuen, der sollte mal besser sein eigenes Rechtsstaatsverständnis hinterfragen.\n\n({4})\n\nLiebe Kolleginnen und Kollegen der Union, das, was Sie hier abziehen, ist so lächerlich wie durchschaubar. Das alles sagt mehr über Sie selbst aus als über die Angegriffenen. Es ist wirklich enttäuschend – und das meine ich aus tiefstem Herzen –,\n\n({5})\n\nwie Sie versuchen, mit solchen Manövern, die in der Sache völlig ins Leere laufen, billige Punktgewinne am rechten Rand zu erzielen.\n\nAls wir diese Koalition eingegangen sind, ging es uns natürlich darum, unser Land inhaltlich voranzubringen, aber eben auch eine politische Kultur des gegenseitigen Respekts und des Anstands zu etablieren.\n\n({6})\n\nDazu will ich Ihnen mal ein Beispiel nennen. Als Friedrich Merz Anfang Januar seinen Gastbeitrag im „Focus“ veröffentlichte, stand dort die Überschrift – ich zitiere – „Corona-Angstszenarien treiben immer mehr normale Bürger in den gewaltsamen Protest“. Wäre das ein Beitrag einer Grünen gewesen, hätten Sie nach der Überschrift aufgehört, zu lesen, und erst einmal laut „Skandal!“ geschrien. Aber Lesen bildet ja bekanntlich, und deshalb haben wir uns den ganzen Text angeschaut und festgestellt,\n\n({7})\n\ndass man Friedrich Merz ganz sicher nicht unterstellen kann, gewaltsame Proteste zu legitimieren, wie das die Überschrift vielleicht suggeriert.\n\n({8})\n\nAber im Gegensatz zu Ihnen, liebe Kolleginnen und Kollegen, haben wir danach keine Aktuelle Stunde beantragt,\n\n({9})\n\num Zweifel am Rechtsstaatsverständnis Ihres heutigen Fraktionsvorsitzenden zu streuen.\n\n({10})\n\nDenn wir als Ampelkoalition suchen die Auseinandersetzung mit Ihnen in der Substanz und nicht in übler Nachrede.\n\n({11})\n\nIn diesem Sinne weisen wir entschieden jeden Versuch Ihrerseits zurück, Mitglieder dieses Kabinetts in die Nähe von Rechtsstaats- und Demokratiefeindlichkeit zu rücken.\n\n({12})\n\nWas Sie insinuieren, ist eine Unverschämtheit, und es wäre gut, wenn Sie wenigstens den Anstand hätten, sich dafür zu entschuldigen.\n\n({13})\n\nWir wissen – und das spüren wir hier bei jeder Ihrer Reden –: Die Oppositionsrolle ist neu für Sie.\n\n({14})\n\nAber Sie werden feststellen – lassen Sie sich das von einer erfahrenen Oppositionspolitikerin einmal sagen –, dass die Menschen von Ihnen mehr erwarten als durchschaubare Aktionen zur Herabwürdigung von Mitgliedern der Bundesregierung.\n\n({15})\n\nLassen Sie uns ernsthaft – und das meine ich wirklich so – um Inhalte streiten, um die besten Konzepte!\n\n({16})\n\nDamit gewinnen Sie auch Profil in der öffentlichen Debatte. Inszenierte Scharmützel interessieren da draußen niemanden,\n\n({17})\n\nund das völlig zu Recht, wie ich finde, meine Damen und Herren.\n\nVielen Dank.\n\n({18})"
"1067198","Konstantin","Notz","Grüne","Member of Parliament","2022-02-17T00:00:00.000Z","https://dip21.bundestag.de/dip21/btp/20/20017.pdf","\n\nFrau Präsidentin! Liebe Kolleginnen und Kollegen! Meine sehr verehrten Damen und Herren! Es sind bewegte Zeiten, auch und gerade in der Innenpolitik. Rechtsextreme versuchen, die Verunsicherung der Bevölkerung in einer globalen Pandemie zu missbrauchen. Unsere Demokratie wird angegriffen.\n\n({0})\n\nDer Rechtsstaat wird delegitimiert, Frau von Storch. Wir sehen schlimmste Gewalt gegen die Polizei; der schreckliche Doppelmord von Kusel hat unser Land erschüttert. Es gibt tausend sehr schwierige, gewichtige, relevante Themen in der Innenpolitik. Da ist es interessant, zu welchem Thema die Union eine der ersten Aktuellen Stunden hier beantragt. Und was thematisieren Sie? Die Kollegin Mihalic hat Ihnen das aufs Deutlichste erklärt, Herr Amthor: Sie reißen eine Aussage der Umweltministerin verfälschend aus dem Zusammenhang,\n\n({1})\n\nund Sie tun dies jetzt wieder. Und Sie versuchen, die Innenministerin über die Veröffentlichung eines Aufsatzes anzuschmuddeln. Das ist unterste Schublade, meine Damen und Herren.\n\n({2})\n\nDieses ganze Vorgehen und auch, dass Sie es gestern in der Debatte zu Hanau – Kollege Lindh hat es gesagt – offenbar wichtiger fanden, ein Negative Campaining zu setzen, als am Jahrestag über diese entsetzlichen rassistischen Morde zu sprechen,\n\n({3})\n\nist ein einziger innenpolitischer Offenbarungseid der CDU/CSU-Fraktion.\n\n({4})\n\nDie Vorwürfe gegen Frau Faeser waren von Beginn an abwegig, Herr Kollege Amthor, und Sie wissen das. Die Zahl von kommunalpolitisch Aktiven – auch das ist gesagt worden –, die mit der Vereinigung der Verfolgten des Naziregimes zusammenarbeiten, ist hoch, auch in der Union. Sie diffamieren mit Ihren abwegigen Kampagnen so auch noch ihre eigenen Bürgermeister und ehrenamtlichen Politiker/-innen. Das geht so nicht.\n\n({5})\n\nWas ist des Pudels Kern? In dem fraglichen Artikel macht Frau Faeser die rechtsextremistischen Beleidigungen und Bedrohungen des NSU 2.0 gegen sich öffentlich.\n\n({6})\n\nDas ist das Thema dieses Aufsatzes. Das tut die damalige Landtagsabgeordnete – und Sie alle wissen das – in einem Bundesland, nämlich Hessen, in dem Ihr Parteifreund Dr. Walter Lübcke, ehemaliger hessischer CDU-Landtagsabgeordneter und Regierungspräsident, nach genau solchen rechtsextremistischen Bedrohungen von Rechtsextremisten ermordet worden ist.\n\n({7})\n\nEin solcher Vorgang, nämlich das Sich-Wehren einer Landtagsabgeordneten gegen diese ekelhaften, infamen und perfiden rechtsextremistischen Einschüchterungsversuche, verlangt unsere ganze parlamentarische Solidarität und politische Solidarität.\n\n({8})\n\nEinen solchen Vorgang parteipolitisch zu instrumentalisieren und hier zu skandalisieren, das ist unterirdisch, und das machen wir nicht mit.\n\n({9})\n\nWenn das der neue Friedrich-Merz-Style Ihrer Fraktion ist und wenn das Aufwärmen von Kampagnen der „Jungen Freiheit“ hier stilprägend wird, meine Kollegen der Union, dann gute Nacht!\n\nEin Satz zur AfD. Herr Hess, Sie stehen ja nun wirklich mit dem Flügel, mit Ihrer Jugendorganisation, mit Einzelpersonen, mit Ihren politischen Freunden national wie international im Fokus des Interesses sämtlicher Verfassungsschutzbehörden dieses Landes.\n\n({10})\n\nDer neueste Kronzeuge gegen Sie heißt Jörg Meuthen, Frau von Storch,\n\n({11})\n\nvon der Gewalt auf Ihren Anticoronademos gegen die Polizistinnen und Polizisten in unserem Land mal ganz abgesehen.\n\n({12})\n\nDass Sie die Chuzpe haben, sich in einer solchen Debatte mit Kritik gegen irgendwen überhaupt zu Wort zu melden, das schlägt dem Fass wirklich den Boden aus.\n\n({13})\n\nLiebe Kolleginnen und Kollegen der Union, ich sage es noch einmal ganz deutlich: Dieses Parlament, der Deutsche Bundestag, braucht eine kritische, eine demokratische, eine inhaltlich-kompetente Opposition, gerade in der Innenpolitik, gerade in solchen Zeiten.\n\n({14})\n\nEine deutsche Tea Party braucht kein Mensch in diesem Haus.\n\n({15})\n\nDeswegen bin ich nicht bereit, Sie aufzugeben.\n\nHerzlichen Dank.\n\n({16})"
