id,firstname,lastname,faction,position,date, url,speech
"1062893","Kordula","Schulz-Asche","Grüne","Member of Parliament","2021-06-11T00:00:00.000Z","https://dip21.bundestag.de/dip21/btp/19/19234.pdf","\n\nHerr Präsident! Meine Damen und Herren! Pflege ist gesellschaftsrelevant, und das nicht erst seit der Coronapandemie. Aber jetzt wissen viele Menschen, wo überall\n        professionelle Pflege stattfindet, und zwar an vielen Stellen in unserer Gesellschaft: in Krankenhäusern, in der Rehabilitation, in teilstationären oder stationären Einrichtungen, natürlich\n        auch zu Hause in den Familien und mancherorts auch schon in Schulen und am Arbeitsplatz. Pflege ist an vielen Stellen für immer mehr Menschen ein zentrales Thema ihres Lebens.\n\nDer demografische Wandel in den nächsten Jahrzehnten erfordert heute eine Reform der Pflegeversicherung: eine Pflegereform, die die Bedürfnisse und Bedarfe der auf Pflege\n        angewiesenen Menschen in den Mittelpunkt stellt, eine Pflegereform, die die Qualifikation und Arbeit professioneller Pflege endlich aufwertet, eine Pflegereform, die Strukturen für Pflege\n        schafft, die im Stadtteil oder im Dorf eine gute Versorgung der pflegebedürftigen Menschen und die Unterstützung ihrer Familien erleichtert.\n\n({0})\n\nWas hier heute entschieden wird, ist keine Pflegereform, sondern aufgrund einiger Maßnahmen bestenfalls ein Pflegereförmchen. Ich möchte das anhand von zwei zentralen Punkten\n        darstellen.\n\nErstens. Natürlich ist es höchste Zeit für bessere Bezahlung von Pflegekräften. Es ist auch zu begrüßen, dass die Tarifbezahlung Standard werden soll. Aber dort, wo heute unter\n        Tarif bezahlt wird, wird das durch Schlupflöcher im Gesetz über Haustarife weiter der Fall sein. Meine Damen und Herren, notwendig als Voraussetzung für einen Versorgungsvertrag wäre das\n        Niveau eines repräsentativen Flächentarifvertrags. Das, Herr Minister Heil, wäre das richtige Mittel. Das hätten Sie als Sozialdemokrat hier heute vorstellen müssen.\n\n({1})\n\nZweitens. Die veraltete Logik der Pflegeversicherung bedeutet, dass mit jeder Verbesserung – dazu gehören natürlich auch die Gehälter des Personals – die finanzielle Belastung\n        der Pflegebedürftigen durch den Eigenanteil an der Pflege steigt und dass dadurch immer mehr Menschen Sozialhilfe in Anspruch nehmen müssen. Das Problem hat diese Regierung erkannt – wenn auch\n        spät. Aber Ihr Vorschlag ist nicht geeignet, die Verarmungsproblematik tatsächlich zu lösen. Was Sie vorschlagen, ist eine Entlastung durch einen 5-prozentigen Zuschlag im ersten Jahr. Aber\n        dieser wird verpuffen; denn gleichzeitig verzichtet diese Regierung auf die Dynamisierung der Leistungen. Deswegen wird es im ersten Jahr überhaupt keinen Effekt geben. Damit haben wir erst im\n        zweiten Jahr eine nennenswerte Entlastung, obwohl auch diese zu niedrig ist. Die volle Entlastung erfolgt erst ab dem vierten Jahr, und das wird mehr als die Hälfte der Pflegebedürftigen gar\n        nicht mehr erleben.\n\nMeine Damen und Herren, das ist keine Pflegereform. Nein, Sie hinterlassen der nächsten Bundesregierung ein wirklich explosives Erbe. Wir brauchen eine demografiefeste Lösung\n\n({2})\n\nmit der doppelten Pflegegarantie, wie wir es vorschlagen, und mit einer Bürgerversicherung; denn gute Pflege ist eine Frage von Qualität, von Menschlichkeit und von\n        Solidarität.\n\nIch danke Ihnen.\n\n({3})"
"1062910","Konstantin","Notz","Grüne","Member of Parliament","2021-06-11T00:00:00.000Z","https://dip21.bundestag.de/dip21/btp/19/19234.pdf","\n\nFrau Präsidentin! Liebe Kolleginnen und Kollegen! Von den Amigos über die Kohl-Spenden, Ehrenworte und – ich zitiere – „jüdischen Vermächtnisse“ der hessischen CDU bis hin zu\n        den aktuellen Aktienoptionen von Augustus Intelligence, Geld aus Aserbaidschan und den empörenden Maskendeals: Die Liste der Korruptionsskandale von CDU und CSU ist sehr lang, meine Damen und\n        Herren. Allein dieses Jahr, wenige Wochen ist es her – ich sage es nur mal: wenige Wochen –: strafrechtliche Ermittlungen gegen mindestens fünf namhafte Unionspolitiker, Vermögensarreste in\n        Millionenhöhe, Durchsuchungen von Büros hier im Deutschen Bundestag. Was sich Vertreter Ihrer Fraktion mit Maskengeschäften geleistet haben, sind keine Ausrutscher; es ist und bleibt ein\n        Skandal, meine Damen und Herren.\n\n({0})\n\nAber es ist richtig, Herr Kollege Schnieder: Man kann nicht nur von einigen wenigen auf Ihre große Fraktion schließen, und es verbieten sich Generalverdächtigungen und pauschale\n        Verurteilungen gegen andere. Das ist immer richtig. Von einigen wenigen auf viele zu schließen, ist in einem Rechtsstaat immer falsch.\n\n({1})\n\nAber zur Wahrheit, meine Damen und Herren, gehört auch: Diese Strukturen, die Lücken bei der Transparenz und Strafbarkeit sind im Schutz Ihrer ganzen Fraktion gewachsen. Sie alle\n        von CDU und CSU haben hier im Deutschen Bundestag Jahre und Jahrzehnte die Intransparenz, die Schutzlücken, die Einfallstore für Korruption mit allen parlamentarischen Mitteln verhindert, und\n        das geht voll auf Ihr Konto, meine Damen und Herren.\n\n({2})\n\nAll das trotz der Skandale, gegen die Stimmen aus der Fachwelt und Zivilgesellschaft, trotz unzähliger Anträge hier im Deutschen Bundestag von meiner Fraktion, aber auch den\n        anderen Fraktionen.\n\nWenn ich mehr Zeit hätte, würde ich Ihnen aus Ihren Reden der letzten Jahre vorlesen. Es sind zynische, vor Hybris und Selbstgefälligkeit strotzende Reden angesichts des\n        Umstandes, dass sich Kolleginnen und Kollegen aus Ihrer Fraktion in der schwersten Krise der Bundesrepublik unter Ausnutzung des Mandats persönlich und mit riesigen Summen bereichert haben. Es\n        ist schlicht beschämend, meine Damen und Herren.\n\n({3})\n\nProaktiv waren Sie nicht bereit und in der Lage, dieses Thema anzugehen. Das machen Sie jetzt, getrieben von Skandalen oder dem Druck der Öffentlichkeit und mit dem Blick auf die\n        anstehende Bundestagswahl. Aber da, wo Sie selbst Aufklärung versprochen haben, rühren Sie keinen Finger. Sie haben Leute aus Ihrer Fraktion rausgeschmissen – okay. Sie haben Ehrenerklärungen\n        abgegeben – meinetwegen. Aber die Aufklärung, welche Logiken, welche Strukturen hinter all dem stecken, betreiben bis zum heutigen Tage nur die Staatsanwaltschaften und Medien, nicht Sie. Das\n        ist einfach zu wenig, meine Damen und Herren.\n\n({4})\n\nAber ich will auch sagen – ich komme zum Schluss –: Herr Schnieder, es ist vollumfänglich sinnvoll, das zu tun; da haben Sie recht. Es ist gut und richtig, was wir hier heute\n        verabschieden, aber es kommt zu spät, und es ist zu wenig. Es fehlt die Parteienfinanzierung, es fehlt die Verschärfung des Tatbestandes bei der Abgeordnetenbestechung. Insofern bleibt viel zu\n        tun.\n\nGanz herzlichen Dank.\n\n({5})"
"1063270","Katharina","Dröge","Grüne","Member of Parliament","2021-06-24T00:00:00.000Z","https://dip21.bundestag.de/dip21/btp/19/19236.pdf","\n\nSehr geehrte Frau Präsidentin! Liebe Kolleginnen und Kollegen!\n\nEs reicht nicht, Klimaneutralität per Gesetz vorzuschreiben. Die Politik muss auch dringend etwas dafür tun, dass das Ziel erreicht werden kann, und politische Entscheidungen treffen.\n\nDieser Satz stammt nicht aus unserem Antrag, obwohl er daraus hätte stammen können, dieser Satz stammt von Siegfried Russwurm, dem Präsidenten des Bundesverbandes der Deutschen Industrie, anlässlich des Tages der Industrie. Wer die Stimmen aus der Industrie vernimmt, der weiß, dass diese dringende Bitte, dieser Appell an Sie immer verzweifelter wird.\n\n({0})\n\nDas, was Sie tun, ist das Gegenteil von Handeln. Das, was Sie tun, ist das Gegenteil von Entscheidungen treffen. Wenn man sich die Reden von Herrn Laschet, Herrn Lämmel und Herrn Linnemann den ganzen Tag angehört hat, dann weiß man, warum Sie die Industrie mittlerweile zur Verzweiflung bringen: Sie sagen keinen Satz zur Zukunft, keinen Satz dazu, wie Sie die größte Herausforderung, vor der die deutschen Industrie steht, adressieren.\n\n({1})\n\nStattdessen reden Sie über Frieden, Freude, Freiheit und geben irgendwelche allgemeinpolitischen Bekenntnisse ab; kein Satz zur größten Herausforderung.\n\nHandeln wäre stattdessen nötig. Eine Regierung wäre nötig, die endlich ernst macht mit dem Ausbau der erneuerbaren Energien, statt jahrelang nur auf der Bremse zu stehen,\n\n({2})\n\neine Regierung, die endlich mal für vernünftige, faire Strompreise sorgt, eine Regierung, die der Wirtschaft Planungssicherheit und Verlässlichkeit beim notwendigen Fortschritt gibt.\n\nMit Fortschritt sind die klimaneutralen Technologien gemeint. Deswegen verlangen alle – von der Chemieindustrie bis zur Stahlindustrie – von Ihnen sogenannte Klimaverträge, mit denen die klimaneutralen Technologien wettbewerbsfähig gemacht werden könnten und Deutschland somit international zum Vorreiter würde. Kein Wort dazu von Ihnen in dieser Debatte. Was für ein wirtschaftspolitisches Armutszeugnis!\n\n({3})\n\nZur Handelspolitik. Irgendjemand fand das mit den planetaren Grenzen sehr lustig. Ich sage Ihnen ganz ehrlich: Der Verlust an Artenvielfalt, den wir gerade beobachten, und die sich immer mehr zuspitzende Klimakrise sind nicht lustig, sondern sie sind Zeichen einer Überlastung unseres Planeten. Da müssen wir massiv im Rahmen der Handelspolitik gegensteuern.\n\nZur Frage, welchem Abkommen wir zugestimmt haben: Das Abkommen mit Großbritannien war eines, dem wir zugestimmt haben, weil es in die richtige Richtung gegangen ist. Ich frage Sie: Warum sollte etwas, das mit Boris Johnson möglich war, mit Justin Trudeau nicht möglich sein?"
"1062924","Irene","Mihalic","Grüne","Member of Parliament","2021-06-11T00:00:00.000Z","https://dip21.bundestag.de/dip21/btp/19/19234.pdf","\n\nSehr geehrte Frau Präsidentin! Liebe Kolleginnen! Liebe Kollegen! Am Ende dieser Legislaturperiode ist die Bilanz der Bundesregierung bei der Bekämpfung des Rassismus und des\n        Rechtsextremismus leider alles andere als gut. Umso wichtiger ist es, dass wir hier und heute noch einmal über dieses Thema sprechen.\n\nDass die NSU-Morde und das massive Versagen in diesem Zusammenhang nicht bereits für ein radikales Umdenken in dem seit 16 Jahren von der Union geführten Innenministerium gesorgt\n        haben, ist vollkommen unverständlich.\n\n({0})\n\nDer Mord an Walter Lübcke, der antisemitische Anschlag in Halle, der rassistische und rechtsterroristische Anschlag in Hanau – nach jeder Tat wurde gemahnt, und es wurden\n        Konsequenzen versprochen. Selbst der Bundesinnenminister erkannte 2020: Der Rechtsextremismus ist die größte Bedrohung in unserem Land. – Da frage ich mich, warum außer warmen Worten kaum\n        etwas passiert ist. Und wenn Sie, Herr Throm, jetzt auch noch damit kommen, dass Sie ja das Gesetz gegen Hasskriminalität gemacht haben, kann ich Ihnen nur sagen: Selbst da haben Sie ein paar\n        Anläufe gebraucht, bis es für den Bundespräsidenten unterschriftsfähig war.\n\n({1})\n\nDarüber hinaus ist praktisch nichts geschehen. Warum haben wir immer noch kein Demokratiefördergesetz? Wo bleibt die lange versprochene und dringend notwendige Verstetigung von\n        Fördermitteln? Was ist mit dem Periodischen Sicherheitsbericht, auf den wir schon ewig warten? Wie steht es um die Verbesserung der Analysefähigkeit der Sicherheitsbehörden? Warum gibt es\n        keine angemessene Verschärfung beim Waffenrecht, und warum gibt es nicht endlich Untersuchungen über verfassungsfeindliche Einstellungsmuster in den Sicherheitsbehörden, wenn die Meldungen\n        über rassistische und rechtsextreme Chatgruppen und Verhaltensweisen nicht abreißen, zuletzt beim BKA und beim SEK in Frankfurt? Wo bleiben die Verbesserungen beim Opferschutz?\n\n({2})\n\nEs ist mir ein Rätsel, wie man nach der Blutspur, die der Rassismus und der rechte Terror seit Jahren durch Deutschland ziehen, in so einer Schockstarre verharren kann.\n\n({3})\n\nUnd noch eines: Sprache verändert das Denken und das Handeln. Für rassistisches Vokabular sollte in unserer Verfassung definitiv kein Platz sein. Das haben wir in unserem Antrag\n        mit dem Titel „Für eine antirassistische und chancengerechte Einwanderungsgesellschaft“ auch dargelegt. Dass Sie es nicht einmal geschafft haben, den Begriff „Rasse“ aus dem Grundgesetz zu\n        streichen, obwohl der Bundesinnenminister das selbst zugesagt hat, ist ein Armutszeugnis und zeigt: Diese Koalition ist am Ende.\n\n({4})\n\nIn der nächsten Legislaturperiode muss die Bekämpfung von Rechtsextremismus und Rassismus endlich im Zentrum stehen. Dafür werden wir uns mit aller Kraft einsetzen.\n\nHerzlichen Dank.\n\n({5})"
"1062958","Omid","Nouripour","Grüne","Member of Parliament","2021-06-23T00:00:00.000Z","https://dip21.bundestag.de/dip21/btp/19/19235.pdf","\n\nHerr Präsident! Meine Damen und Herren! Erlauben Sie mir eine Vorbemerkung zur Rede des Kollegen Bartsch. Es ist nicht alles schlecht in Ihrer Rede; aber eines kann ich hier nicht stehen lassen, und das sage ich für meine gesamte Fraktion, die wir seit Jahren über diesen Einsatz miteinander ringen und dann jeweils in den Spiegel gucken und Gewissensentscheidungen treffen: Diese Entscheidung treffen wir in Abwägung dessen, was für die Menschen in Afghanistan am besten ist, und sicher nicht, weil irgendjemand in Washington sagt, was wir machen sollen. Ich finde, die Gewissensfreiheit der Abgeordneten in dieser Frage sollte man nicht einfach so beiseiteschieben\n\n({0})\n\nund so tun, als wäre es von anderer Seite diktiert.\n\n({1})\n\nMeine Damen und Herren, die Nachrichten aus Masar-i-Scharif sind extrem besorgniserregend, aber nicht nur aus Masar-i-Scharif. In den letzten zwei Monaten – in nur zwei Monaten! – sind 78 der 380 Distrikte in Afghanistan von den Taliban erobert worden. Die Anzahl der Gefechte, aber vor allem der Anschläge ist gewaltig. Im Schnitt ist in den letzten zwei Monaten alle zehn Minuten eine Zivilistin oder ein Zivilist in Afghanistan ums Leben gekommen. Der Anschlag von Dasht-e-Barchi am 8. Mai auf eine Mädchenschule mit zig Toten kann niemanden ungerührt lassen. Wenn man die Fotos von blutbeschmierten Schreibheften von ABC-Schützinnen und sieht, dann weiß man, was auf dem Spiel steht. Gleichzeitig gibt es die Verhandlungen in Doha, und die kommen nicht voran.\n\nDas alles zusammen kann zu verschiedensten Konsequenzen führen; aber aus meiner Sicht ist die erste und offensichtlichste ein Abschiebestopp nach Afghanistan. Wenn wir uns jetzt Sorgen um einen sicheren Abzug der Bundeswehr machen, stellt sich die Frage, warum es keinen Abschiebestopp nach Afghanistan gibt.\n\n({2})\n\nWie kann es sein, dass der asylpolitische Lagebericht des Auswärtigen Amts diese Abschiebungen immer noch ermöglicht? Das geht mir nicht in den Kopf.\n\n({3})\n\nMeine Damen und Herren, eine Bilanzierung des Einsatzes ist überfällig; das ist gerade gesagt worden. In einem Satz: Einiges in Afghanistan ist erreicht worden; aber die Tatsache, dass wir sehen, dass die Erfolge nicht nachhaltig sind oder vielleicht nicht nachhaltig sein werden, zeigt, wie viel mehr hätte erreicht werden können, aber auch wie viel mehr hätte erreicht werden müssen – gerade angesichts all der Opfer – mit all dem Geld, das ausgegeben worden ist: bei der Bundeswehr, bei Entwicklungshelferinnen und ‑helfern, bei der Polizei und bei der afghanischen Zivilbevölkerung.\n\nIch möchte an dieser Stelle nach diesen 20 Jahren einen großen Dank aussprechen an die Soldatinnen und Soldaten, an die Polizistinnen und Polizisten, an die Diplomatinnen und Diplomaten, an die Mediation, an Berghof, an all die Menschen, die sich eingebracht haben, um Afghanistan zu einem besseren Ort zu machen.\n\n({4})\n\nUnd auch sie haben eine unabhängige Evaluation des Einsatzes verdient. Es ist dringend notwendig, daraus zu lernen.\n\nJenseits der Evaluation gibt es auch Maßnahmen, die man jetzt sofort ergreifen kann. Ein Beispiel: Die Unabhängige Afghanische Menschenrechtskommission fordert, dass bei dem Menschenrechtsrat der Vereinten Nationen ein Menschenrechtskomitee für Afghanistan eingerichtet wird. Diese Forderung zu unterstützen, wäre absolut überfällig, gerade nach dem Abzug.\n\n({5})\n\nWir wissen seit 2009 – ich erinnere an die Rede von Obama, Westpoint 2009 –, dass dieser Abzug kommen wird. Seitdem heißt es, es gebe Pläne, wie auch nach dem Abzug die Entwicklungszusammenarbeit, die Polizeiausbildung fortgesetzt werden könne. Das steht aber weiterhin noch aus. Die lokalen Ortskräfte müssen unbedingt geschützt werden. Im Grundsatz sind wir uns einig; die Frage stellt sich nur: Warum gilt das erst ab Stichtag 2013? Das werden wir heute Nachmittag auch noch mal miteinander erörtern müssen. Engagierte, beherzte und großzügige Hilfen für diese Menschen sind dringend notwendig, auch um den Ruf Deutschlands als verlässlichen Partner in der Welt gerade in solchen Einsätzen klarzumachen.\n\n({6})\n\nMehr Druck auf die regionalen Akteure wäre dringend angebracht. Und ganz ehrlich: Ein bisschen mehr Hilfe als bisher für Afghanistan zur Bewältigung der Covid-Pandemie, ein paar Impfdosen, ein paar Masken, ein paar Beatmungsgeräte mehr als das, was wir bisher tun, ist in einem Land, in dem Covid wie ein Lauffeuer grassiert, absolut angebracht und längst überfällig.\n\n({7})\n\nAber die wichtigste Lehre der letzten 20 Jahre ist, dass sich unsere Afghanistan-Politik nicht von geopolitischen Entscheidungen und Überlegungen, auch nicht von einer Summe von Innenpolitiken diktieren lassen darf, vielmehr muss das Wohlergehen der Menschen im Zentrum stehen. Deshalb ist eine Afghanistan-zentrierte Strategie auch nach dem Abzug absolut richtig und notwendig.\n\nGanz ehrlich: Ich glaube nicht an eine künftige amerikanische Afghanistan-Politik; ich glaube nicht daran, dass die afghanische Regierung jetzt liefern wird; ich glaube auch erst recht nicht daran, dass die Taliban verstanden haben, dass Frieden angebracht ist. Ich glaube an die zahlreichen Menschen der Zivilgesellschaft und vor allem an diese unglaublichen Frauen, die in den letzten 20 Jahren dieses Land mit aufgebaut haben. Sie nicht im Stich zu lassen, sie nicht zu vergessen, das ist das Gebot der Stunde.\n\n({8})"
"1063021","Oliver","Krischer","Grüne","Member of Parliament","2021-06-23T00:00:00.000Z","https://dip21.bundestag.de/dip21/btp/19/19235.pdf","\n\nHerzlichen Dank, Frau Präsidentin. – Frau Bundeskanzlerin, im Netz kursiert derzeit ein Video einer NDR-Talkshow aus dem Jahr 1997. Da äußern Sie sich sehr vehement, dass in Sachen Klimaschutz schnell und konsequent gehandelt werden muss. Sie argumentieren – und das finde ich fast 25 Jahre zurück sehr weitsichtig – auch, dass Folgekosten eines Nichthandelns im Umwelt- und Klimaschutz oft die Kosten des Handelns übersteigen, und plädieren deshalb im Jahr 1997 sehr stark für schnelles Handeln. Wie würden Sie nach 16 Jahren Ihrer Kanzlerinnenschaft die Bilanz in Sachen Klimaschutz vor dem Hintergrund Ihrer damaligen Äußerungen, die, glaube ich, nicht nur in dieser einen Talkshow, sondern von Ihnen öfter gemacht worden sind, bewerten?"
"1063024","Oliver","Krischer","Grüne","Member of Parliament","2021-06-23T00:00:00.000Z","https://dip21.bundestag.de/dip21/btp/19/19235.pdf","\n\nDanke, Frau Bundeskanzlerin, für die Erläuterung. Mich würde aber da noch mal etwas konkret interessieren. Sie haben jetzt die Ziele im Laufe der Zeit beschrieben. Aber würden Sie das – auch in der Rückschau darauf, wie Sie damals argumentiert haben –, was in den letzten 16 Jahren passiert ist, als ausreichend betrachten, oder würden Sie heute sagen, das hätte eigentlich mehr sein müssen?\n\nMeine weitere Frage: Was würden Sie Ihrer Nachfolgerin oder Ihrem Nachfolger dazu mit auf den Weg geben, was man im Klimaschutz tun muss?"
"1063065","Ulle","Schauws","Grüne","Member of Parliament","2021-06-23T00:00:00.000Z","https://dip21.bundestag.de/dip21/btp/19/19235.pdf","\n\nFrau Bundeskanzlerin, viele der diesjährigen Erstwählerinnen kennen dieses Land nur mit Ihnen als Kanzlerin, und trotzdem hat sich nach 16 Jahren Ihrer Zeit als Regierungschefin der Frauenanteil im Bundestag nicht erhöht, im Gegenteil: Er ist gesunken. Sie und Ihre Fraktion hätten jetzt die Chance gehabt, mit einem Parité-Gesetz oder zumindest mit einer Parité-Kommission zügig etwas gegen diese Entwicklung zu unternehmen. Jetzt ist es auf die lange Bank, auf die Wahlrechtskommission geschoben worden, und es ist unter „ferner liefen“ ein Thema, das irgendwann in der nächsten Legislaturperiode behandelt wird.\n\nDeswegen frage ich Sie: Ist aus Ihrer persönlichen Sicht der Anteil von Frauen im Bundestag ausreichend?"
"1063068","Ulle","Schauws","Grüne","Member of Parliament","2021-06-23T00:00:00.000Z","https://dip21.bundestag.de/dip21/btp/19/19235.pdf","\n\nIch will es noch mal anders sagen: Seit Sie Kanzlerin sind, können sich Mädchen vorstellen, Politikerin oder auch Kanzlerin zu werden. Ich kann das beurteilen, weil ich Berufsberaterin bei SOS-Kinderdorf war. Es haben viele Mädchen seit Ihrer Kanzlerinnenschaft diesen Berufswunsch geäußert. Es ist eben auch bei dieser jungen Generation von Frauen eine sehr motivierende Aussicht. Sind Sie mit mir der Meinung, dass es deswegen nicht am besten wäre, wenn es in diesem Land weiterhin eine Kanzlerin geben würde?\n\n({0})"
"1063137","Christian","Kühn","Grüne","Member of Parliament","2021-06-23T00:00:00.000Z","https://dip21.bundestag.de/dip21/btp/19/19235.pdf","\n\nJa, gerne."
