id,firstname,lastname,faction,position,date, url,speech
"1055577","Ottmar","Holtz","Grüne","Member of Parliament","2021-02-25T00:00:00.000Z","https://dip21.bundestag.de/dip21/btp/19/19212.pdf","\n\nHerr Präsident! Meine Damen und Herren! Stand heute sind wir meilenweit entfernt davon, die Covid-19-Pandemie global in den Griff zu bekommen. Das hat fatale Folgen, nicht nur für uns, sondern auch und vor allem für die Menschen in den ärmeren Ländern unserer Erde.\n\nJahrzehntelang hat die Welt beharrlich globale Partnerschaften aufgebaut, erfolgreiche internationale Organisationen, Strukturen der internationalen Zusammenarbeit, zum Beispiel bei der Bekämpfung von Polio oder anderen Krankheiten. Soll das alles jetzt – in dieser großen Pandemie, die uns selbst herausfordert – keine Rolle mehr spielen? Wir dürfen diese über die letzten Jahrzehnte mühsam erarbeitete globale Solidarität nicht einfach fahrlässig über Bord werfen, meine Damen und Herren.\n\n({0})\n\nWir sind leider kurz davor, genau das zu tun. Wir dürfen die ärmeren Länder in dieser schweren Zeit, in der Pandemie, nicht alleinlassen. Das Virus und die damit verbundenen Folgeerscheinungen – Millionen Infizierte, Hunderttausende an Covid-19 Gestorbene, überfüllte Kliniken, Verunsicherung der Menschen, Schulschließungen, das Wiederaufflammen von beigelegt geglaubten Konflikten – würden einen immensen Schaden nach sich ziehen, wenn wir jetzt nicht handeln.\n\n({1})\n\nEines sage ich hier voraus: In dieser Situation steht auch unsere Glaubwürdigkeit auf dem Spiel. Wenn wir die Länder des Globalen Südens jetzt im Stich lassen, dann fällt uns das irgendwann gewaltig auf die Füße.\n\nHerr Dr. Müller, ich sehe, Sie nehmen auch an der Debatte teil. Ja, das BMZ hat viel getan, aber wir bekommen die Pandemie global nicht in den Griff, wenn wir business as usual machen.\n\n({2})\n\nIn Deutschland, in Europa haben wir seit nunmehr einem Jahr auf die Herausforderungen, die das Virus an uns stellt, mit Ausnahmebeschlüssen reagiert, mit Ausnahmebeschlüssen zum Schutz unserer Bevölkerung und mit sehr viel Geld – dreistelligen Millionenbeträgen! – zur Unterstützung unserer Wirtschaft. Wir müssen jetzt den nächsten Schritt tun und Ausnahmebeschlüsse zum Schutz der vulnerablen Menschen weltweit fassen.\n\n({3})\n\nDass wir jetzt im Haushalt 1,5 Milliarden Euro für die globale Covid-19-Kampagne freigegeben haben, ist ein wichtiger erster Schritt. Doch zur Wahrheit gehört auch: Die Kampagne ist trotz der Zusagen aus Amerika, Großbritannien und der EU weiterhin extrem unterfinanziert. Von Anfang an hätten alle Staaten, EU und Deutschland inklusive, den Einkauf von Impfstoffen über die dafür vorgesehene Covax-Initiative der WHO steuern müssen. Das wäre der richtige, multilaterale Weg gewesen, auch um günstigere Preise für alle Länder verhandeln zu können und Transparenz zu gewährleisten.\n\n({4})\n\nStattdessen haben viele Länder, auch die Bundesregierung, bilaterale Abkommen mit Impfstoffherstellern getroffen, bevor Covax hierzu die Möglichkeit hatte; der Markt ist für Covax so gut wie leergekauft. Niedriglohnländer waren nun auch gezwungen, ihrerseits bilaterale Verhandlungen einzugehen – mit fatalen Folgen. Medienberichten zufolge bekommen diese Länder Zusagen nämlich nur zu exorbitant höheren Preisen als wir.\n\nSeit zwei Monaten impfen wir bereits. Aber Covax hat erst gestern mit der Auslieferung von Impfstoffen starten können. Bei uns überschüssige Impfdosen müssen wir Covax zur Verfügung stellen. Es muss unter uns doch Einigkeit darüber herrschen, dass auch in anderen Ländern weltweit das Gesundheitspersonal und Menschen mit dem höchsten Risiko zuerst und schnell geimpft werden müssen.\n\n({5})\n\nDas wäre eine faire und ethisch erforderliche globale Verteilung der Impfstoffe.\n\nWenn wir die globalen Ziele der Weltgesundheitsorganisation nicht erreichen, müssen wir natürlich auch über Fragen der Lizenzen und des Patentschutzes reden. Südafrika und Indien haben in der Welthandelsorganisation bereits einen Vorstoß gemacht. Liebe Bundesregierung, machen Sie sich zum Anwalt dieser Länder! Sagen Sie nicht einfach: „Nein, das geht nicht“ und „Das machen wir nicht“. Sagen Sie uns, wie es geht!\n\n({6})\n\nGleichwohl wissen wir auch, dass das allein nicht ausreicht. Der Unterstützungsbedarf geht darüber weit hinaus. Wenn es um die Ausweitung von weltweiten Produktionskapazitäten geht, dann braucht es viele weitere Maßnahmen. Dann geht es um einen Know-how-Transfer. Es braucht eine funktionierende Zulieferindustrie, Transport und Lagerung. Um den Impfstoff effektiv verimpfen zu können, braucht es neben der gerechten Verteilung über Covax auch Aufklärung, geschultes Personal, Impfzentren usw.\n\nNatürlich brauchen die ärmeren Länder auch Unterstützung bei der Bereitstellung von Tests, Diagnostika und – ganz wichtig – Behandlungsmöglichkeiten für Covid-19-Patienten. Auch wenn das Impfen verständlicherweise derzeit im Mittelpunkt steht: Prävention, Diagnose, Behandlung und starke Gesundheitssysteme in allen Ländern sind wichtige Bestandteile der Bekämpfung dieser Pandemie.\n\n({7})\n\nWir haben uns in der Fraktion sehr viele Gedanken über die Machbarkeit unserer Forderungen gemacht. Herr Dr. Müller, Sie haben eine gute Handreichung dessen, was Sie jetzt tun können und müssen. Ich bin davon überzeugt, dass wir das mit einer gemeinsamen Anstrengung aller Staaten, insbesondere der Industriestaaten, hinbekommen. Das wäre nicht nur in unserem ureigenen Interesse. Es wäre auch ein Akt der globalen Solidarität – etwas, das wir uns, wie ich eingangs sagte, mit viel Mühe über die Jahrzehnte aufgebaut haben und das wir unter keinen Umständen aus den Händen geben dürfen.\n\nDanke schön.\n\n({8})"
"1055633","Ulle","Schauws","Grüne","Member of Parliament","2021-02-25T00:00:00.000Z","https://dip21.bundestag.de/dip21/btp/19/19212.pdf","\n\nHerr Präsident! Meine Damen und Herren! Frauen dürfen mitmachen, aber nur ein bisschen. – Das ist die Botschaft, die von Ihrem Gesetzentwurf ausgeht. Und das reicht nicht. Es reicht nicht, weil Frauen führen wollen und weil sie es können.\n\n({0})\n\nEs reicht nicht, weil die Innovationsfähigkeit der deutschen Wirtschaft stockt, wenn es keinen Kulturwandel in den Führungsetagen gibt. Nach 20 Jahren freiwilliger Selbstverpflichtung der Privatwirtschaft müssen wir konstatieren: Führende Männer sind an der Aufgabe gescheitert, es ohne gesetzliche Vorgaben zu schaffen.\n\n({1})\n\nDeswegen brauchen wir eine feste Quote auch für Unternehmensvorstände. Die gläserne Decke ist nicht gut sichtbar, aber sie wirkt weiter. Sie bremst Frauen aus und potenziert ihre Wirkung, wenn weitere Diskriminierungsmerkmale wie Herkunft, Behinderung oder sexuelle Identität mit dazukommen.\n\nMeine Damen und Herren, als die Aufsichtsratsquote für eine kleine Pilotgruppe von etwas mehr als 100 Unternehmen im Jahr 2015 auf unser Drängen und durch den unermüdlichen Kampf von FidAR und anderen Frauenverbänden endlich durchgesetzt wurde, war das ein guter Anfang. Wir stellen fest: Die Quote wirkt. Die betroffenen Unternehmen haben die Quote alle eingehalten, und sie führt zu einer Professionalisierung der Arbeit in Aufsichtsräten.\n\nUnd was machen Sie damit? Warum wenden Sie diese Erkenntnis bei dem neuen Gesetz nicht an? Statt einer festen Quote für Unternehmensvorstände soll es nur eine Mindestbeteiligung geben. Noch schlimmer: Die Mindestbeteiligung gilt nur für 70 Unternehmen. In etwas mehr als der Hälfte dieser Unternehmensvorstände gibt es aber bereits mindestens eine Frau. Das heißt, es fehlen weitere 30 Frauen in Vorständen, und dann wäre Ihr neues Gesetz schon erfüllt.\n\n({2})\n\nSie machen ein Gesetz für 30 Frauen? Das ist kein Fortschritt, das ist Symbolpolitik!\n\n({3})\n\nIch sage Ihnen: Eine Frau im Vorstand reicht nicht. Sie allein kann die verkrusteten Strukturen nicht aufbrechen. Diversität braucht die kritische Masse von mindestens einem Drittel Frauen; so haben wir es in unserem Grünenantrag gefordert.\n\n({4})\n\nDas, was einige gegen die Quote einwenden, schaffen wir in Wahrheit erst mit der Quote: dass Qualität sich durchsetzt und nicht Geschlecht.\n\n({5})"
"1055635","Ulle","Schauws","Grüne","Member of Parliament","2021-02-25T00:00:00.000Z","https://dip21.bundestag.de/dip21/btp/19/19212.pdf","\n\nNein, danke schön. – Führungspositionen werden aktuell eben nicht ausschließlich nach Qualifikation vergeben. Männer werden befördert durch eine informelle Männerquote. Eine Frauenquote ändert diese Spielregel, und das schafft Gerechtigkeit.\n\n({0})\n\nLiebe Kolleginnen und Kollegen, es ist entscheidend, dass der Blick aus den Führungsetagen auf die Welt nicht nur ein männlicher ist; denn Probleme werden immer komplexer. Um sie zu lösen, brauchen wir alle guten Köpfe. Wir brauchen Frauen, Diversität und kein Weiter-so mit einem männlichen Blick.\n\nIch fordere Sie auf, aus dem ersten Schritt einen Sprung zu machen. Eine echte Quote für Vorstände ist jetzt fällig. Frauen sind längst startklar.\n\nVielen Dank.\n\n({1})"
"1055665","Canan","Bayram","Grüne","Member of Parliament","2021-02-25T00:00:00.000Z","https://dip21.bundestag.de/dip21/btp/19/19212.pdf","\n\nVielen Dank. – Liebe Frau Präsidentin! Mein Vorname Canan steht für das Wort „Liebling“, so nennen Sie mich alle, wenn Sie meinen Vornamen aussprechen. Ich kann Ihnen aber sagen, dass mich das nicht zu Everybody’s Darling macht, und das will ich auch gar nicht sein.\n\n({0})\n\nMeine Damen und Herren, was hat die AfD hier für einen Antrag vorgelegt? Man fragt sich: Worüber wollen Sie eigentlich diskutieren? – Das Thema soll das Bargeld sein. Ich weiß nicht, wer bei der AfD davon geträumt hat, dass es politische Kräfte gäbe, die das Bargeld abschaffen wollen würden, wahrscheinlich der Moruk, der in der ersten Reihe schläft. Der Albtraum der AfD ist völlig absurd.\n\n({1})\n\nHerr Gauland hat sich Sorgen gemacht, dass demnächst das Bargeld abgeschafft wird. Ich kann Ihnen sagen: Keiner will das. Für uns, Bündnis 90/Die Grünen, gilt vielmehr: Freiheit statt Angst. Dazu gehört auch die Freiheit, in seinen Bewegungsprofilen nicht überwacht zu werden. Natürlich können und sollen die Leute weiterhin mit Bargeld zahlen, meine Damen und Herren.\n\n({2})\n\nVor zwei Wochen haben wir hier einen Entschließungsantrag eingebracht, den auch Die Linke und die FDP unterstützt haben, mit dem wir Bargeldzahlungen bei Immobilienkäufen ausschließen möchten, um Geldwäsche zu verunmöglichen, weil Geldwäsche ein Verbrechen darstellt, meine Damen und Herren. Das wollen wir bekämpfen.\n\n({3})\n\nBei Verbrechen fällt mir komischerweise wieder die AfD ein. Man fragt sich: Wie werden eigentlich die Waffen bezahlt, die irgendwie mit dem Büro von Herrn Bystron verwickelt sind, mit Bargeld oder mit etwas anderem?\n\n({4})\n\nWie sind die ganzen Koffer und sonstigen unterstützenden Parteispenden bei der AfD eigentlich eingegangen? Kennen wir nur die unbaren Zahlungen? Gab es da vielleicht auch Geldkoffer?\n\nMeine Damen und Herren, für uns Grüne steht fest: Parteienfinanzierung benötigt größtmögliche Transparenz, das heißt, wir müssen klar überwachen, wohin Bargeld fließt, um zu merken, wann der Geldfluss gegen geltende Gesetze verstößt.\n\n({5})\n\nDas ist doch gar keine Frage! Da es völliger Unsinn ist, zu behaupten, dass hier irgendwer plant, das Bargeld abzuschaffen, fragt man sich insoweit schon: Wovor hat die AfD eigentlich Angst?\n\n({6})\n\n– Genau. – Sie hat Angst, dass sie selber irgendwann an ihre eigenen Fake News glaubt. Soweit ist es mit denen schon gekommen, meine Damen und Herren.\n\n({7})"
"1055689","Erhard","Grundl","Grüne","Member of Parliament","2021-02-25T00:00:00.000Z","https://dip21.bundestag.de/dip21/btp/19/19212.pdf","\n\nSehr geehrte Frau Präsidentin! Meine Damen und Herren! Wo sind die Frauen in der Kultur? Wo sind die Frauen in der Kunst? Eigentlich scheinen sie ja gut aufgestellt zu sein. In den Fächern Darstellende Kunst, Bühne, Regie, Bildende Kunst und Kunstgeschichte studiert eine deutliche Mehrheit an Frauen. Frauen im Kulturbetrieb in Deutschland sind trotzdem ungehört, ungesehen, unrezensiert und ungezeigt. Nur 22 Prozent der deutschen Theater werden von einer Frau geleitet. Nur 30 Prozent der Inszenierungen an diesen Bühnen sind von Frauen, und in mageren 14 Prozent der Produktionen des öffentlich-rechtlichen Rundfunks führen Frauen Regie. Von 130 Orchestern in Deutschland werden sage und schreibe 3 von Frauen dirigiert.\n\n({0})\n\nJa, da ist sie, meine Damen und Herren, die Quote. Es gibt sie nämlich schon. Es ist eine Männerquote.\n\n({1})\n\nDie Kunst ist frei, vorausgesetzt sie ist männlich. Und die Frauen, die es trotz der Brother Culture, der Seilschaften und der permanenten Unterschätzung geschafft haben, sind dann auch noch unterbezahlt. Der durchschnittliche Gender Pay Gap in der Kultur liegt bei 24 Prozent – Tendenz steigend in allen Branchen, so die Studie des Kulturrats 2020. Das ist kein Gap, das ist ein Abgrund.\n\n({2})\n\nWas macht die Bundesregierung, die diese trostlosen Zahlen mit zu verantworten hat? Seit Jahren liegen diese Zahlen vor, und sie machen dazu einen runden Tisch und ein Mentoringprogramm. In vier Jahren bei 800 Bewerbungen wurden 97 Frauen betreut. Ich denke, das ist mehr als mager.\n\n({3})\n\nDabei sind sich Wissenschaft und Sachverständige einig: Nur die Quote kann das wirklich verändern. Was schlagen CDU/CSU und die SPD jetzt in ihrem Antrag vor? Mehr vom Gleichen, mehr von dem, was nichts bewirkt, hier und da mal ein bisschen Förderung und einen Frauentrostpreis. Meine Damen und Herren, wir brauchen eine Quote für Parität auf den Führungsebenen staatlicher Häuser, in der Projektförderung, bei Ausstellungen, in Filmen der Öffentlich-Rechtlichen, überall, wo die Kultur von Steuergeldern, also zur Hälfte von Frauen, finanziert wird, eine Quote für eine geschlechtergerechte Kulturbranche und echte Chancengleichheit in Kultur und Medien.\n\n({4})\n\nNur da, wo es gerechte Chancen auf Teilhabe und Zugang gibt, existiert Kunstfreiheit. Wer in Sonntagsreden die Freiheit der Kunst betont, der muss erst mal für Chancengleichheit sorgen.\n\n({5})\n\nDa haben Sie, meine Damen und Herren von CDU und CSU, aber leider auch von der SPD, Nachholbedarf. Um Margarete Stokowski zu zitieren:\n\nMan muss nicht für die Quote sein, man kann auch einfach warten und sterben, bevor es Gleichberechtigung gibt.\n\n({6})\n\nIch bin überzeugt, wir sind es all den großartigen Frauen im Kulturbereich schuldig, uns für diese Chancengleichheit, für diese Quote einzusetzen. Aber noch mehr sind wir es all den Frauen schuldig, die wir noch nicht kennen, die daran gehindert werden, sichtbar zu werden, weil sie das vermeintlich falsche Geschlecht haben.\n\n({7})\n\nIhnen die gleichen Chancen zu geben, wie wir Männer sie haben, darauf freue ich mich, und dafür setzen wir uns ein. Ich möchte Sie alle bitten, unseren Antrag unterstützen.\n\nVielen Dank.\n\n({8})"
"1055705","Ingrid","Nestle","Grüne","Member of Parliament","2021-02-25T00:00:00.000Z","https://dip21.bundestag.de/dip21/btp/19/19212.pdf","\n\nSehr geehrte Frau Präsidentin! Liebe Kolleginnen und Kollegen! Im Grundsatz ist das Anliegen dieses heute zu beratenden Gesetzes absolut zu begrüßen. Ja, natürlich müssen die Planungen weitergehen, auch zu Coronazeiten.\n\nUnd ja, natürlich bieten diese digitalen Beteiligungsformate für manche Menschen auch eine richtige Chance; denken wir nur an Eltern, die für die Betreuung ihrer Kinder verantwortlich sind. Natürlich ist es da einfacher, zwischendurch einmal zwei Stunden vom eigenen Arbeitszimmer aus ins Internet zu gehen, als an einen anderen Ort zu fahren und da womöglich den ganzen Tag zu verbringen. Denken wir an Leute, die sich vielleicht ein bisschen scheuen, im großen Saal aufzustehen und ins Mikro zu sprechen. Es gibt eine ganze Reihe Menschen, für die diese digitalen Beteiligungsformate ein Mehr an Beteiligung bedeuten. Deswegen sollten wir sie auch weiterentwickeln und auf Dauer zusätzlich zu Präsenzformaten beibehalten.\n\n({0})\n\nTrotzdem wird der heute vorliegende Gesetzentwurf, finde ich, der Bedeutung des Themas nicht wirklich gerecht. Das liegt in erster Linie daran, dass Sie sich überhaupt nicht die Mühe gemacht haben, einmal die Erfahrungen auszuwerten, die wir bisher mit diesem Gesetz gemacht haben. Ja, vor einem Jahr, da mussten Sie schnell reagieren. Als Sie im Frühjahr letzten Jahres das Gesetz auf den Weg gebracht haben und Corona neu war, da mussten Sie schnell etwas machen; das war völlig in Ordnung. Aber jetzt müssten Sie doch weiter sein.\n\nKollege Özdemir, wenn Sie hier stolz sagen, ja, wir haben seit damals nichts geändert, dann, so finde ich, ist das nicht unbedingt ein Qualitätsmerkmal; denn es ist Ihre Verantwortung,\n\n({1})\n\nes ist Ihre Pflicht, auszuwerten: Was haben wir denn aus der Zeit gelernt?\n\nIch habe die Bundesregierung einmal gefragt: Was haben Sie denn evaluiert? Wie oft sind eigentlich die verschiedenen Veranstaltungstypen gewählt worden? – Die Antwort war: Der Bundesregierung liegen keine Informationen vor, und – Zitat –: Im Gesetzgebungsverfahren ist jedoch eine Evaluierung des PlanSiG durch die Bundesregierung vorgesehen worden. – Sie stellen also fest, es soll evaluiert werden. Aber offensichtlich evaluieren Sie, nachdem Sie das Gesetz verlängern, nicht vorher. Gelinde gesagt, ist das der falsche Zeitpunkt.\n\n({2})\n\nSie verlängern auch nicht nur so ein bisschen. Nein, Sie verlängern gleich bis Ende 2022, nicht bis zum Anfang 2022. Erst dachte ich auch so, Anfang nächsten Jahres, passt ja; nein, bis Ende nächsten Jahres sehen Sie jetzt schon vorher, dass keine größeren öffentlichen Veranstaltungen stattfinden können. Ich finde, das ist deutlich zu lange, vor allem wenn keine Evaluierung stattgefunden hat.\n\n({3})\n\nEs wäre auch leicht gewesen, Punkte zu finden, wo man nachbessern kann. Nicht nur am Montag in der Anhörung wurde deutlich: Ja, die Videokonferenz, also das Format, wo man ins Gespräch kommt, das den Erörterungstermin am besten ersetzen kann, wird nur sehr selten angewendet, weil man vorher von jedem Einzelnen eine Einverständniserklärung einholen muss, um dieses Format überhaupt wählen zu dürfen. Das ist nur einer der Punkte, wo man tatsächlich unproblematisch und schnell Verbesserungen für mehr Beteiligung und eine bessere Qualität hinbekommen könnte.\n\nIch wünsche mir sehr, dass es für die Zukunft wenigstens gelingt, die Erfahrungen noch auszuwerten, die Formate weiter zu verbessern, weil sie so wichtig sind. Leider können wir in dieser Form noch nicht zustimmen.\n\nDanke schön.\n\n({4})"
"1055727","Canan","Bayram","Grüne","Member of Parliament","2021-02-25T00:00:00.000Z","https://dip21.bundestag.de/dip21/btp/19/19212.pdf","\n\nSehr geehrte Frau Präsidentin! Liebe Kolleginnen und Kollegen! Wohnen ist ein Menschenrecht. Keiner kann sich aussuchen, ob er wohnen will oder nicht. Wir alle brauchen ein Dach über dem Kopf.\n\nGerade in der Pandemie ist es umso wichtiger, dass wir nicht nur darüber nachdenken, ob die Menschen Schutz und Sicherheit vor Kälte und anderem haben, sondern dass wir auch, wenn wir „Stay at home“ sagen – wer zu Hause bleibt, steckt andere nicht an –, denen, die keine Wohnung haben, erst mal ein Home besorgen.\n\n({0})\n\nDas heißt, eigentlich dürfte es Wohnungs- und Obdachlose in der Pandemie gar nicht geben.\n\n({1})\n\nDass wir uns hier heute wieder darüber austauschen müssen, wo es überall fehlt, liegt daran, dass – das sollten wir als Deutscher Bundestag doch vielleicht mal gemeinsam feststellen – die Kommunen und die Länder es nicht alleine schaffen,\n\n({2})\n\njetzt in der Pandemie all die Menschen unterzubringen. Und da hilft es auch nicht, dass die FDP hier hineinruft.\n\n({3})\n\nZum einen haben Sie eine Maske und kein Mikro, sodass man Sie überhaupt nicht hört, und zum anderen haben Sie auch noch unrecht.\n\n({4})\n\nEs kann doch nicht sein, dass Sie von der FDP in der Pandemie immer noch die Immobilienlobby verteidigen wollen.\n\n({5})\n\nHaben Sie denn überhaupt kein Herz? Haben Sie da, wo bei anderen das Herz schlägt, ein Portemonnaie? Ich weiß es nicht.\n\n({6})\n\nEs geht wirklich darum – da appelliere ich an uns alle –, dass wir uns darüber einig sein sollten, das nicht auf die Kommunen – auf die Senatorin in Berlin oder sonst wen – zu schieben,\n\n({7})\n\nund wir sollten uns hier darüber verständigen, dass der Bund nach dem Infektionsschutzgesetz eine Verantwortung dafür hat, die Wohnungslosen unterzubringen. Da sollten wir vielleicht mal reinschreiben: Infektionsschutz heißt, die Menschen von der Straße zu kriegen. – Dann können sie weder infiziert werden noch andere infizieren.\n\n({8})\n\nWohnen ist ein Menschenrecht. Aktuell haben wir die Situation, dass viele Menschen bedroht sind. Das müssen wir uns mal vorstellen: Einerseits sind wir darauf angewiesen, dass die Menschen zu Hause bleiben, um sich nicht anzustecken; andererseits muss die Polizei in Häuser rein, um Wohnungen zu räumen. Wie absurd ist das denn!\n\n({9})\n\nDas könnten wir hier im Bundestag sofort ändern, und da müssen Sie von der FDP auch nicht rumheulen. Sie müssen dem Antrag der Linken gar nicht zustimmen; Sie könnten mal einen eigenen Antrag schreiben.\n\n({10})\n\n- „Respekt vor Eigentum“ habe ich mehr, als die AfD Respekt vor irgendwas hat, liebe Kolleginnen und Kollegen, und dazu gehört auch: Der Respekt vor Eigentum geht nicht vor Menschenleben und Schutz von Leben und körperlicher Unversehrtheit. – Dass das bei Ihnen in der AfD keine Rolle spielt, wundert mich jetzt hier auch nicht.\n\n({11})\n\n– Ja, rufen Sie doch weiter rein; dann rede ich weiter."
"1055729","Canan","Bayram","Grüne","Member of Parliament","2021-02-25T00:00:00.000Z","https://dip21.bundestag.de/dip21/btp/19/19212.pdf","\n\nWir wollen die Menschen aus der Obdachlosigkeit heraus in Wohnungen, in Hostels oder in sonst was bringen, und dafür, meine lieben Kolleginnen und Kollegen, ist hier jeder verantwortlich.\n\n({0})"
"1055737","Canan","Bayram","Grüne","Member of Parliament","2021-02-25T00:00:00.000Z","https://dip21.bundestag.de/dip21/btp/19/19212.pdf","\n\nSehr geehrte Frau Präsidentin! Der Kollege hat mich angesprochen und mir erklärt, dass die Union 2018 irgendwas zum Thema Obdachlosigkeit gemacht haben will. Da wollte ich ihn fragen, ob er mitbekommen hat, dass wir eine Pandemie haben und ob er erkennt, dass die Tatsache, dass Menschen keine Wohnung haben, dass sie obdachlos, wohnungslos sind, dazu führen kann, dass sie sich schneller und leichter mit Corona anstecken und dass sie, wenn sie angesteckt sind und auf der Straße sind, wiederum andere Menschen anstecken können. Deswegen wäre es infektionsschutzrechtlich relevant, diese Menschen entsprechend unterzubringen – ob in Hostels, in Wohnungen, in was auch immer –, damit wir den Infektionsschutz gewährleisten können. Die Verantwortung von uns allen ist, das mitzudenken. Das habe ich in meiner Rede angesprochen, und Sie kommen da in Ihrer Rede irgendwie mit 2018.\n\nDie Geltungsdauer des Kündigungsschutzes – das haben Sie auch falsch wiedergegeben – haben Sie kein einziges Mal verlängert. Das Moratorium wurde einmal entschieden und nicht verlängert. Sie reden irgendwas von Verlängerung.\n\n({0})\n\n– Die SPD ruft hier rein: Wir wollten verlängern, die CDU wollte es nicht.\n\n({1})\n\nIch denke, wann man da vorne eine Rede hält, dann sollte die inhaltlich nicht falsch sein.\n\n({2})\n\n– Herr Hoffmann, man hört Sie nicht. Sie haben eine Maske auf. Sie haben kein Mikro.\n\n({3})\n\nIch sage Ihnen auch: Ehrlich gesagt, wenn Sie zur Unterbringung und zum Schutz der wohnungs- und obdachlosen Menschen vor Corona eine Idee hätten, dann bräuchten Sie meinen Fraktionsvorsitzenden Toni Hofreiter auch nicht falsch zu zitieren. Wie ahnungslos, wie erbärmlich, ideenlos ist eigentlich Ihre Wohnungspolitik!\n\n({4})"
