id,firstname,lastname,faction,position,date, url,speech
"1064969","Katrin","Uhlig","Grüne","Member of Parliament","2022-01-12T00:00:00.000Z","https://dip21.bundestag.de/dip21/btp/20/20010.pdf","\n\nVielen Dank. – Welche Bedeutung hat denn für Sie der Ausbau der erneuerbaren Energien in Bezug auf den Wirtschafts- und Industriestandort Deutschland?"
"1065102","Helge","Limburg","Grüne","Member of Parliament","2022-01-12T00:00:00.000Z","https://dip21.bundestag.de/dip21/btp/20/20010.pdf","\n\nVielen Dank. – Frau Präsidentin! Meine Damen und Herren! Herr Abgeordneter Seitz, der einzige Beitrag zur Rechtspolitik, den ich in Ihrer Rede erkannt habe, war der, dass Sie eine Parallele aufgezeigt haben zwischen einem Gerichtssaal und dem Plenarsaal, nämlich die, dass jede noch so abseitige Meinung irgendwie vorgetragen werden darf, aber gleichzeitig diejenigen, die versuchen, mangelnde inhaltliche Substanz durch Lautstärke und Frechheit zu ersetzen, am Ende eben nicht recht bekommen.\n\n({0})\n\nFrau Präsidentin, liebe Kolleginnen und Kollegen, zu den Dingen, die unser solidarisches Zusammenleben sichern – der Justizminister hat es gleich eingangs gesagt –, gehört natürlich auch das Recht. Es gehört zum Fundament unserer freiheitlichen Demokratie. Eine Demokratie ohne Rechtsstaat ist wenig wert. Beides gehört zusammen.\n\nIn öffentlichen Debatten ist immer wieder einmal von der vollen Härte des Rechtsstaates die Rede. Die ist sicherlich auch manchmal notwendig. Aber der Begriff des Rechtsstaates entstand ursprünglich in Abgrenzung zu absoluten Monarchien und ähnlichen Regierungsformen. Das Recht begrenzt gerade die Macht des Staates, in die Rechte der Bürgerinnen und Bürger einzugreifen.\n\nDeshalb wird es auch ein Zeichen der Stärke des Rechtsstaates sein, wenn diese Ampelkoalition endlich die vom Bundesverfassungsgericht angemahnte Überwachungsgesamtrechnung vornehmen wird; der Justizminister, Kollege Emmerich und andere haben es schon angesprochen. Die zahlreichen Eingriffe, die die Sicherheitsgesetze in den vergangenen Jahren ermöglicht haben, werden dann endlich auf das unbedingt erforderliche Maß begrenzt werden,\n\n({1})\n\nund die anlasslose Vorratsdatenspeicherung, Frau Lindholz, wird dann nicht nur formalrechtlich, sondern auch tatsächlich der Vergangenheit angehören und durch grundrechtsschonende Verfahren wie Quick Freeze ersetzt werden.\n\n({2})\n\nLiebe Kolleginnen und Kollegen, es stärkt auch den Rechtsstaat, wenn wir das Strafrecht von Ballast befreien und auf seinen Kern begrenzen. Im Strafrecht stehen in der Regel der Täter und die Tat im Mittelpunkt. Trotz Verbesserungen in den letzten Jahren gibt es aber vor allem im Bereich der Unterstützung der Opfer weiterhin Verbesserungsbedarf. Diese Ampelkoalition wird Lücken im Opferentschädigungsrecht endlich schließen. An dieser Stelle möchte ich gerne dem Kollegen Pascal Kober ganz herzlich zu seiner neuen Aufgabe als Beauftragter für Opferschutz gratulieren. Ich wünsche Ihnen eine gute Hand, Herr Kollege!\n\n({3})\n\nBesonders schlimm ist es – das haben Sie zu Recht angesprochen –, wenn Kinder Opfer von Straftaten werden. Diese Koalition wird den Kampf gegen Kindesmissbrauch verstärken durch Verfahren wie Quick Freeze, durch eine verbesserte Zusammenarbeit der Behörden und vor allem auch dadurch, dass wir sicherstellen werden, dass die Justiz an allen Stellen kindgerecht und sensibel agiert, liebe Kolleginnen und Kollegen.\n\n({4})\n\nFrau Präsidentin, meine Damen und Herren, „Schuld, die nicht vergeht“ lautet der Titel des lesenswerten Buches von Kurt Schrimm, dem früheren Leiter der Zentralen Stelle zur Verfolgung von NS-Verbrechen. Weil diese Schuld nie vergeht – es laufen noch NS-Verfahren –, werden wir im Einvernehmen mit allen Landesjustizministerinnen und ‑ministern die Zentrale Stelle zu einer Dokumentationsstelle umwandeln.\n\nDie AfD und ihr Umfeld haben ausdrücklich erklärt, auf die Wehrmacht stolz sein zu wollen. Wir – da weiß ich die Union und Die Linke mit eingeschlossen – sind stolz auf die Arbeit der Juristinnen und Juristen, die es sich seit über 70 Jahren zur Aufgabe gemacht haben, die NS-Verbrechen juristisch zu ahnden, Verbrecher zur Rechenschaft zu ziehen. Auf diese Juristen wollen wir stolz sein, liebe Kolleginnen und Kollegen.\n\n({5})\n\nDas Recht als Fundament unserer freiheitlichen Demokratie ist jedoch ebenso wenig statisch, wie es unsere Gesellschaft ist. Dort, wo Gesetze und Verordnungen nicht mehr angemessen sind, nicht mehr den Realitäten des menschlichen Zusammenlebens entsprechen, liebe Kollegin Lindholz, müssen wir sie anpassen. Das gilt, auch wenn Sie es nicht wahrhaben wollen, insbesondere im Familienrecht.\n\n({6})\n\nEs hat in den letzten Jahren bereits bedeutende Änderungen gegeben, Frau Lindholz, etwa die Einführung der Ehe für alle – also für alle, die wollen, natürlich –,\n\n({7})\n\naber wichtige Dinge sind leider liegen geblieben, die diese Ampelkoalition nun entschlossen angehen wird.\n\nDa ist in der Tat die Verantwortungsgemeinschaft. Es ist doch letztlich im Interesse von uns allen, im Interesse der Gesellschaft, wenn Menschen erklären: Wir wollen füreinander einstehen, wir wollen Verantwortung füreinander übernehmen,\n\n({8})\n\nund wir wollen das auch rechtlich festlegen.\n\n({9})\n\nEs ist doch im Interesse der Gesellschaft und stärkt Familien auch und gerade im Sinne des Grundgesetzes, wenn wir auch Patchworkfamilien rechtlich besser absichern, rechtlich besserstellen.\n\n({10})\n\nDas Beste ist doch: All das nimmt wirklich niemandem etwas. Herr Buschmann, ich bin Ihnen dankbar, dass Sie das betont haben. Frau Lindholz, wovor haben Sie denn eigentlich Angst?\n\n({11})\n\nSie haben in Ihren Ausführungen nicht an einer Stelle darlegen können, wem eigentlich Schaden dadurch zugefügt werden könnte, dass wir als Fortschrittskoalition die Möglichkeiten im Familienrecht erweitern wollen.\n\nWir werden ebenfalls das Abstammungsrecht reformieren. Was für die rechtliche Vaterschaft gilt, muss auch für die rechtliche Mutterschaft gelten. Wer bei Geburt verheiratet ist, der muss rechtlich als Eltern gelten. Sie wissen, dass dazu ein Verfahren vor dem Bundesverfassungsgericht liegt. Gute Rechtspolitik wartet nicht immer auf Karlsruhe, wie es in der Vergangenheit viel zu oft der Fall war. Gute Rechtspolitik handelt!\n\n({12})\n\nFrau Präsidentin, liebe Kolleginnen und Kollegen, unser Rechtsstaat ist keine rein nationale Angelegenheit. Deshalb ist es ein zentrales Anliegen der Koalition, die europäische Zusammenarbeit im justiziellen Bereich zu stärken sowie Eurojust und die Europäische Staatsanwaltschaft stärker zu unterstützen. Wir wollen den Whistleblower-Schutz – eine EU-Richtlinie, die eigentlich Sie schon hätten umgesetzt haben müssen – endlich in deutsches Recht umsetzen. Wir werden den kollektiven Rechtsschutz ausbauen. Menschen müssen sich leichter als bislang zusammenschließen können, um gemeinsam ihre individuellen Rechte geltend zu machen.\n\n({13})\n\nLiebe Kolleginnen und Kollegen, „Alles auf Neustart – Rechtspolitik in der 20. Legislaturperiode“ war gestern der Titel einer Veranstaltung beim Deutschen Anwaltsverein, wo auch viele von uns waren. Ich finde, er ist sehr passend für die Vorhaben in der Rechtspolitik. Wie Sie sehen, gibt es in diesem Bereich sehr viel zu tun. Ich freue mich auf die Debatten im Rechtsausschuss und auf die rechtspolitischen Debatten hier im Plenum.\n\nVielen Dank.\n\n({14})"
"1064966","Katrin","Uhlig","Grüne","Member of Parliament","2022-01-12T00:00:00.000Z","https://dip21.bundestag.de/dip21/btp/20/20010.pdf","\n\nVielen Dank, Frau Präsidentin. – Herr Bundeskanzler, Sie haben die Klimakrise und den Ausbau der erneuerbaren Energien gerade schon angesprochen. Minister Habeck hat gestern die aktuelle Klimabilanz vorgestellt. Das Ergebnis war für mich, dass wir dringend ambitionierte Maßnahmen umsetzen müssen, um die Klimaziele einhalten zu können. Deshalb wäre meine Frage: Welchen Stellenwert hat der schnellere Ausbau der erneuerbaren Energien in dieser Legislaturperiode für Sie und die Regierung?\n\n({0})"
"1065003","Wolfgang","Strengmann-Kuhn","Grüne","Member of Parliament","2022-01-12T00:00:00.000Z","https://dip21.bundestag.de/dip21/btp/20/20010.pdf","\n\nFrau Präsidentin! Sehr geehrter Herr Bundeskanzler! Der Wirtschafts- und Klimaminister hat gestern in einer Pressekonferenz deutlich gemacht, was alles an Veränderungen notwendig ist, um die notwendigen Klimaziele zu erreichen. Gleichzeitig haben wir mit der Digitalisierung, der demografischen Entwicklung weitere sogenannte Megatrends – um nur die wichtigsten zu nennen.\n\nFür all diese Prozesse ist Weiterbildung ein ganz zentraler Faktor. Deswegen hat das für uns Grüne eine ganz zentrale Priorität; denn wir brauchen für die sozial-ökologische Transformation eine regelrechte Weiterbildungsrepublik. Dabei wird die Bundesagentur für Arbeit eine ganz wichtige Rolle spielen. Deswegen würde mich interessieren, welche Priorität Sie als Bundeskanzler dem Thema Weiterbildung beimessen. Insbesondere würde mich interessieren, ob und wann wir Veränderungen bei der Arbeitslosenversicherung oder beim SGB III insgesamt sehen werden. Maßnahmen wie das Weiterbildungsgeld wären ja schon relativ zeitnah umsetzbar.\n\n({0})"
"1065006","Wolfgang","Strengmann-Kuhn","Grüne","Member of Parliament","2022-01-12T00:00:00.000Z","https://dip21.bundestag.de/dip21/btp/20/20010.pdf","\n\nVielen Dank für Ihre Antwort. – Ich würde gern konkret nachfragen: Heißt das, das wird prioritär von der Bundesregierung angegangen und man könnte mit Veränderungen auch schon in diesem Jahr rechnen? Und bezieht das auch das sogenannte SGB II, also das Arbeitslosengeld II oder demnächst Bürgergeld, mit ein? Dort ist ja auch ein Weiterbildungsgeld geplant."
"1065048","Lamya","Kaddor","Grüne","Member of Parliament","2022-01-12T00:00:00.000Z","https://dip21.bundestag.de/dip21/btp/20/20010.pdf","\n\nVielen Dank. – Sehr geehrte Frau Präsidentin! Sehr geehrte Damen und Herren! Liebe Kolleginnen und Kollegen! Ich freue mich – ich bin auch ein wenig nervös –, heute erstmals vor diesem Hohen Haus, dem Deutschen Bundestag, reden zu dürfen. Mein Weg war nicht immer frei von Steinen. Sicherlich bin ich kampferprobt, wenn es um den Einsatz gegen jede Form von Menschenfeindlichkeit und für eine starke, vielfältige Gesellschaft geht. Dafür werde ich mich immer einsetzen.\n\nIch stehe hier als Deutsche und als Tochter syrischer Einwanderer, deren Eltern es nie für möglich gehalten hätten, ihr Kind an dieser Stelle sprechen zu hören. Das, was für viele von Ihnen, geschätzte Kolleginnen und Kollegen, vielleicht selbstverständlich ist, nämlich aus der Perspektive einer Mehrheit zu sprechen und Ihren eigenen Platz in dieser Gesellschaft einzunehmen, stellt sich für mich als etwas größere Herausforderung dar. Ich musste wie viele andere hier im Saal diesen Platz in dieser Gesellschaft erst einmal finden. Und ich muss ihn bis heute übrigens regelmäßig verteidigen – gegen Menschenfeinde und Demokratiehasser. Doch das Ergebnis ist offensichtlich: Mein Platz ist nun hier.\n\n({0})\n\nSehr geehrte Frau Präsidentin, sehr geehrte Kolleginnen und Kollegen, die Zahl der neu gemeldeten Covid-19-Fälle in Europa hat sich Angaben zufolge innerhalb von zwei Wochen mehr als verdoppelt. Wie in einem Brennglas zeigt uns das Virus, zeigt uns diese Pandemie die gesellschaftlichen Herausforderungen und stellt uns vor eine Zerreißprobe. Wir Grüne sind als Teil der Regierungsfraktionen angetreten, diese gesellschaftlichen Herausforderungen endlich anzugehen, und die Aufgaben, die vor uns liegen, sind gewaltig.\n\nEs ist festzuhalten: Unsere Demokratie ist stark und lebendig. Die Demokratinnen und Demokraten in diesem Land sind weit mehr als die Nichtdemokratinnen und ‑demokraten. Liebe Kolleginnen und Kollegen, es ist unser aller Verpflichtung, unsere Verfassung zu hüten und uns deutlich gegen Menschenfeinde jeglicher Couleur zu positionieren.\n\n({1})\n\nDenn gleichzeitig wird unsere Demokratie bedroht. Sie steht aus unterschiedlichen ideologischen Richtungen unter Beschuss, ganz besonders von rechten Netzwerken oder Bewegungen wie den Identitären und nicht zuletzt von Querdenkern. Wenn aber die organisatorischen Strukturen hinter einer Vielzahl von unangemeldeten Demonstrationen, verbrämt als angebliche Spaziergänge, von rechten Netzwerken betrieben werden, vor allen Dingen über Telegram, und wenn in diesen Chats seit Mitte November mehr als 250 Tötungsaufrufe gefunden werden, die sich gegen Politiker/-innen, Wissenschaftler/-innen, Ärztinnen und Ärzte, Journalistinnen und Journalisten wenden, dann gefährdet das die innere Sicherheit und die Unversehrtheit von Menschen in diesem Land, dann müssen wir durch diese Unterwanderung sogenannter Spaziergänger durch rechtsextreme Netzwerke davon ausgehen, dass es zu schweren staatsgefährdenden Taten kommen kann.\n\nDamit ich hier aber nicht falsch verstanden werde: Menschen, die sich gegen die Impfpflicht oder gegen die Coronamaßnahmen aussprechen wollen, sollen das unbedingt tun dürfen. Die Verantwortung aber, mit wem man – und nicht nur sinnbildlich – untergehakt auf Demos mitläuft, trägt jede Einzelne, jeder Einzelne selbst.\n\n({2})\n\nFrau Präsidentin, meine Damen und Herren, Freiheit und Sicherheit sind fundamentale Werte, für die diese Koalition gleichermaßen einsteht. Sicherheitsbehörden schützen den Rechtsstaat. Aber der Staat muss auch seine Bediensteten schützen, und das gilt gerade auch für die Polizistinnen und Polizisten, die bei den mehr als 1 000 Protestaktionen gegen staatliche Maßnahmen zur Bekämpfung der Coronapandemie am Montag insgesamt verletzt wurden. Ich möchte den Verletzten in den Reihen der Polizei von hier aus gute Besserung wünschen und mich für ihren Einsatz bedanken.\n\n({3})\n\nAber Dank allein reicht nicht aus. Daher haben wir im Koalitionsvertrag vereinbart, dass die Polizei besser ausgestattet wird. Das ist längst überfällig und wurde von der Vorgängerregierung vernachlässigt. Das gehen wir jetzt an, und – liebe Frau Bundesinnenministerin Faeser, da bin ich zuversichtlich – es wird uns gelingen. Wenn sich Sicherheitsbehörden einer zunehmenden Gewaltbereitschaft ausgesetzt sehen, ist es unsere Aufgabe, sie zum Wohle aller zu stärken. Aber auch in den Reihen der Sicherheitsbehörden gibt es verfassungsfeindliche Tendenzen, die wir mit aller Härte angehen werden.\n\nAls Wissenschaftlerin, die sich auch mit dem Thema „islamistischer Terrorismus“ befasst, muss ich darüber hinaus feststellen: Ohne Nachrichtendienste wäre eine Bekämpfung undenkbar. Aber die parlamentarische Kontrolle der Nachrichtendienste muss besser werden. Wir schaffen deshalb eine überfällige gesetzliche Regelung für den Einsatz von V‑Personen aller Sicherheitsbehörden.\n\n({4})\n\nEs braucht auch eine Gesamtstrategie, die auf Prävention, Deradikalisierung und effektiver Gefahrenabwehr basiert, und zwar genauso auf den rechten Terror wie in Kassel oder in Hanau bezogen wie auf den islamistischen Terror am Breitscheidplatz.\n\nWas wir aber auch endlich brauchen, ist eine staatliche Etikette im Umgang mit Opfern von Gewalt und nationalen Katastrophen. Diese Menschen fühlen sich von uns alleingelassen – und das viel zu lange schon. Daher führen wir für den 11. März einen nationalen Gedenktag für die Opfer terroristischer Gewalt ein.\n\nAls innenpolitische Sprecherin bin ich auch für Religionspolitik zuständig. Ich bin froh, in einem Land zu leben, das so vielen Religionen eine Heimat ist. Es ist unsere historische Verantwortung, dabei sicherzustellen, dass sich gerade Jüdinnen und Juden in Deutschland sicher fühlen können. Gegen alle Formen von Antisemitismus werden wir jüdische Einrichtungen stärker beschützen – und auch Jüdinnen und Juden persönlich. Antisemitischem Hass und antisemitischer Hetze im Netz treten wir entschiedener entgegen. Dass Coronaverharmloser oder gar ‑leugner Vergleiche mit dem Leid der Opfer des NS-Regimes ziehen, dürfen wir nicht länger hinnehmen.\n\nUnd – viele werden es gar nicht wissen – der Islam gehört schon ganz lange zu Deutschland, und zwar seit dem 18. Jahrhundert. Es ist daher überfällig, dass wir Ausbildungsprogramme für Imaminnen und Imame an deutschen Universitäten ausbauen. Auch das packen wir jetzt an. Und hierbei – das liegt mir sehr am Herzen – werden wir den Dialog mit progressiven islamischen Gemeinden intensivieren und diese in die Prozesse einbinden.\n\n({5})\n\nEs ist nicht hinnehmbar, wenn, wie an Silvester in Iserlohn, Gräber geschändet werden, egal ob diese muslimisch, jüdisch, christlich oder buddhistisch sind.\n\nWir als Koalition stehen für Aufbruch und Wandel. Lassen Sie uns diesen Aufbruch und Wandel gemeinsam mit Ihnen, liebe Kolleginnen und Kollegen der Opposition, für ein besseres Land und eine bessere, stärkere Gesellschaft gestalten. Denn ein altes chinesisches Sprichwort lautet: Wenn der Wind der Veränderung weht, bauen die einen Mauern und die anderen Windmühlen.\n\nVielen Dank.\n\n({6})"
"1065060","Marcel","Emmerich","Grüne","Member of Parliament","2022-01-12T00:00:00.000Z","https://dip21.bundestag.de/dip21/btp/20/20010.pdf","\n\nSehr geehrte Frau Präsidentin! Sehr geehrte Damen und Herren! Liebe Kolleginnen und Kollegen! Wir erleben in den letzten Monaten verstärkt, dass versucht wird, unseren Staat, seine Institutionen und unsere Gesellschaft zu spalten und zu verhöhnen, mit Verschwörungsmythen, antidemokratischen und antiwissenschaftlichen Parolen, die verbreitet werden. Ich möchte jetzt die Gelegenheit nutzen, ein Signal der Solidarität an all diejenigen da draußen auszusenden, die direkt davon betroffen sind. Es gibt nämlich ganz viele Menschen, die sich tagtäglich einsetzen: Ärztinnen, Wissenschaftler/-innen, Journalistinnen, viele Kommunalpolitiker/-innen, die sich jeden Tag für unser Gemeinwohl einsetzen und von diesen Angriffen betroffen sind.\n\nDas ist mir ganz wichtig; denn in meinem Wahlkreis, in Ulm, ist der Dekan Ernst-Wilhelm Gohl davon betroffen. Er hat in seiner Kirche eine Impfaktion durchführen lassen und wird seitdem mit Drohbriefen überfrachtet. Sie alle hier in den Reihen kennen auch solche Beispiele, beispielsweise von Landrätinnen oder anderen engagierten Personen. Deswegen ist es mir wichtig, dass wir als Parlament hier auch Verantwortung übernehmen und ein Signal aussenden. Diese Menschen verdienen unsere Unterstützung, unseren Respekt und unsere Anerkennung für ihre Arbeit. Vielen Dank für ihr Engagement, vielen Dank für ihren Einsatz!\n\n({0})\n\nFrau Ministerin, ich muss sagen: Ihre Worte hier am Redepult waren wirklich sehr wohltuend,\n\n({1})\n\nwirklich wie in einer richtig neuen Zeit. Das kannte man von Ihrem Vorgänger so nicht, und das zeigt einfach, dass wir hier in Zukunft eine andere Innenpolitik haben werden. Ich will mich auch bedanken, dass Sie das noch mal so stark hervorgehoben haben, was wir in der Koalition beim Thema Rechtsextremismus vereinbart haben, dass Sie auch gesagt haben, dass es für uns eine besondere Priorität hat. Das Demokratiefördergesetz, die weitere Aufarbeitung der offenen Fragen des NSU-Komplexes und der von Ihnen angekündigte Aktionsplan gegen Rechtsextremismus sind Punkte, bei denen Sie die volle Unterstützung meiner Fraktion haben. Wir freuen uns auf die Mitarbeit bei diesen Themen.\n\n({2})\n\nMit einem klaren Kompass für Freiheit, Sicherheit und den demokratischen Rechtsstaat gestalten wir dieses Land also neu. Wir werden nicht alle Probleme auf einmal lösen; aber wir gehen weg von fortwährenden, impulsiven Rufen nach weiteren Gesetzesverschärfungen und stehen stattdessen für eine vorausschauende, evidenzbasierte und vor allem grundrechtsorientierte Innenpolitik ein.\n\n({3})\n\nDazu gehört der periodische Sicherheitsbericht, dazu gehört eine Überwachungsgesamtrechnung. Wir lassen von der anlasslosen Vorratsdatenspeicherung ab, und wir schränken die Quellen-TKÜ ein.\n\n({4})\n\nDamit stärken wir im Übrigen auch die IT-Sicherheit in diesem Land. Angesichts vieler weiterer Datenlecks ist das auch wirklich sehr wichtig.\n\nFür die Sicherheit in unserem Land sorgen jeden Tag über 300 000 Polizistinnen und Polizisten. Vielen Dank für ihre Arbeit! Wir statten sie besser mit Sachmitteln aus, wir stehen an ihrer Seite und sorgen dafür, dass sie mehr Kolleginnen und Kollegen an ihrer Seite haben.\n\nMit der Einführung einer unabhängigen Polizeibeauftragten schaffen wir mehr Bürger/-innennähe und eine Anlaufstelle innerhalb der Polizei. Wir stellen außerdem den Bevölkerungsschutz in Zukunft neu auf, und wir sorgen für mehr Mitbestimmung, Bürger/-innenbeteiligung und Transparenz. Das ist auch ein neuer Politikansatz, ein neuer Politikstil.\n\n({5})\n\nMeine Damen und Herren, wir haben schon heute vernommen, was wir bei den Fragen von Migration, Asyl und Flüchtlingspolitik in den nächsten Jahren aus der Opposition – von der rechten Seite – zu hören bekommen: vor allem Angstmacherei bei der Frage der Geflüchteten oder wenn es um Migrantinnen geht. Wir machen hier auch einen Aufbruch, einen Neuanfang. Statt Ausgrenzung und Abschottung stellen wir endlich wieder Menschlichkeit und Mitgefühl in den Vordergrund, für eine vielfältige Gesellschaft. Das heißt, wir kommen weg von Kettenduldungen. Stattdessen kommen wir hin zu echten Perspektiven und zu einem ganz klaren Ja zur Seenotrettung. Dazu stehen wir auf europäischer Ebene.\n\n({6})\n\nDeutschland ist natürlich ein Einwanderungsland. Wer anderes sagt, liegt vollkommen falsch. Das muss sich jetzt aber auch endlich in den gesetzlichen Rahmenbedingungen widerspiegeln, und dafür sorgen wir. Mit einem modernen Staatsangehörigkeitsrecht ermöglichen wir – mehr als 20 Jahre nach der unsäglichen Doppelpasskampagne – mit der Mehrstaatlichkeit endlich die Einbürgerung für alle.\n\n({7})\n\nMit einem Punktesystem schaffen wir ein modernes und gerechtes Einwanderungsgesetz. Unsere Politik ist klar: Egal welche Sprache jemand spricht, wie jemand aussieht, wo jemand herkommt oder welches Geschlecht jemand hat – jede und jeder hat das Recht, sicher, in Freiheit und Würde und ohne Angst zu leben.\n\n({8})\n\nDaran konstruktiv mitzuarbeiten, dazu laden wir alle demokratischen Fraktionen ein. Ich freue mich auf die Zusammenarbeit, vor allem im Ausschuss. Ich setze mich dafür ein.\n\nVielen Dank für Ihre Aufmerksamkeit.\n\n({9})"
"1065073","Helge","Limburg","Grüne","Member of Parliament","2022-01-12T00:00:00.000Z","https://dip21.bundestag.de/dip21/btp/20/20010.pdf","\n\nVielen Dank, Herr Kollege Mayer, dass Sie die Zwischenfrage zulassen. – Vor dem Hintergrund, dass Sie sich gerade echauffiert haben, in unserem Koalitionsvertrag würde nur eine Seite dem Sport gewidmet: Hätten Sie die Güte, dem Plenum zu erklären, wie viele Seiten im Koalitionsvertrag 2017, wo ja Ihr Parteifreund Herr Seehofer für den Sport zuständig war, sich mit dem Sport beschäftigt haben?\n\n({0})"
