id,firstname,lastname,faction,position,date, url,speech
"1041845","Oliver","Krischer","Grüne","Member of Parliament","2020-05-29T00:00:00.000Z","https://dip21.bundestag.de/dip21/btp/19/19164.pdf","\n\nHerr Präsident! Liebe Kolleginnen und Kollegen! Corona hat in diese Welt hunderttausendfachen Tod und noch viel mehr Leid gebracht und bringt es immer noch. Es sieht ganz so aus, dass das Virus auch eine der schwersten Wirtschaftskrisen dieses Jahrhunderts verursachen wird. Es legt schonungslos die blinden Flecken der Art und Weise, wie wir wirtschaften und leben, offen. Wenn man ein Beispiel dafür bringen müsste, dann das des ausbeuterischen Systems der Fleischindustrie, wo durch Corona aufgezeigt wurde, was seit Jahren falsch läuft und was wir ändern müssen. Ich hoffe, die Bundesregierung hat den Mut, mehr als nur Eckpunkte zu verabschieden. Sie muss deutlich machen, dass wir ein Gesetz brauchen, um die entsprechende Maßnahmen umzusetzen. Es ist bitter nötig, dass wir handeln.\n\n({0})\n\nDas eben genannte Beispiel zeigt, dass es nicht nur darum geht, zu versuchen, die Folgen der Coronakrise mit einem Konjunktur- und Investitionsprogramm aufzufangen; nein, wir müssen uns auch um die Ursachen und Folgen der anderen Krisen kümmern, allen voran der Klimakrise. Das ist die Aufgabe unserer Zeit, meine Damen und Herren.\n\n({1})\n\nIch bin sehr froh, dass sich die Wirtschaftswissenschaft eigentlich einig ist. Es gibt niemanden Ernstzunehmendes aus der Wissenschaft, der jetzt sagen würde: Wir müssen die Maßnahmen gegen die Klimakrise und andere politische Ziele aufgeben, um wieder in fossile Energien und andere vergangene Technologien zu investieren. – Nein, die Botschaft der Wissenschaft ist klar: Wir müssen jetzt in die Zukunft, in Digitalisierung, in erneuerbare Energien, in Elektromobilität und in vieles andere investieren.\n\n({2})\n\nMeine Damen und Herren, wir brauchen einen Zukunftspakt, der die Grundlagen dafür legt, dass wir nicht in die nächste Krise rutschen. Wir müssen aus der Finanzkrise lernen. Damals haben wir nämlich wieder in fossile Technologien investiert. Wir hatten die Abwrackprämie, während China und Südkorea in Batterietechnologie investiert haben, und das Ergebnis kann man heute sehen. Das war ein Fehler. Daraus müssen wir lernen. Das dürfen wir nicht wiederholen.\n\n({3})\n\nWenn ich mir angucke, was die Bundesregierung jetzt macht: Da wird die Lufthansa gerettet – ohne jede Klimaauflage; Frankreich macht das ganz anders –, da sind ganz offensichtlich Kaufprämien für Verbrenner im Gespräch, und da gibt es die Ansage der Bundeskanzlerin, den europäischen Green Deal nicht in der Weise umzusetzen, dass Deutschland den gleichen Beitrag leistet.\n\n({4})\n\nMeine Damen und Herren, das ist das exakte Gegenteil von dem, was notwendig ist. Das ist nicht das Konjunkturprogramm, das wir brauchen.\n\n({5})\n\nWir brauchen ein Konjunkturprogramm, mit dem wir in erneuerbare Energien investieren. Wir schlagen vor, dafür in den nächsten zehn Jahren 500 Milliarden Euro vorzusehen. Wir wollen 100 Milliarden Euro als Sofortprogramm zur Konjunkturstützung."
"1041847","Oliver","Krischer","Grüne","Member of Parliament","2020-05-29T00:00:00.000Z","https://dip21.bundestag.de/dip21/btp/19/19164.pdf","\n\nWir müssen investieren in erneuerbare Energien, in Verkehrswende, in die energetische Gebäudesanierung, in den Bau von 1 Million Sozialwohnungen und in eine neue Wohngemeinnützigkeit."
"1041849","Oliver","Krischer","Grüne","Member of Parliament","2020-05-29T00:00:00.000Z","https://dip21.bundestag.de/dip21/btp/19/19164.pdf","\n\nWir müssen unser Land klimafreundlicher machen, wir müssen es resilienter machen gegen die Folgen der Klimakrise, und wir müssen uns wappnen gegen alle anderen Krisen, die in Zukunft auf uns zukommen. Wir haben diese eine Chance, und die müssen wir nutzen.\n\n({0})"
"1041879","Katharina","Dröge","Grüne","Member of Parliament","2020-05-29T00:00:00.000Z","https://dip21.bundestag.de/dip21/btp/19/19164.pdf","\n\nSehr geehrter Herr Präsident! Liebe Kolleginnen und Kollegen! Herr Gremmels, es ist ja schön, wenn Sie über Klimaschutz und Nachhaltigkeit sprechen. Diese Offenheit hat man bei anderen Kollegen, insbesondere der Union und FDP, ja nicht so unbedingt.\n\n({0})\n\nAber wenn Sie darüber sprechen, dann müssen Sie das auch in Ihrer konkreten Politik machen. Dann müssen Sie das auch bei der Lufthansa machen. Dann können Sie nicht so einen schlechten Deal machen, bei dem Sie sich am Ende von Herrn Spohr die Bedingungen und die Konditionen haben diktieren lassen, also wie viel Geld Sie zahlen, in welcher Form Sie das Geld investieren, wie die Mitbestimmung der Bundesregierung ist, die eben noch nicht vorhanden ist. Sie haben im Bereich des Klimaschutzes auch nur windelweiche Bedingungen ausgehandelt.\n\n({1})\n\nDaran werden Sie gemessen, am konkreten Handeln. Das ist bislang in Sachen Klimaschutz echt miserabel.\n\n({2})\n\nDas Zweite – das richtet sich an Herrn Whittaker und Herrn Kruse –: Sie haben mich in dieser Debatte, ehrlich gesagt, so ein bisschen ratlos zurückgelassen. Sie haben mit Blick auf unseren Antrag irgendwie über Nachhaltigkeit und Begriffsbestimmung philosophiert. Was Ihnen in der Sache zu unserem Antrag dann aber nur eingefallen ist, ist auf der einen Seite, dass es recht viel Geld ist, was wir hier fordern, und auf der anderen Seite, dass Sie erstaunt waren, wie viele Forderungen wir in unserem Antrag gestellt haben.\n\n({3})\n\nIch kann verstehen, dass so etwas die Union verwirrt. Lange Forderungen sind nicht so Ihre Sache. Ich muss sogar sagen: Dieser Antrag ist auch einer der längsten, den wir in den vergangenen Jahren ins Parlament eingebracht haben. Aber es gibt einen klaren Grund, warum das so ist: Die Krise ist so groß, dass die Antwort auch so groß sein muss.\n\n({4})\n\nFinanziell ist es jetzt notwendig, für die kommende Dekade ein Investitionsprogramm von 500 Milliarden Euro aufzulegen.\n\n({5})\n\nSie haben über Generationengerechtigkeit gesprochen, Herr Whittaker. Ich glaube, wir sind ja ungefähr gleich alt. Die Frage ist, was für unsere Generation am generationengerechtesten ist. Das ist, wenn man jetzt auf der einen Seite die Wirtschaft so transformiert, dass sie mit Klimaschutz und Klimaneutralität eine wirtschaftliche Zukunft hat und dafür heute das Geld in die Hand nimmt, und wenn man auf der anderen Seite für unsere Kinder und für unsere Enkelkinder eine Gesellschaft hinterlässt, in der ein Leben noch lebenswert ist. Das ist der Moment, über den wir hier entscheiden, wenn wir dieses Konjunktur- und Investitionsprogramm auflegen. Das hat was mit Nachhaltigkeit und das hat was mit Generationengerechtigkeit zu tun.\n\n({6})\n\nHerr Kruse und Herr Whittaker, bei Ihnen habe ich ja wenigstens eine Offenheit für das Thema Klimaschutz wahrgenommen; das finde ich ausdrücklich begrüßenswert. Der Wirtschaftsminister hat es in der Debatte am vergangenen Mittwoch geschafft, eine Rede zur Coronakrise und zur Konjunkturpolitik zu halten, in der das Wort „Klimaschutz“ nicht ein einziges Mal vorkam. Er versteht nicht, dass das jetzt der entscheidende Moment für künftige Generationen ist. Wir werden in den nächsten Jahren nie wieder solche Summen in die Hand nehmen. Wenn wir jetzt nicht die Weichen stellen,\n\n({7})\n\ndann verspielen wir die wirtschaftliche Zukunft unseres Landes.\n\nAm besten kann ich Ihnen das an der Stahlindustrie erklären. Ich komme aus Nordrhein-Westfalen. Die Stahlindustrie steht wirtschaftlich gerade am Abgrund. Ich glaube, keiner hier im Raum möchte sich vorstellen, wie eine Stadt wie Duisburg aussieht, wenn dieser große Arbeitgeber nicht mehr existiert. Jetzt sind wir gefordert, dieser Industrie eine langfristige Antwort zu geben. Das Problem lösen wir nicht mit einer kurzfristigen Konjunkturhilfe. Wir müssen jetzt Investitionshilfen für eine klimaneutrale Technologie der Zukunft schaffen.\n\n({8})\n\nDie Stahlindustrie selber verlangt das von der Bundesregierung. Sie sind gefordert, ein Investitionsprogramm aufzulegen mit Investitionshilfen für thyssenkrupp, für ArcelorMittal, für Salzgitter und andere, damit sie eine Stahlproduktion schaffen, die auf der einen Seite klimaneutral ist, –"
"1041881","Katharina","Dröge","Grüne","Member of Parliament","2020-05-29T00:00:00.000Z","https://dip21.bundestag.de/dip21/btp/19/19164.pdf","\n\n– ein Drittel der industriellen Emissionen in diesem Land einspart\n\n({0})\n\nund auf der anderen Seite die einzige Jobperspektive darstellt, die diese Beschäftigten haben.\n\n({1})\n\nDeswegen einfach ganz klar: Sie können nicht nur kurzfristig handeln."
"1041883","Katharina","Dröge","Grüne","Member of Parliament","2020-05-29T00:00:00.000Z","https://dip21.bundestag.de/dip21/btp/19/19164.pdf","\n\nSie müssen verstehen: Klimaschutz und wirtschaftliche Hilfen gehören zusammen. Es ist jetzt der beste und der einzige Moment, in dem Sie das noch hinkriegen können.\n\n({0})"
"1041917","Filiz","Polat","Grüne","Member of Parliament","2020-05-29T00:00:00.000Z","https://dip21.bundestag.de/dip21/btp/19/19164.pdf","\n\nSehr geehrte Frau Präsidentin! Liebe Kolleginnen und Kollegen! Die Debatten über das Kopftuch müssen mit aller gebotenen Sachlichkeit geführt werden. Wir tragen hier eine große Verantwortung. Die Rechten nutzen die alten Feindbilder und Vorurteile gegenüber Muslimen, um tief verwurzelte Ängste und Rassismen in der Bevölkerung für ihre Zwecke zu nutzen, und das konnten wir leider heute wieder eindrücklich erleben, meine Damen und Herren.\n\nDas Kopftuch für Mädchen lehnen wir ab.\n\n({0})\n\nAber genauso wie die große Zahl der Muslime in Deutschland und im Übrigen auch die Dachverbände sagen wir: Ein Verbot ist nicht der richtige Weg und auf Bundesebene definitiv so oder so gesetzlich nicht umsetzbar.\n\n({1})\n\nDer Staat hat die Aufgabe, eine sehr genaue Abwägung und einen Ausgleich möglicher Grundrechtskollisionen vorzunehmen. Nach der geltenden Rechtsprechung ist anzuerkennen, dass allein die Grundrechtsträgerin entscheiden kann, ob es sich um ein für sie verbindliches Glaubensgebot handelt. Der Staat hat nicht zu beurteilen, welche Bekleidungsvorschriften aus religiöser Überzeugung befolgt werden.\n\n({2})\n\nIm Gutachten des Wissenschaftlichen Dienstes von 2017 zu Schule und Religionsfreiheit, das ich wirklich empfehle, wird hierzu treffend ergänzt – ich zitiere –:\n\nDem Staat ist es verwehrt, die Glaubensüberzeugungen der Bürger zu bewerten oder als „richtig“ oder „falsch“ zu beurteilen. Das gilt insbesondere dann, wenn dazu unterschiedliche Ansichten innerhalb einer Religionsgemeinschaft vertreten werden.\n\nMeine Damen und Herren, die Herausforderung beim Thema „Kopftuch bei minderjährigen Mädchen“ ist jedoch, dass die Eltern für ihre Kinder diese Entscheidung treffen. Es ist nun einmal so, dass Kinder unter 14 Jahren bis zu ihrer Religionsmündigkeit – das wissen Sie – von ihren Eltern vertreten werden. Nichtsdestotrotz ist klar: Wenn Zwang ausgeübt wird, muss der Staat in die elterliche Fürsorge eingreifen können und das Kindeswohl in den Mittelpunkt stellen, und darüber sind wir uns wohl einig, meine Damen und Herren.\n\n({3})\n\nDafür haben wir die entsprechende gesetzliche Rahmengesetzgebung. Wir sehen keinen Änderungsbedarf auf Bundesebene. Denn ein pauschales Verbot und vor allem dessen Durchsetzung durch den Staat hätten unverhältnismäßige Folgen insbesondere für die Kinder. Es ist nicht im Interesse der Kinder, zur Durchsetzung dieses Verbots möglicherweise vorübergehend von Bildungseinrichtungen ausgeschlossen zu werden. Wir haben hierfür schon Beispiele aus der Vergangenheit in Bezug auf das Nikab-Verbot in einigen Bundesländern gesehen. Dieser Konsequenzen müssen Sie sich bewusst sein, bevor Sie ein pauschales Verbot fordern. Auf religiöse Gebote, meine Damen und Herren, mit weltlichen Verboten zu reagieren, führt zu Ausgrenzung und Isolation statt zu Inklusion.\n\nVielen Dank für Ihre Aufmerksamkeit.\n\n({4})"
"1041926","Canan","Bayram","Grüne","Member of Parliament","2020-05-29T00:00:00.000Z","https://dip21.bundestag.de/dip21/btp/19/19164.pdf","\n\nVielen Dank, Frau Präsidentin, vielen Dank auch, Herr Kollege, dass Sie die Zwischenfrage zugelassen haben. – Nun hat die Vertreterin der AfD vorgetragen, dass es ihr Ziel sei, die Gleichstellung, die Gleichberechtigung von Frauen zu befördern – insoweit würde ich sagen: es geht ihr um die Frauenrechte –, und die würden geschmälert, wenn man als Kind schon das sogenannte Kinderkopftuch trägt. Während sie das vortrug, habe ich mich gefragt: Ja, was ist denn bei den Frauen in der AfD falsch gelaufen, dass die Gleichberechtigung – für uns ja sichtbar – in einer Art und Weise erfolgt ist, dass sie noch nicht einmal die Frauen repräsentieren können, geschweige denn die Frauenrechte in ihrer eigenen Fraktion, der AfD im Deutschen Bundestag, vertreten können?\n\n({0})"
"1041945","Dieter","Janecek","Grüne","Member of Parliament","2020-05-29T00:00:00.000Z","https://dip21.bundestag.de/dip21/btp/19/19164.pdf","\n\nSehr geehrte Frau Präsidentin! Ich glaube, viele Sozialunternehmerinnen und Sozialunternehmer – Social Entrepreneurs, Social Start-ups – freuen sich, dass heute diese Debatte stattfindet. Sie freuen sich allerdings auch deswegen, weil es so lange gedauert hat, bis die Bundesregierung endlich mal was vorgelegt hat. Herr Sattelberger und ich zum Beispiel wurden ja letztes Jahr schon initiativ, aber auch die Linken haben Anträge vorgelegt. Dieses Thema beschäftigt uns seit vielen Jahren. Endlich bekommt es die Wertschätzung, die es verdient.\n\n({0})\n\nIn einer Zeit von Kaufprämien für die Automobilindustrie, von Rettungspaketen ohne Klimaschutzauflagen für die Lufthansa ist die Debatte über das Thema „soziale Innovationen“ fast anachronistisch zu dem, was die Regierung momentan in vielen Bereichen tut. Trotzdem freue ich mich, dass viele Abgeordnete, auch der Koalition – ich nenne namentlich Herrn Lenz und Frau Poschmann –, mit denen wir in den letzten Jahren auf vielen Podien gesessen haben, jetzt mitgeholfen haben, etwas auf den Weg zu bringen. Es ist, glaube ich, auch anerkennenswert, dass wir hier einen Konsens haben. Der Konsens steht im Vordergrund; aber wenn wir jetzt über den Neustart der Wirtschaft in Deutschland reden, wäre es schon auch gut, dass wir dann soziale Innovationen auch nach vorne stellen, dass das nicht nur ein Mauerblümchendasein fristet in den nächsten Jahren.\n\n({1})\n\nUnd natürlich geht es nicht nur um den Profit. Viele soziale Unternehmungen sind wirtschaftlich sinnvoll und können profitorientiert arbeiten, aber viele sind einfach auch gut für die Gesellschaft vor Ort. Ich nenne Ihnen mal zwei Beispiele aus meinem Wahlkreis in München: Zum einen das Unternehmen Social-Bee. Dieses Unternehmen beschäftigt geflüchtete Menschen, nimmt sie in eine Arbeitsgesellschaft auf und vermittelt sie dann über Weiterbildung, Qualifizierung an andere Unternehmen, sorgt dafür, dass Menschen, die geflüchtet sind und es zuerst schwer haben, in den Arbeitsmarkt zu kommen, auf dem Arbeitsmarkt ankommen. So was ist sehr sinnvoll und hilft uns am Ende auch, Kosten zu sparen. Vor allem aber ist es menschlich anständig, und darum geht es eben auch in der Wirtschaft.\n\n({2})\n\nIch möchte nicht nur über die großen Geschäftsmodelle reden, ich möchte auch mal über die kleinen Sachen reden. Was mir sehr gut gefällt bei mir zu Hause ist die Bäckerei „Kuchentratsch“; du kennst sie vielleicht, Thomas.\n\n({3})\n\nDas ist eine kleine Unternehmung, wo Seniorinnen und Senioren in ihrer Arbeitsgeschwindigkeit Kuchen backen und unter die Leute bringen und so auch unter Leute kommen. Das ist jetzt vielleicht in Coronazeiten in den letzten Wochen ein bisschen schwieriger gewesen als sonst; aber wir hoffen ja auf bessere Zeiten in dieser Phase. Also, auch so was gehört gefördert; das ist auch ein geschäftliches Modell, das Anerkennung verdient. Auch dafür setzen wir uns ein.\n\n({4})\n\nIn unseren Anträgen haben wir ja zum einen bemängelt, dass bei der Förderkulisse momentan nur sehr wenig drin ist für die Social Entrepreneurs; nach eigenen Angaben sind gerade mal 3 Prozent überhaupt förderfähig. Das muss dringend geändert werden. Es kann nicht sein, dass wir nur Lufthansa und die Automobilindustrie retten. Wir müssen auch diesen kleinen Unternehmen jetzt in der Krise eine Chance geben; denn denen geht gerade ganz viel verloren.\n\n({5})\n\nUnd wir brauchen auch eine Zuständigkeit dafür in den Ministerien, das heißt, wir brauchen jemanden, eine Person, die sagt: Ich fühle mich für solche Themen zuständig. – Es reichen nicht nur Prüfaufträge; wir brauchen bei diesem Thema auch Verantwortlichkeiten. Also, gehen Sie ran! Die 13,5 Millionen Euro werden natürlich nicht reichen, um einen solchen Bereich, wo es um Hunderttausende Menschen geht, die arbeiten wollen, die schaffen wollen, die ehrenamtlich, aber auch geschäftlich tätig sein wollen, zu fördern. Also, lassen Sie uns den Blick auf die Ökonomie ändern! Mit Social Entrepreneurs nach vorne!\n\nVielen Dank.\n\n({6})"
"1041963","Kirsten","Kappert-Gonther","Grüne","Member of Parliament","2020-05-29T00:00:00.000Z","https://dip21.bundestag.de/dip21/btp/19/19164.pdf","\n\nFrau Präsidentin! Liebe Kolleginnen und Kollegen! Tabakwerbung schadet. Sie trifft immer auch Kinder und Jugendliche. Tabakwerbung konterkariert jede Prävention.\n\n({0})\n\nDas haben bereits alle anderen EU-Länder begriffen und die Tabakwerbung inzwischen verboten. Nur Deutschland hinkt bis heute hinterher. Gut, dass es jetzt zum Greifen nah ist, dass sich das endlich ändert.\n\n({1})\n\nDrei Kreuze können wir aber erst machen, wenn das Gesetz wirklich abgestimmt ist. Wir erinnern uns: In der letzten Legislaturperiode blieb ein Kabinettsentwurf ohne Parlamentsbeschluss in der Schublade liegen. Der Einfluss der Tabaklobby war offensichtlich zu groß. Gesundheit darf aber nicht hinter Lobbyinteressen zurückstehen. Gesundheit geht vor.\n\n({2})\n\nAuch den Gesetzentwurf der Grünen für ein Tabakwerbeverbot haben Sie im letzten Jahr noch abgelehnt, nur einen Tag übrigens nachdem sich die Kanzlerin hier in der Regierungsbefragung für ein Tabakwerbeverbot ausgesprochen hatte. Nun dauerte es ein weiteres halbes Jahr, bevor sich die Union endlich zu einem Fraktionsbeschluss durchringen konnte, und noch einmal genauso lange, bis wir heute endlich über diesen Gesetzentwurf debattieren. Aber besser spät als nie!\n\nLeider versäumen Sie es aber, neue Marketingstrategien in den Blick zu nehmen. Dazu gehört auch das Sponsoring von Festivals; die Linken haben zu Recht darauf hingewiesen und dazu einen Antrag eingebracht. Die Industrie wirbt überdies zunehmend für Tabakerhitzer und E-Zigaretten. Auch E-Zigaretten sind schädlich. Werbung für diese Dampfprodukte brauchen wir ebenso wenig wie die für die klassische Zigarette.\n\n({3})\n\nAuch diese Werbung trifft Kinder und Jugendliche. Schauen Sie sich das einmal bei Instagram an. Die Liquids werden teils mit rechtswidrigen Gesundheitsversprechen beworben. Es ist also grundfalsch, die Werbung hierfür noch bis 2024 zuzulassen.\n\n({4})\n\nWarum denn auch? Wenn Sie erkannt haben, dass ein generelles Tabakwerbeverbot sinnvoll ist: Warum dann eine Übergangsfrist von weiteren drei Jahren? Warum stellen Sie wieder Lobbyinteressen vor Gesundheitsschutz? Ein wirksames Tabakwerbeverbot muss konsequent sein.\n\n({5})\n\nIn Ihrem Gesetzentwurf steht, die Werbeeinnahmen für die Kommunen würden dann einfach wegbrechen. Das ist wirklich Unsinn. Fragen Sie einmal die Kommunen, die als Pioniere schon jetzt auf Tabakwerbung und sexistische Werbung verzichten. Es geht gut ohne.\n\n({6})\n\nIch freue mich sehr auf die Beratungen in den Ausschüssen und hoffe, dass wir dann noch deutliche Verbesserungen erreichen, damit, was lange währt, endlich gut wird.\n\nVielen Dank.\n\n({7})"
"1041981","Beate","Walter-Rosenheimer","Grüne","Member of Parliament","2020-05-29T00:00:00.000Z","https://dip21.bundestag.de/dip21/btp/19/19164.pdf","\n\nSehr geehrte Frau Präsidentin! Liebe Kollegen und Kolleginnen! Liebe Zuhörer und Zuhörerinnen! Last, but not least beschäftigen wir uns an diesem Freitagnachmittag, fast schon ‑abend, mit dem Thema „Ausbildung in der Coronakrise“ frei nach dem Motto „Kommt Zeit, kommt Rat“. Einmal mehr nämlich standen Auszubildende auch in diesen Tagen der Coronakrise nicht im Fokus, und es wurde viel zu wenig Aufmerksamkeit auf ihre Bedürfnisse gelegt. Insgesamt sind die Themen Bildung und Ausbildung sehr vernachlässigt worden, was ich für einen riesigen Fehler halte.\n\n({0})\n\nWährend die Debatte zumindest noch Abiturienten und Abiturientinnen und Studierende in den Blick nahm, mussten die Auszubildenden mal wieder im Verborgenen blühen, obwohl auch bei ihnen extrem viel Unsicherheit über ihre Ausbildung, die Prüfungen, die Weiterbeschäftigung aufkam, als unser Land in den Lockdown ging. Viele konnten in ihren Ausbildungsbetrieben nicht weiterarbeiten, Information fehlte. Auch mir fehlt Information; denn auf meine Frage an die Bundesregierung, wie viele Auszubildende von Kurzarbeit in der Krise betroffen seien, musste ich hören, dass die BA in der Kurzarbeiterstatistik Azubis gar nicht aufführt. Es gibt gar keine Zahlen dazu. Das ist ebenso unglaublich wie falsch, und das muss sich ändern.\n\n({1})\n\nNun haben wir dank der Anträge von den Linken und der FDP heute die Gelegenheit, über Ausbildung in der Krise zu debattieren. Ich kann in beiden Anträgen gute Aspekte finden. Wir können aber nicht bei allem mitgehen. Jetzt ist die Zeit – drei Minuten – natürlich zu kurz, um zu diskutieren. Ich freue mich aber auf die Debatte im Ausschuss. Das werden wir in jedem Fall machen.\n\nDie Frage ist jetzt: Was brauchen Auszubildende in diesen Tagen? Nach all der Verunsicherung, den Einschränkungen, der Ungewissheit brauchen sie jetzt endlich Klarheit und die Möglichkeit, ihre Ausbildung fortzuführen, zum Beispiel durch Verbundausbildung, die auch den Betrieben helfen kann,\n\n({2})\n\ndurch mehr und bessere Digitalisierung. Es hat sich ja gezeigt, dass die theoretische Ausbildung auch online gut geht. Darauf kann man jetzt aufbauen. Hier hat die Krise sogar ein bisschen was Gutes bewirkt und unser Land etwas aus dem digitalen Dornröschenschlaf geführt.\n\n({3})\n\nDas macht Mut, weiterzugehen. Deshalb muss das neue DigitalPakt-Sofortausstattungsprogramm auch dringend der beruflichen Bildung zugutekommen.\n\n({4})\n\nUm gute Ausbildung krisenfest zu machen, braucht es natürlich mehr: den Abbau von Warteschleifen, die Verhinderung von Ausbildungsabbrüchen und eine angemessene Vergütung statt eine geradezu unglaubliche Diskussion über den Abbau von Jugendarbeitsschutzrechten oder die Absenkung des Mindestlohns.\n\n({5})\n\nEs braucht eine echte Ausbildungsgarantie, wie wir Grünen sie vorgelegt haben, um die berufliche Bildung krisenfest zu machen und auch den Fachkräftebedarf zu sichern.\n\nBegreifen wir also die Krise als Chance, liebe Kolleginnen und Kollegen, um der dualen Ausbildung wieder mehr Aufwind zu verleihen. Den braucht sie dringend, um sie sicher und krisenfest zu gestalten.\n\n({6})"
"1042028","Annalena","Baerbock","Grüne","Member of Parliament","2020-06-17T00:00:00.000Z","https://dip21.bundestag.de/dip21/btp/19/19165.pdf","\n\nHerr Staatsminister, herzlichen Dank für Ihre Ausführungen zu den letzten Wochen. – Ein Bereich, den Sie nicht angesprochen haben, sind die Ausstattung mit Schutzmaterialien und deren Produktion. Da ist man ja am Anfang etwas holprig an den Start gekommen. Man hat dann Anfang April erklärt, es gebe einen Arbeitsstab Produktion, woran sehr viele Ministerien beteiligt waren. Dann haben wir Ende Mai nachgefragt, wer denn jetzt federführend zuständig ist. Darauf konnte die Staatssekretärin damals keine Antwort geben und sprach von einer dynamischen Entwicklung der Zuständigkeiten zwischen den Ressorts.\n\nDie Frage: Sind diese Zuständigkeiten jetzt geklärt? Vor allen Dingen: Wie gedenken Sie, die Probleme, die wir nach wie vor haben, zu lösen? Es gibt auf der einen Seite Schutzmasken, die leider nicht abgenommen werden. Es gibt die Situation in Krankenhäusern, dass nach wie vor medizinisches Personal seine Masken waschen muss, weil nicht ausreichend Schutzmasken vorhanden sind. Auf der anderen Seite gibt es Hersteller, die ihre Produktion umstellen wollen, aber keine gesicherten Abnahmegarantien haben. Das heißt, neben der Frage, wer eigentlich zuständig ist, stelle ich folgende Frage: Wie gedenken Sie, dafür zu sorgen, dass die Materialien dann auch in die Einrichtungen kommen?"
