id,firstname,lastname,faction,position,date, url,speech
"1053498","Britta","Haßelmann","Grüne","Member of Parliament","2021-01-27T00:00:00.000Z","https://dip21.bundestag.de/dip21/btp/19/19205.pdf","\n\nVielen Dank, Herr Präsident. – Liebe Kolleginnen und Kollegen! Wir diskutieren morgen – für alle diejenigen, die interessiert sind – in der Sache noch mal über genau dieses Thema. Der Bundestag duckt sich hier nicht weg, der Bundestag berät intensiv. Regierung und Opposition – FDP, Linke und Grüne – sind an der einen oder anderen inhaltlichen Stelle vielleicht unterschiedlicher Auffassung über den Tatbestand der Regelungen, die heute bzw. morgen verabschiedet werden. Aber sitzen Sie bitte nicht diesen Argumenten auf, die immer wieder von der AfD kommen. Meine Damen und Herren, sie sind wirklich nur dazu da, Zweifel am Vertrauen in demokratische Institutionen und auch in das Parlament und die Beratungen der Abgeordneten zu säen. Sitzen Sie dem nicht auf, meine Damen und Herren.\n\n({0})\n\nDenn auch wenn ich in der Sache mit der Fraktion Bündnis 90/Die Grünen an vielen Stellen zu einer anderen Auffassung gekommen bin und auch versucht habe, Sie zu überzeugen, dass wir gute Argumente hatten, das Bundeswahlgesetz anders zu formulieren und für mehr Bestimmtheit und Rechtsklarheit zu sorgen, auch wenn ich an der Rechtsverordnung inhaltlich wirklich noch Kritik habe und wir deshalb morgen, wenn wir nach der Debatte abschließend entscheiden, nicht zustimmen werden,\n\n({1})\n\nkann man doch dem Brandner das hier so nicht durchgehen lassen, meine Damen und Herren.\n\n({2})\n\nWie kommen Sie eigentlich auf die Idee, es sei nicht beraten worden? Meine Damen und Herren, das stimmt einfach nicht.\n\n({3})\n\nEs ist gelogen, meine Damen und Herren, schlichtweg gelogen; denn wir haben die Änderung des Bundeswahlgesetzes diskutiert, hier parlamentarisch mit Mehrheit verabschiedet, gegen die Stimmen der Grünen. Aber ich sage es trotzdem: Wir haben einen demokratischen Beschluss gefasst. – Das nennt man Demokratie, wenn hier Mehrheiten zustande kommen.\n\n({4})\n\nUnd da sollten Sie nicht in der Öffentlichkeit Zweifel säen. Es ist fahrlässig – wirklich fahrlässig –, so zu tun, als wäre hier irgendwas gemauschelt oder getrickst worden. Mit Mehrheit, die mir und Bündnis 90/Die Grünen nicht gepasst hat, ist hier ein Beschluss zustande gekommen.\n\nIch finde auch, dass wir alle uns als kritische Opposition mit Verbesserungsvorschlägen, mit inhaltlichen Auffassungen einbringen sollen. Wo sind die denn von Ihnen? Sie von der AfD sind doch blank, bei jedem dieser Punkte sind Sie doch absolut blank. Sie können doch nichts Konstruktives beisteuern, meine Damen und Herren.\n\n({5})\n\nIch finde es gut, wenn wir morgen die Debatte in aller Ernsthaftigkeit in der Sache führen. Wir hätten uns hier mehr Rechtssicherheit und mehr Klarheit für die Parteien gewünscht. Wir wissen aber, dass alle demokratischen Parteien und Kräfte darauf drängen, dass es jetzt endlich eine Regelung gibt. Deshalb sind wir auch sehr bereit, mit Ihnen morgen darüber zu diskutieren, meine Damen und Herren.\n\nIch glaube, es ist einfach nicht Brandners Woche.\n\n({6})\n\nDas erkennt man, wenn man sich anguckt, was in den sozialen Medien los ist, wo Sie ja zu Hause sind. Schalke 04 ist nicht mein Verein – ich bin für Arminia Bielefeld –;\n\n({7})\n\naber der Verein hatte gestern recht, als er getwittert hat: Schalke wird nie auf Ihr Niveau absteigen. – Ich hoffe, wir alle auch nicht – ich bin mir ganz sicher.\n\n({8})"
"1053521","Ulle","Schauws","Grüne","Member of Parliament","2021-01-27T00:00:00.000Z","https://dip21.bundestag.de/dip21/btp/19/19205.pdf","\n\nVielen Dank, Herr Präsident. – Frau Ministerin, ich frage da auch noch mal nach. Insbesondere mit Blick auf die Unterfinanzierung der Frauenhäuser, was wir ja jetzt seit Jahrzehnten diskutieren, gibt es immer wieder eine Auseinandersetzung darüber, was der Bund mehr tun kann. Sie haben das Investitionsprogramm erwähnt. Das ist ja gut; das sind investive Mittel. Aber das stärkt natürlich weder die Personalstrukturen noch die Möglichkeiten, Frauenhäuser in dem Maße auszubauen, wie es notwendig ist. Laut Istanbul-Konvention fehlen ja Plätze. Deswegen noch mal die Frage – Sie haben über den Rechtsanspruch gesprochen; wir als Bündnis 90/Die Grünen haben konkret im vorletzten Jahr einen Vorschlag mit einem Rechtsanspruch auf den Schutz vor Gewalt vorgelegt –: Wo bleibt Ihr Vorschlag dazu, um als Bund konkret –"
"1053523","Ulle","Schauws","Grüne","Member of Parliament","2021-01-27T00:00:00.000Z","https://dip21.bundestag.de/dip21/btp/19/19205.pdf","\n\n– Vorschläge zu machen und nicht nur auf die Länder zu warten?"
"1053526","Ulle","Schauws","Grüne","Member of Parliament","2021-01-27T00:00:00.000Z","https://dip21.bundestag.de/dip21/btp/19/19205.pdf","\n\nIch habe noch eine Nachfrage."
"1053528","Ulle","Schauws","Grüne","Member of Parliament","2021-01-27T00:00:00.000Z","https://dip21.bundestag.de/dip21/btp/19/19205.pdf","\n\nIch meine, mich erinnern zu können, Frau Ministerin, dass Sie vor eineinhalb Jahren im Rahmen der Debatte um den 25. November herum schon angekündigt haben, den Rechtsanspruch in Angriff zu nehmen. Ein Rechtsanspruch vonseiten des Bundes würde ja auch ermöglichen – und das ist der Vorschlag, den wir vorlegen –, dass der Bund in die Finanzierung eintritt und die Länder nicht alleine finanziell dafür zuständig bleiben. Diese Diskussion ist von Ihrer Seite bisher nicht angestoßen worden. Ich glaube, dass es ein Thema des Runden Tisches sein muss, wie die bessere Finanzierung auch von Bundesseite aussehen kann. Deswegen noch mal die Nachfrage: Haben Sie vor, mit dem Rechtsanspruch in dieser Wahlperiode noch konkreter zu werden?"
"1053558","Ekin","Deligöz","Grüne","Member of Parliament","2021-01-27T00:00:00.000Z","https://dip21.bundestag.de/dip21/btp/19/19205.pdf","\n\nFrau Ministerin, ich bleibe bei dem Thema. Wenn es im Februar zu einer Verlängerung des Shutdowns kommen sollte, was wir ja alle nicht wissen, kann es passieren, dass die 20 Tage pro Elternteil ziemlich schnell aufgebraucht sind. Werden Sie in dem Fall in dem Zeitraum die Regelung über die 20 Tage noch mal verlängern, sodass die Eltern weiterhin die Möglichkeit haben, auf die Kinderkrankentage zurückzugreifen?"
"1053561","Ekin","Deligöz","Grüne","Member of Parliament","2021-01-27T00:00:00.000Z","https://dip21.bundestag.de/dip21/btp/19/19205.pdf","\n\nJa. – Ich will nur sichergehen: Es ist unser aller Wunsch, dass Kitas und Schulen wieder öffnen. Wenn es aber anders kommt – und im Moment gibt es eine Wahrscheinlichkeit –, werden Sie sich dann dafür einsetzen, dass es eine Verlängerung bei den Kinderkrankentagen gibt, und werden Sie sich, zweitens, auch für die Wiedereinführung des Kinderbonus, den es im letzten Jahr gab, einsetzen?"
"1053563","Margit","Stumpp","Grüne","Member of Parliament","2021-01-27T00:00:00.000Z","https://dip21.bundestag.de/dip21/btp/19/19205.pdf","\n\nVielen Dank, Frau Präsidentin. – Frau Ministerin, es ist unbestritten, dass die Erweiterung der Kinderkrankentage Druck von den Eltern genommen hat. Auf der anderen Seite mussten die Eltern feststellen, als sie am nächsten Tag ihr Kind in die Notbetreuung geben wollten, dass die Konditionen für die Notbetreuung immer weiter eingeschränkt werden. Sie hatten im Gegenzug zur Erweiterung der Kinderkrankentage keinen Anspruch mehr auf Notbetreuung und wurden von den Einrichtungen stringent darauf verwiesen, dass sie doch ihre Kinderkrankentage nehmen sollten. Das heißt, der Druck wurde den Eltern, die systemrelevante Berufe haben, nicht genommen; vielmehr wurde er von anderer Seite erhöht. Wie wollen Sie dieser Entwicklung begegnen?"
"1053590","Ulle","Schauws","Grüne","Member of Parliament","2021-01-27T00:00:00.000Z","https://dip21.bundestag.de/dip21/btp/19/19205.pdf","\n\nVielen Dank. – Frau Präsidentin! Frau Ministerin, ich habe eine Frage zu einem Gerichtsverfahren, das in den letzten Tagen stattgefunden hat: Die Ärztin Kristina Hänel ist vor dem Oberlandesgericht Frankfurt erstmals rechtskräftig nach dem § 219a StGB verurteilt worden. Sie muss jetzt die Informationen über Schwangerschaftsabbrüche für ihre Patientinnen, die sie auf der Webseite stehen hatte, runternehmen.\n\nJeder Mensch – Sie, ich, jeder hier im Saal – dürfte auf seiner Homepage diese Informationen zur Verfügung stellen, aber nicht die Ärztinnen, die Schwangerschaftsabbrüche vornehmen. Da die Bundeszentrale für gesundheitliche Aufklärung, nachdem Sie die Reform des § 219a StGB auf den Weg gebracht haben, immer noch keine vollständige Liste von Ärztinnen sowie entsprechende Informationen zur Verfügung stellt: Sind Sie der Meinung, dass dieses reformierte Strafgesetz § 219a in der Form trägt, wie Sie es zugesagt hatten?"
"1053593","Ulle","Schauws","Grüne","Member of Parliament","2021-01-27T00:00:00.000Z","https://dip21.bundestag.de/dip21/btp/19/19205.pdf","\n\nKonkrete Nachfrage. Sie haben jetzt gerade gesagt, dass es ein Kompromiss war. Das mag sein. Aber es gab eben damals auch die klare Aussage von Ihnen in der Koalition, dass alle Informationen für Frauen und dass eine Liste von Ärztinnen zugänglich gemacht werden sollten. Das ist aber bis heute nicht geschehen, und die Verabschiedung dieses Gesetzes ist im vorletzten Jahr gewesen; wir erinnern uns alle daran. Meine Frage ist: Was werden Sie konkret in den nächsten Wochen und Monaten bis zum Ende der Wahlperiode tun, damit diese Informationen vollständig zugänglich werden?"
"1053604","Ekin","Deligöz","Grüne","Member of Parliament","2021-01-27T00:00:00.000Z","https://dip21.bundestag.de/dip21/btp/19/19205.pdf","\n\nFrau Ministerin, ich bleibe bei dem Thema „Kinderrechte in die Verfassung“. Ein entsprechender Gesetzentwurf ist ja jetzt im Kabinett verabschiedet worden. Es gibt eine Erklärung von allen großen Kinderrechtsverbänden – Deutscher Kinderschutzbund, UNICEF, Deutsches Kinderhilfswerk, Deutsche Liga für das Kind – , die sagen, dass die Vorlage weit hinter den geltenden Gesetzen und Bundesverfassungsgerichtsentscheidungen zurückbleibt. Was sagen Sie als Kinder- und Familienministerin zu dieser Stellungnahme? Teilen Sie diese Stellungnahme, und, wenn Sie diese Stellungnahme nicht teilen, warum nicht?"
"1053637","Ekin","Deligöz","Grüne","Member of Parliament","2021-01-27T00:00:00.000Z","https://dip21.bundestag.de/dip21/btp/19/19205.pdf","\n\nFrau Ministerin, Ende des letzten Jahres wurde im Kabinettsausschuss ein großes Programm zur Bekämpfung von Rechtsextremismus und Rassismus beschlossen. Bisher sind uns aber Ihre Umsetzungspläne nicht bekannt. Könnten Sie uns diese bitte kurz erläutern? Wann können wir damit rechnen, und wie planen Sie das umzusetzen?"
"1053640","Ekin","Deligöz","Grüne","Member of Parliament","2021-01-27T00:00:00.000Z","https://dip21.bundestag.de/dip21/btp/19/19205.pdf","\n\nKönnen Sie uns ein Datum, wann das im Kabinett sein soll, schon nennen?"
"1053660","Kordula","Schulz-Asche","Grüne","Member of Parliament","2021-01-27T00:00:00.000Z","https://dip21.bundestag.de/dip21/btp/19/19205.pdf","\n\nFrau Präsidentin! Meine Damen und Herren! Der Titel dieser Aktuellen Stunde lautet „Verantwortung und Risikoverringerung“. Und ich kann nur alle bitten: Populismus hat an dieser Stelle nichts zu suchen. Aber es sind gute Stichworte, diese Bundesregierung aufzufordern, endlich Verantwortung wahrzunehmen, sie zu übernehmen, um das Maßnahmenchaos und die chaotische Vielstimmigkeit, die die letzten Monate bestimmt haben, endlich zu beenden.\n\n({0})\n\nWir brauchen eine einheitliche Strategie, und dies natürlich auf nationaler Ebene und mit entsprechenden regionalen Anpassungen an die jeweilige Lage, wo es nötig ist. Das gemeinsame Ziel dieses Hauses, von rechts abgesehen, muss es doch sein, die Pandemie tatsächlich zu beenden, aus der Krise zu kommen.\n\n({1})\n\nUnd das Sinken der Fallzahlen macht uns ja hoffnungsvoll. Aber sie sinken zu langsam, und dies auch bis zum 14. Februar.\n\nVerantwortung heißt, vorausschauend zu handeln. Was braucht es, um gut durch die nächsten Monate zu kommen? Fünf Bereiche sind in der Pandemiebekämpfung bekannt, um dies zu schaffen: das Impfen, die Schutzmaßnahmen, das Testen, Testen, Testen, die Kontaktnachverfolgung und die Kommunikation. Und in allen diesen Bereichen hat diese Regierung erheblichen und dringenden Nachbesserungsbedarf, meine Damen und Herren.\n\n({2})\n\nUnd nicht oder gar nicht aufgestellt ist diese Regierung bei der Frage von Schnelltests zur Selbstanwendung, bei der weiter gehenden Umsetzung von Homeoffice, als es bisher der Fall ist, beim Tragen sicherer FFP2-Masken, bei Konzepten für Schule und Kita und auch bei der Frage des Umgangs mit alten Menschen in unseren Einrichtungen, aber auch zu Hause. Das betrifft das Pflegepersonal, also diejenigen, die zu Recht auch schon mehrfach für ihren Einsatz gelobt wurden, der mit einem hohen Risiko für ihre eigene Gesundheit verbunden ist.\n\nDer zweite Punkt, bei dem es tatsächlich einen großen Bedarf für Nachbesserungen gibt, ist aus meiner Sicht die Information der Bevölkerung, die Aufklärung, die Begründung, das Erklären: Was? Warum? Wie?\n\n({3})\n\nEines der wirklich ganz großen Defizite zeigt sich in der Kommunikation mit der Bevölkerung und besonders mit Zielgruppen, die wir erreichen müssen: bestimmte Berufsgruppen, bestimmte Bevölkerungsgruppen, bestimmte Gruppen, die eben nicht durch die Medien erreicht werden, usw. usf. Hier, glaube ich, müssen wir in der Kommunikation wirklich nachlegen, Verständnis wecken und die Leute mitnehmen. Das ist die zentrale Frage, vor der wir gerade stehen.\n\n({4})\n\nIch sage das so mit Nachdruck, weil wir in dieser Pandemie an einem kritischen Punkt angekommen sind. Wir haben ja gerade das Gift von rechts gehört, das hier in diesen Raum und auch in die Gesellschaft zu streuen versucht wurde.\n\nAber Sie haben mit diesen scheibchenweisen Verlängerungen und mit immer neuen Regeln, die nicht nachvollziehbar waren – und manche konnten auch gar nicht nachvollzogen werden –, die Menschen trotz der großen Akzeptanz, die wir bisher hatten, wirklich müde und mürbe gemacht. In dieser Situation befinden wir uns, und deswegen braucht es eine Strategie des Weges zur Öffnung hin, zur Einheitlichkeit, Transparenz und Verlässlichkeit der Strategien und der Maßnahmen, verbunden mit klaren Kriterien für die nächsten Monate.\n\n({5})\n\nWir müssen die Fallzahlen schnell herunterbekommen, und wir müssen die Fallzahlen langfristig kontrollieren können.\n\nWir Grünen haben übrigens mit einem Stufenplan – ich bin ja immer froh, wenn unsere Ideen aufgegriffen werden, und wenn es auch nur der Titel ist – schon vor Monaten angefangen. Wir fordern seit Monaten gerade auch für die Kommunikation einen interdisziplinären Pandemierat, um die verschiedenen wissenschaftlichen Aspekte, die in einer Pandemie eine Rolle spielen, auch tatsächlich zusammenzuführen und Maßnahmen zu entwickeln, die wirklich helfen und nicht nur diesen Eindruck erwecken.\n\n({6})\n\n– Das Letzte, was mir einfiele, wäre, Nazis zu zitieren.\n\nMeine Damen und Herren, man sagt: In einer Krise schlägt die Stunde der Exekutive. – Das ist richtig. Aber in einer Demokratie gehört mehr dazu, nicht nur eine gut funktionierende Regierung oder, wenn wir in die Bundesländer gucken, gut funktionierende Landesregierungen, sondern aktive, problemlösungsorientierte Parlamente und vor allem ihre demokratischen Fraktionen sowie die vielen Akteure in den Gesundheitsämtern, auf den Intensivstationen, in Pflegeheimen, in anderen Berufen und ihre Verbände, die Zivilgesellschaft und die vielen Bürgerinnen und Bürger, die die Maßnahmen verstehen wollen, die die Maßnahmen nachvollziehen wollen und auch wollen, dass sie sie umsetzen können. Und auch das ist eine soziale Frage. Wir haben eine Spaltung der Gesellschaft, die auch in sozialen Fragen voranschreitet, wenn wir dem nicht entgegenwirken.\n\n({7})\n\nDiese Chancen, meine Damen und Herren, die ich versucht habe aufzuzeigen, müssen jetzt die Regierung und wir gemeinsam hier als demokratisch gewähltes Parlament ergreifen, zusammen mit allen Demokratinnen und Demokraten.\n\nIch danke Ihnen für Ihre Aufmerksamkeit.\n\n({8})"
"1053684","Tabea","Rößner","Grüne","Member of Parliament","2021-01-27T00:00:00.000Z","https://dip21.bundestag.de/dip21/btp/19/19205.pdf","\n\nFrau Präsidentin! Meine Damen und Herren! Die Bundesregierung will, wie schon deutlich geworden ist, das Patentrecht vereinfachen oder klarstellen, wie Sie gesagt haben, Herr Staatssekretär Lange. Das ist ein wichtiges Thema, weil Innovation auch ganz stark von einem starken Patentschutz abhängt.\n\nDas Herzstück unseres hohen Schutzniveaus für Patente ist der Unterlassungsanspruch; aber genau den wollen Sie aufweichen. Das sehe ich kritisch, weil dies den Innovationsstandort Deutschland bedroht.\n\n({0})\n\nWarum? Der Unterlassungsanspruch ist aktuell das einzige Rechtsinstrument, mit dem eine Patentinhaberin verhindern kann, dass ihre patentierte Erfindung ohne ihre Zustimmung weitergenutzt wird. Nun wollen Sie also einen Ausschluss des Unterlassungsanspruches aus Gründen der Verhältnismäßigkeit festschreiben.\n\nIch will Ihnen keinen bösen Willen unterstellen, aber Ihre Argumente tragen da nicht. Zum einen wird immer wieder auf das Szenario verwiesen – Kollege Jung hat das auch gemacht –, dass bei einem Unternehmen eine komplette Produktserie lahmgelegt werden könnte, wenn nur ein einziges Patent verletzt und der Unterlassungsanspruch geltend gemacht wird. Nur: In der Realität kommt das sehr, sehr selten vor.\n\nZum anderen verweisen viele auf die Regelung in den USA. Der Vergleich zwischen Deutschland und den USA ist aber ein Vergleich von Äpfeln mit Birnen, weil wir völlig unterschiedliche Rechtssysteme haben. In den USA sorgen astronomisch hohe Schadensersatzsummen bei Patentverletzungen für Abschreckung, in Deutschland haben wir den Unterlassungsanspruch als ein scharfes Schwert und brauchen diese finanzielle Drohkulisse deshalb gar nicht. Ausgerechnet dieses scharfe Schwert wollen Sie jetzt abstumpfen. Das verstehe ich nicht.\n\n({1})\n\nEs wurde schon gesagt: Es wären leider wieder gerade die kleinen und mittleren Unternehmen und Start-ups, die gegenüber großen Konzernen ins Hintertreffen geraten würden. Geht ein kleines Start-up gegen einen großen Konzern wegen einer Patentverletzung vor, macht das Unternehmen Unverhältnismäßigkeit geltend. Der eigentliche Rechtsstreit zieht sich dann über Jahre hin, das Start-up ist irgendwann pleite. Bei einem Prozesserfolg käme die Entschädigung nur noch der Insolvenzmasse zugute. Das kann nicht in unserem Interesse sein.\n\nWenn deutsche KMUs sich nicht mehr darauf verlassen können, dass die Ergebnisse ihrer langjährigen Investitionen in Forschung und Entwicklung effektiv geschützt werden, schädigt das die Bereitschaft, in Innovation zu investieren.\n\nEin kurzes Wort zur Impfstoffdebatte, weil das ja auch immer wieder im Zusammenhang mit dem Patentrecht debattiert wird. Die Pandemie lässt sich nur erfolgreich bekämpfen, wenn auch die Länder im Globalen Süden Zugang zu Impfstoffen haben. Daher würde ich eine temporäre Aussetzung der Patentrechte an den Coronaimpfstoffen in der jetzigen Pandemie begrüßen. Selbst die Bundeskanzlerin hat den Impfstoff als globales öffentliches Gut bezeichnet. Es fällt der Bundesregierung jetzt aber auf die Füße, dass sie bisher ziemlich knauserig bei den Investitionen in die Forschung war. Ich hoffe, Sie lernen daraus und nehmen in Zukunft mehr Geld für die Forschungsförderung in die Hand. Das wird nach der Novelle wahrscheinlich noch nötiger werden.\n\nVielen Dank.\n\n({2})"
"1053701","Wolfgang","Strengmann-Kuhn","Grüne","Member of Parliament","2021-01-27T00:00:00.000Z","https://dip21.bundestag.de/dip21/btp/19/19205.pdf","\n\nFrau Präsidentin! Liebe Kolleginnen und Kollegen! Die Krise zeigt sehr deutlich, wo es Lücken in unserem sozialen Netz gibt, und davon sind insbesondere die Selbstständigen sehr stark betroffen.\n\nDie Lösung der Bundesregierung besteht darin, sie zum Jobcenter zu schicken und ihnen verbesserte Möglichkeiten für die Grundsicherung zu bieten, was wir unterstützt haben. Nach einigen Monaten – es ist fast schon ein Dreivierteljahr – sieht man aber: Das hilft nicht. Als wir das damals beschlossen haben, hieß es vonseiten der Bundesregierung, dass bis zu 1 Million Selbstständige Anspruch auf Grundsicherung haben könnten. Wenn man sich die Zahlen anschaut, erkennt man, dass die Grundsicherungszahlen für Erwerbstätige gar nicht gestiegen sind. Das heißt, die Selbstständigen nehmen das Angebot nicht in Anspruch; das Geld kommt bei ihnen nicht an. Und das müssen wir ändern.\n\n({0})\n\nEs gibt aus unserer Sicht vor allen Dingen zwei Schlussfolgerungen daraus.\n\nDie erste Schlussfolgerung: Wir müssen Hartz IV überwinden, und das würde insbesondere den Selbstständigen zugutekommen. Wir haben dazu gerade ein Konzept vorgelegt, in dem wir sagen, dass wir keine aufwendige Vermögensprüfung wollen. Wir wollen bei Nichtverheirateten das Partnerinnen- und Partnereinkommen nicht anrechnen. Wir wollen, dass bei Selbstständigen oder Erwerbstätigen, wenn sie Garantiesicherung beziehen, zusätzliche Einnahmen nicht vollständig angerechnet werden. Zudem wollen wir prüfen, ob wir die Garantiesicherung ins Steuersystem integrieren können. Das würde gerade Selbstständigen besonders helfen.\n\n({1})\n\nDie zweite Schlussfolgerung: Wir wollen die Arbeitslosenversicherung ausweiten. Wir haben schon vor einem Jahr, noch bevor es mit Corona richtig losging, hier einen Antrag eingebracht, in dem wir gesagt haben, dass wir die Arbeitslosenversicherung zu einer Arbeitsversicherung weiterentwickeln wollen. Einer der Forderungspunkte lautete, dass wir die freiwillige Arbeitslosenversicherung für alle Selbständigen öffnen wollten. Es hat sich gezeigt, wie gut es gewesen wäre, wenn auch die Selbstständigen jetzt Kurzarbeitergeld bekommen hätten.\n\nDas ist übrigens ein Aspekt, der in dem Antrag der Linken fehlt. Sie sprechen über die Beitragsseite, was sehr richtig ist, und Sie sprechen über die Probleme, was ebenfalls sehr richtig ist. Nicht enthalten ist jedoch die Leistungsseite. Aus unserer Sicht ist es wichtig, dass es nicht nur bei den Beiträgen eine Gleichstellung mit den abhängig Beschäftigten gibt, sondern auch auf der Leistungsseite, damit Selbstständige nicht nur Arbeitslosengeld bekommen, sondern auch Kurzarbeitergeld. Auch das ist eine wichtige Schlussfolgerung aus dieser Krise.\n\n({2})\n\nDas sind alles Schlussfolgerungen für die Zukunft. Was wir aber jetzt sofort brauchen, und was die Bundesregierung immer noch nicht gemacht hat, ist eine schnelle, unbürokratische Lösung, um das Existenzminimum für Selbstständige, freiberuflich Tätige und Künstlerinnen und Künstler endlich schnell und unbürokratisch abzusichern.\n\n({3})\n\nDa ist die Bundesregierung immer noch gefordert.\n\nVielen Dank.\n\n({4})"
