id,firstname,lastname,faction,position,date, url,speech
"1021956","Omid","Nouripour","Grüne","Member of Parliament","2019-03-21T00:00:00.000Z","https://dip21.bundestag.de/dip21/btp/19/19089.pdf","\n\nFrau Präsidentin! Meine Damen und Herren! Der Parlamentsvorbehalt ist eine sehr ernste Sache. Er dient dazu, die Entsendung von Militär in Konflikte oder potenziell gefährliche Regionen durch gewählte Volksvertreterinnen und Volksvertreter zu legitimieren.\n\n({0})\n\nEr schafft damit auch eine Verantwortung dieses Hauses für diejenigen Soldatinnen und Soldaten, die wir entsenden, und er schafft eine Verantwortung für die politischen Kontexte, in denen sie handeln. Doch diese Verantwortung können wir nur übernehmen, wenn wir wissen, wofür. Eine Aussage dazu findet sich in diesem Mandatstext leider mitnichten konkret wieder.\n\n({1})\n\nDie Bundesregierung fordert von uns nun also zum vierten Mal einen Blankoscheck. Wir werden das vierte Mal einen solchen Blankoscheck nicht ausstellen.\n\n({2})\n\nDie Frage nach dem Sinn dieses Mandates ist bereits in der ersten Lesung und auch in den Ausschussberatungen ausführlich diskutiert worden. Der Kollege Lindner hat diese Frage für meine Fraktion in der ersten Lesung auch konkret gestellt. Der sinnvolle Kern dieser Mission könnte ja auch durch NATO-Routine übernommen werden.\n\nDer seerechtliche Kern aller Missionen im Mittelmeerraum – das betrifft sowohl Sophia als auch Sea Guardian –, nämlich die Rettung der zahllosen Schiffbrüchigen im Mittelmeer, wird zurzeit durch die Regierung in Rom torpediert. Wenn Boote voller Menschen, die knapp dem Tod entronnen sind, in Europa nicht nur keinen Hafen finden, sondern diejenigen, die sie retten, und zwar gemäß dem internationalen Seerecht retten, nun auch strafrechtlich verfolgt werden, dann ist das schlicht eine politische und moralische Bankrotterklärung,\n\n({3})\n\nvor allem wenn man sich ansieht, was den Menschen droht, wenn sie in Lager nach Libyen zurückgebracht werden, die im Übrigen teilweise von der gleichen Küstenwache betrieben werden, die die EU nun auszubilden versucht. Sie alle kennen die Bilder von menschenunwürdigen Gefängnissen und Sklavenauktionen, die Geschichten von Erpressung und Misshandlung.\n\nEs wäre doch eine Erleichterung, wenn wir das Gefühl hätten, dieses Mandat wäre nur überflüssig. Das ist aber nicht so. Es ist und bleibt ein gefährliches Mandat; denn es beinhaltet die Möglichkeit, dass die Bundeswehr sich ohne weitere Konsultationen am Kapazitätsaufbau und am Informationsaustausch mit allen Mittelmeeranrainern beteiligt – mit allen! Schauen wir uns mal ein paar Beispiele an. Das Beispiel Libyen habe ich gerade genannt.\n\nSchauen wir uns mal das Beispiel Ägypten an: Die angeschobene Verfassungsänderung wird die Demokratie in diesem Land, eine Demokratie, die ohnehin seit einigen Jahren nur noch auf dem Papier besteht, endgültig zerstören. Ein Land im Übrigen, von dem ranghohe Offizielle in diesen Tagen proklamiert haben, die Menschenrechte würden nicht universell gelten. Wer trägt diese Entwicklung in Ägypten? Es ist das Militär, das den Sicherheitssektor, die Wirtschaft und nun demnächst auch mit Brief und Siegel den gesamten Staat kontrolliert. Und Sie wollen von uns einen Blankoscheck, damit Sie mit diesem Militär so zusammenarbeiten können, dass Sie es ertüchtigen und mit ihm Kapazitätsaufbau betreiben? Sie wollen, dass wir Ihnen einen Blankoscheck dafür geben, dass Sie Informationen zu Terrorismus mit einem Staat austauschen, in dem es mittlerweile gang und gäbe ist, dass zivilgesellschaftliche Akteure einfach als Terroristen annonciert und ins Gefängnis gesteckt werden?\n\nIch gebe Ihnen ein Beispiel. Es gibt einen Musiker, er heißt Rami Sidky – er ist im Übrigen frischgebackener Vater eines Kindes mit deutschem Pass –, der wegen eines Liedes, mit dem er gar nichts zu tun hat, verhaftet wurde und nun der Mitgliedschaft in einer terroristischen Vereinigung angeklagt wird. Sie wollen, dass wir jetzt zustimmen, dass Sie mit einem solchen Land Informationsaustausch über Terrorismus bei einem so ausgeleierten und missbrauchten Terrorismusbegriff betreiben? Das werden wir nicht tun.\n\n({4})\n\nIch könnte weitere Beispiele nennen. In Algerien gehen Millionen Menschen auf die Straße, um gegen die autokratische Gerontokratie dort zu protestieren. Sie wollen von uns, dass wir Ihnen einen Blankoscheck für eine militärische Kooperation mit dieser Diktatur geben? Das ist ein falscher Weg. Diesen falschen Weg werden Sie allein gehen müssen.\n\n({5})"
"1021977","Agnes","Malczak","Grüne","Member of Parliament","2019-03-21T00:00:00.000Z","https://dip21.bundestag.de/dip21/btp/19/19089.pdf","\n\nSehr geehrte Frau Präsidentin! Meine Damen und Herren! Einmal mehr haben sich die Erzfeinde Salva Kiir und sein früherer Vize Riek Machar im September auf ein Friedensabkommen geeinigt. Die Gewalt wurde aber nicht beendet. Man kann nur hoffen, dass dieses Abkommen trotzdem auf der langen Strecke erfolgreicher ist als seine Vorgänger, die alle, ehrlich gesagt, nur für die Tonne waren.\n\nMan kann das nur hoffen, gerade auch für die Angehörigen der mittlerweile über 400 000 Opfer, für die Millionen Vertriebenen und Geflüchteten. In dieser düsteren Situation ist die Friedensmission der Vereinten Nationen für viele Menschen noch die beste, manchmal auch die einzige Chance auf ein kleines bisschen an Sicherheit und ein kleines bisschen an Hilfe.\n\nImmer noch befinden sich 190 000 Menschen in den Camps. Sie haben dort Zuflucht gefunden. Ich kann allen nur danken, die sich trotz dieser schrecklichen Lage für die Menschen im Südsudan engagieren, sie nicht alleinlassen; das gilt für die Soldatinnen und Soldaten, es gilt aber natürlich auch für die zivilen Helferinnen und Helfer.\n\n({0})\n\nIch will auch gar nicht verschweigen: Natürlich gibt es Probleme, es gibt Unzulänglichkeiten, es gab sogar sehr große Fehler im Rahmen von UNMISS in den vergangenen Jahren. Gerade an eine Friedensmission der Vereinten Nationen müssen besonders hohe Maßstäbe angelegt werden, und gerade da müssen Verfehlungen besonders hart geahndet werden.\n\nMeine Damen und Herren, von drei Frauen im Südsudan haben zwei sexualisierte Gewalt erlebt. Gerade dieses wichtige Feld, der Kampf gegen sexualisierte Gewalt, darf kein blinder Fleck dieser Friedensmission sein, sondern muss zu einem neuen Schwerpunkt werden, dass man hier mehr tut.\n\n({1})\n\nAber so eine Friedensmission kann eben auch nur besser werden, sie kann nur dann mehr zu einer positiven Entwicklung beitragen, wenn die internationale Gemeinschaft und insbesondere ihre stärksten Schultern mehr tragen. Jedes Jahr betteln die Vereinten Nationen bei den Mitgliedstaaten um mehr Geld angesichts dieser humanitären Katastrophe. Es kommt aber nicht genug zusammen. Das darf doch einfach nicht sein!\n\n({2})\n\nAuch Deutschlands personeller Beitrag ist mit 14 Soldaten – bei einer ohnehin schon sehr geringen Mandatsobergrenze von 50 – nur symbolischer Art. Auch hier könnte die Bundesregierung die Vereinten Nationen endlich deutlich mehr unterstützen.\n\nMachar und Kiir dürfen angesichts ihrer üblen Verbrechen nicht einfach so weitermachen wie bisher; sie gehören, ehrlich gesagt, vor ein internationales Gericht gestellt, wo sie zur Rechenschaft gezogen werden.\n\n({3})\n\nAber vor allem muss eines endlich aufhören: dass Waffen in diesen Konflikt gelangen, dass sie ihn weiter verlängern und verschärfen. Es hat lange gedauert, viel zu lange, bis endlich das Waffenembargo kam. Es muss auf jeden Fall verlängert werden.\n\nAllerdings habe ich neulich wie auch viele Zuschauerinnen und Zuschauer meinen Augen und Ohren nicht getraut, als in der ARD eine Reportage lief, in der es darum ging, dass während der Zeit, als sich diese Bundesregierung für ein Waffenembargo einsetzte, während der Zeit, als deutsche Soldatinnen und Soldaten an UNMISS teilnahmen, angeblich ein BND-Mitarbeiter in illegale Waffentransporte in den Südsudan verwickelt war. Wir erwarten, dass die Bundesregierung nicht weiter die Auskunft verweigert, ob diese krasse Geschichte eigentlich stimmt oder nicht. Es geht gar nicht, dass Sie dem Parlament hier keine Auskunft geben.\n\n({4})\n\nMeine Damen und Herren, es mag noch ein sehr langer und ein sehr steiniger Weg sein, bis Frieden und Sicherheit im Südsudan ansatzweise eine Chance auf Realität bekommen. Aber dieser Weg wäre noch deutlich unwahrscheinlicher, wenn es diese Mission nicht gäbe. Deshalb werden wir Grünen heute dem Mandat zustimmen.\n\nVielen Dank.\n\n({5})"
"1022897","Kai","Gehring","Grüne","Member of Parliament","2019-04-05T00:00:00.000Z","https://dip21.bundestag.de/dip21/btp/19/19093.pdf","\n\nHerr Präsident! Liebe Kolleginnen und Kollegen! Nach einem Jahr im Amt legt Ministerin Karliczek ihren ersten Gesetzentwurf vor. Damit haben Sie zwar Horst Seehofer als untätigsten Minister abgehängt, aber im Ernst, Frau Karliczek: Ihre Änderungsvorschläge zum BAföG sind nichts weiter als eine Alibinummer. Statt einer Strukturreform der Studienfinanzierung legen Sie eine halbgare Novelle vor, und das reicht einfach nicht.\n\n({0})\n\nIhren Entwurf wird der Bundestag überarbeiten müssen, damit tatsächlich ein Plus für Bildungsgerechtigkeit herauskommt. Der Wohlstand unseres Landes beruht auf Bildung, und dafür brauchen Schüler, Studierende und ihre Familien bestmögliche Unterstützung.\n\n({1})\n\nÜbrigens: Unter Schwarz-Gelb ging es dem BAföG historisch immer am schlechtesten. Daher ist es unglaublich unglaubwürdig, wie die FDP hier aufgespielt hat.\n\nEs gibt so viele Studierende wie nie zuvor, aber BAföG erhalten nur noch die wenigsten. 87 Prozent der Studierenden sind außen vor. Allein zwischen 2013 und 2017 ist die Zahl der BAföG-Empfänger um 200 000 gesunken – ein verheerender Abschwung und Folge Ihrer miserablen BAföG-Politik.\n\n({2})\n\nAuf rekordverdächtige Höhen angestiegen ist nur die Zahl der Studierenden in Nebenjobs, um irgendwie über die Runden zu kommen. Eine 60-Stunden-Woche hält auf Dauer niemand durch. Wir wollen keine Abbrüche provozieren, sondern Studienerfolge finanzieren.\n\n({3})\n\nWo Studienfinanzierung versagt, wird am Nötigsten gespart. Bei den einkommensschwächsten Studierenden liegen laut DSW die Ausgaben fürs Essen zum Teil unter dem physiologischen Existenzminimum. Das heißt, einige sparen sich das Studium vom Munde ab. Das ist eine Schande für unser reiches Land. Das BAföG muss zum Leben reichen.\n\n({4})\n\nStatt zuverlässig mehr in Bildungsgerechtigkeit zu investieren, handelt die Ministerin beim BAföG nach Gutsherrenart. Freihändig hebt sie in zwei Kleckerschritten die Fördersätze an, die Freibeträge sogar in drei Schrittchen. Warum kommen diese Erhöhungen nicht sofort in einem Rutsch zum nächsten Semester? Nach sechs BAföG-Nullrunden für Studierende müssen Sie klotzen statt kleckern.\n\n({5})\n\nMich wundert es nicht, dass der Bundesrat, die Gewerkschaften, sogar die Arbeitgeber, Studierendenverbände und das Deutsche Studentenwerk unisono sagen: Die geplanten Änderungen reichen nicht.\n\n({6})\n\nRecht haben sie. Was Sie vorlegen, ist eben keine Trendumkehr; das ist Mangelverwaltung.\n\n({7})\n\nWas muss konkret geändert werden? Wir meinen, Fördersätze und Freibeträge müssen sofort um mindestens 10 Prozent steigen und danach automatisch und regelmäßig, damit Schluss ist mit Willkür.\n\nStudentisches Wohnen liegt uns in der Tat auch am Herzen, Frau Karliczek, und natürlich braucht es mehr Wohnheimplätze. Aber wo bleibt denn dann die Karliczek-­Seehofer-Initiative für ein Bauprogramm für studentisches Wohnen? Dafür sind Sie doch auch in der Verantwortung.\n\n({8})\n\nNichtsdestotrotz müssen Sie bei der Wohnpauschale dringend nachbessern: Denn in München oder Hamburg finden Studierende für die 325 Euro, die Sie vorsehen, nirgendwo eine Bleibe. Darum ist eine Pauschale auf Basis der Stufen des Wohngeldgesetzes die richtige und gerechtere Antwort.\n\n({9})\n\nWer studieren will, soll den Studienort danach aussuchen, wo das Studienangebot passt. Frau Karliczek riet, man möge dort studieren, wo man es sich leisten kann. Und das ist wirklich zynisch. Wenn Sie Exzellenzuniversitäten in teuren Städten fördern, dann müssen junge Talente armer Eltern auch dort studieren können. Wir wollen Bildung und Forschung in der Spitze und in der Breite fördern; nur das ist fair.\n\n({10})\n\nWeitere Reformpunkte, die überfällig sind: Unterstützung von Studierenden, die Angehörige pflegen, BAföG-Öffnung für Teilzeitstudierende, Förderung von Orientierungssemestern, die Förderlücke für Geflüchtete schließen. Das alles sind Fortschritte, die nicht nur wir, sondern auch der Bundesrat fordern. Sie gehören in die Novelle. Bessern Sie also nach!\n\n({11})\n\nMehr Fortschritt brauchen wir auch bei der Vereinfachung von Anträgen und beim Online-BAföG. 590 Onlineanträge gab es im Zeitraum Juni 2017 bis April 2018. Das bewegt sich im lächerlichen Promillebereich. Den BAföG-Antrag an jeder Milchkanne ausfüllen zu können, muss der Anspruch sein. Dafür sollten Sie streiten, Frau Karliczek.\n\n({12})\n\nIhre halbgare Novelle setzt auf Tarnen statt auf Transparenz. Die Regierung will den BAföG-Bericht von 2019 in das Jahr 2021 verschleppen. Dabei sagt das Gesetz klipp und klar: Alle zwei Jahre hat die Regierung dem Bundestag diesen Bericht vorzulegen. Und das aus einem guten Grund: So können wir flott auf Reformbedarfe reagieren und das BAföG auf der Höhe der Zeit halten. So soll es sein, und so soll es auch bleiben.\n\n({13})\n\nUnion und SPD haben ganz offensichtlich keine Idee, wie sie den krassen Bedeutungsverlust des BAföGs stoppen. Die Debatte über die Weiterentwicklung der Studienfinanzierung ist überfällig. Wir wollen sie seit langem führen, FDP und Linke auch.\n\nAls Grüne im Bundestag schlagen wir vor, das BAföG zu einem Zwei-Säulen-Modell auszuweiten: Wir wollen einen Studierendenzuschuss als Basis für alle plus einen Bedarfszuschuss für Studierende einkommensarmer Eltern. Beide Säulen sollen Vollzuschüsse sein; damit senken wir die Sorge vor Verschuldung auf null.\n\n({14})\n\nDas Gute am BAföG erhalten und die Nachteile korrigieren, darauf zielt unser Zwei-Säulen-Modell; denn die staatliche Studienfinanzierung muss gerechter, verlässlicher und leistungsfähiger werden.\n\n({15})\n\nMinisterin Karliczek, fangen Sie doch mal an zu kämpfen! Und Herr Minister Scholz – trotz der Klingbeil-­Oppositionsrede ist ja auch die SPD in der Regierung –,\n\n({16})\n\nöffnen Sie endlich Ihr Portemonnaie für ein besseres BAföG!\n\n({17})\n\nDenn ohne deutliche Korrekturen am Entwurf der 26. BAföG-Novelle, ohne eine echte Reform droht der 50. Geburtstag des BAföGs 2021 eher ein Trauerspiel als eine Freudenfeier zu werden. Sorgen Sie für eine Feier!\n\n({18})"
"1021768","Anton","Hofreiter","Grüne","Member of Parliament","2019-03-21T00:00:00.000Z","https://dip21.bundestag.de/dip21/btp/19/19089.pdf","\n\nSehr geehrter Herr Präsident! Liebe Kolleginnen und Kollegen! Sehr geehrte Frau Bundeskanzlerin, Sie werden auf dem jetzt anstehenden Gipfel wieder mit den Folgen des Chaos in der britischen Politik konfrontiert sein. Wenn man sich anschaut, wie die Europäische Union bisher mit den Folgen des Brexit-Chaos umgegangen ist, dann sieht man: Es war geprägt von Entschlossenheit und Solidarität. Das ist vielleicht das einzig Positive in dieser Tragödie. Selbstverständlich bleibt uns Großbritannien weiter und dauerhaft willkommen. Aber was wir nicht zulassen dürfen, was Sie nicht zulassen dürfen, ist, dass das Chaos der britischen Politik auf die Europäische Union und die Europawahl übergreift. Deshalb muss man ganz klar sagen: Fristverlängerung nur dann, wenn es eine Idee davon gibt, wofür die zusätzliche Zeit genutzt werden soll.\n\n({0})\n\nUnd mit Entschlossenheit und Solidarität geht man auch am besten die großen Herausforderungen an, vor denen Deutschland und die Europäische Union stehen. Das ist ein konsequenter Klimaschutz, das ist beispielsweise der Erhalt unseres Wohlstands bei verstärktem Wettbewerb mit anderen Systemen wie zum Beispiel dem diktatorischen, aber erfolgreichen China, das ist die Durchsetzung sozialer Gerechtigkeit – all dies wird kein Nationalstaat alleine schaffen. Eine selbstbewusste und solidarische Europäische Union ist das beste Mittel, um diese politischen Ziele zu erreichen.\n\n({1})\n\nDas Problematische ist nur: Von Entschlossenheit und Solidarität kann in Ihrer Europapolitik leider keine Rede sein. Bei zentralen Projekten stehen Sie auf der Bremse. Nehmen wir die Steuer für Digitalkonzerne. Frau Nahles spricht davon, dass Herr Scholz da nicht im Wege stand. Herr Scholz hat mit dazu beigetragen, dass die Digitalsteuer so kleingehäckselt worden ist, dass man sie fast nicht mehr erkennen konnte.\n\n({2})\n\nIch frage mich ehrlich gesagt schon, warum ein sozialdemokratischer Finanzminister auf der Seite von Apple, Google, Facebook steht. Wo sind denn Ihre Wurzeln? Kämpfen Sie doch dafür, dass diese Konzerne auch in Europa endlich Steuern zahlen!\n\n({3})\n\nUnd wenn Herr Brinkhaus von dem Video von Herrn Weber schwärmt, dann kann man nur sagen: Die Uploadfilter schaden Urhebern, und damit verlieren Sie die junge Generation. Aber vielleicht hätten die Uploadfilter dazu beigetragen, uns mit diesem Video zu verschonen. Dann hätten sie wenigstens einen Zweck erfüllt.\n\nWir hören, dass Frau Merkel davon schwärmt, dass es endlich eine Batteriefabrik in Deutschland und in Europa geben sollte, damit die Elektromobilität durchgesetzt werden kann. Wir hören das zwar, fragen uns aber: Frau Merkel, wissen Sie, dass Herr Scheuer Ihr Verkehrsminister ist?\n\n({4})\n\nHerr Scheuer ist eines der Haupthindernisse für die Umsetzung der emissionsfreien Mobilität in Deutschland und in Europa.\n\n({5})\n\nSie müssen endlich für eine andere Verkehrspolitik sorgen. Sie müssen endlich dafür sorgen, dass die Infrastruktur in Deutschland ausgebaut und benutzbar wird. Dann würden wir anfangen, daran zu glauben, dass Ihren Worten auch Taten folgen.\n\nBesonders problematisch ist, wie Sie mit unserem wichtigsten Partner Frankreich umgehen. Von einem einzigen Beispiel, den Rüstungsexporten, abgesehen, hören wir seit vielen Jahren nur dröhnendes Schweigen aus dem Kanzleramt auf all die Appelle, die Macron an uns gerichtet hat. Ausgerechnet bei den Rüstungsexporten wollen Sie nun die europäische Fahne hochhalten und sprechen davon, dass am Ende die Wahrheit konkret ist.\n\nDie Wahrheit ist konkret: Wir haben europäische Rüstungsexportrichtlinien, und zwar seit 2008. Diese sind an klaren menschenrechtlichen Standards ausgerichtet. Deshalb sage ich Ihnen an diesem Beispiel: Wenn Sie hier wirklich Europa verteidigen wollen würden, dann würden Sie nicht gemeinsam mit Frankreich gegen Europa und gegen europäische Regelungen agieren, sondern würden versuchen, die europäischen Regelungen, die jetzt seit über zehn Jahren in Kraft sind, zur Geltung zu bringen.\n\n({6})\n\nProblematisch ist auch, dass man den Eindruck hat, dass die Zuständigkeit für diesen gesamten Bereich vom Kanzleramt ins Konrad-Adenauer-Haus gewandert ist; denn von dort kam nach vielen Jahren des Schweigens eine Antwort auf die Fragen des französischen Präsidenten. Dazu kann man nur sagen: Wenn die CDU-Vorsitzende geschwiegen hätte, dann wäre sie eine Europäerin geblieben. Die Antwort Ihrer Vorsitzenden, liebe Kolleginnen und Kollegen von der CDU, provoziert nämlich mit Absurditäten wie der Straßburg-Debatte und der bereits erwähnten Idee eines gemeinsamen Flugzeugträgers mit Frankreich, der in keiner einzigen seriösen Verteidigungsdebatte wirklich eine Rolle spielt.\n\nZu all dem könnte man noch sagen: Mein Gott, das ist eben ein bisschen lächerlich. – Doch Frau Kramp-­Karrenbauer legt damit die Axt an die Wurzel der Gemeinschaftsmethode. Und das ist hochproblematisch.\n\n({7})\n\nSie hatten in Ihrem Koalitionsvertrag noch davon gesprochen, dass Sie „einen Rahmen für Mindestlohnregelungen sowie für nationale Grundsicherungssysteme in den EU-Staaten entwickeln“ wollen. Sie hatten davon gesprochen, dass Sie einen „Aufbruch für Europa“ organisieren wollen. Nach dieser Antwort der CDU-Vorsitzenden und dem lauten Schweigen der SPD bei den entscheidenden Punkten muss man leider sagen: Nach einem Jahr des Nichtstuns ist von dieser Koalition auch nichts mehr zu erwarten. Wir haben die große Sorge, dass diese Koalition europapolitisch fertig hat. Und das wäre mehr als bitter für die Europäische Union.\n\nVielen Dank.\n\n({8})"
"1021778","Franziska","Brantner","Grüne","Member of Parliament","2019-03-21T00:00:00.000Z","https://dip21.bundestag.de/dip21/btp/19/19089.pdf","\n\nSehr geehrter Herr Präsident! Sehr geehrte Damen und Herren! Auch nach dieser Debatte und nach dieser Regierungserklärung ist wieder einmal klar: Aufbruch für Europa ist und bleibt die Fata Morgana dieser Bundesregierung.\n\n({0})\n\nFrau Merkel, Herr Scholz, man kann Europa auch durch Nichtstun kaputtmachen. Ich nenne Ihnen ein konkretes Beispiel. Sie werden auf dem Gipfel auch über den nächsten EU-Haushalt reden. Hier gibt es eine Frage: Wie viel Geld aus diesem Haushalt soll dem Klimaschutz dienen? Frankreich fordert 40 Prozent, die Bundesregierung sagt: 25 Prozent. Das ist das Ausbremsen des Klimaschutzes durch diese Bundesregierung. Das bringt Europa nicht voran, sondern gefährdet die nächsten Generationen.\n\n({1})\n\nBei dieser Verweigerung wundere ich mich, dass die Schülerinnen und Schüler nur einen Tag streiken und nicht die ganze Woche.\n\n({2})\n\nJetzt geht es um Orban, Europa und Demokratie. Die EVP hat die Suspendierung von Fidesz beschlossen. Das ist ein politischer Trick. Aber das eigentlich Krasse sind die drei Kriterien: Du sollst dich bei deinen Parteifreunden entschuldigen. Du sollst aufhören, Herrn Juncker auf Plakaten böse zu machen. Du sollst eine bayerische Rettung deiner Uni zulassen. – Hören Sie sich einmal in Ungarn um: Was wollen die Menschenrechtsaktivisten? Sie wollen Pressefreiheit, Pressefreiheit, Pressefreiheit. Sie wollen Wissenschaftsfreiheit, Wissenschaftsfreiheit, Wissenschaftsfreiheit. Und sie wollen eine freie Zivilgesellschaft. Das müssten die Kriterien Ihrer Partei sein, wenn Sie es mit Demokratie und Rechtsstaatlichkeit ernst meinen\n\n({3})\n\nund es Ihnen nicht nur um die Macht und Herrn Weber als nächsten Kommissionspräsidenten geht. Von seinem schönen Filmchen haben wir heute schon gehört.\n\n({4})\n\nFür Europa ist auch auf die Konservativen in Großbritannien kein Verlass. Ich finde es mittlerweile einfach tragisch, dass die Regierungschefin May immer noch nicht bereit ist, ihr Land über ihre Partei zu stellen.\n\n({5})\n\nIch kann es überhaupt nicht nachvollziehen, dass eine konservative Regierungschefin bis zur letzten Sekunde sagt: Meine Partei ist aber wichtiger als dieses Land, als Europa, als alles, was wir zusammen aufgebaut haben.\n\n({6})\n\nDas ist verantwortungslos. Das dürfen Sie ihr nicht durchgehen lassen.\n\n({7})\n\nDer Brexit darf nicht dazu führen, dass wir selber keine Zukunftsdebatten führen. Wir müssen in Europa handlungsfähiger werden. Wir wissen alle, ein Weg dahin ist die Abkehr vom Einstimmigkeitsprinzip bei der Außen- und Sicherheitspolitik, aber auch bei Steuerfragen. Herr Scholz könnte dann vielleicht noch schneller vorankommen. Deswegen beantragen wir heute: Abkehr vom Einstimmigkeitsprinzip hin zu qualifizierter Mehrheit bei der Außen- und Sicherheitspolitik sowie bei Steuerfragen. Alle haben sich dazu bis jetzt positiv geäußert. Deswegen sind wir sicher, dass wir gleich eine große Mehrheit in diesem Haus erfahren werden. Wir wollen Europa handlungsfähig machen. Das haben Sie immer gesagt. Jetzt können Sie auch beweisen, dass Sie dafür sind.\n\nIch danke Ihnen.\n\n({8})"
