id,firstname,lastname,faction,position,date, url,speech
"1054928","Kordula","Schulz-Asche","Grüne","Member of Parliament","2021-02-11T00:00:00.000Z","https://dip21.bundestag.de/dip21/btp/19/19209.pdf","\n\nFrau Präsidentin! Meine Damen und Herren! Gute Pflege darf kein frommer Wunsch sein, sondern muss das gemeinsame Ziel von uns allen sein. Gute Pflege beruht auf drei Faktoren: auf gut ausgebildetem und ausreichendem Personal, auf dem konkreten Bedarf eines jeden Pflegebedürftigen und seiner Familie und auf einer bedarfsgerechten und armutsfesten Finanzierung der Pflege.\n\nWie bekommen wir schnell und ausreichend gutes Personal? Durch eine gute Ausbildung, durch gute Bezahlung, durch Personalbemessung am Bedarf und durch die Aufwertung der Fachpflege und die Stärkung im Verbund der Gesundheitsberufe, in der Gesundheitsförderung, in der Prävention von Pflegebedürftigkeit, in der Pflege zu Hause, in der Pflege im Heim und in anderen Bereichen. Wir brauchen gut ausgebildete Pflegefachkräfte, die beraten, die Pflegediagnosen erstellen, die Therapien und Rehabilitationen durchführen können.\n\nUnser Vorschlag zur Reform der Pflegeversicherung besteht in der doppelten Pflegegarantie. Wir garantieren jedem Menschen, dass er die Pflege bekommt, die er auch tatsächlich braucht.\n\n({0})\n\nDer zweite Teil unserer doppelten Pflegegarantie garantiert: Pflegekosten dürfen nicht länger armmachen. Derzeit, meine Damen und Herren, beträgt der Eigenanteil in einem Heim für Bewohner rund 2 100 Euro im Monat; 830 Euro davon sind allein für die Pflege. Die Folge davon ist, dass immer mehr Menschen in die Sozialhilfe, in die Hilfe zur Pflege, finanziert durch die Kommunen, abrutschen. Das betrifft bereits jeden dritten Bewohner eines Heims. Meine Damen und Herren, das kann und das darf nicht sein, und das darf auch niemand wollen.\n\n({1})\n\nDeshalb schlagen wir vor, Folgendes zu tun, und zwar schnell und nach Möglichkeit noch in dieser Legislaturperiode: Wir müssen die Eigenanteile deutlich senken und festschreiben. Und: Wir müssen zudem die notwendige Pflege sicherstellen durch ein Case Management durch Pflegefachkräfte, die dafür speziell ausgebildet werden und ausgebildet sind. Das müssen wir jetzt auf den Weg bringen; denn am Ende der nächsten Legislaturperiode wird es zu spät sein. Wir laufen in einen demografischen Wandel hinein.\n\nFrau Westig, bei allem Respekt: Die jetzige Generation – das sind die geburtenstarken Jahrgänge – hat keine Zeit mehr, für ihre eigene Vorsorge zu sorgen. Hier müssen wir zu einer Lösung kommen, und zwar ganz, ganz schnell. Da hilft Ihre Kapitaldeckung überhaupt nicht.\n\n({2})\n\nGerade in der jetzigen Situation brauchen wir die Solidarität der Generationen miteinander und untereinander.\n\n({3})\n\nPflege muss gut sein, Pflege muss armutsfest sein, und die Finanzierung muss gerecht sein!\n\nIch danke Ihnen für Ihre Aufmerksamkeit.\n\n({4})"
"1054948","Katja","Keul","Grüne","Member of Parliament","2021-02-11T00:00:00.000Z","https://dip21.bundestag.de/dip21/btp/19/19209.pdf","\n\nSehr geehrte Frau Präsidentin! Liebe Kolleginnen und Kollegen! Das gesamte deutsche Namensrecht steht schon seit Längerem in der Kritik. Eine Arbeitsgruppe des Justizministeriums hat bereits ein Eckpunktepapier mit umfassenden Empfehlungen vorgelegt. Damit hat der hier vorgelegte Gesetzentwurf der Bundesregierung allerdings nichts zu tun. Hier werden heute überholte Begriffe und Ministeriumsbezeichnungen aus dem Deutschen Reich eliminiert, und das ist richtig und wichtig. Ausdrücklich werden allerdings keine inhaltlichen Änderungen vorgenommen.\n\nDie FDP hingegen hat tatsächlich einen wichtigen inhaltlichen Vorschlag unterbreitet. Ich gebe zu, dass ich zunächst skeptisch war, ob es wirklich sinnvoll ist, Kindern von Geburt an echte Doppelnamen zu geben. Die Anhörung im Dezember hat mich allerdings davon überzeugt, dass dies wichtig ist, um der Bedeutung von Autonomie und Persönlichkeitsrecht bei der Namenswahl gerecht zu werden.\n\n({0})\n\nGemeinsame Kinder mit echten Doppelnamen könnten dann, wenn sie selber heiraten, entscheiden, welchen Teil ihres Namens sie weiter tragen und welchen sie aufgeben wollen. Das wird bereits in anderen Ländern traditionell so praktisch gehandhabt, beispielsweise in Spanien oder in Brasilien.\n\nDas Konzept des kurz gehaltenen Ehenamens vermag das im internationalen Vergleich sehr restriktive Namensrecht nicht zu rechtfertigen. Eine Reform kann auch dazu beitragen, die immer noch überwiegende Dominanz des Mannesnamens abzuschwächen.\n\nBei der öffentlichen Anhörung im Rechtsausschuss bekam der Gesetzentwurf der FDP entsprechend positive Rückmeldungen der Sachverständigen. Die Kritik war allerdings, dass man sich hier das isolierte Herzstück der Reformvorschläge herausgepickt hat, ohne die komplizierteren sonstigen Probleme mitzuregeln. Es war die Rede von einer Insellösung, die zu weiterem Flickwerk führen würde.\n\nAls weiterer Regelungsbedarf wurden unter anderem benannt die Vereinheitlichung des dreigeteilten Rechtsweges zwischen Verwaltungsgericht, Familiengericht und Rechtspfleger, die Pflicht zur Namensänderung bei der Adoption Volljähriger, die Rückbenennung von Scheidungshalbwaisen und die Rechtslage bei gemischtnationalen Familien. Warum ist es beispielsweise für die vielen Frauen mit einem Namen sorbischen oder slawischen Ursprungs nicht möglich, die typische geschlechtsbezogene Form des Familiennamens zu verwenden? Warum gibt es nach wie vor so viele Fälle, in denen ein im Ausland rechtmäßig erworbener Name nach deutschem Namensrecht nicht anerkannt wird? Das Argument der Namenskontinuität kann dafür sicherlich nicht herangezogen werden.\n\nEs ist also deutlich geworden, dass das Namensrecht eine umfassende Überarbeitung benötigt. Der FDP-Antrag hat dieses Thema zu Recht auf die Tagesordnung des Rechtsausschusses gesetzt, und die Anhörung war auch sehr erkenntnisreich. Trotzdem gibt es für diese Insellösung von uns erst mal nur eine Enthaltung.\n\nDem Gesetzentwurf der Bundesregierung kann man nur zustimmen; denn das Deutsche Reich wollen wir sicher alle nicht mehr im Gesetzestext wiederfinden.\n\n({1})\n\nDie eigentliche Reform des Namensrechts steht uns allerdings noch bevor.\n\nVielen Dank.\n\n({2})"
"1054964","Omid","Nouripour","Grüne","Member of Parliament","2021-02-11T00:00:00.000Z","https://dip21.bundestag.de/dip21/btp/19/19209.pdf","\n\nFrau Präsidentin! Meine Damen und Herren! Vor zehn Jahren sind Tausende und Abertausende mutige Frauen und Männer in Sanaa das erste Mal auf die Straße gegangen, um zu kämpfen und zu demonstrieren für ihre Freiheit, für bessere Lebensbedingungen, für ihre Würde. Zehn Jahre später, heute, sehen wir im Jemen eine humanitäre Katastrophe, die sich in der Tat vielleicht noch mit der in Syrien messen lässt. In Syrien sind im Übrigen über eine halbe Millionen Menschen ums Leben gekommen, in erster Linie in der Verantwortung eines Präsidenten, den die AfD gern besucht hat. Deshalb sind hier die Verhältnisse in der Rede des Kollegen tatsächlich ein wenig aus den Fugen geraten.\n\n({0})\n\nHeute sehen wir im Jemen eine humanitäre Katastrophe, die auch vom Iran, von den Vereinigten Arabischen Emiraten und Ägypten massiv befeuert wird. Alle drei begehen dabei Völkerrechtsbruch: der Iran durch die Unterstützung einer illegitimen Regierung der Huthi, Saudi-Arabien durch das massive Verletzen des Grundsatzes der Verhältnismäßigkeit der Kriegsführung und die Vereinigten Arabischen Emirate – Herr Kollege Hardt, ich weiß nicht, wo Sie die letzten zwei Jahre waren – durch eine proaktive, auch militärische Unterstützung von Separatismus. Auch deswegen sind das, was Saudi-Arabien und was die Vereinigten Arabischen Emirate dort machen, zwei verschiedene Paar Schuhe. Aber beides ist zu verurteilen.\n\n({1})\n\nEs sind Krankenhäuser, es sind Flüchtlingslager, es sind Schulen, Getreidespeicher, Weltkulturerbestätten bombardiert worden. Menschen verschwinden in geheimen Gefängnissen, werden gefoltert, werden ermordet. Die humanitäre Hilfe wird Tag für Tag behindert. Das ist der Alltag im Jemen. Das ist eine Katastrophe. Und ja, alle begehen Kriegsverbrechen.\n\nDie Lage ist hochkomplex, die Lösung auch; aber es gibt Dinge, die sind nicht so komplex. Dazu gehört der Text des Koalitionsvertrages, dass man an die Staaten, die dort beteiligt sind, keine Waffen liefert. Im Übrigen ist das nicht nur ein Gebot des Koalitionsvertrages; es ist auch ein Gebot der Rüstungsexportrichtlinien dieser Bundesregierung, das endlich einzustellen.\n\n({2})\n\nDie Zahlen sind gewaltig: Rüstungsgüter im Wert von 750 Millionen Euro allein an Ägypten 2020, im Wert von 50 Millionen Euro an die Vereinigten Arabischen Emirate, und es geht einfach so weiter.\n\nDabei hatte Heiko Maas gesagt, dass der Jemen ein Schwerpunktthema der Mitgliedschaft Deutschlands im VN-Sicherheitsrat sein würde. Wenigstens klar zu benennen, wer alles dort das Völkerrecht bricht, das wäre das Mindeste gewesen, wenn man dort einen solchen Schwerpunkt setzt.\n\n({3})\n\nWir sehen ja an der US-Regierung, dass so viel mehr geht. Man sieht ja in den ersten Tagen der Biden-Administration, dass sie schon jetzt weit mehr gewagt hat als die Bundesregierung in den letzten drei Jahren.\n\nUnd ja, es ist extrem kompliziert, und wir haben es bei den Huthis mit ganz, ganz schwierigen Akteuren zu tun. Just als Biden erklärt hat, dass die Waffen nicht mehr nach Saudi-Arabien gehen werden, haben die Huthis ihre Offensive in der Provinz Marib verstärkt und weitere Kriegsverbrechen begangen.\n\n({4})\n\nQuasi als Antwort auf Bidens Angebot des Gespräches. Aber auch das zeigt, dass es nicht ausreichend ist, einfach Geld hinüberzuschieben, Entwicklungshilfe zu leisten und humanitäre Hilfe zu organisieren. Das ist notwendig, aber nicht ausreichend. Man kann nicht einfach die diplomatische Arbeit anderen überlassen. Deutschland muss da weit aktiver werden.\n\nDeshalb noch mal, wie wir es in unserem Antrag auch formulieren: Bitte Druck machen auf den Iran, die Huthis nicht mehr zu unterstützen, Druck machen auf Saudi-Arabien, humanitäre Hilfe ins Land zu lassen, Druck machen auf die Vereinigten Arabischen Emirate, damit die Verhandlungen einheitlicher verlaufen können und die jeminitischen Akteure wieder besser miteinander kooperieren. Und natürlich muss der Internationale Strafgerichtshof mit den zahlreichen Kriegsverbrechen befasst werden, und vor allem müssen die Kriegsverbrecher beim Namen genannt werden. Das ist das, was bisher schlichtweg fehlt.\n\n({5})\n\nAlles das, was ich sage, ist nicht ausreichend, um den Krieg im Jemen zu beenden. Aber das wären wirklich substanzielle Schritte, damit die Menschen, die vor zehn Jahren auf die Straße gegangen sind, eines Tages doch zu ihrem Traum kommen, in Frieden, in Würde und in Freiheit leben zu können.\n\n({6})"
"1054984","Kordula","Schulz-Asche","Grüne","Member of Parliament","2021-02-12T00:00:00.000Z","https://dip21.bundestag.de/dip21/btp/19/19210.pdf","\n\nHerr Präsident! Meine Damen und Herren! Die zahlreichen Debatten hier im Bundestag allein in dieser Woche zeigen, dass die Coronapandemie nach wie vor unser aller Leben bestimmt, dass die Lage ernst ist und gleichzeitig die Bürgerinnen und Bürger zunehmend mürbe werden und der Krise müde sind. Wir alle sehnen uns nach Normalität, nach einer Perspektive aus dieser Krise heraus.\n\nAber – so ehrlich müssen wir auch sein – wir sind noch nicht über den Berg. Deswegen ist ein weiteres Gesetz zur epidemischen Lage von nationaler Tragweite notwendig. Ich begrüße es ausdrücklich, dass jetzt die Regierungsfraktionen – und nicht allein die Regierung – die Initiative übernommen haben.\n\nAber, meine Damen und Herren, was Sie uns hier vorgelegt haben, ist leider inhaltlich wenig von dem zu unterscheiden, was wir bisher gesehen haben. Sie sind einfach nicht bereit – und das ist nach wie vor das Problem –, aus den bisherigen Erfahrungen zu lernen, oder Sie können es nicht. Und das ist der größte Fehler, den man in dieser Pandemie machen kann.\n\n({0})\n\nMeine Damen und Herren, wir brauchen Klarheit über die Rechtsgründe. In einer Demokratie ist es auch und gerade während einer Pandemie notwendig, die Einschränkung der Freiheitsrechte zu begründen; und begründet sind die Einschränkungen nur, wenn sie breit demokratisch legitimiert sind durch Bundestag und Bundesrat als verfassungsmäßige Organe.\n\n({1})\n\nSie müssen hier dringend nachbessern; denn breite demokratische Legitimation ist auch die Voraussetzung für die Akzeptanz von freiheitseinschränkenden Maßnahmen.\n\nWeiter, meine Damen und Herren: In einer Demokratie muss das Krisenmanagement nachvollziehbar, vorausschauend und angemessen sein. Von der Regierung gibt es im Dreiwochenrhythmus autoritäre Ansagen. Auch jetzt finden wir in der Vorlage der Regierungsfraktionen keine Strategie, die den Weg durch die und aus der Coronakrise aufzeigen würde. Wir brauchen aber, meine Damen und Herren – sonst werden wir es nicht schaffen –, das überzeugte Mitmachen der Bevölkerung beim Überwinden der Krise.\n\n({2})\n\nDeswegen halten wir einen Stufenplan für den Weg, für die Perspektive aus dieser Pandemie für nötig, mit Einheitlichkeit von Regeln bundesweit und Anpassung an das jeweilige Infektionsgeschehen regional: Wann können Schulen, Restaurants, Theater, ja, wegen meiner auch Friseursalons wieder öffnen, und unter welchen Bedingungen müssen sie eventuell für bestimmte Zeiträume wieder schließen? Das brauchen wir doch als Sicherheit, als Information. Das ist für die Menschen so wichtig.\n\n({3})\n\nDie Regierung und jetzt auch die Regierungsfraktionen verweigern das, was wir seit Monaten fordern, einen interdisziplinären wissenschaftlichen Pandemierat, der sich aus unterschiedlichen Wissenschaftlern zusammensetzt, aus Virologen, aus Medizinern, aber auch Sozialwissenschaftlern, Wirtschaftswissenschaftlern und Pädagogen. Wir brauchen ein breites Spektrum von Wissenschaftlern, die Maßnahmen erarbeiten und vorschlagen, die während der Durchführung die Wirksamkeit der Maßnahmen bewerten – das macht doch im Moment keiner – und entsprechende Anpassungen empfehlen. Das ist die Aufgabe eines Pandemierats, den Sie seit Monaten verweigern.\n\n({4})\n\nWas Sie mit diesem Gesetzentwurf vorlegen, ist wirklich – ich habe es kaum geglaubt – eine halbherzige Evaluierung bis zum Jahre 2022. Wir brauchen solche Erkenntnisse aber jetzt, um die Maßnahmen jetzt zu begründen.\n\n({5})\n\nIch verstehe es einfach nicht; ich verstehe nicht, warum Sie es nicht verstehen. Wir müssen die Maßnahmen jetzt begründen, und zwar wissenschaftlich und interdisziplinär. Die Kommunikation dieser Regierung in dieser Pandemie gegenüber der Bevölkerung ist eine absolute Katastrophe. Das muss sich endlich ändern.\n\n({6})\n\nEs sind nach wie vor viele Fragen offen: Wo sind die Produktionsanreize, zum Beispiel für Antigenschnelltests für den häuslichen Gebrauch? Eine wichtige Voraussetzung, um den öffentlichen Raum wieder öffnen zu können. Wo ist die gesetzliche Grundlage für die Impfpriorisierung, die der Präsident des Bundesverfassungsgerichts und der Präsident des Bundessozialgerichts fordern?\n\nMeine Damen und Herren, für Pflegeeinrichtungen drohen mit Ihrem jetzigen Gesetzentwurf sogar Verschlechterungen. Wir haben es gesehen: Vor allem ältere Menschen sind von dieser Pandemie betroffen – und ihre Angehörigen und die Einrichtungen, in denen sie gepflegt werden, und die Hausärztinnen und Hausärzte, die in diese Einrichtungen gehen und ihre Patienten weiter versorgen. Es war gut, dass Pflegeeinrichtungen in den Rettungsschirm aufgenommen wurden. Und die Priorisierung war gut, es war gut, dass mit dem Impfen in diesen Einrichtungen begonnen wurde. Aber, meine Damen und Herren, wir wissen noch nichts über die Folgeschäden. Und mit diesem Gesetzentwurf drohen nun sogar Mindereinnahmen; denn die Einrichtungen drohen jetzt aus dem Rettungsschirm rauszufallen, sie befürchten zum Teil einen Leerstand von bis zu 30 Prozent. Wir sollten lieber die Chance nutzen, die Heime für die Zukunft besser aufzustellen, damit sie krisenfester werden und damit nicht so viele Menschen in diesen Einrichtungen tatsächlich Opfer der Pandemie werden.\n\n({7})\n\nHerr Minister Spahn, wir haben ein Jahr lang bewusst versucht, konstruktive Opposition zu sein.\n\n({8})\n\nDenn in einer Krise passieren Fehler, vor allem in einer solch dynamischen Krise. Aber Fehler müssen benannt und korrigiert werden. Aber Sie wiederholen die alten Fehler, und damit verspielen Sie das notwendige Vertrauen der Menschen in dieser Krise. Legen Sie einen auf wissenschaftlichen Erkenntnissen basierenden Perspektiven-Stufenplan vor, und schaffen Sie die verfassungsrechtlichen Grundlagen dafür.\n\nIch danke Ihnen für Ihre Aufmerksamkeit.\n\n({9})"
"1054993","Manuela","Rottmann","Grüne","Member of Parliament","2021-02-12T00:00:00.000Z","https://dip21.bundestag.de/dip21/btp/19/19210.pdf","\n\nVielen Dank, dass Sie die Zwischenfrage zulassen. – Sie sagen: Es ist doch gut, dass wir evaluieren. – Ich habe eine einzige Frage. Wir haben die ganze Zeit darüber geredet, dass die Inzidenzwerte dazu dienen, die Nachverfolgbarkeit von Kontakten in den Gesundheitsämtern zu ermöglichen. Der Wert, ab dem die Nachverfolgbarkeit nicht mehr funktioniert, ändert sich aber ständig. Warum brauchen wir jetzt eine Studie? Warum können wir nicht nach einem Jahr erklären: „Wie sind die Kapazitäten in den deutschen Gesundheitsämtern? Wie viele Kontakte können die ab welcher Inzidenz nachverfolgen?“, und darauf einen Stufenplan aufsetzen? Warum ist das nach einem Jahr nicht möglich? Das ist niemandem zu erklären.\n\n({0})"
"1055001","Kordula","Schulz-Asche","Grüne","Member of Parliament","2021-02-12T00:00:00.000Z","https://dip21.bundestag.de/dip21/btp/19/19210.pdf","\n\nHerr Kollege, ich weiß nicht, ob Sie mir wirklich gut zugehört haben. Der Zusammenhang, in dem ich von autoritären Ansagen gesprochen habe, bezog sich auf die Treffen der Bundeskanzlerin mit den Ministerpräsidenten und die daraus folgenden Anordnungen, die nicht vom Parlament legitimiert sind.\n\n({0})\n\nVon daher bitte ich Sie, das zur Kenntnis zu nehmen und, da Ihre Fraktion ja daran beteiligt ist, den Gesetzentwurf zur epidemischen Lage entsprechend weiterzuentwickeln, darauf Rücksicht zu nehmen und dafür zu sorgen, dass wir gemeinsam als demokratische Fraktionen in diesem Parlament hier zu Verbesserungen kommen. Ich würde Ihnen empfehlen, das nicht für einfache Wahlkampfaktionen zu nutzen, sondern tatsächlich zuzuhören; denn hier geht es um eine ernste Sache, und zwar die epidemische Lage nationaler Tragweite.\n\n({1})"
"1055006","Manuela","Rottmann","Grüne","Member of Parliament","2021-02-12T00:00:00.000Z","https://dip21.bundestag.de/dip21/btp/19/19210.pdf","\n\nHerr Kollege Wiese, ich kenne den § 28a Infektionsschutzgesetz sehr gut; denn vielleicht erinnern Sie sich daran, dass wir Grüne daran intensiv mitgearbeitet haben.\n\n({0})\n\nHerr Kollege Wiese, was mir bei der SPD ein bisschen Sorgen macht, ist, dass Ihnen in einer Debatte über ein Gesetz hier im Deutschen Bundestag nichts anderes mehr einfällt, als auf Landesregierungen zu verweisen. Die sind nun nicht dafür zuständig,\n\n({1})\n\ndie gesetzlichen Grundlagen zu schaffen, sondern das sind wir hier.\n\nIch will Ihnen einen dritten Hinweis geben: In Baden-Württemberg ist der Landtag an der Entscheidung über die Verordnungen beteiligt. Das ist ein wesentlicher Unterschied.\n\n({2})"
"1055023","Manuela","Rottmann","Grüne","Member of Parliament","2021-02-12T00:00:00.000Z","https://dip21.bundestag.de/dip21/btp/19/19210.pdf","\n\nVielen Dank, Herr Luczak, dass ich noch eine Frage stellen darf. – Stellen Sie sich vor, Sie sind ein Kinobetreiber und seit Monaten ist Ihr Kino geschlossen. Die Frage, ob Sie bei 50er-Inzidenz wieder aufmachen dürfen oder bei 35er- Inzidenz oder bei 10er-Inzidenz\n\n({0})\n\nist für Sie eine wesentliche Frage. An welcher Stelle beantwortet der § 28a Infektionsschutzgesetz diese Frage?\n\n({1})"
