id,firstname,lastname,faction,position,date, url,speech
"1023385","Lisa","Paus","Grüne","Member of Parliament","2019-04-11T00:00:00.000Z","https://dip21.bundestag.de/dip21/btp/19/19095.pdf","\n\nHerr Präsident! Meine Damen und Herren! Wir reden hier heute auf Antrag der AfD über das inzwischen mit weitem Abstand nur noch zweitliebste Thema der AfD nach „Ausländer sind an allem schuld“. Wir reden über den Euro bzw. über die AfD-Illusion „Wie zerstöre ich den Euro, aber für Deutschland bleibt alles wie bisher, nur schöner, weil Deutschland dann die D-Mark wieder hat?“.\n\n({0})\n\nWir tun dies, wie es sich für die AfD gehört, indem wir über das insbesondere bei begeisterten Verschwörungstheoretikern so beliebte Stichwort „Target2“ sprechen. Das haben wir letztes Jahr im September schon getan, und wir tun dies auch heute wieder. Einige meiner Kollegen, insbesondere Herr Berghegger, haben bereits sehr gut erläutert, was ein Target2-Saldo ist – eine rein technische Größe im Clearingsystem der Europäischen Zentralbank zwischen den nationalen Notenbanken – und was er nicht ist, was aber die AfD immer behauptet, nämlich ein Kredit, den der Staat Deutschland vergeben hat und für den er haftet. Das ist es eben nicht.\n\n({1})\n\nIch erspare Ihnen einen weiteren Versuch, das vertieft zu erläutern; denn es wird – das haben wir schon einmal festgestellt – keinen einzigen Target2-Gläubigen bekehren. So ist das eben mit Verschwörungstheorien: Sie sind mit Fakten nicht wirklich zu entkräften. Sie funktionieren ja gerade mit einer Mischung aus Fakten auf der einen Seite und frei erfundenen Behauptungen auf der anderen Seite und verbinden das mit stereotypen Feindbildern, denen gerne übelste Machenschaften unterstellt werden.\n\n({2})\n\nWenn es dann auch noch um ganz, ganz viel Geld geht, wie hier bei Target2, also um 800 Milliarden Euro, 1 Billion Euro – wer bietet mehr? –, dann hat das alles, was eine gute Verschwörungstheorie braucht, Spannung inklusive.\n\n({3})\n\nDabei ist die Wahrheit hinter dieser Debatte ganz schlicht: Sie wollen den Euro abschaffen. Sie wissen, dass das horrende Kosten und schwere wirtschaftliche Verwerfungen für Deutschland bedeuten würde;\n\n({4})\n\nder Brexit ist ein laues Lüftchen dagegen. Und Sie wollen das jetzt mit Ihrer Forderung – der Pflicht zur Besicherung von Target2-Salden – für Ihre Wähler programmatisch erträglicher machen, inklusive des Schürens von Angst gegen das bestehende System. Dazu sage ich vor allem den Wählerinnen und Wählern: Machen Sie sich selbst ein Bild. Ich möchte Ihnen dazu ein paar Punkte mitgeben.\n\nErstens ist es wichtig, zu wissen und zu akzeptieren: Eine Zentralbank hat andere Möglichkeiten bezüglich des Geldes als jeder andere; denn die Zentralbank ist das Geldmonopol. Sie kann in ihrer eigenen Währung nicht pleitegehen, und sie kann Geld in riesigen Mengen ausgeben oder wieder aus dem Markt herausnehmen. Die AfD und andere wollen diese Macht begrenzen, indem sie zum Beispiel den Goldstandard wieder einführen.\n\n({5})\n\nDas würde eine drastische Reduzierung der derzeitigen Geldmenge bedeuten und einen sofortigen Zusammenbruch. Aber das ist nicht die aktuelle Lage.\n\nDerzeit ist es so, dass die Europäische Zentralbank autonom entscheidet und auch die Macht hat, über die Menge des Geldes zu entscheiden. Sie ist nur der Preis- und Systemstabilität des Euro-Raumes verpflichtet. Dass sie das kann, hat sie in den letzten Jahren unter anderem durch die viel diskutierten sogenannten Quantitative-­Easing-Programme bewiesen. An denen ist nicht alles toll, aber ich finde es richtig, dass die Europäische Zentralbank diese Möglichkeiten hat; denn so kann sie, wenn sonst nichts mehr geht – wir standen wirklich vor dem Abgrund –, wenn eine riesige Pleitewelle droht, als sogenannter Lender of Last Resort, also als letztmöglicher Kreditgeber, die Wirtschaft, die Bevölkerung und die Staaten vor einer Insolvenz schützen. Weil das so ist, ist es irrelevant, ob de facto von zwei Filialen der Europäischen Zentralbank, nennen wir sie Bundesbank und Banca d’Italia, die Verrechnungskonten divergieren. Hätten die beiden von Anfang an ein gemeinsames Konto bekommen – das wäre genauso möglich –, gäbe es den Begriff Target2 gar nicht.\n\nZweitens möchte ich noch einmal deutlich machen, wie enorm wichtig und leistungsfähig das System ist, das wir haben. 2017 wurden beispielsweise Zahlungen im Gesamtwert von über 430 000 Milliarden Euro über dieses System abgewickelt. Das waren 89 Millionen Transaktionen. Jede Woche lief ein Geldvolumen in Höhe des Jahresumsatzes der gesamten Volkswirtschaft des Euro-Raums durch dieses Zahlungssystem. Das heißt, das Target2-System hat, weil es die ganze Zeit einfach funktioniert hat, aus meiner Sicht, die ich mit vielen Experten teile, einen wichtigen Beitrag zur Stabilisierung und eben nicht zur Destabilisierung in der Europäischen Union beigetragen;\n\n({6})\n\ndenn für einen funktionierenden Binnenmarkt ist es einfach essenziell, dass das Zahlungssystem funktioniert.\n\n({7})\n\nDrittens teile ich die Gewissheit vieler Experten, dass die Forderung der AfD, diese Verrechnungskontendifferenzen mit Wertpapieren abzusichern, eine reine Scheinlösung ist;\n\n({8})\n\ndenn in dem von Ihnen gewünschten Fall des Euro-Austritts wären diese Sicherheiten keine mehr, da der Wert ins Bodenlose fallen würde. Aber eigentlich ist es noch schlimmer: Sie machen damit das derzeitige System behäbiger und weniger funktionsfähig. Das unterstützt dann zwar Ihre Krisentheorie, ist aber das Gegenteil von dem, was wir brauchen.\n\n({9})\n\nDie Kosten eines Euro-Austritts liegen für Deutschland im Übrigen um ein Vielfaches höher als die Höhe von Target2-Salden, ganz zu schweigen von den hohen politischen Kosten für Frieden, sozialen Zusammenhalt und gemeinsamen Klimaschutz in Europa. Deshalb arbeite ich, deshalb arbeiten wir Grünen dafür, dass wir die bestehenden Ungleichgewichte in der Euro-Zone abbauen – in Deutschland, indem wir nicht nur den Export, sondern auch die Binnenwirtschaft stärker in den Blick nehmen durch Investitionen in die kommunale Infrastruktur und in moderne Mobilität, in Pflege, Bildung und Klimaschutz, und in Europa, indem wir mehr gemeinsam europäisch in die Zukunft investieren, uns für mehr Steuergerechtigkeit einsetzen und für eine Vervollständigung der Bankenunion.\n\n({10})"
"1023403","Agnes","Malczak","Grüne","Member of Parliament","2019-04-11T00:00:00.000Z","https://dip21.bundestag.de/dip21/btp/19/19095.pdf","\n\nHerr Präsident! Meine Damen und Herren! Uns erreichen aus Mali gemischte Nachrichten. Manche stimmen uns durchaus hoffnungsvoll, aber die meisten sind leider besorgniserregend. Als islamistische Gruppen 2012 ein Schreckensregime errichtet haben und dann vom Norden aus den Süden erobern wollten und sehr schnell in Richtung der Hauptstadt Bamako vorgedrungen sind, reagierte die internationale Gemeinschaft schnell auf den malischen Hilferuf. Da liegt der Ursprung dieser Friedensmission der Vereinten Nationen, über deren Mandat wir heute hier beraten. Der Friedensprozess ist noch sehr lange nicht am Ziel, vielmehr gerät er krass ins Stocken. Nach der anfänglichen Euphorie über die Erfolge, gerade über das Friedensabkommen vor vier Jahren, ist heute die Ernüchterung bei vielen zu Recht sehr groß.\n\nWir Grüne haben dem Mandat in den vergangenen Jahren mit großer Mehrheit zugestimmt. Aber ich muss in Richtung der Bundesregierung auch in aller Klarheit sagen: Unsere Zustimmung ist kein Automatismus. Wir erwarten von der Bundesregierung endlich Antworten auf die vielen zentralen, kritischen Fragen und nicht die Standardfloskeln, die wir heute hier von Ihnen gehört haben, Herr Außenminister Maas.\n\n({0})\n\nWir wollen sehen, dass Sie die Probleme erkennen und dass Sie auch Maßnahmen ergreifen. Ein solcher Einsatz kann nicht nur mit vergangenen Erfolgen begründet werden, sondern es braucht Fortschritte, und es braucht eine Erfolgsperspektive für die Zukunft.\n\n({1})\n\nDie Fragezeichen werden nun einmal nicht kleiner, sondern größer: Terroristische Gruppierungen tragen die Gewalt zunehmend in den Süden des Landes; die Sicherheitslage verschlechtert sich; malische Sicherheitskräfte und die internationale Mission selbst sind immer wieder Ziel von Angriffen.\n\nÜber 190 MINUSMA-Angehörige haben in diesem Einsatz mittlerweile schon ihr Leben verloren. Die meisten von ihnen sind Blauhelme afrikanischer Staaten. Ich finde, so eine Debatte ist auch immer ein Anlass, dieser Opfer zu gedenken, natürlich auch der beiden Bundeswehrsoldaten, die bei dem furchtbaren Hubschrauberabsturz 2017 ums Leben gekommen sind.\n\nMeine Damen und Herren, wie die zukünftige Entwicklung in Mali verlaufen wird – zurück ins Chaos oder hin zu Sicherheit und Frieden –, das hängt zentral von der Frage ab, ob dieser Friedensprozess wirklich mit Leben gefüllt wird. Aber alle Konfliktparteien, auch die malische Regierung, verschleppen diesen Prozess, um sich selbst kurzfristige Vorteile zu verschaffen. Sie gefährden damit eine friedliche Zukunft Malis. Das muss endlich aufhören.\n\n({2})\n\nKlar ist auch: MINUSMA und die Vereinten Nationen sind die zentralen Akteure, manchmal auch die einzigen Akteure, die immer wieder die Konfliktparteien an den Tisch zurückrufen, die vermitteln und überwachen, wer die Vereinbarungen einhält und wer nicht. Das ist ein wichtiger Beitrag. Die Bundeswehr kann diesen Friedensprozess natürlich nicht einfordern, sie kann ihn maximal absichern und überprüfen. Aber wenn es darum geht, die Konfliktparteien in die Pflicht zu nehmen, ist dies eine zentrale Aufgabe der politischen Akteure, und zwar der Bundesregierung und der internationalen Gemeinschaft.\n\n({3})\n\nAuch wenn die Fortschritte im Friedensprozess alles andere als zufriedenstellend sind, so gibt es eben doch auch Bewegung, oft angestoßen von MINUSMA: die Integration verschiedener Gruppen in die malischen Sicherheitskräfte oder den Pakt für den Frieden, mit dem endlich mehr Tempo bei der Umsetzung des Friedensabkommens versprochen worden ist. Es reicht aber nicht aus, wenn Ursula von der Leyen – wie in der letzten Plenardebatte zu diesem Thema – davon spricht, dass es noch Luft nach oben gibt bei der malischen Regierung, oder wenn Sie, Herr Maas, nach Mali reisen. Das ist zu wenig. Das gilt auch für das zivile Engagement: Friedensverhandlungen, Antikorruptionsinitiativen, Entwicklungszusammenarbeit oder auch zivile Perspektiven für die vielen jungen Menschen in Mali – da kann und sollte man dringend mehr tun.\n\n({4})\n\nMeine Damen und Herren, die Bundesregierung darf ihre Augen nicht vor der problematischen Entwicklung in Mali verschließen, sondern sie muss mehr Druck auf alle Konfliktparteien ausüben, damit sie endlich ihre Versprechen der malischen Gesellschaft gegenüber, aber auch gegenüber der internationalen Gemeinschaft einhalten.\n\nVielen Dank.\n\n({5})"
"1023421","Maria","Klein-Schmeink","Grüne","Member of Parliament","2019-04-11T00:00:00.000Z","https://dip21.bundestag.de/dip21/btp/19/19095.pdf","\n\nSehr geehrter Herr Präsident! Meine lieben Kolleginnen und Kollegen! Die Beiträge zu der Debatte kommen aus den Schützengräben, so wie wir sie kennen. Ich stelle mal hier die Frage in den Raum: Können wir es uns eigentlich erlauben, in diesen Schützengräben zu bleiben? Müssen wir nicht tatkräftig sein und vor allen Dingen auch sichere solide Finanzierungsvorschläge für die großen Herausforderungen machen, die auf uns zukommen?\n\nWir wissen alle, dass wir einiges zu stemmen haben, einfach durch den demografischen Wandel, durch die Alterung der Gesellschaft, aber auch durch den medizinischen Fortschritt. Da liegen die Herausforderungen. Dafür brauchen wir Antworten.\n\n({0})\n\nDa reicht es nicht, darauf zu verweisen, dass die einen immer mit der Bürgerversicherung kommen und die anderen die PKV anpreisen.\n\nInsgesamt müssen wir sagen: Dieses duale System produziert viele Verliererinnen und Verlierer. Das können wir uns nicht mehr leisten.\n\n({1})\n\nEs produziert Verliererinnen und Verlierer bei den Beitragszahlern, weil die Einkommensstarken in der Tat nur in der PKV versichert sind.\n\n({2})\n\nDas System produziert Nachteile dadurch, dass in der PKV sehr viele Menschen sind, die sich die hohen Beiträge gar nicht mehr leisten können, vor allen Dingen dann nicht, wenn sie älter werden.\n\n({3})\n\nEs produziert Verlierer, weil in der PKV ältere Menschen und Menschen mit Erkrankungen stark benachteiligt werden; denn das Risiko muss eben abgesichert werden. Dadurch finden die Menschen keine tragfähige Antwort, insbesondere dann nicht, wenn sie alt werden und unter Erkrankungen leiden.\n\n({4})\n\nDeshalb ist es so wichtig, dass wir Antworten finden, die tatsächlich allen Lebenslagen gerecht werden. Das ist die Herausforderung.\n\n({5})\n\nNatürlich wissen wir: Solidarisch und gerecht finanziert können wir diese großen Herausforderungen besser stemmen als in diesem dualen System. Deshalb verlange ich von allen, sich darüber Gedanken zu machen: Wie schaffen wir das in Zukunft, in der nächsten Wahlperiode, wenn wir ein Plus von 5 Milliarden Euro aus den jetzt bereits beschlossenen Gesetzen zu finanzieren haben? Das möchte ich von Ihnen wissen. Darauf möchte ich Antworten haben.\n\n({6})\n\nDa können wir ganz klar sagen: Die Bürgerversicherung wird zur Entlastung beitragen, weil sie alle einbeziehen wird,\n\n({7})\n\nund zwar gerecht entlang der finanziellen Möglichkeiten, die jeder hat.\n\n({8})\n\nKommen Sie mir nicht damit, dass es darum ginge, privat und gesetzlich gegeneinander auszuspielen! Nein, es muss ja darum gehen, einen gemeinsamen Rahmen zu schaffen, in dem die private und die gesetzliche Krankenversicherung eine solche solidarische Absicherung finanziert. Das muss der Weg sein. Da erwarte ich von Ihnen, dass Sie sich damit wirklich auseinandersetzen und nicht alles mit den üblichen Argumenten abtun. Damit werden Sie weder den Linken gerecht – die haben sich ein Stückchen bewegt –,\n\n({9})\n\nnoch geben Sie selber Antworten darauf, wie denn dann dieses Nebeneinander von privat und gesetzlich funktionieren soll.\n\n({10})\n\nDa warte ich noch immer auf Antworten.\n\nNeben den Argumenten der Solidarität und der gerechten Finanzierung geht es auch immer um das Argument des Wettbewerbs. Das Argument höre ich derzeit vom Minister, insbesondere in der Facette, die AOKen bundesweit zu öffnen. Eigentlich muss es doch darum gehen – Stichwort „Wettbewerb“ –, allen Menschen in dieser Gesellschaft die Wahlfreiheit möglich zu machen.\n\n({11})\n\nDie Beamten haben diese Wahlfreiheit nicht. Diejenigen, die sich privat versichert haben, haben diese Wahlfreiheit nicht, weil sie in der Regel ihre persönlichen Rückstellungen überhaupt nicht mitnehmen können und weil außerdem bei einem Wechsel ihr Beitrag risikobezogen wieder neu verhandelt wird. Das ist keine Antwort auf Wahlfreiheit, so wie Sie dieses Wort immer im Munde führen.\n\n({12})\n\nVon daher erwarte ich auch an dieser Stelle Antworten vonseiten der Union, vonseiten der FDP.\n\n({13})\n\nIch habe da an dieser Stelle noch wenig gehört.\n\n({14})\n\nHier wird viel von einer Zweiklassenmedizin gesprochen. Aber es wird selten davon gesprochen, dass es nicht nur um die Wartezeit auf einen Termin geht, sondern auch um die abgesicherte Leistung. Wenn ich mir anschaue, dass die leistungsstärksten Tarife der PKV wesentliche und empfindliche Lebenslagen nicht absichern – nehmen wir den ganzen Bedarf von Rehaleistungen, den man gerade im Alter hat, den man bei einer psychischen Erkrankung hat –, dann kann ich Ihnen sagen: Die Zweiklassenmedizin gibt es auch andersherum, nämlich so, dass wir bei den Privaten große Versorgungsmängel und -defizite und Absicherungslücken haben.\n\n({15})\n\nDas sind die Themen, die wir angehen und weiterentwickeln müssen. Da müssen wir ran. Von daher erwarte ich, dass wir uns, wenn wir die Anhörungen haben werden, tatsächlich mit den eigentlichen Problemen auseinandersetzen und nicht immer wieder nur die Antworten aus den Schützengräben heraus geben.\n\nDanke schön.\n\n({16})"
"1023436","Maria","Klein-Schmeink","Grüne","Member of Parliament","2019-04-11T00:00:00.000Z","https://dip21.bundestag.de/dip21/btp/19/19095.pdf","\n\nHerr Kollege Sorge, Sie sprechen gerade von Enteignung und Ähnlichem, aber letztendlich geht es ja darum, wie wir die drängenden Fragen nach sozialer Sicherung und das Einlösen unseres Sozialstaatsversprechens hinbekommen. Man kann Vorschläge der Opposition ablehnen, kritisch sehen, aber man müsste ja wenigstens einmal Antworten geben.\n\n({0})\n\nMich würde schon interessieren, wie Sie eine tragfähige, solide Finanzierung all der Aufgaben, die da vor uns liegen, und zwar im Bereich Pflege wie im Bereich Gesundheit, tatsächlich hinbekommen wollen. Da sehen wir doch noch deutliche Lücken. Ich sehe von Ihrer Seite keinerlei Vorschläge, wie Sie denn die Digitalisierung im Gesundheitswesen finanzieren wollen, wie Sie den Investitionsstau bei den Krankenhäusern auflösen wollen oder wie Sie beim Thema „bezahlbarer Wohnraum“ – Sie haben diesen Bereich gerade genannt – tatsächlich zu Lösungen kommen wollen, also zu Lösungen, durch die das Vertrauen in der Bevölkerung in die soziale Sicherheit und den Sozialstaat glaubhaft eingelöst wird.\n\n({1})"
"1023449","Katja","Keul","Grüne","Member of Parliament","2019-04-11T00:00:00.000Z","https://dip21.bundestag.de/dip21/btp/19/19095.pdf","\n\nSehr geehrter Herr Präsident! Liebe Kolleginnen und Kollegen! Die malische Armee ist nach wie vor nicht in der Lage, das eigene Land zu verteidigen, und benötigt deshalb immer noch Ausbildung und Unterstützung.\n\nWir Grüne haben die Ausbildungsmission EUTM seit 2013 unterstützt. Europa hat nämlich aus einem doppelten Grund eine Verantwortung für Mali. 2011 war die malische Armee ein wehrloser Haufen ohne Ausrüstung und Fähigkeiten. Die Soldaten waren den aus Libyen zurückkehrenden Tuareg-Söldnern hilflos ausgeliefert. Diese waren mit den modernsten Waffen aus dem Arsenal Gaddafis ausgestattet, die Europäer ihnen geliefert hatten. Erst hat also die Rüstungsindustrie ein gutes Geschäft mit den Waffenlieferungen an Gaddafi gemacht. Dann hat die NATO das Land bombardiert, ohne sich im Geringsten um die Folgen dieses Krieges zu scheren. Im Januar 2012 wurden in der Nähe von Kidal 100 Soldaten der malischen Armee in ihrem Camp brutal ermordet. Welche der kriminellen oder islamistischen Gruppen dafür verantwortlich war, weiß man bis heute nicht. Die malischen Soldaten und ihre Angehörigen waren jedenfalls danach nicht mehr bereit, sich massakrieren zu lassen, zogen nach Bamako und putschten im März 2012.\n\nWie sieht es jetzt, nach sechs Jahren europäischer Ausbildungsmission, aus? In der Mandatsbegründung selbst heißt es:\n\nDie Fortschritte im Bereich der Sicherheitskräfte sind … bislang begrenzt.\n\nWas aus den in Koulikoro ausgebildeten Soldaten wird und wo sie im Einsatz sind, kann niemand nachverfolgen, weil es kein Personalmanagement gibt. Das ist aber nicht das Einzige, was fehlt. Das von der malischen Regierung zu stellende Material ist eine Katastrophe. Fahrzeuge sind nicht fahrtauglich, und Werkzeug für Reparaturarbeiten ist nicht vorhanden.\n\n({0})\n\nIn Brüssel liegt bereits eine Wunschliste für europäisches Ausbildungsmaterial für Mali vor. Ich muss sagen: Wenn wir schon diesen Aufwand betreiben, sollten wir nicht am falschen Ende sparen.\n\nDer Aufwand für Logistik und Sicherung der Ausbilder steht leider ohnehin in keinem Verhältnis. Von aktuell 170 Bundeswehrangehörigen sind gerade einmal sieben mit der eigentlichen Ausbildung beschäftigt, allesamt ohne Französischkenntnisse. Ich hatte bei meinen Gesprächen durchaus den Eindruck, dass Sprachkurse als Einsatzvorbereitung gerne angenommen würden. Ich finde, ein solches Angebot sollte eine Selbstverständlichkeit sein.\n\n({1})\n\nWas allerdings die Kosten-Nutzen-Rechnung endgültig zum Kippen bringen könnte, ist die Sicherheitslage. Der komplexe Angriff vom 24. Februar dieses Jahres auf die Offiziersschule in Koulikoro wird Sicherheitsvorkehrungen in völlig neuen Dimensionen erforderlich machen. Trotz aller Vorkehrungen ist nicht auszuschließen, dass die Militärpräsenz der Europäer in unmittelbarer Nähe zur Stadt selbst zu einem Sicherheitsrisiko für die Zivilbevölkerung wird. Das derzeit führende Islamistennetzwerk hat sich nicht nur zu dem Anschlag bekannt, sondern auch die „fremden Besatzer“ zum Anschlagsziel erklärt. Es war reiner Zufall, dass der Anschlag missglückte und die Angreifer nicht ins Camp eindringen konnten. Vor diesem Hintergrund gehört die Mission gründlich auf den Prüfstand gestellt.\n\nWenn wir für sieben Trainer insgesamt 170 Soldaten nach Mali schicken müssen, die dann auf unzureichendes Material stoßen und durch ihre Präsenz im Land ein Angriffsziel für die Islamisten bieten, muss die Frage erlaubt sein, ob das der richtige Weg ist.\n\n({2})\n\nIch habe da inzwischen erhebliche Zweifel. Es drängt sich doch die Frage auf, ob wir die malischen Offiziere nicht besser und effizienter in Europa ausbilden könnten. Das scheint mir nicht nur günstiger zu sein, was den Kostenaufwand anbetrifft, sondern auch im Hinblick auf die Sicherheitslage.\n\nEines soll jedenfalls nicht als Grund herhalten: die Symbolik einer EU-Präsenz um ihrer selbst willen. Wir dürfen unsere Soldatinnen und Soldaten nur in einen solchen Einsatz schicken, wenn es wirklich der Ausbildung der malischen Armee zugutekommt. Wenn es nur darum geht, zu beweisen, dass die EU in Afrika irgendwie dabei ist, wäre das nicht zu legitimieren.\n\nSelbst wenn Sie diesmal noch die Unterstützung der Grünenfraktion für diese Mission bekommen sollten, muss sich im nächsten Jahr einiges ändern, sonst verliert diese Mission langfristig endgültig ihre Legitimität.\n\nVielen Dank.\n\n({3})"
"1023467","Kirsten","Kappert-Gonther","Grüne","Member of Parliament","2019-04-11T00:00:00.000Z","https://dip21.bundestag.de/dip21/btp/19/19095.pdf","\n\nHerr Präsident! Liebe Kolleginnen und Kollegen! Wer soll darüber entscheiden, ob ein Leiden schwer genug ist, dass ein Suizid staatlich unterstützt wird? Ein Sachbearbeiter? Eine Gutachterin, nach Aktenlage? Ein Katalog des Gesundheitsministeriums? Ich finde, staatliche Behörden dürfen kein Werturteil darüber abgeben, welches Leben lebenswert ist und welches nicht.\n\n({0})\n\nAus meiner 25-jährigen Erfahrung als Ärztin, als Psychiaterin weiß ich, dass der Wunsch zum Suizid in den allermeisten Fällen vorübergehend ist. Er wird stark von den Lebensumständen beeinflusst: Schmerzen, Einsamkeit. Die Aufgabe des Staates, der Medizin und der Gesellschaft ist es, an diesen Umständen etwas zu verändern, und nicht, Suizid zu einer gleichwertigen Option neben anderen zu machen.\n\n({1})\n\nWir wissen von einigen unserer Nachbarländer, dass dort der Anwendungsbereich von Sterbehilfe immer weiter ausgedehnt wird. Dort wird schon heute bei Kindern, bei psychisch Kranken und bei Dementen aktive Sterbehilfe angewendet. Ich finde das falsch.\n\n({2})\n\nDiese zutiefst ethischen Fragen können allesamt nicht mit dem Antrag der FDP beantwortet werden. Dazu wäre eine breite ethische Debatte, auch in diesem Haus, notwendig. Das Verwaltungsgericht Köln hat übrigens das Verfahren ausgesetzt, bis das Bundesverfassungsgericht über § 217 Strafgesetzbuch entschieden hat. Nächste Woche beginnt dazu die Verhandlung in Karlsruhe. Unabhängig davon, wie Einzelne inhaltlich zu diesem Antrag stehen: Es gebietet der Respekt vor dem höchsten Gericht, dieses Urteil abzuwarten. Ich empfehle Ablehnung des Antrags.\n\nVielen Dank.\n\n({3})"
