id,firstname,lastname,faction,position,date, url,speech
"1042657","Omid","Nouripour","Grüne","Member of Parliament","2020-06-18T00:00:00.000Z","https://dip21.bundestag.de/dip21/btp/19/19166.pdf","\n\nHerzlichen Dank, liebe Frau Präsidentin. – Liebe Kolleginnen und Kollegen! In den letzten Tagen und Wochen ist in Syrien etwas sehr Bewegendes passiert: Überall dort, wo der Druck der Repression abgenommen hat, gab es quasi sofort friedliche Demonstrationen gegen Assad. Die Leute sind teilweise mit denselben Parolen wie 2011 in großen Zahlen auf die Straße gegangen – in Daraa, einer Stadt im Süden, die in den letzten neun Jahren massiv vor allem von Fassbomben getroffen worden ist, in Suwaida, einer Stadt, die zum großen Teil drusisch geprägt ist. Den Leuten, die meinen, Assad sei derjenige, der die Christinnen und Christen in Syrien schützt, sage ich: Auch diese Leute gehen friedlich gegen Assad auf die Straße. Was sagt uns das?\n\nErstens. Diese Leute sind unglaublich mutig.\n\nZweitens. Das syrische Volk hat die letzten Jahre so gelitten – unter Dschihadisten, unter der türkischen völkerrechtswidrigen Invasion im Norden, unter iranischen Milizen, unter russischen Kriegsverbrechen –; aber das Hauptleid hat das Regime von Assad verursacht. Wenn die AfD in ihren Anträgen in diesem Zusammenhang von Friedenspolitik spricht, dann deutet das darauf hin, dass sie gar nicht weiß, was Frieden eigentlich bedeutet.\n\n({0})\n\nDrittens. Wir haben uns als Deutsche, als Europäerinnen und Europäer in den letzten neun Jahren mehr oder minder freiwillig in die dritte Reihe begeben, haben uns da, wo wir vielleicht etwas hätten tun können, komplett rausgehalten. Wir können uns aber nicht leisten, bei diesen Demonstrationen einfach nur zuzusehen. Diesen Leuten schulden wir, dass wir wenigstens einen Entwurf haben, uns Gedanken machen, wie man das Land befrieden kann, was man dort tun muss und wie denn eigentlich eine Ordnung in Syrien nach dem möglichen Frieden aussehen kann. Aber wir sind auch verpflichtet, diese Menschen, die syrische Gesellschaft, als unsere Partner zu verstehen,\n\n({1})\n\nmit ihnen zu sprechen. Das ist eine Partnerschaft, die wir wagen müssen. Das ist eine Investition in Frieden und in Gerechtigkeit.\n\n({2})\n\nViertens. Genauso, wie Sie den Begriff Frieden anscheinend nicht verstehen, wissen Sie auch nicht, was dort passiert, wo angeblich Frieden eingezogen ist. Das ist etwas, was mich, ehrlich gesagt, entsetzt; das bleibt auch in anderen Anträgen der Linken immer wieder einfach aus. Da, wo die Leute zurückgekehrt sind, gibt es so viele Berichte von Leuten, die einfach verschwunden sind, von Folter, von Leuten, die einfach auf der Straße verhaftet worden sind. Das ist der Grund, warum die Leute nicht zurückgehen.\n\n({3})\n\nDas Entscheidende ist die politische Verfolgung in dem Land, in einem Land, in dem es über 100 000 Häftlinge gibt, die politisch motiviert in Folterknästen sitzen.\n\n({4})\n\nDas ist entscheidend. Wie kann man da von Rückkehr sprechen und sich über die Ursachen ausschweigen, warum sie nicht zurückkehren können? Versteht ihr nicht, dass ihr denen in die Hände spielt, indem ihr einfach verschweigt, was Assad dort veranstaltet? Genau so spielt ihr denen in die Hände, während wir darum kämpfen, Syrien zu befrieden, damit die Menschen zurückkehren können. Das können sie nicht, weil Assad so agiert, wie er dort agiert.\n\n({5})\n\nDer letzte Punkt. Wir sollten auch darüber reden, wo die Leute nicht demonstrieren, weil es nicht geht. Am allerschlimmsten ist es in Idlib. Da leiden die Leute unter Dschihadisten, aber auch unter den Bombardements und darunter, dass es kaum mehr Krankenhäuser gibt, weil sie von den Russen und mit den Fassbomben der Assad-Armee weggebombt wurden. Deshalb haben wir zu diesem Thema einen Antrag eingebracht: weil die Situation in Idlib so dramatisch ist, weil die Leute dort eingekesselt sind – von der türkischen Armee im Norden, von den Dschihadisten im Inneren und von Assad und den Affiliierten.\n\nDen mutigen Menschen in Not, die ich beschrieben habe, Respekt zu zollen, bedeutet, dass wir in erster Linie – nicht nur, aber in erster Linie – über die Kriegsverbrechen von Assad sprechen müssen.\n\n({6})\n\nDas ist, finde ich, unsere Verantwortung, wenn wir Frieden in Syrien wollen.\n\n({7})"
"1042669","Corinna","Rüffer","Grüne","Member of Parliament","2020-06-18T00:00:00.000Z","https://dip21.bundestag.de/dip21/btp/19/19166.pdf","\n\nSehr geehrte Frau Präsidentin! Liebe Kolleginnen und Kollegen! „Endlich hat die Frau Rüffer das Wort; sie ist ja auch schon mehrfach angesprochen worden.“ – Ich will Ihnen ganz am Anfang sagen: Ich bin erschüttert – ich bin eigentlich seit vielen Monaten erschüttert – über das, was hier vorgefallen ist. Ich bin erschüttert über die Exegese, die dazu geführt hat, dass wir hier heute stehen.\n\nVom Ergebnis her will ich Ihnen sagen: Wir werden natürlich zustimmen. Wir werden deshalb zustimmen, weil diese Änderung des Conterganstiftungsgesetzes den Menschen endlich Schutz gibt, dass ihnen im Nachhinein die Leistungen nicht mehr entzogen werden können. Es ist an sich schon ein Skandal ist, dass wir diesen Schutzwall ziehen müssen.\n\n({0})\n\nWir stimmen auch deshalb zu, weil wir 2016 schon mal zugestimmt haben, als es darum ging, die Finanzierung der medizinischen Kompetenzzentren aus Stiftungsmitteln heraus zu ermöglichen. Uns hat der Bundesrechnungshof dazu aufgefordert, dafür jetzt auch die gesetzliche Grundlage zu legen. Also, es gibt überhaupt keinen Grund, dass wir uns hier beweihräuchern für das, was wir heute tun.\n\nAber der eigentliche Grund – und das ist wichtig –, warum wir hier heute stehen, ist ein Skandal, der im letzten Dezember vom „Spiegel“ und anderen aufgedeckt worden ist. Der Skandal besteht darin, liebe Kolleginnen und Kollegen, dass die Conterganstiftung im Oktober des Jahres 2019 gegenüber 60 Geschädigten, vor allen Dingen aus Brasilien, Mexiko, aber auch Finnland, ein Anhörungsverfahren eingeleitet hat und ihnen mitgeteilt hat: Wir entziehen Ihnen nach 40 Jahren – nach 40 Jahren! – die Conterganrente. Wir entziehen Ihnen gerade mal die Existenz. Jetzt fragen Sie sich: Auf welcher Grundlage ist dieses Anhörungsverfahren eingeleitet worden? Man würde sich denken: Die haben das in der Stiftung doch bestimmt gut geprüft, bevor sie die Leute, die Portugiesisch sprechen, auf Deutsch angeschrieben haben.\n\nJetzt muss man sagen: Die Stiftung hat keinen Kontakt zur Firma Grünenthal aufgenommen, und die Stiftung hat über lange Zeit den Kontakt zur Firma Grünenthal verweigert, um hier zu einer Klärung zu kommen. Des Weiteren hat sich die Stiftung nicht mal den Lizenzvertrag angeschaut, der öffentlich zugänglich gewesen ist. Diesen Lizenzvertrag hat sie sich erst angeschaut, nachdem wir eine schriftliche Frage zu diesem Thema gestellt haben. Das Ganze ist also ohne Prüfung geschehen. Bis heute ist nicht ersichtlich, ob, in welcher Weise und auf welcher Grundlage eine Prüfung vorgenommen wurde. Ohne Prüfung sind die Menschen einfach mit dem Entzug ihrer Existenzgrundlage bedroht worden. Das ist der Skandal, über den wir heute reden.\n\n({1})\n\nIch bin seit 2013 Berichterstatterin in diesem Parlament für das Thema Contergan. Einen herzlichen Dank an die Berichterstatterinnen und Berichterstatter der anderen Fraktionen! Sie sind hier nämlich wahrlich nicht das Problem. Aber ich kann Ihnen sagen, dass in dieser Stiftung ganz viel im Argen liegt und dass das Bundesfamilienministerium aus unserer Sicht in diesem Fall seine Rechtsaufsicht nicht wahrgenommen hat, seiner Aufgabe nicht gerecht geworden ist.\n\nWas wir heute tun, ist notwendig. Aber was wir ab morgen tun müssen, ist, diesen Skandal aufzudecken. Wir müssen endlich an die Stiftungsstruktur herangehen, an den Kern des Problems, weil, glaube ich, keiner von uns Lust hat, in wenigen Monaten, Jahren oder wann auch immer wieder hier zu stehen und irgendwelche Skandale aufzudecken. Wir brauchen eine Stiftung, vor der auch die deutschen Contergangeschädigten keine Angst haben müssen.\n\n({2})"
"1042671","Corinna","Rüffer","Grüne","Member of Parliament","2020-06-18T00:00:00.000Z","https://dip21.bundestag.de/dip21/btp/19/19166.pdf","\n\nWir brauchen eine Stiftung, bei der diese Menschen im Mittelpunkt stehen, eine Stiftung, die transparente, demokratische Strukturen hat, Strukturen, die wir nachvollziehen können. Wir brauchen ein Bundesfamilienministerium, das seine Aufgaben ernst nimmt."
"1042673","Corinna","Rüffer","Grüne","Member of Parliament","2020-06-18T00:00:00.000Z","https://dip21.bundestag.de/dip21/btp/19/19166.pdf","\n\nJetzt komme ich zum Ende. – Wir haben unter den Berichterstatterinnen und Berichterstattern vereinbart, dass wir dementsprechend noch in dieser Legislaturperiode aktiv werden. Und ich werde nicht ruhen, bis etwas geschieht, weil ich keine Lust habe, immer und immer wieder diese Debatten zu führen.\n\nDanke.\n\n({0})"
"1042691","Ingrid","Nestle","Grüne","Member of Parliament","2020-06-18T00:00:00.000Z","https://dip21.bundestag.de/dip21/btp/19/19166.pdf","\n\nSehr geehrter Herr Präsident! Liebe Kolleginnen und Kollegen! Ich freue mich über die Anträge der FDP.\n\n({0})\n\nDenn da steht viel Richtiges drin. Wir teilen Ihre Ziele.\n\n({1})\n\nAllein, die Umsetzung wird so noch nicht funktionieren.\n\n({2})\n\nDas fängt damit an, dass Sie die Methanpyrolyse falsch beschreiben. Nein, ein Hauptprodukt ist eben nicht CO2; das ist doch gerade der Clou daran. Es geht damit weiter, dass Sie behaupten, Blauer Wasserstoff sei CO2-neutral. Nein, das ist er eben nicht.\n\nAber noch weitaus problematischer ist Ihre Annahme, dass Wasserstoff in schier unbegrenzter Menge ganz kostenlos zur Verfügung stehen wird – irgendwoher, aber keiner weiß, woher.\n\n({3})\n\nNein, auch das stimmt nicht. Wasserstoff wird wertvoll bleiben. Eine Wasserstoffstrategie muss sich darauf einstellen.\n\n({4})\n\nIch möchte Ihnen nur ein Beispiel aus Ihrem Antrag nennen. Sie meinen, durch den Einsatz von synthetischen Kraftstoffen könnten Verbrennungsmotoren sowie Öl- und Gasheizungen klimaneutral betrieben werden. Da hätten Sie noch nichts für die Industrie, noch nichts für die Flugzeuge, noch nichts für die Schiffe, noch nichts für die Versorgungssicherheit beim Strom getan. Alleine dafür bräuchten Sie dreimal die komplette Stromproduktion Deutschlands und jede Menge CO2, das, aus der Luft abgeschieden, sicherlich nicht zu vertretbaren Kosten zur Verfügung stehen wird. Das ist doch kein sinnvolles Konzept.\n\n({5})\n\nUnd die Kosten? An manchen Stellen bürden Sie den Nutzern drei- bis viermal höhere Kosten auf, nur weil Sie so auf dem Vergangenen beharren. Sie schaffen es mit Ihrer Wasserstoffstrategie, absurde Kosten zu produzieren, keine Versorgungssicherheit zu schaffen; denn dieses blinde Vertrauen „Der Wasserstoff wird irgendwo herkommen“ – das wird nicht funktionieren.\n\n({6})\n\nDas ist auch kein Klimaschutz; denn Klimaschutz bedeutet nicht: Ja, ja, die ganzen alten Strukturen können bleiben, und irgendein Wasserstoff wird uns retten. – Das, verehrte FDP, wird nicht funktionieren.\n\n({7})\n\nNun zur Wasserstoffstrategie der Bundesregierung. Was die fachliche Richtigkeit angeht, ist sie zum Glück um einiges besser. Nur leider beantworten Sie nicht die entscheidenden Fragen. Gerade mal 100 Terawattstunden Wasserstoff wollen Sie in 2030 zur Verfügung haben. Damit werden Sie niemals die ganzen Sektoren bedienen können, die Sie selbst fröhlich aufzählen. Selbst bei den 100 Terawattstunden wissen Sie bei über 80 Prozent nicht, woher dieser Wasserstoff kommen soll. Auch das kann doch nicht funktionieren.\n\n({8})\n\nWenn wir an dieser Stelle schon gerne über den Import reden und auch Sie sehr viel darüber reden: Warum sorgen Sie nicht endlich dafür, dass statt fossiler LNG-Terminals in Deutschland Wasserstoffterminals gebaut werden, damit Import überhaupt stattfinden kann?\n\n({9})\n\nDeshalb bitte ich Sie: Unterstützen Sie unseren Grünenantrag! Er würde dafür sorgen, dass die Stärken von Wasserstoff, seine Speicherbarkeit und seine Flexibilität, in den Mittelpunkt gestellt würden. Durch eine Reform der Abgaben und Umlagen könnte der Wasserstoff genau dort und dann produziert werden, wo tatsächlich die Erneuerbaren sind.\n\nWasserstoff wird nicht zur Erfolgsgeschichte, indem man das Blaue vom Himmel verspricht. Wasserstoff wird zur Erfolgsgeschichte, indem man die erneuerbaren Energien ausbaut und indem man die Stärken des Wasserstoffs zur Geltung bringt. Das tut unser Antrag.\n\nHerzlichen Dank.\n\n({10})"
"1042723","Anton","Hofreiter","Grüne","Member of Parliament","2020-06-19T00:00:00.000Z","https://dip21.bundestag.de/dip21/btp/19/19167.pdf","\n\nSehr geehrter Herr Präsident! Liebe Kolleginnen und Kollegen! Die Coronakrise hat massive gesundheitliche, wirtschaftliche und soziale Folgen. Unternehmen sind bedroht, Arbeitsplätze drohen verloren zu gehen, und bestehende Ungerechtigkeiten drohen sich zu vertiefen. Und deshalb halten wir es für richtig, deshalb unterstützen wir Sie auch dabei, dass wir gemeinsam versuchen, in Dimensionen, die es davor noch nie gab, unsere Wirtschaft, unsere Gesellschaft in dieser Krise zu unterstützen.\n\n({0})\n\nAber, liebe Kolleginnen und Kollegen, als ich zuerst Ihr Konjunkturpaket gesehen habe, war mein erster Gedanke: Besser, als ich befürchtet habe!\n\n({1})\n\nDenn es ist Geld drin für die Kommunen, Kosten der Unterkunft – längst überfällig –,\n\n({2})\n\nAusfälle der Gewerbesteuereinnahmen – richtige Maßnahme –, Gelder für Ganztagsbetreuung, Gelder für Forschung. Und ich bin, ehrlich gesagt, auch froh, dass keine pauschalen Unternehmensteuersenkungen oder pauschale dauerhafte Abschaffung des Rest-Solis drin sind.\n\nWas mittlere Einkommen in der Wahrnehmung der FDP sind, haben wir auch erfahren, nämlich wenn Menschen über 100 000 Euro im Jahr verdienen. Also, für mich ist das kein mittleres Einkommen.\n\n({3})\n\n– Na Sie.\n\n({4})\n\nUnd ich sehe es auch als einen großen Erfolg der Klimabewegung an, dass es keine Prämie für fossile Verbrenner gab.\n\n({5})\n\nDa kann man insbesondere sagen: „Druck bewirkt etwas“, und ich kann nur hoffen, dass dieser Lernfortschritt ein dauerhafter Lernfortschritt ist.\n\n({6})\n\nLiebe Kolleginnen und Kollegen, bei 130 Milliarden wird allerdings umso drastischer sichtbar, was fehlt. Wir geben Milliarden für die Rettung der Lufthansa aus, auch Milliarden für die Rettung der Autoindustrie, und es ist auch richtig, dass wir sie retten;\n\n({7})\n\naber für die Ärmsten gibt es in dieser Krise noch nicht einmal einen temporären Aufschlag auf Hartz IV. Für die Familien gibt es einen einmaligen Bonus,\n\n({8})\n\naber kein dauerhaftes Coronaelterngeld, und die Soloselbstständigen – damit die Künstlerinnen und Künstler, Musiklehrerinnen und Musiklehrer, Therapeutinnen – haben Sie wieder vergessen; sie bekommen keinen Zuschuss zu ihrem Lebensunterhalt.\n\n({9})\n\nUnd, liebe Kolleginnen und Kollegen, wenn wir doch Milliarden für Konzerne haben – und das auch in Teilen richtig ist –, dann sollten wir auch Milliarden für die Ärmsten haben. Denn sonst führt das zu einer sozialen Schieflage, und damit gefährden Sie den Zusammenhalt unserer Gesellschaft, und das ist falsch in dieser Krise.\n\n({10})\n\nWenn ich mir in dem Paket Ihre Maßnahmen zum Klimaschutz und zur Gestaltung der Zukunft anschaue, dann fehlt es halt da wieder mal an Entschlossenheit. Man kann überhaupt sagen: Wenn es bei der Zukunftsgestaltung bei dieser Großen Koalition einen roten Faden gibt, dann ist es dieser:\n\n({11})\n\ndass Sie bei allen Maßnahmen nicht ausreichend entschlossen in die Zukunft investieren.\n\n({12})\n\nBei 130 Milliarden wäre es ja auch ein Wunder, wenn nicht die eine oder andere Summe für richtige Maßnahmen dabei wäre. Aber sobald es beim Klimaschutz ernst wird, ist es halt zu wenig, zu spät und zu zögerlich. Nehmen wir zum Beispiel die Kfz-Steuer. Die Kfz-Steuerreform schützt nicht das Klima, sondern diese Steuerreform schützt de facto den Weiterverkauf von SUVs, die in unseren Städten ein Problem sind und die für unser Klima ein Problem sind.\n\nBei den Milliarden für die Lufthansa haben Sie nicht gut genug verhandelt. Da ist weder etwas vernünftiges Soziales drin, noch ist wirklich eine Reformagenda für Klimaschutz bei der Lufthansa mit drin.\n\n({13})\n\nMan ist inzwischen froh, wenn Sie im Zusammenhang mit der Energiewende keinen größeren Schaden anrichten.\n\n({14})\n\nNotwendig wäre eine massive Ausbauoffensive; denn wir brauchen kostengünstigen sauberen Strom für die Stahlherstellung, für die Chemieindustrie, für unsere Grundstoffindustrie und de facto für den Erhalt unserer Industrialisierung. Ihre Wasserstoffstrategie wird scheitern, wenn Sie nicht ausreichend kostengünstigen Strom haben.\n\n({15})\n\nWas vielleicht am Schlimmsten ist: Sie haben keine langfristige Investitionsstrategie. Deshalb: Wir wollen in den nächsten zehn Jahren 500 Milliarden Euro langfristig in die Zukunft investieren. Deshalb: Reformieren Sie die Schuldenbremse, investieren Sie!\n\nWir freuen uns, wenn Sie da bei uns abschreiben. Ja, ich bitte Sie sogar darum, bei uns abzuschreiben.\n\n({16})\n\nDann hat unser Land nämlich eine gute Zukunft, und darauf kommt es an. Investieren Sie, und schaffen Sie endlich eine Zukunftsoffensive für unser Land!\n\nVielen Dank.\n\n({17})"
"1042707","Canan","Bayram","Grüne","Member of Parliament","2020-06-18T00:00:00.000Z","https://dip21.bundestag.de/dip21/btp/19/19166.pdf","\n\nVielen Dank, Herr Präsident; jetzt ist ja wieder Stimmung hier in der Bude. Liebe Kolleginnen und Kollegen! Der Gesetzentwurf ist eine der sehr seltenen Beispiele für systematisches Arbeiten der Bundesregierung am Strafgesetzbuch. Auch wenn es dabei überwiegend um formale Änderungen geht: Zentrale Aufgabe des Bundesjustizministeriums ist es, die Einheit der Rechtsordnung, die Einheit des Strafgesetzbuches im Blick zu behalten und dabei die Grundsätze des Strafrechts mit der nötigen Festigkeit zu wahren. Dabei weder vor der „Bild“-Zeitung noch vor dem Koalitionspartner einzuknicken, gelingt hier allerdings nicht. Was wir derzeit zum § 176 Strafgesetzbuch erleben, ist jenseits jeder rationalen Kriminalpolitik, gegen alle wissenschaftliche Erkenntnis und bringt das System des Strafgesetzbuches durcheinander – es rettet übrigens auch kein Kind, meine Damen und Herren.\n\nWas an systematischer Arbeit beim Strafgesetzbuch zum Beispiel fehlt, ist die seit Jahren ausstehende Gesamtüberarbeitung seines Dreizehnten Abschnitts, der Straftaten gegen die sexuelle Selbstbestimmung. Dafür liegt ein Expertenbericht dem BMJV vor. Über punktuelle Änderungen hinaus wird aber nichts getan.\n\nWas ebenfalls seit Jahren fehlt, ist die Überarbeitung und Reform der Tötungsdelikte. Da traut sich die Koalition nicht heran.\n\n({0})\n\n2015 hatte eine Expertengruppe Empfehlungen vorgelegt, dann gab es, 2016, einen Referentenentwurf des Bundesjustizministeriums, und dann ist die SPD vor der Union eingeknickt. Bei dem Gesetzentwurf, den wir heute beraten, werden richtigerweise überholte Begriffe wie „Schwachsinn“ und „Abartigkeit“ ersetzt. Auch bei den Tötungsdelikten gibt es Begriffe, die auf die sogenannte Tätertypenlehre der Nationalsozialisten zurückgehen und reformiert werden müssten.\n\nSelbst kleine Veränderungen, die Gegenstand des heute zu beratenden Gesetzentwurfs hätten sein können, bleiben unbearbeitet. Was ist etwa mit dem Begriff der schädlichen Neigung im Jugendgerichtsgesetz? Der ursprünglich 1941 eingeführte Begriff ist stigmatisierend und unterstellt eine Defektpersönlichkeit; er ist zudem viel zu unbestimmt. Die Unionsländer hatten dazu im Bundesrat schon vor einigen Jahren einen guten Vorschlag gemacht, den könnte man einfach übernehmen.\n\nUnd was ist mit dem Begriff der rassischen Gruppe im Volksverhetzungsparagrafen, § 130 StGB: Kann die Koalition oder das Bundesjustizministerium einmal erklären, wer mit diesem Begriff gemeint sein soll? Mit dem vorliegenden Gesetz wird zwar § 130 Strafgesetzbuch geändert, was im Inland wahrnehmbare Handlungen, die im Ausland stattfinden, angeht – gut so! –, aber eine wirkliche Reform bekommt die Bundesregierung auch bei dieser Gelegenheit nicht zustande.\n\nInsgesamt handelt es sich gleichwohl um einen ordentlichen Gesetzentwurf, den wir wohlwollend beraten werden.\n\n({1})"
"1042735","Anja","Hajduk","Grüne","Member of Parliament","2020-06-19T00:00:00.000Z","https://dip21.bundestag.de/dip21/btp/19/19167.pdf","\n\nHerr Präsident! Meine sehr verehrten Damen und Herren! Sehr geehrter Herr Minister Scholz! Ja, uns fällt kein Zacken aus der Krone, wie mein Fraktionsvorsitzender gesagt hat, zuzugeben: Dieses Paket ist besser als erwartet oder befürchtet. – Wir als Grüne sind davon überzeugt, dass es jetzt eine aktive Rolle des Staates braucht. Aber dieses Paket hat gravierende Schwächen, und das ist bei der Summe von 130 Milliarden Euro sehr bedauerlich.\n\n({0})\n\nSie haben selber die befristete Mehrwertsteuersenkung als Herzstück bezeichnet. Und in der Tat: Das ist eine 20 Milliarden Euro teure Wette. Das Problem ist: Sie ist nicht wirklich zielgerichtet; dafür ist die Summe von 20 Milliarden sehr, sehr hoch.\n\n({1})\n\nEs ist auch nicht klar, was von diesem Betrag wirklich bei den Menschen ankommt, und es droht dann beim Übergang von 2020 auf 2021, in einer sehr sensiblen Phase, ein Zickzackkurs. Das überzeugt mich und uns nicht.\n\n({2})\n\nAber was ich zugestehen will: Es ist nicht ganz leicht, Konjunkturpakete sehr, sehr wirksam zu konzipieren. – Was mich dann jedoch sehr wundert, ist, dass Sie nicht sehr stark und ausdrücklich Wert darauf gelegt haben, durchzusetzen, dass für mehr Gerechtigkeit gesorgt wird bei denen, die wirklich sehr wenig haben, oder bei denen, die massiv in ihrer beruflichen Existenz bedroht sind.\n\n({3})\n\nDas heißt, Sie hätten mindestens die Regelsätze für Hartz IV anheben müssen. Das wäre auch finanzierbar gewesen.\n\n({4})\n\nEs ist zu Recht gesagt worden: Sie haben doch weiterhin eine Rücklage von knapp 20 Milliarden Euro. – Es ist nicht richtig, den Menschen, die als Kleinunternehmer, als Selbstständige keine Chance haben, ihren Geschäftsbetrieb aufrechtzuerhalten, nur Unterstützung bei den Mieten zu geben,\n\n({5})\n\nsondern die brauchen auch was für ihren Lebensunterhalt. Die Menschen fühlen sich in ihrer Existenz bedroht und alleingelassen.\n\n({6})\n\nIch komme zu einem weiteren Punkt – Herr Scholz, das kann ich Ihnen nicht ersparen –: 40 Milliarden dieser 218 Milliarden Euro, die wir jetzt zusätzlich an Verschuldung machen müssen, sind Steuermindereinnahmen. Das ist ein erwartbarer Effekt bei so einem wirtschaftlichen Einbruch wie dem durch die Coronakrise. Aber wir müssen leider auch zur Kenntnis nehmen, dass gestern die USA aus den OECD-Verhandlungen für eine Besteuerung von Digitalkonzernen ausgestiegen sind. Da zeigt sich, dass es naiv und falsch war von der Bundesregierung und auch von Ihnen, Herr Minister Scholz, allein auf die Verhandlungen auf OECD-Ebene zu setzen bei der Besteuerungsperspektive digitaler Konzerne.\n\n({7})\n\nSie haben nämlich deswegen den Prozess innerhalb der EU ausgebremst.\n\nWarum erwähne ich das heute? Eine Digitalsteuer wäre schon vor Corona wichtig und gerecht gewesen für das sogenannte Level Playing Field. Aber in der Krise haben gerade die digitalen Konzerne besonders profitiert. Und da wird deutlich: Wir machen im Moment keine vernünftige Steuerpolitik, die auch die zur Verantwortung zieht, die es finanzieren können.\n\n({8})\n\nDeswegen kann ich Sie nur auffordern: Bessern Sie da nach! Es gibt keinen Grund zur Selbstzufriedenheit.\n\n({9})\n\n– Die Digitalkonzerne sollen herangezogen werden, indem die unglaublichen Gewinne, die sie machen, besteuert werden.\n\n({10})\n\nEs wäre nur gerecht, Herr Michelbach, wenn wir das auch wirklich im Steuersäckel für die Gemeinschaft hätten.\n\nFazit: Wir brauchen ein Konjunkturpaket, ja. Aber damit es ein generationengerechtes Konjunkturpaket ist, gerade bei der Größe, muss es mit einem langfristigen Zukunftsinvestitionsprogramm verbunden werden. Wir brauchen es als Programm, das unsere Art zu wirtschaften klimaverträglich umgestaltet. Das erwartet die junge Generation, das erwarten auch die Bürgerinnen und Bürger. Ich glaube, die wollen kein Strohfeuer, sondern die wollen einen langfristigen Plan.\n\n({11})\n\nDaran werden wir Sie messen.\n\nHerzlichen Dank.\n\n({12})"
