id,firstname,lastname,faction,position,date, url,speech
"1064482","Maria","Klein-Schmeink","Grüne","Member of Parliament","2021-12-07T00:00:00.000Z","https://dip21.bundestag.de/dip21/btp/20/20004.pdf","\n\nSehr geehrte Frau Präsidentin! Liebe Kolleginnen und Kollegen hier im Hause! Sehr geehrter Herr Stracke, ich muss sagen: Ich bin etwas verwundert und auch enttäuscht. Ich hatte gedacht, dass Sie mit der Zustimmung zum Fristverzicht auch mit uns ein Zeichen hier aus dem Hause aussenden, dass wir uns gemeinsam der Verantwortung stellen in der schwierigen Situation, in der wir jetzt stehen.\n\n({0})\n\nIch hatte gedacht, dass die Zeiten vorbei sind, in denen wir aufeinander zeigen und sagen: Du bist schuld. Du hast dieses und jenes nicht getan.\n\n({1})\n\nIch kann nur sagen: Wir haben versucht, in dieser schwierigen Situation, in der wir noch nicht die Regierung stellen, die passenden Antworten auf die Herausforderungen, die sich jetzt stellen, zu finden.\n\n({2})\n\nDa ist es enttäuschend, dass Sie Dinge anmahnen und von Versäumnissen reden,\n\n({3})\n\naber nicht darüber reden, was wir jetzt tun können, um die Situation zu verbessern.\n\n({4})\n\nGanz konkret: Wie kommen wir beim Impfen voran? Wie schaffen wir es, eine gute Logistik hinzukriegen? Es ist doch ein Jammer, was wir jetzt zu verzeichnen haben,\n\n({5})\n\nnämlich dass wir lange Schlangen vor den Impfzentren haben, dass wir lange Wartezeiten haben, bis in den Praxen ein Termin für eine Boosterimpfung für über 70-Jährige frei ist. Das ist doch die Situation, mit der wir uns jetzt sehr konkret auseinandersetzen müssen. Und genau das tun wir.\n\n({6})\n\nIch finde es sehr bedauerlich, dass Sie da nicht mit uns darum streiten: Wie ist denn jetzt der beste Weg?\n\n({7})\n\nEs geht nicht nur um Instrumentenkästen bzw. Instrumente im § 28a, die überhaupt nicht wahrgenommen worden sind in den letzten beiden Monaten,\n\n({8})\n\nsondern es geht darum, jetzt die richtigen Antworten zu finden, und das, mit Verlaub, können wir nur gemeinsam. Denn diese Gesellschaft kann nur gemeinsam mit dieser schwierigen Situation umgehen.\n\n({9})\n\nWir wissen alle: Mit der neuen Virusvariante kommen Dinge auf uns zu, die wir derzeit sehr, sehr schlecht einordnen können. Wir sehen in den Nachbarländern einen enormen Anstieg der Infektionszahlen. Wir wissen aber noch nicht, ob das auch damit einhergeht, dass die Schwere der Erkrankung zunimmt, dass wir unter Umständen erleben müssen, dass unsere Impfstoffe nicht mehr wirken. Das ist die Realität, mit der wir uns auseinandersetzen müssen. Darauf brauchen wir Antworten, und da brauchen wir Gemeinsamkeit hier in diesem Hause: von links bis zu Ihnen. Bei den Rechten brauchen wir gar nicht nachzufragen; die sind ja sowieso für solche Problemlösungen nicht zu haben. Wenn wir das jetzt nicht gemeinsam angehen, werden wir von der nächsten Welle überrollt, die uns dann erneut Einschränkungen bescheren wird.\n\nDeshalb ist es so wichtig, dass wir mit diesem Gesetzentwurf viele ganz konkrete Vorschläge machen, wie wir mit dem Impfen vorankommen können – indem wir mehr Berufsgruppen einbeziehen –, wie wir es schaffen können, die Logistik besser aufzustellen, wie wir es schaffen können, die, die am meisten gefährdet sind, die älteren Menschen in den Einrichtungen, die Menschen mit Behinderung in den Einrichtungen, die Menschen in der Eingliederungshilfe, alle, die Behandlungen und Eingriffe im Krankenhaus und im Gesundheitswesen brauchen, tatsächlich so zu schützen, dass sie nicht im Februar oder März erneut die Gruppen sind, in denen die meisten Todesfälle zu verzeichnen sind. Deshalb brauchen wir die einrichtungsbezogene Impfpflicht.\n\nWir gehen an dieser Stelle voran und machen ganz konkrete Vorschläge, die wir in einem zügigen Verfahren miteinander erarbeitet haben. Von meiner Seite einen herzlichen Dank an alle – sowohl bei der FDP als auch bei der SPD und meiner Fraktion –, die daran mitgewirkt haben. Es ist ein schwieriges Verfahren gewesen. Wir werden auch Fehler gemacht haben. Aber wir sind willens, da zu korrigieren, wo wir korrigieren müssen. Genau das kündigen wir auch schon an: Wenn wir sehen, dass nachgesteuert werden muss, dann steuern wir auch nach.\n\n({10})\n\nIn diesem Sinne wünsche ich mir eine gemeinsame Verantwortung hier aus diesem Haus.\n\n({11})"
"1064497","Janosch","Dahmen","Grüne","Member of Parliament","2021-12-07T00:00:00.000Z","https://dip21.bundestag.de/dip21/btp/20/20004.pdf","\n\nSehr geehrte Frau Präsidentin! Liebe Kolleginnen und Kollegen! Bevor ich mit meiner Rede beginne, möchte ich doch zunächst etwas zu den Kollegen der Unionsfraktion sagen. Herr Kollege Stracke, Herr Kollege Frei, ich bin doch verwundert über das Geschrei, mit dem Sie hier trotzig einen alten Hut durch die Manege tragen. Sie sagen immer nur, dass Sie nicht verstehen, warum die Gesetzgebung nicht angepasst und weiterentwickelt wurde. In 16 Jahren Regierungszeit – 2 davon in dieser Pandemie – haben Sie es nicht geschafft, dieses Land zu schützen und es darauf vorzubereiten,\n\n({0})\n\ndass eine solche dramatische vierte Welle sich ausbreitet. Wo sind im Sommer die 2-G-Regeln gewesen in diesem Land? Wo wurde im Sommer die Boosterimpfkampagne vorbereitet? Ich verstehe nicht, wie Sie – geschäftsführend in der Bundesregierung, regierend in den Ländern – sich hierhinstellen und sagen können, andere seien daran schuld, dass die Situation so gekommen ist.\n\n({1})\n\nDas hilft niemand weiter.\n\n({2})\n\nEs schadet in allererster Linie der Glaubwürdigkeit unserer Politik, und zwar allesamt: alte und neue Regierung, Bund und Länder.\n\nInsofern lassen Sie uns übergehen zu der Frage: Was sind denn Maßnahmen, die uns weiterbringen? Was ist Gesetzgebung, die sich anpasst und nicht einfach die Verlängerung von irgendetwas Dagewesenem ist, sondern mit neuen Maßnahmen? 2 G bundesweit, 3 G am Arbeitsplatz, 3 G im Nah- und Fernverkehr, eine einrichtungsspezifische Impfpflicht: Das alles sind zusätzliche Schutzinstrumente, die wir früher gebraucht hätten,\n\n({3})\n\ndie dieses Land nach vorne gebracht hätten, aber gefehlt haben. Angesichts einer solchen Bilanz von „too little“ und „too late“ zu sprechen, ist beschämend und irreführend und bringt am Ende des Tages die Politik insgesamt in Misskredit.\n\n({4})\n\nIch will nach vorne schauen und sagen: Wir sollten aufpassen, dass wir insgesamt einem gefährlichen Trugschluss nicht erliegen. Oberflächlich betrachtet ist es tatsächlich so, dass die Inzidenzen in vielen Regionen und bundesweit ein Plateau erreicht haben, in manchen Regionen sogar leicht zurückgehen. Aber das ist tatsächlich – das haben verschiedene Vorredner/‑innen schon deutlich gemacht – noch kein Zeichen für Entwarnung, sondern zeigt lediglich, dass die zuletzt beschlossenen Maßnahmen ihre Wirkung entfalten. Das Infektionsgeschehen insgesamt ist natürlich noch auf einem viel zu hohen Niveau.\n\nWir müssen uns zwei Dinge bewusst machen: Erstens folgt auf eine derart hohe Zahl von Infektionen auch eine Unsicherheit bei den Daten. Wir erleben dieser Tage – das RKI hat das gerade in seinem Wochenbericht auch noch mal ausgewiesen –, dass die Gesundheitsämter nicht nur bei der Kontaktnachverfolgung nicht hinterherkommen, sondern auch bei der Meldung von Neuinfektionen große Probleme haben, weil sie so belastet sind wie noch nie. Viele Labore haben Probleme, die Testkapazitäten so auszuweiten, dass noch alle Tests ausgewertet werden können. Und wir brauchen dringend ein realistisches Lagebild, um zurückzukehren und das Gesundheitssystem wieder resilienter aufzustellen.\n\n({5})\n\nDer zweite Grund – auch das ist schon angesprochen worden – ist die Omikron-Variante. Wir wissen noch nicht alles über diese neue Variante; aber es zeigt sich, dass der R-Wert vermutlich noch mal deutlich höher liegen könnte, als es bei der Delta-Variante der Fall ist, dass die Omikron-Variante so ansteckend wie Masern oder Windpocken sein könnte. Wenn wir jetzt nach vorne schauen, dann müssen wir uns darüber klar sein, dass wir diesen Omikron-Effekt nicht sofort, heute, morgen, an einem Anstieg der Infektionszahlen sehen werden. Er findet versteckt statt, möglicherweise bei fallenden Neuinfektionszahlen, wird langsam ansteigen. Das heißt, konsequent umgesetzte Maßnahmen heute – Masketragen, wie wir es endlich überall, hier auch im Plenarsaal, haben, das Reduzieren von Kontakten im Alltag und insbesondere schnelleres Impfen – sind die Vorsorge für morgen. Hier müssen wir mehr machen,\n\n({6})\n\nalle in persönlicher Verantwortung und mit den heute auf den Weg gebrachten Regeln auch insgesamt im Land.\n\n({7})\n\n„Zu spät, zu wenig und zu langsam“, das ist das Motto einer fehlgeleiteten Politik im Bundesgesundheitsministerium, das uns, von der Union geführt, in diese Situation der vierten Welle gebracht hat. Das darf so nicht weitergehen! Denn mit Blick auf die neuen Virusvarianten muss gelten: Bevor Omikron auf den Intensivstationen ankommt, müssen wir die Zahl der Neuinfektionen massiv gesenkt haben, müssen wir die Impfrate deutlich gesteigert haben.\n\nLiebe Kolleginnen und Kollegen, die einzige Steigerungsform von Überlastung ist der Kollaps. Und weil wir Überlastungen regional längst sehen, müssen wir jetzt alles tun, um einen Kollaps der Versorgung in den Krankenhäusern und Kliniken in diesem Land mit allen Mitteln zu vermeiden.\n\n({8})"
"1064499","Janosch","Dahmen","Grüne","Member of Parliament","2021-12-07T00:00:00.000Z","https://dip21.bundestag.de/dip21/btp/20/20004.pdf","\n\nNein. – Ich möchte nach vorne schauen und sagen: Wenn wir uns die Situation insgesamt anschauen, dann kommt es doch darauf an, dass wir mit dem Gesetz, das wir heute auf den Weg bringen, kurzfristig die Infektionszahlen senken – durch flächendeckende 2-G-Maßnahmen, Kontaktreduktion, Absage von Veranstaltungen, Schließung von Gastronomie, Klubs und Bars –, mittelfristig durch das Boostern und Ausweiten der Impfungen Schutz bieten und langfristig durch so scharfe Instrumente wie eine einrichtungsspezifische Impfflicht bzw. eine allgemeine Impfpflicht – eine Debatte, die wir auf den Weg gebracht haben – für einen besseren Schutz sorgen und damit einen Weg aus dieser Pandemie ebnen.\n\nIch möchte an die Länder gerichtet appellieren: Wir brauchen jetzt die Durchsetzung, die Umsetzung der Maßnahmen in voller Fülle, die wir ermöglichen. Nur so wird Schutz auch möglich und auf den Weg gebracht, nur so verhindern wir, dass Omikron, das längst im Land ist, weiter die Hütte anzündet, und bringen Schutz für die Menschen wirkungsvoll auf den Weg. In diesem Sinne: Lassen Sie uns gemeinsam einen Kollaps verhindern!\n\nVielen Dank.\n\n({0})"
"1064514","Britta","Haßelmann","Grüne","Member of Parliament","2021-12-07T00:00:00.000Z","https://dip21.bundestag.de/dip21/btp/20/20004.pdf","\n\nVielen Dank, Frau Präsidentin. Vielen Dank auch, Herr Kollege Luczak, für die Möglichkeit, Ihnen eine Zwischenfrage zu stellen. – Ich möchte Sie fragen, wann Sie mit dieser Geschichte endlich aufhören. Angesichts der dramatischen Lage, die wir haben, sowohl auf den Intensivstationen als auch für die Betroffenen als auch bei der Unterversorgung, beim Boostern und angesichts all der Probleme, die da sind, wissen Sie doch, dass die Frage, ob hier eine Rechtsnorm zur Feststellung der epidemischen Lage verabschiedet wird oder nicht, überhaupt keine Relevanz hat.\n\n({0})\n\nWann hören Sie endlich auf mit dieser Geschichte? Das ist meine erste Frage.\n\nDiese verbinde ich mit dem Hinweis darauf, dass Sie meinen – ich habe das letztes Wochenende schon gesehen, da stiegen Sie ja in den sozialen Netzwerken in eine Debatte dazu ein –, der arme Ministerpräsident aus Nordrhein-Westfalen, Hendrik Wüst, hätte nicht verhindern können, dass sich im Kölner Fußballstadion 50 000 Fans ohne Maske versammelt haben und dass sich beim Kölner Karneval 25 000 Menschen im Straßenkarneval versammelt haben.\n\nWann hören Sie auf, den Menschen solche Geschichten zu erzählen? Alles war rechtlich möglich. Dafür braucht es diese Gesetzesänderung nicht. Allein der Ministerpräsident aus Nordrhein-Westfalen – zum Beispiel – hatte nicht das Kreuz, das zu veranlassen. Das war der Punkt. Hier braucht es eine Änderung, und das Parlament entscheidet.\n\n({1})"
"1064577","Stefan","Gelbhaar","Grüne","Member of Parliament","2021-12-09T00:00:00.000Z","https://dip21.bundestag.de/dip21/btp/20/20006.pdf","\n\nSehr geehrte Frau Präsidentin! Sehr geehrte Kolleginnen und Kollegen! Was bin ich froh, dass die CSU-Verkehrspolitik vorbei ist!\n\n({0})\n\nGelegentlich war das ganz unterhaltsam, aber in der Summe bleibt es ein Desaster. Sie von der Union haben 16 Jahre lang die Klimakrise und die soziale Ungerechtigkeit auch im Bereich Mobilität verschärft.\n\n({1})\n\nPkw-Maut, Beratermillionen, Dieselgate, Bahnschulden – Sie hinterlassen einen verkehrspolitischen Scherbenhaufen.\n\n({2})\n\nIhr Antrag, den Sie jetzt hier vorgelegt haben, belegt das sogar noch eindrücklich. Sie schreiben da zum Beispiel, dass das Auto in vielen Regionen unverzichtbar sei, gerade auf dem Land. Das ist doch nichts anderes als ein Schuldeingeständnis. Wo war denn die ÖPNV-Offensive auf dem Land für die ländlichen Regionen? Nichts haben Sie da hinbekommen, nichts haben Sie da unternommen! Das muss jetzt anders werden.\n\n({3})\n\nMobilität ist nicht nur Auto. Um einen Aspekt zu benennen: Die Bürgerinnen und Bürger haben der Union die unnötig teure Mobilität zu verdanken – wegen des verschleppten Umstiegs auf Elektromobilität, wegen der Vernachlässigung von Bus und Bahn, wegen immer teurerer Tickets. Herr Schreiner, es sei Ihnen einmal gesagt: 79 Prozent höhere Ticketpreise nur im Zeitraum zwischen 2000 und 2018, 57 Prozent bei der Bahn, das ist eine deutlich krassere Steigerung als bei den Preisen für das Auto.\n\n({4})\n\nHerr Scheuer hat immer sehr gerne von der Spritpreisbremse gesprochen. Ich habe ihn nie etwas dazu sagen hören, dass ihm die Ticketpreise nicht egal wären. Nein, die sind ihm egal gewesen. Und da liegt der Fehler.\n\n({5})\n\nWir werden da einen anderen Weg gehen. Die Ampelkoalition hat sich auf eine deutliche Steigerung der Mobilität mit Bus, Bahn und Fahrrad verständigt. Genau das wird der Verkehrsminister umsetzen.\n\n({6})\n\nNoch ein Wort zum Diesel. Wissen Sie: Die Ampelkoalition verbindet drei unterschiedliche politische Ansätze und Ideen.\n\n({7})\n\nDie gesellschaftlichen Konflikte sind Teil dieser Koalition, und das ist auch gut so. Gesellschaftliche Konflikte werden in der Zukunft nicht mehr abmoderiert. Wir werden sie ausdiskutieren, und wir werden trotz aller Unterschiede gemeinsam mit dem Ministerium Lösungen suchen und finden, entlang von Wort und Sinn des Koalitionsvertrages. Das bedeutet auch, dass wir sozial gerecht klima- und umweltschädliche Subventionen abbauen werden. Das haben wir so vereinbart.\n\n({8})\n\nJeder Autofahrer findet in diesem Land sehr schnell und unproblematisch einen Anwalt. Das ist auch gut so. In dieser Koalition gibt es jetzt einen Anwalt für Klima, Umwelt und, ja, für die Verkehrswende. Die Regierungsarbeit hat gestern begonnen. Es gibt keinen Grund für uns, die vergeudete Amtszeit der Union nachträglich schönzufärben. Ihre Schaufensteranträge bringen da nichts, und deswegen lehnen wir sie ab.\n\nVielen Dank.\n\n({9})"
"1064591","Matthias","Gastel","Grüne","Member of Parliament","2021-12-09T00:00:00.000Z","https://dip21.bundestag.de/dip21/btp/20/20006.pdf","\n\nSehr geehrte Frau Präsidentin! Liebe Kolleginnen! Liebe Kollegen! Ganz schön mutig von der CDU/CSU, einen solchen Antrag zu stellen. Sie sind es gewesen, die drei Legislaturperioden in Folge die Bundesverkehrsminister gestellt haben und eine ganze Reihe von falschen Entscheidungen und Dingen, die liegen geblieben sind, zu verantworten haben.\n\n({0})\n\nSie waren es, die das Ministerium jahrelang lahmgelegt haben mit einer unsinnigen Ausländermaut. Sie waren es, die den Bundesverkehrswegeplan mit 1 360 Straßenbauprojekten völlig überfrachtet haben.\n\n({1})\n\nSie waren es, die einseitig auf die Straße gesetzt und die Schiene vernachlässigt haben.\n\n({2})\n\nLieber Kollege Ploß, sehen Sie doch einmal in den Haushaltsplan dieses Jahres,\n\n({3})\n\nwie viel Geld für die Straße und wie viel für die Schiene vorgesehen ist! Sie sind es, die die Elektrifizierung und die Digitalisierung der Schiene verschleppt haben.\n\n({4})\n\nUnd Sie sind es, die es zu verantworten haben, dass die Klimaziele im Verkehrsbereich krass verfehlt worden sind. Das ist Ihre Verantwortung Ihrer jahrelangen falschen Verkehrspolitik.\n\n({5})\n\nDie Ampelkoalition hat viele Vereinbarungen getroffen, um diesen Stillstand aufzulösen und die notwendigen Entscheidungen herbeizuführen.\n\n({6})\n\nWir haben ehrgeizige Ziele für die Stärkung des öffentlichen Verkehrs und des Schienengüterverkehrs getroffen. Wir wollen erheblich mehr in die Schiene als in die Straße investieren. Wir werden mehr Oberzentren an den Fernverkehr der Bahn anbinden und die Bahn wieder in die Fläche bringen. Wir werden Strecken elektrifizieren; ein wesentlicher Beitrag für die Stärkung des Güterverkehrs auf der Schiene und für die Klimaziele im Verkehrsbereich.\n\n({7})\n\nWir werden dafür sorgen, dass es mehr Gleisanschlüsse in Industriegebieten gibt und mehr Terminals für den kombinierten Verkehr, damit die Verlagerung auf die Schiene gelingt. Wir werden das Straßenverkehrsgesetz und die Straßenverkehrs-Ordnung ökologisch reformieren und den Städten und Gemeinden mehr Handlungsspielräume eröffnen. Das ist gut für den Radverkehr und gut für den Fußverkehr.\n\n({8})\n\nUnter zu vielen CSU-Verkehrsministern ist zu vieles zu lange liegen geblieben. Vieles davon wird die Ampel anpacken.\n\n({9})"
"1064594","Ekin","Deligöz","Grüne","Member of Parliament","2021-12-09T00:00:00.000Z","https://dip21.bundestag.de/dip21/btp/20/20006.pdf","\n\nFrau Präsidentin! Sehr geehrte Kolleginnen und Kollegen! Die neue Koalition bringt heute eine gesetzliche Änderung zu Regelungen der Ganztagsfinanzierung ein. Damit schaffen wir Klarheit und vereinfachen die Investitionen in die Schulkindbetreuung in zwei Punkten.\n\nDer erste Punkt ist, dass die Laufzeit der Beschleunigungsmittel in Höhe von 750 Millionen Euro um ein Jahr verlängert wird. Es hat sich gezeigt, dass diese Gelder nicht so abfließen konnten, wie es eigentlich geplant war. Die Gründe dafür liegen auf der Hand: Lieferengpässe in der Bauwirtschaft, Planungsengpässe im Handwerk, Folgen von Hochwasser, die Pandemie. All diese Gründe lagen vor. Wir als Ampelparteien haben diesen Schritt bereits in der letzten Sitzungswoche angekündigt. Heute setzen wir ihn um.\n\nBitte erlauben Sie mir an dieser Stelle einen ganz herzlichen Dank an meinen Kollegen Sönke Rix und an Herrn Seestern-Pauly. Wir drei haben das verhandelt. Vielen herzlichen Dank für die gute Zusammenarbeit gleich von Anfang an.\n\n({0})\n\nJetzt wird eine Partei, nämlich die CDU/CSU-Fraktion, sagen: Wir haben das doch noch vor Ihnen eingebracht. – Wissen Sie was: Wir hätten nicht so schnell handeln müssen, hätten Sie die handwerklichen Fehler erst gar nicht gemacht. Ihnen haben wir es zu verdanken, dass wir so schnell agieren mussten. Sie wussten nämlich, als das Gesetz damals verabschiedet wurde, dass es diese Probleme gibt. Ihnen ging es gar nicht um die Unterstützung der Kommunen. Womöglich ging es Ihnen auch gar nicht um die Ganztagsschulen. Sie wollten einfach so schnell wie möglich ein Konjunkturmittel auf den Weg bringen, und Symbolik hatte bei Ihnen Vorrang. Deshalb haben Sie diese Fehler gemacht, und diese Fehler korrigieren wir. Das ist unser Plan.\n\n({1})\n\nIch habe in meiner Rede angekündigt, dass es nicht nur darum gehen kann, sondern dass es um ein ganzheitliches Denken geht, dass es darum geht, Fortschritt voranzubringen, dass es darum geht, die Kommunen und die Länder zu unterstützen und die besten Bildungseinrichtungen für die Kinder in diesem Land zu schaffen. Deshalb gehen wir noch einen zweiten Schritt: Wir sorgen dafür, dass nicht nur diese Mittel, sondern die gesamten Ganztagsmittel von allen in Anspruch genommen werden können, dass sie unbürokratisch und einfach abfließen können. Wir machen das Ganze viel einfacher, viel unkomplizierter, viel unbürokratischer, und wir überführen die Bonusmittel in die Basismittel, sodass die Inanspruchnahme auch erfolgen kann. Das nenne ich: ganzheitliches Denken und Handeln.\n\n({2})\n\nEs ist wichtig und richtig, dass wir das so machen, liebe Kolleginnen und Kollegen; denn wir haben gemeinsam ein Bekenntnis zur Ganztagsschule gegeben. Wir haben das im Bundesrat verhandelt. Das Ergebnis ist da. Jetzt geht es nicht um Bund gegen Länder, Länder gegen Kommunen oder wie auch immer, sondern es geht darum, dass wir dieses Ziel gemeinsam entschlossen und ehrgeizig verfolgen.\n\n({3})\n\nAber, liebe Kolleginnen und Kollegen, das kann ich Ihnen auch sagen: Wir werden bei diesem einen Punkt nicht stehen bleiben. Wir haben uns wirklich vorgenommen, die Bildungseinrichtungen in diesem Land bestmöglich zu fördern. Sie können es in unserem Koalitionsvertrag nachlesen: Wir setzen nicht nur auf Quantität; wir setzen nicht nur auf Investitionen. Wir setzen auch auf Qualität, weil auch das zur bestmöglichen Förderung der Bildungseinrichtungen gehört. Wir werden das Gute-KiTa-Gesetz nicht nur verlängern, sondern wir werden es in ein Betreuungsqualitätsgesetz überführen, bei dem es darauf ankommt, die besten Kindergärten für unsere Kinder zu schaffen.\n\n({4})\n\nUm beste Startchancen für unsere Kinder und Jugendlichen zu schaffen, werden wir auch die Schulsozialarbeit in den Schulen erweitern. Die Schulkinderbetreuung wird durch das Investitionsprogramm ergänzt, wo Digitalisierung, moderne Schulen, klimagerechte Bauten und Barrierefreiheit nicht nur gedacht, sondern auch umgesetzt werden.\n\n({5})\n\nAuch die Schulkinderbetreuung wird von diesem Land in Richtung Qualitätsrahmen in der Bildung in einer Ganztagsschuleinrichtung gefördert werden. Das gehört zu den Vorhaben des Bildungsministeriums. Sie sehen: Unsere Ziele in diesem Bereich sind wahnsinnig hoch. Das ist auch richtig und wichtig in diesem Land.\n\nEs ist übrigens auch unumgänglich, dass wir noch ein sehr, sehr wichtiges Thema rausholen: Das ist der Bereich der Fachkräftesicherung. Hier brauchen wir einen großen Kraftakt, nicht nur Symbolik, sondern das Handeln einer entschlossenen Regierung, damit wir die Menschen davon überzeugen können, dass dieses Berufsbild nicht nur attraktiv, sondern auch wichtig für unsere Gesellschaft ist.\n\n({6})\n\nDiese Regierung wird aber noch weiter gehen. Wir packen es an, Kinderarmut zu bekämpfen. Wir wollen nicht, dass jedes fünfte Kind in Armut aufwächst. Wir wollen Alleinerziehende nicht im Stich lassen. Wir haben so vieles vor, um diese Gesellschaft umzubauen. Sie von CDU und CSU finden zumindest erst mal die Fristverlängerung richtig. Das finde ich, ehrlich gesagt, gut. Ich bin gespannt, ob Sie auch dementsprechend abstimmen werden. Uns reicht das nicht. Das ist erst der Anfang. Alles andere sind unsere Hausaufgaben, die wir in der kommenden Zeit umsetzen werden. Bereits in den ersten 100 Tagen werden Sie hier einiges von uns vorgelegt bekommen.\n\nDann wird es darauf ankommen, ob es Ihnen tatsächlich um Kinder und Jugendliche in diesem Land geht, ob Sie uns darin unterstützen werden, dieses Land voranzubringen, ob Sie uns darin unterstützen werden, dieses Land gerechter zu machen. Dann wird sich abzeichnen, ob es Ihnen um Kinder geht, spätestens dann, wenn wir nicht nur im Bundestag, sondern auch im Bundesrat darüber entscheiden werden.\n\nVielen Dank, liebe Kolleginnen und Kollegen.\n\n({7})"
"1064607","Ekin","Deligöz","Grüne","Member of Parliament","2021-12-09T00:00:00.000Z","https://dip21.bundestag.de/dip21/btp/20/20006.pdf","\n\nFrau Kollegin Gohlke, Sie haben gesagt, wir hätten nicht darüber geredet. Ich hoffe, Sie haben mir zugehört; denn in meiner Rede habe ich einen ganz wichtigen Punkt gesetzt. Ich habe gesagt, dass wir genau dafür eine Strategie brauchen, um Bund, Länder, Kommunen, die Träger, alle, die damit befasst sind, an einen Tisch zu holen und gemeinsam nach einer Lösung zu streben. Sind Sie und Ihre Fraktion bereit, mitzuarbeiten, wenn es so weit ist, und uns dabei behilflich zu sein? Die Frage ist doch nicht, ob wir was machen werden; das steht schon fest. Die Frage ist: Sind Sie so weit, uns dann darin zu unterstützen?"
