id,firstname,lastname,faction,position,date, url,speech
"1054275","Margit","Stumpp","Grüne","Member of Parliament","2021-01-29T00:00:00.000Z","https://dip21.bundestag.de/dip21/btp/19/19207.pdf","\n\nSehr geehrte Frau Präsidentin! Sehr geehrte Damen und Herren! Das TK-Modernisierungsgesetz wurde im Dezember zu einem Zeitpunkt vom Kabinett beschlossen, zu dem der europäische Kodex für die elektronische Telekommunikation bereits hätte umgesetzt sein müssen. Ein Vertragsverletzungsverfahren der EU droht. Deswegen sollten 475 Seiten Entwurf seitens der Verbände innerhalb von 48 Stunden kommentiert werden. Die vorgeschriebene und wichtige Beteiligung der Verbände lief damit faktisch ins Leere. Es fällt schwer, die Motivation dafür einzuschätzen: Entweder will man die eigene Agenda durchdrücken, oder man weiß um die Mängel und hat Angst vor berechtigter Kritik. Klar ist: Dieses Vorgehen schlägt sich letztlich negativ auf die Qualität des Gesetzentwurfs nieder. Ein solches Verfahren wird der Bedeutung dieser umfangreichen Novelle einfach nicht gerecht.\n\n({0})\n\nAls Fraktion sehen wir in den Themenbereichen „Verbraucherschutz“, „Datensicherheit“ und „digitale Infrastruktur“ große Baustellen; ich konzentriere mich heute auf Letzteres. Das neue Gesetz könnte zukunftsweisende Regelungen im Bereich der digitalen Infrastruktur festsetzen – könnte. Eine zukunftsfähige Infrastruktur im Festnetz- und Mobilfunkbereich gehört – das spüren wir jetzt mehr denn je – zur staatlichen Daseinsvorsorge. Deswegen fordern wir seit 2011 den Universaldienst, also einen Rechtsanspruch auf eine schnelle – wohlgemerkt: schnelle – Internetverbindung. Jetzt könnte man sagen: Hurra! Endlich ist Einsicht eingekehrt! – Weit gefehlt. Diese Regierung handelt bei der Umsetzung des EU-Kodex wie ein bockiges Kind, das seine Hausaufgaben nur mit größtem Widerwillen erledigt.\n\nWie so oft orientiert sich die Bundesregierung am Minimum der Grundversorgung, die die europäische Vorgabe gerade noch zulässt. Das vollmundig versprochene Recht auf schnelles Internet besteht im Entwurf der Bundesregierung aus einem Mindestangebot an Diensten, die ein angemessener Breitbandinternetzugangsdienst unterstützen können muss. Maßstab des Kabinetts ist quasi eine Mail, die sich mühsam durch Kupfer schleicht.\n\nEine solche Universaldienstverpflichtung wäre vielleicht zu einer Zeit sinnvoll gewesen, als das Internet tatsächlich noch Neuland war. Inzwischen gilt das nicht mal mehr für Hochbetagte, die sich in pandemischen Zeiten tapfer durch die Onlineanmeldung für einen Impftermin klicken müssen.\n\n({1})\n\nDeswegen beantragen wir unter anderem, die Bandbreite dynamisch zu bestimmen und entsprechend der COCOM-Empfehlung zu definieren. Grundlage soll die vertraglich vereinbarte maximale Bandbreite der von 80 Prozent der Nutzer/-innen geschlossenen Verträge sein, nicht die mickrige minimale, die im Kleingedruckten versteckt ist und die ohnehin niemand kennt.\n\nIm Übrigen dauert das Verfahren zur Feststellung der Unterversorgung und zur Bestimmung der Dienstverpflichteten entschieden zu lange. Wer zu Beginn dieser Pandemie interveniert hätte, würde heute noch auf schnelles Internet warten. Das ist eine Zumutung! Im Gegensatz zur Pandemie können wir hier leicht Abhilfe schaffen. Das muss unser gemeinsames Ziel sein.\n\n({2})"
"1054294","Stefan","Gelbhaar","Grüne","Member of Parliament","2021-01-29T00:00:00.000Z","https://dip21.bundestag.de/dip21/btp/19/19207.pdf","\n\nSehr geehrte Frau Präsidentin! Sehr geehrte Damen und Herren! Sollen Bus und Bahn künftig neue Konkurrenz bekommen? Wird es das Taxigewerbe noch geben? Sind Weltkonzerne künftig die beherrschenden Mobilitätsanbieter? Werden unsere Kommunen den Verkehr überhaupt noch steuern können? Das sind vier – zugegeben – zugespitzte Fragen, die an das neue Personenbeförderungsgesetz gestellt werden – vier von vielen. Die Beschäftigten, etwa im Taxigewerbe, betrachten mit Sorge und, ja, mit Argwohn die Entwicklungen – ich sage: zu Recht –, meine Damen und Herren.\n\nVerkehrsminister Scheuer stellte vor langer Zeit ein erstes Eckpunktepapier vor. Die Absicht war klar: die völlige Liberalisierung. Taxiunternehmen mit der Pflicht zur Beförderung, mit Tarifpflicht, mit Fachkundenachweis sollten konkurrieren, und zwar mit Mietwagenunternehmen ohne all diese Pflichten. Das war völlig absurd. Tausende Taxifahrerinnen und Taxifahrer protestierten wütend, und zwar mit Recht, meine Damen und Herren.\n\n({0})\n\nDer Verkehrsminister wusste nicht weiter, also gründete er einen Arbeitskreis. In der sogenannten Findungskommission wurde ein neues Eckpunktepapier mit den Bundesländern und mehreren Fraktionen verhandelt. In dem fanden sich einige innovative Punkte, wie das Pooling mit Kleinbussen oder auch die Zusage von Antidumpingregeln. Das wäre ein notwendiges, ein ausgewogenes Update. Dafür haben wir gearbeitet. Deswegen haben wir als Bündnisgrüne dann auch die positiven Punkte öffentlich benannt. Ein Erfolg war greifbar.\n\nJetzt hat die Koalition allerdings diesen Gesetzentwurf vorgelegt. Ich sage Ihnen: Der Entwurf entspricht nicht den vereinbarten Eckpunkten. Er taugt so nicht.\n\n({1})\n\nUmweltverträglichkeit, Verkehrseffizienz – im Entwurf sind das nur Worthülsen. Kontrollierbare Sozialstandards sucht man vergebens. Von den Rechten der Beschäftigten bei den Busunternehmen ist keine Rede mehr. Und es geht noch weiter. Im Bereich des Mietwagengewerbes wollen Sie die ausbeuterische Praxis der Plattformunternehmen erlauben, sie legitimieren. Wozu brauchen wir das? Die versprochenen und funktionierenden Antidumpingregeln – Mehrzahl! – sind nicht zu finden. So ist das eine Ohrfeige ins Gesicht derer, die jeden Tag unsere Mobilität ermöglichen.\n\n({2})\n\nFür die Fahrgäste: riesige Lücken. Stichwort „Barrierefreiheit“ – beginnend bei den Apps –; kein Wort dazu zu finden. Oder: Warum sollen die Sicherheitsstandards bei Mietwagen eigentlich geringer sein als bei Taxis? Gemeint ist zum Beispiel der Fachkundenachweis. Das versteht keiner. Das muss nachgearbeitet werden.\n\nHerr Scheuer, diese Mogelpackung bekommen Sie hier nicht als Erfolg verkauft. Das ist ganz klar. Daher: Lassen Sie uns die Anhörung und die Beratungen nutzen und diesen Gesetzentwurf vom Kopf auf die Füße stellen! Sonst – das sage ich Ihnen voraus – wird diese Reform scheitern.\n\nVielen Dank.\n\n({3})"
"1054313","Katharina","Dröge","Grüne","Member of Parliament","2021-01-29T00:00:00.000Z","https://dip21.bundestag.de/dip21/btp/19/19207.pdf","\n\nSehr geehrte Frau Präsidentin! Liebe Kolleginnen und Kollegen! Die Coronakrise hat eine soziale Dimension. Menschen mit geringerem Einkommen hatten es im letzten Jahr schwerer, sich und auch andere vor Corona zu schützen; denn die Maßnahmen, wie man sich schützen kann, sind teuer. FFP2-Masken waren in den letzten Monaten teuer. Für Menschen mit geringem Einkommen ist es keine Kleinigkeit, wenn eine Maske teilweise 4, 5 Euro das Stück gekostet hat. Es fällt vielen schwer, so viel zu bezahlen.\n\n({0})\n\nAuch Coronaschnelltests sind teuer. Solange sie nicht zur Selbstanwendung freigegeben werden, solange die Ärzte sie nicht flächendeckend in den Hausarztpraxen auch auf Rechnung der Krankenkassen zur Verfügung stellen, so lange entscheidet der Geldbeutel darüber, ob ich bereit bin, 40 Euro dafür auszugeben und in ein Testzentrum zu gehen, wenn ich Halsschmerzen habe, um auf Nummer sicher zu gehen für meine Angehörigen, die ich so vielleicht schützen kann. 40 Euro sind für viele zu viel. Corona hat eine soziale Dimension!\n\n({1})\n\nAuch mit Blick auf Homeoffice und Homeschooling gibt es eine soziale Dimension: ob meine Wohnung so klein ist, dass Homeoffice fast nicht möglich ist, ob ich so wenig Endgeräte habe, dass ich nicht gleichzeitig Homeoffice und Homeschooling hinkriege. Auch diese soziale Dimension hat Corona.\n\nAuch mit Blick auf die Belastungen hat Corona eine soziale Dimension. Kurzarbeitergeld, das nur bei 70 bis 80 Prozent liegt, ist für Menschen mit geringem Einkommen manchmal zu wenig zum Leben. Und auch die Hartz-IV-Regelsätze, die eh schon viel zu gering sind, waren in dieser Krise nochmals zu gering, um die Zusatzbelastungen, die während Corona entstanden sind, aufzufangen.\n\nDas heißt: Corona hat eine soziale Dimension. Und ich würde es so hart formulieren: Es ist einer der größten Fehler gewesen, den insbesondere Bundeskanzlerin Merkel in dieser Pandemiebekämpfung gemacht hat, dass sie die soziale Dimension von Corona nicht gesehen hat.\n\n({2})\n\nSie hat einen guten Job gemacht – teilweise schon; das muss man sagen –: bei der Langfristbekämpfung, bei dem Sehen, was notwendig ist, um die Ausbreitung des Virus zu stoppen. Aber die soziale Dimension kam in ihren Reden hier im Parlament teilweise kaum vor. Ich hatte manchmal den Eindruck – so hart muss ich das sagen –, dass sie sich mehr für Glühweinstände interessiert hat als für die Armut in diesem Land.\n\n({3})\n\nDeswegen ist es auch richtig, dass Die Linke sich in ihrem Antrag mit dieser sozialen Dimension von Corona noch einmal beschäftigt. Deswegen ist es richtig, dass Menschen in der Grundsicherung und selbstverständlich, sage ich, auch Obdachlose und Geflüchtete diese Masken bekommen. Es ist aber richtig, nicht nur darüber zu sprechen, sondern grundsätzlich einen höheren Zuschlag, einen Krisenzuschlag, zur Grundsicherung zu fordern, um die Menschen in dieser Krise zu unterstützen.\n\n({4})\n\nEs ist auch richtig, wenn alle Arbeitgeber verpflichtet werden, ihren Beschäftigten FFP2-Masken auszugeben. Das Verpflichten, sie auszugeben, heißt ja noch lange nicht, dass die Beschäftigten sie tragen müssen.\n\n({5})\n\nAber jemand, der sich schützen möchte, hat dann die Möglichkeit, wenn er von seinem Arbeitgeber eine solche Maske bekommen hat, sich zu schützen, und er hat auch die Möglichkeit, sich in der Straßenbahn auf dem Weg zur Arbeit zu schützen. Auch das ist für viele ein relevantes Problem.\n\n({6})\n\nLetzter Punkt ist die Preisregulierung. Da schießen Sie als Linke über das Ziel hinaus. Eine Begrenzung der Preisregulierung auf den Selbstkostenpreis wird nicht funktionieren, sondern wird dazu führen, dass in diesem Land im Endeffekt kaum noch Masken angeboten werden. Das kann nicht das Ziel sein. Herr Spahn hat mit der Infektionsschutzverordnung eine Möglichkeit, Preise sinnvoll zu regulieren, indem er den Zuschlag der Händler begrenzt. Dafür bräuchte es allerdings erst mal ein vernünftiges Preismonitoring."
"1054315","Katharina","Dröge","Grüne","Member of Parliament","2021-01-29T00:00:00.000Z","https://dip21.bundestag.de/dip21/btp/19/19207.pdf","\n\nDas haben Sie nicht fortgesetzt. Das wäre der erste Schritt; denn dann würden wir sehen, ob in den Apotheken exzessive Preise erhoben werden, und dann könnten Sie diese auch regulieren.\n\nHerzlichen Dank.\n\n({0})"
"1054323","Maria","Klein-Schmeink","Grüne","Member of Parliament","2021-01-29T00:00:00.000Z","https://dip21.bundestag.de/dip21/btp/19/19207.pdf","\n\nSehr geehrte Präsidentin! Liebe Kolleginnen und Kollegen hier im Raum! Ich glaube, die Debatte geht ein Stückchen am Notwendigen vorbei; denn wenn wir über die Zurverfügungstellung von Masken reden, dann reden wir über die Zurverfügungstellung von Schutzmaterial, und in der Pandemiebekämpfung ist das eines der wesentlichsten Instrumente, die wir überhaupt haben, solange wir noch keinen durchgängigen Impfschutz in der Bevölkerung haben. Deshalb ist diese Debatte ernst zu nehmen.\n\n({0})\n\nNatürlich hat diese Debatte eine große soziale Dimension. Wirksamer Schutz, und zwar der Schutz der eigenen Person – der ist allein mit der FFP2-Maske möglich –, darf nicht vom Geldbeutel abhängig sein. Da müssen wir gegensteuern. Das muss passieren.\n\n({1})\n\nDer erste Schritt im Herbst, dass diejenigen über 60 Jahren und die mit einem gesundheitlichen Risiko eine Maske zur Verfügung gestellt bekommen haben, war richtig. Es war auch richtig, sicherzustellen, dass die Zurverfügungstellung möglichst niedrigschwellig erfolgt. Aber wenn wir uns ansehen, welches Verfahren dafür genutzt wurde, dann müssen wir sagen: Das war hochbürokratisch und sehr teuer. Der Abgabepreis über die Apotheken liegt bei 6 Euro pro Maske. Ich kann Ihnen sagen, bei mir in der Stadt Münster kann ich locker zehn Masken für 12 Euro bekommen. Es gibt Charity-Projekte und andere Projekte, über die sie für 1 Euro abgegeben werden, immer noch verbunden mit einer kleinen Gewinnmarge. Also, da muss man sagen: Dieses Instrument ist leider zu spät gekommen, und das war auch nicht besonders gut gemacht.\n\n({2})\n\nDas muss man kritisieren, zumal Sie dieses Muster fortsetzen wollen, wenn Sie jetzt auch die SGB-II-Beziehenden in das System der Verteilung einbeziehen. Auch das wollen Sie über die Apotheken machen. Wenn Sie das in dieser Machart machen, dann ist das, würde ich sagen, sehr teuer und gleichzeitig nicht wirklich niedrigschwellig. Das sollte man verändern.\n\n({3})\n\nZumindest die Preise müssen Sie dabei in den Blick nehmen. Es kann nicht sein, dass da solch stolze Preise aufgerufen werden. Das ist ja nahezu absurd.\n\nZusätzlich ist sicherzustellen, dass wir diejenigen im Blick haben, die nicht offiziell gemeldet sind, diejenigen, die zu den prekären Gruppen gehören. Weil wir wissen, dass da große Probleme bestehen, gerade hinsichtlich gesundheitlicher und sozialer Belastungen, muss sichergestellt sein, dass mit allen Konzepten, die Minister Heil zusammen mit dem Gesundheitsminister auf den Weg bringt, alle vulnerablen Gruppen erreicht werden. Es darf nicht sein, dass wirksamer Selbstschutz am Geldbeutel scheitert. Wir alle wissen, dass mit den Virusvarianten dieser Schutz notwendiger denn je wird. Deshalb ist es eine eminent wichtige gesundheitspolitische Maßnahme des Infektionsschutzes und der Pandemiebekämpfung, wenn wir für alle den Zugang möglichst niedrigschwellig und kostenfrei gestalten.\n\nDanke schön.\n\n({4})"
"1054328","Maria","Klein-Schmeink","Grüne","Member of Parliament","2021-01-29T00:00:00.000Z","https://dip21.bundestag.de/dip21/btp/19/19207.pdf","\n\nHerr Sorge, Sie rechnen jetzt mit der Linken so martialisch ab. Aber letztendlich ist es so, dass das Infektionsschutzgesetz durchaus die Möglichkeit schafft, preisbegrenzend in die Beschaffung einzugreifen. Das hat der Minister bei der Infektionsschutzverordnung, bei den Antigentests im Dezember durchaus auch gemacht, mit einem gar nicht so unklugen Instrument des Festzuschlags, um eben die Handelsspanne zu begrenzen. Das scheint mir ein durchaus gängiger und gangbarer Weg zu sein.\n\nSie haben das aber gerade so massiv abgelehnt. Haben Sie denn für sich klar, können Sie sicher sagen, wie die Marktentwicklung in diesem Bereich sein wird, wenn es tatsächlich zu einer großen Ausbreitung der Virusvariante käme? Dann würde den FFP2-Masken noch einmal eine ganz besondere Bedeutung zukommen, und da wäre es wichtig, das Instrument der Marktbeobachtung, regelmäßig, zu haben. Wir mussten im Ausschuss diese Woche lernen, dass es das als regelmäßiges Instrument jedenfalls im Wirtschaftsministerium nicht gibt. Ich meine auch, gehört zu haben, dass es das im BMG nicht als systematisches Instrument gibt.\n\nAlso, Sie müssen sich auf Instrumente der Marktbeobachtung und ‑beherrschung einstellen. Was halten Sie von solchen Maßnahmen? Halten Sie sie für durchgängig nicht notwendig? Woran machen Sie das fest?\n\n({0})"
"1054346","Konstantin","Notz","Grüne","Member of Parliament","2021-01-29T00:00:00.000Z","https://dip21.bundestag.de/dip21/btp/19/19207.pdf","\n\nFrau Präsidentin! Meine sehr verehrten Damen und Herren! Hier und heute geht es um nichts weniger als die Verrechtsstaatlichung einer Praxis, die vom BND über viele, viele Jahre nicht nur in irgendeinem Graubereich, sondern schlichtweg rechtswidrig durchgeführt wurde.\n\nDie von Edward Snowden und dem Untersuchungsausschuss dieses Hohen Hauses aufgedeckte Praxis deutscher Behörden in einem weltumspannenden geheimdienstlichen Überwachungssystem hat die digitalen Bürgerrechte von Millionen von Menschen im In- und Ausland jahrelang verletzt. Das war ein Skandal, und das bleibt ein Skandal, meine Damen und Herren.\n\n({0})\n\nMit hanebüchenen Konstrukten wie der Weltraumtheorie hat man verfassungswidrige Praktiken scheinlegitimiert. Als auch dies offenkundig wurde, hat die Große Koalition sie einfach in ein Gesetz geschrieben. So was fliegt einem in Karlsruhe um die Ohren, und zwar zu Recht, liebe Kolleginnen und Kollegen.\n\n({1})\n\nDas Bundesverfassungsgericht hat in seiner Grundsatzentscheidung deutlich gemacht, wie zentral eine wirksame, unabhängige Kontrolle für die Legitimität der Nachrichtendienste ist. Deswegen begrüßen wir grundsätzlich die Auflösung der Third-Party-Rule-Problematik durch die Schaffung eines Unabhängigen Kontrollrats in der Sphäre der Exekutive. Aber, meine Damen und Herren, das Zentrum der Kontrolle nachrichtendienstlicher Betätigung in einem verfassten demokratischen Rechtsstaat ist und bleibt das Parlament, dieses Parlament – so steht es in unserem Grundgesetz.\n\n({2})\n\nMit einem Kontrollrat, der sich weitgehend losgelöst vom Parlament konstituiert und sich selbst reguliert, schwächt man dieses demokratisch legitimierte Parlament und verliert in der breiten Öffentlichkeit weiter Vertrauen. Deswegen brauchen wir eine Stärkung und Vernetzung aller Ebenen von Kontrollen, bei dem das PKGr gestärkt im Mittelpunkt steht, eine stärkere und weitere Professionalisierung der G-10-Kontrolle, mehr technischen Sachverstand und ungehinderten Kontrollzugang zu den Systemen selbst sowie eine Stärkung des BfDI. Und: Wer SIGINT sagt, muss auch HUMINT sagen. Der völlig unregulierte Bereich der Quellenführung muss endlich parlamentarisch kontrolliert werden, meine Damen und Herren.\n\n({3})\n\nWirksame Kontrolle, Transparenz, Nachvollziehbarkeit für die Nachrichtendienste und die Exekutive schafft die Legitimität, die wir in einem Rechtsstaat brauchen. Es wäre sehr, sehr wünschenswert, meine Damen und Herren, wenn das hier nach all den Problemen und Skandalen der letzten Jahre endlich der Grundkonsens aller demokratischen Fraktionen wird; denn der BND macht in diesen schwierigen Zeiten eine enorm bedeutsame und wichtige Arbeit. Deswegen möchte ich es nicht versäumen, den Präsidenten und seine Mitarbeiterinnen und Mitarbeiter auf der Tribüne zu begrüßen. Schön, dass Sie da sind, meine Damen und Herren.\n\n({4})\n\nLassen Sie uns gemeinsam den rechtsstaatlichen Goldstandard setzen, den wir für diese Tätigkeit im digitalen Zeitalter brauchen. Unser Antrag gibt dafür gute Vorschläge vor. Ich freue mich auf die Beratungen.\n\nHerzlichen Dank.\n\n({5})"
"1054367","Manuela","Rottmann","Grüne","Member of Parliament","2021-01-29T00:00:00.000Z","https://dip21.bundestag.de/dip21/btp/19/19207.pdf","\n\nSehr geehrte Frau Präsidentin! Liebe Kolleginnen und Kollegen! Wir sind uns mit der FDP-Fraktion und – da teile ich Ihre Wahrnehmung der Anhörung – mit allen Sachverständigen einig, dass die derzeitige Impfverordnung über keine gesetzliche Grundlage verfügt.\n\n({0})\n\nEs geht hier nicht um Gesetz oder Verordnung. Jede Verordnung braucht eine gesetzliche Grundlage, und an der fehlt es.\n\n({1})\n\nUnd solange der Impfstoff knapp ist, birgt seine Verteilung natürlich Konfliktpotenzial. Ja, es gibt bereits Klagen auf Impfungen und gegen diese Verordnung, und jedes Verwaltungsgericht in Deutschland kann diese Verordnung außer Kraft setzen. Es ist unsere Aufgabe als Gesetzgeber, solche wesentlichen Fragen zu entscheiden und vermeidbare Konflikte nicht den Kommunen oder den Gerichten vor die Tür zu kehren, erst recht nicht, wenn es um eine so zentrale Frage wie die Impfung gegen Covid-19 geht.\n\n({2})\n\nUnd ich verstehe nicht, warum die Koalition dieses völlig unnötige Risiko eingeht.\n\nDass der Impfstoff nicht EU-weit oder, wie es eigentlich nötig wäre, weltweit sofort verfügbar ist, kurz nach der Zulassung, ich finde, das muss jedem vernünftigen Menschen vorher klar gewesen sein. Aber Sie riskieren in dieser schwierigen Situation nun auch noch, dass Ihnen die Regelungen für die Verteilung gekippt werden. Wenn das passiert, dann tragen Sie allein, Sie von Union und SPD, dafür die Verantwortung.\n\n({3})\n\nDer Gesetzentwurf der FDP zeigt aber auch die Schwierigkeit, in einer extrem dynamischen Lage gesetzlich bestimmte Regelungen zu fassen. Wir finden, es ist Ihnen nicht gut gelungen, das richtige Maß an gesetzgeberischer Bestimmtheit und nötiger Flexibilität zu treffen. Auf der einen Seite gibt es da den § 3, der geradezu detailversessen die Impfreihenfolge durchregulieren will. Auf der anderen Seite erteilen Sie dann aber in § 6 eine Verordnungsermächtigung, die diese detaillierte Regelung in § 3 wieder völlig zur Disposition stellt.\n\n({4})\n\nIch finde, die Verordnungsermächtigung der FDP ähnelt damit – mit Ausnahme der Beteiligung des Bundestags – sehr stark den anderen Ermächtigungen in § 5 Infektionsschutzgesetz, an deren Bestimmtheit wir höchste verfassungsrechtliche Zweifel haben.\n\n({5})\n\nWir wissen seit gestern, dass der AstraZeneca-Impfstoff nur eine Zulassung für Erwachsene unter 65 Jahren erhalten wird. Das heißt, dass die in Ihrem Gesetz durchformulierte Reihenfolge in § 3 eigentlich schon wieder hinfällig ist. Deswegen finden wir, mit Ihrem Entwurf ist gegenüber dem Status quo zu wenig gewonnen. Dennoch: Die FDP hat sich Verdienste erworben, weil sie das Thema auf die Tagesordnung gesetzt hat.\n\n({6})\n\nWir haben einen anderen Vorschlag eingebracht. Wir wollen zum Beispiel die Belange von Menschen mit Behinderung stärker einbeziehen sowie die Belange der übrigen Gruppen und die Perspektive der Antidiskriminierungsstelle mit berücksichtigen. Wir wollen, dass die Impfung von pflegenden Angehörigen höher gewichtet wird als bisher, um diesen zu ersparen, dass sie monatelang in die Selbstisolation müssen. Wir schlagen aber vor, dass wir zur Impfreihenfolge nach den groben gesetzlichen Maßgaben, die wir machen, auf den Verordnungsweg verweisen, schreiben allerdings auch eine Beteiligung von Bundestag und Bundesrat fest. Wir glauben, wir genügen so den Anforderungen von Artikel 80 Grundgesetz.\n\nWir bitten daher alle um Zustimmung zu unserem Antrag. Es ist auch in Ihrem Interesse, im Interesse der Koalition.\n\nDanke schön.\n\n({7})"
