id,firstname,lastname,faction,position,date, url,speech
"1022512","Beate","Müller-Gemmeke","Grüne","Member of Parliament","2019-04-04T00:00:00.000Z","https://dip21.bundestag.de/dip21/btp/19/19092.pdf","\n\nSehr geehrter Herr Präsident! Sehr geehrter Herr Minister! Sehr geehrte Kolleginnen und Kollegen! Sehr geehrte Gäste! Die Internationale Arbeitsorganisation schätzt, dass in der EU mehr als 600 000 Menschen von Arbeitsausbeutung betroffen sind, und diese findet auch in Deutschland statt. Diese Menschen bekommen entweder gar keinen Lohn oder zu wenig, und sie haben häufig hohe Abzüge für Vermittlung, Unterkunft oder Verpflegung. Sie müssen lange und hart arbeiten – häufig unter gefährlichen Bedingungen. Sie leben in Matratzenlagern oder in baufälligen Unterkünften. Sie werden ausgebeutet, getäuscht, betrogen und menschenunwürdig behandelt. Das darf es nicht geben. Wir müssen die Menschen vor Arbeitsausbeutung schützen.\n\n({0})\n\nArbeitsausbeutung hat auch Folgen für das Gemeinwesen. Die Stichworte sind „Steuerhinterziehung“ und „Sozialversicherungsbetrug“. Wie hoch die Schäden eigentlich sind, weiß niemand. Davon betroffen sind auch die verantwortungsvollen Unternehmen; denn sie müssen sich gegen diese Schmutzkonkurrenz behaupten. Deshalb wurde vor drei Jahren das Strafgesetzbuch geändert, um Arbeitsausbeutung, Menschenhandel und Zwangsarbeit besser greifen zu können. Diese Änderung brachte aber keinen Erfolg. Das zeigen die Zahlen, die ich gerade erst abgefragt habe: Im Jahr 2017 gab es gerade einmal fünf Ermittlungsverfahren wegen Ausbeutung der Arbeitskraft. Bei Zwangsarbeit waren es ganze drei Verfahren.\n\nArbeitsausbeutung muss also endlich effektiv bekämpft werden,\n\n({1})\n\nund deshalb geht der Gesetzentwurf an dieser Stelle in die richtige Richtung. Auch wir wollen die Finanzkon­trolle Schwarzarbeit stärken.\n\n({2})\n\nEs ist wichtig, dass die FKS endlich bei Verdacht auf ausbeuterische Arbeitsbedingungen ermitteln darf. Gut sind zum Beispiel auch tarifliche Mindeststandards für Unterkünfte im Arbeitnehmer-Entsendegesetz, deren Einhaltung kontrolliert wird. Und gut ist auch, dass die FKS besser gegen die Ausbeuter vorgehen kann, die Tag für Tag Arbeitskräfte für billiges Geld von der Straße holen.\n\nWas wir aber in diesem Zusammenhang strikt ablehnen, sind Strafen gegen die Menschen, die ausgebeutet werden. Nicht die Menschen, sondern die Ursachen von Armut und Perspektivlosigkeit müssen bekämpft werden.\n\n({3})\n\nAuch an anderen Stellen haben wir noch Diskussionsbedarf. Die Stichworte sind „kleine Staatsanwaltschaft“, „das Betreten der Unterkünfte ohne richterlichen Beschluss“, „Datenschutz“ und insbesondere die „Telekommunikationsüberwachung“. Das sind schon harte Eingriffe,\n\n({4})\n\nund die müssen genau überlegt und insbesondere gut begründet sein.\n\n({5})\n\nPositiv wiederum ist, dass die Finanzkontrolle Schwarzarbeit mehr Personal bekommen soll. Das fordern wir schon lange. Das Problem ist nur – jetzt hört der Herr Minister nicht zu –, dass mittlerweile 1 300 Stellen, und zwar von den alten Stellen, nicht besetzt sind. Das heißt, Herr Minister, Sie dürfen nicht nur ankündigen, sondern Sie müssen auch endlich liefern!\n\n({6})\n\nWir Grünen wollen, dass es gerecht zugeht auf dem Arbeitsmarkt. Arbeitsausbeutung darf es nicht geben. Wir wollen faire und gleiche Bedingungen für die Unternehmen. Im Ziel sind wir uns also einig. Aber darüber, ob dieses Ziel alle geplanten Mittel und Befugnisse rechtfertigt, werden wir im Ausschuss noch heftig diskutieren müssen.\n\nVielen Dank.\n\n({7})"
"1022526","Wolfgang","Strengmann-Kuhn","Grüne","Member of Parliament","2019-04-04T00:00:00.000Z","https://dip21.bundestag.de/dip21/btp/19/19092.pdf","\n\nHerr Präsident! Liebe Kolleginnen und Kollegen! Es gab einmal einen SPD-Politiker, dessen Motto war: „Versöhnen statt spalten.“ Er war Ministerpräsident in Nordrhein-Westfalen, sogar zeitweise mit absoluter Mehrheit – so etwas gab es damals noch –,\n\n({0})\n\nund später Bundespräsident. Jetzt gibt einen stellvertretenden Vorsitzenden der SPD und Vizekanzler, der von sich sagt, er könne auch Kanzler werden, der immer vorne mit dabei ist, wenn es um die Einschränkung von Sozialleistungen von Unionsbürgerinnen und Unionsbürgern geht.\n\nIch rede über einen Paragrafen, der sich hier so ein bisschen eingeschmuggelt hat. Da geht es nicht um Sozialmissbrauch; es geht auch nicht um Kinder, die nicht vorhanden sind, sondern es geht um Kinder, die hier rechtmäßig leben. Es geht um Familien, die nach Deutschland kommen. In diesem Gesetzentwurf steht, dass diese kein Kindergeld erhalten sollen. Und das geht gar nicht.\n\n({1})\n\nDas geht gar nicht, weil es aus sozialpolitischen Gründen verwerflich ist, wenn Familien, die hier rechtmäßig leben, das Kindergeld verweigert wird. Es ist übrigens eine Ergänzung im Einkommensteuerrecht. Das macht noch einmal deutlich, um welche Leistung es hier geht: Es ist eben keine Sozialhilfeleistung. Solche Leistungen, Leistungen im Einkommensteuerrecht, aber auch Familienleistungen insgesamt, dürfen nach EU-Recht nicht eingeschränkt werden.\n\n({2})\n\nSie verstoßen mit diesem Absatz klar gegen EU-Recht. Es gibt eine ausführliche Stellungnahme des Deutschen Anwaltvereins, in der das ganz klar und eindeutig erklärt wird. Lesen Sie die mal! Dann wissen Sie, dass der Paragraf dagegen verstößt.\n\nIch frage mich: Was sagt eigentlich die Spitzenkandidatin der SPD zur Europawahl dazu? Sie ist ja, glaube ich, noch Justizministerin und Mitglied in diesem Kabinett. Sie muss dem ja auch zugestimmt haben – einem Paragrafen, der klar gegen EU-Recht und gegen grundlegende EU-Prinzipien verstößt.\n\nIch appelliere an die Fraktionen hier – Sie haben ja „christlich“ und „sozial“ in Ihrem Namen –, an alle, die noch christlich und sozial oder auch europäisch denken oder sich mit europäischem Recht auskennen: Sorgen Sie dafür, dass dieser Paragraf aus diesem Gesetzentwurf gestrichen wird.\n\nVielen Dank für die Aufmerksamkeit.\n\n({3})"
"1022548","Beate","Müller-Gemmeke","Grüne","Member of Parliament","2019-04-04T00:00:00.000Z","https://dip21.bundestag.de/dip21/btp/19/19092.pdf","\n\nSehr geehrter Herr Präsident! Sehr geehrte Kolleginnen und Kollegen! Sehr geehrte Gäste! Wir haben gerade über einen Gesetzentwurf der Bundesregierung diskutiert, mit dem die Finanzkontrolle Schwarzarbeit gestärkt werden soll. Jetzt fordert die FDP mit ihrem Antrag genau das Gegenteil und redet nur über Bürokratie.\n\nFür uns Grüne geht es bei diesem Thema um die Menschen. Es geht um die Beschäftigten, die von ihrem Lohn kaum leben können. Es geht beispielsweise um die Bedienung im Restaurant, um die Reinigungskraft im Hotel, um den Postboten und um die Beschäftigten in der Fleischbranche. Genau diese Menschen müssen darauf vertrauen können, dass der Mindestlohn nicht nur auf dem Papier steht, sondern auch wirklich gezahlt wird.\n\n({0})\n\nEs darf keine Lücken und keine Möglichkeiten geben, den Mindestlohn zu unterlaufen. Deswegen muss der Mindestlohn effektiv kontrolliert werden. Dennoch möchte die FDP die Dokumentationspflichten einschränken. Sie meinen ja, für Kontrollen würden die Dauer der Arbeitszeit und der ausgezahlte Lohn ausreichen. In Ihrem Antrag schreiben Sie sogar, für die Arbeitszeit sei schon der Arbeitsvertrag eine ausreichende Dokumentationsbasis und außerdem könnten die Beschäftigten ja klagen, wenn irgendetwas nicht stimmt. Liebe FDP, das ist absurd; denn das geht in vielen Fällen an der Realität vorbei.\n\n({1})\n\nWer sich schon einmal mit Kontrollen beschäftigt hat, dem ist bekannt, dass jemand, der Mindestlöhne umgehen will, das über die Arbeitszeit macht. Da hilft der Blick in den Arbeitsvertrag kein bisschen. Deshalb fragt die Finanzkontrolle Schwarzarbeit bei den Beschäftigten nach. Sie schaut sich die Abläufe in den Betrieben genau an.\n\n({2})\n\nDas alles vergleicht sie dann mit den dokumentierten Arbeitszeiten. Dafür braucht sie nicht die Dauer der Arbeitszeit, sondern die tatsächlichen Arbeitszeiten. Nur so kann die Finanzkontrolle Schwarzarbeit den Mindestlohn effektiv überprüfen. Deshalb müssen die Dokumentationspflichten so bleiben, wie sie sind.\n\n({3})\n\nDiese Aufzeichnungspflichten gelten ja nicht für alle. Bei den Minijobs – das kritisieren Sie ja – macht das aber Sinn; denn gerade hier werden häufig die Rechte der Beschäftigten missachtet. Dann ist die Gefahr groß, dass am Lohn und an den Arbeitszeiten etwas gedreht wird. Entscheidend ist aber: Diese Dokumentationspflichten gelten nur für die Branchen, die im Schwarzarbeitsbekämpfungsgesetz stehen. Herr Kemmerich, ich bin mir nicht sicher, ob Sie das tatsächlich verstanden haben. Es geht nur um diese Branchen. Der Fokus auf diese Branchen ist auch nicht willkürlich, ist nicht vom Himmel gefallen. Das sind Erfahrungswerte – wie vor kurzem bei den Kontrollen in der Logistikbranche, die ergeben haben, dass jeder dritte Arbeitgeber zu wenig Lohn zahlt. Für diese missbrauchsanfälligen Branchen möchten Sie, die FDP, jetzt die Dokumentationspflichten reduzieren. Das geht gar nicht;\n\n({4})\n\ndenn der Gesetzgeber muss seiner Schutzverantwortung für die Beschäftigten gerecht werden.\n\nDann gibt es auch noch die Kritik am Schwellenwert, ab dem dokumentiert werden muss. Sind 2 958 Euro oder 2 000 Euro richtig oder willkürlich? An dieser Stelle möchte ich einmal ganz grundsätzlich werden; denn die Empörung der FDP ist so groß, dass man fast meinen könnte, durch den Mindestlohn gäbe es zum ersten Mal die Pflicht, die Arbeitszeit zu dokumentieren. Und das ist einfach falsch.\n\nDarf ich mal kurz etwas sagen? Die Antragsteller in der ersten Reihe schauen nur aufs Handy. Das finde ich irgendwie komisch.\n\n({5})\n\n– Ich wollte nur einmal sagen, dass mich das irritiert.\n\n({6})\n\nIch werde jetzt also etwas grundsätzlicher. Laut Arbeitszeitgesetz müssen alle Überstunden dokumentiert werden. Aber wie sollen die nachgewiesen werden, wenn die anderen Stunden gar nicht dokumentiert werden? Der Arbeitgeber muss auch darauf achten, dass die gesetzlichen Grenzen bei der Arbeitszeit und die Ruhezeiten eingehalten werden. Schon allein deswegen muss der Arbeitgeber wissen, wann und wie viel seine Beschäftigten arbeiten. Für die Sozialversicherung muss auch das Arbeitsentgelt nachgewiesen werden, und zwar die Zusammensetzung und die zeitliche Zuordnung. Außerdem gibt es genau die gleichen Dokumentationspflichten im Arbeitnehmer-Entsendegesetz und bei der Arbeitnehmerüberlassung. Diese Dokumentationspflichten sind also nicht neu. Bevor Sie sich empören und etwas fordern, sollten Sie erst einmal die Gesetzeslage zur Kenntnis nehmen.\n\n({7})\n\nDie Dokumentation der Arbeitszeit ist im Übrigen auch keine unzumutbare Belastung für die Unternehmen. Im Gegenteil: Sie macht Sinn, und zwar für beide Seiten. Die Beschäftigten können damit ihre Arbeitsstunden nachweisen, damit sie gerecht entlohnt werden. Die Arbeitgeber können die Arbeitszeiten ihrer Beschäftigten kontrollieren. Mir kann keiner erzählen, dass daran niemand Interesse hat. Immerhin wurde die Stechuhr nicht von der Politik, sondern von den Unternehmen eingeführt.\n\nArbeitszeiten können auch ganz einfach erfasst werden. Viele Möglichkeiten sind hier genannt worden. Das ist kein Bürokratiemonster.\n\n({8})\n\nHier sollte sich die FDP den eigenen Wahlslogan, der schon zitiert wurde, einfach einmal zu Herzen nehmen: Digital first, Bedenken second. – Ich finde, dass das auch bei der Dokumentation der Arbeitszeit gelten sollte.\n\n({9})\n\nVielen Dank.\n\n({10})"
"1022582","Jürgen","Trittin","Grüne","Member of Parliament","2019-04-04T00:00:00.000Z","https://dip21.bundestag.de/dip21/btp/19/19092.pdf","\n\nHerr Präsident! Meine Damen und Herren! Manche Feindbilder halten länger als manche Verteidigungsbündnisse. Wenn Sie zurückblicken auf die Zeit vom 16. Jahrhundert bis heute, dann stellen Sie fest, dass die durchschnittliche Dauer von solchen Verteidigungsbündnissen 15 Jahre beträgt. Gemessen daran ist die NATO mehr als viermal so alt. Das ist unzweifelhaft ein Erfolg.\n\nAm Beginn der NATO stand der berühmte Satz des späteren ersten Generalsekretärs: To keep the Russians out, to keep the Americans in and to keep the Germans down. – Gemessen daran hat die NATO unzweifelhaft etwas erreicht.\n\n({0})\n\nWenn der Sowjet gewollt hätte – er ist nicht gekommen; wir haben ihn erfolgreich rausgehalten.\n\nEs ist richtig, dass im Rückblick die Chance vertan wurde, nach dem Wegfall des Warschauer Paktes die NATO in ein System kollektiver Sicherheit ganz Europas zu überführen. Wir müssen hinzufügen, dass 2014 ausgerechnet die Außenpolitik von Wladimir Putin die NATO relegitimiert hat. Die Annexion der Krim, der anhaltende Konflikt in der Ostukraine – das alles hat jene europäische Friedensordnung infrage gestellt, und zwar durch Russland, das einst die Sowjetunion mitgeschaffen hat. Mit diesem Konflikt, mit dieser Krise ist die Kernfähigkeit dessen, was die NATO kann, wieder gefordert worden, nämlich kollektive Selbstverteidigung.\n\n({1})\n\nMan muss feststellen, dass die Situation der anderen Anforderungen dieses Satzes schwieriger geworden ist. Im 70. Jahr seit ihrer Gründung befindet sich die NATO in einer existenziellen Krise. Es stellt sich offen die Frage, ob es noch gelingt, „the Americans in“ zu halten. Der Bundesaußenminister hat gesagt: Das hat Trump gar nicht so gemeint. – Aber andere haben das sehr viel ernster genommen. Das ist der Grund, warum Nancy Pelosi und Lindsey Graham parteiübergreifend – die sind sich sonst in keiner Frage einig – im US-Kongress die Mehrheit für einen Beschluss gefunden haben, der es Donald Trump verbietet, einfach aus der NATO auszutreten. Dem Tweet „Raus aus der NATO, rein ins Vergnügen“ ist ein Riegel vorgeschoben worden.\n\n({2})\n\nDie Kolleginnen und Kollegen im US-Kongress haben aber mit etwas ganz anderem bezogen auf „Ger­mans down“ ein Problem. Sie glauben nämlich, dass wir zu wenig fürs Militär ausgeben. CDU, FDP und AfD sehen das ebenso. Die Kollegen von der SPD wissen das nicht so recht. Partei und Fraktion weisen die Bezugnahme auf 2 Prozent zurück. Heiko Maas hat gestern und heute lauthals versichert: Wir stehen zu unseren Zusagen. – Olaf Scholz gewährt Ursula von der Leyen 1 Milliarde Euro mehr in der Finanzplanung. Aber er streicht dem Ministerium für wirtschaftliche Zusammenarbeit und dem Außenministerium 1,5 Milliarden Euro. Während CSU-Müller dagegen auf die Barrikaden geht, sagt Heiko Maas artig Danke. Ich sage Ihnen: Man schafft keine Sicherheit, indem man bloß aufrüstet und gleichzeitig die Mittel für Diplomatie und Entwicklung zusammenstreicht.\n\n({3})\n\nDas solltest du eigentlich wissen, Niels Annen.\n\nIch finde, es ist nötig, in einer solchen Situation Klartext zu reden. Es gibt keine Beiträge zur NATO. Es gibt nicht einmal eine Beitragsordnung in der NATO. Die Wahrheit ist: Europas NATO-Mitglieder investieren in die Sicherheit heute dreimal so viel wie Russland – ohne die USA, ohne Kanada. Nicht jede Militärausgabe erhöht die Sicherheit, auch das ist richtig. Denken Sie einmal an den weltweiten Drohnenkrieg der USA. Denken Sie an die Ausgaben der Türkei für einen völkerrechtswidrigen Krieg in Syrien. All das erhöht unsere Sicherheit nicht.\n\n({4})\n\nDie Bezugnahme auf das Bruttoinlandsprodukt ist bedeutungslos. Estland zum Beispiel ist viel zu klein, um sich alleine verteidigen zu können. Deswegen sind sie im Bündnis, und wir ergreifen Maßnahmen, um Estland mit zu schützen. Aber von 2 Prozent des Bruttoinlandsprodukts von Estland können Sie vielleicht die „Gorch Fock“ reparieren, aber nicht Annegrets neuen Flugzeugträger bezahlen.\n\n({5})\n\nIch sage Ihnen: Es ist gefährlich, dass deutsche Soldaten in Mali von Hubschraubern aus Mittelamerika abhängig sind. Und es ist peinlich, wenn es in internationalen Missionen an Nachtsichtgeräten und Hubschraubern fehlt. Aber wenn Sie all diese Ausrüstungsdefizite beseitigt haben, dann werden Sie immer noch um Milliarden Euro von den 2 Prozent entfernt sein.\n\n({6})\n\nDeswegen sollte der 70. Jahrestag ein Anlass sein, dass Sie sich ehrlich machen. Deutschland wird die 2 Prozent nicht erfüllen. Es gibt dafür keine militärische Notwendigkeit, und ich sage Ihnen auch: Es gibt dafür keine politische Mehrheit und erst recht nicht nach Neuwahlen.\n\n({7})\n\nDas NATO-Bündnis ist im deutschen Interesse: Kollektive Verteidigung schafft Sicherheit. Aber es geht um noch etwas mehr: Es geht auch um Selbsteinbindung. Wir mit unserer Geschichte haben gute Gründe, unser Militär in Bündnisse einzubinden. Wir wollen keine militärischen Alleingänge. Dafür bleibt die NATO weiterhin wichtig.\n\n({8})"
"1022604","Wolfgang","Strengmann-Kuhn","Grüne","Member of Parliament","2019-04-04T00:00:00.000Z","https://dip21.bundestag.de/dip21/btp/19/19092.pdf","\n\nFrau Präsidentin! Liebe Kolleginnen und Kollegen! Die großen Herausforderungen, die auf uns zukommen – Klimakrise, globale Gerechtigkeit, Digitalisierung, Globalisierung –, werden wir nur durch eine starke Europäische Union meistern können.\n\n({0})\n\nDeswegen brauchen wir nicht mehr Nationalismus, sondern mehr Europa. Wir brauchen mehr Zusammenhalt in der EU; denn nur gemeinsam sind wir stark.\n\n({1})\n\nLeider ist der Zusammenhalt in der EU bedroht. Mit dem Brexit bricht jetzt sogar ein ganzes Land weg. Aber auch in den anderen Ländern gibt es nationalistische Bestrebungen, nationalistische Parteien, die die EU schwächen wollen. Diesen nationalistischen Parteien müssen wir uns gemeinsam entgegenstellen und für ein starkes Europa kämpfen.\n\n({2})\n\nEin starkes Europa geht nur mit einem stärkeren sozialen Zusammenhalt. Wir müssen die Herzen der Menschen erreichen. Deswegen muss deutlicher werden, dass dieses großartige Projekt Europäische Union nicht nur eine Wirtschaftsunion ist, sondern auch und gerade für die Menschen da ist. Wir müssen das soziale Europa stärken und weiter ausbauen.\n\n({3})\n\nAuch die Bundesregierung oder die Mitglieder der Regierungskoalition reden in Sonntagsreden immer mal wieder über das soziale Europa – und wahrscheinlich auch gleich in dieser Debatte. Schöne Reden reichen aber nicht. Die Regierung muss sich an ihren Taten messen lassen. Von den positiven Punkten, die es im Koalitionsvertrag ja zum sozialen Europa gibt, hat sie allerdings so gut wie nichts umgesetzt. Die CDU, allen voran ihre Vorsitzende, hat sich jetzt sogar explizit gegen weitere Schritte in Richtung soziales Europa ausgesprochen.\n\nAber es ist noch schlimmer: Immer dann, wenn es um die Einschränkung von Sozialleistungen für Unionsbürgerinnen und Unionsbürger geht, ist die Große Koalition vorne mit dabei – nicht nur CDU und CSU, sondern auch die SPD. Sie haben sich auf EU-Ebene dafür eingesetzt – zum Glück erfolglos. Aber national hat die Große Koalition in den letzten Jahren den Sozialleistungsbezug von Unionsbürgerinnen und Unionsbürgern eingeschränkt. Und just heute Morgen hat sie einen Gesetzentwurf in den Bundestag eingebracht, mit dem sogar Kindern das Kindergeld verweigert werden soll. Das ist nicht mehr, sondern weniger soziales Europa.\n\nWir brauchen aber mehr soziales Europa.\n\n({4})\n\nUnd das fängt hier bei uns an. Wir Grünen schlagen hier und heute elf Punkte vor, wie wir das soziale Europa stärken können.\n\nUns Grünen ist besonders wichtig, die Armut in der Europäischen Union zu verringern. Dazu braucht es auf EU-Ebene eine gemeinsame Strategie und gemeinsame Ziele. Wir haben uns alle im Rahmen der Agenda 2030 dazu verpflichtet, die Armut in allen Staaten der Welt bis 2030 zu halbieren. Wie wäre es, wenn wir uns dieses Ziel auch auf EU-Ebene setzen würden und mit gemeinsamen Maßnahmen hinterlegen würden? Das wäre doch mal ein starkes Zeichen an die Bevölkerung in der EU.\n\n({5})\n\nEin zentraler Vorschlag, den wir Grüne dazu machen, ist, uns in der EU darauf zu verständigen, dass es in allen Mitgliedstaaten eine Grundsicherung gibt, die vor Armut schützt. Eine Grundsicherung überall in der EU – das wäre eine wichtige Basis für ein soziales Europa.\n\n({6})\n\nUm Beschäftigte besser abzusichern, fordern wir, uns in der EU auf Mindestlöhne zu verständigen, die vor Armut schützen, das Prinzip „Gleicher Lohn für gleiche Arbeit am gleichen Arbeitsplatz“ überall durchzusetzen und außerdem dafür zu sorgen, dass Frauen für gleiche und gleichwertige Arbeit endlich auch den gleichen Lohn erhalten.\n\n({7})\n\nUm die Absicherung von Arbeitslosen zu verbessern, schlagen wir eine Rückversicherung der Arbeitslosenversicherungen vor, die mit Mindeststandards für die nationalen Systeme verbunden werden kann. Dadurch werden Arbeitslose besser abgesichert. Gleichzeitig stabilisiert das die Wirtschafts- und Währungsunion. Hier können wir zwei Ziele mit einem Mittel gut erreichen.\n\nWir müssen mehr gegen Jugendarbeitslosigkeit in Europa machen und dafür sorgen, dass alle jungen Menschen in der EU einen Ausbildungsplatz bekommen. Europäische Betriebsräte müssen gestärkt werden, und wir können auch für Gesundheitssysteme und Alterssicherung Mindeststandards verabschieden. Und: Wir sollten uns für eine bessere soziale Absicherung der Freizügigkeit einsetzen und damit bei uns anfangen.\n\n({8})\n\nAll diese Maßnahmen sind jetzt schon möglich. Wir sollten aber auch darüber hinausdenken. So schlagen wir Grüne wie viele andere Initiativen, Wohlfahrtsverbände, Gewerkschaften und andere eine Ergänzung der Europäischen Verträge vor, die darauf abzielt, dass soziale und wirtschaftspolitische Ziele gleichwertig sind, also eine soziale Fortschrittsklausel.\n\n({9})\n\nMittelfristig ist es darüber hinaus aber auch wichtig, die sozialen Sicherungssysteme stärker zu europäisieren, zum Beispiel durch eine europäische Arbeitslosenversicherung oder ein europäisches Kindergeld, um zu verdeutlichen: Wir sind alle Unionsbürgerinnen und Unionsbürger, überall in der EU, und wir stehen füreinander ein.\n\n2017 hat die Europäische Union die Europäische Säule sozialer Rechte proklamiert. Es ist jetzt an uns, diese sozialen Rechte zu konkretisieren und verbindlicher zu machen – für mehr sozialen Zusammenhalt, für ein starkes Europa.\n\nVielen Dank.\n\n({10})"
"1022633","Anja","Hajduk","Grüne","Member of Parliament","2019-04-04T00:00:00.000Z","https://dip21.bundestag.de/dip21/btp/19/19092.pdf","\n\nVielen Dank für die Gelegenheit, die Zwischenfrage zu stellen. – Frau Staatssekretärin, da Sie uns ermutigen, einfach darauf zu vertrauen, dass diese Regierung noch lange arbeiten will und die Punkte schon abgearbeitet werden, möchte ich jetzt auf das zu sprechen kommen, was Sie gerade zu einer europäischen Arbeitslosenversicherung gesagt haben. Uns ist sehr wohl bekannt, dass Finanzminister Scholz und die Sozialdemokraten Sympathien für diese Idee haben, aber mir ist bisher nicht bekannt oder bestätigt worden, dass dieses Vorhaben auch konsequent im Rahmen Ihrer Regierung weiterverfolgt wird. Wenn Sie das hier jetzt so vortragen, möchte ich fragen: Ist es so, dass die Idee einer Arbeitslosenrückversicherung, wie wir sie im Antrag skizziert haben, durch Ihr Regierungshandeln in dieser Legislaturperiode weiter vorangetrieben wird? Können Sie das für die Große Koalition sagen?"
