id,firstname,lastname,faction,position,date, url,speech
"1043547","Lisa","Paus","Grüne","Member of Parliament","2020-07-02T00:00:00.000Z","https://dip21.bundestag.de/dip21/btp/19/19170.pdf","\n\nHerr Präsident! Meine Damen und Herren! Wirecard ist wirklich ein beispielloser Bilanzskandal in Deutschland. Millionen von Anlegern sind betroffen. Da Wirecard ein DAX-Konzern ist, ist jeder Anleger mit einem Indexfonds dabei. Es ist ein massiver Schaden für den Finanzplatz Deutschland. Denn was 2018 mal so symbolträchtig zelebriert wurde – der „Spiegel“ titelte damals: Börsenstar Wirecard – Fintech-Unternehmen verdrängt Commerzbank aus dem DAX –, das zerplatzte eben nach nur zwei Jahren und entpuppte sich als riesige Seifenblase. Von den damals 200 Euro pro Aktie sind heute noch 3 Euro übrig, meine Damen und Herren. Und die verheerende Botschaft an die Welt aus Deutschland von heute lautet: In Deutschland kann ein Unternehmen mit einer Bilanz, die offenbar seit Jahren Luftbuchungen in Höhe von einem Drittel der Bilanz enthält, zu einem DAX-Konzern aufsteigen. Das kann nicht sein, meine Damen und Herren! Das ist ein Riesenskandal.\n\n({0})\n\nAngesichts dessen gab es zwar eine kurze Irritation; aber dann war die Flucht nach vorn von Finanzminister Scholz und Präsident Hufeld auch wirklich die einzige Möglichkeit. Denn Kleinreden ist bei dieser Angelegenheit wirklich überhaupt keine Option. Starke Worte alleine reichen aber eben auch nicht. Der Skandal muss konsequent und lückenlos aufgeklärt werden. Die Sitzung des Finanzausschusses gestern war dazu nur ein Auftakt, meine Damen und Herren, da noch ganz viel aufgeklärt werden muss. Aber zwei Dinge sind heute schon klar:\n\nErstens. Es gibt massive Lücken und Schwächen im Aufsichtsregime für den digitalen Finanzmarkt und für Mischkonzerne, und dabei geht es im Kern nicht nur um die richtige Einordnung, also: War die Wirecard AG jetzt doch eine Finanzholding oder nur eine Technologieholding? Nur das Verschwinden von 1,9 Milliarden Euro machen einen Technologiekonzern noch nicht zu einer Finanzholding. Wir brauchen eine Anpassung der Regulierung für Bank-Tech-Mischkonzerne. Anders wird auch der massive Vertrauensverlust der Anlegerinnen und Anleger nicht zurückzugewinnen sein, meine Damen und Herren.\n\n({1})\n\nZweitens ist auch heute schon klar, dass sich im Fall Wirecard mindestens zwei seit der Finanzkrise – also seit über zehn Jahren – bekannte große Problemfelder in Deutschland einfach potenziert haben, zu deren Lösung es seitdem auch bereits klare Vorschläge gibt, die aber von dieser Koalition seit Jahren blockiert werden. Das ist zum einen das Thema Wirtschaftsprüfung\n\n({2})\n\nund zum anderen das Thema BaFin.\n\nZu den Wirtschaftsprüfungen. Seit elf Jahren hat mit EY eine der Big Four Wirecard geprüft, jahrelang testiert und nichts gemerkt. Offensichtlich sind ihnen die Luftbuchungen nicht aufgefallen, trotz Hinweisen seit Jahren. Das ist aber kein Einzelversagen; das hat eben leider Methode. Wenn die Prüfgesellschaft nur maximal 4 Millionen Euro Haftung befürchten muss,\n\n({3})\n\nwenn Unternehmen ihre Prüfer auswählen und 20 Jahre lang beauftragen oder eben auch kurzfristig kündigen können, wenn Prüfgesellschaften zugleich Beratergesellschaften sind, dann kommt eben am Ende Wirecard dabei raus, meine Damen und Herren.\n\n({4})\n\nDeswegen: Wir brauchen unabhängige Prüfer, wir brauchen die vollständige Trennung von Prüfung und Beratung, und wir brauchen auch eine stärkere Haftung von Wirtschaftsprüfern. Nach zehn Jahren Blockade der Koalition, Verwässerung auf europäischer Ebene, laxer Umsetzung in Deutschland finde ich: Das muss aufhören. Hier hat insbesondere Wirtschaftsminister Altmaier tatsächlich endlich zu liefern. Im Übrigen stimmt es: Eine nachgelagerte Bundesbehörde von ihm hat auch die Fachaufsicht, und von ihm ist da bisher überhaupt nichts zu hören.\n\nZum Zweiten kommen wir tatsächlich auch noch einmal zum Thema BaFin. Ja, Wirecard ist ein besonders krasser Fall von Aufsichtsversagen. Aber er ist eben bei Weitem nicht der einzige. Er reiht sich vielmehr ein in eine lange, lange Liste. Mein Kollege Sven Giegold aus dem Europäischen Parlament sammelt seit nunmehr 48 Stunden Finanzskandale, die seit der Finanzkrise in Deutschland bekannt geworden sind, bei der die BaFin aber vorher nichts entdeckt hat. Wenn Ihnen noch welche bekannt sind, schicken Sie es bitte an uns oder an Sven Giegold direkt.\n\nBereits jetzt, innerhalb von 48 Stunden, ist bei ihm eine Liste von 53 unterschiedlichen Fällen aufgelaufen, unter anderem auch die, die wir alle vielleicht noch kennen, zum Beispiel die Hypo Real Estate direkt im Zusammenhang mit der Finanzkrise. Damals hatte eben die BaFin die hochriskanten Geschäfte der Hypo Real Estate in Irland schlicht übersehen. Aber auch 2018 gab es zum Beispiel einen Finanzskandal beim Containeranbieter P&R. P&R hatte jahrelang Anlegern Container verkauft, die es gar nicht gab. Die BaFin hat davon nichts gemerkt.\n\nUnd auch bei den inzwischen breitbekannten kriminellen Cum/Ex-Geschäften, die die Steuerzahler Milliarden gekostet haben, ist die BaFin nie aktiv geworden, obwohl sie den Wertpapierhandel beaufsichtigt."
"1043549","Lisa","Paus","Grüne","Member of Parliament","2020-07-02T00:00:00.000Z","https://dip21.bundestag.de/dip21/btp/19/19170.pdf","\n\nDie BaFin nutzt ihre derzeitigen Kompetenzen nicht aus. Im Moment läuft es eben eher nach Vorschrift ins Desaster. Stattdessen brauchen wir einen Neustart der BaFin. Wir brauchen einen agilen Finanzwächter mit kriminalistischem Gespür. Deswegen in der Summe: Wir werden Sie jetzt tatsächlich daran messen, was Sie tun."
"1043551","Lisa","Paus","Grüne","Member of Parliament","2020-07-02T00:00:00.000Z","https://dip21.bundestag.de/dip21/btp/19/19170.pdf","\n\nErstens schonungslose Aufklärung, zweitens Regulierungslöcher stopfen und Novelle bei den Wirtschaftsprüfern sowie drittens ein echter Neustart bei der BaFin, meine Damen und Herren.\n\n({0})"
"1043569","Markus","Tressel","Grüne","Member of Parliament","2020-07-02T00:00:00.000Z","https://dip21.bundestag.de/dip21/btp/19/19170.pdf","\n\nHerr Präsident! Liebe Kolleginnen und Kollegen! Seit 16 Wochen kämpft die Reisebranche ums Überleben. Und jetzt, nach 16 Wochen, klären wir die Frage der berühmten Gutscheine abschließend; Kollege Müller-Böhm hat es ja schon angesprochen. Dieses Gesetz zu den Gutscheinen, liebe Kolleginnen und Kollegen, hätte schon vor Monaten kommen müssen,\n\n({0})\n\nganz zu Beginn dieser Krise, als Verbraucher, Veranstalter und Reisebüros Sicherheit gebraucht hätten. Zu diesem Zeitpunkt wären auch viele noch bereit gewesen, freiwillige Gutscheine zu akzeptieren.\n\nDie Bundesregierung hat aber wochenlang auf Zwangsgutscheine gesetzt und damit auch an hilfsbereite Verbraucher ein fatales Signal gesendet. Sie wollten die Verbraucher zur Bank machen und sich selbst aus der Verantwortung nehmen. Das war Ihre Strategie, liebe Kolleginnen und Kollegen.\n\n({1})\n\nDa warten, auch bei den Airlines – das muss man auch sagen – und bei vielen Veranstaltern, immer noch Tausende auf ihr Geld, zum Teil seit Monaten. Glauben Sie, dass ein Großteil dieser Kunden jetzt freiwillig Gutscheine von diesen Unternehmen akzeptieren wird? Das wäre zu hoffen, aber ich habe da große Zweifel; das muss ich deutlich sagen.\n\nDer TUI und der Lufthansa haben Sie in Liquiditätsengpässen geholfen. Das ist völlig richtig. Aber: Sorgen Sie jetzt dafür, dass die Unternehmen, die Hilfe bekommen haben, endlich auch die Kundengelder zeitnah an die Kundinnen und Kunden zurückzahlen.\n\n({2})\n\nDas ist nicht nur verbraucherpolitisch geboten, das ist auch ökonomisch sinnvoll, weil wir dringend Neugeschäft brauchen – Kerstin Kassner hat es gesagt –, und das geht nur mit zufriedenen Kunden. Alles in allem: Der freiwillige Gutschein ist nur Teil einer Lösung für die Tourismuswirtschaft, und die Krise wird ja absehbar weiter anhalten.\n\nEinige Reiseveranstalter und auch Reisebüros haben schon Insolvenz angemeldet. Wir haben in unserem Antrag, der ja heute hier zur Mitberatung vorliegt, schon vor zwei Monaten Lösungsvorschläge gemacht, die die gesamte Branche unterstützen sollten. Und Sie haben diesen Antrag blockiert. Gleichzeitig haben Sie aber selbst in diesen Wochen nichts vorgelegt und haben viel Zeit verstreichen lassen, liebe Kolleginnen und Kollegen.\n\n({3})\n\nFür viele war es bereits zu spät, als Sie endlich was vorgelegt haben. Und ich sage Ihnen: Einige Unternehmen sind auch an Ihrer wochenlangen Lethargie und Ihrer Unverbindlichkeit in dieser schwierigen Situation gescheitert. Das müssen Sie sich am Ende zuschreiben lassen.\n\nSie haben jetzt das eine oder andere auf den Weg gebracht. Das ist richtig.\n\n({4})\n\nAber ich sage auch, liebe Kollegin Hiller-Ohm: Das wird am Ende nicht ausreichen.\n\n({5})\n\nDer Rettungsfonds für die Reisewirtschaft ist aus unserer Sicht nicht vom Tisch – und dreimal nicht, wenn die Krise noch lange anhalten wird.\n\n({6})\n\nInsofern brauchen wir wirksame Instrumente zum Erhalt der Strukturen bei den Veranstaltern, im Vertrieb und auch in den Destinationen. Und wir müssen endlich die Breite und die Dynamik der Veränderung der Branche im Blick haben. Denken Sie nur an das Messe- und Kongressgeschäft; da ist viel in Bewegung, auch durch die Digitalisierung, die wir in den vergangenen Wochen erlebt haben. Deshalb ist unser Antrag, der heute hier vorliegt, weiterhin aktuell, auch wenn Sie ihn mit Ihrer Verzögerungstaktik\n\n({7})\n\nmonatelang vor sich her geschoben haben.\n\nWir müssen jetzt gemeinsam dafür sorgen, dass die Rettung der Tourismuswirtschaft weitergeht. Das wird auch bitter nötig sein. Niemand – das sage ich an dieser Stelle auch ganz deutlich – sollte glauben, mit dem Konjunkturprogramm hätte man da jetzt genug getan. Deshalb: Nehmen Sie unseren Antrag jetzt als Auftakt für die weitere Debatte!\n\n({8})\n\nDeswegen bitte ich Sie heute auch um Ihre Zustimmung zu diesem Antrag, weil da viele wertvolle Vorschläge drin sind, wie wir dieser Branche wirklich wirksam helfen können. Diese Fragen werden sich auch weiterhin stellen.\n\nHerzlichen Dank.\n\n({9})"
"1043587","Margit","Stumpp","Grüne","Member of Parliament","2020-07-02T00:00:00.000Z","https://dip21.bundestag.de/dip21/btp/19/19170.pdf","\n\nSehr geehrter Herr Präsident! Sehr geehrte Kolleginnen und Kollegen! Liebe Damen und Herren! Die Hoffnung stirbt zuletzt. Es zeugt schon von einer optimistischen Grundhaltung, wenn man glaubt, diesen DigitalPakt noch beschleunigen zu können. Ich will nicht so weit gehen, dass ich sage: „Ein totes Pferd soll man nicht reiten“, aber ein Kaltblüter wird nicht mehr zum Rennpferd; da kann man sich noch so anstrengen.\n\n({0})\n\nHätte Ministerin Karliczek die Digitalisierung angesichts der Krise tatsächlich beschleunigen wollen, hätte sie ein Förderprogramm Digitalisierung aufgelegt und hätte nicht an diesen ohnehin mager ausgestatteten DigitalPakt angedockt.\n\n({1})\n\nSchon vor der Krise war doch klar: Die meisten Schulen stehen in puncto Digitalisierung noch ganz am Anfang. Ein Grund dafür ist die derzeitige Struktur des Bildungsföderalismus. Die Lasten sind unfair verteilt. Arme Kommunen, die das Geld für Digitalisierung nicht hatten, werden jetzt bei wegbrechenden Steuereinnahmen noch weiter unter Druck geraten. Wie sollen die da noch Digitalisierung stemmen?\n\nEin zeitlich befristeter DigitalPakt, der Betriebs- und Wartungskosten am Ende doch wieder auf die Kommunen abwälzt, ist kontraproduktiv.\n\n({2})\n\nVor diesem Hintergrund ist es auch völlig unverständlich, dass die riesigen Konjunkturpakete vielen zugutekommen, Bildung, der Rohstoff für die Zukunft, aber vergleichsweise wenig abbekam. Das zeigt, welche Prioritäten diese Koalition und auch die nicht anwesende Ministerin setzen.\n\n({3})\n\nStattdessen müssen gerade die Schulen, die digital noch ganz am Anfang stehen, bei denen also der größte Handlungsbedarf besteht und Eile geboten ist, die größten bürokratischen Hürden meistern. Der Grund dafür ist, dass gerade diese Schulen eben noch kein Medienentwicklungskonzept hatten. Für eine digitale Grundausstattung, die digitale Pflicht, braucht man aber auch kein Medienentwicklungskonzept.\n\n({4})\n\nGerade um diese Pflicht geht es doch bei vielen Schulen, wenn sie zu Beginn des nächsten Schuljahres für hybriden Unterricht fit sein sollen. Das könnte gelingen, wenn sich Bund und Länder auf eine grundsätzliche Basisstruktur einigen und die Checklisten zügig in die Schulen gegeben würden, um hier die Lücken zu füllen.\n\nDer Ansatz ist doch für alle Schulen gleich: Jede Schule braucht ein technisches Fundament; das haben wir gerade schon gehört: Breitbandanschluss, WLAN-Ausleuchtung, ausreichend Endgeräte für Lehrkräfte, für Schülerinnen und Schüler sowie Administration. Schulen brauchen ein organisatorisches Fundament. Dazu gehören Mail-Adressen für Lehrkräfte, für Schülerinnen und Schüler, ein Lernmanagementsystem, Zugang zu einer Cloud und all diese Dinge.\n\nUnd Lehrkräfte brauchen ein pädagogisches Fundament. Das heißt Aus- und Weiterbildung. Außerdem brauchen Schulen und Schulträger Orientierung, natürlich auch für eine komplizierte Antragstellung, aber vor allem für die Auswahl von Hard- und Software, nicht nur für die digitale Pflicht, sondern auch für die digitale Kür. Das kann eine gute Begleitung und eine Bundeszentrale für digitale und Medienbildung, wie wir sie schon vor der Krise vorgeschlagen haben, tatsächlich leisten.\n\n({5})\n\nDie Hoffnung stirbt zuletzt. Wir hoffen mit der FDP auf die Einsicht, dass Entbürokratisierung tatsächlich nottut und Bildung endlich, endlich als gesamtpolitische Verantwortung verstanden wird. Deswegen stimmen wir Ihrem Antrag zu.\n\n({6})"
"1043592","Anna","Christmann","Grüne","Member of Parliament","2020-07-02T00:00:00.000Z","https://dip21.bundestag.de/dip21/btp/19/19170.pdf","\n\nJa, vielen Dank, Frau Kollegin. – Sie haben ja eingangs den Dank an die Schülerinnen und Schüler wiederholt, an die Lehrerinnen und Lehrer, die jetzt in Corona vieles gemeistert haben. Dieser Dank ist sicher richtig und zu unterstützen. Ich glaube aber, viel mehr als einen Dank haben diese Menschen es doch verdient, dass wirklich jetzt auch die Voraussetzungen geschaffen werden, dass digitales Lernen in der Schule möglich wird. Das ist das, was Eltern, Schülerinnen und Schülern und Lehrerinnen und Lehrern wirklich hilft, nicht unbedingt die Tatsache, dass wir jetzt die ganze Zeit Dankesreden halten.\n\nDa, glaube ich, ist es weniger produktiv, die ganze Zeit mit dem Finger aufeinander zu zeigen, wer hier wofür zuständig ist. Das interessiert diese Menschen nämlich auch alle ziemlich wenig.\n\n({0})\n\nVielmehr ist doch die Frage: Warum ist der DigitalPakt zu so einer Digitalisierungsverhinderungsgeschichte für die Digitalisierung an unseren Schulen geworden?\n\n({1})\n\nSeit Jahren steht dieser DigitalPakt im Raum. Wir mussten bis dieses Jahr warten, bis überhaupt mal Geld fließt. Es sind wahnsinnig hohe Hürden. Meine Kollegin hat darauf hingewiesen:\n\n({2})\n\nMedienentwicklungspläne für jede Steckdose, für jeden Breitbandanschluss, den man haben möchte.\n\nWas wollen Sie denn tun, damit dieser DigitalPakt jetzt tatsächlich auch Fahrt aufnimmt und in Anspruch genommen wird? Das ist doch hier die entscheidende Frage und nicht, wer für was genau zuständig ist.\n\n({3})"
"1043611","Kordula","Schulz-Asche","Grüne","Member of Parliament","2020-07-02T00:00:00.000Z","https://dip21.bundestag.de/dip21/btp/19/19170.pdf","\n\nHerr Präsident! Meine Damen und Herren! Seit über einem Jahr verfolgt die Bundesregierung mit dem sogenannten Intensivpflege- und Rehabilitationsstärkungsgesetz eine Reihe von Zielen, die hier im Hause eine große Mehrheit finden würden. Wir alle hier wollen die Qualität der außerklinischen Intensivpflege verbessern. Wir alle hier wollen die kriminellen Machenschaften einiger endlich unterbinden. Wir alle wollen die Potenziale der Beatmungsentwöhnung ausschöpfen; denn wir wissen, was das für eine Verbesserung, einen Zugewinn an Lebensqualität bedeutet. Auch falls es keiner Verbesserung bedürfte, würden die Regelungen im Bereich der Rehabilitation auf Zustimmung treffen.\n\n({0})\n\nAll das hätten wir hier vor Monaten beschließen können. Deswegen ist die Frage, Herr Minister Spahn: Warum haben Sie das nicht getan?\n\n({1})\n\nDiese Frage stelle ich hier, weil die in dem Gesetz enthaltenen Regelungen zur außerklinischen Intensivpflege von Anfang an in eklatantem Widerspruch zu den Selbstbestimmungsrechten der betroffenen Menschen und zur UN-Behindertenrechtskonvention standen.\n\n({2})\n\nSie haben nicht auf den Beauftragten der Bundesregierung für die Belange von Menschen mit Behinderung, Herrn Dusel, gehört. Sie haben nicht auf die Petitionen und auf die Proteste gehört. Sie haben nicht auf die Anhörung im Bundestag gehört. Nach einem Jahr intensivster Diskussionen haben Sie sich erst in dieser Woche am Dienstag, wahrscheinlich auf Druck der SPD, zu Änderungen hinreißen lassen. Aber auch damit ist für uns keine Rechtssicherheit für die betroffenen Menschen gegeben, auch damit keine Garantie, dass selbstbestimmtes Leben im eigenen Zuhause weiter möglich ist. Darum muss es uns allen doch gehen, meine Damen und Herren.\n\n({3})"
"1043613","Kordula","Schulz-Asche","Grüne","Member of Parliament","2020-07-02T00:00:00.000Z","https://dip21.bundestag.de/dip21/btp/19/19170.pdf","\n\nJa, gerne."
"1043617","Kordula","Schulz-Asche","Grüne","Member of Parliament","2020-07-02T00:00:00.000Z","https://dip21.bundestag.de/dip21/btp/19/19170.pdf","\n\nLiebe Frau Kollegin Schmidt, Sie wissen, dass ich Sie sehr schätze und dass Sie auch in unserer Gesellschaft aktuell gerade für die Menschen mit Behinderung eine sehr, sehr wichtige Rolle spielen. Wir wissen auch – wir haben es in dieser Woche auch gehört –, dass die Verbesserungen, die in dieser Woche vorgenommen wurden, sehr stark auf Ihre Interventionen zurückzuführen sind. Dafür möchte ich Ihnen auch im Namen der betroffenen Menschen ausdrücklich danken.\n\n({0})\n\nWenn Sie mir gerade zugehört haben, bin ich, wie gesagt, auch gern bereit – ich habe ja jetzt noch zwei Minuten –, in meiner Rede fortzufahren. Ich habe bisher eigentlich vor allem Minister Spahn und die Verschleppung des bisherigen Verfahrens kritisiert, weil die anderen Teile dieses Gesetzes gar nicht schlecht sind. Ich habe auch gesagt, dass das, was in dieser Woche gemacht wurde, durchaus Verbesserungen sind, aber trotzdem nicht zu Rechtssicherheit führt und deswegen auch weiterhin von uns kritisiert wird. Wenn Sie mir erlauben, würde ich auch genau darauf jetzt weiter eingehen, an welchen Punkten wir die gleiche Problematik fortgesetzt sehen.\n\nSie haben es gerade angesprochen: Den Wünschen der Betroffenen ist zu entsprechen. – Das ist sozusagen die Analogie zum SGB IX. Wir haben aber in diesem Gesetz auch Betroffenengruppen, die nicht durch das SGB IX abgedeckt sind. Deswegen sehen wir hier keine grundsätzliche Problemlage für alle Betroffenengruppen geklärt.\n\nFür die Versorgungsschwierigkeiten sind nach wie vor die Betroffenen zuständig. Wir sind aber der Meinung, dass es dringend geboten ist, dass die Kassen den Sicherstellungsauftrag zu erfüllen haben. Das steht nicht in Ihren Änderungsanträgen.\n\n({1})\n\nFür uns ist auch nicht absehbar, was die Zielvereinbarungen für die Betroffenen bedeuten, wenn zum Beispiel keine Erfolge von wem auch immer definiert werden.\n\nDas sind meiner Meinung nach drei wesentliche Punkte, die nach wie vor in der jetzigen Regelung zu kritisieren sind\n\n({2})\n\nDeswegen ist für uns immer noch nicht ausgeschlossen, dass die Betroffenen gegen ihren Willen in eine stationäre Einrichtung umziehen müssen. Das ist der Kernpunkt. Die Selbstbestimmung ist für uns das Hauptthema. Deswegen halten wir, die drei Oppositionsfraktionen aus dem demokratischen Lager, unseren Änderungsantrag aufrecht.\n\n({3})\n\n– Ja. – Wieso ist jetzt die Zeit schon vorbei?"
"1043619","Kordula","Schulz-Asche","Grüne","Member of Parliament","2020-07-02T00:00:00.000Z","https://dip21.bundestag.de/dip21/btp/19/19170.pdf","\n\nGenau. – Deswegen halten wir an unserem Änderungsantrag fest. Uns geht es vor allem um die Selbstbestimmung der Betroffenen. Wir sehen die nach wie vor nicht wirklich gewährleistet. Sie haben durch die einjährige Verschleppung, durch das unzureichende Verfahren eher dafür gesorgt, dass das Vertrauen bei vielen Menschen verspielt wurde. Ich hoffe, dass wir das in irgendeiner Form wiedergutmachen können. Aber dieser Bereich ist wirklich ein zentraler Punkt der Versorgung."
"1043621","Kordula","Schulz-Asche","Grüne","Member of Parliament","2020-07-02T00:00:00.000Z","https://dip21.bundestag.de/dip21/btp/19/19170.pdf","\n\nWir haben einen Entschließungsantrag mit Verbesserungsvorschlägen eingebracht. Wir werden den Regierungsentwurf für dieses Gesetz ablehnen.\n\n({0})"
"1043628","Corinna","Rüffer","Grüne","Member of Parliament","2020-07-02T00:00:00.000Z","https://dip21.bundestag.de/dip21/btp/19/19170.pdf","\n\nFrau Schulz-Asche beschwert sich, dass sie nicht genügend Zeit hatte. Na ja, aber egal. – Sie haben gesagt – das ist auch völlig richtig –, dass ein Gesetz im Verfahren verbessert werden soll. Aber was wir hier haben – ich habe dieses Gesetz wirklich von Anfang an begleitet und beobachtet, Öffentlichkeitsarbeit dazu gemacht, mit Aktivisten geredet, mit Leuten, die beatmet werden – –\n\n({0})\n\n– Und jetzt seien Sie mal ruhig! Denn das hier ist kein Konflikt zwischen den drei demokratischen Oppositionsfraktionen und der SPD. Halten Sie einfach einmal die Luft an! Ich will jetzt etwas mit Herrn Spahn klären.\n\n({1})\n\nSie haben von Anfang an gewusst, dass es eine Gruppe von dauerhaft beatmeten Patienten gibt, bei denen es auch keine Entwöhnung geben kann, die zu Recht befürchtet hat – weil der erste Entwurf in dieser Frage ganz klar gewesen ist –, dass es grundsätzlich die Möglichkeit geben soll, dass der MDK über eine Verlegung in besondere Wohnformen entscheiden können soll. Jetzt muss man sagen: Wir sind 50 Wochen später, und diese Menschen und ihre familiären Strukturen haben 50 Wochen lang richtig Angst gehabt. Schon wenn es darum geht, eine Schulbegleitung zu beantragen, und das abgelehnt wird, ist das für Familien richtig brutal hart. Ich weiß nicht, Herr Minister, ob Sie sich vorstellen können, was es bedeutet, wenn Familien 50 Wochen lang, wenn Menschen 50 Wochen lang Angst davor haben, in ein Heim verlegt zu werden.\n\nWarum haben Sie, Herr Minister, nicht vorher eingelenkt? Warum haben Sie nicht an der Stelle signalisiert, dass Sie einsehen, dass es gesetzliche Klarheit braucht, um hier das Selbstbestimmungsrecht von Menschen mit Behinderungen klar zu regeln?\n\n({2})\n\nWarum haben Sie das nicht gemacht, sondern haben diese Leute in Angst gelassen?\n\nUnd warum haben Sie gestern im Gesundheitsausschuss sinngemäß behauptet, dass für diese Angst die Oppositionsfraktionen zuständig seien, dass wir diese Angst ausgelöst hätten? Warum haben Sie das gesagt, wenn doch im Entwurf klar gewesen ist, dass diese Angst berechtigt gewesen ist? Warum haben Sie dieses Leid verursacht, Herr Minister?\n\n({3})"
