id,firstname,lastname,faction,position,date, url,speech
"1041146","Uwe","Kekeritz","Grüne","Member of Parliament","2020-05-27T00:00:00.000Z","https://dip21.bundestag.de/dip21/btp/19/19162.pdf","\n\nDanke schön. – Diese Antwort widerspricht ein bisschen Ihrer Länderliste. Sie haben ja viele Länder aus dieser Länderliste gestrichen, und wir haben nach einem Argument gefragt."
"1041141","Uwe","Kekeritz","Grüne","Member of Parliament","2020-05-27T00:00:00.000Z","https://dip21.bundestag.de/dip21/btp/19/19162.pdf","\n\nHerzlichen Dank. – Sie haben das Stichwort „Mercosur“ genannt; das finde ich sehr interessant. Sie wissen, dass die Brandrodungen extrem ausgeweitet wurden; noch nie wurde so viel Wald vernichtet wie zurzeit. Sie wissen auch, dass Corona dort drüben wütet und dass vor allen Dingen die Indigenen betroffen sind; sie sind sowohl vom Virus als auch von der Brandrodung betroffen.\n\nDer Umweltminister Brasiliens hat vor Kurzem gesagt: Wir müssen die Chance nutzen – in der Öffentlichkeit nimmt man uns zurzeit nicht wahr –, diese Brandrodungen zu legalisieren und die Täter straffrei zu stellen, damit die Großgrundbesitzer dieses Land erwerben können. – Wollen Sie tatsächlich mit einem solch verbrecherischen Regime ein Handelsabkommen betreiben? Wir wissen doch, dass die nur an ihrem persönlichen Profit interessiert sind; Menschenrechte und Legalität spielen überhaupt keine Rolle. Wie kann diese Bundesregierung ein solches Vorgehen verantworten?\n\n({0})"
"1041144","Uwe","Kekeritz","Grüne","Member of Parliament","2020-05-27T00:00:00.000Z","https://dip21.bundestag.de/dip21/btp/19/19162.pdf","\n\nJa."
"1041148","Uwe","Kekeritz","Grüne","Member of Parliament","2020-05-27T00:00:00.000Z","https://dip21.bundestag.de/dip21/btp/19/19162.pdf","\n\nSie haben gesagt: Wir arbeiten jetzt nicht mehr mit den Ländern zusammen, die die Menschenrechte missachten, die die Korruption fördern, die auf die Legalität, auf das Rechtssystem pfeifen, die was weiß ich noch alles machen. – Und jetzt in Brasilien gilt das alles nicht mehr? Das muss man mir erst erklären, Herr Müller."
"1041165","Britta","Haßelmann","Grüne","Member of Parliament","2020-05-27T00:00:00.000Z","https://dip21.bundestag.de/dip21/btp/19/19162.pdf","\n\nVielen Dank, Herr Präsident. – Ich komme zurück zum Lieferkettengesetz. Herr Minister Müller, wir kennen ja Ihre Strategie bei Regierungsbefragungen. Sie erzählen hier schöne Geschichten, was Sie in der Welt alles gesehen haben. Viele der Parlamentarier aus dem Bereich der Entwicklungszusammenarbeit, die hier sitzen, haben das auch alles schon gesehen und kennen das. Wir brauchen keine Beschreibungen über die elende Situation, über die erbärmlichen, ausbeuterischen Bedingungen. Wir wollen von Ihnen jetzt mal wissen, wann Sie liefern, und wir wollen keine Interviews, keine blumigen Erklärungen, keine dramatischen Schilderungen hören. Woran scheitert das Lieferkettengesetz? Warum kriegen Sie das nicht auf die Kette? Wo ist der Widerstand? Und: Was tun Sie ganz konkret? Das wollen die Parlamentarierinnen und Parlamentarier von Ihnen wissen,\n\n({0})\n\nund sie wollen keine Geschichten über die Arbeitsbedingungen von Menschen hören. Die kennen wir, die sind schlimm, und dagegen müssen wir was tun.\n\n({1})"
"1041194","Ottmar","Holtz","Grüne","Member of Parliament","2020-05-27T00:00:00.000Z","https://dip21.bundestag.de/dip21/btp/19/19162.pdf","\n\nSchönen Dank, Herr Präsident. – Herr Minister, Sie wollen die WHO zu einem Pandemiezentrum ausbauen. Dazu hätte ich noch eine Frage. Die WHO ist bereits jetzt mit dem Auftrag, den sie eigentlich hat, massiv unterfinanziert. Pandemiebekämpfung ist das eine, aber, ich glaube, wir müssen – das werden wir morgen hier noch eingehend diskutieren – auch einen Blick auf die Gesundheitssysteme und auf die Strukturen in den Entwicklungsländern werfen, und dazu brauchen wir eine koordinierende Stelle. Ich hätte jetzt ganz gerne Ihre Einschätzung zur Pandemiebekämpfung auf der einen Seite und zur Stärkung von Gesundheitssystemen auf der anderen Seite, wo, glaube ich, die WHO auch eine entscheidende Rolle zu spielen hat. Wie sehen Sie das, dass wir das eine jetzt nicht tun, und das andere dann aber lassen, was nicht richtig wäre?"
"1041197","Ottmar","Holtz","Grüne","Member of Parliament","2020-05-27T00:00:00.000Z","https://dip21.bundestag.de/dip21/btp/19/19162.pdf","\n\nSchönen Dank, Herr Präsident. – Das war jetzt nicht die Antwort auf meine Frage. Ich habe nach den Gesundheitssystemen in den Entwicklungsländern gefragt. Dass „One Health“ ein wichtiger und richtiger Ansatz ist, steht außer Frage; das sehe ich auch so. Aber es geht um die Gesundheitsgrundversorgung. Pandemiebekämpfung löst nicht die Probleme der Gesundheitsgrundversorgung in den Entwicklungsländern. Wir müssen im Rahmen der Entwicklungspolitik ein Augenmerk darauf legen; das passiert nicht. Meine Frage war, wie Sie das einschätzen, wie Sie das zuwege bringen, unterstützen wollen und welche Rolle Sie in diesem Zusammenhang für die WHO sehen."
"1041206","Uwe","Kekeritz","Grüne","Member of Parliament","2020-05-27T00:00:00.000Z","https://dip21.bundestag.de/dip21/btp/19/19162.pdf","\n\nHerzlichen Dank. – Jetzt ist gerade der Begriff „Agrarökologie“ gefallen. Mein Beitrag passt, glaube ich, ganz gut zum Beitrag von Eva Schreiber. In der letzten Regierungsbefragung haben Sie auf die Frage, was Sie denn konkret gegen die Plastikflut, die Meeresverschmutzung tun, toll geantwortet und gesagt: Die Frage gebe ich zurück ans Parlament. Und ich sage Ihnen, was Sie als Parlament morgen tun können. Sie können eine Gesetzesinitiative starten und einen Antrag an die Regierung stellen. – Ich habe diesbezüglich weiter nichts gehört; aber dieses Parlament ist im Juni 2019 aktiv geworden und hat einen Koalitionsantrag zur Agrarökologie verabschiedet. Großartig! Das Parlament hat Ihnen zur Agrarökologie einen ganz klaren Auftrag gegeben.\n\nIch habe in den letzten drei Monaten versucht, herauszufinden, inwieweit Sie diesbezüglich aktiv geworden sind. Ich kann Ihnen sagen: Das Ergebnis ist minimal; es sind tatsächlich keine Daten vorhanden. Sie haben nichts gemacht! – Wie ist das zu erklären? Sie bekommen einen Auftrag vom Parlament und ignorieren diesen."
"1041208","Uwe","Kekeritz","Grüne","Member of Parliament","2020-05-27T00:00:00.000Z","https://dip21.bundestag.de/dip21/btp/19/19162.pdf","\n\nIst sie? Gut."
"1041211","Uwe","Kekeritz","Grüne","Member of Parliament","2020-05-27T00:00:00.000Z","https://dip21.bundestag.de/dip21/btp/19/19162.pdf","\n\nHerzlichen Dank, Herr Präsident. – Wissen Sie, das ist der typische Müller. Das hier ist eine Regierungsbefragung. Ich verstehe Ihre Antwort so, dass Sie die Zeit vom Verabschieden des Antrags der Koalition bis jetzt genutzt haben, um ein Buch darüber zu schreiben. Das ist allerdings nicht das, was ich von meinem Minister erwarte.\n\n({0})\n\n– Man könnte sagen: Das ist Arbeitsverweigerung.\n\nJetzt möchte ich noch auf den Mercosur-Vertrag zurückkommen. Sie haben uns erzählt, wie wichtig es ist, die Menschen zu schützen, den Wald zu schützen. Hier in diesem Hause gibt es doch niemanden, der das nicht unterschreibt. Vielmehr ist die Frage gewesen: Inwieweit glauben Sie, dass dieses Handelsabkommen – Mercosur – tatsächlich weiterführt? Sie sagten: Es muss ein Nachhaltigkeitskapitel eingetragen werden, das Sanktionen vorsieht. Sie wissen genau: Die Verhandlungen sind abgeschlossen. Es gibt ein Nachhaltigkeitskapitel; aber es beinhaltet keine Sanktionen. Inwieweit ist der Mercosur-Vertrag zweckdienlich?"
"1041220","Agnes","Malczak","Grüne","Member of Parliament","2020-05-27T00:00:00.000Z","https://dip21.bundestag.de/dip21/btp/19/19162.pdf","\n\nVielen Dank, Herr Präsident. – Herr Minister, das ist ja schön, dass Sie mit so vielem, was wir hier vortragen, übereinstimmen. Die Forderung nach mehr Geld zur Bekämpfung der Coronakrise haben wir, ehrlich gesagt, schon vor zwei Monaten im Haushaltsausschuss gestellt. Jetzt haben Sie uns hier gesagt, Sie haben 3 Milliarden Euro mehr beantragt, Sie haben hier eine schöne Liste, in welche Titel das Geld gehen soll, und warten jetzt – wie lange? zwei Monate? – auf die Antwort vom Bundesfinanzminister. Wann haben Sie denn mal vor, nachzufragen? Wir haben hier so viele Rettungspakete auf den Weg gebracht. Wann bekommt dieses Parlament eine Antwort von Ihnen, ob wir bereit sind, für internationale Solidarität im Kampf gegen das Coronavirus auch Geld auf den Tisch zu legen, und zwar frisches Geld, also Geld, das nicht nur von Umschichtungen in Ihrem Haus herrührt?"
"1041223","Agnes","Malczak","Grüne","Member of Parliament","2020-05-27T00:00:00.000Z","https://dip21.bundestag.de/dip21/btp/19/19162.pdf","\n\nJa. – Ich würde trotzdem noch mal die Frage wiederholen. Wir teilen das ja total, dass das alles schlimm ist und dass wir schnell handeln müssen. Ich habe gesagt: Jetzt warten wir schon zwei Monate, ob es Gelder für mehr internationale Solidarität geben wird. – Jetzt sagen Sie, wir sollen noch ein paar Wochen warten.\n\nMir stellt sich schon die Frage, wann das Lieferkettengesetz kommt. Wenn Sie sagen: „Moria ist ein Schandfleck“, den Turbokapitalismus kritisieren, mehr Geld für die internationale Solidarität im Kampf gegen das Coronavirus wollen, müssen Sie uns hier nicht überzeugen. Aber warum hört Ihnen denn im Kabinett niemand zu, und warum kommt dann nichts Konkretes?"
"1041279","Tobias","Lindner","Grüne","Member of Parliament","2020-05-27T00:00:00.000Z","https://dip21.bundestag.de/dip21/btp/19/19162.pdf","\n\nVielen Dank. – Frau Präsidentin! Liebe Kolleginnen und Kollegen! Bevor sich hier weiter durch Zwischenrufe über Koalitionsoptionen ausgetauscht wird, lassen Sie mich zum Thema dieses Mandats kommen, nämlich zur Ernährungssituation in Ostafrika. Ich glaube, wir müssen leider feststellen, dass diese allein durch Corona schon nicht besser geworden ist. Aber – das ist hier mehrfach an diesem Pult in dieser Debatte angesprochen worden –: Corona führt natürlich auch dazu, dass viele Krisen und Tragödien unter dem medialen Radar verschwinden. Die Heuschreckenplage in Ostafrika ist angesprochen worden. Länder wie Kenia haben seit 70 Jahren eine solche Plage nicht mehr erlebt, und sie führt dazu, dass für 25 Millionen Menschen im Osten Afrikas die Ernährungssituation mehr als kritisch ist.\n\nLiebe Kolleginnen und Kollegen, in einer solchen Situation ist es, glaube ich, der Mühe wert, mit dem Bundesaußenminister darüber zu streiten, ob wir genug an humanitärer Hilfe leisten, ob wir alles tun, was wir können, ob wir das Welternährungsprogramm stärker unterstützen müssen. Ich finde, über eines können wir nicht streiten – das will ich ganz deutlich sagen –: Wenn wir Hilfe leisten wollen, wenn wir Schiffe mit Nahrungsmitteln und Hilfsgütern nach Ostafrika, nach Somalia schicken wollen, dann muss der Zugang auf dem Seeweg möglich sein, und dann braucht es am Ende des Tages auch die Schiffe von Atalanta, um die Schiffe des Welternährungsprogramms zu schützen und zu sichern, liebe Kolleginnen und Kollegen.\n\n({0})\n\nEs ist, Herr Kollege Hampel, schon ein deutlicher Ausdruck davon, welch zynischer Geist in Ihrer Fraktion herrscht,\n\n({1})\n\nwenn Sie das Welternährungsprogramm in dieser Debatte als ein Feigenblatt betiteln. Das zeigt, was für ein Menschenbild Sie haben.\n\n({2})\n\nIch will aber an dieser Stelle auch eines ganz deutlich sagen: Wenn wir heute darüber reden, dass die Mission Atalanta leider immer noch notwendig ist, dann zeigt das natürlich schon, dass sie an die Symptome, aber nicht an die Ursachen der schwierigen humanitären Situation in Ostafrika rangeht. Ich glaube, da kann man nicht einfach nur achselzuckend zusehen und so tun, als könnte sich daran nichts ändern. Da erwarte ich von unserer Bundesregierung, da erwarte ich auch von der Europäischen Union, dass an dieser Stelle mehr Druck gemacht wird, dass mehr Eigeninitiativen kommen. Denn ich will hier in diesem Bundestag den Tag noch erleben, an dem wir alle sagen können: Die Mission Atalanta ist erfüllt, weil die Gründe für die humanitäre Krise in Ostafrika beseitigt worden sind, liebe Kolleginnen und Kollegen.\n\n({3})\n\nEin letzter Punkt. Ich finde, wenn dieses Mandat eine Schwäche hat, dann ist es die Landoption, die es ermöglichen würde, 2 Kilometer an Land zu operieren, die ein einziges Mal gezogen worden ist. Diese Option birgt mehr Risiken, als sie tatsächlichen Nutzen für die Sicherheit des Welternährungsprogramms und für dieses Mandat hat. Sie wären gut beraten gewesen, diese Option aus dem Mandat herauszustreichen.\n\nHerzlichen Dank.\n\n({4})"
"1041247","Claudia","Müller","Grüne","Member of Parliament","2020-05-27T00:00:00.000Z","https://dip21.bundestag.de/dip21/btp/19/19162.pdf","\n\nSehr geehrter Herr Präsident! Sehr geehrte Kollegen und Kolleginnen! Es gab in letzter Zeit doch sehr unterschiedliche Stimmen aus der Koalition dazu, was denn jetzt die besten Maßnahmen für Wege aus der Krise seien. Deshalb war ich, ehrlich gesagt, fast ein bisschen überrascht, dass ausgerechnet Sie dieses Thema jetzt setzen. Aber möglicherweise dient diese Aktuelle Stunde ja auch Ihrer Ideenfindung, und da helfen wir natürlich sehr gerne.\n\n({0})\n\nDenn im Gegensatz zur Bundesregierung haben wir Grüne mit unserem Zukunftspakt heute ein Konzept vorgestellt, ein Konzept zur Stabilisierung und zu Wegen aus der Krise –\n\n({1})\n\nübrigens nicht nur aus der Coronakrise. Selbstverständlich nehmen wir die Klimakrise mit in den Blick, zu der Sie, Herr Altmaier, heute kein einziges Wort verloren haben.\n\n({2})\n\nViele unserer Vorschläge, die Sie darin finden, sind übrigens Vorschläge, die Sie heute auch in der Anhörung von de facto allen Sachverständigen gehört haben. Schauen Sie mal rein, fühlen Sie sich inspiriert.\n\nWir sind aber noch nicht aus der Krise heraus. Das heißt, wir sind noch nicht fertig damit, die besonders stark betroffenen Gruppen vor dem Ruin zu schützen. Das sind: Start-ups, die Kreativszene, Gründerinnen, Unternehmerinnen, die kluge Ideen umsetzen, Menschen, die handwerkliche Traditionen in die heutige Zeit überführen. Sie alle sind Deutschlands Potenzial für die Zukunft, und sie alle sind in erster Linie selbstständig.\n\nWir sprechen ständig mit Stolz von der Gründerrepublik Deutschland. Aber wenn man sich die letzten Wochen anguckt, ist das nichts als blanker Hohn. Monatelang vergisst diese Bundesregierung Millionen von Selbstständigen und Gründerinnen. Und die Hoffnung, dass das in der ersten Runde ein Versehen war, ist jetzt weg; denn Ihre Eckpunkte zeigen, dass Sie die moderne Arbeits- und Wirtschaftswelt nicht verstehen.\n\n({3})\n\nDer Vorstoß der AG Wirtschaft und Energie der CDU/CSU-Fraktion, der praktisch nur aus ollen Kamellen besteht, macht dies noch deutlicher. Aber gewundert hat mich das, ehrlich gesagt, nicht; denn das sind die gleichen Stimmen, die jetzt gefordert haben, das Thema Klimaschutz und den Green Deal hintanzustellen.\n\nZur Krisenbewältigung auf allen Ebenen brauchen wir jetzt aber einen ganzheitlichen Blick auf die Gesellschaft. Das bedeutet zum Beispiel im Bereich Arbeit, anzuerkennen, dass Unternehmerinnen und Selbstständige eben nicht die Haifische im Becken sind, sondern genauso eine Absicherung und Unterstützung brauchen wie abhängig Beschäftigte. Sie brauchen dringend eine gerechte Unterstützung, um die Krise zu überleben und dann weiterzumachen; denn für sie bedeutet eine Insolvenz im Allgemeinen persönlicher Ruin und Weg in die Armut.\n\nDoch Sie von SPD und CDU/CSU schicken diese Menschen zum Jobcenter. Damit lösen Sie Frust und übrigens auch zusätzliche Bürokratie aus; denn die Vermögensprüfung ist keineswegs ausgesetzt; sie findet weiterhin statt. Häufig bedeutet das für die Betroffenen: Die persönliche Altersvorsorge muss angegangen werden; das Partnereinkommen wird geprüft. Das ist übrigens ein Vorgehen, das Sie beim Thema Kurzarbeitergeld ablehnen würden – vollkommen zu Recht. Bei Gründerinnen und Selbstständigen machen Sie das aber. Sie erklären damit Unternehmerinnen, Selbstständige, Gründerinnen und Kreative zu Arbeitenden zweiter Klasse.\n\n({4})\n\nUnsere Erkenntnis daraus: Neben schnellen, unbürokratischen Hilfen müssen wir auch die sozialen Sicherungssysteme offener gestalten, um diesen Menschen in Krisenzeiten Unterstützung zu bieten und diesen Gruppen – selbst wenn sie nicht einzahlen – ein Anrecht auf Kurzarbeitergeld zu ermöglichen.\n\n({5})\n\nDenn in der Krise hat sich auch gezeigt, dass gerade kleine Unternehmen, Selbstständige und Kreative mit wenig Ressourcen oft sehr schnell sehr flexibel Dinge verändern können, sich anpassen können. Das ist die Innovationsfähigkeit, die wir jetzt brauchen, um aus dieser Krise zu kommen.\n\nForschung und Innovation sind die Schlüssel, und nichts treibt die Entwicklung in diesem Bereich so sehr voran wie das Thema Klimaschutz. Auch wenn wir jetzt über die Coronakrise reden: Die Klimakrise und das Artensterben haben deswegen nicht aufgehört. Wenn wir über Krisenfestigkeit reden, dann muss das für all diese Krisen gelten. Wir brauchen Investitionen auf allen Ebenen: in Infrastruktur, vor allem die digitale, erneuerbare Energien, Forschung, Innovation, Schulen und frühkindliche Bildung. Wir dürfen nicht zulassen, dass einige – leider momentan entscheidende – Personen mit ihrem Unvermögen die Zukunftschancen dieses Landes und der zukünftigen Generation verspielen.\n\n({6})\n\nWir haben jetzt die Chance, aus dieser Krise zu lernen und Ökonomie und Ökologie zu verbinden, nicht nur, um eine Erholung der Wirtschaft zu erreichen, sondern auch, um sie zukunftsfähig und krisenfest zu machen. Denn schon jetzt gilt: Was ökologisch sinnvoll ist, ist auch ökonomisch sinnvoll. Wer das nicht einpreist, dem werden mittelfristig auch keine Rettungspakete mehr helfen.\n\n({7})"
"1041305","Uwe","Kekeritz","Grüne","Member of Parliament","2020-05-27T00:00:00.000Z","https://dip21.bundestag.de/dip21/btp/19/19162.pdf","\n\nFrau Präsidentin! Werte Kolleginnen und Kollegen! Uns liegt mal wieder ein Klassiker vor, erstellt von Entwicklungspolitikern, deren Ziel es ist, die Entwicklungspolitik abzuschaffen – ein Klassiker deshalb, weil da postuliert wird: Wir Deutschen sind die Opfer, die Afrikaner sind die Täter. – Das sind die Grundstrukturen von Hassbotschaften, und deswegen ist es ein Klassiker.\n\n({0})\n\n– Das finden wir in ganz vielen Ihrer Anträge.\n\nDie Coronakrise scheint der AfD jetzt ein geeigneter Hebel zu sein, wieder einen Vorstoß zu unternehmen und die Entwicklungspolitik zu diffamieren. Mit solch einer Geisteshaltung muss Demokratie, das heißt müssen wir zurechtkommen. Das ist leider so. Ich könnte mir auch was Schöneres vorstellen. Aber es ist unsere Aufgabe, in Zukunft dafür zu sorgen, dass dieses Problem hier immer weniger wird.\n\n({1})\n\nEs fällt mir schwer, eine ernsthafte Debatte zu diesem Antrag zu führen. So viel Unfug habe ich selten auf zwei Seiten Papier gedruckt gesehen.\n\n({2})\n\nEs zeugt auch davon, dass die AfD weder verstanden hat, welchen Beitrag die Entwicklungspolitik für Entwicklungsländer leistet, noch haben Sie verstanden, wie die deutsche Wirtschaft und die Weltwirtschaft funktionieren, und Sie haben auch nicht verstanden, wie die Wirtschaft des globalen Südens funktioniert.\n\n({3})\n\nWerte Kolleginnen und Kollegen, Sie haben jetzt sehr gute Argumente gegen diesen Antrag vorgebracht. Das ist doch löblich. Aber glauben Sie denn tatsächlich, dass diese Argumente bei dieser Partei nicht bekannt sind? Die kennen die. Aber das ist denen völlig egal; denn es geht ihnen nicht um Argumente.\n\n({4})\n\nEs geht ihnen um Botschaften; um Hassbotschaften geht es ihnen, um Diffamierungen.\n\n({5})\n\nDer Wahrheitsgehalt ihrer Aussagen spielt dabei keine Rolle.\n\nDie erste Botschaft, die Sie senden wollen: Die Coronaprobleme in Deutschland könnten wesentlich gemildert werden, würden wir die Entwicklungszusammenarbeit einstellen. – Genau das Gegenteil ist der Fall. Die wirtschaftliche Situation würde sich sowohl hier als auch in afrikanischen Ländern verschlechtern. Wir hätten absolut nichts davon. Wir sind auf Rohstofflieferungen angewiesen, wir sind auf Absatzmärkte angewiesen, und vor allen Dingen sind wir auf ein Miteinander angewiesen; denn nur miteinander werden wir die Zukunft gestalten.\n\n({6})\n\nDie zweite falsche Botschaft lautet – das haben Sie jetzt nicht erwähnt –: Sie stellen die Jahresetats des BMZ nebeneinander – 10,2 Milliarden, 10,4 Milliarden und 10,6 Milliarden – und erwecken den Eindruck, als wenn das rausgeschmissenes Geld wäre. Das ist eine Diffamierung der Arbeit hier. Sie sagen an keiner Stelle, wo Sie wirklich Kritik üben würden, und Sie sagen vor allen Dingen auch nicht, was besser gemacht werden könnte.\n\nAn der dritten Botschaft erkennt man, dass Herr Frohnmaier die Federführung bei diesem Antrag hatte. Sie versuchen wieder, die Unsinnigkeit von Entwicklungsausgaben auch dadurch zu belegen, dass Sie Programme aufführen, die den Begriff „Gender“ enthalten. Dafür bekommen Sie in Ihrer Fraktion Schenkelklopfer und Lacher, und das erheitert Sie.\n\n({7})\n\nHerr Frohnmaier, meinen Sie nicht auch, dass es langsam an der Zeit wäre, dass Sie Ihre Bildungslücke bezüglich „Gender“ – Funktion, Begriff, geschichtliche Relevanz, gesellschaftliche Relevanz – endlich schließen?\n\n({8})"
"1041307","Uwe","Kekeritz","Grüne","Member of Parliament","2020-05-27T00:00:00.000Z","https://dip21.bundestag.de/dip21/btp/19/19162.pdf","\n\nSie schüren mit Ihren Anträgen immer wieder bewusst die Botschaft, die da lautet: Das sind die Schuldigen.\n\n({0})"
"1041309","Uwe","Kekeritz","Grüne","Member of Parliament","2020-05-27T00:00:00.000Z","https://dip21.bundestag.de/dip21/btp/19/19162.pdf","\n\nNoch drei Sekunden. – Das haben wir auch schon im Ausschuss diskutiert, und da sagten Sie, Herr Frohnmaier: Das ist Demokratie. – Ich kann Ihnen versichern: Das ist Missbrauch von Demokratie und nicht Demokratie.\n\n({0})"
