id,firstname,lastname,faction,position,date, url,speech
"1065661","Zoe","Mayer","Grüne","Member of Parliament","2022-01-14T00:00:00.000Z","https://dip21.bundestag.de/dip21/btp/20/20012.pdf","\n\nFrau Präsidentin! Liebe Kollegen! Das ist eine hitzige Debatte heute – und mal ehrlich: Das ist auch gut so. Nach 16 Jahren landwirtschaftspolitischem Stillstand ist es wirklich mal dringend notwendig, dass wir uns über Veränderungen unterhalten. Und bei Veränderungen gehören hitzige Debatten nun einmal dazu.\n\n({0})\n\nWir reden heute dank unseres Ministers auch mal über das Thema Lebensmittelpreise. Ich danke Cem Özdemir an dieser Stelle wirklich sehr dafür, dieses Thema klar und offen zu benennen.\n\nUm auf die Reden meiner Vorrednerinnen und Vorredner einzugehen: Natürlich ist es ein gigantisches Problem, wenn die Lebensmittelpreise in Deutschland schneller steigen als die Einkommen. Aber da müssen wir doch zwischen Ursache und Wirkung unterscheiden: Steigende Lebensmittelpreise sind nicht schuld daran, dass unsere Tariflöhne in Deutschland kaum erhöht werden. Die Lösung für dieses Problem sind ganz sicher nicht Ramschpreise für Lebensmittel, sondern die Lösung ist eine anständige Sozial- und Arbeitspolitik.\n\n({1})\n\nDie Lösung ist ein höherer Mindestlohn. Die Lösung sind gute Renten.\n\n({2})\n\nDie Lösung ist die Kindergrundsicherung und noch vieles mehr. Genau das wird unsere Regierung auf den Weg bringen; denn nur so schaffen wir es, dass wir Soziales, Ökologisches und Tierschutz zusammendenken und eben nicht mehr gegeneinander ausspielen.\n\n({3})\n\nWas wir ganz sicher nicht machen werden, ist, die Debatte um faire Lebensmittelpreise weiter zu verschleppen. Das sind wir nämlich insbesondere den Landwirtinnen und Landwirten in Deutschland dringend schuldig, die sich kaum über Wasser halten können in dem aktuellen System. Das Geld, das für landwirtschaftliche Erzeugnisse aktuell erworben wird, reicht kaum, um die Kosten zu decken. Das reicht nicht für eine gute Existenzsicherung. Und das reicht schon dreimal nicht, um die Bedingungen für die Millionen von Tieren, die in unserem wirklich prekären System der deutschen Massentierhaltung leben und sterben müssen, zu verbessern. Damit muss Schluss sein!\n\n({4})\n\nKlar, wir brauchen Geld für das, was wir planen. Die Finanzierung für die höheren Standards beim Fleisch soll getragen werden durch alle, die Fleisch konsumieren möchten. Wir unterstützen die Verbraucherinnen und Verbraucher bei der Transparenz durch die verbindliche Einführung der Tierhaltungskennzeichnung. Das ist ein längst überfälliger Schritt.\n\n({5})\n\nZur Ehrlichkeit gehört auch dazu: Wenn wir unsere Klimaziele ernst nehmen und wenn wir den Tierschutz in Deutschland ernst nehmen, dann müssen wir auch wegkommen von diesen enormen Zahlen in der Tierhaltung. Für all die, die die Tötung von Tieren für ihren Konsum nicht mehr unterstützen möchten oder die ihren Konsum reduzieren möchten, müssen wir auch gute Angebote schaffen. Das heißt: pflanzliche Ernährung unterstützen, vegetarische und vegane Angebote unterstützen, und zwar flächendeckend. Nur so schaffen wir echte Wahlfreiheit für alle Bürgerinnen und Bürger, die tierleidfreie, nachhaltige und klimaschonende Ernährung wollen.\n\nIch freue mich sehr auf all das, was unsere Regierung hier in den nächsten Jahren auf den Weg bringt. Das ist Veränderung!\n\nVielen Dank.\n\n({6})"
"1065687","Agnes","Malczak","Grüne","Member of Parliament","2022-01-14T00:00:00.000Z","https://dip21.bundestag.de/dip21/btp/20/20012.pdf","\n\nSehr geehrte Frau Präsidentin! Sehr geehrte Frau Ministerin! Liebe Kolleginnen und Kollegen! Sicherheit, Frieden und internationale Zusammenarbeit sind leider keine Selbstverständlichkeiten. Sie müssen gelebt, erarbeitet und in Krisenzeiten auch immer wieder beschützt werden. Wenn Autokraten mit Menschenrechtsverletzungen und militärischer Aggression und in Erpressungsmanövern ihre geopolitischen Machtinteressen durchdrücken wollen, wie wir es gerade durch die Kremlführung in der Ukraine sehen, dann ist das weder in unserem Interesse, noch dürfen wir uns das bieten lassen.\n\n({0})\n\nEs bedeutet, unsere Gesellschaften vor gezielter Spaltung zu schützen, unsere bisherigen Bündnisse zu stärken und neue Allianzen zu schmieden.\n\nVerantwortungsvolle Sicherheitspolitik in einer hochvernetzten Welt bedeutet aber auch vor allem ein kluges Zusammenspiel von Diplomatie, Entwicklung und Verteidigung. Wer zum Beispiel Waffenlieferungen an Autokraten oder Aggressoren genehmigt, stellt Geschäftemacherei über die glaubwürdige Botschaft für die Einhaltung internationalen Rechts und trägt am Ende zu Instabilität und im schlimmsten Fall zu Menschenrechtsverletzungen und Kriegsverbrechen bei. Deshalb ist eine strengere und verantwortungsvolle Rüstungsexportpolitik mit einem Gesetz, wie wir sie im Koalitionsvertrag vereinbart haben, ein aktiver und starker Beitrag zu mehr Sicherheit.\n\n({1})\n\nUnd gerade weil die Zeitfenster für nukleare Abrüstung so selten und so wertvoll sind, wäre es fatal, sie verstreichen zu lassen. Deshalb braucht es gerade in schwierigen Zeiten und immer in enger Abstimmung und in Solidarität mit unseren Partnern eine Offensive für Rüstungskontrolle und auch den Beobachterstatus beim Atomwaffenverbotsvertrag und weitere Abrüstungsinitiativen, wie wir sie miteinander vereinbart haben.\n\n({2})\n\nLiebe Kolleginnen und Kollegen, gerade weil Kohärenz in der Sicherheitspolitik so wichtig ist, Herr Kollege Hahn, war ich doch schon sehr verwundert über Ihre Rede. Ich weiß nicht, was Sie mit dem Wort „Marschrichtung“ meinen. Wenn ich an die letzten Jahre hier zurückdenke, erinnere ich mich vor allem an mehrere Ministerinnen und Minister aus Ihrer Partei, die einfach mal international vorgeprescht sind, ohne sich mit den anderen Ressorts, ohne sich mit dem Koalitionspartner abzustimmen. Frau Ministerin, ich möchte mich bei Ihnen herzlich bedanken. In diesen wenigen, aber sicherheitspolitisch doch sehr unruhigen Wochen haben wir eine andere Kultur der Zusammenarbeit erlebt. Ich glaube, das ist die Grundvoraussetzung dafür, dass Sicherheitspolitik erfolgreich sein kann.\n\n({3})\n\nUnd dafür braucht es auch nicht dieses altväterliche Mansplaining, das wir hier gerade von der Union gesehen haben.\n\n({4})\n\nUnd: Ja, mit der Ampel wird einiges mehr anders – und ich würde auch sagen: besser – in der deutschen Sicherheitspolitik. Es ist doch ein Novum, dass ein Untersuchungsausschuss nicht von der Opposition eingefordert wird, sondern dass sich die Parteien im Rahmen der Sondierungsgespräche auf die Einrichtung eines solchen zur Aufklärung der Ereignisse rund um den Abzug aus Afghanistan verständigt haben. Das ist eine andere politische Kultur, die sich Verantwortung und Realität stellt, nicht um abzurechnen, sondern um aus den Fehlern der Vergangenheit zu lernen und sie in der Zukunft nicht zu wiederholen.\n\n({5})\n\nLiebe Kolleginnen und Kollegen, nach 16 Jahren Union im Verteidigungsministerium blicken wir auch zurück auf 16 Jahre mit vielen Skandalen, viel PR-Spektakel, einer unrealistischen Trendwende nach der nächsten. Viele Probleme sind einfach verschleppt und vertagt worden. Sie haben sich verschärft. Damit muss nun endlich Schluss sein. So skizzieren wir zum Beispiel in unserem Koalitionsvertrag mit nur ganz wenigen Worten eine sehr grundlegende Umkehr bei den Beschaffungsentscheidungen: weg von einer Politik, die sich vor allem an den Wahlkreiswünschen von Unionsabgeordneten und an den Interessen der Rüstungsindustrie orientiert,\n\n({6})\n\nsondern den Bedarf der Bundeswehr und den verantwortungsvollen Umgang mit Steuergeld in den Mittelpunkt stellt. Das ist so was von überfällig, meine Damen und Herren.\n\nWir wollen aber auch die persönliche und materielle Ausstattung, die Vereinbarkeit von Familie und Dienst, die Führungskultur, die Fürsorge und all das, was auch hier liegen geblieben ist, zusammen angehen – im Sinne der so vielen engagierten Menschen bei der Bundeswehr, die ihren Dienst mit einer so hohen Einsatzbereitschaft und beeindruckenden Überzeugungen unter schwierigen Bedingungen leisten.\n\n({7})\n\nDas ist eigentlich eine Selbstverständlichkeit. Und es ist auch nicht nur Ausdruck von Dankbarkeit und Wertschätzung, sondern es ist auch ganz entscheidend für die Frage, wer sich mit welcher Motivation für diese schwierige Aufgabe entscheidet. Denn zu Recht stellt unsere Gesellschaft sehr hohe Anforderungen an all diejenigen, die im Auftrag unseres Staates das Gewaltmonopol ausüben und die Zugang zu militärischer Ausbildung und zu Waffen haben.\n\nEs gibt in der Bundeswehr nicht nur eine sehr hohe Impfquote, sondern die Soldatinnen und Soldaten leisten auch schon lange Beeindruckendes bei der Bewältigung der Pandemie. Aber die Fälle von radikalen Verschwörungsideologen beschädigen gerade die tolle Arbeit so vieler Menschen aus der Bundeswehr und auch das Vertrauen in unsere Sicherheitsbehörden. Und das sind keine kleinen Einzelfälle, wie auch die Enthüllungen der letzten Jahre rund um rechtsextremistische Fälle deutlich zeigen. Alle Verächter unseres Staates in unseren Sicherheitsbehörden sind ein eklatantes Sicherheitsrisiko. Frau Ministerin, ich bin Ihnen dankbar, dass Sie das in dieser Klarheit heute hier angesprochen haben.\n\n({8})\n\nWir müssen mit großer Wachsamkeit noch genauer hinschauen, lückenlos aufklären und gerade die Verbindung zwischen Rechtsextremismus und Antisemitismus, zwischen Reichsbürgern und Verschwörungsideologen im Blick haben und bei den erkannten Fällen noch viel entschlossener, schneller und härter handeln. Auch dazu haben wir uns im Koalitionsvertrag verpflichtet; denn wer unseren Staat ablehnt, kann und darf nicht in seinen Diensten stehen.\n\n({9})\n\nMeine Damen und Herren, gemeinsam haben wir uns viel vorgenommen, und wir wollen aus der Mitte Europas heraus und gemeinsam mit unseren vielen Partnern, mit Kooperation, mit Klarheit und Konsequenz für Frieden, Sicherheit und Menschenrechte eintreten und dabei deutlich machen: –"
"1065689","Agnes","Malczak","Grüne","Member of Parliament","2022-01-14T00:00:00.000Z","https://dip21.bundestag.de/dip21/btp/20/20012.pdf","\n\n– Eine Politik der Werte ist auch eine Politik der Stärke.\n\nVielen Dank.\n\n({0})"
"1065705","Sara","Nanni","Grüne","Member of Parliament","2022-01-14T00:00:00.000Z","https://dip21.bundestag.de/dip21/btp/20/20012.pdf","\n\nSehr geehrte Präsidentin! Liebe Kolleginnen und Kollegen! Liebe Frau Ministerin! Ja, die Bundesregierung hat sich auch sicherheitspolitisch viel vorgenommen. Wissen Sie, worauf ich mich besonders freue? Wir werden Auslandseinsätze in Zukunft regelmäßig und ressortübergreifend evaluieren.\n\n({0})\n\nSeien wir mal ganz ehrlich: Das müsste eigentlich selbstverständlich sein. Wenn wir als Deutscher Bundestag die Soldatinnen und Soldaten in den Einsatz schicken, dann müssen wir nicht nur vorher genau wissen, was der Auftrag ist, was die Ziele sind und wie die Aussichten auf Erfolg aussehen, sondern wir sollten auch immer – auch mit externer Expertise – fragen, ob der Auftrag denn erfüllt wird, welche Ziele nicht oder noch nicht erreicht wurden und vor allem, warum, auch wenn es wehtut.\n\n({1})\n\nDas werden wir jetzt auch genauso machen. Liebe Kolleginnen und Kollegen, das sind wir den Soldatinnen und Soldaten schuldig.\n\nWir sind es aber auch den Menschen in den Einsatzgebieten schuldig, die Hoffnung in unseren Einsatz, in unser Engagement legen oder gelegt haben – wie unsere Partner/-innen in Afghanistan, die über 20 Jahre an unserer Seite eingestanden sind für Demokratie, Rechtsstaatlichkeit und Menschenrechte. Die internationalen Truppen sind abgezogen. Die Taliban haben die Macht übernommen, aber diese Menschen streiten weiter vor Ort und im Exil für Rechtsstaatlichkeit, Demokratie und Menschenrechte.\n\n({2})\n\nAuch die Bundesregierung und das Parlament bleiben dran. Unsere Außenministerin hat den Aktionsplan für Afghanistan ins Leben gerufen, eine ihrer ersten Amtshandlungen. Und die Innenministerin hat mit der Aussicht auf bessere Bleibemöglichkeiten und Teilhabe ein klares Zeichen gesetzt: Wir vergessen euch nicht.\n\n({3})\n\nWir werden auch hier im Parlament mit einem Untersuchungsausschuss die Evakuierungsmission des Sommers untersuchen.\n\n({4})\n\nEs wird eine Enquete-Kommission zum Afghanistan-Einsatz geben, wo alle zu Wort kommen müssen,\n\n({5})\n\ndie Bundeswehr, die Berater/-innen aus den zivilen Missionen, die Entwicklungspartner/-innen vor Ort, die Zivilgesellschaft in Afghanistan und in Deutschland. Auch hier ist die Botschaft: Wir vergessen euch nicht.\n\n({6})\n\nUnd ja, Herr Kollege, das reicht nicht. Der Bundestag kann selbst nicht alle Aufarbeitungsarbeit machen. Eine kleine Anregung an alle, die zivilgesellschaftlich auch mit dem Thema befasst sind: Wir sind als Parlament ansprechbar, wenn Sie da auch in die Aufarbeitung gehen wollen. Ich glaube, das ist ein gesamtgesellschaftlicher Auftrag.\n\n({7})\n\nLiebe Kolleginnen und Kollegen, die Bundeswehr war im letzten und im vorletzten Jahr sehr sichtbar, so sichtbar wie lange nicht, ja, auch wegen der Bilder aus Kabul, aber auch wegen der Bilder vom Hochwasser und aus den Impfzentren. Allen Soldatinnen und Soldaten, die sich deshalb die eine oder andere Extra- oder Nachtschicht um die Ohren gehauen haben, herzlichen Dank!\n\n({8})\n\nSie haben wichtige Arbeit geleistet und leisten sie weiter.\n\nAber für uns als Parlament muss auch klar sein: Wenn schon heute die Zahl der Naturkatastrophen zunimmt, muss in erster Linie der zivile Katastrophenschutz gestärkt werden. Denn Kernaufgabe der Bundeswehr bleibt die äußere Sicherheit.\n\n({9})\n\nKernaufgabe der Bundeswehr ist also die äußere Sicherheit. Dazu gehört, dass Aufgaben und Fähigkeiten zusammenpassen – das ist eine Binse –, wobei ich dazusagen möchte, dass man sowohl bei den Aufgaben als auch bei den Fähigkeiten ansetzen kann, um sie besser zueinanderzubringen.\n\nEine kleine Anmerkung sei mir erlaubt, Frau Ministerin: Über die Frage, ob und, wenn ja, in welchem Umfang und für welche Linien mehr Geld ausgegeben wird, entscheiden wir in guter Zusammenarbeit mit Ihrem Haus, aber trotzdem letztendlich mit der Mehrheit hier im Parlament.\n\n({10})\n\nEins will ich auch klar sagen: Die Bundeswehr selbst kann nur einen Beitrag zur äußeren Sicherheit leisten. Es ist eine Binse, dass sich Konflikte mit militärischen Mitteln nicht lösen lassen.\n\n({11})\n\nDeswegen ist für uns als Ampelkoalition die europäische Abstimmung so wichtig; Sie haben es selbst erwähnt. Deswegen arbeiten wir auch daran, die Kohärenz zwischen den Häusern zu verbessern, und wir werden auch in Rüstungskontrolle und zivile Krisenprävention mehr investieren.\n\n({12})\n\nWas ich in den letzten Wochen durch den Kontakt, den ich zur Truppe gesucht habe, erlebt habe, ist, dass die Angehörigen der Bundeswehr oft am besten wissen: Ohne eine zivile und politische Gesamtstrategie nutzt auch ein guter Fähigkeitslückenschließungsplan herzlich wenig. Ohne eine kohärente Strategie ist alles nichts.\n\nLiebe Kolleginnen und Kollegen, ich lade Sie alle herzlich ein: Bringen Sie sich konstruktiv in die Debatte um eine kohärente Außen- und Sicherheitspolitik ein! Es gibt dabei viel zu gewinnen.\n\nDanke schön.\n\n({13})"
"1065717","Deborah","Düring","Grüne","Member of Parliament","2022-01-14T00:00:00.000Z","https://dip21.bundestag.de/dip21/btp/20/20012.pdf","\n\nSehr geehrte Präsidentin! Sehr geehrte Ministerin Schulze! Liebe Kolleginnen und Kollegen! Seit Beginn der Pandemie stehen wir hier und diskutieren über Impfstoffgerechtigkeit, und, ehrlich gesagt, sind wir immer noch meilenweit davon entfernt. Eine gerechte Verteilung von Impfstoffen, der Zugang zu Medikamenten und Technologietransfer sind nicht nur eine Frage der Solidarität und der globalen Verantwortung, sondern sie sind schlichtweg einer der entscheidenden Faktoren in der Pandemiebekämpfung.\n\n({0})\n\nGlobale Krisen können wir nur global bekämpfen, ganz egal, ob es die Coronapandemie oder die Klima- und Biodiversitätskrise ist. Wir dürfen uns nicht im nationalstaatlichen Klein-Klein verlieren. Wie die Bundesministerin gerade schon erwähnte: Entwicklungspolitik ist vor allem Strukturpolitik. Und genau deswegen müssen wir die globalen Herausforderungen auch in der Bundesregierung gemeinsam über die Ressorts hinweg angehen.\n\nDas bedeutet, dass wir uns für faire Arbeitsbedingungen und existenzsichernde Löhne weltweit einsetzen.\n\n({1})\n\nDas bedeutet, dass wir aufhören, hochgiftige Pestizide in den Globalen Süden zu exportieren, die hier bereits verboten sind.\n\n({2})\n\nUnd das bedeutet vor allen Dingen, dass wir uns konsequent für Menschenrechte und die Rechte von Minderheiten wie indigenen Gemeinschaften einsetzen und internationale Abkommen wie die ILO-Konvention 169 umsetzen und einhalten.\n\n({3})\n\nEine der größten Herausforderungen im Globalen Süden ist, dass die Zahl der an Hunger leidenden Menschen wieder zunimmt. Die Ursachen dafür liegen vor allen Dingen in der ungleichen Ressourcenverteilung, in bewaffneten Konflikten, den Auswirkungen der Coronapandemie und der Klimakrise. Sie haben es gerade schon erwähnt: Es ist richtig, dass das BMZ in den letzten Jahren genau diese Themen zum Schwerpunkt gemacht hat. Aber es wurde verpasst, an die Strukturen heranzugehen, die zu Hunger und Mangelernährung führen.\n\n({4})\n\nWir müssen uns dafür einsetzen, dass Landrechte gestärkt werden, dass Kleinbäuerinnen und Kleinbauern endlich faire Preise für ihre Produkte bekommen\n\n({5})\n\nund dass Saatgut frei getauscht werden kann. Wir müssen Agrarökologie mit all ihren sozialen, ökologischen und ökonomischen Dimensionen in den Mittelpunkt dieses Themenschwerpunktes stellen.\n\nLiebe Kolleginnen und Kollegen, für globale Gerechtigkeit zu kämpfen, bedeutet vor allem, dass wir Verantwortung übernehmen – Verantwortung für die koloniale Geschichte Deutschlands, Verantwortung dafür, dass koloniale Strukturen bis heute wirken,\n\n({6})\n\nVerantwortung dafür, diese kolonialen Kontinuitäten endlich aufzubrechen!\n\n({7})\n\nAnhaltende Auswirkungen des Kolonialismus sind vor allem die globalen Abhängigkeiten und Ungleichheitsstrukturen. Diese Ungleichheitsstrukturen finden wir zum Beispiel im internationalen Wirtschaftssystem. 132 Länder des Globalen Südens sind hoch verschuldet. Wir haben weltweit eine dramatische Schuldenspirale vor uns. Da reicht auch kein mittelfristiges Schuldenmoratorium mehr. Und genau deswegen bin ich sehr dankbar dafür, dass wir endlich ein Staateninsolvenzverfahren voranbringen. Das ist ein Quantensprung in der Debatte um Entschuldung und dringend notwendig!\n\n({8})\n\nWir haben uns nicht nur einen dekolonialen Handlungsrahmen, sondern auch eine feministische Außen- und Entwicklungspolitik zum Ziel gesetzt.\n\n({9})\n\nGeschlechtergerechtigkeit muss integraler Bestandteil unserer Entwicklungspolitik sein. Ich freue mich, mit Ihnen, Ministerin Schulze, die politische, wirtschaftliche und soziale Teilhabe von Frauen und LGBTIQ-Personen gemeinsam voranzutreiben und für einen intersektionalen feministischen Aufbruch gemeinsam zu kämpfen!\n\n({10})\n\nEnden möchte ich bei dem Stichwort „Generationengerechtigkeit“. Ich durfte ein Jahr in der indigenen Gemeinschaft der Brörán in Costa Rica leben und lernen.\n\n({11})\n\nEin Ansatz, der mir besonders in Erinnerung geblieben ist, ist, dass der Ältestenrat immer, wenn er eine Entscheidung trifft, darüber nachdenkt, welche Konsequenzen diese Entscheidung für die sieben Generationen nach ihnen hat. Ich wünsche uns allen, dass wir uns und die zukünftigen Generationen nicht nur im Hinterkopf, sondern immer präsent vor uns haben, wenn wir gemeinsam für eine bessere Zukunft kämpfen.\n\nVielen Dank.\n\n({12})"
"1065735","Jan Niclas","Gesenhues","Grüne","Member of Parliament","2022-01-14T00:00:00.000Z","https://dip21.bundestag.de/dip21/btp/20/20012.pdf","\n\nFrau Präsidentin! Liebe Kolleginnen und Kollegen! Die deutsche Entwicklungspolitik schlägt einen neuen, zukunftsfähigeren Weg ein. Das hat die Rede der Ministerin sehr deutlich gemacht – an der Stelle noch mal herzlichen Glückwunsch zum Amt –; das haben auch die Reden der Kolleginnen und Kollegen der Koalitionsfraktionen hier schon sehr deutlich gemacht.\n\nIch kann nur sagen: Gehen wir konsequent diesen Weg! Es ist nun an der Zeit, die zahlreichen globalen Herausforderungen endlich wirksam anzupacken. Um das zu tun, hat die neue Regierung zugesagt, ihre Politik insgesamt viel stärker an den globalen Entwicklungszielen und auch am Pariser Klimaabkommen auszurichten. Das ist ein wichtiger Fortschritt. Denn es darf nicht damit weitergehen, dass die zarten Erfolge der Entwicklungszusammenarbeit immer wieder kaputt gemacht werden durch eine völlig gegenläufige Wirtschafts-, Landwirtschafts- und Handelspolitik.\n\n({0})\n\nMeine Damen und Herren, zu einer global gerechten Politik gehört erst recht in diesem Jahrzehnt, den Kampf gegen die ökologische Krise ins Zentrum der Entwicklungspolitik zu rücken. Damit meine ich neben dem Klimaschutz besonders den Einsatz gegen den Verlust von Arten- und Ökosystemen weltweit und den Einsatz gegen die Biodiversitätskrise als die zweite große ökologische Krise.\n\nEs geht hier um nichts weniger als um das sensible weltumspannende Netz der Arten- und Ökosysteme, das uns erhält. Es geht um die globale Versorgung mit Lebensmitteln, Baustoffen, Arznei, sauberem Wasser und vielem mehr für Millionen von Menschen.\n\n({1})\n\nDeswegen, meine Damen und Herren, ist es gut und wichtig, dass die Bundesregierung den Schutz von Klima und Biodiversität zu wichtigen Schwerpunkten der Entwicklungszusammenarbeit und auch der Regierungspolitik insgesamt macht.\n\n({2})\n\nMeine Damen und Herren, um diese Politik für Umwelt und Gerechtigkeit international umzusetzen, braucht es wirksame und vor allem auch bedarfsorientierte globale Partnerschaften. Ich habe in den letzten Jahren beruflich Partnerschaftsprojekte mit aufgebaut, unter anderem in Südafrika, Mosambik und Jordanien. Diese Arbeit hat mir immer wieder gezeigt: Gegenseitiger Austausch, gemeinsame Projekte – das ist der Kitt internationaler Zusammenarbeit.\n\nAber dieser Kitt hat in Coronazeiten massiv gelitten. Wir müssen deswegen zusehen, dass wir globale Partnerschaften wieder ertüchtigen, aber sie effektiver und kohärenter aufstellen. Denn es sind genau diese Partnerschaften, die der Schlüssel sind für Armutsbekämpfung, Sicherheit und Klimaschutz.\n\nVielen Dank.\n\n({3})"
"1065749","Kathrin","Henneberger","Grüne","Member of Parliament","2022-01-14T00:00:00.000Z","https://dip21.bundestag.de/dip21/btp/20/20012.pdf","\n\nSehr geehrte Präsidentin! Sehr geehrte Ministerin! Liebe Kolleginnen und Kollegen! Die Klimakrise macht gnadenlos in vielen Regionen der Erde bereits Fortschritt gegen Hunger zunichte, schürt gewalttätige Konflikte, raubt Menschen ihre Existenzgrundlage, zwingt sie zur Flucht. Wenn das Ziel, wenn unser Ziel ist, eine klimagerechte Welt aufzubauen, dann können wir das nur mit dem Wissen und der Perspektive der Menschen, die besonders jetzt schon die grausame Realität der Klimakrise spüren und unter der kolonialen Ausbeutung der letzten Jahrhunderte leiden. Aktuell fehlen diese Stimmen aber immer da, wo über unser aller Zukunft entschieden wird. Das merken wir besonders auf den UN-Klimakonferenzen, wenn beispielsweise die Forderung nach ausreichender Finanzierung für Loss and Damage nicht unterstützt wird, nicht angehört wird. Das darf nicht mehr passieren.\n\n({0})\n\nUnterstützen müssen wir auch Institutionen wie die Indigene Plattform oder den Gender Action Plan, damit auch in der Klimapolitik auf allen Ebenen Geschlechtergerechtigkeit gelebt wird. Eine lebendige und eine vielfältige Zivilgesellschaft, Menschenrechtsaktivistinnen und ‑aktivisten, Gesellschaften, die bereits Suffizienz leben – sie sind die Akteurinnen und Akteure des Wandels für eine globale Klimagerechtigkeit, und sie sind unsere Verbündeten in den nächsten vier Jahren.\n\n({1})\n\nGlobale Gerechtigkeit beginnt dort, wo Ausbeutung von Mensch und Natur endet. Ganz konkret: Wirtschaftliche Zusammenarbeit sollte nicht bedeuten, dass wir Steinkohle importieren aus Regionen, wo die Tagebaue dazu führen, dass Dörfer zwangsumgesiedelt werden, dass Menschenrechte verletzt werden, dass Umweltaktivistinnen und ‑aktivisten tödliche Repressionen drohen, so wie in Sibirien und Kolumbien. Diese Steinkohle hat in Deutschland nichts verloren.\n\n({2})\n\nDie Verantwortung für Lieferketten, die koloniale Ausbeutung nicht weiterführen, die Klimagerechtigkeit respektieren, die liegt bei uns. Wirtschaftliche Zusammenarbeit darf auch nicht bedeuten, dass deutsche Firmen Technologien liefern, damit beispielsweise in der Nähe der Sundarbans in Bangladesch Kohlekraftwerke gebaut werden, gegen den Willen der dortigen Bevölkerung.\n\n({3})\n\nEine Politik der Zusammenarbeit, die sich primär danach richtet, den Bedürfnissen des industriellen Nordens gegenüber gehorsam zu sein, das ist eine rassistische Politik. Der Gegensatz ist eine klimagerechte, die eine lebenswerte Zukunft aller Menschen im Fokus hat – und danach wird sich unsere Politik in den nächsten vier Jahren richten.\n\nVielen Dank.\n\n({4})"
